Title,Content,Date,Url,Summary
"Thi đánh giá năng lực ĐH Quốc gia TP.HCM: Đề vừa sức, ngày 15-4 có kết quả","Đợt 1 kỳ thi đánh giá năng lực Đại học Quốc gia TP.HCM năm nay có 93.831 thí sinh tham gia tại 24 địa phương trải dài từ miền Trung đến Tây Nam Bộ với 51 cụm thi và 90 điểm thi. Không được dự thi vì mất giấy tờ tùy thân TS Nguyễn Quốc Chính - giám đốc Trung tâm khảo thí và đánh giá chất lượng đào tạo Đại học Quốc gia TP.HCM - cho biết đợt 1 của kỳ thi diễn ra ổn định, không có gì bất thường, an toàn và đúng quy chế. Theo báo cáo nhanh của tất cả các điểm thi, trong buổi thi sáng qua không có thí sinh vi phạm quy chế. Lý giải về con số hơn 1.700 thí sinh vắng thi đợt 1, theo đại diện các điểm thi, có nhiều lý do, trong đó có cả những em quên mang giấy tờ tùy thân. Năm nay Đại học Quốc gia TP.HCM thực hiện nghiêm ngặt quy chế thi nên những thí sinh không mang theo giấy tờ tùy thân như quy định đều không được thi. TS Võ Văn Tuấn - trưởng điểm thi Trường đại học Văn Lang - cho biết tại điểm thi này nhiều thí sinh quên mang theo giấy báo dự thi và báo bị mất căn cước công dân. Các thí sinh đã được điểm thi hỗ trợ làm các thủ tục để vào thi theo đúng quy chế. Nhưng tại điểm thi này, khoảng 10 thí sinh không được dự thi do không có giấy tờ tùy thân. ""Một số thí sinh dù có đơn báo mất căn cước công dân do công an xác nhận nhưng không có giấy tờ tùy thân khác theo quy định nên không được vào thi. Theo quy chế, thí sinh không mang theo các giấy tờ tùy thân theo quy định đều không được tham gia kỳ thi. Bên cạnh đó, không ít thí sinh sai sót thông tin số căn cước trên giấy báo dự thi đến điểm thi làm thủ tục điều chỉnh. Những trường hợp này thí sinh phải làm cam kết để được thi nhưng tạo tâm lý không tốt trước khi thi. Do vậy các em cần cẩn trọng hơn trong đăng ký dự thi để tránh sai sót và đặc biệt cần phải giữ gìn giấy tờ tùy thân cẩn thận"" - ông Tuấn lưu ý. Đề thi vừa sức Tại điểm thi Trường đại học Bách khoa (Đại học Quốc gia TP.HCM), thí sinh Nguyễn Phương Nhật Vy (học sinh Trường THPT Nguyễn Hữu Huân, TP Thủ Đức, TP.HCM) nhận định đề thi đánh giá năng lực đợt 1 năm nay tương đối vừa sức, dễ hơn so với nội dung bạn đã ôn. ""Mục tiêu của mình khi tham gia kỳ thi này cố gắng đạt từ 700 điểm trở lên, hy vọng sẽ đạt được. Dù kết quả có ra sao mình cũng sẽ giữ tinh thần lạc quan vì còn có cơ hội thi đợt 2"" - Vy chia sẻ. Trong khi đó, Lê Nguyễn Minh Khôi (học sinh Trường THPT Nguyễn An Ninh, Q.10, TP.HCM), có thế mạnh các môn xã hội, cho biết trong bài thi đánh giá năng lực đợt 1, phần kiến thức tự nhiên khá khó, nhất là phần vận dụng cao. Khôi khá ấn tượng với nhiều câu hỏi của đề thi. Bạn hy vọng sẽ đạt trên 800 điểm để xét vào ngành quản trị kinh doanh. Tại điểm thi Trường đại học Công nghiệp TP.HCM, nhiều thí sinh tỏ ra thoải mái và thích thú với kỳ thi đánh giá năng lực năm nay. Rời khỏi phòng thi, thí sinh Nguyễn Gia Bảo (Trường THPT Nguyễn Khuyến) chia sẻ: ""Đề không quá khó cũng vừa kịp, em đánh giá khoảng được 85%. Có một vài câu hỏi phần tư duy logic thì hơi mất thời gian để làm. Bên cạnh đó nhiều câu hỏi khó nhằn, nhất là các môn tự nhiên đòi hỏi sự nhanh nhạy và tư duy mới làm được"".",08/04/2024 08:12 GMT+7,https://tuoitre.vn/thi-danh-gia-nang-luc-dh-quoc-gia-tp-hcm-de-vua-suc-ngay-15-4-co-ket-qua-20240408080525656.htm,"Kỳ thi đánh giá năng lực đợt 1 năm 2024 do Đại học Quốc gia TP.HCM tổ chức vào sáng 7-4 có tỉ lệ thí sinh dự thi cao nhất từ trước đến nay lên đến 98,2%."
25 học sinh bị triệu chứng ngộ độc thực phẩm ở Nha Trang còn nằm viện,"Chiều 7-4, Phó giám đốc Sở Y tế tỉnh Khánh Hòa Lê Văn Khoa cho biết hiện vẫn còn 25 học sinh Trường tiểu học Vĩnh Trường và Trường THCS Trần Hưng Đạo (phường Vĩnh Trường, TP Nha Trang) nằm điều trị ở các bệnh viện tại TP Nha Trang.  Theo ông Khoa, tất cả các em đều có tình trạng sức khỏe ổn định. 25 học sinh kể trên nằm trong số 37 học sinh Trường tiểu học Vĩnh Trường và Trường THCS Trần Hưng Đạo bị các triệu chứng ngộ độc thực phẩm xảy ra sáng 5-4 được nhà trường, gia đình đưa đến các bệnh viện để cấp cứu, khám, điều trị. Trong số 30 học sinh nhập viện có 1 nữ sinh lớp 5/4 Trường tiểu học Vĩnh Trường tử vong. Theo thông báo của UBND tỉnh Khánh Hòa, để đảm bảo an toàn vệ sinh thực phẩm, Phó chủ tịch UBND tỉnh Đinh Văn Thiệu vừa có kết luận, chỉ đạo về việc thành lập các đoàn kiểm tra liên ngành cấp tỉnh, cấp huyện, cấp xã để kiểm tra công tác bảo đảm an toàn vệ sinh thực phẩm 100% cơ sở sản xuất, kinh doanh, chế biến, mua bán thực phẩm trên địa bàn toàn tỉnh. Bắt đầu từ ngày mai 8-4, các đoàn kiểm tra liên ngành của tỉnh sẽ tiến hành kiểm tra. Sau đó, các đoàn kiểm tra của huyện, xã cũng đồng loạt kiểm tra kể từ ngày 9-4. Nội dung thanh tra, kiểm tra ""tập trung vào chất lượng, an toàn sản phẩm, hạn sử dụng, nguồn gốc nguyên liệu, sản phẩm thực phẩm, việc công bố tiêu chuẩn sản phẩm, ghi nhãn sản phẩm, nguyên liệu, phụ gia sử dụng để sản xuất, chế biến thực phẩm, điều kiện sản xuất thực phẩm và quảng cáo thực phẩm"" cùng các hoạt động thực tế tại các cơ sở được kiểm tra.",07/04/2024 19:32 GMT+7,https://tuoitre.vn/25-hoc-sinh-bi-trieu-chung-ngo-doc-thuc-pham-o-nha-trang-con-nam-vien-20240407191351238.htm,"Những học sinh còn nằm viện kể trên của Trường tiểu học Vĩnh Trường và Trường THCS Trần Hưng Đạo, TP Nha Trang đều đã nhập viện cùng ngày với nữ sinh lớp 5 tử vong vào sáng 5-4."
Hàng trăm học sinh thích thú đi thuyền chụp ảnh sông Sài Gò,"Chiều chủ nhật 7-4, vòng chung kết Hội thi sáng tác ảnh Tuổi Xanh diễn ra với hình thức tranh tài độc đáo: 100 thí sinh khối THCS và 100 thí sinh khối THPT được chia thành các tốp di chuyển trên du thuyền và chụp ảnh dọc sông Sài Gòn. Du thuyền chạy theo thủy trình Bến Bạch Đằng - Cột cờ Thủ Ngữ - Bến Nhà Rồng - Cảng hành khách tàu biển - Cảng Tân Thuận - Cảng Bến Nghé, giúp học sinh khám phá TP.HCM từ góc nhìn đầy mới mẻ trên dòng sông Sài Gòn. Nhiều thí sinh cho biết đây là lần đầu tiên được đi du thuyền trên sông Sài Gòn.  ""Đi trên sông Sài Gòn chụp ảnh, mình có nhiều góc chụp tuyệt đẹp về thành phố mà lâu nay chưa có dịp trải nghiệm. Các tòa nhà cao tầng đặc trưng của TP.HCM, các di tích lịch sử như cột cờ Thủ Ngữ, bến Nhà Rồng khi nhìn từ trên sông lại rất mới mẻ.  Đi xa thêm một chút là cảng Tân Thuận nhộn nhịp, bên kia là những mảng xanh mướt mắt"", Ngô Gia Bảo, học sinh Trường THCS - THPT Trí Đức (Tân Phú), háo hức. Đức Trí, học sinh Trường THCS - THPT Đinh Thiện Lý (Q.7), nói: ""Lần đầu được nhìn ngắm và chụp hình thành phố từ trên tàu, mình thấy rất thú vị, đặc biệt khi nhìn dòng người qua lại. Trước nay mình chỉ đi trên phố nhìn xuống sông Sài Gòn, bây giờ từ sông Sài Gòn nhìn ngược lại, thấy thành phố mình thật đẹp"". Dù vậy, theo Đức Trí, thử thách với các bạn khi sáng tác ảnh trên tàu là không nhỏ. Khó nhất là giới hạn không gian tác nghiệp hơn trên bờ, không thể di chuyển tự nhiên.  Vì thế theo Đức Trí, người chụp cần có sự chủ động để tính toán trước những khung cảnh mà tàu sẽ chạy đến, và nhanh chóng di chuyển đến bấm máy. Trong khi đó Đức Việt, học sinh Trường THCS Bình An (Q.8), ""bị"" thử thách mỗi khi tàu lắc lư do sóng, làm ảnh dễ bị nhòe. Do đó suốt quá trình tác nghiệp, Việt phải cầm chắc máy, tìm chỗ đứng phù hợp và luôn có điểm tựa khi tác nghiệp. ""Mình đã chụp được đến 300 tấm ảnh, theo quy định của ban tổ chức, mình sẽ chọn 10 tấm để ban giám khảo chấm điểm"", Đức Việt nói.",07/04/2024 19:10 GMT+7,https://tuoitre.vn/hang-tram-hoc-sinh-thich-thu-di-thuyen-chup-anh-song-sai-gon-20240407171003129.htm,"Với hầu hết học sinh, chụp ảnh thành phố từ sông Sài Gòn là trải nghiệm 'có 1 không 2'. Có bạn đã chụp hơn 300 tấm hình trong chuyến đi đầy thú vị."
Học sinh THPT tìm cách giải bài toán của doanh nghiệ,"Cuộc thi ""Thử thách kinh doanh sáng tạo Việt Nam năm 2024"" (VBIC) là sân chơi trí tuệ dành cho học sinh THPT đam mê kinh doanh. Tham gia cuộc thi, học sinh trong và ngoài nước sẽ cùng đưa ra những ý tưởng hay cho doanh nghiệp. Học sinh giải bài toán từ số liệu thực tế của doanh nghiệp Vòng chung kết có 13 đội thi, học sinh sẽ nhận số liệu thực tế của Land Rover Vietnam (một thương hiệu xe địa hình hạng sang của Anh), sau đó đưa ra chiến lược, phương hướng giúp doanh nghiệp kinh doanh có hiệu quả. Được biết, các vòng trước thí sinh cũng nhận số liệu thực tế của Công ty cổ phần Sữa Việt Nam (Vinamilk), sân khấu kịch Hồng Hạc (TP.HCM). Tiến sĩ Phan Hoàng Lan - giám đốc Trung tâm Khởi nghiệp và Sáng tạo, Trường đại học Fulbright Việt Nam - cho biết dù là lần đầu tiên tổ chức, cuộc thi vẫn thu hút nhiều học sinh cả trong và ngoài nước tham gia. ""Không có nhiều doanh nghiệp ở Việt Nam thực sự tin tưởng các bạn trẻ, đặc biệt các bạn học sinh cấp 3. Vì thế, chúng tôi kêu gọi các doanh nghiệp cởi mở, sẵn sàng trao cơ hội để các bạn có những số liệu thực tế, từ đó sáng tạo ý tưởng. Đồng thời mời chuyên gia trong lĩnh vực phát triển doanh nghiệp, marketing, tài chính, phát triển bền vững, đổi mới sáng tạo… hỗ trợ về kiến thức cho các em khi tham gia cuộc thi"", bà Lan nói thêm. ""Tham gia giải bài toán, các bạn hiểu được khó khăn của doanh nghiệp, từ đó đưa ra giải pháp tương ứng. Việc để giới trẻ tiếp cận với các vấn đề thực tế cuộc sống rất quan trọng. Nếu chỉ học lý thuyết, học sinh khó tiếp cận nhanh với những vấn đề doanh nghiệp, khi được tìm hiểu sớm các bạn có thêm kinh nghiệm"". Thêm cơ hội tiếp cận kiến thức mới Shun Abe (học sinh người Nhật Bản, đang học tại Trường quốc tế BIS TP.HCM) cho biết tham gia cuộc thi, em có thêm được nhiều kiến thức về kinh tế, kinh nghiệm trong hoạt động kinh doanh. ""Em học được nhiều kỹ năng như nghiên cứu, làm việc nhóm, thuyết trình, nói trước đám đông. Là học sinh lớp 10 tham gia cuộc thi, em cũng gặp nhiều thử thách, khó khăn trong vấn đề đưa ra ý tưởng chung, tìm kiếm thông tin đề tài. Nhưng giám khảo nhận xét rất khách quan và những lời khuyên này giúp chúng em có thêm góc nhìn rộng trong lĩnh vực kinh doanh"" - Shun Abe nói thêm. Đinh Vũ Minh Tuấn (học sinh Trường phổ thông liên cấp Vinschool The Harmony, Hà Nội) cho biết rất vui và bất ngờ khi vào được vòng chung kết. ""Bọn em học được phân tích tài chính kinh doanh của một doanh nghiệp, điểm yếu, điểm mạnh, những cái cần khắc phục để doanh nghiệp phát triển hơn. Tuy nhiên vẫn thiếu ý tưởng để đưa ra giải pháp, lợi ích cho các doanh nghiệp"", Tuấn nói. ""Đây là lần đầu tiên em tham gia cuộc thi. Chúng em có nhiều cơ hội để tiếp cận với những kiến thức mới, đối mặt với thử thách mà học sinh cấp 3 chưa từng nghĩ tới, biết cách giải quyết vấn đề sao cho sáng tạo. Tham gia cuộc thi, được quen nhiều bạn, em học hỏi được nhiều góc nhìn từ nhóm khác"". ",07/04/2024 19:10 GMT+7,https://tuoitre.vn/hoc-sinh-thpt-tim-cach-giai-bai-toan-cua-doanh-nghiep-20240407173237898.htm,"Vòng chung kết cuộc thi ""Thử thách kinh doanh sáng tạo Việt Nam năm 2024’’ diễn ra tại Trường đại học Fulbright Việt Nam chiều 7-4, với sự tham gia của hơn 780 học sinh đến từ 10 quốc gia và vùng lãnh thổ."
Một trường có 55 thí sinh vào chung kết Hội thi sáng tác ảnh Tuổi Xan,"Đó là Trường THCS-THPT Trí Đức (TP.HCM). Mời chuyên gia nhiếp ảnh trò chuyện với học sinh Năm nay hội thi cũng ghi nhận Trường THCS-THPT Trí Đức có số thí sinh tham gia ""kỷ lục"". Trong tổng cộng 5.999 bức ảnh bảng thi THPT gửi tham gia vòng sơ loại thì học sinh trường này sở hữu đến 1.166 bức ảnh, chiếm gần 20%. Ở bảng THCS, học sinh trường này cũng gửi ảnh tham gia nhiều nhất, tổng cộng 201 bức. Ông Nguyễn Duy Luận, phó hiệu trưởng Trường THCS-THPT Trí Đức, cho biết hội thi sáng tác Tuổi Xanh được trường đặc biệt quan tâm và mỗi năm đều hướng dẫn cho tất cả các em học sinh của trường tham gia. Ông nói trường nhận thấy thông qua cuộc thi, các em học sinh được học thêm nhiều kỹ năng về bộ môn nghệ thuật này, thích nghi với thời buổi công nghệ số với các nền tảng mạng xã hội đang phát triển hiện nay. Không chỉ dừng lại ở mức độ động viên, khuyến khích, ông Luận cho biết nhà trường còn triển khai những hoạt động để hỗ trợ các em tham gia cuộc thi, cũng như nuôi dưỡng đam mê nhiếp ảnh của các em. Chẳng hạn trường đã mời các chuyên gia về bộ môn nhiếp ảnh, tổ chức nhiều buổi hướng dẫn cho các em về thao tác cũng như các kỹ năng vận dụng của bộ môn này để có những bức hình đẹp. Hay để chuẩn bị cho vòng chung kết cuối tuần này, nhà trường đã tổ chức cho các học sinh đến tham quan khu vực bến Bạch Đằng - khu vực sẽ tranh tài chung kết, giúp các em có điều kiện được thực tập trước khi bước vào ngày thi chính thức. ""Đặc biệt thông qua hội thi này, nhà trường cũng phát hiện thêm nhiều học sinh có năng khiếu về bộ môn nhiếp ảnh, từ đó có chương trình đào tạo thêm cho các em, để các em phát triển năng khiếu và thể hiện niềm đam mê của mình"", ông Luận nói. Học được nhiều từ Hội thi sáng tác ảnh Tuổi Xanh Trương Đại Bảo Khang - học sinh lớp 11C3 Trường THCS-THPT Trí Đức - lọt vào vòng chung kết Hội thi sáng tác ảnh Tuổi Xanh. Khang cho biết em đam mê với bộ môn nhiếp ảnh do trong nhà ba em là kiến trúc sư, đồng thời là một nhiếp ảnh gia. Em phần nào được kế thừa ""gene"" của ba. Khang nói trong trường có một câu lạc bộ tổ chức sự kiện, tại đây em được học thêm rất nhiều kỹ năng, đặc biệt là về nhiếp ảnh. Nhờ vậy, em có cơ hội trải nghiệm với đam mê và được động viên tham gia Hội thi sáng tác ảnh Tuổi Xanh. Còn Nguyễn Trần Minh Anh - học sinh lớp 12C6 - nói trong quá trình chuẩn bị cho Hội thi sáng tác ảnh Tuổi Xanh, em có cơ hội tìm hiểu nhiều về kỹ thuật, như cách canh chỉnh máy cũng như những góc máy, biết kiên nhẫn để bắt được những bức ảnh đẹp… ""Mình đã tìm hiểu thêm những bức ảnh, tác phẩm đạt giải cao từ Hội thi sáng tác ảnh Tuổi Xanh trước đó. Mình tiếp thu thêm nhiều kỹ năng, cũng như học cách bắt lại khoảnh khắc đời sống của mọi người xung quanh"", Minh Anh nói.",07/04/2024 15:33 GMT+7,https://tuoitre.vn/mot-truong-co-55-thi-sinh-vao-chung-ket-hoi-thi-sang-tac-anh-tuoi-xanh-20240407144054719.htm,"Trong 100 thí sinh bảng THPT vào chung kết Hội thi sáng tác ảnh Tuổi Xanh, trường này có đến 41 em, gần phân nửa. Ngoài ra trường còn có 14 trong số 100 thí sinh ở bảng THCS."
Sang Việt Nam học nghề bế,"Hoạt động giao lưu quốc tế với các trường đại học Việt Nam không hiếm, nhưng với trường trung cấp còn khá mới mẻ. Lần đầu biết sơ chế hải sản Gần như mỗi ngày, nhóm sinh viên, giảng viên Hungary sẽ học chung với các lớp sinh viên, học viên Việt Nam. Mỗi buổi như thế, các bạn được giảng viên, đầu bếp Việt Nam hướng dẫn một món ăn mới. Từ những món quen thuộc như phở bò, phở gà, bún chả, gỏi cuốn, lẩu hải sản, đến những món lạ tai hơn như dê chiên riềng, gà tre hấp mắm nhỉ, cua lột xốt X.O... Bạn Zahorán Gábor Tamás, sinh viên ngành bếp tại Trung tâm đào tạo nghề Békéscsaba, cho biết mỗi món ăn Việt Nam với bạn là một hành trình trải nghiệm độc đáo vì có nhiều khác biệt với ẩm thực Hungary. Chẳng hạn, cách nêm nếm gia vị đậm đà hơn và cầu kỳ hơn. Những buổi đầu Gábor nói mình không biết cách phối hợp muối, đường, nước mắm như thế nào để nêm ra đúng vị của giảng viên Việt Nam. Bạn cho rằng lý thú nhất là các món hải sản. Ở Hungary không có biển nên các món hải sản khá nghèo nàn, thay vào đó các món truyền thống của Hungary chỉ tập trung vào thịt heo, thịt bò và rau củ. Vì vậy mà trong những tiết học làm các món tôm, cua, ốc... Gábor và các bạn không ít lần phải há hốc mồm khi lần đầu chứng kiến những kỹ thuật sơ chế, chế biến các loại thực phẩm này. ""Đặc biệt khi phải sơ chế cua sống, mình khá sợ, nhưng cuối cùng được hướng dẫn thì cũng biết cách làm. Lần đầu tiên mình được học những kỹ thuật này"", Gábor nói. Còn nữ sinh Karasz Zóra, đang học ngành bếp, cho biết khá bất ngờ khi nhiều món ăn của Việt Nam khá cay so với chuẩn chung của người Hungary. Tiêu, ớt được dùng nhiều trong các món gỏi, xào, lẩu... Zóra để ý thấy các món nước chấm của Việt Nam, gần như nước chấm nào cũng được thêm một tí ớt. Zóra nói đây là lần đầu tiên bạn ""xuất ngoại"" tham gia một chuyến trao đổi nghề bếp, mà lại đi sang tận một nơi xa như Việt Nam. Nhưng theo Zóra, đã theo học nghề bếp, trải nghiệm là điều tất yếu. ""Trải nghiệm không chỉ trong mà còn ở ngoài nhà trường. Chẳng hạn tại Việt Nam, những món ăn đường phố rất đa dạng và chúng tôi cũng học hỏi từ đó rất nhiều"", Zóra chia sẻ. Chuyện chiếc máy chuyển ngữ Ông Hegyi Béla, quản lý bộ phận F&B (dịch vụ ẩm thực) và ông Horváth Ferenc, giáo viên bếp thuộc Trung tâm đào tạo nghề Békéscsaba, là hai thầy tham gia học cùng nhóm sinh viên Hungary trong hơn ba tuần vừa qua. Cả hai ông đều không giỏi tiếng Anh, và dĩ nhiên là không biết tiếng Việt. Vì vậy trước khi lên đường sang Việt Nam, hai ông sắm cho mình một chiếc máy dịch, sử dụng phần mềm chuyển ngữ của Google để dịch hai chiều giữa tiếng Việt và tiếng Hungary. Chiếc máy như vật bất ly thân trong mỗi tiết học của ông Béla và ông Ferenc. Khi muốn các đầu bếp Việt Nam lặp lại những đoạn quan trọng, các ông sẽ bấm máy, thu âm và ""xi nhan"" những giảng viên này hãy nói chậm rãi để máy kịp dịch. Ngược lại, nếu muốn nói gì, hai ông đưa máy lên như với một chiếc micro, sau đó máy sẽ phát giọng đọc tiếng Việt đã được chuyển ngữ cho giảng viên và bạn học người Việt. Ông Béla cười và chia sẻ nghe có vẻ rườm rà vậy thôi nhưng ông đã học gần như đầy đủ các chi tiết trong từng bài học với chiếc máy dịch. Ông khoe với mỗi bài, tương ứng với một món ăn, ông ghi chép chi tiết vào điện thoại từ nguyên liệu, phương pháp nấu ăn đến những chi tiết lưu ý nhỏ. Từng công đoạn, ông đều chụp hình và quay phim lại để có thêm tư liệu khi trở về nước. Chiếc máy dịch cũng được ông Ferenc mang ""ngao du"" đến một số lễ hội ẩm thực trong thời gian tại TP.HCM, trong đó có một lễ hội ẩm thực lớn quy tụ gần như đầy đủ các món ăn nổi tiếng khắp ba miền. Ông xem đây là dịp may của mình khi có thể cùng một lúc thưởng thức trọn vẹn đặc trưng ẩm thực của nhiều địa phương Việt Nam. Vượt qua rào cản ngôn ngữ, ông có thể hỏi thăm những đầu bếp tại các sự kiện về bí quyết làm các món ăn. ""Tôi thích nhất là các món hải sản và món phở bò, phở gà của Việt Nam"", ông Ferenc chia sẻ.",07/04/2024 13:46 GMT+7,https://tuoitre.vn/sang-viet-nam-hoc-nghe-bep-20240407100819307.htm,"Từ ngày 20-3 đến 10-4, 4 sinh viên và 2 giảng viên nghề bếp và F&B từ Hungary sang Việt Nam trong một chương trình trao đổi tại Trường trung cấp Du lịch và Khách sạn Saigontourist (TP.HCM)."
