Title,Content,Date,Url,Summary
"Nhiều trường đại học quy mô 'siêu nhỏ', có nơi chưa tới 200 sinh viê","Thống kê năm học 2022-2023 từ các cơ sở giáo dục đại học cho thấy số lượng sinh viên đại học chính quy đang theo học tại trường khá khiêm tốn. Không chỉ các trường đại học tư mà ngay cả các trường công, phân hiệu đại học lớn cũng có quy mô đào tạo rất khiêm tốn. Năm 2024, tròn 19 năm phân hiệu Đại học Huế tại Quảng Trị tuyển sinh đại học. Cơ sở giáo dục đại học này có cơ ngơi khá hoành tráng, tổng diện tích đất năm học 2022-2023 là 250.000m², diện tích sàn hơn 22.000m², 26 giảng viên cơ hữu, tuyển sinh 5 ngành. Thế nhưng thời điểm công khai năm 2022-2023, quy mô đào tạo của phân hiệu này chỉ vỏn vẹn 158 sinh viên đại học chính quy. Cũng chính vì quá ít sinh viên nên Phân hiệu Đại học Huế tại Quảng Trị lập luôn kỷ lục mà hiếm trường nào đạt được. Diện tích đất/một sinh viên lên đến 3.246m² và diện tích sàn cũng lên đến 291m²/một sinh viên. Tương tự là Trường đại học Tài chính - Kế toán (Quảng Ngãi). Đây là trường đại học trực thuộc Bộ Tài chính, được thành lập năm 2011 trên cơ sở Trường cao đẳng Tài chính - Kế toán. 7 năm sau, phân hiệu tại Huế của trường đại học này được thành lập. Kết quả là cả trụ sở chính và phân hiệu Huế đều tuyển sinh èo uột. Quy mô đào tạo đại học chính quy năm 2022-2023 của phân hiệu Huế chỉ có 340 sinh viên và trụ sở chính là hơn 1.200 sinh viên. Trong khi đó, năm học 2021-2022, Trường đại học Tân Tạo cũng có quy mô đào tạo vỏn vẹn 430 sinh viên. Riêng khối ngành sức khỏe chiếm hơn 50% với 292 sinh viên. Nhiều cơ sở giáo dục khác cũng có quy mô đào tạo chính quy dưới 1.000 sinh viên dù đã được thành lập từ rất lâu. Trong khi đó nhiều trường đại học có quy mô dưới 2.000 sinh viên. Trong số các trường đại học có quy mô dưới 2.000 sinh viên, nhiều trường đại học địa phương góp mặt. Theo đánh giá của Bộ Giáo dục và Đào tạo trong dự thảo quy hoạch mạng lưới giáo dục đại học, cả nước hiện có 26 cơ sở giáo dục đại học trực thuộc UBND các tỉnh, thành phố trực thuộc trung ương. Các trường đại học này trong nhiều năm không có nhiều cải thiện về quy mô đào tạo, công tác tuyển sinh gặp nhiều khó khăn. Hoạt động của hầu hết các trường địa phương không hiệu quả, đặc biệt trong bối cảnh tự chủ đại học được đẩy mạnh. Hầu hết các cơ sở giáo dục đại học trực thuộc các địa phương có quy mô nhỏ, chỉ đóng góp 6,3% tổng quy mô đào tạo trình độ đại học, 3,5% thạc sĩ và 1% tiến sĩ của toàn hệ thống. Chỉ có 3 cơ sở giáo dục đại học có quy mô lớn hơn 10.000 sinh viên, trong khi có tới 8 cơ sở giáo dục đại học có quy mô thấp hơn 2.000 sinh viên.",05/04/2024 10:42 GMT+7,https://tuoitre.vn/nhieu-truong-dai-hoc-quy-mo-sieu-nho-co-noi-chua-toi-200-sinh-vien-20240405100857054.htm,"Quy mô đào tạo đại học chính quy của nhiều trường đại học, phân hiệu đại học chỉ trên dưới 1.000 sinh viên, thậm chí có nơi chưa đến 200 sinh viên."
Ai có thể thi lại IELTS? Thi lại ở đâu? Chi phí ra sao,"Trên cơ sở sự cho phép của Bộ Giáo dục và Đào tạo, Hội đồng Anh và IDP cho biết sẽ bắt đầu tính năng thi lại một kỹ năng IELTS (IELTS One Skill) tại Việt Nam. Ai có thể thi lại một kỹ năng IELTS? Thí sinh đủ điều kiện đăng ký thi lại IELTS theo tính năng IELTS One Skill nếu đã hoàn tất đầy đủ bài thi IELTS và đã nhận được bảng điểm. Trong vòng 60 ngày kể từ ngày dự thi lần đầu, thí sinh có thể đăng ký thi lại. Lưu ý, dù bài thi IELTS hiện nay được tổ chức với 2 hình thức thi trên máy tính hoặc thi trên giấy, nhưng tính năng IELTS One Skill hiện chỉ được áp dụng cho hình thức thi trên máy tính. Thí sinh được thi lại 1 trong 4 kỹ năng (nghe - nói - đọc - viết) để cải thiện điểm, và chỉ có thể thi lại 1 lần sau lần thi chính thức. Đại đa số thí sinh chọn thi lại là để cải thiện điểm một kỹ năng mà mình chưa ưng ý. Thí sinh chỉ có thể đăng ký thi lại bài thi IELTS ở đơn vị mình đã thi bài thi chính thức trước đó. Được lựa chọn dùng kết quả mới hoặc cũ Thí sinh sẽ được nhận bảng điểm mới khi thi lại IELTS One Skill. Bảng điểm này bao gồm kết quả mới cho một kỹ năng thi lại và điểm của 3 kỹ năng còn lại trong bài thi đầu tiên. Tùy vào kết quả thi lại, thí sinh có quyền lựa chọn sử dụng bảng điểm mới hoặc bảng điểm cũ. Nếu muốn phúc khảo bài thi IELTS thì sao? Thí sinh muốn phúc khảo bài thi chính thức của mình phải nộp yêu cầu phúc khảo trong 2 tuần kể từ ngày thi IELTS (cho các kỹ năng nghe - đọc - viết). Với những thí sinh này, sau khi có kết quả phúc khảo, họ mới có thể đăng ký thi lại một kỹ năng bài thi IELTS. Lệ phí thi lại IELTS ra sao? Dù thi lại bất kỳ kỹ năng nào, lệ phí thi lại một kỹ năng là như nhau. Ở các quốc gia đã áp dụng tính năng này, chi phí của các đơn vị sở hữu bài thi IELTS đưa ra dao động từ 3,5 - 5,5 triệu đồng Việt Nam, tùy nước. Lệ phí thi lại một kỹ năng IELTS chưa được công bố chính thức. IELTS One Skill được công nhận thế nào?  Ra mắt từ cuối năm 2022, tính năng thi lại IELTS One Skill đã có mặt tại hơn 50 quốc gia và vùng lãnh thổ, trong đó có thể kể đến như: Úc, Campuchia, Canada, Pháp, Ấn Độ, Ý, Nhật, Hàn Quốc, Malaysia, Hà Lan, New Zealand, Na Uy, Philippines, Qatar, Ba Lan, Thái Lan, Mỹ, Đài Loan, Hong Kong… Hiện tại, hầu hết các trường đại học lớn ở Mỹ, Anh, Úc, Canada và châu Âu đều công nhận kết quả thi lại một kỹ năng IELTS trong tuyển sinh, xét tuyển.",05/04/2024 10:33 GMT+7,https://tuoitre.vn/ai-co-the-thi-lai-ielts-thi-lai-o-dau-chi-phi-ra-sao-20240405094740503.htm,Tính năng thi lại một kỹ năng bài thi IELTS vừa được Bộ Giáo dục và Đào tạo cho phép Hội đồng Anh và IDP triển khai tại Việt Nam. Tính năng này như thế nào?
"Nhiều giáo viên Trường quốc tế AISVN chưa đi làm, 42 học sinh chuyển trườn","Sở Giáo dục và Đào tạo TP.HCM vừa có báo cáo UBND TP.HCM về tình hình hoạt động của Trường tiểu học, THCS và THPT Quốc tế Mỹ Việt Nam (Trường quốc tế AISVN) ngày 4-4. Giáo viên còn vắng nhiều, học sinh chưa đi học đầy đủ Về tình hình hoạt động giáo dục tại Trường quốc tế AISVN, ở bậc tiểu học có 49/50 giáo viên nước ngoài đến lớp, vắng 1 giáo viên về nước vì lý do cá nhân. Có 8/14 giáo viên Việt Nam đến lớp, vắng 6 giáo viên; 9/23 trợ giảng đến trường (vắng 14) và 8/11 bảo mẫu làm việc (vắng 3, bận việc nhà). Tổng số học sinh tiểu học đi học: 439/455 học sinh. Ở bậc trung học, có 66/79 giáo viên nước ngoài (vắng 13), 12/13 giáo viên Việt Nam đến lớp, và 80/105 nhân viên đi làm. Tổng số học sinh trung học đi học lại là 532/716 học sinh. Theo báo cáo của phòng kế hoạch tài chính (Sở Giáo dục và Đào tạo TP.HCM), tính đến 14h30 ngày 4-4, tổng số tiền phụ huynh đóng góp cho Trường quốc tế AISVN là hơn 27 tỉ đồng. Lãnh đạo phòng kế hoạch tài chính, chuyên viên và kế toán của Sở Giáo dục và Đào tạo TP.HCM đã tham gia rà soát, giám sát thực hiện việc kế hoạch chi và chi lương, BHXH, BHYT cho giáo viên, trợ giảng, nhân viên người nước ngoài, người Việt Nam làm việc tại trường. Trong ngày 4-4, tổng chi cho giáo viên, trợ giảng và nhân viên người Việt Nam làm việc tại trường (gồm 24 giáo viên, 23 trợ giảng, 305 nhân viên) hơn 3,1 tỉ đồng. Trước đó, ngày 2-4, tổng các khoản chi trả cho giáo viên nước ngoài và tiền xe buýt, tiền điện nước, thiết bị dạy học, chi phí đăng ký khóa học và dự thi IB hơn 15,7 tỉ đồng. Trường quốc tế AISVN thành lập tổ tiếp nhận nguyện vọng chuyển trường Hiện tại Trường quốc tế AISVN có tổng số 1.171 học sinh. Đến nay đã có 42 học sinh chuyển trường. Theo kết quả rà soát danh sách của phụ huynh về các nhóm ý kiến cho thấy có 685 phụ huynh đồng ý đóng góp hỗ trợ nhà trường, 339 phụ huynh chưa phản hồi, 127 phụ huynh có ý định chuyển trường cho con, 164 phụ huynh có ý kiến khác. Cũng theo Sở Giáo dục và Đào tạo TP.HCM, Trường quốc tế AISVN hiện đã thành lập tổ tiếp nhận nguyện vọng chuyển trường theo nhu cầu của phụ huynh học sinh. Sở Giáo dục và Đào tạo vẫn đang tiếp tục triển khai tiếp nhận thông tin và xử lý đơn thư của phụ huynh học sinh; công khai danh sách cơ sở giáo dục công lập và ngoài công lập để phụ huynh tham khảo và hướng dẫn phụ huynh học sinh có nhu cầu chuyển trường. Giám đốc Sở Giáo dục và Đào tạo TP.HCM Nguyễn Văn Hiếu cho biết đang tiếp tục chỉ đạo các phòng chuyên môn thuộc sở giám sát chặt chẽ hoạt động dạy học của nhà trường.",05/04/2024 10:10 GMT+7,https://tuoitre.vn/nhieu-giao-vien-truong-quoc-te-aisvn-chua-di-lam-42-hoc-sinh-chuyen-truong-20240405095610219.htm,"Hôm qua 4-4, số giáo viên, trợ giảng, nhân viên Trường quốc tế AISVN vẫn vắng khá nhiều, trong khi hiện đã có 42 học sinh chuyển trường."
'Bí kíp' đạt điểm cao thi đánh giá năng lực ĐH Quốc gia TP.HC,"Đợt thi này có lượng thí sinh đăng ký đông kỷ lục nhất từ trước đến nay với hơn 95.000 người. Thí sinh cần chuẩn bị gì để đạt điểm cao trong kỳ thi này? Đánh giá khả năng suy luận, giải quyết vấn đề Theo TS Nguyễn Quốc Chính - giám đốc Trung tâm khảo thí và đánh giá chất lượng đào tạo, ĐH Quốc gia TP.HCM - sau 6 năm tổ chức, kỳ thi đánh giá năng lực của ĐH Quốc gia TP.HCM liên tục phát triển cả về quy mô, chất lượng và hiệu quả tuyển sinh. Kết quả kỳ thi đánh giá năng lực năm 2024 do ĐH Quốc gia TP.HCM tổ chức sẽ được sử dụng để xét tuyển thí sinh trực tiếp vào gần 100 trường đại học, cao đẳng trong mùa tuyển sinh năm nay. ""Việc tổ chức kỳ thi đánh giá năng lực năm 2024 vẫn giữ ổn định như các năm trước về cách thức tổ chức thi, hình thức làm bài và cấu trúc đề thi. Bài thi này tích hợp được các kỹ năng về đọc hiểu, phân tích vốn được nhấn mạnh ở bài thi SAT, kỹ năng tư duy phản biện và giải quyết vấn đề của bài thi TSA. Bài thi đánh giá năng lực chú trọng đánh giá các năng lực cơ bản để học đại học của thí sinh như sử dụng ngôn ngữ, tư duy logic, xử lý số liệu, giải quyết vấn đề. Nội dung bài thi được tích hợp đầy đủ cả về mặt kiến thức và tư duy dưới hình thức cung cấp số liệu, dữ kiện và các công thức cơ bản. Bài thi chú trọng đánh giá khả năng suy luận và giải quyết vấn đề, không đánh giá khả năng học thuộc lòng của thí sinh. Đề thi chính thức sẽ hoàn toàn tương đồng với đề thi mẫu về cấu trúc"", ông Chính khẳng định. Cũng theo ông Chính, để đạt được kết quả tốt trong kỳ thi này đòi hỏi thí sinh có nền tảng kiến thức và kỹ năng vững chắc đã được chuẩn bị trong một quá trình dài lâu. Những thí sinh có cách tiếp cận học tập đúng đắn và khoa học trong quá trình học phổ thông sẽ có nhiều lợi thế đối với hình thức thi đánh giá năng lực như thế này. Bên cạnh đó, thí sinh cũng cần có sự chuẩn bị tốt như đảm bảo sức khỏe tốt về cả thể chất và tinh thần cho ngày thi, hệ thống hóa kiến thức kỹ năng trước khi thi, đến phòng thi đúng nơi quy định... Kinh nghiệm làm bài thi của thủ khoa Kỳ thi đánh giá năng lực đợt 2 năm 2023 do ĐH Quốc gia TP.HCM tổ chức xuất hiện thủ khoa đạt thành tích cao nhất trong lịch sử kể từ khi kỳ thi được tổ chức vào năm 2018. Người nắm giữ kỷ lục này là thủ khoa Phan Lê Thúc Bảo (cựu học sinh Trường THPT chuyên Quốc Học Huế) với số điểm 1.133/1.200. Đáng chú ý, Phan Lê Thúc Bảo tham gia cả hai đợt thi đánh giá năng lực năm 2023 và đều đứng trong tốp thí sinh đạt thành tích cao nhất với số điểm lần lượt là 1.052 và 1.133. Chia sẻ về kinh nghiệm làm bài thi năng lực, chàng thủ khoa nay đang là sinh viên chương trình tiên tiến ngành khoa học máy tính Trường ĐH Khoa học tự nhiên (ĐH Quốc gia TP.HCM) cho rằng ba yếu tố để làm tốt bài thi đánh giá năng lực là nắm vững kiến thức cơ bản, trau dồi năng lực suy luận và chuẩn bị một tâm lý vững vàng. ""Kết quả bài thi đánh giá năng lực là cả một quá trình dài tích lũy kiến thức 12 năm học của tôi, trong đó ba năm THPT là trọng tâm. Để giải quyết số lượng câu hỏi lớn là 120 câu trong 150 phút của bài thi đánh giá năng lực thật sự rất áp lực. Thí sinh cần tập trung cao độ và có sức bền để không bị đuối ở những chặng đua cuối cùng. Vì thế, mình nghĩ cần phải luyện đề thi thử thật nhiều, không chỉ để làm quen với áp lực thời gian mà còn để tự mỗi thí sinh tìm ra chiến thuật với các phần thi nhỏ"", Bảo nói. Qua quá trình ôn luyện, giải đề thi thử Bảo nhận ra kỳ thi đánh giá năng lực yêu cầu thí sinh phải có kiến thức và năng lực toàn diện. Vì thế, Bảo tuyệt đối không học ""tủ"", học ""lệch"" mà cố gắng học đều các môn. Bảo cũng chia sẻ: ""Các bạn cần phát huy được điểm mạnh và cải thiện điểm yếu của bản thân, từ đó có thể lên kế hoạch ôn tập đúng trọng tâm và phân bố thời gian hiệu quả. Là học sinh chuyên toán, mình có thể nghe giảng và nắm chắc bài học các môn tự nhiên ngay tại lớp. Còn đối với các môn xã hội, đặc biệt là tiếng Việt, mình đầu tư nhiều công sức để có thể làm bài tốt nhất. Bên cạnh đó, mình nghĩ điều quan trọng nhất là phải thoải mái, nên việc học phải đi kèm với niềm vui. Vì nếu quá căng thẳng thì khó thể đạt kết quả cao trong bất cứ kỳ thi nào"". Với số điểm 1.118/1.200, Trần Công Huy Hoàng (sinh viên năm 4 ngành khoa học máy tính, Trường ĐH Bách khoa - ĐH Quốc gia TP.HCM) cũng là thủ khoa kỳ thi đánh giá năng lực đợt 1 năm 2020 do ĐH Quốc gia TP.HCM tổ chức. Bí quyết ôn tập của Huy Hoàng là tập trung nghe giảng tất cả các môn học ngay tại lớp và nắm kiến thức. Khi về nhà, chỉ đọc lại bài đã làm, tham gia nhóm học tập trên mạng. ""Với kỳ thi đánh giá năng lực mình tự học là chính. Mình tập trung trước vào các môn tự nhiên. Với các môn xã hội, mình đọc sách giáo khoa và đánh dấu những chỗ quan trọng. Mỗi tuần mình xem lại các phần đã đánh dấu 1-2 lần để nhớ, chứ không học thuộc. Trên mạng có nhiều dạng đề, mình in đề ra rồi đặt trước mặt để có cảm giác thôi thúc phải làm bài"", Hoàng chia sẻ. Về cách thức làm bài thi đánh giá năng lực, Hoàng cho hay: ""Bài thi không chia theo từng môn, các câu hỏi phân bố ngẫu nhiên. Khi thi nên làm từ trên xuống dưới, với những bài có dữ kiện quá dài thì cần tóm tắt đề để dễ làm hơn. Với những câu phân vân hoặc không biết làm thì đánh dấu lại để quay lại sau. Mình dành 10 phút cuối để đánh dấu vào phiếu trả lời trắc nghiệm, tránh trường hợp làm xong bài nhưng không kịp tô đáp án. Với các câu toán logic, nên tóm tắt lại đề, tức ghi lại các số liệu hoặc thông tin chính để hiểu đề bài hơn"". ",05/04/2024 08:47 GMT+7,https://tuoitre.vn/bi-kip-dat-diem-cao-thi-danh-gia-nang-luc-dh-quoc-gia-tp-hcm-20240404231940244.htm,Kỳ thi đánh giá năng lực đợt 1 năm 2024 do ĐH Quốc gia TP.HCM tổ chức sẽ diễn ra sáng 7-4 tại 24 địa phương trên cả nước.
Đa số học sinh ngộ độc bóng nổ ở Vĩnh Long đã xuất việ,"Tối 4-4, Bệnh viện Đa khoa tỉnh Vĩnh Long cho biết 18 trong tổng số 19 em học sinh lớp 6/5 Trường trung học cơ sở Lộc Hòa, huyện Long Hồ bị ngộ độc khí bóng nổ sức khỏe ổn định, đã xuất viện về nhà theo dõi. Còn một em vẫn đang được theo dõi tại bệnh viện. Ông Trịnh Văn Ngoãn - phó giám đốc Sở Giáo dục và Đào tạo Vĩnh Long - cũng cho biết trong thời gian tới, ngành sẽ chỉ đạo thực hiện đồng bộ các giải pháp phòng ngừa các vụ việc tương tự.  Trong đó chú trọng tuyên truyền, vận động phụ huynh quan tâm, nhắc nhở, hướng dẫn học sinh không mua, không sử dụng các đồ dùng, đồ chơi không rõ nguồn gốc hoặc đồ dùng, đồ chơi nguy hiểm đến sức khỏe trẻ em. Chiều cùng ngày, Sở Y tế tỉnh Vĩnh Long cũng ban hành văn bản đề nghị các đơn vị liên quan, đơn vị trực thuộc báo cáo tình hình và phối hợp triển khai các giải pháp nhằm hạn chế xảy ra các vụ việc ngộ độc khí như báo chí phản ánh. Sở Y tế đề nghị ngành giáo dục chỉ đạo khẩn trương tuyên truyền, thông báo cho học sinh và phụ huynh không mua và sử dụng đồ chơi mang nhãn hiệu ""Fart bomb"". Khuyến cáo các cá nhân không buôn bán đồ chơi gây nguy hại cho học sinh. Ngành y tế cũng đề nghị Cục Quản lý thị trường tăng cường thanh tra, kiểm tra các cơ sở kinh doanh để kịp thời phát hiện các sản phẩm liên quan đến đồ chơi có tên ""Fart bomb"". Kiên quyết tịch thu, xử lý nghiêm các trường hợp vi phạm.  Các cơ sở y tế khi gặp trường hợp tương tự phải kịp thời sơ, cấp cứu, nhanh chóng chuyển nạn nhân đến cơ sở có đủ điều kiện điều trị đảm bảo sức khỏe.",04/04/2024 19:37 GMT+7,https://tuoitre.vn/da-so-hoc-sinh-ngo-doc-bong-no-o-vinh-long-da-xuat-vien-20240404191252058.htm,"Theo ngành y tế Vĩnh Long, đa số học sinh Trường trung học cơ sở Lộc Hòa, huyện Long Hồ, tỉnh Vĩnh Long bị ngộ độc khí bóng nổ sức khỏe đã ổn định và xuất viện."
Sinh viên Greenwich Cần Thơ cho hoa sen in trên chén biết 'bay,"Ngày 4-4, tại triển lãm Đồ họa tranh in áp dụng thực tế ảo tăng cường (Timeless Elegance Exhibition 2024) do Trường đại học Greenwich Việt Nam - cơ sở Cần Thơ (quận Ninh Kiều, TP Cần Thơ) tổ chức, đã làm khách tham quan không khỏi ngạc nhiên trước các sản phẩm độc đáo mà sinh viên ngành thiết kế đồ họa ""trình làng"" tại buổi triển lãm. Theo đó, triển lãm trưng bày tranh in với chủ đề ca ngợi vẻ đẹp của văn hóa con người Nam Bộ nói chung và Cần Thơ nói riêng thông qua các ấn phẩm tương tác hiện đại. Triển lãm cũng tạo môi trường giao lưu, học hỏi và chia sẻ kinh nghiệm giữa các bạn sinh viên ngành thiết kế đồ họa. Ông Nguyễn Hùng Dũng, giám đốc Greenwich Việt Nam - cơ sở Cần Thơ, cho biết với sự hướng dẫn của giảng viên, các bạn sinh viên đã hoàn thành đồ án học tập.  Việc áp dụng công nghệ thực tế ảo tăng cường (AR) đã giúp sản phẩm của các bạn trở nên ""có hồn"" hơn, thật hơn trước mắt người dùng. Tại gian triển lãm, dự án Sứ hoa họa ký gây chú ý với bộ sưu tập gốm sứ độc đáo. Nhóm của Lâm Chí Thiện (sinh viên năm cuối ngành thiết kế đồ họa) thông tin mỗi cái chén, dĩa, ly là sự kết hợp tinh tế giữa nghệ thuật truyền thống và phong cách hiện đại. ""Sản phẩm hoàn thiện với chủ yếu là họa tiết hoa sen truyền thống. Qua thời gian nghiên cứu và lập trình, chúng mình đã có cách làm cho hoa sen biết chuyển động ngay trước mắt người dùng bằng cách lập trình và thông qua công nghệ AR có thể làm hoa sen bay lượn sống động…"", bạn Chí Thiện nói. Trong khi đó, khách tham quan không thể rời mắt trước những bức tranh Đông Hồ cũng được ""ra lò"" theo phong cách mới mẻ hiện đại.  Tranh Đông Hồ truyền thống nghệ nhân lành nghề sẽ khắc tranh trên gỗ. Sau đó, dùng giấy điệp để in tranh. Nhóm bạn Lê Thành Ngoan đã dùng kỹ thuật cắt laser để tạo ra khung tranh gỗ về dòng tranh Đông Hồ. Dùng giấy dó để in tranh và sử dụng màu sắc tự nhiên.  Từ đó, tranh về Đám cưới chuột, Gà Đông Hồ, Lợn Đông Hồ, Vinh Hoa - Phú Quý... được tái hiện theo phong cách hiện đại mang đậm chất sinh viên miền Tây nhưng vẫn giữ được nét truyền thống vốn có.",04/04/2024 17:35 GMT+7,https://tuoitre.vn/sinh-vien-truong-dai-hoc-greenwich-can-tho-cho-hoa-sen-in-tren-chen-biet-bay-20240404163602621.htm,"Những hoa văn màu sắc mang nét truyền thống được vẽ trên chén, dĩa, ly... biết 'bay lượn' nhờ vào công nghệ AR được các bạn sinh viên lập trình."
