Title,Content,Date,Url,Summary
"Học sinh lớp 6 không biết đọc thông viết thạo, giáo viên tiểu học sẽ bị truy trách nhiệm","Ngày 13-4, ông Nguyễn Hữu Thọ - trưởng Phòng Giáo dục - Đào tạo huyện Minh Hóa (Quảng Bình) - cho biết cơ quan này sẽ yêu cầu rà soát lại quá trình dạy học cũng như kiểm điểm trách nhiệm của các giáo viên, lãnh đạo trường ở cấp tiểu học liên quan học sinh lớp 6 không biết đọc thông viết thạo. Theo đó, Phòng Giáo dục - Đào tạo huyện sẽ yêu cầu trường tiểu học báo cáo kết quả học tập của em này từ lớp 1 đến lớp 5. Sau đó sẽ kiểm điểm trách nhiệm của các giáo viên liên quan cũng như lãnh đạo của trường tiểu học. Vì lớp 6 mà không đọc thông viết thạo thì đã có ""lỗ hổng"" ở các lớp trước đó. Đặc biệt là giai đoạn lớp 3, lớp 4, lớp 5 tại trường tiểu học. Ban Thường vụ Huyện ủy Minh Hóa cũng đã họp và yêu cầu phải rà soát lại kiến thức cơ bản của học sinh ở tất cả các trường khác trong huyện. ""Sẽ truy cô giáo thầy giáo nào dạy kiểu gì, hiệu trưởng hiệu phó ở đó nói như thế nào về việc này"", ông Thọ nói. Về giải pháp trước mắt, ông Thọ nói phương án được đưa ra là hằng tuần buổi sáng em này vẫn đi học bình thường theo chương trình lớp 6. Còn buổi chiều thì giáo viên dạy ở trường tiểu học sẽ đến Trường THCS Hồng Hóa để phụ đạo thêm. Việc cử giáo viên tiểu học đến phụ đạo là để phù hợp với lỗ hổng kiến thức cơ bản về đọc viết mà học sinh này đang chưa hoàn thiện. ""Nếu trong đợt kiểm tra học kỳ 2 mà em này không đạt thì phải ở lại lớp"", ông Thọ khẳng định. Như Tuổi Trẻ Online đã thông tin, khi thực hiện bài kiểm tra môn giáo dục công dân ở lớp 6B, cô Đinh Thị Thu Hòa, giáo viên bộ môn này, thấy trong bài của một nam sinh có dòng chữ ""chép nhanh để về"" ở cuối bài nên đã gọi lên hỏi lý do. Em học sinh này thừa nhận nhìn bài bạn để chép chứ không hiểu nghĩa. Còn người bạn cho em này chép bài thì trả lời cố tình viết câu đó để đùa giỡn, không nghĩ là bạn chép luôn vào bài kiểm tra! Sau đó, cô Hòa đã yêu cầu nam sinh này làm lại bài kiểm tra và phát hiện em đọc, viết rất kém và không hiểu từ ngữ được nên không làm được bài. Em chỉ viết được dòng họ tên của mình.",13/04/2024 10:09 GMT+7,https://tuoitre.vn/hoc-sinh-lop-6-khong-biet-doc-thong-viet-thao-giao-vien-tieu-hoc-se-bi-truy-trach-nhiem-20240413081541061.htm,Phòng Giáo dục - Đào tạo huyện Minh Hóa cho biết sẽ rà soát và kiểm điểm trách nhiệm của giáo viên tiểu học để tình trạng học sinh lớp 6 không biết đọc thông viết thạo.
Lớp học 'chạy' ở Trường THPT chuyên Lê Hồng Phong TP.HCM,"Mô hình lớp học ""chạy"" được triển khai ở Trường THPT chuyên Lê Hồng Phong từ năm học 2022 - 2023 đến nay. Sáng học một lớp, chiều học nhiều lớp Sáng 12-4, Phan Ngô Quỳnh Mai, học sinh lớp 11 chuyên sinh, đến trường và ngồi học tại lớp 11 chuyên sinh với các môn văn, toán, tiếng Anh. Chiều 12-4, lớp 11 chuyên sinh không còn nữa, hơn 20 học sinh của lớp này tỏa đi học ở nhiều lớp khác nhau. Quỳnh Mai cũng vậy, Mai chuyển sang phòng học mỹ thuật và học cùng với học sinh các lớp 11 chuyên lý, chuyên hóa, chuyên toán... Tương tự, ngày 12-4 Nguyễn Tấn Đức, học sinh lớp 10 chuyên tin, có lịch học như sau: buổi sáng học chung với các bạn tại lớp 10 chuyên tin theo thời khóa biểu chung của lớp. Đến buổi chiều, Đức và các học sinh lớp 10 chuyên tin di chuyển sang nhiều lớp khác nhau theo lựa chọn cá nhân. Hai tiết đầu Đức ngồi ở phòng học môn công nghệ cùng với những học sinh của các lớp 10 chuyên Anh, chuyên hóa, chuyên địa... Hai tiết sau Đức qua sân cầu lông để học môn giáo dục thể chất cùng với những học sinh khác. Cô Phạm Thị Bé Hiền, hiệu trưởng Trường THPT chuyên Lê Hồng Phong, cho biết: ""Chương trình giáo dục phổ thông 2018 được triển khai tại các trường THPT trên cả nước từ năm học 2022 - 2023 đối với khối lớp 10. Ngoài 8 môn học và hoạt động giáo dục bắt buộc, các học sinh sẽ được chọn lựa 4 môn học và 3 chuyên đề. Từ sự chọn lựa môn học của học sinh, trường sẽ sắp xếp thời khóa biểu theo hướng tất cả các buổi sáng học sinh sẽ học môn bắt buộc và môn chuyên theo lớp truyền thống của mình, ví dụ học sinh lớp 10 chuyên Anh sẽ học buổi sáng ở lớp 10 chuyên Anh. Nhưng vào buổi chiều, học sinh chuyển sang học cùng với học sinh các lớp khác theo môn học tự chọn, chuyên đề, giáo dục thể chất đã đăng ký và học trí tuệ nhân tạo (AI) cơ bản. Như vậy, mỗi học sinh sẽ có một thời khóa biểu riêng"". Đau đầu với thời khóa biểu ""Sau khi nghiên cứu chương trình mới, chúng tôi đưa ra nhiều phương án và cuối cùng chọn phương án tốt nhất cho học sinh. Đó là cho các em đăng ký môn lựa chọn theo đúng khả năng, sở thích của mình"", cô Hiền nói. Theo cô Hiền, để thực hiện điều này, trường gặp khá nhiều khó khăn. Năm đầu tiên trường cần thêm 8 phòng học, năm thứ 2 cần thêm 4 phòng học nữa. Do đó ban giám hiệu nhà trường đã phải thu xếp để tận dụng tất cả những phòng có thể sử dụng làm phòng học. Chẳng hạn phòng giám thị chuyển sang khu vực khác nhỏ gọn hơn, phòng bán trú gom lại để dành cho phòng học, phòng STEM và nghiên cứu khoa học nhập lại thành một phòng... Về đội ngũ giáo viên, trường cấp tốc tuyển giáo viên âm nhạc, mỹ thuật cho 2 môn học mới. Về sĩ số, các lớp tự chọn không bị đội sĩ số lên quá cao, chỉ khoảng 30 học sinh/lớp. Chỉ có duy nhất lớp chuyên đề mỹ thuật là sĩ số đội lên 50 học sinh. ""Cái khó nhất chính là việc xếp thời khóa biểu cho từng học sinh, làm sao để lịch học của các em không bị đụng với các môn khác, làm sao cho lịch dạy của giáo viên hài hòa, đủ tiết nghĩa vụ... là một vấn đề rất đau đầu. Chúng tôi phải sử dụng cả hai phương pháp: thủ công và công nghệ"", cô Hiền thừa nhận. Quỳnh Mai chia sẻ: ""Bốn môn tự chọn của em là hóa, sinh, âm nhạc và mỹ thuật. Trong đó, hóa và sinh là chọn để định hướng nghề nghiệp vì em dự định theo ngành y. Còn âm nhạc và mỹ thuật là hai môn năng khiếu, em chọn học để cân bằng cuộc sống, để việc học tập đỡ áp lực hơn"". Dù học chuyên khá căng thẳng nhưng Mai vẫn có thời gian hoàn thành nhiệm vụ phó chủ nhiệm CLB Harmonica. ""Được chọn môn mình thích nên em cảm thấy việc học rất thoải mái và nhẹ nhàng. Không những thế, em còn được làm quen và học tập với nhiều bạn ở nhiều lớp khác nhau, được học với nhiều giáo viên khác nhau trong cùng một môn học"", Mai nói. Còn với Nguyễn Tấn Đức, bốn môn lựa chọn của em là tin học, lý, công nghệ và âm nhạc. Trong đó, môn âm nhạc là để giải tỏa những lúc căng thẳng, các môn còn lại là để phục vụ cho nghề nghiệp của mình sau này. ""Việc di chuyển từ lớp này sang lớp kia, học chung với nhiều bạn khác nhau mang lại cho em cảm giác thú vị. Đồng thời đây cũng là cơ hội để em rèn luyện kỹ năng giao tiếp, ứng xử, mở rộng mối quan hệ bạn bè"", Đức nói.",13/04/2024 09:44 GMT+7,https://tuoitre.vn/lop-hoc-chay-o-truong-thpt-chuyen-le-hong-phong-tp-hcm-20240412231553969.htm,"Nói học chạy' là vì ngoài các môn bắt buộc, học theo lớp cố định vào buổi sáng, buổi chiều mỗi học sinh ở Trường THPT chuyên Lê Hồng Phong TP.HCM có một thời khóa biểu riêng, chạy sang các lớp có môn học tự chọn mà mình đăng ký."
Học bổng cho thí sinh xét tuyển sớm chương trình Gloucestershire Vietna,"Với chính sách học bổng đa dạng, mức học phí phù hợp, nhiều ưu điểm về đào tạo, chương trình cử nhân quốc tế của Gloucestershire Vietnam đã mang đến cho các bạn trẻ cơ hội để trở thành công dân toàn cầu. Học bổng lên đến 50% học phí Gloucestershire Vietnam (UoG Vietnam) là chương trình hợp tác chiến lược giữa Trường Đại học Kinh tế - Tài chính TP.HCM (UEF) và Đại học Gloucestershire (Anh Quốc) đào tạo cử nhân quốc tế toàn phần tại Việt Nam. Đặc biệt, trong năm 2024, thí sinh khi đăng ký xét tuyển sớm sẽ nhận ngay học bổng từ 25 - 50%, giá trị lên đến 180 triệu đồng. Cụ thể, thí sinh chỉ cần đạt một trong những điều kiện theo chính sách học bổng của UoG Vietnam dựa trên các phương thức: điểm học bạ THPT, điểm kỳ thi ĐGNL của ĐHQG TP.HCM, điểm chứng chỉ ngoại ngữ IELTS. Ngoài ra, với những thí sinh có điểm chứng chỉ IELTS từ 5.0 sẽ được miễn học phí các cấp độ tiếng Anh tương ứng lên đến 68 triệu đồng. Phương thức xét tuyển sớm sẽ là một lợi thế rất lớn dành cho các bạn học sinh khối 12 ở thời điểm hiện tại. Các bạn vừa nhận được mức học bổng giá trị và nắm chắc trong tay khả năng học tập ngành học mình yêu thích. Với chứng chỉ ngoại ngữ IELTS 7.5, thí sinh Hồ Thanh Quang học sinh khối 12 một trường THPT tại quận 3, TP.HCM đã nộp hồ sơ xét tuyển chương trình Cử nhân quốc tế. Chia sẻ về quyết định của mình, Thanh Quang cho biết: ‘Mùa thi đang đến gần, em nhận thấy nếu mình xét tuyển sớm để trúng tuyển có điều kiện thì khi bước vào kỳ thi tốt nghiệp THPT, em không quá lệ thuộc vào điểm số và giảm được áp lực thi cử cho bản thân. Em còn nhận được mức học bổng 50%, giúp tiết kiệm chi phí học tập cho chương trình quốc tế mình yêu thích’. TS. Đỗ Hữu Nguyên Lộc, Giám đốc Gloucestershire Vietnam chia sẻ: ‘Với chính sách học bổng đa dạng dành cho các bạn tân sinh viên, chúng tôi mong muốn tạo điều kiện để các bạn có thể trải nghiệm môi trường học tập đạt chuẩn quốc tế với mức chi phí hợp lý. Từ đó, giúp các bạn an tâm học tập và phát triển bản thân, sớm trở thành công dân toàn cầu trong tương lai.’ Chương trình đào tạo với nhiều lợi thế Bên cạnh chính sách học bổng giá trị, chi phí học tập tiết kiệm, chương trình cử nhân quốc tế này mang đến rất nhiều lợi thế dành cho người học. Mặc dù học tập tại Việt Nam các bạn sinh viên hoàn toàn có thể thụ hưởng chương trình đào tạo chất lượng, tương đương với du học tại Anh quốc. Với đội ngũ giảng viên là các giáo sư giàu kinh nghiệm, đến từ Anh Quốc và các quốc gia nói tiếng Anh, sinh viên có thể tăng cường vốn ngoại ngữ và phát triển khả năng tư duy, sáng tạo. Thời gian học được rút ngắn chỉ từ 3 đến 3,5 năm, bằng cấp tốt nghiệp do Đại học Gloucestershire cấp được Bộ GD-DT công nhận và có giá trị toàn cầu. Đây là điểm mạnh để các bạn sinh viên có thể cạnh tranh với thị trường lao động quốc tế hiện nay. Môi trường học tập với những trải nghiệm đa văn hóa, sinh viên được tạo mọi điều kiện tham gia các hoạt động học tập, thực tại nước ngoài với nhiều chương trình học kỳ quốc tế, giao lưu quốc tế, trao đổi sinh viên tại nhiều quốc gia trên thế giới. Từng tham gia các chương học kỳ quốc tế, cũng như những cuộc thi dành cho sinh viên tại nhiều quốc gia, Huỳnh Thanh Phú Quí, sinh viên ngành Kinh doanh quốc tế chia sẻ: ‘Tham gia chương trình học kỳ quốc tế giúp em có trải nghiệm mới về văn hóa của các quốc gia, giao lưu học tập chung với các bạn sinh viên bản xứ. Hơn hết là em có cơ hội tham gia các cuộc thi để thức sức bản thân và tìm kiếm cho mình nhiều cơ hội để học cao hơn hoặc làm việc ở nước ngoài sau khi tốt nghiệp’. Năm 2024, chương trình xét tuyển những ngành học xu hướng đáp ứng được nhu cầu nguồn nhân lực cho thị trường lao động trong nước và quốc tế trong thời điểm hiện tại và những năm tới như tiếng Anh và ngôn ngữ học, quản trị kinh doanh và marketing, quản trị khách sạn và du lịch quốc tế, kinh doanh quốc tế, truyền thông đa phương tiện, các ngành dự kiến trong năm 2024 gồm quản trị logistics, tài chính - kế toán.  Khi tốt nghiệp với bằng cử nhân quốc tế, sinh viên chương trình có thể tự tin ứng tuyển vào những tập đoàn quốc tế, công ty đa quốc gia tại Việt Nam và nước ngoài.",13/04/2024 09:00 GMT+7,https://tuoitre.vn/hoc-bong-cho-thi-sinh-xet-tuyen-som-chuong-trinh-gloucestershire-vietnam-20240412214733283.htm,"Hiện nay, việc lựa chọn môi trường học tập đa văn hóa, chất lượng quốc tế đang được các bạn trẻ quan tâm."
"Chọn học đại học gần nhà, tại sao không","Tiết kiệm hơn so với học xa nhà Nguyễn Quốc Huy, sinh viên ngành Đông phương học (Tiếng Hàn) cho biết nhà ở Nha Trang nên em chọn học ở Đại học Thái Bình Dương cho thuận tiện. Với quãng đường từ nhà đến trường 5km, Huy có thể đi học bằng xe máy và không tốn tiền thuê trọ, chi phí sinh hoạt hàng tháng. ‘Nhờ học gần nhà mà gia đình em tiết kiệm được một khoản kinh phí kha khá’, Huy nói. Cũng theo Huy, việc học gần nhà không khiến em bỏ lỡ nhiều cơ hội, bởi Nha Trang luôn là điểm đến du lịch nổi tiếng. Thời gian qua, Nha Trang ngày càng thu hút du khách Hàn Quốc nên Huy có nhiều cơ hội trò chuyện, kết bạn với người Hàn, từ đó nâng cao ngoại ngữ sở trường của mình. Nhiều phụ huynh cũng hài lòng với quyết định cho con học đại học gần nhà. Cô Thu Hoài, giáo viên một trường tiểu học tại phường Phước Hải (Nha Trang) cho biết, con gái cô cũng đang theo học ngành Tài chính - Ngân hàng tại Đại học Thái Bình Dương. ‘Nhờ cho cháu học gần nhà, tôi có thể kịp thời giúp con khi con gặp những vướng mắc, ốm đau, đồng hành và chia sẻ khó khăn cùng con’, cô Hoài tâm sự. Cũng theo cô Hoài, việc định hướng cho con học gần nhà không đồng nghĩa với việc cha mẹ bao bọc con thái quá. Con được trao quyền tự quyết, biết chịu trách nhiệm, biết cách giải quyết vấn đề của chính mình. Đảm bảo chất lượng đào tạo Ngày càng nhiều bậc phụ huynh và người trẻ không còn đóng khung trong tư tưởng phải học ở thành phố lớn mới có nhiều cơ hội. Chú Xuân Bình, phụ huynh của một sinh viên chia sẻ con gái đã đi làm tại doanh nghiệp ngay từ khi mới vào năm hai, sau khi đỗ phỏng vấn trong một hội thảo việc làm tổ chức tại trường. Chú Bình càng yên tâm khi biết trường có mạng lưới các doanh nghiệp đối tác và cam kết việc làm sau khi tốt nghiệp, với nhiều cơ hội rộng mở không thua gì học ở Sài Gòn. ‘Các con có rất nhiều cơ hội để trau dồi, phát triển bản thân, học thật làm thật trong môi trường doanh nghiệp ngay từ khi còn ngồi trên ghế nhà trường. Những kỹ năng thực tế sẽ giúp các con vững vàng và trưởng thành, đó là điều giúp chúng tôi an tâm nhất.’, chú Bình nói. Phương Nghi, sinh viên Khoa Du lịch cho biết, các em được tạo điều kiện để thực tập từ năm nhất. ‘Em từng thực tập tại một khách sạn hạng sang tại Ninh Vân Bay, được trải nghiệm những tình huống thực tế và làm việc như một nhân viên thực thụ, đồng thời còn được nhận lương’, Nghi chia sẻ. Không chỉ được tạo nhiều cơ hội thuận lợi để phát huy khả năng ngay tại quê hương, không ít sinh viên tốt nghiệp tại trường đã lập nghiệp và đạt được nhiều thành tựu tại nhiều thành phố lớn như TP.HCM, Hà Nội, Đà Nẵng… Bên cạnh đó, nhà trường còn chú trọng tổ chức nhiều hoạt động trải nghiệm học tập quốc tế, giao lưu với doanh nhân; tham vấn tâm lý cho sinh viên… Đây là cơ sở để sinh viên tăng tương tác và tự tin thích ứng với thị trường việc làm sau này. Cơ hội việc làm rộng mở Những năm qua, ngôi trường này liên tục đầu tư nâng cao chất lượng đội ngũ giảng viên, cơ sở vật chất, cải tiến chương trình đào tạo, triển khai nhiều hoạt động cho sinh viên. Mạng lưới đối tác chiến lược được nhà trường đẩy mạnh với hơn 100 doanh nghiệp trong và ngoài nước. Sinh viên được thực học tại doanh nghiệp với hơn 30% tổng thời gian đào tạo, khi tốt nghiệp có hơn 1,5 năm kinh nghiệm làm việc. Trường cam kết 100% việc làm tại các đối tác chiến lược như HDBank, Vietjet Air, tập đoàn Sovico, địa ốc Phú Long… Tỉnh Khánh Hòa đang hướng đến mục tiêu trở thành thành phố trực thuộc Trung ương vào năm 2030, trung tâm dịch vụ, du lịch biển quốc tế; một cực tăng trưởng của khu vực Nam Trung Bộ, Tây Nguyên và cả nước. Điều này tạo tiền đề cho Khánh Hoà thu hút làn sóng đầu tư lớn; thu hút ngày càng nhiều sinh viên tỉnh và các địa phương lân cận đến học tập, làm việc; cũng như đủ sức hấp dẫn ‘kéo’ người tài từng lập nghiệp xa quê quay về. ‘Trong bối cảnh đó, Đại học Thái Bình Dương sẽ là lựa chọn lý tưởng tại khu vực Nam Trung Bộ, là cái nôi đào tạo nguồn nhân lực chất lượng cao, góp phần cùng tỉnh Khánh Hoà hiện thực hoá mục tiêu trở thành thành phố trực thuộc Trung ương’, Ông Nguyễn Thành Hưng – Giám đốc Tuyển sinh của trường cho biết.",13/04/2024 08:00 GMT+7,https://tuoitre.vn/chon-hoc-dai-hoc-gan-nha-tai-sao-khong-20240412182203536.htm,"Chi phí sống ở các thành phố lớn tăng, nhiều bạn trẻ Khánh Hòa chọn học đại học gần nhà với nhiều cơ hội rộng mở."
Đình chỉ cô giáo gõ đầu học sinh lớp 2 gây sưng mắt,"UBND huyện Bình Liêu, tỉnh Quảng Ninh đã quyết định đình chỉ giảng dạy đối với cô giáo C.T.L.T. để làm rõ trách nhiệm liên quan đến một học sinh lớp 2 bị gõ thước vào đầu. Trước đó, khoảng 15h ngày 9-4-2024, trong khi làm bài tập ở tiết học thứ hai, môn toán lớp 2 tại điểm trường Nà Nhái - Trường tiểu học Vô Ngại (xã Vô Ngại, huyện Bình Liêu, Quảng Ninh), cô C.T.L.T. hướng dẫn nhưng em P.T.L. không làm được, không tập trung. Cô T. đã nhắc nhở nhưng không được, sau đó đã dùng thước kẻ gõ vào đầu em. Em sau đó học bình thường, cuối buổi học có biểu hiện sưng mắt. Đến 17h15 cùng ngày, gia đình phát hiện em bị sưng mắt và đau ở đầu đã gọi điện thông báo giáo viên chủ nhiệm. Sau đó em L. được gia đình và giáo viên đưa đến Trung tâm Y tế huyện Bình Liêu kiểm tra, thăm khám; rồi tiếp tục được đưa lên Bệnh viện Đa khoa tỉnh Quảng Ninh. Tối 9-4, Trường tiểu học Vô Ngại đã cử đoàn công tác đến Trung tâm Y tế huyện Bình Liêu thăm em L. và động viên gia đình. Cô C.T.L.T. đã xin lỗi gia đình và cam kết chi trả viện phí, hỗ trợ, chăm sóc học sinh. Theo kết quả xét nghiệm của Bệnh viện Đa khoa tỉnh Quảng Ninh, em L. không bị tổn thương não, chỉ sưng phần mềm vùng đầu và vùng mắt hai bên. Ngày 11-4, UBND huyện đã ban hành quyết định số 539/QĐ-UBND đình chỉ giảng dạy đối với cô giáo C.T.L.T. để làm rõ trách nhiệm trong vụ việc. Hiện UBND huyện đã chỉ đạo các cơ quan chuyên môn, lực lượng chức năng, UBND xã Vô Ngại và nhà trường tiếp tục kiểm tra, xác minh sự việc; đồng thời tổ chức thăm hỏi, chăm sóc học sinh; phối hợp với phụ huynh học sinh để xử lý những vấn đề liên quan. Đồng thời lưu ý các đơn vị, địa phương tiếp tục thực hiện tốt quy định về an toàn trường học, không để xảy ra các hành vi bạo lực học đường, vi phạm đạo đức nhà giáo, vi phạm pháp luật của giáo viên, học sinh.",12/04/2024 19:26 GMT+7,https://tuoitre.vn/dinh-chi-co-giao-go-dau-hoc-sinh-lop-2-gay-sung-mat-20240412190043728.htm,"Trong tiết học toán, sau khi nhắc nhở học sinh không được, cô giáo C.T.L.T. đã dùng thước kẻ gõ vào đầu em khiến em bị sưng phần mềm vùng đầu và vùng mắt hai bên."
