Title,Content,Date,Url,Summary
Trường đại học tặng bảo hiểm y tế cho phụ huynh thí sin,"Thí sinh sau khi hoàn thành đăng ký xét tuyển học bạ online tại Trường Đại học Văn Hiến đến ngày 15-5-2024 đều sẽ nhận được những hỗ trợ trên, và được sử dụng sau khi trúng tuyển và nhập học. Bốn quyền lợi đặc biệt cho thí sinh myU đồng hành cùng phụ huynh và thí sinh là chương trình được Trường ĐH Văn Hiến phối hợp cùng với myU (Hệ sinh thái HungHau) thực hiện từ năm 2022.  Ông Trần Minh Hậu, giám đốc điều hành thường trực Trường ĐH Văn Hiến, cho biết đối với thí sinh tham gia xét tuyển học bạ vào trường trong năm 2024, myU sẽ tặng bốn quyền lợi đặc biệt cho thí sinh khi bước vào đại học. Thứ nhất, sau khi đăng ký xét tuyển học bạ trên phần mềm xét tuyển của trường, thí sinh sẽ được myU tặng một triệu myU Coin trong tài khoản. Số lượng myU Coin có thể chuyển sang đóng học phí tại VHU hoặc sử dụng mua các sản phẩm của myU như thực phẩm, mỹ phẩm, voucher học kỹ năng, voucher cơm trưa tại căn tin của VHU… Thứ hai, khi đăng ký xét tuyển, thí sinh sẽ được tặng gói khám sức khỏe tại phòng khám thuộc Hệ sinh thái HungHau lúc làm thủ tục nhập học, myU sẽ tài trợ chi trả chi phí này. Thứ ba, myU tặng ba thẻ bảo hiểm y tế có giá trị trong một năm. Trong đó, một thẻ dành cho thí sinh và hai thẻ dành cho người thân của các em, có thể là ba, mẹ, anh chị em, hoặc người đang nuôi dưỡng trực tiếp, khi các em đăng ký xét tuyển và trúng tuyển vào trường. Thứ tư, myU hỗ trợ việc làm cho phụ huynh thí sinh tại các công ty thuộc hệ sinh thái HungHau. Ông Trần Minh Hậu chia sẻ, khi có con học đại học ở thành phố là muôn vàn nỗi lo đối với rất nhiều quý phụ huynh, đặc biệt là những phụ huynh ở quê. Do đó các chương trình của myU đưa ra có đối tượng cụ thể, thiết thực với thí sinh, phụ huynh, có sự chia sẻ có tính nhân văn cao, phù hợp với triết lý giáo dục của nhà trường. Không chỉ với các thí sinh xét tuyển mới, sinh viên đang học tập tại Trường cũng có thể tham gia myU. Cụ thể, nhà trường sẽ tặng myU Coin cho sinh viên khi tham gia các sự kiện, chương trình và các cuộc thi trong và ngoài trường. Số myU Coin tích lũy cũng dùng để đóng học phí tại trường, sử dụng học các lớp kỹ năng hoặc mua các sản phẩm trên app myU hoặc ủng hộ trong các chương trình thiện nguyện nhà trường tổ chức. Nhiều ngành học mới hấp dẫn Thời điểm này, Trường ĐH Văn Hiến đang nhận hồ sơ xét tuyển theo kết quả học bạ THPT. Năm 2024, trường xét tuyển bằng học bạ theo 4 hình thức, bao gồm: - Hình thức 1: Tổng điểm trung bình 3 môn 2 học kỳ lớp 10 + 2 học kỳ lớp 11 + học kỳ 1 lớp 12 + điểm ưu tiên khu vực ≥ 18 điểm - Hình thức 2: Tổng điểm trung bình 3 môn 2 học kỳ lớp 11 + học kỳ 1 lớp 12 + điểm ưu tiên khu vực ≥ 18 điểm - Hình thức 3: Tổng điểm trung bình của 3 môn học kỳ 1 + học kỳ 2 lớp 12 + điểm ưu tiên khu vực ≥ 18 điểm - Hình thức 4: Tổng điểm trung bình chung cả năm lớp 12 ≥ 6.0 điểm trở lên. Ngoài xét tuyển bằng kết quả học bạ, Trường triển khai thêm bốn phương thức xét tuyển khác trong mùa tuyển sinh năm 2024, bao gồm xét tuyển theo kết quả kỳ thi tốt nghiệp trung học phổ thông 2024; xét tuyển thẳng theo quy định của Bộ GD-ĐT và của nhà trường; xét tuyển theo kết quả thi đánh giá năng lực 2024 của ĐH Quốc gia TP.HCM; xét tuyển kết hợp thi tuyển đối với ngành thanh nhạc và piano. Được biết năm học 2024-2025, Trường sẽ mở thêm 6 ngành mới là ngành Kiểm toán; Quản trị nhân lực; Quan hệ quốc tế; Công nghệ điện ảnh, truyền hình; Kỹ thuật xây dựng; Đạo diễn sân khấu, điện ảnh. Hiện tại, thí sinh cả nước đã có thể đăng ký xét tuyển bằng phương thức xét học bạ và tìm hiểu thông tin về Trường theo địa chỉ: https://ts.vhu.edu.vn/",11/04/2024 08:00 GMT+7,https://tuoitre.vn/truong-dai-hoc-tang-bao-hiem-y-te-cho-phu-huynh-thi-sinh-20240410115723773.htm,"Trường Đại học Văn Hiến tặng 1 triệu myU Coin, tặng gói khám sức khỏe miễn phí, thẻ bảo hiểm y tế cho thí sinh và phụ huynh, giới thiệu việc làm cho phụ huynh…"
Yêu cầu Trường quốc tế AISVN xây dựng phương án dạy học trực tuyến,"Chiều 10-4, Văn phòng Sở Giáo dục và Đào tạo TP.HCM đã công bố kết luận về việc tiếp phụ huynh Trường quốc tế AISVN vào ngày 8-4. Trường quốc tế AISVN công khai tài chính đóng góp của phụ huynh đến hết năm học Trước đó, ngày 8-4, ông Nguyễn Văn Hiếu - giám đốc Sở Giáo dục và Đào tạo TP.HCM - đã chủ trì buổi tiếp các phụ huynh của Trường tiểu học, THCS, THPT quốc tế Mỹ Việt Nam (Trường quốc tế AISVN) tại sở này. Sau khi nghe ý kiến trình bày của các phụ huynh đại diện cho nhóm phụ huynh của Trường quốc tế AISVN và báo cáo của ông Trần Khắc Huy - trưởng phòng kế hoạch tài chính Sở Giáo dục và Đào tạo, giám đốc Sở Giáo dục và Đào tạo đã kết luận để các đơn vị, cá nhân có liên quan biết và triển khai thực hiện. Theo đó, giao các phòng chuyên môn thuộc Sở Giáo dục và Đào tạo trao đổi với hiệu trưởng để xây dựng phương án cơ cấu tổ chức lớp học, đảm bảo quyền lợi của học sinh. Tiếp tục tham mưu, đề xuất giải quyết các vấn đề liên quan đến việc tổ chức hoạt động giáo dục tại Trường quốc tế AISVN theo quy định. Sở Giáo dục và Đào tạo TP.HCM yêu cầu Công ty cổ phần Giáo dục quốc tế Mỹ và Trường quốc tế AISVN thực hiện công khai tài chính đóng góp của phụ huynh, gửi thư cảm ơn và kế hoạch hoạt động giáo dục của nhà trường đến hết năm học 2023 - 2024 qua email đến phụ huynh. Đồng thời xác nhận kinh phí do phụ huynh đóng góp hỗ trợ duy trì hoạt động giáo dục của nhà trường cho đến cuối năm học này, cam kết hoàn trả sau khi thực hiện tái cấu trúc Công ty cổ phần Giáo dục quốc tế Mỹ. Nhà trường phải xây dựng phương án dạy học trực tuyến trong điều kiện kinh phí do phụ huynh đóng góp hỗ trợ duy trì hoạt động không đủ để tổ chức hoạt động giáo dục trực tiếp đến cuối năm học 2023 - 2024. Chủ trường cam kết hoàn trả, hoán đổi cổ phần khoản tiền phụ huynh đóng góp Cập nhật đến 9h ngày 10-4, tài khoản ngân hàng đồng sở hữu hai bên giữa Sở Giáo dục và Đào tạo - nhà trường và có sự giám sát của đại diện cha mẹ học sinh đã ghi nhận được tổng các khoản thu hỗ trợ và các khoản phí khác là 29,6 tỉ đồng. Chiều qua, bà Nguyễn Thị Út Em - chủ tịch hội đồng trường Trường quốc tế AISVN - cũng đã gửi thư cảm ơn tới quý phụ huynh của trường. Trong thư, bà Út Em bày tỏ lòng biết ơn sâu sắc đến phụ huynh và xin tri ân tất cả các nghĩa cử cao đẹp của phụ huynh, đồng thời cam kết nỗ lực tìm kiếm các giải pháp khả thi nhất và sẵn sàng chào đón các nhà đầu tư phù hợp nhằm xây dựng Trường quốc tế AISVN ngày càng phát triển hơn. ""Đến thời điểm hiện tại, chúng tôi đã ghi nhận rất nhiều sự đóng góp quý báu của quý phụ huynh. Tất cả khoản đóng góp của phụ huynh sẽ được tổ công tác liên ngành cùng đại diện phụ huynh giám sát việc tổng hợp, quản lý, đồng chi trả cho các hoạt động dạy học của trường cũng như công khai tại bảng tin. Khi trường thực hiện phương án tái cấu trúc, số tiền này sẽ được hoàn trả hoặc hoán đổi nợ thành cổ phần. Bản chính giấy xác nhận về khoản tiền đóng góp của quý phụ huynh sẽ được gửi đến phụ huynh trong thời gian sớm nhất"", bức thư có đoạn viết.",10/04/2024 18:21 GMT+7,https://tuoitre.vn/yeu-cau-truong-quoc-te-aisvn-xay-dung-phuong-an-day-hoc-truc-tuyen-2024041018032273.htm,Sở Giáo dục và Đào tạo TP.HCM yêu cầu Trường quốc tế AISVN xây dựng phương án dạy học trực tuyến trong điều kiện kinh phí do phụ huynh đóng góp không đủ để tổ chức hoạt động giáo dục trực tiếp đến cuối năm học này.
"Sau các vụ ngộ độc ở Nha Trang, phụ huynh 'lên ruột' vì hàng rong vẫn bủa vây trường họ","Chỉ trong vòng chưa đầy 1 tháng qua, tại tỉnh Khánh Hòa xảy ra 3 vụ nghi ngộ độc thực phẩm khiến hàng chục học sinh phải nhập viện, trong đó có 2 vụ xảy ra tại TP Nha Trang, 1 vụ tại thị trấn Tô Hạp (huyện Khánh Sơn). Việc hàng rong vẫn nhan nhản trước các cổng trường khiến phụ huynh vô cùng lo lắng. Lo nhưng không biết làm sao Theo ghi nhận của phóng viên trong các ngày 8 và 9-4, số xe, quán hàng rong trước cổng và xung quanh trường học ở TP Nha Trang vẫn còn nhan nhản. Chẳng hạn, trước cổng Trường THCS Trần Quốc Toản, những người bán cá viên chiên, kem... dựng xe sát cổng trường để bán hàng mà không có ai nhắc nhở. Còn ở Trường THCS Cao Thắng, các em học sinh vô tư mua đồ ăn từ hàng quán gần đó mang vào trường… Anh Nguyễn Văn Hùng có con học ở Trường THCS Trần Quốc Toản cho hay rất lo vì không biết chất lượng đồ ăn bán trước cổng trường ra sao. ""Mấy vụ ngộ độc liên quan đến nhiều học sinh gần đây làm tôi lo lắm. Đôi khi mình bận quá phải bắt buộc cho cháu ăn ở cổng trường. Tôi hy vọng nhà trường sẽ mở căng tin để các cháu có thể ăn đồ an toàn hơn"", anh Hùng nói. Có em học lớp 8 Trường THCS Trưng Vương, chị Lê Minh Nguyệt chia sẻ: ""Tôi hay cho tiền em mua quà vặt. Em rất thích ăn những món như que cay, trà sữa... Khi ăn xong em thường không muốn ăn cơm. Dù tôi không an tâm lắm, nhưng em thích nên phải chiều"". Mạnh tay hơn trong xử lý hàng rong Ông Võ Hồng Vân - chi cục trưởng Chi cục An toàn vệ sinh thực phẩm Khánh Hòa - cho hay những người bán hàng rong thường không bán cố định một điểm, mà hay di chuyển. Họ không được cấp giấy chứng nhận an toàn vệ sinh thực phẩm, cũng như chịu sự ràng buộc, kiểm tra từ cơ quan chức năng. ""Địa phương nên rà soát các hộ kinh doanh hàng rong, tăng cường tập huấn và truyền thông trực tiếp với nhóm hộ kinh doanh này, hoặc có thể mời tổ trưởng tổ dân phố truyền thông lại cho họ. Nếu các hộ chế biến thực phẩm đều lưu mẫu và kiểm thực 3 bước thì sẽ dễ truy xuất được đầu vào. Các xã, phường nên mạnh tay hơn trong việc kiểm tra, xử lý hàng rong"", ông Vân nói. Tại cuộc họp của Ban Chỉ đạo liên ngành về vệ sinh an toàn thực phẩm TP Nha Trang hôm 8-4, bà Phạm Thị Châu Anh - phó trưởng Phòng Giáo dục và Đào tạo TP Nha Trang - nói rằng những điểm bán hàng rong buổi sáng cho học sinh thường chế biến từ tối hôm trước; thực phẩm không được bảo quản tốt, quy trình chế biến và đầu vào của thực phẩm rất dễ gây ngộ độc. Cũng theo bà Anh, việc phối hợp kiểm tra và quản lý nhà nước đối với các cơ sở giáo dục mầm non ngoài công lập, các nhóm trẻ độc lập tư thục do UBND cấp xã quản lý không được tiến hành thường xuyên. Những cơ sở này có số lượng học sinh ít nên việc hợp đồng với các nhà cung cấp thực phẩm chưa nghiêm ngặt. Phòng Giáo dục và Đào tạo TP Nha Trang sẽ kiến nghị UBND thành phố chỉ đạo các xã, phường thực hiện tốt hơn công tác quản lý đối với giáo dục mầm non ngoài công lập. Đối với cấp tiểu học, sẽ đề xuất tăng cường các lớp tập huấn. Đối với cấp THCS, phòng đang nghiên cứu lại các văn bản liên quan để xem xét việc tổ chức căng tin trong trường học.",10/04/2024 16:28 GMT+7,https://tuoitre.vn/sau-cac-vu-ngo-doc-o-nha-trang-phu-huynh-len-ruot-vi-hang-rong-van-bua-vay-truong-hoc-20240409192447985.htm,"Sau loạt vụ ngộ độc thực phẩm khiến nhiều học sinh nhập viện, phụ huynh ở TP Nha Trang càng thêm lo khi hàng rong vẫn bày bán trước nhiều trường."
"'Cô giáo lập nhóm trao đổi nhưng không cho phụ huynh nhắn, sao kỳ vậy?'","""Phụ huynh không được nhắn trên nhóm"" Chia sẻ với Tuổi Trẻ Online, anh Hà, một phụ huynh, cho biết nhóm được cô giáo chủ nhiệm lập ra vào đầu năm học, khi cô mới nhận lớp. Nhưng cô để chế độ chặn nên phụ huynh không thể nhắn tin, phản hồi trên nhóm. Trong tuần, có những việc cần nhắc nhở học sinh hay thông tin cho phụ huynh thì cô giáo sẽ nhắn tin. Cha mẹ đọc tin để biết và thực hiện hoặc nhắc nhở con. Không riêng anh Hà, chị N. có con học lớp 3 ở quận Cầu Giấy (Hà Nội) cũng cho biết nhóm phụ huynh lớp con chị chỉ có cô được nhắn. Một lần, trường xảy ra vụ học sinh bị ngộ độc thực phẩm nhẹ. Nhiều phụ huynh lo lắng muốn biết thông tin nhưng không thể hỏi trên nhóm, mà phải nhắn riêng cho cô và gọi điện cho ban đại diện cha mẹ học sinh. ""Nhân đó tôi kiến nghị với trưởng ban cha mẹ học sinh về việc phải mở chế độ để phụ huynh nhắn tin được trong nhóm. Vì nhóm lập ra để có sự tương tác, trao đổi nhiều chiều giữa cô giáo với cha mẹ, giữa các cha mẹ với nhau. Có lẽ trưởng ban đề đạt với cô nên cô mở cho phụ huynh nhắn tin trong nhóm 2 ngày để cập nhật tình hình học sinh có dấu hiệu ngộ độc thực phẩm. Nhưng sau đó lại đóng lại"", chị N. cho biết. Giáo viên nói gì? Trao đổi vấn đề trên, một số giáo viên tiểu học, THCS ở Hà Nội cho rằng họ cần ""chặn phản hồi"" vì nhóm Zalo chỉ là một kênh để gửi những thông tin cần thiết cho phụ huynh. ""Thông tin trên sổ liên lạc điện tử thường ngắn gọn. Vì thế những việc của trường, lớp, nhất là việc liên quan trực tiếp đến học sinh, giáo viên chủ nhiệm cần thông tin thêm trên nhóm để cha mẹ cùng nắm. Những việc cần phản hồi, trao đổi, cha mẹ có thể nhắn tin lại riêng cho cô để không làm phiền người khác. Nếu tương tác trên nhóm, những thông tin cần phụ huynh đọc có thể bị trôi, nhiều người bỏ sót"", cô Bích Ngọc, giáo viên chủ nhiệm lớp 5 một trường tiểu học ở quận Hai Bà Trưng, Hà Nội, giải thích. Tuy nhiên, cũng có những thầy, cô cho rằng việc đặt chế độ để cha mẹ không nhắn tin, phản hồi là cực đoan.  Theo các thầy cô này, khi lập nhóm có thể thống nhất với phụ huynh để không bàn bạc, trao đổi, thậm chí chuyện phiếm trong nhóm quá nhiều. Nhưng với mỗi thông tin giáo viên trao đổi, phụ huynh có thể xác nhận bằng cách thả tim, dấu ""ok"" hoặc trao đổi ngắn gọn nếu có vấn đề chưa rõ, đề đạt ý kiến.",10/04/2024 16:01 GMT+7,https://tuoitre.vn/co-giao-lap-nhom-trao-doi-nhung-khong-cho-phu-huynh-nhan-sao-ky-vay-20240410144901866.htm,"'Cô giáo chủ nhiệm lập nhóm phụ huynh lớp trên Zalo nhưng lại để chế độ chặn với phụ huynh?', một phụ huynh có con học tiểu học tại Hà Nội băn khoăn."
"Thêm vụ 'bóng thối' gây ngộ độc, 6 học sinh phải nhập viện","Ngày 10-4, ông Lê Thanh Long - trưởng Phòng Giáo dục và Đào tạo huyện Tam Nông, tỉnh Đồng Tháp - cho biết mới đây 6 em học sinh phải nhập viện do hít phải khí từ ""bóng thối"" (còn được gọi là ""bom thối""). Theo báo cáo của UBND huyện Tam Nông, sáng 8-4, sau tiết chào cờ, các em nam sinh lớp 7 Trường THCS Phú Ninh lấy ""bóng thối"" đùa giỡn, ném qua lại khiến quả bóng vỡ ra, 6 nữ sinh hít phải khí thối của quả bóng dẫn đến khó thở. Sau khi được chăm sóc tại phòng y tế của trường, các em được đưa đến Trạm y tế xã An Long rồi chuyển đến Trung tâm Y tế huyện Tam Nông. Trên đường đi các em có dấu hiệu khó thở, buồn nôn, nôn khan và tâm lý rất hoảng sợ. Tại Trung tâm Y tế huyện Tam Nông, các em được thăm khám và truyền nước, lấy mẫu máu  xét nghiệm. Đến 13h30 cùng ngày, các em được làm thủ tục chuyển đến khoa nhi để tiếp tục theo dõi thêm.  Hiện các em học sinh đã được xuất viện về nhà. Qua làm việc, các học sinh cho biết mua ""bóng thối"" tại tiệm tạp hóa ngoài cổng trường. ""Các cơ quan ban ngành đã đến bệnh viện thăm các em học sinh, sức khỏe tỉnh táo. Công an xã Phú Ninh đã đến khu vực trường học để kiểm tra, nắm tình hình và xử lý theo quy định"", ông Long thông tin.",10/04/2024 14:52 GMT+7,https://tuoitre.vn/them-vu-bong-thoi-gay-ngo-doc-6-hoc-sinh-phai-nhap-vien-20240410133928936.htm,"Qua làm việc, các học sinh cho biết mua 'bóng thối' tại tiệm tạp hóa ngoài cổng trường."
"Trường đại học đăng danh sách sinh viên nợ học phí, có trường hợp chỉ nợ 10.000 đồng","Nhiều người đang tỏ ra bức xúc trước việc các trường đại học đăng công khai trên mạng danh sách nợ học phí. Các ý kiến đều cho rằng cách làm này của các trường là vô cảm, thiếu tôn trọng và thậm chí phạm luật. Liên tục công bố danh sách sinh viên nợ học phí cập nhật nhiều lần Theo ghi nhận của Tuổi Trẻ Online, hiện có hàng chục trường đại học (công lập và tư thục) trên cả nước công bố danh sách sinh viên nợ học phí lên website nhà trường. Trong đó không ít trường thực hiện việc này trong nhiều năm qua với tần suất ngày càng tăng. Trường đại học Tài chính - Marketing liên tục công bố danh sách sinh viên nợ học phí, nhiều lần cập nhật thời điểm khác nhau trong học kỳ và năm học (dự kiến bị hủy học phần, chưa nộp học phí, đã bị hủy học phần, hệ thống trường hủy hết học phần còn nợ, sinh viên nợ học phí sau khi có thông báo gia hạn, sinh viên nợ học phí năm…). Thực tế nhà trường đã thực hiện việc ""đòi nợ sinh viên"" trên mạng cả chục năm nay. Hiện nay, trên website phòng tài chính - kế toán Trường đại học Tài chính - Marketing vẫn còn hiển thị danh sách sinh viên chưa nộp học phí, ký túc xá học kỳ 1 năm học 2017-2018 và trả nợ học phần các khóa. Phòng kế hoạch - tài chính Trường đại học Sài Gòn mỗi học kỳ cũng đều gửi danh sách sinh viên chính quy ngoài sư phạm chưa hoàn tất học phí và học phí học lại để các khoa thông báo đến sinh viên. Danh sách này sau đó được đăng trên website nhà trường. Theo thông báo này, sinh viên có tên trong danh sách trên sẽ bị hủy đăng ký môn học của học kỳ đó, đồng thời chịu mọi hình thức kỷ luật theo quy định của nhà trường. Sinh viên nợ 10.000 đồng, sinh viên mồ côi nợ phí vệ sinh vẫn bị nêu tên Theo danh sách sinh viên chưa hoàn thành nghĩa vụ học phí (học kỳ 1 năm học 2023-2024) phòng tài vụ Trường đại học Sư phạm Hà Nội 2 công bố có thông tin chi tiết (họ tên sinh viên, mã số sinh viên, lớp, môn học nợ, tổng nợ học phí…). Trong đó có nhiều sinh viên nợ học phí một vài môn học, và cũng có sinh viên nợ học phí cả chục môn. Đáng chú ý, một số sinh viên nợ vài chục ngàn đồng, thậm chí có sinh viên còn nợ 10.000 đồng học phí cũng có tên trong danh sách này. Phòng kế hoạch tài chính Trường đại học Công nghệ thông tin và Truyền thông Việt - Hàn (Đại học Đà Nẵng) mỗi học kỳ đều công bố danh sách sinh viên chưa hoàn thành học phí. Danh sách này công khai họ tên sinh viên, mã sinh viên, lớp sinh hoạt, số học phí còn nợ của số tín chỉ học lần 1, số tín chỉ học lại. Trường đại học Đồng Nai công bố danh sách sinh viên các khóa nợ học phí và lệ phí, trong đó có nhiều thông tin chi tiết của sinh viên (họ tên, ngày tháng năm sinh, mã số sinh viên, lớp, số học phần còn nợ học phí, lệ phí thư viện, lệ phí vệ sinh… của từng học kỳ, năm học). Bên cạnh đó còn có thông tin ghi chú tình trạng sinh viên diện buộc thôi học, bị xóa tên, bảo lưu, nghỉ tạm thời. Điều đáng nói, có sinh viên mồ côi, diện miễn học phí nhưng còn nợ 1 triệu đồng lệ phí thư viện và lệ phí vệ sinh cũng bị nêu tên trong danh sách này. Công bố cả danh sách dự kiến cấm thi và hủy kết quả đăng ký môn do chậm nộp học phí Trong khi đó, phòng công tác sinh viên và thanh tra giáo dục Trường đại học Công Thương TP.HCM công khai trên website danh sách sinh viên gia hạn học phí, với chi tiết thông tin cá nhân của sinh viên cùng thời gian và số tiền gia hạn đóng theo từng đợt. Trường đại học Cần Thơ công bố danh sách sinh viên không đóng học phí 2 học kỳ. Trường hợp sinh viên nếu có nguyện vọng học tiếp phải liên hệ trình bày lý do không đóng học phí trong thời gian qua tại phòng công tác sinh viên để nhà trường xem xét. Phòng kế hoạch tài chính Trường đại học Nha Trang mỗi học kỳ cũng đều công bố danh sách sinh viên dự kiến cấm thi và hủy kết quả đăng ký môn học do nợ học phí học kỳ. Theo thông báo này, nhà trường nhắc những sinh viên đã được gia hạn đóng học phí, sinh viên phải đóng học phí trước thời gian trường cho gia hạn để đảm bảo kết quả học tập trong học kỳ; sinh viên chưa thực hiện nghĩa vụ đóng học phí học kỳ (không thuộc đối tượng được gia hạn), dự kiến cấm thi và hủy kết quả đăng ký môn học học kỳ.  Kèm theo thông báo là danh sách sinh viên với thông tin cá nhân chi tiết liên quan.",10/04/2024 12:02 GMT+7,https://tuoitre.vn/truong-dai-hoc-dang-danh-sach-sinh-vien-no-hoc-phi-co-truong-hop-chi-no-10-000-dong-2024041011315795.htm,Hàng chục trường đại học trên cả nước nhiều năm nay công khai danh sách sinh viên nợ học phí với nhiều thông tin cá nhân chi tiết.
