Title,Content,Date,Url,Summary
"7 năm trước chị đoạt giải nhất viết thư quốc tế, nay đến lượt em","Điều thú vị là 7 năm trước, chị ruột của Minh là Nguyễn Đỗ Huyền Vi cũng đạt giải nhất cuộc thi này và xuất sắc giành giải khuyến khích UPU quốc tế. Hai bức thư của hai chị em mang màu sắc khác nhau, song có chung sự rung cảm nhạy bén trước những vấn đề nhức nhối toàn cầu. Chuyện hiếm ở cuộc thi UPU Cuộc thi viết thư quốc tế UPU năm 2024 với chủ đề ""Gửi các thế hệ tương lai để kể về thế giới mà bạn hy vọng họ được kế thừa"". Chủ đề cuộc thi cũng gắn với kỷ niệm 150 năm thành lập Liên minh Bưu chính thế giới UPU (1874 - 2024).  Vượt qua 1,5 triệu bài viết, bức thư của nam sinh Nguyễn Đỗ Quang Minh, học sinh lớp 9 Trường THCS-THPT Nguyễn Khuyến (quận Cẩm Lệ, TP Đà Nẵng), đã giành giải nhất quốc gia. Minh cho biết em đã hóa thân thành nhân vật Pull Attie - một nhân viên làm việc tại bưu điện ở ngôi làng Ông già Noel, trực tiếp đọc những lá thư của trẻ em trên toàn thế giới gửi về. Ông Pull Attie viết thư cho tổng giám đốc UPU năm 2174, chia sẻ cảm nhận về việc trẻ em thiếu tình thương và cần một nơi để giãi bày tâm sự. Bức thư có đoạn: ""... Thế giới càng phát triển, con người càng xa cách nhau, dần trở nên vô cảm với nhau. Trẻ em dần thiếu thốn tình yêu thương, và chúng cần lắm một nơi để giãi bày tâm sự. Chúng khao khát được chia sẻ bằng những dòng thư tay chân thành nhất, gửi đến một nơi mà chúng tin sẽ có người lắng nghe để được nhận lại tình yêu thương. Và đó chỉ có thể là Ông già Noel!""... Bức thư đã chạm đến cảm xúc của nhiều người với sự rung cảm vừa ngây thơ vừa sâu sắc. Sau khi danh sách đạt giải nhất quốc gia được công bố, ít ai biết được Minh là em trai của Nguyễn Đỗ Huyền Vi, học sinh lớp 8/9 Trường THCS Tây Sơn, Đà Nẵng, cũng giành giải nhất cuộc thi này năm 2017. Đây là trường hợp hiếm ở một cuộc thi mang tầm quốc tế dành cho thanh thiếu niên toàn quốc. Hai bức thư, hai màu sắc Với cách giải quyết vấn đề khá thông minh và táo bạo, bức thư gửi Tổng thư ký Liên Hiệp Quốc Antonio Guterres của Nguyễn Đỗ Huyền Vi, cô học sinh lớp 8 năm ấy, đã đề cập cách giải quyết vấn đề người tị nạn tràn sang châu Âu. Huyền Vi đã đề xuất ý tưởng kêu gọi các quốc gia phát triển, các tổ chức từ thiện và tỉ phú trên khắp thế giới mua đảo cho người tị nạn. Huyền Vi bây giờ là sinh viên năm 3 ngành quản trị sự kiện Đại học Greenwich (TP.HCM). Vi kể ngày nhỏ, mỗi buổi tối cả nhà lại quây quần cùng ăn cơm và xem tivi.  ""Ý tưởng này xuất phát từ thông tin trên một bản tin thời sự về việc tỉ phú Ai Cập Naguib Sawiris muốn mua đảo tặng người tị nạn. Đây là một lời giải đầy tính nhân văn giúp tháo gỡ vấn đề người tị nạn mà cả thế giới đang phải đối mặt lúc bấy giờ"", Vi chia sẻ. Khác với bức thư của em trai với thiên hướng mơ mộng, lãng mạn xen lẫn những nỗi niềm ngây thơ, cô học sinh lớp 8 Huyền Vi năm ấy thể hiện sự hiểu biết sâu sắc về tình hình người tị nạn trên thế giới. Bức thư đậm chất nghị luận xã hội sắc bén, thuyết phục. Song cả hai bức thư có điểm chung là sự rung cảm sâu sắc trước những vấn đề thời cuộc. Vi cho biết từ nhỏ hai chị em đã được mẹ truyền cho niềm yêu văn, say văn. Ở nhà có một tủ sách lớn với nhiều loại sách văn học, truyện, ký... Hai chị em Vi lớn lên cùng sách.  Dòng máu yêu văn học cũng có phần được kế truyền từ người cha là nhà thơ và mẹ là một giáo viên dạy văn vừa là tiến sĩ văn học. Bí quyết của người mẹ Nói về chuyện cả hai con đều đạt giải nhất cuộc thi viết thư UPU, cô Đỗ Thị Cẩm Nhung, giáo viên dạy văn tại Trường THPT chuyên Lê Quý Đôn (Đà Nẵng), cho biết cả hai bức thư đều do chính hai con lên ý tưởng, tìm tòi thông tin để đưa ra những lập luận cho riêng mình. Mẹ chỉ chỉnh một số ý nhỏ cho con.  Hai bức thư cũng thể hiện đúng tính cách của Vi sắc sảo, nhạy bén và Minh sống nội tâm, lãng mạn và luôn nhiều ý tưởng mới lạ. Cô Nhung cho hay khi Quang Minh kể về ngôi làng Ông già Noel và ngôi trường đào tạo Ông già Noel trên thế giới, cô đã rất bất ngờ vì không nghĩ đó là những điều có thật. Nói về nội dung Quang Minh trăn trở trong thư ""trẻ em dần thiếu thốn tình yêu thương"", giọng cô Nhung chùng xuống.  ""Cả hai con phải sống thiếu tình thương yêu của cha từ khi còn rất nhỏ. Tôi đã cố gắng bù đắp tình thương cho con nhưng mãi sau này tôi mới nhận ra không thể bù đắp được tình cảm của người cha với các con mình"", cô Nhung nói. Khi Minh đưa cho mẹ xem lá thư của một bạn nhỏ viết cho Ông già Noel với những dòng chữ ngây ngô: ""... Mẹ nói bố đang làm ở thiên đường chỗ Ông già Noel. Cháu đạt học sinh giỏi, cháu làm lớp trưởng. Cháu xin ông cho bố cháu nghỉ làm để đưa cháu đi coi thú. Cả mẹ cũng được nghỉ, không phải đi quét rác để đi chơi với cháu"", cô Nhung đã bật khóc.  ""Quang Minh cũng thiếu thốn tình yêu của người cha, nên con đã chạm được đến nỗi lòng của em bé viết bức thư ấy. Tôi hiểu tâm trạng của con. Từ sự thiếu thốn đó, Minh đã nói lên nỗi lòng của những đứa trẻ khác chung hoàn cảnh như mình"", cô Nhung tâm sự. Hỏi cô Nhung về bí quyết để ""nhóm lửa"" cho các con yêu văn học, cô cho biết từ khi các con còn rất nhỏ, cứ mỗi tối sau giờ lên lớp, cô sẽ ngồi đọc sách cùng con rồi để con tự nói lên suy nghĩ của mình về nội dung trong mỗi cuốn sách. Nhờ thế tình cảm mẹ con gắn kết hơn và các con cũng tạo được thói quen đọc sách, diễn đạt tốt những ý tưởng và suy nghĩ của mình.",12/05/2024 09:14 GMT+7,https://tuoitre.vn/7-nam-truoc-chi-doat-giai-nhat-viet-thu-quoc-te-nay-den-luot-em-2024051208431277.htm,Giải nhất quốc gia cuộc thi viết thư quốc tế UPU năm 2024 thuộc về em Nguyễn Đỗ Quang Minh - học sinh lớp 9 ở TP Đà Nẵng.
Cô gái không răng được phẫu thuật với 'trợ lý' AI,"Ngày 10-5, hội thảo ""Hiểu AI, làm giàu hành trang nghề nghiệp"" trong khuôn khổ sự kiện AI Day do báo Tuổi Trẻ và Google tổ chức để lại ấn tượng cho hàng ngàn khán giả tham dự với một câu chuyện đặc biệt, về một bạn trẻ đã thay đổi cuộc đời nhờ vào AI. Ca khó 'sai một ly, đi một dặm' Câu chuyện được bác sĩ chuyên khoa 1 Trương Chí Bảo thuộc Nha khoa Nhân Tâm thuật lại khiến không ít khán giản tham dự xúc động. Năm 2020, các bác sĩ của Nha khoa Nhân Tâm gặp gỡ bệnh nhân Nguyễn Ngọc Hạnh không may mắc hội chứng loạn sản ngoại bì ngay từ khi sinh ra, khiến bạn không có tóc, răng, lông mày và lông mi phát triển kém. Hơn 27 năm, Hạnh chưa bao giờ thưởng thức được một bữa ăn ngon, và khuôn mặt thiếu hài hòa vì không có răng khiến bạn thường xuyên phải chịu đựng ánh nhìn tò mò và trêu ghẹo. Đáng buồn hơn, Hạnh đã từng gửi nhiều hồ sơ xin việc nhưng đều bị từ chối khéo do ngoại hình… ""không giống ai"". Bác sĩ Trương Chí Bảo giải thích hội chứng loạn sản ngoại bì có tỉ lệ 1/100.000 người. Việt Nam đang có 100 triệu dân, thì khoảng 1.000 người mắc hội chứng này. Theo bác sĩ, cái khó trong điều trị nằm ở chỗ các bệnh nhân không những không có răng mà không có cả xương răng, nên không thể cấy chân răng như thông thường. Các bác sĩ phải tính đến cách dùng những implant dài gấp 3-4 lần implant thường để cấy vào vị trí xương gò má. ""Vị trí này cách mắt bệnh nhân chỉ khoảng 1mm, nên nếu có biến chứng thì không chỉ họ không răng, không tóc mà còn có thể bị mù"", bác sĩ Trương Chí Bảo nói tại hội thảo. Do đó, bác sĩ buộc phải đặt implant chính xác đến từng mm, bởi nếu ""sai một ly đi một dặm"". Để đảm bảo sự chính xác tối đa, các bác sĩ thực hiện ""ca khó"" này phải sử dụng một công nghệ AI mới là công nghệ định vị tự động X-Guide. Công nghệ gồm 2 camera giám sát vị trí của mũi khoan theo thời gian thực. Các bác sĩ có thể theo dõi vị trí mũi khoan màn hình máy tính trong lúc làm phẫu thuật. Khi khoan chưa tới độ dài mục tiêu, màn hình sẽ báo màu vàng và sẽ chuyển sang màu xanh khi đạt đến yêu cầu. Chỉ cần mũi khoan vượt quá 0,1mm, màn hình lập tức chuyển sang màu đỏ đồng thời phát thêm tín hiệu cảnh báo cho nha sĩ. Hoặc khi khoan tới những vị trí gần các cấu trúc giãi phẩu quan trọng, máy sẽ có một chế độ cảnh báo phát ra âm thanh nhắc nhở bác sĩ. ""Nếu không có công nghệ AI tiên tiến, có lẽ chúng tôi không dám thực hiện ca phẫu thuật này"", bác sĩ Trương Chí Bảo chia sẻ. Kết quả, bệnh nhân Nguyễn Ngọc Hạnh đã được khoan 4 implant dài vào xương gò má thành công. Sau toàn bộ quá trình điều trị tại Nha khoa Nhân Tâm, bệnh nhân đã có bộ răng đẹp, một ngoại hình và cuộc sống mới. Hiện tại, Nguyễn Ngọc Hạnh đang là sứ giả truyền cảm hứng cho những người mắc các hội chứng không răng bẩm sinh, truyền cảm hứng về nghị lực và sự lạc quan. Trong sự kiện AI Day, bạn đã có mặt tại gian hàng của Nha khoa Nhân Tâm, giao lưu cùng nhiều bạn trẻ đến tham dự. AI không thể thay thế bác sĩ Cũng tại hội thảo ""Hiểu AI, làm giàu hành trang nghề nghiệp"", bác sĩ Trương Chí Bảo giới thiệu ngoài công nghệ X-Guide, AI có rất nhiều tiềm năng áp dụng vào lĩnh vực nha khoa. Điển hình vào năm sau, Nha khoa Nhân Tâm sẽ đưa vào sử dụng một phần mềm giúp chẩn đoán bệnh nha chu và sâu răng, chiếm 90% dân số của người Việt Nam. Ngoài ra, các công nghệ số có thể được dùng trong chế tác răng, thay thế cho phương pháp chế tác bằng tay. Hoặc ngay từ ở giai đoạn lên phác đồ điều trị, AI có thể giả lập cho bệnh nhân biết và nhìn thấy được trên máy tính kết quả của quá trình điều trị răng tương ứng với từng mốc thời gian cụ thể. Tuy nhiên theo bác sĩ Trương Chí Bảo, AI dù phát triển nhưng rất khó có thể thay thế một bác sĩ, bởi một bác sĩ còn có những cảm xúc, tình cảm khi chữa trị cho bệnh nhân. Do đó dành lời khuyên cho các học sinh, sinh viên đang và sẽ theo học các ngành y khoa, ông Bảo cho rằng ngoài nâng cao kiến thức, tay nghề, các bạn còn cần trau dồi thêm một ""trái tim lớn"". ""Có như vậy, các bạn sẽ không bao giờ bị AI thay thế"", ông Bảo nói.",12/05/2024 09:00 GMT+7,https://tuoitre.vn/co-gai-khong-rang-duoc-phau-thuat-voi-tro-ly-ai-20240512065832043.htm,"Mắc bệnh hiếm không răng, không xương răng, bệnh nhân Nguyễn Ngọc Hạnh được các bác sĩ phẫu thuật thành công nhờ vào 'trợ lý' AI."
Vụ giáo viên phát đơn ‘xin không thi tuyển sinh lớp 10’ cho học sinh là có thật,"Lá đơn xin không tham gia thi tuyển sinh lớp 10 năm học 2024 - 2025 được in sẵn, để trống phần tên cho học sinh, phụ huynh điền vào. Ép học sinh không thi tuyển sinh lớp 10? Nội dung của lá đơn, ngoài thông tin của phụ huynh, học sinh và số điện thoại liên hệ, còn ghi rõ: ""Căn cứ vào kết quả học tập năm học vừa qua và năng lực nhận thức của cháu không tốt, gia đình nhận thấy khả năng của cháu khó có thể theo học chương trình trung học phổ thông hệ công lập. Nay gia đình làm đơn này xin ban giám hiệu nhà trường cho phép cháu (tên học sinh) không tham gia kỳ thi tuyển sinh vào lớp 10 của Sở Giáo dục và Đào tạo TP.HCM, khóa ngày 6-6-2024"". Theo Phòng Giáo dục và Đào tạo huyện Hóc Môn, qua xác minh ban đầu của đơn vị, lá đơn trên xuất phát từ một lớp 9 của Trường THCS Nguyễn Văn Bứa. Giáo viên đã in lá đơn này ra, để học sinh điền vào.  Hiện Phòng Giáo dục và Đào tạo huyện Hóc Môn đã yêu cầu nhà trường làm báo cáo, đồng thời chỉ đạo nhà trường mời phụ huynh học sinh đến trường để trao đổi lại. Phụ huynh và học sinh bức xúc Nội dung lá đơn trên hiện đang lan truyền trên mạng xã hội. Nhiều phụ huynh và học sinh tỏ ra bức xúc. Họ cho rằng nhà trường đã vì thành tích mà không cho học sinh thi tuyển sinh lớp 10. Trong khi đó, Phòng Giáo dục và Đào tạo huyện Hóc Môn nói đây là sự việc xảy ra ngoài ý muốn, không phải chủ trương của phòng.",11/05/2024 19:16 GMT+7,https://tuoitre.vn/vu-giao-vien-phat-don-xin-khong-thi-tuyen-sinh-lop-10-cho-hoc-sinh-la-co-that-20240511185614808.htm,"Giáo viên phát đơn ""xin không tham gia thi tuyển sinh lớp 10"" cho học sinh điền tên. Sự việc xảy ra tại Trường THCS Nguyễn Văn Bứa, huyện Hóc Môn, TP.HCM."
Ứng dụng AI trong lĩnh vực y tế,,11/05/2024 19:00 GMT+7,https://tuoitre.vn/ung-dung-ai-trong-linh-vuc-y-te-20240511155350593.htm,"Trí tuệ nhân tạo (AI) đang là xu hướng nổi bật trong mọi lĩnh vực toàn cầu và lĩnh vực y tế cũng không ngoại lệ. Rất nhiều ứng dụng AI trong y tế đã ra đời để giảm tải gánh nặng cho các bệnh viện, nâng cao hiệu quả điều trị bệnh."
Google đồng hành Việt Nam phát triển AI,"Ngày 10-5, sự kiện AI Day - “Hiểu Al làm giàu hành trang nghề nghiệp” được báo Tuổi Trẻ phối hợp với Google tổ chức tại TP.HCM thu hút gần 2.000 học sinh, sinh viên tham dự. Khóa học AI miễn phí của Google Tại sự kiện, ông Marc Woo - giám đốc điều hành Google châu Á - Thái Bình Dương, phụ trách Việt Nam - cho biết nghiên cứu mới nhất về tiềm năng kinh tế của AI ước tính AI có thể tạo ra giá trị tương đương từ 2.600 tỉ USD đến 4.400 tỉ USD mỗi năm. Nhiều quốc gia đang xem AI sẽ trở thành sức bật cho nền kinh tế, nhất là trong bối cảnh Diễn đàn Kinh tế thế giới dự báo các công nghệ mới bao gồm AI sẽ tạo ra 97 triệu việc làm mới vào năm 2025. Tại Việt Nam, ông Marc Woo đánh giá Chính phủ đang rất quan tâm đến AI. Chiến lược quốc gia về nghiên cứu, phát triển và ứng dụng AI đến năm 2030 hướng tới mục tiêu đưa Việt Nam thành trung tâm đổi mới sáng tạo, phát triển các giải pháp và ứng dụng AI. Bên cạnh đó, theo giám đốc điều hành Marc Woo, Việt Nam đang sở hữu lợi thế với tỉ lệ người trẻ am hiểu công nghệ chiếm 20% dân số. Họ rất nhạy bén trong việc nắm bắt những công nghệ như AI. “Google luôn cam kết đồng hành cùng Việt Nam trong các hoạt động nâng cao hiểu biết, kỹ năng công nghệ và AI trên nhiều lĩnh vực. Google sẽ tiếp tục mở rộng những hoạt động hỗ trợ cộng đồng tiếp cận với AI”, ông Marc Woo nói. Một trong số những hoạt động được Google triển khai là các khóa học cho bạn trẻ Việt Nam. Bà Hà Lâm Tú Quỳnh - giám đốc Quan hệ công chúng và Truyền thông, phụ trách Việt Nam, Google châu Á - Thái Bình Dương - giới thiệu đến các học sinh, sinh viên tham dự AI Day cơ hội giành những suất học bổng cho các khóa học miễn phí Google AI Essentials. Cụ thể, các khóa học được phát triển bởi các chuyên gia hàng đầu của Google. Người học đăng ký và tự học trên máy tính hoặc điện thoại thông minh, mỗi khóa kéo dài khoảng 10 giờ. Khóa học được chia thành 5 module: Giới thiệu về AI; Tối đa năng suất với công cụ AI; Thỏa sức sáng tạo với kỹ thuật viết Prompt; Sử dụng AI có trách nhiệm; Tiên phong trong bối cảnh phát triển của AI. “Học sinh, sinh viên dù đã biết hay chưa biết về AI cũng có thể tìm thấy module học tập phù hợp”, bà Quỳnh nói. Các bạn trẻ có thể tìm hiểu thêm về chương trình học bổng Google AI Essentials tại địa chỉ: https://grow.google/ai-essentials/ Cũng trong sự kiện, bà Xiuxian Ho - giám đốc truyền thông của Google phụ trách khu vực Singapore và Việt Nam tại Châu Á Thái Bình Dương - giới thiệu cho học sinh những bước tiến mới trong nền tảng Gemini của Google và hướng dẫn các bạn trẻ gia tăng hiệu suất của Gemini thông qua tối ưu hóa hiệu từ khóa, dữ liệu. Còn ông Lê Văn Thành - kỹ sư giải pháp từ Google - cùng các bạn trẻ đến từ Google Developers Group đã hướng dẫn học sinh, sinh viên tham dự những cách ứng dụng AI, tự tạo một CV hiệu quả bằng công cụ AI và thực hành viết bài luận, nội dung sáng tạo với AI. Biết dùng AI là chưa đủ Bác sĩ chuyên khoa 1 Trương Chí Bảo thuộc Nha khoa Nhân Tâm nhấn mạnh rằng khi sử dụng AI trong học tập và công việc, người dùng cần có một nền tảng kiến thức vững chắc để có thể kiểm tra và đánh giá thông tin mà AI cung cấp.  Đặc biệt với những ngành đòi hỏi kiến thức chuyên môn sâu như y khoa, người dùng không thể phó thác hoàn toàn vào AI. Tương tự, ông Đặng Anh Tuấn - phó tổng thư ký tòa soạn, giám đốc trung tâm phát triển nội dung số báo Tuổi Trẻ - cho rằng khi công nghệ AI phát triển nhanh chóng, việc cập nhật kiến thức mới là rất quan trọng.  Tham gia các khóa học, workshop và các chương trình giáo dục liên quan đến AI sẽ giúp học sinh và sinh viên không ngừng mở rộng hành trang AI của mình. Tuy nhiên theo ông Tuấn, người dùng luôn cần đặt câu hỏi và kiểm tra tính xác thực của dữ liệu và kết quả do AI đưa ra. Có như thế, các bạn trẻ sẽ không những không lệ thuộc vào công nghệ, mà còn tư duy đánh giá thông tin độc lập. TS Lê Văn Quốc Anh - trưởng khoa công nghệ thông tin, Trường ĐH Giao thông Vận tải TP.HCM - cho biết dự kiến từ năm học sau, môn “Nhập môn AI” sẽ được đưa vào giảng dạy cho mọi sinh viên mọi ngành học tại trường.  Môn học này sẽ giúp các bạn có hiểu biết cơ bản về cách thức hoạt động của AI, các thuật toán liên quan và cách ứng dụng. Theo TS Lê Văn Quốc Anh, bên cạnh biết dùng AI, các bạn trẻ cũng cần nắm được các vấn đề đạo đức, pháp luật khi sử dụng AI như quyền riêng tư, an toàn dữ liệu. Trên nền tảng này, người dùng AI mới có thể sử dụng những công nghệ mới này một cách có trách nhiệm nhất.",11/05/2024 18:30 GMT+7,https://tuoitre.vn/google-dong-hanh-viet-nam-phat-trien-ai-20240511173514713.htm,"Đây là thông điệp xuyên suốt được các diễn giả, chuyên gia từ Google đưa ra trong sự kiện AI Day."
