Title,Content,Date,Url,Summary
Website giáo dục giới tính cho bạn trẻ Việt Nam được Úc tài trợ,"Tổ chức phi chính phủ quốc tế MSI Reproductive Choices tại Việt Nam (MSIVN) chuyên hoạt động nâng cao nhận thức về sức khỏe sinh sản và Weploy (Úc) vừa cho ra mắt nền tảng website giáo dục giới tính ""Like it is - Nó là thế đó!"". Dự án được Chính phủ Úc tài trợ tài chính. Trang web nolathedo.vn có hơn 100 tài nguyên dưới nhiều dạng bài viết, hình ảnh, video, podcast, game… cung cấp các thông tin cho những bạn trẻ, học sinh, sinh viên được phân loại theo độ tuổi, từ những nội dung hiểu về cơ thể, dậy thì, đến các kiến thức về giới tính, tình dục an toàn, các biện pháp tránh thai… Học sinh, sinh viên có thể tìm hiểu các vấn đề khá phổ biến trong giáo dục giới tính như hiểu về kinh nguyệt, sử dụng bao cao su, viên uống tránh thai. Một số câu chuyện nghe qua tưởng chừng ""khó nói"" cũng được các chuyên gia ""bật mí"" như ""cô bé"" thay đổi theo thời gian như thế nào, những màu sắc của ""cô bé"", chuyện ""tự sướng"" ở bạn nam… Những vấn đề ""gai góc"" hơn như nhận diện xâm hại tình dục, quấy rối tình dục nơi làm việc, quấy rối tình dục trên Internet… cũng được các chuyên gia chia sẻ cho các bạn trẻ truy cập website. Bà Nguyễn Thị Bích Hằng, giám đốc quốc gia tổ chức MSI Reproductive Choices tại Việt Nam, cho biết website ra đời xuất phát từ việc các chuyên gia nhận thấy tâm lý e ngại giáo dục giới tính của nhiều phụ huynh Việt Nam. Trong khi đó, theo báo cáo của Vụ Sức khỏe Bà mẹ Trẻ em, Bộ Y tế, giai đoạn 2019-2021, mỗi năm Việt Nam có khoảng 200.000 ca phá thai, trong đó 30% là phụ nữ 15-19 tuổi với 70% là học sinh sinh viên. Hằng năm có thêm 3.000 ca phá thai ở tuổi vị thành niên tại các cơ sở y tế công lập. Thực tế có thể cao hơn rất nhiều, do hơn 40% ca phá thai ở Việt Nam được thực hiện ở cơ sở tư nhân. ""Một số cha mẹ cho biết chia sẻ tình dục là chuyện nhạy cảm, cấm kỵ trong gia đình. Số khác phụ huynh nghĩ rằng con còn quá nhỏ, quá sớm để dạy về giới tính hoặc không nên vẽ đường cho hươu chạy"", bà Hằng nói. Mặt khác theo Weploy, các tài nguyên giáo dục sức khỏe giới tính, sức khỏe sinh sản hiện vẫn còn khó tiếp cận. Khảo sát gần đây của Weploy thực hiện khảo sát trên nhóm người trẻ từ 18 đến 30 tuổi tại Việt Nam cho thấy hơn 80% người được hỏi rất quan tâm tìm hiểu các kiến thức về chăm sóc sức khỏe sinh sản, sức khỏe tình dục nhưng khó tìm thấy các thông tin chính thống đáp ứng nhu cầu. Bên cạnh website cung cấp kiến thức thông tin, trong thời gian tới MSIVN và Weploy sẽ tổ chức thêm các chương trình đào tạo, tư vấn phi lợi nhuận nhằm nâng cao nhận thức về giáo dục giới tính, sức khỏe sinh sản phù hợp với học sinh, sinh viên và các bạn lao động trẻ tại Việt Nam.",14/05/2024 14:25 GMT+7,https://tuoitre.vn/website-giao-duc-gioi-tinh-cho-ban-tre-viet-nam-duoc-uc-tai-tro-20240514133259914.htm,"Nguồn tài nguyên từ bài viết, video, podcast đề cập đến các chủ đề 'khó nói' giúp học sinh, sinh viên và các lao động trẻ hiểu hơn về giáo dục giới tính."
16.252 học sinh ở TP.HCM không đăng ký thi lớp 10,"Theo thống kê của Sở Giáo dục và Đào tạo TP.HCM, năm học 2024-2025 TP.HCM chỉ có 98.681/114.933 học sinh lớp 9 đăng ký thi lớp 10. 16.252 học sinh còn lại không đăng ký thi. Giải thích về vấn đề trên, ông Lê Hoài Nam - phó giám đốc Sở Giáo dục và Đào tạo TP.HCM - cho biết: ""16.252 học sinh lớp 9 không đăng ký dự thi lớp 10 các trường THPT công lập là vì các em đã chủ động lựa chọn con đường học tập khác phù hợp với năng lực và hoàn cảnh của mình. Có thể là các em chọn học nghề tại các trường trung cấp, cao đẳng, du học, học hệ giáo dục thường xuyên, học tại các trường THPT tư thục… Trong đó, hình thức học tập được nhiều học sinh chọn lựa là học nghề tại các trường trung cấp, cao đẳng trên địa bàn TP.HCM"", ông Nam thông tin. Theo ông Nam, những năm gần đây, công tác phân luồng học sinh sau THCS ở TP.HCM đã có được một số kết quả khả quan, khi nhiều học sinh chủ động chọn lựa học nghề chứ không thi vào lớp 10 công lập. Hiện tại các trường nghề trên địa bàn TP đã cải tiến rất nhiều, từ việc đổi mới phương pháp giảng dạy cho đến bổ sung cơ sở vật chất hiện đại, đáp ứng nhu cầu thực hành của học viên nghề. Đó là chưa kể ưu đãi đối với học sinh mới tốt nghiệp THCS mà đăng ký học trường nghề sẽ được miễn học phí 100%. Được biết, nhiều năm nay TP.HCM luôn có hơn 15.000 học sinh không đăng ký thi lớp 10. Cụ thể như sau: Năm học 2021-2022, TP.HCM có 99.692 học sinh lớp 9 nhưng chỉ có 83.302 học sinh đăng ký thi tuyển sinh lớp 10 công lập, 16.390 học sinh không thi. Năm học 2022-2023, TP.HCM có 108.297 học sinh lớp 9 nhưng chỉ có 92.517 học sinh đăng ký thi tuyển sinh lớp 10 công lập, 15.780 học sinh không thi. Năm học 2023-2024, TP.HCM có 113.807 học sinh lớp 9 nhưng chỉ có 96.334 học sinh đăng ký thi tuyển sinh lớp 10 công lập, 17.473 học sinh không thi tuyển sinh lớp 10 công lập.",14/05/2024 13:47 GMT+7,https://tuoitre.vn/16-252-hoc-sinh-o-tp-hcm-khong-dang-ky-thi-lop-10-20240514133322363.htm,"Trong số 114.933 học sinh lớp 9 ở TP.HCM năm nay, chỉ có 98.681 em đăng ký thi lớp 10. Như vậy, có 16.252 học sinh không đăng ký thi."
"TP.HCM công bố số thí sinh dự thi lớp 10, tỉ lệ chọi vào từng trường công lập","Đối chiếu giữa số thí sinh dự thi lớp 10 công lập và chỉ tiêu tuyển sinh thì tỉ lệ chọi vào các trường hot ở TP.HCM năm nay như sau: Trường THPT Bùi Thị Xuân: 1 chọi 2,2 Trường THPT Nguyễn Thị Minh Khai: 1 chọi 2,7 Trường THPT Lê Quý Đôn: 1 chọi 2,63 Trường THPT Mạc Đĩnh Chi: 1 chọi 2,24 Trường THPT Gia Định: 1 chọi 2,64 Trường THPT Phú Nhuận: 1 chọi 2,18 Trường THPT Trần Phú: 1 chọi 2,48 Trường THPT Nguyễn Thượng Hiền: 1 chọi 3,16 Trường THPT Trưng Vương 1 chọi 2,32... Chi tiết tỉ lệ chọi vào lớp 10 các trường ở TP.HCM như sau: Theo Sở Giáo dục và Đào tạo TP.HCM, các học sinh sẽ bắt đầu điều chỉnh nguyện vọng thi lớp 10 từ 17h hôm nay đến 17h ngày 19-5. Như vậy học sinh, phụ huynh có 5 ngày để điều chỉnh nguyện vọng. Trong thời gian này, hệ thống chỉ nhận điều chỉnh nguyện vọng, không thêm hoặc loại bỏ thí sinh ra khỏi danh sách. Sở Giáo dục và Đào tạo TP cho biết học sinh điều chỉnh nguyện vọng vẫn sẽ thực hiện trên hệ thống trực tuyến tuyển sinh 10 của Sở Giáo dục và Đào tạo TP.HCM. Sở lưu ý học sinh sẽ theo dõi việc sai sót thông tin trong đăng ký tuyển sinh 10 để chỉnh sửa tại các trường THCS nơi các em đang theo học. Hiện TP.HCM có 115.759 học sinh đang học lớp 9. Số học sinh dự kiến tốt nghiệp lớp 9 năm học 2023 - 2024 là 114.601 học sinh (tỉ lệ 99%). Năm học 2024 - 2025, sở đã giao chỉ tiêu tuyển sinh lớp 10 cho 113 trường THPT công lập là 71.020 học sinh.",14/05/2024 12:19 GMT+7,https://tuoitre.vn/tp-hcm-cong-bo-so-thi-sinh-du-thi-lop-10-ti-le-choi-vao-tung-truong-cong-lap-20240514121335838.htm,Sở Giáo dục và Đào tạo TP.HCM vừa công bố số thí sinh dự thi lớp 10 vào từng trường công lập năm 2024 và tỉ lệ chọi.
Trưởng khoa bị tố vì làm giám đốc doanh nghiệp ngoài trường,"PGS.TS Lê Nguyễn Đoan Duy, trưởng khoa công nghệ thực phẩm Trường đại học Công Thương TP.HCM, đang bị nhiều giảng viên của trường tố việc ông là giám đốc doanh nghiệp tư nhân. Trưởng khoa làm giám đốc có thu nhập 2 nơi Theo phản ánh của các giảng viên, ông Lê Nguyễn Đoan Duy dù đang là trưởng khoa nhưng nhiều năm nay ông làm kinh tế bên ngoài trường. ""Ông Duy là đại diện pháp luật Công ty cổ phần hóa chất Á Châu - chi nhánh Đồng Nai, giám đốc phát triển kinh doanh của Tập đoàn nguyên liệu Á Châu (AIG).  Hiện ông Duy đang có thu nhập, bảng lương 2 nơi. Do quá bận rộn với công việc kinh doanh bên ngoài nên trưởng khoa Duy không còn nhiều thời gian cho việc lãnh đạo khoa, giảng dạy ở trường. Theo các quy định của pháp luật hiện nay (Luật Phòng, chống tham nhũng năm 2018; Luật Viên chức về quyền của viên chức) về hoạt động kinh doanh và làm việc ngoài thời gian và quyết định 15/QĐ-TW năm 2006, thì ông Duy đang vi phạm. Chúng tôi đã nhiều lần tố cáo vi phạm của ông Duy đến lãnh đạo nhà trường nhưng vẫn không ai xử lý"", một số giảng viên cho biết. Bên cạnh đó, một số giảng viên khác cũng phản ánh do ông Duy hiện đang sở hữu một lượng lớn cổ phiếu của công ty nên ""người ở trường mà tâm hồn ngoài doanh nghiệp"".  Điều này dẫn đến việc ông Duy không nghiêm túc trong giảng dạy (nghỉ dạy, ra ngoài nghe điện thoại)… ""Làm thêm ngoài doanh nghiệp để hỗ trợ cho chuyên môn giảng dạy"" Trao đổi với Tuổi Trẻ Online, ông Lê Nguyễn Đoan Duy cho hay ông bắt đầu công tác tại Trường đại học Công Thương TP.HCM từ ngày 21-7-2020 theo chính sách thu hút cán bộ của nhà trường (chuyển công tác từ Trường đại học Bách khoa - Đại học Quốc gia TP.HCM). ""Hợp đồng của tôi có thời hạn 5 năm, sẽ kết thúc vào 30-6-2025. Hiện tại những công việc tại trường cũng như tại doanh nghiệp cũng là theo đúng những yêu cầu và cam kết của tôi với trường.  Từ tháng 7-2020 đến nay, tôi luôn được đánh giá hoàn thành xuất sắc nhiệm vụ trên cương vị giảng viên và quản lý khoa"", ông Duy khẳng định. Đồng thời, ông Duy xác nhận có hợp tác với một tập đoàn ngoài trường trong vai trò giám đốc công nghệ/giám đốc phát triển và là đại diện pháp luật của chi nhánh Đồng Nai thuộc công ty hóa chất từ tháng 12-2020. Ông Duy cho rằng: ""Đây là công việc có liên quan đến nghiệp vụ chuyên môn ngành công nghệ thực phẩm, hoạt động nghề nghiệp ngoài thời gian làm việc này hỗ trợ cho chuyên môn giảng dạy, nghiên cứu khoa học và tạo ra nhiều cơ hội cho sinh viên được đào tạo và tiếp xúc với thực tế tại doanh nghiệp"". Cũng theo ông Duy, Trường đại học Công Thương TP.HCM là trường tự chủ về tài chính và đào tạo sinh viên theo định hướng ứng dụng, vì vậy luôn có sự kết nối chặt chẽ với doanh nghiệp. Đặc biệt trường là đơn vị giáo dục đầu tiên thực hiện học kỳ doanh nghiệp, trong đó sinh viên thực hiện đề tài tốt nghiệp trực tiếp tại doanh nghiệp dưới sự hướng dẫn của cán bộ doanh nghiệp, được gọi là giảng viên doanh nghiệp và các cán bộ này cũng sẽ tham gia vào hội đồng chấm tốt nghiệp. ""Vì vậy nhà trường luôn khuyến khích cán bộ làm việc cùng doanh nghiệp để hiểu rõ nhu cầu thực tế nhằm đáp ứng được tốt hơn những kỳ vọng của doanh nghiệp đối với sinh viên. Đây là một hướng mở để khuyến khích thầy cô không chỉ dừng lại ở các kiến thức hàn lâm, sách vở mà cần phải có thực tế.  Hiện tại ở trường cũng có rất nhiều thầy cô làm việc cùng doanh nghiệp, thậm chí mở doanh nghiệp riêng để ứng dụng những đề tài nghiên cứu vào sản xuất thực tế"", ông Duy cho hay. ""Giảng viên phải giỏi, phải giàu thì đi dạy nói sinh viên mới nghe"" Liên quan đến sự việc trên, PGS.TS Nguyễn Xuân Hoàn - hiệu trưởng Trường đại học Công Thương TP.HCM - cho hay khi nhận được đơn tố cáo, lãnh đạo nhà trường đã yêu cầu ông Lê Nguyễn Đoan Duy giải trình và sau đó đã có các cuộc làm việc để làm rõ. Với việc ông Duy là trưởng khoa đồng thời làm giám đốc, đại diện pháp luật của doanh nghiệp ngoài trường là trái với quy định của pháp luật, nên không được làm giám đốc doanh nghiệp bên ngoài.  Nhưng công ty ông Duy đứng tên đại diện pháp luật không có hoạt động. Và công ty ông Duy làm giám đốc này không liên quan hay ""sân sau"" gì của trường. Sau khi lãnh đạo nhà trường và Đảng ủy cấp trên làm việc về vấn đề này, ông Duy đã chuyển đổi người đứng đầu chi nhánh công ty cho người khác. Ông Hoàn cũng đánh giá trưởng khoa Duy là người có chuyên môn tốt. Khoa công nghệ thực phẩm hoạt động rất tốt và luôn hoàn thành tốt nhiệm vụ. ""Thực sự tôi rất thích giảng viên, cán bộ khoa học, thậm chí cán bộ quản lý của trường có doanh nghiệp bên ngoài. Giảng viên đại học phải năng động, phải giỏi, phải giàu thì đi dạy nói sinh viên mới nghe. Đặc biệt các giảng viên khối công nghệ kỹ thuật mà không biết gì về quản lý nhà máy, không gần gũi với doanh nghiệp thì không thể dạy tốt được. Trong cuộc họp đầu năm 2024, tôi đến gặp gỡ khoa và nói rõ quan điểm của trường là khuyến khích cán bộ giảng viên gắn kết hoạt động chuyên môn với doanh nghiệp nhưng không làm ảnh hưởng đến hoạt động giảng dạy"", ông Hoàn nói.",14/05/2024 11:51 GMT+7,https://tuoitre.vn/truong-khoa-bi-to-vi-lam-giam-doc-doanh-nghiep-ngoai-truong-20240514105326552.htm,"Trưởng khoa của một trường đại học đồng thời làm giám đốc phát triển tập đoàn, đại diện pháp luật chi nhánh công ty tư nhân nên bị giảng viên tố vi phạm quy định của pháp luật."
Phát đơn xin không thi tuyển sinh lớp 10: Đáng hay không đáng trách?,"Nhiều bạn đọc cho biết chuyện phát đơn xin không thi tuyển sinh vào lớp 10 không phải cá biệt tại Trường THCS Nguyễn Văn Bứa (Hóc Môn, TP.HCM), cũng không phải chỉ diễn ra mới đây. Học sinh khá cũng được khuyên không tuyển sinh lớp 10 Theo tài khoản lavi****@gmail.com:  ""Vụ việc này đã hình thành vài năm trước đây. Ban giám hiệu họp phụ huynh khối lớp 9 đặt vấn đề: Động viên các em lớp 9 học yếu thì viết đơn không tham dự kỳ thi tuyển vào lớp 10. Bởi các em thi cũng trượt thôi, mà trượt thì làm thành tích của trường tụt xuống.  Các em làm đơn không thi thì nhà trường sẽ nâng điểm để các em học yếu đó đạt tốt nghiệp THCS, rồi đăng ký học lớp 10 trường tư thục hoặc trung tâm giáo dục thường xuyên, trung tâm dạy nghề.  Nếu các em yếu không làm đơn ""không thi tuyển sinh"" thì nhà trường sẽ cho các em rớt lớp 9.  Bản chất sự việc là ""hai bên cùng có lợi"". Nhà trường thì được tỉ lệ học sinh tốt nghiệp 100% và tỉ lệ đậu lớp 10 cao, các em học yếu được tốt nghiệp lớp 9"". Bạn đọc Nguyễn Ngọc Anh kể thêm: ""Ngay tại ngoại thành Hà Nội nơi tôi đang ở, không những giáo viên ép học sinh có học lực yếu mà cả những học sinh trung bình khá cũng không đăng ký tuyển sinh lớp 10. Nhà trường còn tổ chức cho đội ngũ tư vấn các trường trung học nghề để tiếp cận và định hướng cho các em nữa!"". Phản ánh đến Tuổi Trẻ Online, bạn đọc Tuấn chia sẻ ""nỗi buồn của một giáo viên dạy lớp 9"". ""Đó là ngành giáo dục còn nặng nề bệnh thành tích, như quận nơi tôi dạy năm nay đặt chỉ tiêu vào công lập 86%, mỗi môn thi trên trung bình khoảng 70%.  Là giáo viên môn toán, tôi dám chắc một điều rằng chỉ tiêu môn toán trên trung bình 70% rất khó đạt được (trừ những trường top đầu). Điều này gây ra áp lực rất nặng nề cho giáo viên lớp 9. Chính vì bị giao chỉ tiêu quá cao như thế, tất cả hiệu trưởng và giáo viên lớp 9 đều biết không thể đạt được. Do đó họ mới có kế hoạch tư vấn cho các em học còn yếu, học lực trung bình khá lựa chọn không thi tuyển lớp 10.  Nếu còn đánh giá giáo viên, xếp hạng trường THCS theo chỉ tiêu thi tuyển vào lớp 10 thì tình trạng này sẽ không bao giờ chấm dứt"". Chuyện không đáng trách? Tuy nhiên, một số bạn đọc có góc nhìn khác về chuyện này. Bạn đọc Lê Hào viết: ""Nhìn ở mặt tích cực thì nhà trường cho phụ huynh cam kết không thi lên lớp 10 công lập là chuyện không phải đáng trách. Bám sát năng lực học sinh, biết học sinh thi chắc chắn rớt thì tham gia thi làm gì cho tốn tiền của gia đình và xã hội.  Cho các em quen dần với việc muốn làm gì cũng căn cứ vào năng lực, chứ không phải thi cho có, cho vui. Hãy dũng cảm nhìn thẳng vào sự thật cho các em đi theo con đường phù hợp với năng lực mới thức thời và đúng đắn"".  Đồng tình, độc giả Lê Văn Vinh viết: ""Cô thầy làm sai, nhưng bản chất là đúng. Vì nhiều học sinh hiện nay học không biết gì mà cũng được công nhận tốt nghiệp THCS.  Theo tôi, các em học yếu, kém nên chọn học nghề"". Tranh luận lại, bạn đọc Hùng Dũ có ý kiến: ""Trình độ học tập các em có thể khác nhau nhưng hãy nên cho các em thử sức. Nếu không đạt thì học trường nghề cũng không muộn. Nhà trường và giáo viên không được phép tước đoạt cơ hội của các em"". ""Cũng là một lần thử sức trong đời mà, đi thi có mất mát gì đâu, sao không cho các em tham gia. Quan trọng là kỳ thi phải nghiêm túc, hiệu quả"", độc giả Đảm Ý bình luận. Theo bạn đọc Dung: ""Học sinh bây giờ đa số có điều kiện được học hành, cứ động viên và tư vấn cho các em thi theo nguyện vọng. Nếu có rớt thì cũng xem như trải nghiệm sau này trong cuộc sống"".  Bạn đọc Thuy An nhắn gửi: ""Hãy cho các em được hưởng quyền của học sinh, được bình đẳng thi vào lớp 10. Thầy cô nên động viên để các em được thi vào trường cấp 3 mà các em mơ ước. Sau có kết quả em nào không đỗ vào lớp 10 hãy phân luồng.  Tại sao không để sau khi các em thi vào lớp 10, em nào không đỗ thì phân luồng. Lúc đó các em học nghề, học trường dân lập, trung tâm giáo dục thường xuyên vẫn chưa muộn mà"". Cùng quan điểm, độc giả Nhật viết: ""Việc một học sinh có thể tốt nghiệp THCS và vào THPT nên được đánh giá thông qua kỳ thi, chứ không phải ý kiến chủ quan của giáo viên. Nếu thầy cô đánh giá tốt nghiệp được thì xét tốt nghiệp, chứ cần chi phải tổ chức kỳ thi cho tốn kém"". Và tài khoản BKT đặt vấn đề: ""Chuyện phát đơn không thi tuyển lớp 10 liệu có đi ngược với giá trị vốn có của giáo dục là kích thích sự tích cực của người học? Chuyện này không thể bắt nguồn chỉ từ mỗi giáo viên!"". ",14/05/2024 10:01 GMT+7,https://tuoitre.vn/phat-don-xin-khong-thi-tuyen-sinh-lop-10-dang-hay-khong-dang-trach-20240513092015905.htm,Việc giáo viên phát đơn xin không thi tuyển sinh lớp 10 cho học sinh trường THCS ở TP.HCM gây dư luận bức xúc. Tuy nhiên không ít ý kiến trái chiều.
