Title,Content,Date,Url,Summary
Làm gì để Việt Nam có các nhóm nghiên cứu khoa học xuất sắc?,"Đây là thông tin vừa được ông Trần Hồng Thái - thứ trưởng Bộ Khoa học và Công nghệ - chia sẻ trong buổi tọa đàm ""Xây dựng các nhóm nghiên cứu xuất sắc"" diễn ra ngày 13-5, do tạp chí Tia Sáng và quỹ phát triển khoa học và công nghệ quốc gia Nafosted tổ chức. Sẽ không tập trung hướng nghiên cứu quá ưu tiên vào công bố quốc tế Phát biểu tại tọa đàm, Thứ trưởng Bộ Khoa học và Công nghệ Trần Hồng Thái cho hay cách đây khoảng 10 năm Việt Nam có rất ít công bố quốc tế, gặp nhiều khó khăn do ngoại ngữ, trình độ, nền tảng khoa học. Từ khi quỹ Nafosted đi vào hoạt động góp phần hỗ trợ hoạt động nghiên cứu khoa học, trung bình hằng năm tỉ lệ các bài công bố khoa học quốc tế uy tín của Việt Nam tăng khoảng 20%/năm. Đến nay có khoảng 18.000 công bố quốc tế uy tín hằng năm. Bên cạnh đó, nhiều trường đại học, đại học được xếp hạng cơ sở đào tạo trong top thế giới như Đại học Quốc gia Hà Nội, Đại học Quốc gia TP.HCM, Đại học Bách khoa Hà Nội… Theo ông Thái, nền khoa học công nghệ của Việt Nam như một cơ thể, các nhóm nghiên cứu mạnh như những tế bào. Khi cơ thể muốn khỏe mạnh, muốn phát triển được thì các tế bào phải vững mạnh. Vì vậy, ông Thái cho rằng việc đẩy mạnh các nhóm nghiên cứu mạnh phát triển tại Việt Nam chính là sự kết nối lâu dài, là sự bình ổn để các cơ sở nghiên cứu tồn tại và phát triển trong tương lai. ""Nếu chỉ tập trung phát triển các nhà khoa học riêng lẻ mà không có các nhóm nghiên cứu mạnh thì đó chỉ là phát triển các cá thể cá nhân. Khi các nhà khoa học chuyển công tác thì nhóm nghiên cứu ấy sẽ biến mất ở cơ sở nghiên cứu đó. Thực tiễn tại Việt Nam việc này đã diễn ra nhiều lần"", ông Thái nói. Ông Thái cho biết thời gian tới, Bộ Khoa học và Công nghệ sẽ không quá ưu tiên, tập trung vào các hướng nghiên cứu dàn trải; không tập trung vào hướng nghiên cứu quá ưu tiên cho mục tiêu công bố quốc tế, mà sẽ có ưu tiên cho các nhà khoa học trẻ, hỗ trợ tăng cường năng lực của các nhà khoa học trẻ. Làm gì để nhà khoa học yên tâm nghiên cứu dài hơi? Bà Nguyễn Thị Thu Oanh - nguyên phó viện trưởng Viện Đánh giá khoa học và định giá - cho rằng chi phí đầu tư cho nghiên cứu và triển khai khoa học công nghệ còn thấp, chỉ tăng về tổng số tiền đầu tư nhưng lại tụt so với tỉ lệ phần trăm GDP các năm trước. ""Tôi rất ngạc nhiên khi Bộ Khoa học và Công nghệ đang quản lý 43 chương trình khoa học công nghệ trọng điểm, quốc gia, đây là một con số quá lớn. Năm 2020, tổng các chương trình của các bộ, ngành mới là khoảng 36-37 chương trình. Với kinh phí thấp mà lại đầu tư dàn trải quá nhiều chương trình như vậy thì cần hết sức lưu ý"", bà Oanh nói. Tương tự, GS.TS Hoàng Anh Tuấn - hiệu trưởng Trường đại học Khoa học xã hội và Nhân văn, Đại học Quốc gia Hà Nội - cho rằng phần lớn các trường đại học chưa tương xứng, chưa đủ điều kiện cho các nhóm nghiên cứu hoạt động mạnh. Nguyên nhân từ nhiều yếu tố như thiếu kinh phí, cơ chế, yêu cầu đầu ra. ""Khi hình thành nhóm nghiên cứu mạnh, nếu không khéo mà sa đà vào các công việc cụ thể không hướng tới cụm sản phẩm mà có thể phát triển đội ngũ, chiến lược phát triển con người về mặt năng lực khoa học thì sau 3 - 5 năm, nhóm nghiên cứu không những không phát triển được mà còn thụt lùi so với xu hướng về khoa học"", ông Tuấn nói.",13/05/2024 16:26 GMT+7,https://tuoitre.vn/lam-gi-de-viet-nam-co-cac-nhom-nghien-cuu-khoa-hoc-xuat-sac-20240513152753408.htm,"Thời gian tới, Bộ Khoa học và Công nghệ sẽ không quá ưu tiên, tập trung vào các hướng nghiên cứu khoa học dàn trải, mục tiêu công bố quốc tế, mà sẽ ưu tiên phát triển các nhà khoa học trẻ."
"19h tối nay 13-5, hệ thống Trường Me Since 1988 lên sóng Khám phá trường học","Với hệ thống cơ sở vật chất học tập và giải trí được đầu tư bài bản và hiện đại, Me Since 1988 là môi trường giáo dục liên cấp mầm non - tiểu học khơi nền tảng, xây động lực cho trẻ học tập và phát triển tiềm năng của mình. Nhà trường áp dụng phương pháp Montessori, tiếng Anh hoàn toàn với giáo viên nước ngoài, giáo cụ đa dạng và môi trường thân thiện. Me Since 1988 còn đưa các môn thực hành cuộc sống như nấu ăn, làm mộc, may thêu… vào chương trình giảng dạy để giúp các con có sự quan sát tốt hơn và áp dụng những kiến thức, kỹ năng vào cuộc sống hằng ngày ngay từ rất nhỏ. Trong số phát sóng Khám phá trường học tối nay, nữ MC Lê Tam Triều Dâng sẽ đưa quý khán giả dạo một vòng quanh không gian học tập tại Me Since 1988, qua đó có những hình dung cụ thể về cơ sở vật chất, đội ngũ giáo viên và chất lượng giảng dạy tại hệ thống giáo dục này. Đại diện của Me Since 1988 cũng sẽ có mặt để chia sẻ đến quý phụ huynh những thông tin về nhà trường cũng như những chương trình học phí, ưu đãi trong mùa nhập học tới đây. Chương trình sẽ được phát sóng vào lúc 19h tối nay trên tuoitre.vn và kênh YouTube báo Tuổi Trẻ. Cùng theo dõi một số hình ảnh trong số phát sóng tối nay tại Me Since 1988:",13/05/2024 15:49 GMT+7,https://tuoitre.vn/19h-toi-nay-13-5-he-thong-truong-me-since-1988-len-song-kham-pha-truong-hoc-20240513153910106.htm,"Chuyến xe Khám phá trường học tiếp tục đưa khán giả tham quan một cơ sở giáo dục mới, lần này là hệ thống Trường Me Since 1988 tại TP.HCM."
Gen Z tự tin với cách học Quản trị kinh doanh khác biệt,"Tại Trường Đại học Công nghệ TP.HCM (HUTECH), Quản trị kinh doanh hút lượng lớn thí sinh đăng ký xét tuyển và theo học mỗi năm, vì độ hot của ngành cũng như phương pháp đào tạo thực tiễn với những cách học độc lạ mang lại hiệu quả không ngờ. Thử sức làm nhà quản trị với phương pháp học mô phỏng Với những ngành nghề yêu cầu cao sự năng động và tố chất quản trị như Quản trị kinh doanh, việc học tập không chỉ gắn với giảng đường truyền thống, mà còn linh hoạt biến hóa theo nhiều hình thức đa dạng để sinh viên tích lũy kiến thức lẫn kinh nghiệm thực tế.  Một trong những cách học được Gen Z liên tục thả tim là thực hành qua hình thức học mô phỏng. Và phương pháp học này không xa lạ với sinh viên trường. Tại các phòng thực hành hiện đại, các nhóm sinh viên ‘thành lập’ doanh nghiệp với các chức danh cụ thể như giám đốc kinh doanh, giám đốc tài chính, giám đốc nhân sự, trưởng phòng marketing... Vận hành như một doanh nghiệp thực thụ, chính sinh viên lên chiến lược, lập kế hoạch và giải quyết tình huống cụ thể do ""khách hàng"" (giảng viên, nhóm phản biện) đưa ra. Từ đó, sinh viên có cơ hội nâng cao kiến thức chuyên môn, rèn bản lĩnh, phát triển các kỹ năng cần thiết và tích lũy kinh nghiệm làm việc trong môi trường kinh doanh. Các sân chơi khởi nghiệp hoành tráng Hầu hết các bạn trẻ khi học Quản trị kinh doanh đều có máu kinh doanh và đam mê khởi nghiệp. Các sân chơi khởi nghiệp vì thế là nơi vừa chơi vừa học hiệu quả để sinh viên ‘thử lửa’ bản thân, củng cố chuyên môn và phát triển bản lĩnh doanh nhân. Học tại ngôi trường năng động, sinh viên được thử sức ở nhiều sân chơi khởi nghiệp lớn, trong đó phải kể đến HUTECH Startup Wings. Tại cuộc thi này, sinh viên được khuyến khích phát hiện và hình thành những ý tưởng sáng tạo mới hoặc phát triển từ các đề tài nghiên cứu khoa học các cấp, đồ án môn học ở đa dạng các lĩnh vực.  Các bạn được trang bị kỹ năng xây dựng mô hình kinh doanh, quản trị tài chính, phương thức trình bày dự án khởi nghiệp cũng như triển lãm quảng bá thương hiệu, sản phẩm đến gần hơn với cộng đồng. Không hề đơn thương độc mã mà trên mỗi bước đi, những nhà khởi nghiệp trẻ của Trường luôn được đồng hành từ hội đồng mentor là những chuyên gia khởi nghiệp dày dạn kinh nghiệm. Qua quá trình tương tác, sinh viên mở rộng tầm nhìn và phát triển tư duy chiến lược, từ đó có định hướng phù hợp để hoàn thiện ý tưởng khởi nghiệp ban đầu.  Được biết, sân chơi này đã trở thành bệ phóng khởi nghiệp cho nhiều dự án của sinh viên Quản trị kinh doanh, nhiều bạn đã vươn ra biển lớn và thành công. Đối thoại cùng doanh nhân Một kiểu học của sinh viên Quản trị kinh doanh Trường nữa khiến dân tình phát hờn là liên tục gặp gỡ, giao lưu, học hỏi cùng những doanh nhân thành đạt qua các chương trình đối thoại cùng CEO, hội thảo, tọa đàm, talkshow được tổ chức thường xuyên.  Đây là cơ hội để các bạn bỏ túi những kinh nghiệm làm việc từ chính những người trong nghề, học hỏi bản lĩnh chinh chiến trên thương trường. Chẳng hạn như ở Hội thảo Hành trình kinh doanh từ giảng đường đến đại siêu thị, sinh viên được lắng nghe các diễn giả là các lãnh đạo cấp cao của Trung tâm MM Mega Market, VGROUP & VTG, Công ty CP San Media chia sẻ nhiều câu chuyện về quá trình khởi nghiệp ngay từ khi còn học đại học, các vấn đề về bán lẻ, hành trình để phát triển từ một sinh viên mới ra trường đến nhà quản trị cấp cao,… Qua đối thoại, sinh viên được lĩnh hội nhiều bài học thực tế giá trị để tự tin bước vào nghề. Sinh viên thêm hiểu biết thực tế hơn khi các bạn được tham quan, trải nghiệm tại các ông lớn tên tuổi trong lĩnh vực kinh doanh như Cengroup Miền Nam, Lotte Mart, Tập đoàn Tân Á Đại Thành.  Với sự đồng hành của lãnh đạo, chuyên viên ngay tại doanh nghiệp, các bạn được trực tiếp tiếp cận môi trường làm việc chuyên nghiệp, quy trình làm việc, phân bổ công việc của từng bộ phận, phương thức vận hành của một doanh nghiệp lớn. Đây là dịp để sinh viên sớm kết nối với thị trường lao động, tạo lợi thế đáng kể trên hành trình sự nghiệp, sẵn sàng làm giàu.",13/05/2024 15:00 GMT+7,https://tuoitre.vn/gen-z-tu-tin-voi-cach-hoc-quan-tri-kinh-doanh-khac-biet-20240513095632452.htm,Quản trị kinh doanh luôn có sức hút mạnh mẽ đối với Gen Z và là một ngành hot mỗi mùa tuyển sinh đại học.
Ngành quan hệ công chúng thu hút gen Z,"Luôn là ngành xu hướng Sức hút của ngành quan hệ công chúng xuất phát từ sự đa dạng nghề nghiệp, lĩnh vực hoạt động và nguồn nhân lực luôn khát. Đây là ngành học có khối kiến thức mở và thích ứng nhanh, đặc biệt trong việc tiếp cận các mảng như công nghệ, AI hay marketing. Quan hệ công chúng cũng được xem là ngành học mang lại nhiều giá trị thương mại cho doanh nghiệp, tổ chức.  Ngoài doanh số, định vị và phát triển thương hiệu, xây dựng mối quan hệ,... ngành còn tạo ra những giá trị tích cực cho cộng đồng, xã hội như lồng ghép khéo léo trong chiến lược phát triển, đặt để các mục tiêu cộng đồng, tạo hiệu ứng tích cực và mang lại nhiều giá trị tốt đẹp cho xã hội. Sự đa dạng trong hướng học tập chuyên sâu còn giúp sinh viên ra trường có thể thực chiến được ở nhiều vị trí công việc khác nhau như chuyên viên quan hệ công chúng, chuyên viên truyền thông, phóng viên, biên tập viên, MC…  Sự linh động trong nghề nghiệp và xu hướng đã thu hút một lượng lớn các bạn trẻ lựa chọn theo đuổi, làm cho sức nóng của ngành ngày một tăng theo từng năm. Sáng tạo cùng thực chiến làm nên điểm mạnh Đứng trước xu hướng phát triển ngành quan hệ công chúng, hàng loạt các cơ sở giáo dục đại học đã nghiên cứu, tổ chức kiểm định và đưa ngành học này vào chương trình đào tạo. Điều này đã đặt ra cho các bạn trẻ nhiều sự lựa chọn. Với những bạn trẻ mong muốn học tập trong môi trường đề cao tính thực chiến, chú trọng tiếng Anh, cơ hội học tập quốc tế, học song ngành, song bằng thuận lợi thì Trường Đại học Kinh tế - Tài chính TP.HCM (UEF) sẽ là một lựa chọn phù hợp. Trường đào tạo chương trình song ngữ, quốc tế với không gian học tập năng động, tự do sáng tạo, một trong những tiêu chí của sinh viên ngành PR. Đội ngũ giảng viên giàu kinh nghiệm cả trong và ngoài nước sẽ mang đến cho sinh viên kiến thức về ngành một cách chuyên sâu. Bên cạnh đó là vốn kiến thức thực tiễn từ thầy, cô đến từ doanh nghiệp. Với việc đào tạo gắn kết thực tiễn, Trường tạo mọi điều kiện cho sinh viên tiếp xúc với doanh nghiệp, cọ xát công việc cụ thể để tích lũy kinh nghiệm. Sinh viên ngành PR liên tục có những chuyến học tập thực tế ở các đài truyền hình, phát thanh, công ty, tập đoàn về truyền thông lớn.  Ở đó, các bạn được lắng nghe câu chuyện từ các anh, chị là quản lý, giám đốc về hoạt động quan hệ công chúng và truyền thông của đơn vị, được tiếp cận với công việc tương lai một cách trực quan nhất. Đây là cách học thực hành đạt hiệu quả cao mà trường chú trọng trong chương trình đào tạo. Ngành học được trợ lực lớn từ học bổng toàn khóa học Chọn theo học ngành quan hệ công chúng tại Trường, sinh viên còn được nhận học bổng doanh nghiệp 35% toàn khóa học khi trúng tuyển. Học đúng chuyên môn, nắm bắt thế mạnh nghề nghiệp để tạo khác biệt, song song đó là chi phí học tập phù hợp chính là những điểm cộng lớn để sinh viên nắm vững tương lai nghề nghiệp khi ra trường. Qua nhiều khóa đào tạo, sinh viên ngành quan hệ công chúng của UEF đã chính thức cộng tác tại các đơn vị, công ty trước khi tốt nghiệp. Tỉ lệ sinh viên có việc làm ngay sau tốt nghiệp theo thống kê luôn đạt 94%.  Từ nền tảng kiến thức vững chắc mà trường trang bị, nhiều sinh viên cũng nắm bắt cơ hội phát triển năng lực nghiên cứu ở nước ngoài hay tham gia các học kỳ quốc tế để tiếp thu tri thức toàn cầu trong lĩnh vực PR, truyền thông. Với UEF, mỗi sinh viên được khuyến khích khám phá và phát huy tối đa tiềm năng của bản thân trong từng ngành học. Một môi trường học tập năng động, tiếp động lực nghề nghiệp, đảm bảo mọi kiều kiện để người học thích ứng bối cảnh sẽ là nền tảng vững chắc để sinh viên tự tin có bước khởi đầu vững chắc ở bất kỳ vị trí công việc nào khi chọn ngành học. Hiện Trường nhận hồ sơ xét tuyển học bạ ngành quan hệ công chúng đến ngày 31-5. Thí sinh có thể đăng ký theo hình thức xét học bạ lớp 12 của tổ hợp ba môn hoặc xét điểm trung bình học bạ ba học kỳ với mức điểm từ 18 trở lên.",13/05/2024 15:00 GMT+7,https://tuoitre.vn/nganh-quan-he-cong-chung-thu-hut-gen-z-2024051310021832.htm,Sức hút ngành quan hệ công chúng tăng dần và liên tục thu hút thí sinh quan tâm trên các diễn đàn nghề nghiệp.
Tuyển sinh lớp 10 tại TP.HCM: 5 ngày để thay đổi nguyện vọng,"17h hôm qua (12-5), việc đăng ký nguyện vọng tuyển sinh lớp 10 năm học 2024-2025 tại TP.HCM bằng hình thức trực tuyến đã kết thúc. Từ 12-5 đến chậm nhất là 17h ngày 13-5, các phòng giáo dục và đào tạo rà soát việc nhập liệu của các cơ sở (kể cả việc nhập liệu cho các đối tượng được tuyển thẳng) và tiến hành khóa dữ liệu. Chậm nhất là 18h ngày 13-5, Sở Giáo dục và Đào tạo TP.HCM sẽ khóa cổng đăng ký tuyển sinh lớp 10 đợt 1. Sau thời điểm này, thí sinh và các đơn vị không thể thêm hay loại bỏ đăng ký dự thi. Đăng ký tuyển sinh lớp 10 được điều chỉnh những gì? Theo công bố của Sở Giáo dục và Đào tạo TP.HCM, dự kiến chậm nhất là 16h ngày 14-5, Sở Giáo dục và Đào tạo TP.HCM sẽ phổ biến số liệu tổng hợp về số lượng học sinh đăng ký vào từng trường (nguyện vọng 1). Dự kiến từ 17h ngày 14-5 đến chậm nhất là 17h ngày 19-5, phụ huynh và học sinh có thể điều chỉnh, thay đổi nguyện vọng. Trong thời gian này, hệ thống chỉ nhận điều chỉnh nguyện vọng, không thêm hoặc loại bỏ thí sinh ra khỏi danh sách. Bà Nguyễn Xuân Mai - phó trưởng phòng khảo thí và kiểm định chất lượng (Sở Giáo dục và Đào tạo TP.HCM) - lưu ý lúc này phụ huynh cần theo dõi chặt chẽ thông tin và cân nhắc vì đây là cơ hội một lần để học sinh điều chỉnh nguyện vọng. ""Các em có thể điều chỉnh nguyện vọng từ trường này qua trường khác căn cứ số lượng nguyện vọng 1 vào các trường mà Sở Giáo dục và Đào tạo TP.HCM công bố. Học sinh có thể điều chỉnh nguyện vọng trong khung thời gian cho phép này. Và sau khung thời gian này thì không điều chỉnh được nữa"" - bà Mai lưu ý. Theo bà Mai, trong khoảng thời gian này, đối với việc đăng ký nguyện vọng thường, học sinh có thể điều chỉnh các nguyện vọng thường 1, 2, 3. Việc điều chỉnh này có thể thay đổi nguyện vọng của thí sinh từ trường này sang trường kia cả trong ba nguyện vọng thường. Đối với việc đăng ký nguyện vọng chuyên hoặc tích hợp, trong đợt này, học sinh không thể đăng ký việc tuyển sinh vào các lớp chuyên hoặc tích hợp nếu trước đó chưa đăng ký. Chiều 12-5, trả lời Tuổi Trẻ, một cán bộ Sở Giáo dục và Đào tạo TP.HCM cho biết dự kiến hết ngày 13-5, sở sẽ có hướng dẫn việc chỉnh sửa nguyện vọng. Để chỉnh sửa nguyện vọng và sai sót, theo Sở Giáo dục và Đào tạo TP.HCM, phụ huynh học sinh theo dõi thông tin tại trường THCS nơi các em đang theo học là chính xác nhất. Năm nay, học sinh đăng ký tuyển sinh 10 vào các trường công lập tại TP.HCM cũng được hướng dẫn đăng ký tổ hợp khi đăng ký nguyện vọng vào các trường THPT thường.  Về việc này, Sở Giáo dục và Đào tạo TP.HCM cho biết những nội dung đăng ký tổ hợp này chỉ mang tính chất tham khảo để sở tổng hợp gửi về trường, chưa phải là tổ hợp chính thức khi học sinh theo học tại trường đó. Học sinh, phụ huynh cần làm gì? Chỉ còn khoảng 3 tuần nữa là học sinh lớp 9 tại TP.HCM sẽ bước vào kỳ thi tuyển sinh 10. Từ ngày 14 đến 19-5 là khoảng thời gian học sinh được điều chỉnh nguyện vọng 1, 2, 3 vào trường THPT thường. Lúc này, phụ huynh và học sinh cần cân nhắc thực sự để nếu có thì điều chỉnh nguyện vọng cho chính xác với năng lực, sở thích. ""Cần chọn trường THPT phù hợp với năng lực học tập bởi theo chương trình giáo dục phổ thông 2018 ở bậc THPT, ngay từ đầu năm lớp 10, học sinh phải chọn 4 trong 9 môn học lựa chọn theo năng lực, sở thích gắn với định hướng nghề nghiệp. Tùy điều kiện về cơ sở vật chất, đội ngũ giáo viên, mỗi trường sẽ có kế hoạch giảng dạy phù hợp với năng lực học sinh"" - bà Mai lưu ý. Những ngày qua, Trường THCS Nguyễn Du, quận 1 đang ôn tập cho học sinh lớp 9 chuẩn bị thi vào lớp 10.  ""Qua những gì giáo viên thu nhận được từ các kết quả ôn tập của học sinh, tôi thấy các em có kiến thức nhưng vẫn còn nhiều vấn đề trong kỹ năng làm bài. Vì thế, thời điểm này, ngoài việc ôn tập và chú trọng đến những bài học, đề thi, phụ huynh cần chia sẻ, đồng hành cùng con em để các em tự tin bước vào lớp 10"" - cô Nguyễn Đoan Trang, hiệu trưởng Trường THCS Nguyễn Du, lưu ý. Cũng theo cô Trang, để đạt được kết quả mong muốn, các em phải thật bình tĩnh, tự tin và không được căng thẳng, áp lực, gây xáo trộn đến tâm lý.  ""Nhà trường mong đợi các em đi thi cũng thể hiện được hết năng lực ở trên lớp trên trường, vì thế phụ huynh cần động viên, chia sẻ, đồng hành cùng các con trong ôn luyện, chăm sóc sức khỏe thể chất và tinh thần"" - cô Trang nhấn mạnh. ",13/05/2024 10:05 GMT+7,https://tuoitre.vn/tuyen-sinh-lop-10-tai-tp-hcm-5-ngay-de-thay-doi-nguyen-vong-20240513084723625.htm,"Dự kiến bắt đầu từ 17h ngày mai 14-5, học sinh lớp 9 ở TP.HCM sẽ có 5 ngày để thay đổi nguyện vọng tuyển sinh lớp 10."
