Title,Content,Date,Url,Summary
Cuối cùng có thành lập Trường THCS-THPT Trần Đại Nghĩa không?,"Đó là thắc mắc của rất nhiều phụ huynh có con sắp bước vào kỳ thi tuyển sinh lớp 10 năm 2024 ở TP.HCM. Chị Nguyễn Ngọc Mai, phụ huynh ở quận 1, bức xúc: ""Trong danh sách các trường tuyển sinh lớp 10 năm học 2024-2025, tôi thấy có Trường THCS-THPT Trần Đại Nghĩa (tức Trường Trần Đại Nghĩa mới tách ra từ Trường THPT chuyên Trần Đại Nghĩa - PV). Trường này dự kiến tuyển 205 học sinh lớp 10 nên tôi đã đăng ký nguyện vọng 1 cho con mình.  Hôm nay 15-5 là thời điểm Sở Giáo dục và Đào tạo TP.HCM cho học sinh thay đổi nguyện vọng lớp 10 mà thành phố vẫn chưa có thông tin gì về Trường THCS-THPT Trần Đại Nghĩa. Trong khi học sinh chỉ được thay đổi nguyện vọng một lần.  Mấy hôm nay cả vợ chồng tôi và con gái rất sốt ruột, ngày nào cũng mở báo ra xem UBND TP.HCM đã có quyết định thành lập Trường THCS-THPT Trần Đại Nghĩa chưa?"". Tương tự, chị Thanh Phương, phụ huynh ở quận 4 cũng cho biết: ""Con tôi cũng đã đăng ký nguyện vọng vào Trường THCS-THPT Trần Đại Nghĩa. Cháu cho biết mấy hôm nay cháu như 'ngồi trên lửa' vì mong thông tin về trường.  Cuối cùng, thành phố có quyết định thành lập Trường THCS-THPT Trần Đại Nghĩa không? Nếu không thành lập trường thì cần thông báo sớm cho chúng tôi biết để chúng tôi thay đổi nguyện vọng tuyển sinh lớp 10. Chỉ còn 4 ngày nữa là hết hạn thay đổi nguyện vọng rồi"". Không chỉ học sinh đã đăng ký nguyện vọng vào Trường THCS-THPT Trần Đại Nghĩa, những phụ huynh, học sinh chưa đăng ký nguyện vọng vào trường này cũng đang ngóng thông tin. ""Em và nhóm bạn thân đã đăng ký nguyện vọng 1 vào Trường THPT Nguyễn Thị Minh Khai nhưng nay thấy trường này có tỉ lệ chọi cao quá. Em muốn chuyển nguyện vọng qua Trường THCS-THPT Trần Đại Nghĩa nhưng đến thời điểm này không hiểu sao thành phố vẫn chưa có thông tin chính thức về việc thành lập trường. Chúng em đang rất mong…"", N.N.H., học sinh lớp 9 ở quận 3, chia sẻ. Trong khi đó, trao đổi với Tuổi Trẻ Online, một cán bộ Sở Giáo dục và Đào tạo TP.HCM cho hay: ""Khi nào có quyết định thành lập trường, sở sẽ thông báo ngay cho người dân"".",15/05/2024 10:09 GMT+7,https://tuoitre.vn/cuoi-cung-co-thanh-lap-truong-thcs-thpt-tran-dai-nghia-khong-20240515093137803.htm,'Hôm nay đã là ngày học sinh lớp 9 thực hiện thay đổi nguyện vọng tuyển sinh lớp 10. Vậy mà chúng tôi vẫn không biết Trường Trần Đại Nghĩa mới có thành lập không?'.
"Giáo viên phản ánh không được trả lương dạy thêm giờ, Bộ Giáo dục và Đào tạo chưa làm rõ nguyên nhân","Sáng 15-5, Ủy ban Thường vụ Quốc hội cho ý kiến về báo cáo kết quả giám sát việc giải quyết, trả lời kiến nghị của cử tri gửi đến kỳ họp thứ 6, Quốc hội khóa XV. Vướng mắc về quy định xét cấp học bổng với học sinh trường THPT chuyên Trình bày báo cáo, Trưởng Ban Dân nguyện Dương Thanh Bình cho biết cử tri tỉnh Bắc Kạn phản ánh trong quá trình thực hiện chính sách khuyến khích để xét cấp học bổng với học sinh Trường THPT chuyên Bắc Kạn, có vướng mắc giữa quy định về hạnh kiểm, học lực với quy định đánh giá, xếp loại kết quả rèn luyện, kết quả học tập của học sinh. Qua giám sát cho thấy nghị định 84/2020 của Chính phủ quy định chi tiết một số điều của Luật Giáo dục nêu rõ về đối tượng xét, cấp học bổng khuyến khích học tập. Theo đó, học sinh khối THPT chuyên trong cơ sở giáo dục đại học, học sinh trường chuyên có hạnh kiểm tốt, học lực giỏi trong kỳ xét học bổng… Tuy nhiên, tại thông tư 22/2021 của Bộ Giáo dục và Đào tạo quy định về đánh giá học sinh trung học cơ sở và học sinh THPT lại đánh giá về kết quả rèn luyện và kết quả học tập của học sinh theo 4 mức, gồm tốt, khá, đạt, chưa đạt, không đánh giá học sinh có hạnh kiểm tốt, học lực giỏi nên các địa phương không có cơ sở để triển khai thực hiện chính sách học bổng khuyến khích học tập theo nghị định 84. Để giải quyết vướng mắc, Bộ Giáo dục và Đào tạo đã có văn bản, trong đó đề nghị các địa phương thực hiện chính sách học bổng khuyến khích học tập cho đối tượng xét, cấp học bổng khuyến khích học tập theo cách chuyển tương đương. Theo đó, học sinh đạt kết quả rèn luyện đạt mức tốt, kết quả học tập đạt mức tốt được tính tương đương như học sinh đạt kết quả hạnh kiểm tốt, học lực giỏi. Tuy nhiên, công văn nêu trên chỉ là công văn hành chính, không thể dùng thay thế văn bản quy phạm pháp luật. Báo cáo chỉ rõ học bổng khuyến khích học tập được quy định tại nghị định 84 là chính sách tốt đẹp hỗ trợ thiết thực về tài chính của Nhà nước dành cho học sinh khối THPT chuyên trên phạm vi toàn quốc, nhằm giảm bớt khó khăn về tài chính cho gia đình học sinh. Đồng thời khuyến khích học sinh phấn đấu học tập nhưng chưa được triển khai hiệu quả trên thực tế do quy định thiếu thống nhất giữa nghị định 84 và thông tư 22. Đây đều là các văn bản quy phạm pháp luật, do Bộ Giáo dục và Đào tạo tham mưu xây dựng trình Chính phủ ban hành hoặc trực tiếp ban hành. Do đó, kiến nghị bộ khẩn trương rà soát tổng thể trình Chính phủ sửa đổi, bổ sung nghị định 84 hoặc sửa đổi, bổ sung thông tư 22 cho phù hợp với thực tiễn để kịp thời thực hiện học bổng khuyến khích học tập cho học sinh. Đồng thời rút kinh nghiệm trong công tác tham mưu xây dựng trình ban hành và ban hành văn bản quy phạm pháp luật. Làm rõ nguyên nhân không trả lương dạy thêm giờ cho giáo viên Bên cạnh đó, cử tri tỉnh Bình Dương phản ánh về việc giáo viên các trường học mầm non, các trường tiểu học, các trường THCS trên địa bàn TP Tân Uyên phải dạy thêm giờ do thiếu giáo viên nhưng không được hưởng tiền lương dạy thêm giờ theo quy định. Việc này được quy định tại thông tư liên tịch 07/2013 giữa Bộ Giáo dục và Đào tạo, Bộ Nội vụ, Bộ Tài chính hướng dẫn thực hiện chế độ trả lương dạy thêm giờ với nhà giáo trong các cơ sở giáo dục công lập. Trả lời cử tri, Bộ Giáo dục và Đào tạo lại nêu chế độ trả lương dạy thêm giờ với nhà giáo trong các cơ sở giáo dục công lập được thực hiện theo thông tư liên tịch số 07 và đề nghị UBND tỉnh Bình Dương chỉ đạo các đơn vị chức năng thực hiện chi trả tiền lương dạy thêm giờ cho nhà giáo theo quy định. Báo cáo nêu rõ với trách nhiệm là cơ quan quản lý nhà nước ở trung ương, Bộ Giáo dục và Đào tạo chưa làm rõ về khó khăn, vướng mắc, nguyên nhân dẫn đến việc giáo viên tại TP Tân Uyên không được hưởng lương dạy thêm giờ để đưa ra giải pháp giải quyết kiến nghị cử tri. Từ đó, kiến nghị bộ rà soát việc thực hiện chi trả tiền lương dạy thêm giờ của giáo viên trên địa bàn TP Tân Uyên. Cần làm rõ nguyên nhân không thực hiện chi trả tiền lương dạy thêm giờ cho giáo viên, trên cơ sở đó có giải pháp để giải quyết, trả lời kiến nghị của cử tri.",15/05/2024 09:14 GMT+7,https://tuoitre.vn/giao-vien-phan-anh-khong-duoc-tra-luong-day-them-gio-bo-giao-duc-chua-lam-ro-nguyen-nhan-202405150854109.htm,"Cử tri Bình Dương phản ánh giáo viên TP Tân Uyên không được chi trả tiền lương dạy thêm giờ theo quy định. Tuy nhiên, Bộ Giáo dục và Đào tạo trả lời chưa làm rõ nguyên nhân, giải pháp."
"Tỉ lệ chọi vào lớp 10 ở TP.HCM diễn biến bất ngờ, có nên đổi nguyện vọng?","Đáng chú ý nhất trong số đó là khu vực huyện Hóc Môn. Đa số các trường THPT đều tăng tỉ lệ chọi so với năm trước. Đặc biệt, Trường THPT Nguyễn Hữu Cầu, ngôi trường nổi tiếng nhất và có điểm chuẩn cao nhất khu vực Hóc Môn, quận 12 lại có tỉ lệ chọi dưới 2: 1 chọi 1,89. Trong khi đó, những trường khác ở cùng huyện Hóc Môn lại có tỉ lệ chọi cao hơn 2 như: THPT Hồ Thị Bi: 1 chọi 3,06; THPT Phạm Văn Sáng: 1 chọi 2,6; THPT Nguyễn Hữu Tiến: 1 chọi 2,36. ""Dễ thở"" ở một số nơi Điểm nổi bật nhất của mùa tuyển sinh lớp 10 năm nay là nhiều trường ở vùng ven, ngoại thành có tỉ lệ chọi trên 2, tương đương hoặc cao hơn cả một số trường THPT top đầu. Như: THPT Bình Hưng Hòa, quận Bình Tân: 1 chọi 2,33; THPT Thạnh Lộc, quận 12: 1 chọi 2,3; THPT Thủ Đức, TP Thủ Đức: 1 chọi 2,19. Theo hiệu trưởng các trường THCS, sở dĩ có tình trạng trên là do nhiều học sinh năm nay chọn nguyện vọng theo kiểu ""chắc ăn"". Các em chọn trường tốp giữa, tốp sau với hy vọng chắc chắn đậu vào lớp 10 công lập. Chỉ những em thực sự giỏi mới dám chọn trường tốp đầu. Bên cạnh đó, ngôi trường có tỉ lệ chọi cao nhất vào lớp 10 thường năm nay là Trường Nguyễn Hữu Huân, TP Thủ Đức: 1 chọi 3,54. Đứng thứ hai là Trường Nguyễn Thượng Hiền, quận Tân Bình: 1 chọi 3,16. Đây cũng là trường THPT có điểm chuẩn tuyển sinh lớp 10 cao nhất thành phố trong nhiều năm gần đây. Về khối lớp chuyên, Trường THPT chuyên Lê Hồng Phong có tỉ lệ chọi cao nhất thành phố: 1 chọi 5,5. Kế đó là Trường Gia Định: 1 chọi 2,4. Ở khối lớp tích hợp, Trường Nguyễn Thị Minh Khai đạt tỉ lệ chọi cao nhất: 1 chọi 5,1. Tuy nhiên, ở khối lớp này, nhiều trường THPT nổi tiếng nhưng lại có số thí sinh đăng ký vào lớp 10 tích hợp rất thấp. Như Trường Mạc Đĩnh Chi: tuyển 70 học sinh nhưng chỉ có 42 học sinh đăng ký. Trường Phú Nhuận tuyển 105 nhưng chỉ có 110 học sinh đăng ký. Trường Nguyễn Thượng Hiền tuyển 105 nhưng chỉ có 199 học sinh đăng ký. Ngoài ra, ở khối lớp 10 thường, TP.HCM có 26 trường đạt tỉ lệ chọi dưới 1. Phần lớn các trường này nằm ở vùng ven và ngoại thành. Trong đó, 3 trường có tỉ lệ chọi dưới 0,5 là THPT Phong Phú, Nguyễn Văn Linh và Nguyễn Văn Tăng. Bắt đầu thay đổi nguyện vọng từ 8h sáng 15-5 Theo bà Nguyễn Xuân Mai, phó trưởng Phòng khảo thí và kiểm định chất lượng giáo dục, Sở Giáo dục và Đào tạo TP.HCM, các học sinh nên cân nhắc thật kỹ, thận trọng trước khi quyết định điều chỉnh nguyện vọng. Vì thật ra ở lần đăng ký nguyện vọng lần thứ 1, các em và ba mẹ của mình cũng đã tìm hiểu rất kỹ trước khi đăng ký nộp hồ sơ. ""Học sinh chỉ nên điều chỉnh nguyện vọng khi rơi vào các trường hợp: Thứ nhất, cảm thấy khoảng cách từ nhà đến trường khá xa. Thứ hai, học sinh cảm thấy không tự tin. Tức là các em cảm thấy mình không chắc chắn đủ điểm để trúng tuyển vào trường khi số lượng học sinh đăng ký nguyện vọng quá nhiều so với chỉ tiêu mà nhà trường sẽ nhận. Lúc này, học sinh nên chọn một trường THPT có điểm chuẩn đầu vào thấp hơn so với trường THPT mà các em đã chọn. Việc chọn nguyện vọng nên căn cứ vào bảng điểm chuẩn của 3 năm học gần nhất, kết quả học tập của học sinh trong suốt 4 năm học, đặc biệt 3 môn: ngữ văn, toán và ngoại ngữ, so sánh mức độ khó, dễ của đề kiểm tra định kỳ tại trường và đề thi tuyển sinh các năm học trước… để quyết định đúng đắn nhất"" - bà Mai khuyên. Trong khi đó, ông Lê Hoài Nam - phó giám đốc Sở Giáo dục và Đào tạo TP.HCM - thông tin giai đoạn điều chỉnh nguyện vọng tuyển sinh lớp 10 bắt đầu từ 8h sáng ngày 15-5 đến 17h ngày 19-5. Thí sinh tiếp tục dùng tài khoản đã sử dụng ở lần đầu để đăng nhập và điều chỉnh nguyện vọng. ""Cha mẹ học sinh và học sinh cần lưu ý giai đoạn này chỉ áp dụng cho việc điều chỉnh nguyện vọng ở các loại hình đã đăng ký ở lần đầu tiên. Đặc biệt, việc đăng ký bài thi ngoại ngữ do trường THCS bộ phận quản lý hệ thống thi tuyển sinh lớp 10 chịu trách nhiệm đăng ký cho thí sinh"" - ông Nam nói.",15/05/2024 08:36 GMT+7,https://tuoitre.vn/ti-le-choi-vao-lop-10-o-tp-hcm-dien-bien-bat-ngo-co-nen-doi-nguyen-vong-20240514234338092.htm,"Tỉ lệ 'chọi' thi vào lớp 10 ở TP.HCM có nhiều điểm bất ngờ. Trong đó, trường THPT tốp giữa lại có tỉ lệ 'chọi' cao hơn cả trường tốp đầu."
Vụ bữa ăn bán trú bị cắt xén ở Lào Cai: Khai trừ Đảng hiệu trưởng Trường tiểu học Hoàng Thu Phố 1,"Tối 14-5, một nguồn tin của Tuổi Trẻ Online xác nhận Huyện ủy Bắc Hà (Lào Cai) ban hành và công bố quyết định về việc thi hành kỷ luật đối với ông Trần Ngọc Hà - bí thư chi bộ, hiệu trưởng Trường phổ thông dân tộc bán trú tiểu học Hoàng Thu Phố 1. Cụ thể, sau khi xem xét tự kiểm điểm của ông Trần Ngọc Hà và báo cáo của Ủy ban Kiểm tra Huyện ủy Bắc Hà, Ban Thường vụ Huyện ủy Bắc Hà nhận thấy ông Trần Ngọc Hà với cương vị là bí thư chi bộ, hiệu trưởng Trường phổ thông dân tộc bán trú tiểu học Hoàng Thu Phố 1 đã làm thay, lấn sân công việc của tập thể, độc đoán, chuyên quyền, vi phạm nguyên tắc tập trung dân chủ, lợi dụng chức quyền để thực hiện không đúng quy định trong tổ chức thực hiện nghị định số 116/2016 của Chính phủ quy định chính sách hỗ trợ học sinh và trường phổ thông ở xã, thôn đặc biệt khó khăn. Vi phạm của ông Trần Ngọc Hà ảnh hưởng xấu đến việc thực hiện đường lối của Đảng, chính sách của Nhà nước.  Làm ảnh hưởng đến uy tín của đội ngũ cán bộ, công chức, đạo đức công vụ, đạo đức nhà giáo và mất uy tín của bản thân ông Hà, gây thiệt hại đến quyền, lợi ích của đối tượng cần được hỗ trợ, thất thoát ngân sách nhà nước.  Làm suy giảm niềm tin của người dân với chính quyền cơ sở, gây dư luận bức xúc trong cán bộ, đảng viên và nhân dân, ảnh hưởng xấu đến uy tín của tổ chức đảng và cơ quan quản lý nhà nước. Ông Hà cũng vi phạm quy định về những điều đảng viên không được làm, trách nhiệm nêu gương, pháp luật của Nhà nước, quy định của Đảng, không hoàn thành nhiệm vụ của cấp ủy viên, đảng viên đến mức phải xử lý kỷ luật. Căn cứ quy định của Đảng, Ban Thường vụ Huyện ủy Bắc Hà quyết định thi hành kỷ luật ông Trần Ngọc Hà bằng hình thức ""khai trừ"". ""Ngoài ông Trần Ngọc Hà, hai phó hiệu trưởng Trường phổ thông dân tộc bán trú tiểu học Hoàng Thu Phố 1 cũng bị kỷ luật Đảng bằng hình thức khiển trách"" - nguồn tin thông tin thêm.",14/05/2024 19:42 GMT+7,https://tuoitre.vn/vu-bua-an-ban-tru-bi-cat-xen-o-lao-cai-khai-tru-dang-hieu-truong-truong-tieu-hoc-hoang-thu-pho-1-20240514191100012.htm,"Liên quan đến phản ánh bữa ăn bán trú bị cắt xén, Ban Thường vụ Huyện ủy Bắc Hà (Lào Cai) quyết định khai trừ Đảng đối với ông Trần Ngọc Hà - bí thư chi bộ, hiệu trưởng Trường phổ thông dân tộc bán trú tiểu học Hoàng Thu Phố 1."
GS.TS Võ Xuân Vinh rút khỏi 2 hội đồng liêm chính học thuật và giáo sư cơ sở UEH,"GS.TS Võ Xuân Vinh - viện trưởng Viện Nghiên cứu kinh doanh UEH - có liên quan đến bài báo khoa học trên tạp chí Environmental Science and Pollution Research thuộc Nhà xuất bản Springer bị gỡ bỏ. Chấp thuận nhà khoa học bị gỡ bài báo quốc tế rút khỏi 2 hội đồng Tối nay 14-5, trao đổi với Tuổi Trẻ Online, đại diện UEH cho hay: ""Nhà trường vừa chấp thuận đơn của GS.TS Võ Xuân Vinh xin rút tên khỏi hội đồng liêm chính học thuật tại UEH và không tham gia hội đồng giáo sư cơ sở UEH năm 2024"". UEH đã thành lập hội đồng liêm chính học thuật từ năm 2020. Đây là đơn vị thực hiện vai trò thẩm định các khía cạnh đạo đức, khoa học của nghiên cứu, từ đó phê duyệt, nghiệm thu; hỗ trợ các công trình nghiên cứu hàn lâm; cảnh báo thường xuyên những danh mục tạp chí bị loại khỏi Scopus, danh mục nhà xuất bản săn mồi, giả mạo; ""bẫy nghiên cứu"" có thể mắc phải. Đơn vị này cũng có trách nhiệm ban hành và chuẩn hóa ""Bộ quy tắc liêm chính trong nghiên cứu khoa học"" được áp dụng đối với cộng đồng nhà nghiên cứu trực thuộc UEH và hơn 100 nhà khoa học nước ngoài cộng tác. Trước đó, ông Võ Xuân Vinh là tác giả thứ 5 trong số 9 tác giả của bài báo khoa học bị tạp chí quốc tế trên gỡ bỏ. UEH đã họp, làm rõ và có biên bản kết luận đối với vụ việc từ tháng 3-2024. Theo kết luận ban đầu nhà trường cho biết: ""UEH đã cân nhắc kỹ càng các luận cứ, bằng chứng và kết luận bài báo bị rút liên quan đến quy trình xử lý của biên tập viên khách mời và hoạt động bình duyệt của tạp chí. Cá nhân ông Vinh không nhận tài trợ/thưởng từ nhà trường cho bài báo này. Ông Vinh cũng đã đưa được các minh chứng về việc bị lạm danh. Đây là trường hợp rút bài báo nghiên cứu có liên quan đến quyền tác giả"". Nhà trường đề nghị ông Vinh nghiêm túc rút kinh nghiệm trong hoạt động hợp tác công bố quốc tế của cá nhân. Ông Vinh cần có chính sách quản lý và cơ chế kiểm soát chặt chẽ mạng lưới các chuyên gia nghiên cứu cộng tác rộng khắp của đơn vị trên cơ sở bộ quy tắc của hội đồng liêm chính học thuật để tránh xảy ra vụ việc tương tự. Tuy nhiên sau đó, dữ liệu một số bài báo của các nhà khoa học, trong đó có ông Vinh là tác giả liên quan đến những bài báo bị tạp chí quốc tế gỡ bỏ bất ngờ biến mất trên thư viện online UEH. GS Võ Xuân Vinh: nhà khoa học trong top ""ảnh hưởng nhất thế giới"" GS.TS Võ Xuân Vinh là ""nhà nghiên cứu kinh tế hàng đầu Việt Nam"", một trong bốn người Việt Nam lọt ""top 1% được trích dẫn cao nhất thế giới"" của Clarivate, đồng thời nằm ở vị trí thứ 8 trong danh sách 47 người Việt vào ""top nhà khoa học ảnh hưởng nhất thế giới"" trong bảng xếp hạng của GS John P.A. Ioannidis cùng các cộng sự thuộc Đại học Stanford (Hoa Kỳ). Ông cũng là giám đốc chương trình tiến sĩ quản trị của CFVG (PhD in Management), giám đốc chương trình cao học tài chính - ngân hàng tại Trung tâm Pháp Việt đào tạo về quản lý (CFVG) TP.HCM. Ông cũng là giám đốc chương trình hợp tác giữa UEH và Đại học Lincoln Vương quốc Anh, giám đốc học thuật chương trình đào tạo tiến sĩ khoa học xã hội giữa UEH và Đại học Leicester, Vương quốc Anh. Từ năm 2020, ông Võ Xuân Vinh còn là giáo sư thỉnh giảng của Đại học Lincoln, Vương quốc Anh. Ông cũng từng tham gia nghiên cứu và giảng dạy tại Đại học New South Wales và Đại học Western Sydney, Úc. Ông Võ Xuân Vinh đã công bố khoảng 225 bài báo. Trong 5 năm gần đây, mỗi năm ông Vinh đăng từ hơn 30 đến gần 50 bài. Ông Vinh còn là thành viên hội đồng biên tập nhiều tạp chí khoa học quốc tế có uy tín có xếp hạng cao như International Review of Financial Analysis (ISI, Scopus, hạng A), Journal of Behaviorial and Experimental Finance (ISI, hạng A), Singapore Economic Review (ISI, hạng B), Eurasian Economic Review (Scopus), Journal of Economic Development (Scopus), Journal for Global Business Advancement (Scopus). Đồng thời, ông Vinh còn là thành viên ban điều hành của nhiều hiệp hội nghề nghiệp quốc tế trong lĩnh vực khoa học kinh tế và kinh doanh.",14/05/2024 19:12 GMT+7,https://tuoitre.vn/gsts-vo-xuan-vinh-rut-khoi-2-hoi-dong-liem-chinh-hoc-thuat-va-giao-su-co-so-ueh-20240514190405488.htm,Đại học Kinh tế TP.HCM (UEH) vừa có thông tin chính thức về việc GS.TS Võ Xuân Vinh xin rút khỏi hội đồng liêm chính học thuật và hội đồng giáo sư cơ sở UEH năm 2024.
