Title,Content,Date,Url,Summary
Lãnh đạo tỉnh Bắc Giang đọc bài phát biểu tại hội thảo do Chat GPT viết về ngành công nghiệp bán dẫn,"Ngày 16-4, UBND tỉnh Bắc Giang tổ chức Hội thảo thực trạng, giải pháp nguồn lao động ngành công nghiệp bán dẫn. ""Bắt mạch"" điểm yếu của lao động Việt Ông Mai Sơn - phó chủ tịch thường trực UBND tỉnh Bắc Giang - bất ngờ đọc bài phát biểu khai mạc do Chat GPT soạn khi kiểm tra sức mạnh của chip bán dẫn và công nghệ AI từ đêm hôm trước. ""Tôi xin phép lấy bài phát biểu của Chat GPT khai mạc hội thảo để chúng ta thấy được việc chủ động hơn nữa trong ngành công nghiệp bán dẫn"", ông Sơn nói. Bài phát biểu có đoạn ""chúng ta cần tạo điều kiện thuận lợi để thu hút và giữ chân các chuyên gia, nhà nghiên cứu có kinh nghiệm từ trung ương và các doanh nghiệp quốc tế"". Sau khi ông Sơn đề nghị các đại biểu thảo luận về cơ hội, thách thức mà AI, chip bán dẫn mang tới cuộc sống, những tiếng vỗ tay vang lên, nhiều người bất ngờ trước văn phong của AI sát với suy nghĩ, mong muốn của người nói. Sau đó, ông Chung Won Seok - tổng giám đốc Hana Công ty TNHH Hana Micron Vina - bày tỏ ngành bán dẫn đang khởi sắc. Đến tháng 4-2024, công ty này có trên 1.600 nhân sự, sản xuất 100 triệu chip/tháng. Nói về nguồn nhân lực, ông bày tỏ năng lực cạnh tranh của lao động Việt còn phải cải thiện. Ví dụ kỹ sư thiết bị mất khoảng 3 năm để đạt trình độ B để bảo dưỡng thiết bị, thay đổi loại sản phẩm, hiểu các công đoạn. Với vị trí phát hiện hỏng hóc, nhân viên Việt Nam được 30 điểm thì Trung Quốc, Hàn Quốc đạt lần lượt 70, 90 điểm. Tuy nhiên ông tin Việt Nam còn tiến xa, nhanh hơn nữa. Việc cần làm là các nhà trường tăng cường đào tạo ý thức, kỹ năng nghề, giới thiệu sinh viên có năng lực tham gia thực tập, làm việc lâu dài ở công ty sau khi tốt nghiệp. Ông Nguyễn Xuân Ngọc - phó trưởng Ban quản lý các khu công nghiệp tỉnh Bắc Giang - cho biết tỉnh có 3 doanh nghiệp về sản xuất chất bán dẫn gồm Công ty TNHH Hana Micron Vina (vốn Hàn Quốc, đăng ký 643 triệu USD), Công ty TNHH Si Flex Việt Nam (vốn Hàn Quốc, đăng ký 299 triệu USD), Công ty TNHH Synergie Cad Việt Nam (vốn Pháp, đăng ký 21,2 triệu USD). Số lao động ngành bán dẫn trên 8.000 người, độ tuổi dưới 35 gần 6.700 người, chủ yếu thuộc lĩnh vực tự động hóa, kỹ thuật điện tử, thiết bị điện tử, công nghệ thông tin, cơ khí chế tạo, công nghệ hóa. Song, ông thẳng thắn nói lao động Việt chưa đáp ứng yêu cầu của doanh nghiệp, phải đào tạo trung bình 1-3 tháng, để thành thạo, chủ động, độc lập cần ít nhất 6 tháng đến 1 năm. Như vậy, vai trò của các trường đại học, cao đẳng trong phối hợp với doanh nghiệp, xây dựng khung chương trình, kiến thức và đưa sinh viên tham qua, thực tập rất lớn. Còn doanh nghiệp cần góp ý chương trình đào tạo, hỗ trợ cơ sở vật chất, thiết bị, trao học bổng cho sinh viên hoặc cử chuyên gia, công nhân lành nghề chia sẻ kinh nghiệm. Nhu cầu nhân lực ngành bán dẫn thế nào? PGS.TS Trương Việt Anh - trưởng ban khoa học công nghệ, Đại học Bách khoa Hà Nội - nêu ngoài thiết kế, sản xuất trong nhà máy, ngành bán dẫn cần người từ ngành công nghiệp phụ trợ, dây chuyền, robot, xử lý môi trường rất lớn. Ví dụ 10 năm tới, Hàn Quốc cần 30.000 vị trí, Nhật Bản cần 35.000 người. Đài Loan (Trung Quốc) có 290.000 người nhưng vẫn cần thêm. Với mục tiêu 50.000 nhân lực ngành công nghiệp vi mạch và bán dẫn đến năm 2030 của Chính phủ, ông nhấn mạnh các cơ sở đào tạo cần hợp tác, đào tạo nguồn nhân lực. Các địa phương cần có chính sách đặc thù thu hút nhân sự có trình độ cao. Đại học Bách khoa Hà Nội, theo ông Anh, có các ngành điện tử viễn thông, thiết kế vi mạch, tự động hóa... dự kiến đáp ứng 20.000 nhân sự. TS Võ Xuân Hoài - phó giám đốc Trung tâm đổi mới sáng tạo quốc gia - nêu chương trình đào tạo hiện nay chưa nhất quán, chưa chuẩn quốc tế do ngành bán dẫn mới, tăng cường phối hợp các bên. Vậy việc hợp tác quốc tế, chuẩn hóa quy trình đào tạo, thu hút nhân lực chất lượng cao, đầu tư máy móc, cơ sở vật chất, thu hút nguồn lực từ Mỹ, Nhật Bản, Hàn Quốc hoặc thành lập trung tâm bán dẫn rất quan trọng.",16/04/2024 14:28 GMT+7,https://tuoitre.vn/lanh-dao-tinh-bac-giang-doc-bai-phat-bieu-tai-hoi-thao-do-chat-gpt-viet-ve-nganh-cong-nghiep-ban-dan-2024041613555664.htm,"Trước đại diện của các 'ông lớn' ngành công nghiệp bán dẫn, lãnh đạo UBND tỉnh Bắc Giang đọc bài phát biểu do Chat GPT viết trong 41 giây để nói về sức mạnh của AI, chip bán dẫn."
"Máy ảnh nhanh nhất thế giới, chụp 156.000 tỉ khung hình mỗi giây","Nhóm khoa học gia thuộc Viện Nghiên cứu khoa học quốc gia (INRS) tại thành phố Quebec (Canada) đã tạo ra máy ảnh sử dụng kỹ thuật quang học mới để chụp 132 khung hình từ một xung laser cực nhanh. Công nghệ này giúp họ ghi lại hiện tượng xảy ra tính bằng femto giây (phần triệu tỉ của một giây). ""Chiếc máy ảnh này hơn cả một món đồ chơi, nó thật sự là một thiết bị khoa học rất quan trọng"", ông Jinyang Liang, trưởng nhóm nghiên cứu thuộc INRS tại Quebec, nói. Nhóm cũng đang phát triển một hệ thống hình ảnh cho phép chúng ta nhìn thấy nhiều hiện tượng mà trước nay không thể thấy được, theo trang LiveScience ngày 15-4. Ông Liang cho biết thách thức chủ yếu khi chụp hình các hiện tượng xảy ra cực nhanh là ngay cả những cảm biến máy ảnh nhanh nhất cũng chỉ có thể ghi lại cảnh quay ở tốc độ vài trăm triệu khung hình/giây (fps). Nhiều hiện tượng tự nhiên xảy ra với tốc độ nhanh hơn như vậy rất nhiều. Năm 2020, nhóm của ông Liang đã phát triển công nghệ gọi là ""chụp ảnh siêu nhanh nén"" (CUP), đạt được tốc độ 70.000 tỉ fsp. Hiện nay, phòng thí nghiệm của ông đã tăng hơn gấp đôi con số đó nhờ phương pháp họ gọi là ""chụp ảnh femto giây thời gian thực sử dụng khẩu độ quét mã hóa""(swept coded aperture real-time femtophotography). Phương pháp mới dựa trên nguồn sáng đặc biệt gọi là laser ""chirped"", một khám phá đoạt giải Nobel vật lý năm 2018. Trong các tia laser này, các bước sóng ánh sáng bị kéo dài ra để các màu khác nhau của ánh sáng đến vào những thời điểm khác nhau. Điều này có nghĩa là khi một xung laser được bắn vào một vật thể, mỗi bước sóng sẽ thu được thông tin từ các thời điểm khác nhau, cho phép ghi lại toàn bộ diễn biến trong một khoảng thời gian cực ngắn. Nhóm nghiên cứu cho biết công nghệ mới có thể cung cấp hiểu biết có giá trị trong nhiều lĩnh vực nghiên cứu và phát triển khác nhau, bao gồm việc tạo ra công nghệ bộ nhớ máy tính mới và phương pháp điều trị y tế bằng siêu âm. Nghiên cứu được đăng trên tạp chí Nature Communications.",16/04/2024 11:55 GMT+7,https://tuoitre.vn/may-anh-nhanh-nhat-the-gioi-chup-156-nghin-ti-khung-hinh-moi-giay-20240416113407746.htm,"Với tốc độ 156.000 tỉ khung hình mỗi giây, máy ảnh mở ra khả năng ghi lại những hiện tượng xảy ra cực nhanh mà trước nay không nhìn thấy được."
CEO Apple Tim Cook mang gì đến Việt Nam?,"Chuyến thăm Việt Nam của CEO Apple Tim Cook thu hút sự chú ý lớn cộng đồng mạng Việt Nam ngay từ những giờ đầu tiên ông đặt chân đến Hà Nội vào ngày 15-4. Sự quan tâm tới chuyến đi thậm chí vượt ra ngoài Việt Nam. ""Không có nơi nào như Việt Nam, một đất nước sôi động và xinh đẹp"", Giám đốc điều hành (CEO) của Apple Tim Cook bày tỏ ngay sau khi đến Việt Nam vào ngày 15-4. Tín hiệu tốt Theo nguồn tin của Tuổi Trẻ, ngoài các hoạt động bên lề tại Hà Nội, trong ngày 15-4, ông Tim Cook còn làm việc với đại diện Trung tâm Đổi mới sáng tạo quốc gia (NIC) thuộc Bộ Kế hoạch và Đầu tư để trao đổi về các vấn đề hợp tác hai bên. Tuy nhiên, nội dung làm việc giữa hai bên được giữ kín theo yêu cầu từ phía Apple. Trao đổi với Tuổi Trẻ, ông Võ Xuân Hoài, phó giám đốc NIC, nhận định chuyến thăm của ông Tim Cook đến Việt Nam lần này cũng giống như chuyến thăm của ông Jensen Huang - chủ tịch NDIVIA.  ""Đây là tín hiệu tốt. Họ đến Việt Nam vì nhìn thấy các cơ hội đầu tư. Hiện rất nhiều nhà cung cấp linh phụ kiện cho Apple như Foxconn, Samsung, Luxshare... đã có nhà máy tại Việt Nam"", ông Hoài nêu. Cũng theo phó giám đốc NIC, trong cuộc làm việc với Thủ tướng Phạm Minh Chính vào hôm nay (16-4), dự kiến CEO Apple sẽ đưa ra các đề xuất liên quan đến đầu tư của tập đoàn tại Việt Nam.  Lãnh đạo Apple cũng được kỳ vọng sẽ cam kết mua nhiều hơn các linh phụ kiện do các đối tác sản xuất tại Việt Nam, đồng thời hỗ trợ Việt Nam trong lĩnh vực đổi mới sáng tạo. Trên thực tế, trước đó theo thông báo từ chính Apple, trong chuyến thăm Việt Nam lần này của CEO Tim Cook, tập đoàn này sẽ công bố việc tăng cường khoản chi cho nhà cung cấp tại Việt Nam. Mức chi của Apple cho các nhà cung cấp địa phương đã đạt gần 400.000 tỉ đồng kể từ năm 2019. Tập đoàn Apple không trực tiếp sản xuất các sản phẩm mà thông qua các nhà cung ứng để sản xuất sản phẩm. Theo danh sách các nhà cung cấp toàn cầu được Apple công bố, có khoảng 25 nhà cung cấp của tập đoàn này đã hiện diện tại Việt Nam. Có thể kể ra một số cái tên lớn cung ứng cho Apple đã đến Việt Nam như Foxconn, Luxshare, Goertek... với 27 cơ sở sản xuất đặt tại 13 tỉnh. Cũng theo thông báo của Apple, trong năm nay tập đoàn sẽ mở rộng chương trình đào tạo nghề cho người khuyết tật để thúc đẩy sự hòa nhập, mang đến cơ hội lớn hơn cho họ trong chuỗi cung ứng.  Apple cũng sẽ tiếp tục mở rộng các chương trình trong quỹ phát triển nhân viên của nhà cung cấp trị giá 50 triệu USD, khi tập đoàn tăng cường khoản đầu tư cho các nhà cung cấp Việt Nam. Nói thêm về chuyến đi đến Việt Nam, ông Tim Cook chia sẻ Apple luôn nỗ lực xây dựng những mối liên kết sâu sắc và mang đến nhiều lợi ích hơn cho người dân ở nơi tập đoàn này hoạt động. Trong đó có việc hợp tác với các nhà cung cấp địa phương, hỗ trợ các dự án cung cấp nước sạch và các cơ hội giáo dục khác. Apple quan tâm Việt Nam Sự quan tâm của người Việt đối với các sản phẩm của Apple là điều không thể bàn cãi, và trong những năm gần đây, tập đoàn với logo quả táo cắn dở đã ngày càng chú ý hơn đến thị trường 100 triệu dân này.  Việt Nam hiện nằm trong số 5 quốc gia hàng đầu thế giới về lĩnh vực sản xuất trò chơi dành cho điện thoại, chủ yếu trong các hệ điều hành Android của Alphabet và iOS của Apple. Năm ngoái, Apple cũng đã khai trương cửa hàng trực tuyến tại Việt Nam, cho phép người dùng mua hàng chính hãng trực tiếp từ tập đoàn mà không thông qua các nhà phân phối ủy quyền. Nhưng các iFan (những người mê sản phẩm của Apple) và quy mô thị trường Việt Nam chỉ là một phần cho sự quan tâm của nhà táo khuyết. Trong ngày 15-4, kênh CNBC đã đăng bài viết ""CEO Apple Tim Cook thăm Việt Nam - một trong những trung tâm sản xuất quan trọng nhất của gã khổng lồ iPhone"", cho thấy một lý do khác Tim Cook đến Việt Nam ngay từ tiêu đề. Kênh truyền hình của Mỹ giải thích việc ông Tim Cook đến thăm Việt Nam diễn ra trong bối cảnh Apple muốn tìm cách tăng doanh số bán hàng tại các thị trường mới. Việt Nam cũng đã trở thành một địa điểm sản xuất quan trọng của Apple khi tập đoàn này tìm cách đa dạng hóa việc lắp ráp sản phẩm của mình bên ngoài Trung Quốc. Tuy nhiên, sức hút của Việt Nam còn đến từ các chính sách linh hoạt của Chính phủ để thu hút đầu tư trực tiếp nước ngoài vào ngành công nghệ cao, theo giáo sư Nguyễn Mãi - chủ tịch Hiệp hội Doanh nghiệp đầu tư nước ngoài.  Chính phủ đã ban hành nhiều kế hoạch, đặc biệt là kế hoạch sản xuất chip bán dẫn, và đặc biệt coi trọng liên kết với tập đoàn công nghệ lớn của thế giới. Chính phủ cũng có kế hoạch đưa ra các ưu đãi chi phí, ưu đãi cho nghiên cứu phát triển. Những ưu đãi này sẽ được công bố trong quý 2 và quý 3 năm nay, góp phần làm tăng lòng tin của các nhà đầu tư lớn. Việc hỗ trợ doanh nghiệp trong nước tham gia chuỗi giá trị toàn cầu, khâu có giá trị gia tăng cao còn rất ít nên chuyện hình thành các liên doanh giữa trong nước và nước ngoài tham gia sản xuất các linh kiện điện tử là điều rất quan trọng. Apple lại chủ trương dùng doanh nghiệp bản địa để tham gia sản xuất linh phụ kiện cho họ.  ""Đây là điều rất thuận lợi cho Việt Nam, bởi theo nhận định của Samsung hay Intel, nguồn nhân lực chất lượng cao Việt Nam hoàn toàn đáp ứng yêu cầu. Với những kỹ sư công nghệ đào tạo chưa đúng ngành nghề thì các tập đoàn nước ngoài chỉ đào tạo thêm khoảng 6 tháng là đáp ứng yêu cầu"", ông Mãi nói thêm. Ví dụ tại trung tâm R&D của Samsung ở Hà Nội hiện có 3.200 kỹ sư đang làm việc, trong đó có nhiều kỹ sư người Việt. Đây cũng là trung tâm R&D đứng đầu châu Á của Samsung, trong tương lai đây sẽ là trung tâm R&D lớn nhất thế giới. Samsung cũng đánh giá những kỹ sư phần mềm hàng đầu của Việt Nam không thua kém gì những kỹ sư phần mềm hàng đầu của Hàn Quốc. ""Chúng ta đang có lợi thế về kỹ sư công nghệ, trong khi chi phí cho kỹ sư Việt Nam chỉ bằng 40% thù lao của kỹ sư Hàn Quốc"", giáo sư Mãi khẳng định. ",16/04/2024 08:51 GMT+7,https://tuoitre.vn/ceo-apple-tim-cook-mang-gi-den-viet-nam-20240416004805328.htm,"Làm việc với Thủ tướng Phạm Minh Chính hôm nay 16-4, dự kiến CEO Tim Cook sẽ đưa ra các đề xuất liên quan đầu tư của Apple tại Việt Nam."
Vì sao CEO Tim Cook thăm Việt Nam lúc này?,"Theo kênh CNBC, ông Tim Cook đến thăm Việt Nam trong bối cảnh Tập đoàn Apple muốn tìm cách tăng doanh số bán hàng tại các thị trường mới. Đây cũng là thời điểm thử thách đối với gã khổng lồ công nghệ của Mỹ. Số liệu do Tập đoàn Dữ liệu quốc tế (IDC) công bố ngày 15-4 cho thấy trong quý 1-2024, số lượng iPhone xuất xưởng trên toàn cầu đã giảm 10% so với cùng kỳ năm ngoái. Apple cũng đang phải đối mặt với sự cạnh tranh gay gắt trong các thị trường điện thoại thông minh (smart phone) cao cấp mà họ hiện diện, đặc biệt là ở các thị trường trọng điểm như Trung Quốc. Theo IDC, Apple đã trở thành nhà cung cấp smart phone bán chạy thứ 3 tại Việt Nam, chỉ sau Oppo và Samsung. Việt Nam cũng đã trở thành một địa điểm sản xuất quan trọng của Apple khi tập đoàn này tìm cách đa dạng hóa việc lắp ráp sản phẩm của mình bên ngoài Trung Quốc. Vào tháng 12-2023, báo Nikkei đưa tin Apple đang chuyển một số nguồn lực kỹ thuật quan trọng trong sản xuất iPad sang Việt Nam. Việt Nam được cho là hiện đang tham gia vào việc phát triển và sản xuất các sản phẩm MacBook, iPad và Apple Watch. ""Việt Nam quan trọng với Apple không chỉ vì lượng người hâm mộ ngày càng tăng ở đây, mà còn vì ngành công nghiệp đang ngăn ngừa rủi ro thông qua việc đa dạng hóa hoạt động sản xuất bên ngoài Trung Quốc.  Trong đó bao gồm các địa điểm quan trọng như Việt Nam, nơi Samsung đã hiện diện từ lâu"", ông Bryan Ma, phó chủ tịch phụ trách nghiên cứu thiết bị khách hàng của IDC, nhận định. Cũng theo ông Bryan Ma, các đối tác sản xuất của Apple như Quanta hay Foxconn đã và đang đầu tư xây dựng các nhà máy sản xuất tại Việt Nam. Ấn Độ cũng nổi lên như một trung tâm sản xuất iPhone quan trọng. Theo Hãng tin Bloomberg, hiện nay cứ 7 chiếc iPhone thì có 1 chiếc được sản xuất ở Ấn Độ. Apple đã bắt đầu lắp ráp dòng iPhone mới nhất của mình tại Ấn Độ vào năm 2022, với dòng iPhone 14. Ấn Độ cũng là một thị trường tiêu dùng khổng lồ của Apple.",15/04/2024 18:00 GMT+7,https://tuoitre.vn/vi-sao-ceo-tim-cook-tham-viet-nam-luc-nay-20240415172659148.htm,"Kênh CNBC (Mỹ) ngày 15-4 đăng tải bài viết: ""CEO Apple Tim Cook thăm Việt Nam - một trong những trung tâm sản xuất quan trọng nhất của gã khổng lồ iPhone""."
"Cho trẻ 13 tuổi được dùng WhatsApp, Meta bị chỉ trích","Quy định mới của Meta, công ty mẹ của WhatsApp, có hiệu lực ở EU từ ngày 11-4. Trước đó, quy định này cũng đã được áp dụng ở Anh hồi tháng 2 năm nay. WhatsApp cho rằng thay đổi này nhằm bảo đảm sự nhất quán về độ tuổi tối thiểu của người sử dụng ứng dụng này trên toàn cầu. Tuy nhiên, việc hạ độ tuổi người được phép sử dụng WhatsApp đã vấp phải sự phản đối của các tổ chức bảo vệ quyền trẻ em tại Anh, cho rằng điều này càng khiến giới trẻ phải đối mặt với hàng loạt tác hại trực tuyến. ""WhatsApp đang đặt lợi ích lên hàng đầu và phớt lờ sự an toàn của trẻ em"", bà Daisy Greenwell - đồng sáng lập tổ chức ""Tuổi thơ không có điện thoại thông minh"" (Smartphone Free Childhood) tại Anh - chỉ trích. Bà nhấn mạnh việc giảm độ tuổi tối thiểu sử dụng ứng dụng là hành động làm ngơ trước những cảnh báo ngày càng tăng của các nhà khoa học, bác sĩ, giáo viên, chuyên gia về an toàn trẻ em, phụ huynh cũng như chuyên gia sức khỏe tâm thần về tác hại của việc sử dụng mạng xã hội đối với trẻ em. Nghị sĩ Vicky Ford, thuộc Đảng Bảo thủ ở Anh và là thành viên của Ủy ban phụ trách vấn đề giáo dục trong chính phủ, cho rằng quyết định của WhatsApp hạ độ tuổi tối thiểu người được phép sử dụng ứng dụng mà không trao đổi trước với phụ huynh là hành động ""vô trách nhiệm"". Trong khi đó, Ủy ban châu Âu (EC) chưa đưa ra bình luận gì trước thông tin trên.",15/04/2024 17:05 GMT+7,https://tuoitre.vn/cho-tre-13-tuoi-duoc-dung-whatsapp-meta-bi-chi-trich-20240415164636651.htm,Các tổ chức bảo vệ quyền trẻ em lên tiếng phản đối sau khi Meta hạ độ tuổi tối thiểu sử dụng ứng dụng nhắn tin WhatsApp tại Liên minh châu Âu (EU) từ 16 xuống 13 tuổi.
