Title,Content,Date,Url,Summary
"Rộ chiêu lừa bán hàng trên 'sàn thương mại điện tử' Starlink, Carousell","Rất nhiều trang Facebook mạo danh người thành đạt hoặc phụ nữ xinh đẹp đi kết bạn khắp nơi. Nhiều người xem qua trang Facebook của họ và kết bạn. Thế là bắt đầu rơi vào con đường sập bẫy. ""Sàn thương mại điện tử Starlink"" Mới đây chị Thanh (TP.HCM) kể đã chấp nhận kết bạn với một người đàn ông lạ qua Facebook vì ""nhìn trên tường nhà anh ấy toàn hình sang chảnh, đẹp trai, làm ăn thành công, Facebook lại có nhiều bạn bè và nhiều tương tác, yêu thích"". Sau một thời gian nhắn tin làm quen, hỏi thăm công việc, chị Thanh được ""anh bạn hào hoa"" giới thiệu kinh doanh đa ngành nghề, trong đó có việc bán hàng xuyên biên giới cho nhiều quốc gia trên thế giới qua ""sàn thương mại điện tử Starlink của tỉ phú Elon Musk"". Starlink là công ty cung cấp dịch vụ Internet vệ tinh của vị tỉ phú nổi tiếng thế giới Elon Musk. Vì cái tên quá nổi tiếng, chị Thanh tin tưởng ngay và truy cập theo địa chỉ web mà người bạn mới cung cấp. Từ thông tin của chị Thanh, chúng tôi phát hiện một loạt website liên quan đến ""sàn thương mại điện tử Starlink"" như starlink168, starlink688, starlink888, starlink889, starlink999… Tất cả tên miền này đều trỏ về cùng một nội dung website có giao diện khá giống với sàn thương mại điện tử Shopee. Thậm chí trên Facebook còn có hẳn một trang với tên ""Thương mại điện tử Starlink"" kèm lời giới thiệu rất hấp dẫn: ""Thị trường Việt Nam được Thương mại điện tử Starlink lựa chọn. Trở thành đại lý thương mại điện tử của chúng tôi và cùng nhau tạo nên thành công"". Trang Facebook này có 1.000 lượt thích và 100.000 người theo dõi, thế nhưng chỉ có vỏn vẹn hai bài đăng vào cuối tháng 10-2023. Thông tin từ trang Facebook cho biết ""sàn Starlink"" này có trụ sở tại California (Mỹ) nhưng không hề có số điện thoại liên lạc, còn địa chỉ email lại là Gmail của Google. Kết bạn ""em gái xinh đẹp"", bay 2,7 tỉ Anh N. (Hà Nội) nhận được lời mời kết bạn từ tài khoản Facebook của một phụ nữ rất xinh đẹp nên anh không ngần ngại chấp nhận ngay. Sau một thời gian trò chuyện làm quen, người phụ nữ xinh đẹp mời anh N. cùng đầu tư bán hàng để hưởng hoa hồng trên sàn thương mại điện tử Carousell khá nổi tiếng của Singapore. Điều khác biệt mà anh N. không nhận ra là địa chỉ website được người phụ nữ giới thiệu với anh là carousell888.com, trong khi tên miền chính chủ lại là www.carousell.sg. Tuy nhiên, website mạo danh cũng được thiết kế hoành tráng và bài bản không kém gì website chính chủ nên anh N. không mấy hoài nghi. Sau đó, anh N. được hướng dẫn mở gian hàng và đăng bán các sản phẩm do ""em gái xinh đẹp"" cung cấp. Khi có khách đặt hàng, anh N. phải thanh toán tiền cho bên kho cung cấp hàng và vận chuyển cho khách nhận, khi hoàn thành đơn hàng sẽ được hưởng hoa hồng. Thời gian đầu tham gia, đơn hàng có giá trị 1-10 triệu đồng và có tiền hoa hồng trả về, anh N. rút được tiền và mừng thầm. Tiếp đó, các đơn hàng có giá trị và số lượng ngày càng lớn hơn. Khi số tiền đạt đến hàng tỉ đồng, anh N. bất ngờ không thể rút tiền ra được. Anh được ""em gái xinh đẹp"" dẫn dắt gặp nhiều người khác của bên nhà cung cấp, kho vận để giải quyết. Nhiều lý do tiếp tục được đưa ra như cần nâng cấp thành viên, đóng thuế, đóng phí hải quan… Kết quả anh N. bị lừa mất 2,7 tỉ đồng. Chiêu lừa ""vỗ béo rồi làm thịt"" Trao đổi với Tuổi Trẻ vào chiều 24-4, ông Nguyễn Vũ Anh - tổng giám đốc Công ty Cốc Cốc (cung cấp trình duyệt web Cốc Cốc) - nhận định những chiêu lừa nêu trên được thực hiện theo cơ chế ""pig butchering"" (nghĩa đen: nuôi heo để giết mổ). Cụm từ ""pig butchering"" ở đây minh họa một thủ đoạn lừa đảo tài chính. Trong đó những kẻ lừa đảo tiếp cận, dụ dỗ nhiều người đầu tư vào một cơ hội đầu tư giả mạo, sau đó biến mất với số tiền khủng. Ông Anh cho biết điểm khởi phát chiêu lừa thường bắt đầu bằng việc những kẻ lừa đảo tạo ra một nhân vật trực tuyến giả mạo, chẳng hạn như một tài khoản mạng xã hội giả với đầy đủ ảnh và thông tin như một nhân vật có thật (thường là các nhân vật nổi tiếng, có uy tín và tầm ảnh hưởng với cộng đồng, xã hội). Các hình ảnh, thông tin này có thể đã bị đánh cắp từ nhiều nguồn khác nhau, đôi khi là từ chính tài khoản của một người thật (nếu thông tin được người đó chia sẻ công khai). Tiếp đó, kẻ xấu sẽ dùng nick ảo đó để tiếp cận với nạn nhân bằng những tin nhắn với nội dung làm quen, khen ngợi hoặc thậm chí giả vờ gửi nhầm để bắt đầu trò chuyện. Cứ như vậy, kẻ lừa đảo dành thời gian kết nối, chia sẻ để dần tạo niềm tin khiến nhiều người mất cảnh giác, nghe theo lời dẫn dụ như tiếp thị liên kết, bán hàng... và sập bẫy lừa đảo. ""Điểm chung của các vụ việc là kẻ xấu sẽ dùng chiêu trò để đánh ""đòn"" tâm lý mà hầu hết là tập trung vào tâm lý muốn chớp cơ hội kiếm nhiều tiền trong thời gian ngắn. Tất cả đều được dàn xếp theo các kịch bản rất chuyên nghiệp khiến nhiều người nhẹ dạ tò mò, từng bước bị thao túng và làm theo chỉ dẫn, từ đó dốc tài sản cho các kế hoạch đầu tư không có thật hoặc trang thương mại điện tử giả, trang web cờ bạc, tiền ảo bất hợp pháp... Khi số tiền bỏ vào đầu tư đủ lớn, những kẻ lừa đảo sẽ ""cắt đuôi"" bằng cách chặn liên lạc và biến mất"", ông Anh phân tích.",25/04/2024 08:23 GMT+7,https://tuoitre.vn/ro-chieu-lua-ban-hang-tren-san-thuong-mai-dien-tu-starlink-carousell-20240425074632187.htm,"Thời gian đầu tham gia 'sàn thương mại điện tử', anh N. thấy có tiền hoa hồng trả về nên mừng thầm. Nhưng khi số tiền đến hàng tỉ đồng, anh không thể rút được."
Thủ tướng chỉ đạo hoàn thiện cơ chế đặc thù đào tạo nhân lực bán dẫn,"Chiều 24-4, tại Hà Nội, Thủ tướng Chính phủ Phạm Minh Chính chủ trì Hội nghị Phát triển nguồn nhân lực phục vụ công nghiệp bán dẫn. Cùng dự hội nghị có Phó thủ tướng Trần Hồng Hà, Phó thủ tướng Trần Lưu Quang, cùng đại diện lãnh đạo các bộ, ngành liên quan. Sinh viên còn mơ hồ về công nghệ bán dẫn Tại hội nghị, PGS.TS Vũ Hải Quân - giám đốc Đại học Quốc gia TP.HCM - cho biết hiện mỗi năm Đại học Quốc gia TP.HCM tuyển sinh khoảng 6.000 sinh viên nhóm ngành liên quan đến công nghệ thông tin, trí tuệ nhân tạo (bao gồm cả đào tạo đại học và tiến sĩ), điện tử viễn thông… Trong đó, có 8 chương trình trong top 500 thế giới, các nhóm ngành về công nghệ thông tin, điện tử viễn thông đều nằm trong top 400 - 450. Tuy nhiên, ông Quân cho biết trong quá trình xây dựng chiến lược phát triển ngành vi mạch của Đại học Quốc gia TP.HCM gặp phải 5 thách thức: Thứ nhất là nguồn tuyển. Hiện nay các sinh viên vẫn còn mơ hồ về ngành thiết kế vi mạch nói riêng và công nghệ bán dẫn. Thứ hai là đội ngũ đảm nhận. Ngay cả Đại học Quốc gia quy mô lớn như vậy nhưng tốt nghiệp chuyên ngành về bán dẫn là tiến sĩ chỉ đếm trên đầu ngón tay. Thứ ba, chương trình đào tạo mới và thay đổi liên tục. Thứ tư là chỗ thực tập cho sinh viên. Học ngành này, ngoài những lý thuyết trên lớp còn phải thực tập, thực hành thực tiễn thì mới có thể bắt tay vào làm việc được. Thứ năm, các nghiên cứu về đổi mới sáng tạo và start-up. Ông Phạm Bảo Sơn - phó giám đốc Đại học Quốc gia Hà Nội - cho biết hiện trường cung cấp nguồn nhân lực hơn 3.000 sinh viên mỗi năm trong các lĩnh vực liên quan trực tiếp hoặc gián tiếp đến lĩnh vực này.  Về các giải pháp trong đào tạo nguồn nhân lực, ông Sơn cho rằng phải tập trung vào ba vấn đề chính gồm đội ngũ giảng viên; hệ thống trang thiết bị, phòng thí nghiệm; thu hút các sinh viên giỏi tham gia trong lĩnh vực này. Hiện tại, trường có hệ thống phòng thí nghiệm, tuy nhiên những phòng thí nghiệm này chưa tích hợp được công đoạn của công nghiệp bán dẫn. Ông Phùng Việt Thắng - giám đốc quốc gia Intel tại Việt Nam - cho biết các quốc gia đã phát triển công nghiệp bán dẫn, nhất là các công ty toàn cầu như Intel, đang có những nhu cầu mới cần thay đổi và việc vẽ lại vị trí trên bản đồ thế giới về bán dẫn là cơ hội đặc biệt. Để bắt kịp cơ hội này Việt Nam cần có những kế hoạch rất nhanh, cụ thể. Chiến lược này liên quan đến rất nhiều góc độ từ đầu tư, nguồn lực cho đến con người, hạ tầng công nghệ… ""Trong công nghiệp bán dẫn, có nhiều công đoạn khác nhau và mỗi một công đoạn yêu cầu nguồn nhân lực khác nhau. Chính vì thế dù Việt Nam có một chiến lược chung để phát triển nguồn nhân lực công nghiệp bán dẫn thì cũng cần có kế hoạch hành động riêng và đặc thù cho mỗi đối tượng nhân lực mà chúng ta cần phát triển, phù hợp với thế mạnh của Việt Nam"", ông Thắng nói. Đào tạo nhân lực bán dẫn là ""đột phá của đột phá"" Phát biểu kết luận, cho biết với mục tiêu đào tạo 50.000 - 100.000 kỹ sư cho ngành bán dẫn, Thủ tướng Phạm Minh Chính nhấn mạnh các quan điểm: Thứ nhất, coi đào tạo, phát triển nguồn nhân lực cho công nghiệp bán dẫn là đột phá của đột phá trong đào tạo nhân lực chất lượng cao. Thứ hai, đa dạng hóa các loại hình đào tạo như đào tạo cơ bản, đào tạo lại, đào tạo chuyển đổi, đào tạo kỹ năng, đào tạo tiến sĩ, đào tạo trong và ngoài nước, đào tạo qua sản xuất kinh doanh. Thứ ba, đa dạng hóa mọi nguồn lực, gồm nguồn lực nhà nước, xã hội, nhân dân, phát huy quan hệ Nhà nước - xã hội - thị trường, đẩy mạnh hợp tác công tư. Về các nhiệm vụ, giải pháp trọng tâm trong thời gian tới, Thủ tướng chỉ đạo: Thứ nhất, hoàn thiện thể chế cho đào tạo nhân lực bán dẫn với cơ chế, chính sách ưu đãi, đặc thù. Thứ hai, đầu tư cho hạ tầng phục vụ đào tạo nhân lực bán dẫn, gồm cơ sở đào tạo, nhà trường, phòng thí nghiệm, nơi sản xuất… Thứ ba, đào tạo đội ngũ giáo viên, giảng viên, xây dựng chương trình, giáo trình phù hợp. Thứ tư, phương thức đào tạo cả tiệm cận và đột phá, cả trước mắt và lâu dài. Thứ năm, huy động, đa dạng hóa nguồn lực của Nhà nước, nhà trường, doanh nghiệp… Thủ tướng yêu cầu các bộ ngành, các cấp, địa phương, doanh nghiệp, đại học, các chủ thể liên quan căn cứ chức năng, nhiệm vụ, quyền hạn của mình chủ động, tích cực, linh hoạt xây dựng kế hoạch và tổ chức thực hiện hiệu quả các giải pháp cụ thể phát triển ngành nhân lực bán dẫn.",24/04/2024 20:38 GMT+7,https://tuoitre.vn/thu-tuong-chi-dao-hoan-thien-co-che-dac-thu-dao-tao-nhan-luc-ban-dan-20240424195655656.htm,"""Phát triển nguồn nhân lực cho công nghiệp bán dẫn là 'đột phá của đột phá' trong đào tạo nhân lực chất lượng cao"", Thủ tướng Phạm Minh Chính nhấn mạnh."
Thế giới cần 1 triệu nhân lực cho công nghiệp bán dẫn: lợi thế của Việt Nam,"Nhân lực bán dẫn là yếu tố quyết định Theo bộ trưởng Bộ Kế hoạch và Đầu tư, cuộc đua chip toàn cầu đang nóng lên và Việt Nam có cơ hội đặc biệt để khẳng định mình là một trong những nước tham gia vào chuỗi giá trị ngành công nghiệp bán dẫn. Ước tính ngành bán dẫn toàn cầu sẽ cần thêm hơn 1 triệu nhân sự vào năm 2030 cho tất cả các khâu thiết kế, sản xuất, lắp ráp, đóng gói và kiểm thử chip. Tại Việt Nam, hiện có hơn 50 doanh nghiệp trong ngành công nghiệp bán dẫn đã hoạt động, trong đó có những cái tên đáng chú ý như: Intel, Amkor, Hana Micron, Ampere, Marvell, Cadence, Renesas, Synopsys, Qorvo, Lam Research, Coherent. Và với nguồn cung lao động dồi dào, lực lượng lao động có chất lượng, Bộ trưởng Nguyễn Chí Dũng khẳng định nguồn nhân lực chính là lợi thế lớn nhất và nổi bật nhất của Việt Nam so với các quốc gia, nền kinh tế khác trên thế giới. Ông cũng cho rằng việc tập trung đầu tư, đào tạo, đào tạo lại cho lực lượng lao động để trong thời gian sớm nhất có thể gia nhập vào thị trường lao động là một hướng đi chiến lược, yếu tố quyết định để có thể tận dụng cơ hội hợp tác đầu tư, tiếp cận, chuyển giao công nghệ, thúc đẩy sự phát triển kinh tế nhanh và bền vững dựa trên khoa học công nghệ và đổi mới sáng tạo. Chi 26.000 tỉ đồng để đào tạo 50.000 kỹ sư bán dẫn Hiện đề án phát triển nguồn nhân lực ngành công nghiệp bán dẫn đến năm 2030, định hướng đến năm 2045 đang được Bộ Kế hoạch và Đầu tư xây dựng. Đề án xác định mục tiêu đến năm 2030, kỹ sư Việt Nam tham gia sâu vào quy trình thiết kế, công đoạn đóng gói và kiểm thử, làm chủ được một phần công nghệ đóng gói và kiểm thử, từng bước nắm bắt được công nghệ trong công đoạn sản xuất. Đào tạo được 50.000 kỹ sư phục vụ ngành công nghiệp bán dẫn trong tất cả các công đoạn của chuỗi giá trị. Trong đó có 15.000 kỹ sư thiết kế vi mạch bán dẫn và 35.000 kỹ sư trong lĩnh vực khác của ngành công nghiệp bán dẫn. Và trong số 50.000 kỹ sư ngành bán dẫn, tối thiểu có 5.000 kỹ sư có chuyên môn sâu về trí tuệ nhân tạo. Và trong giai đoạn đầu thực hiện đề án, Việt Nam sẽ tập trung đào tạo nguồn nhân lực để tham gia công đoạn thiết kế, đóng gói, kiểm thử và một số công đoạn khác liên quan đến sản xuất thiết bị, vật liệu, hóa chất là phù hợp. Hình thức đào tạo chủ yếu là đào tạo ngắn hạn, nâng cao, chuyển đổi từ các ngành gần, ngành phù hợp sang ngành công nghiệp bán dẫn. Song song đó, hình thức đào tạo chính quy cũng sẽ được triển khai trên cơ sở hợp tác chặt chẽ giữa ba nhà là Nhà nước, nhà trường, nhà doanh nghiệp và liên kết quốc tế trong xây dựng, nhập khẩu chương trình, thu hút chuyên gia quốc tế về Việt Nam giảng dạy. Về cơ sở vật chất, trên cơ sở kinh nghiệm thành công của các quốc gia có ngành công nghiệp bán dẫn phát triển, để hỗ trợ cho việc đào tạo, phát triển nguồn nhân lực ngành công nghiệp bán dẫn, Bộ Kế hoạch và Đầu tư cho rằng Việt Nam cần tối thiểu bốn trung tâm bán dẫn dùng chung cấp quốc gia với các trang thiết bị theo tiêu chuẩn quốc tế đặt tại các đại học quốc gia, đại học vùng ở ba miền Bắc, Trung, Nam và tại Trung tâm Đổi mới sáng tạo quốc gia. Các trung tâm bán dẫn dùng chung có chức năng hỗ trợ đào tạo, nghiên cứu, phát triển và ươm tạo doanh nghiệp. Bên cạnh đó cần đầu tư khoảng 18 trung tâm đào tạo bán dẫn tiêu chuẩn ở mức cơ bản tại 18 trường đại học kỹ thuật đáp ứng được yêu cầu. Về nguồn lực để đào tạo 50.000 kỹ sư bán dẫn trong giai đoạn từ nay đến 2030, theo tính toán của Bộ Kế hoạch và Đầu tư, cần khoảng 26.000 tỉ đồng, trong đó ngân sách nhà nước khoảng 17.000 tỉ đồng và nguồn xã hội hóa khoảng 9.000 tỉ đồng.",24/04/2024 18:51 GMT+7,https://tuoitre.vn/the-gioi-can-1-trieu-nhan-luc-cho-cong-nghiep-ban-dan-loi-the-cua-viet-nam-2024042418361049.htm,"Bộ trưởng Bộ Kế hoạch và Đầu tư Nguyễn Chí Dũng khẳng định tại Hội nghị Phát triển nguồn nhân lực phục vụ công nghiệp bán dẫn, do Thủ tướng chủ trì ngày 24-4, ở Hà Nội."
Thủ tướng yêu cầu mở rộng các tiện ích trên ứng dụng VNeID,"Ngày 24-4, Thủ tướng Phạm Minh Chính - chủ tịch Ủy ban Quốc gia về chuyển đổi số - chủ trì phiên họp lần thứ 8 với trọng tâm thảo luận về kinh tế số. Đánh giá các kết quả đạt được, song Thủ tướng cho rằng việc chuyển đổi số, phát triển kinh tế số còn nhiều tồn tại, hạn chế. Bộ trưởng, thứ trưởng quan tâm chuyển đổi số thì kết quả khác ngay Trong đó, nhiều lãnh đạo các ban, bộ, ngành, địa phương chưa coi chuyển đổi số là nhiệm vụ trọng tâm, chưa thực sự quan tâm, chỉ đạo, ưu tiên nguồn lực cho chuyển đổi số.  ""Bộ, ngành nào mà bộ trưởng, thứ trưởng quan tâm tới chuyển đổi số thì kết quả khác ngay, điển hình như Bộ Công an, tạo động lực, truyền cảm hứng cho các cơ quan khác"", Thủ tướng nêu.  Do đó, Thủ tướng yêu cầu các bộ trưởng, chủ tịch tỉnh cần quyết liệt triển khai các nhiệm vụ chuyển đổi số quốc gia, chú trọng ""3 tăng cường"" và ""5 đẩy mạnh"".  Trong đó, 3 tăng cường là nâng cao nhận thức, tăng tiềm lực, nguồn lực cho chuyển đổi số và tăng hợp tác; 5 đẩy mạnh gồm hoàn thiện thể chế, phát triển hạ tầng số, đẩy mạnh đổi mới sáng tạo, lập nghiệp, phát triển nhân lực số và đẩy mạnh an ninh mạng, an toàn thông tin. Người đứng đầu Chính phủ đưa ra các giải pháp, đó là ưu tiên nguồn lực cho chuyển đổi số với ba chiến lược, gồm Chính phủ số, phát triển kinh tế số và xã hội số, dữ liệu số.  ""Mỗi bộ, ngành, địa phương phải có 1 đề án chuyển đổi số như Bộ Công an đã làm và kết nối với đề án 06"", Thủ tướng yêu cầu và giao Bộ Công an phổ biến kinh nghiệm. Sớm hoàn thiện để ban hành chiến lược phát triển ngành bán dẫn; phát triển nguồn nhân lực bán dẫn. Có giải pháp để chỉ số phát triển Chính phủ điện tử của Liên Hiệp Quốc tăng ít nhất 5 bậc và chỉ số an toàn an ninh mạng thuộc nhóm 30 nước dẫn đầu. Thực hiện nghiêm các chỉ đạo của Chính phủ, Thủ tướng Chính phủ, kế hoạch hoạt động năm 2024 của Ủy ban Quốc gia về chuyển đổi số và các nhiệm vụ trong đề án 06. Số hóa trong cải cách hành chính Trong đó, Bộ Thông tin và Truyền thông sớm hoàn thiện Luật Công nghiệp công nghệ số; nghị định hướng dẫn Luật Giao dịch điện tử (sửa đổi), Luật Viễn thông (sửa đổi); xây dựng hệ thống kiểm tra, giám sát, theo dõi, tổng hợp, đánh giá việc triển khai công tác chuyển đổi số quốc gia.  Bộ Công an đẩy mạnh triển khai đề án 06; chủ trì, phối hợp với các cơ quan liên quan khẩn trương hoàn thiện hồ sơ lập đề nghị xây dựng Luật Bảo vệ dữ liệu cá nhân, Luật Dữ liệu trình Chính phủ xem xét, thông qua.  Tiếp tục mở rộng các tiện ích trên ứng dụng VNeID và nghiên cứu, đề xuất ban hành các quy định pháp lý liên quan. Triển khai hiệu quả việc thí điểm cấp phiếu lý lịch tư pháp tại Hà Nội, Thừa Thiên Huế trước khi triển khai nhân rộng; đẩy nhanh tiến độ triển khai xây dựng Trung tâm Dữ liệu quốc gia. Bộ Nội vụ khẩn trương hoàn thiện, báo cáo Chính phủ trình Quốc hội thông qua Luật Lưu trữ (sửa đổi); tập trung số hóa trong cải cách hành chính, nhất là thủ tục hành chính. Các bộ, ngành khẩn trương tổ chức các phiên họp chuyên đề số hóa các ngành, lĩnh vực thuộc phạm vi quản lý. Các địa phương phối hợp chặt chẽ với các doanh nghiệp viễn thông xóa bỏ các vùng lõm sóng di động.  Tập trung tháo gỡ khó khăn vướng mắc, hoàn thành triển khai 12/53 dịch vụ công thiết yếu; rà soát, đánh giá tình hình bảo đảm an toàn thông tin mạng, an ninh mạng đối với các hệ thống thông tin.     ",24/04/2024 14:33 GMT+7,https://tuoitre.vn/thu-tuong-yeu-cau-mo-rong-cac-tien-ich-tren-ung-dung-vneid-20240424140116722.htm,"Tiếp tục mở rộng các tiện ích trên ứng dụng VNeID và nghiên cứu, đề xuất ban hành các quy định pháp lý liên quan theo yêu cầu của Thủ tướng."
