Title,Content,Date,Url,Summary
Hàng ngàn người đến thưởng thức bánh dân gian Nam Bộ trong đêm khai mạc,"Lễ khai mạc Lễ hội bánh dân gian Nam Bộ lần thứ 11 năm 2024 diễn ra tại quảng trường quận Bình Thủy (TP Cần Thơ) tối 17-4 và kéo dài đến hết ngày 21-4, với quy mô 200 - 250 gian hàng bánh dân gian, ẩm thực, đặc sản vùng miền. Ngay trong đêm khai mạc đã có hàng ngàn người dân đổ về khu vực tổ chức lễ hội để tham quan, thưởng thức các món bánh dân gian.  Phát biểu tại lễ khai mạc, ông Nguyễn Thực Hiện - phó chủ tịch UBND TP Cần Thơ - cho biết Lễ hội bánh dân gian Nam Bộ là sự kiện được thành phố tổ chức thường niên. Qua 10 năm tổ chức đã khẳng định được hình ảnh, thương hiệu và sức lan tỏa, góp phần bảo tồn, phát huy giá trị ẩm thực dân gian của vùng đất Nam Bộ.  Đồng thời là dịp để quảng bá hình ảnh du lịch TP Cần Thơ đến du khách trong nước và quốc tế. Theo ông Hiện, đến với lễ hội, du khách sẽ có dịp thưởng thức nhiều loại bánh dân gian được chế biến từ bàn tay khéo léo của các nghệ nhân, với nguyên liệu gạo nếp và rau củ quả được chế biến sáng tạo thành nhiều loại bánh dân gian, chứa đựng giá trị văn hóa sâu sắc, gần gũi, đi vào tâm thức của người dân. Trong khuôn khổ lễ hội cũng diễn ra hội thi bánh dân gian quy tụ các nghệ nhân giao lưu, chia sẻ kinh nghiệm trong cách làm bánh, góp phần bảo tồn và phát huy giá trị bánh dân gian. Đặc biệt năm nay lễ hội có không gian giới thiệu nghề làm bánh tráng Thuận Hưng (thuộc quận Thốt Nốt, TP Cần Thơ), trình diễn chiên bánh xèo khổng lồ và nhiều hoạt động khác. Thông qua lễ hội sẽ tạo điều kiện cho các nghệ nhân liên kết với các doanh nghiệp trong và ngoài nước, thúc đẩy ngành chế biến, sản xuất bánh dân gian trở thành đặc sản Nam Bộ, từng bước xây dựng thương hiệu, quảng bá, thúc đẩy du lịch TP Cần Thơ ngày càng phát triển. Ông Hiện đề nghị những ngày diễn ra lễ hội, ban tổ chức phải thực hiện nghiêm đảm bảo an toàn vệ sinh thực phẩm, vệ sinh môi trường, đảm bảo an ninh trật tự, nâng cao thái độ ứng xử văn minh phục vụ du khách.",17/04/2024 21:35 GMT+7,https://tuoitre.vn/hang-ngan-nguoi-den-thuong-thuc-banh-dan-gian-nam-bo-trong-dem-khai-mac-20240417195003884.htm,"Ngay đêm khai mạc Lễ hội bánh dân gian Nam Bộ, người dân đã ùn ùn đổ về tham quan, thưởng thức các món ngon."
Dẹp luôn cầu thang lên thiên đường vì du khách quá mạo hiểm,"Theo thông cáo báo chí từ chính quyền thành phố Honolulu, thang Haiku, một điểm tham quan nổi tiếng ở đảo Oahu, thường được gọi là ""cầu thang lên thiên đường"", sẽ bị phá bỏ từ cuối tháng 4. Cầu thang lên thiên đường nguy hiểm nhưng hấp dẫn ""Tôi khẳng định đây không phải là một quyết định bộc phát"", Thị trưởng Rick Blangiardi nói trong tuyên bố. Cầu thang Haiku được Hải quân Hoa Kỳ xây dựng trong Thế chiến thứ hai và chính thức đóng cửa đối với công chúng từ năm 1987. Vì sự lan truyền mạnh mẽ của mạng xã hội, nhiều vấn đề bắt đầu phát sinh. Cầu thang Haiku bao gồm 3.922 bậc xoắn qua con đường núi dài gần 1km ở Kaneohe, phía đông Oahu. Bất chấp địa hình nguy hiểm, các YouTuber, TikToker, những người thích cảm giác mạnh và du khách vẫn tiếp tục leo lên cầu thang. Esther Kiaʻāina, thành viên Hội đồng thành phố Honolulu, nói với kênh CNN: ""Do tình trạng xâm nhập bất hợp pháp tràn lan, cầu thang Haiku đặt ra trách nhiệm và chi phí đáng kể cho thành phố, đồng thời ảnh hưởng đến chất lượng cuộc sống của cư dân gần đó"". Theo văn phòng thị trưởng, hội đồng đã nhất trí bỏ phiếu dỡ bỏ cầu thang vào năm 2021. Công việc này sẽ mất ít nhất sáu tháng và tiêu tốn 2,5 triệu USD (khoảng 63 tỉ đồng). ""Quyết định này được đưa ra dựa trên sự tôn trọng đối với những người sống trong và xung quanh lối vào cầu thang, với ʻāina [đất và biển], cũng như với cả tương lai và lịch sử của nền văn hóa cộng đồng Haʻikū"", Thị trưởng Blangiardi nói thêm. Tìm cách chinh phục bất chấp hậu quả Theo thông cáo báo chí, có nhiều yếu tố ảnh hưởng đến quyết định này. Việc dỡ bỏ cầu thang ""ưu tiên an toàn công cộng, tìm cách ngăn chặn việc xâm phạm bất hợp pháp lên cầu thang và các nhà lân cận - những người đã phải đối mặt với sự bất ổn và xáo trộn trong nhiều thập kỷ, giải quyết trách nhiệm đáng kể cho thành phố, bảo tồn vẻ đẹp và tình trạng tự nhiên của khu vực cũng như cải thiện chất lượng cuộc sống của người dân khu vực xung quanh"". CNN từng miêu tả khi lên đến đỉnh cao nhất của cầu thang, du khách có thể trông thấy cảnh đẹp ấn tượng như thể xuyên qua những đám mây. Nhiều người dân địa phương coi đây là cảnh đẹp nhất ở Hawaii. Nhiều năm, rất nhiều người bị thương vì tìm cách chinh phục chiếc cầu thang ngoạn mục mà đầy hiểm nguy này. Năm 2021, một thanh niên 24 tuổi bị thương ở đầu gối và phải được cứu hộ bằng máy bay. Brandon Elefante, một thành viên khác của Hội đồng thành phố Honolulu, nói thành phố đã chi gần 1 triệu USD tiền thuế của người dân để tu sửa cầu thang và hàng trăm ngàn USD chi phí an ninh. Mức phạt tối đa đối với những người bị bắt vì xâm phạm cầu thang Haiku là 1.000 USD. Tuy nhiên, dường như những người đam mê thám hiểm không vì vậy mà từ bỏ ước muốn một lần được thám hiểm khu vực này. Thoạt nhìn, cầu thang Haiku trông khá giống ""sống lưng khủng long"" ở Tà Xùa, địa danh du lịch nổi tiếng thu hút nhiều người đến chinh phục tại Việt Nam. Đây cũng là cung đường khó đi, địa hình trắc trở và phức tạp.",17/04/2024 20:10 GMT+7,https://tuoitre.vn/dep-luon-cau-thang-len-thien-duong-vi-du-khach-qua-mao-hiem-2024041719570248.htm,Cầu thang lên thiên đường đẹp ngoạn mục dẫn đến một danh lam thắng cảnh ở Hawaii sẽ bị dỡ bỏ vì khách du lịch liên tục vào địa điểm tham quan bị cấm này.
Saigontourist Group hợp tác thúc đẩy du lịch Bến Tre,"Lễ ký kết nhằm đẩy mạnh hợp tác phát triển du lịch, xúc tiến đầu tư, phát triển sản phẩm, dịch vụ du lịch, quảng bá tiếp thị, tổ chức sự kiện, đào tạo nhân lực và hỗ trợ ngành du lịch trong quá trình phát triển, đưa du lịch trở thành ngành kinh tế mũi nhọn, tạo động lực phát triển kinh tế - xã hội của tỉnh Bến Tre. ""Thỏa thuận hợp tác là cơ hội để tập đoàn phát triển kinh doanh tại thị trường Bến Tre, trong nỗ lực đẩy mạnh khai thác nguồn khách trong và ngoài nước đến Bến Tre và khai thác nguồn khách tại tỉnh Bến Tre"", ông Phạm Huy Bình, Chủ tịch Saigontourist Group, nhận định về tầm quan trọng của thỏa thuận hợp tác giữa hai bên. Tập đoàn sẽ tư vấn công tác quy hoạch, đầu tư xây dựng các sản phẩm, dịch vụ du lịch mới, các sản phẩm liên kết các địa phương trong địa bàn tỉnh và liên kết vùng nhằm mục tiêu phát triển du lịch của tỉnh Bến Tre. Tập đoàn giao Công ty Dịch vụ Lữ hành Saigontourist tăng cường trao đổi, hợp tác với các đơn vị, đối tác tại tỉnh Bến Tre xây dựng phát triển các sản phẩm du lịch, tour, tuyến mới tại Bến Tre. Trong lĩnh vực đào tạo, tập đoàn giao Trường Trung cấp Du lịch và Khách sạn Saigontourist và các đơn vị thành viên của Saigontourist Group nghiên cứu phối hợp với các trường, các trung tâm tại Bến Tre đào tạo, tập huấn, bồi dưỡng về lĩnh vực du lịch và nghề về du lịch; tạo điều kiện cho sinh viên tham gia thực tập; đặt hàng đào tạo và ưu tiên tuyển dụng nguồn nhân lực được đào tạo theo nhu cầu phát triển của tập đoàn. Saigontourist Group đồng thời tư vấn, hỗ trợ, phối hợp với tỉnh Bến Tre trong các hoạt động quảng bá và xúc tiến du lịch, công tác truyền thông; tư vấn tổ chức sự kiện lễ hội du lịch, văn hóa ẩm thực trong và ngoài nước.  Ngoài ra, tập đoàn cũng sẽ hỗ trợ và đồng hành cùng tỉnh Bến Tre triển khai các nội dung hợp tác nhằm cụ thể hóa việc đóng góp cho sự phát triển du lịch của tỉnh. ""Việc ký kết hợp tác chiến lược giữa Ủy ban nhân dân tỉnh Bến Tre và tập đoàn sẽ là nền tảng vững chắc để tiếp tục xây dựng và phát huy hơn nữa những thành tựu của sự liên kết trong những năm qua và trong thời gian sắp tới. Đây được xem là cột mốc quan trọng, vừa đẩy mạnh hợp tác phát triển du lịch, xúc tiến đầu tư du lịch, đào tạo và các nội dung khác hỗ trợ ngành du lịch Bến Tre trong quá trình phát triển, đồng thời hỗ trợ phát triển kinh doanh của tập đoàn tại thị trường Bến Tre"", bà Nguyễn Thị Bé Mười, Phó chủ tịch UBND tỉnh Bến Tre, phát biểu. Trong giai đoạn hợp tác từ năm 2024-2029, tỉnh Bến Tre tạo điều kiện cho tập đoàn trong quá trình khảo sát, đầu tư, nghiên cứu và xây dựng các sản phẩm, chương trình, dịch vụ du lịch mới nhằm thu hút du khách đến Bến Tre.  Tỉnh hỗ trợ tập đoàn các công việc liên quan đến quá trình tổ chức, triển khai các hoạt động du lịch, khai thác nguồn khách tại tỉnh, hoạt động đầu tư dự án trên địa bàn tỉnh Bến Tre. Và khuyến khích sử dụng các sản phẩm tour, tuyến trong và ngoài nước của Chi nhánh Lữ hành Saigontourist tại Bến Tre, Công ty Dịch vụ Lữ hành Saigontourist và các sản phẩm, dịch vụ tại các khách sạn, khu nghỉ dưỡng, nhà hàng, khu giải trí… thuộc Saigontourist Group.  Trong lĩnh vực đào tạo nghề, tỉnh Bến Tre cam kết hỗ trợ Trường Trung cấp Du lịch và Khách sạn Saigontourist mở các khóa đào tạo, bồi dưỡng nghề du lịch tại Bến Tre. Tập đoàn triển khai chương trình liên kết phục hồi du lịch ""Liên kết du lịch giữa TP.HCM và tỉnh Bến Tre"" vào tháng 10-2021. Đoàn khách du lịch đầu tiên đã tham quan ""vùng xanh"" xứ dừa của Bến Tre vào ngày 13-11-2021, đúng dịp tỉnh tổ chức Lễ phát động các hoạt động thương mại, thể thao và du lịch.  Saigontourist Group cũng hỗ trợ Bến Tre trong tổ chức hội nghị đầu tư, quảng bá tiếp thị và tham gia Lễ hội Văn hóa Ẩm thực, Món ngon Saigontourist Group tại TP.HCM từ năm 2022 đến 2024 và Lễ hội đặc sắc nhất thế giới năm 2023. Từ một nơi tương đối cách trở về giao thông, Bến Tre đã dần thoát khỏi vị thế ""tỉnh lẻ"" trên bản đồ du lịch của vùng Đồng bằng sông Cửu Long. Dựa trên nguồn tài nguyên du lịch và nguồn tài nguyên nhân văn sẵn có, tỉnh Bến Tre đang nỗ lực đẩy mạnh xây dựng và phát triển các loại hình du lịch sinh thái miệt vườn, du lịch về nguồn, du lịch làng nghề và du lịch cộng đồng… nhằm biến nơi đây trở thành một trong những điểm đến hấp dẫn của khu vực.",17/04/2024 18:00 GMT+7,https://tuoitre.vn/saigontourist-group-hop-tac-thuc-day-du-lich-ben-tre-20240417151518976.htm,Ngày 16-4 đã diễn ra Lễ ký kết hợp tác giữa Tổng Công ty Du lịch Sài Gòn (Saigontourist Group) và Ủy ban nhân dân tỉnh Bến Tre giai đoạn 2024 - 2029.
Lần đầu tiên tổ chức lễ hội 100 năm cây dừa sáp tại Trà Vinh,"Ngày 17-4, thông tin từ UBND tỉnh Trà Vinh cho biết nhằm giới thiệu, quảng bá đến du khách những hình ảnh về quê hương Cầu Kè, các tiềm năng du lịch của huyện, đặc biệt là trái cây ngon của Cầu Kè đến với du khách, nhất là sản phẩm dừa sáp, UBND tỉnh sẽ tổ chức Festival 100 năm cây dừa sáp vào cuối tháng 8-2024. Sở Văn hóa, Thể thao và Du lịch tỉnh Trà Vinh sẽ phối hợp với UBND huyện Cầu Kè - địa phương có diện tích dừa sáp lớn nhất tỉnh - để tổ chức. Đây là lần đầu tiên, trái dừa sáp Trà Vinh vốn nổi tiếng về độ ngon, lạ có lễ hội riêng. Trà Vinh là tỉnh có diện tích dừa đứng thứ hai ở Đồng bằng sông Cửu Long (sau Bến Tre), với gần 27.400ha, sản lượng hằng năm khoảng 444 triệu quả, trong đó có hơn 752ha dừa sáp (tập trung nhiều nhất ở huyện Cầu Kè). Lễ hội dừa sáp nhằm tôn vinh những giá trị đặc sắc của dừa sáp Trà Vinh và nỗ lực đưa các sản phẩm chế biến từ dừa sáp ra thị trường thế giới. Qua đó, nâng cao ý thức xây dựng, giữ gìn và phát triển thương hiệu cũng như phát huy nội lực trong toàn tỉnh. Sự kiện còn tạo điều kiện giao thương hàng hóa, kết nối cung cầu, góp phần thúc đẩy phát triển kinh tế, xã hội của huyện Cầu Kè nói riêng và tỉnh Trà Vinh nói chung. Lễ hội sẽ có cuộc thi chế biến 100 món ăn ngon từ dừa sáp (dự kiến xác lập kỷ lục Việt Nam), hội thảo về thực trạng và tiềm năng dừa sáp bản địa Cầu Kè, hoạt động trưng bày trái cây ngon, tọa đàm du lịch Cầu Kè - tiềm năng ven sông Hậu, hội chợ thương mại, các hoạt động thể thao, trò chơi dân gian… Sự kiện quy mô cấp tỉnh này còn kết hợp với việc tổ chức Tuần lễ Vu lan Thắng hội huyện Cầu Kè. Trong dịp này sẽ công bố quyết định của Bộ Văn hóa, Thể thao và Du lịch chứng nhận đây là di sản văn hóa phi vật thể quốc gia. Dừa sáp được trồng nhiều ở huyện Cầu Kè, tỉnh Trà Vinh vì hợp thổ nhưỡng. Điều đặc biệt, không phải cây dừa sáp nào cũng cho trái dừa có sáp và trong một buồng dừa không phải trái nào cũng có sáp. Vì thế, giá trị của dừa sáp luôn vượt mặt những loại dừa khác gấp bội. Dừa sáp hay còn gọi là dừa đặc ruột, dừa kem..., không có nước cơm dừa dày, mềm dẻo và béo hơn trái dừa thường, nước dừa đặc lại trong veo như sương sa. Bên trong trái dừa chứa phần cơm dừa đặc quánh thì mới đạt chuẩn cao nhất. Nếu có nước thì sẽ rất ít và loại nước này phải sền sệt, có vị thanh ngọt, là đặc sản duy nhất chỉ có ở tỉnh Trà Vinh. Trước nay, người ta vẫn dùng phần cơm dừa sáp để xay với đường, sữa hay cho thêm sầu riêng, ca cao để sử dụng như sinh tố, hoặc phần cơm dừa này có thể ăn trực tiếp.",17/04/2024 15:51 GMT+7,https://tuoitre.vn/lan-dau-tien-to-chuc-le-hoi-100-nam-cay-dua-sap-tai-tra-vinh-20240417152648232.htm,"Dừa sáp là một loại trái cây đặc sản của Trà Vinh, việc tổ chức Festival 100 năm cây dừa sáp riêng nhằm tôn vinh những giá trị đặc sắc, và quyết tâm đưa các sản phẩm từ loại trái cây này ra thị trường thế giới."
"Thành phố sa mạc Dubai ngập lụt, 18 người chết ở Oman do mưa lớn","Ngày 17-4, Hãng hàng không Emirates đã tạm dừng việc làm thủ tục lên máy bay cho nhiều hành khách cho đến nửa đêm, trong bối cảnh Các tiểu vương quốc Ả Rập thống nhất (UAE) đang ghi nhận lượng mưa lớn kỷ lục. Sân bay quốc tế Dubai cũng cho biết họ đang gặp các gián đoạn đáng kể do các chuyến bay bị trì hoãn hoặc phải chuyển hướng do mưa lớn. Đăng tải trên mạng xã hội, sân bay này khuyên hành khách ở Dubai không nên đến sân bay. Sân bay Dubai là trung tâm trung chuyển lớn và bận rộn nhất thế giới với những chuyến bay quốc tế. Hôm 16-4, sân bay này đã phải tạm ngừng hoạt động trong thời gian ngắn do mưa lớn gây ngập lụt khắp thành phố Dubai và nhiều nơi khác thuộc UAE. Truyền thông địa phương đưa tin một người đàn ông khoảng 70 tuổi ở Tiểu vương quốc Ras Al Khaimah hôm 16-4 thiệt mạng khi xe của ông bị ngập trong nước lũ quét. Cùng ngày, UAE ghi nhận đón lượng mưa trong 24 giờ lớn lịch sử, đạt kỷ lục từ khi bắt đầu các ghi nhận vào năm 1949, theo Trung tâm Khí tượng quốc gia UAE. Trung tâm này cho biết lượng mưa 254mm được ghi nhận trong vòng chưa đến 24 giờ ở thành phố Al Ain, một phần của Tiểu vương quốc Abu Dhabi, giáp với Oman. Theo Đài CNA, mưa xối xả gây lũ lụt khắp UAE và Bahrain đã làm tê liệt trung tâm tài chính Dubai của Trung Đông, cũng như khiến 18 người tại Oman thiệt mạng trong hai ngày 14 đến 15-4. Sau khi quét qua Oman, nhiều cơn bão đổ bộ vào UAE, Bahrain và một phần của Qatar, gây lũ lụt và khiến hàng chục người mắc kẹt. Cơ quan khẩn cấp của Oman hôm 16-4 cho biết thi thể của một trẻ em đã được tìm thấy, nâng số người thiệt mạng lên 18, và hai người mất tích. Hãng tin của Oman hôm 14-4 đưa tin chín học sinh và ba người lớn thiệt mạng khi xe của họ bị cuốn trôi trong lũ quét. ""Em thích chơi dưới mưa, nhưng đây là lần đầu tiên mưa làm em sợ"", em Ali Hassan, 9 tuổi, nói khi đang phụ mẹ dọn nước ngập bên ngoài ngôi nhà của họ ở thủ đô Manama của Bahrain. Theo những hình ảnh đăng trên mạng xã hội về Dubai ngập lụt, các trung tâm mua sắm hàng đầu như Dubai Mall và Mall of the Emirates đều bị ngập nước. Nước cũng ngập đến mắt cá chân tại ít nhất một ga tàu điện ngầm Dubai. Các trường học trên khắp UAE đã và dự kiến sẽ tiếp tục đóng cửa vào ngày 17-4, khi dự báo sẽ có thêm những cơn bão.",17/04/2024 15:07 GMT+7,https://tuoitre.vn/thanh-pho-sa-mac-dubai-ngap-lut-18-nguoi-chet-o-oman-do-mua-lon-20240417145350055.htm,"Mưa lớn đạt mức lịch sử trong vòng 70 năm đã khiến Dubai ngập lụt. Lũ lụt đã làm tê liệt trung tâm tài chính Dubai, cũng như khiến 18 người tại Oman thiệt mạng."
"Kỳ lạ, đang mùa hè mai anh đào Đà Lạt lại nở","Nhiều người dân và du khách tại Đà Lạt đều cảm thấy bất ngờ, lạ lùng và thích thú vì đang mùa hè, hoa mai anh đào lại nở ở nhiều nơi trong nội ô Đà Lạt. Cụ Nguyễn Văn Đoàn (83 tuổi, P.2, Đà Lạt) cho biết đây là chuyện chưa từng xảy ra ở Đà Lạt. Theo cụ Đoàn, mai anh đào là hoa báo xuân, thường nở trong 2 tháng cuối năm cũ, đầu năm mới. Sau khi mai anh đào nở thì sẽ có hoa ban, hoa phượng tím, phượng đỏ nở. Mai anh đào hiện đang nở nhiều ở các cung đường như: Trần Hưng Đạo, Hồ Tùng Mậu, Phạm Ngũ Lão, Hùng Vương, Trần Phú… Anh Huỳnh Phúc Ân (45 tuổi, P.2, Đà Lạt) nói: “Quá bất ngờ, lần đầu tiên tôi thấy mai anh đào nở cùng với phượng tím, phượng đỏ. Không rõ vì chuyện gì, có lẽ do biến đổi khí hậu. Mình nghĩ dịp lễ tới mà du khách đến Đà Lạt chụp ảnh với mai anh đào thì đúng là quá lạ lùng. Chẳng thể hiểu, mùa hè mà lại có mai anh đào"".",17/04/2024 14:58 GMT+7,https://tuoitre.vn/ky-la-dang-mua-he-mai-anh-dao-da-lat-lai-no-20240417115140364.htm,"Đang mùa hè, mai anh đào Đà Lạt ở khu vực nội ô lại nở rộ. Theo nhiều người dân ở Đà Lạt, đây là hiện tượng chưa từng có."
