Title,Content,Date,Url,Summary
'Thổ địa' Đà Nẵng chỉ 5 điểm lang thang một ngày nghỉ lễ,"Nhiều điểm đến dưới đây có thể chỉ thổ địa Đà thành mới biết. Đặc biệt, bạn có thể đi cùng gia đình có trẻ nhỏ, tận hưởng những giây phút cực ""chill"" với thiên nhiên. 1. Bán đảo Sơn Trà Nghe có vẻ quen, nhưng thực tế du khách ở xa đến chưa biết Sơn Trà ngoài những cung đường đẹp tựa tranh vẽ, còn có những bãi, ghềnh... phù hợp để lang thang một ngày nghỉ lễ. Bạn có thể đến Bãi Cháy là địa điểm khá gần trung tâm Đà Nẵng. Bãi Cháy nằm ở một ""thung lũng"" nhỏ ngay trên đường đi từ thành phố hướng về chùa Linh Ứng. Địa điểm này thích hợp đi từ 15h30 chiều, có thể tận hưởng một buổi dã ngoại nhẹ nhàng cùng hoàng hôn ở đây. Ghềnh Bàng là một địa điểm khác cũng thuộc bán đảo Sơn Trà, đoạn trước cổng khách sạn Intercol, rẽ phải hướng xuống biển. Bạn sẽ men theo con đường mòn nhỏ xuyên qua nhiều cây rừng khá thú vị.  Ghềnh Bàng thích hợp đi từ sáng sớm. Nơi đây có nhiều bãi cát, đá và những ô nước nhỏ có thể chơi đùa thỏa thích nếu đi cùng nhóm bạn hoặc gia đình. Lưu ý khi du lịch ở Sơn Trà, cần cẩn thận cất thức ăn thật kỹ để tránh khỉ trông thấy sẽ lao vào giật thức ăn gây nguy hiểm. Đặc biệt không cho khỉ ăn, làm mất bản năng kiếm ăn trong tự nhiên của loài khỉ. 2. Đèo Hải Vân Bạn nên đi vào sáng sớm để cảm nhận hết vẻ đẹp của cung đường hùng vĩ này. Bạn có thể may mắn được ngắm những áng mây lượn lờ quanh sườn đèo. Dọc đường đừng quên dừng ở các quán cà phê hai bên đèo để ngắm cảnh và chụp ảnh. Nếu muốn, bạn có thể đi Làng Vân với chừng 30 phút đi bộ. Từ đèo Hải Vân, bạn có thể đi cung đường Cầu Vòm Đồn Cả. Đoạn này là qua đỉnh đèo về phía Lăng Cô, có bảng hướng dẫn đi về Cầu Vòm Đồn Cả. Đoạn đường này khá nhỏ hẹp, có đoạn đi bộ vì đi dọc theo đường ray tàu, đến con suối trong veo. Trên đường đi, bạn sẽ được nhìn lên cầu Vòm, có tàu hỏa chạy ngang qua đầu. Hãy canh me để có những khoảnh khắc ""sống ảo"" để đời ở đây. 3. Ngũ Hành Sơn Nên đi Ngũ Hành Sơn từ sáng sớm để thỏa sức khám phá quần thể di tích quốc gia đặc biệt này. Rời công việc văn phòng ngột ngạt, trải nghiệm cùng nhau leo núi, ngắm nhìn hang động, xem cách các nghệ nhân điêu khắc đá và những sản phẩm từ đá… sẽ cho bạn thêm nhiều năng lượng trong ngày nghỉ. Nếu không đủ sức khỏe, bạn có thể chọn lên đỉnh núi bằng thang máy, phóng tầm mắt ra xa hướng về thành phố biển. 4. Hòa Bắc Hãy xuất phát từ sáng sớm, chạy dọc theo suối và sông Cu Đê để đến Hòa Bắc. Nơi này có nhiều khu du lịch, trải nghiệm các dịch vụ ăn uống đặc sản địa phương và cắm trại… Nơi đây có nhiều khu du lịch sinh thái cộng đồng, nên bạn có thể dễ dàng tìm kiếm trên Facebook để lựa chọn trải nghiệm cho riêng mình. 5. Hòa Phú Cách Đà Nẵng tầm 20km về phía tây. Có thể di chuyển bằng ô tô rất thuận tiện. Ở Hòa Phú có rất nhiều khu du lịch từ chuyên nghiệp đến không chuyên. Nhiều địa điểm có sân cỏ rộng xanh mát, có những ô suối nhỏ an toàn. Hòa Phú có những khoảng rừng có thể đi bộ với nhiều cỏ hoa, có khu nhà của người Cơ Tu và đặc biệt đồ ăn cũng khá ngon. Nếu bạn không thích ngủ lều, có thể ở lại trong các căn phòng nhỏ. Nếu cắm lều thì bãi cỏ rất an toàn. ",17/04/2024 14:00 GMT+7,https://tuoitre.vn/tho-dia-da-nang-chi-5-diem-lang-thang-mot-ngay-nghi-le-20240417113745887.htm,"Dịp lễ giỗ Tổ Hùng Vương được nghỉ một ngày, bạn có thể chọn lang thang ở Đà Nẵng dù là gia đình có con nhỏ hay đi cùng bạn bè, người thương."
'Thổ địa' Đà Nẵng chỉ 5 điểm lang thang một ngày nghỉ lễ,"Nhiều điểm đến dưới đây có thể chỉ thổ địa Đà thành mới biết. Đặc biệt, bạn có thể đi cùng gia đình có trẻ nhỏ, tận hưởng những giây phút cực ""chill"" với thiên nhiên. 1. Bán đảo Sơn Trà Nghe có vẻ quen, nhưng thực tế du khách ở xa đến chưa biết Sơn Trà ngoài những cung đường đẹp tựa tranh vẽ, còn có những bãi, ghềnh... phù hợp để lang thang một ngày nghỉ lễ. Bạn có thể đến Bãi Cháy là địa điểm khá gần trung tâm Đà Nẵng. Bãi Cháy nằm ở một ""thung lũng"" nhỏ ngay trên đường đi từ thành phố hướng về Chùa Linh Ứng. Địa điểm này thịch hợp đi từ 15h30 chiều, có thể tận hưởng một buổi dã ngoại nhẹ nhàng cùng hoàng hôn ở đây. Ghềnh Bàng là một địa điểm khác cũng thuộc bán đảo Sơn Trà, đoạn trước cổng khách sạn Intercol, rẽ phải hướng xuống biển. Bạn sẽ men theo con đường mòn nhỏ xuyên qua nhiều cây rừng khá thú vị.  Ghềnh Bàng thích hợp đi từ sáng sớm. Nơi đây có nhiều bãi cát, đá và những ô nước nhỏ có thể chơi đùa thoả thích nếu đi cùng nhóm bạn hoặc gia đình. Lưu ý khi du lịch ở Sơn Trà, cần cẩn thận cất thức ăn thật kỹ để tránh khỉ trông thấy sẽ lao vào giật thức ăn gây nguy hiểm. Đặc biệt không cho khỉ ăn, làm mất bản năng kiếm ăn trong tự nhiên của loài khỉ. 2. Đèo Hải Vân Bạn nên đi vào sáng sớm để cảm nhận hết vẻ đẹp của cung đường hùng vĩ này. Bạn có thể may mắn được ngắm những áng mây lượn lờ quanh sườn đèo. Dọc đường đừng quên dừng ở các quán cà phê hai bên đèo để ngắm cảnh và chụp ảnh. Nếu muốn, bạn có thể đi Làng Vân với chừng 30 phút đi bộ. Từ đèo Hải Vân, bạn có thể đi cung đường Cầu Vòm Đồn Cả. Đoạn này là qua đỉnh đèo về phía Lăng Cô, có bảng hướng dẫn đi về Cầu Vòm Đồn Cả. Đoạn đường này khá nhỏ hẹp, có đoạn đi bộ vì đi dọc theo đường ray tàu, đến con suối trong veo. Trên đường đi, bạn sẽ được nhìn lên cầu Vòm, có tàu hỏa chạy ngang qua đầu. Hãy canh me để có những khoảnh khắc ""sống ảo"" để đời ở đây. 3. Ngũ Hành Sơn Nên đi Ngũ Hành Sơn từ sáng sớm để thỏa sức khám phá quần thể di tích quốc gia đặc biệt này. Rời công việc văn phòng ngột ngạt, trải nghiệm cùng nhau leo núi, ngắm nhìn hang động, xem cách các nghệ nhân điêu khắc đá và những sản phẩm từ đá… sẽ cho bạn thêm nhiều năng lượng trong ngày nghỉ. Nếu không đủ sức khỏe, bạn có thể chọn lên đỉnh núi bằng thang máy, phóng tầm mắt ra xa hướng về thành phố biển. 4. Hoà Bắc Hãy xuất phát từ sáng sớm, chạy dọc theo suối và sông Cu Đê để đến Hòa Bắc. Nơi này có nhiều khu du lịch, trải nghiệm các dịch vụ ăn uống đặc sản địa phương và cắm trại… Nơi đây nhiều khu du lịch sinh thái cộng đồng, nên bạn có thể dễ dàng tìm kiếm trên facebook để lựa chọn trải nghiệm cho riêng mình. 5. Hòa Phú Cách Đà Nẵng tầm 20km về phía Tây. Có thể di chuyển bằng ô tô rất thuận tiện. Ở Hoà Phú có rất nhiều khu du lịch từ chuyên nghiệp đến không chuyên. Nhiều địa điểm có sân cỏ rộng xanh mát, có những ô suối nhỏ an toàn. Hòa Phú có những khoảng rừng có thể đi bộ với nhiều cỏ hoa, có khu nhà của người Cơ Tu và đặc biệt đồ ăn cũng khá ngon. Nếu bạn không thích ngủ lều, có thể ở lại trong các căn phòng nhỏ. Nếu cắm lều thì bãi cỏ rất an toàn. ",17/04/2024 14:00 GMT+7,https://tuoitre.vn/tho-dia-da-nang-chi-5-diem-lang-thang-mot-ngay-nghi-le-20240417113745887.htm,"Dịp lễ giỗ tổ Hùng Vương được nghỉ một ngày, bạn có thể chọn lang thang ở Đà Nẵng dù là gia đình có con nhỏ hay đi cùng bạn bè, người thương."
"Khách quốc tế đến miền Tây quá ít, cả năm chỉ hơn 2 triệu lượt","Thông tin được ông Nguyễn Văn Dũng - phó chủ tịch UBND TP.HCM - nêu ra tại Diễn đàn liên kết phát triển du lịch vùng TP.HCM và 13 tỉnh, thành Đồng bằng sông Cửu Long lần 3 năm 2024 với chủ đề ""Du lịch xanh phát triển bền vững"". Ông Dũng cho biết thêm, năm 2023, chương trình liên kết hợp tác phát triển du lịch vùng TP.HCM và 13 tỉnh, thành Đồng bằng sông Cửu Long đặt trong bối cảnh chung của cả nước còn nhiều thách thức. Tuy nhiên, khi đi vào thực tiễn, chương trình liên kết mang lại hiệu quả thực tế, góp phần phục hồi hoạt động du lịch và tăng trưởng kinh tế của đất nước và từng địa phương ở Tây Nam Bộ. Lượng khách du lịch nội địa đã tăng mạnh so với thời điểm trước đây. Tuy nhiên khách quốc tế vẫn còn quá ít. Ông Dũng dẫn ra con số chỉ khoảng 2 triệu lượt khách đến vùng Đồng bằng sông Cửu Long trong năm 2023, dù trước đó Nhà nước đã có nhiều chính sách thu hút như: miễn thị thực và cấp thị thực điện tử; chính sách đối ngoại song phương và đa phương với khu vực và thế giới. Ngoài ra, ông Dũng cũng nêu những hạn chế trong thu hút khách du lịch tại các tỉnh vùng Đồng bằng sông Cửu Long như chưa có sản phẩm du lịch ""chủ lực"", trong khi nhiều nước trong khu vực có nhiều chương trình kích cầu du lịch hấp dẫn, tác động đến sức cạnh tranh của thị trường Việt Nam đối với khách du lịch quốc tế. Bên cạnh đó, các chính sách hỗ trợ cho doanh nghiệp khôi phục hoạt động chưa thật sự hiệu quả; các chương trình quảng bá, xúc tiến của cơ quan quản lý nhà nước của 13 tỉnh, thành Đồng bằng sông Cửu Long tại các thị trường trọng điểm còn ít. Công tác quản lý điểm đến tại một số địa phương chưa kịp thời xử lý các vấn đề về ô nhiễm môi trường, rác thải, tình trạng ""chặt chém"" du khách… làm ảnh hưởng đến hình ảnh, thương hiệu du lịch vùng… Tại diễn đàn, lãnh đạo các địa phương và các chuyên gia đã nêu nhiều giải pháp nhằm thu hút khách du lịch đến với vùng Đồng bằng sông Cửu Long trong thời gian tới. Trước mắt trong chương trình liên kết hợp tác phát triển du lịch TP.HCM và 13 tỉnh, thành Đồng bằng sông Cửu Long sẽ thúc đẩy mạnh mẽ hơn nữa việc hợp tác giữa các tỉnh, thành trên tất cả các nội dung đã thống nhất. TP.HCM với vai trò là chủ tịch hội đồng liên kết hợp tác phát triển du lịch vùng, đề xuất 13 tỉnh, thành Đồng bằng sông Cửu Long phát triển du lịch theo hướng chuyên nghiệp, hiện đại, văn minh, chất lượng và hiệu quả. Phát triển du lịch phải gắn kết chặt chẽ với bảo tồn, phát huy giá trị di sản và bản sắc văn hóa đặc trưng bản địa; phát triển đồng thời cả du lịch quốc tế và du lịch nội địa.",17/04/2024 13:38 GMT+7,https://tuoitre.vn/khach-quoc-te-den-mien-tay-qua-it-ca-nam-chi-hon-2-trieu-luot-20240417125501404.htm,"Khách quốc tế du lịch đến 13 tỉnh, thành vùng Đồng bằng sông Cửu Long năm 2023 chỉ 2,1 triệu lượt, dù trước đó Việt Nam đã có nhiều chính sách thu hút."
"Khách quốc tế đến miền Tây quá ít, cả năm chỉ hơn 2 triệu lượt","Thông tin được ông Nguyễn Văn Dũng - phó chủ tịch UBND TP.HCM - nêu ra tại Diễn đàn Liên kết phát triển du lịch vùng TP.HCM và 13 tỉnh, thành Đồng bằng sông Cửu Long lần 3 năm 2024 với chủ đề ""Du lịch xanh phát triển bền vững"". Ông Dũng cho biết thêm, năm 2023, chương trình liên kết hợp tác phát triển du lịch vùng TP.HCM và 13 tỉnh, thành Đồng bằng sông Cửu Long đặt trong bối cảnh chung của cả nước còn nhiều thách thức. Tuy nhiên, khi đi vào thực tiễn, chương trình liên kết mang lại hiệu quả thực tế, góp phần phục hồi hoạt động du lịch và tăng trưởng kinh tế của đất nước và từng địa phương ở Tây Nam Bộ. Lượng khách du lịch nội địa đã tăng mạnh so với thời điểm trước đây. Tuy nhiên khách quốc tế vẫn còn quá ít. Ông Dũng dẫn ra con số chỉ khoảng 2 triệu lượt khách đến vùng Đồng bằng sông Cửu Long trong năm 2023, dù trước đó nhà nước đã có nhiều chính sách thu hút như: miễn thị thực và cấp thị thực điện tử; chính sách đối ngoại song phương và đa phương với khu vực và thế giới. Ngoài ra, ông Dũng cũng nêu những hạn chế trong thu hút khách du lịch tại các tỉnh vùng Đồng bằng sôgn Cửu Long như chưa có sản phẩm du lịch ""chủ lực"", trong khi nhiều nước trong khu vực có nhiều chương trình kích cầu du lịch hấp dẫn, tác động đến sức cạnh tranh của thị trường Việt Nam đối với khách du lịch quốc tế. Bên cạnh đó, các chính sách hỗ trợ cho doanh nghiệp khôi phục hoạt động chưa thật sự hiệu quả; các chương trình quảng bá, xúc tiến của cơ quan quản lý nhà nước của 13 tỉnh, thành Đồng bằng sông Cửu Long tại các thị trường trọng điểm còn ít. Công tác quản lý điểm đến tại một số địa phương chưa kịp thời xử lý các vấn đề về ô nhiễm môi trường, rác thải, tình trạng ""chặt, chém"" du khách… làm ảnh hưởng đến hình ảnh, thương hiệu du lịch vùng… Tại diễn đàn, lãnh đạo các địa phương và các chuyên gia đã nêu nhiều giải pháp nhằm thu hút khách du lịch đến với vùng Đồng bằng sông Cửu Long trong thời gian tới. Trước mắt trong chương trình liên kết hợp tác phát triển du lịch TP.HCM và 13 tỉnh, thành Đồng bằng sông Cửu Long sẽ thúc đẩy mạnh mẽ hơn nữa việc hợp tác giữa các tỉnh, thành trên tất cả các nội dung đã thống nhất. TP.HCM với vai trò là chủ tịch hội đồng liên kết hợp tác phát triển du lịch vùng, đề xuất 13 tỉnh, thành Đồng bằng sông Cửu Long phát triển du lịch theo hướng chuyên nghiệp, hiện đại, văn minh, chất lượng và hiệu quả. Phát triển du lịch phải gắn kết chặt chẽ với bảo tồn, phát huy giá trị di sản và bản sắc văn hóa đặc trưng bản địa; phát triển đồng thời cả du lịch quốc tế và du lịch nội địa.",17/04/2024 13:38 GMT+7,https://tuoitre.vn/khach-quoc-te-den-mien-tay-qua-it-ca-nam-chi-hon-2-trieu-luot-20240417125501404.htm,"Khách quốc tế du lịch đến 13 tỉnh, thành vùng Đồng bằng sông Cửu Long năm 2023 chỉ 2,1 triệu lượt, dù trước đó, Việt Nam đã có nhiều chính sách thu hút."
17 sự kiện lớn mùa hè 2024 để Sầm Sơn là ‘thành phố của lễ hội’,"Chiều 16-4, UBND thành phố Sầm Sơn thông tin về một chuỗi hoạt động du lịch Sầm Sơn năm 2024. Theo UBND thành phố Sầm Sơn, mùa du lịch biển năm nay, thông qua các chương trình văn hóa, nghệ thuật, hoạt động thể thao, du lịch để giới thiệu đến nhân dân, du khách trong và ngoài nước về đổi thay tích cực, chuyển biến mạnh mẽ trong diện mạo đô thị và chất lượng dịch vụ du lịch Sầm Sơn. Với những sản phẩm du lịch đặc sắc, khẳng định thành phố Sầm Sơn đang từng bước xây dựng, phát triển trở thành đô thị du lịch trọng điểm quốc gia, điểm đến lý tưởng của du khách. Từng bước xây dựng Sầm Sơn trở thành ""thành phố của lễ hội"", mở ra cơ hội thu hút đầu tư, khai thác các nguồn lực tự nhiên, xã hội cho phát triển du lịch. Đến với mùa du lịch biển Sầm Sơn năm nay, du khách được tham gia 17 sự kiện lớn, nhằm quảng bá tiềm năng và thế mạnh của du lịch biển, nghỉ dưỡng... Điểm mới của du lịch biển Sầm Sơn năm nay là đưa vào hoạt động tổ hợp công viên vui chơi, giải trí ngoài trời (công viên Sun World Sầm Sơn) với quy mô đầu tư và diện tích hàng đầu miền Bắc, gồm công viên nước, công viên chủ đề, tổng diện tích hơn 33,5ha, tổng mức đầu tư giai đoạn một hơn 1.500 tỉ đồng, do Sun Group đầu tư. Sầm Sơn còn là nơi tổ chức lễ kỷ niệm 70 năm đón tiếp đồng bào, cán bộ, chiến sĩ và học sinh miền Nam tập kết ra Bắc (1954 - 2024) và khánh thành, bàn giao dự án khu lưu niệm ""con tàu tập kết"". Khu lưu niệm đồng bào, cán bộ, chiến sĩ và học sinh miền Nam tập kết ra Bắc là công trình thể hiện lòng tri ân, sự đoàn kết, yêu thương đùm bọc của nhân dân miền Bắc đối với miền Nam trong những năm tháng chiến tranh. Bên cạnh đó, mùa du lịch biển Sầm Sơn năm nay còn diễn ra Giải quần vợt bãi biển quốc gia, Giải đua xe đạp Cúp truyền hình TP.HCM, Lễ hội carnival đường phố, Liên hoan ẩm thực, đặc sản xứ Thanh 2024… Thành phố Sầm Sơn đặt ra mục tiêu đón được 8,5 triệu lượt du khách, doanh thu ước đạt khoảng 16.000 tỉ đồng trong năm 2024.",16/04/2024 18:06 GMT+7,https://tuoitre.vn/mua-he-soi-dong-o-sam-son-voi-nhieu-su-kien-thu-hut-du-khach-20240416171707084.htm,"Lễ hội du lịch biển Sầm Sơn năm 2024 và khánh thành quảng trường biển sẽ diễn ra vào tối 27-4 tại quảng trường biển Sầm Sơn, thành phố Sầm Sơn (Thanh Hóa). Đây là sự kiện văn hóa khai trương mùa du lịch biển Sầm Sơn."
Ngập lụt ở Hội An thành sản phẩm du lịch độc đáo của Quảng Nam,"Theo Sở Văn hóa, Thể thao và Du lịch tỉnh Quảng Nam, hơn 100 doanh nghiệp đã thống nhất đưa ra các chương trình ưu đãi. Hội An mùa nước lũ thành tour du lịch Từ đầu tháng 5 đến cuối tháng 11 này, khách tới Quảng Nam sẽ được trải nghiệm nhiều chương trình, tour tuyến đặc sắc với mức giá ""sập sàn"". Doanh nghiệp sẽ trực tiếp bán dịch vụ cho khách các gói combo ưu đãi từ giá phòng, dịch vụ ăn uống, điểm tham quan, đơn vị vận chuyển... với mức giảm giá 30-50%. Nếu khách muốn hưởng chương trình ưu đãi ""khủng"" hơn, các doanh nghiệp cũng sẽ tung chương trình ""săn"" dịch vụ theo giờ vàng với mức giảm tới 80%. Ngoài ra, các doanh nghiệp và điểm tham quan sẽ triển khai dịch vụ ưu đãi mua một tặng một, đưa đón tại sân bay, hỗ trợ đưa đón bằng xe điện từ điểm lưu trú đi vào phố cổ, cho thuê xe máy giá tốt… Năm nay Quảng Nam đưa vào khai thác các tour mới như khám phá cung đường uốn lượn qua bản làng Cơ Tu, Ca Dong; chinh phục Đỉnh Quế (Tây Giang)... Điểm nhấn du lịch dịp cuối năm là chương trình Mùa vàng xứ Quảng. Khách sẽ trải nghiệm tham quan phố cổ rêu phong; đi xe đạp, xe máy dọc các con đường làng ven Hội An, Duy Xuyên, Điện Bàn trên những cánh đồng lúa chín vào mùa gặt. Khách cũng sẽ được trải nghiệm gặt lúa bằng tay, tìm hiểu về nghề dệt chiếu, nấu rượu, nuôi heo, nuôi yến, làm bánh đập, bánh tráng, mộc... Lễ hội Mừng lúa mới sẽ đưa khách ngắm những thửa ruộng bậc thang, trải nghiệm lễ hội mừng lúa mới của người dân tộc Xê Đăng, Ca Dong vùng cao. Đến với Trại sáng tác nghệ thuật đất nung, du khách được thỏa sức sáng tạo trên nền nghệ thuật đất nung. Với chương trình Mùa vàng phủ xanh, du khách sẽ được tham gia các hoạt động thiện nguyện trồng rừng, hỗ trợ bà con vùng sâu, vùng xa,… và trải nghiệm nhiều câu chuyện văn hóa khác. Điều đặc biệt, lần đầu tiên trong một sự kiện kích cầu du lịch của Quảng Nam, đơn vị tổ chức đã giới thiệu sản phẩm ""lạ"" là du lịch Hội An mùa lũ. ""Tour Hội An mùa nước nổi sẽ đưa du khách trải nghiệm đi thuyền trong phố cổ những ngày nước lên, hay trải nghiệm bơi thuyền sông Thu Bồn (Cẩm Kim) và nghe kể câu chuyện ghe bầu Quảng Nam"" - Sở Văn hóa, Thể thao và Du lịch tỉnh Quảng Nam giới thiệu trong chương trình họp báo. Nhiều doanh nghiệp lo vắng khách vì vé máy bay tăng cao Dù hưởng ứng nhiều chương trình kích cầu kéo khách trở lại sau thời gian dài ảnh hưởng dịch, tại buổi họp báo chiều 16-4, nhiều doanh nghiệp du lịch tại Hội An cũng bày tỏ nỗi lo lắng về việc giá vé máy bay nội địa đang ở mức cao. Ông Steven Wolstenholme - chủ tịch kiêm tổng giám đốc Hoiana Resort & Golf - cho rằng ngành du lịch nội địa thời gian tới có thể sẽ gặp khó khăn vì chi phí vận chuyển hàng không trong nước tăng. ""Các năm trước, khối lưu trú của chúng tôi gần như kín phòng cho đợt lễ 30-4, 1-5. Nhưng năm nay, tỉ lệ lấp kín phòng hiện bằng khoảng 60% so với 2023"" - ông Steven nói. Theo ông Steven, việc gần đây các đơn vị tích cực mở các tour du lịch, đưa đón khách bằng đường sắt là một hướng mới. Hoạt động này sẽ góp phần bù nguồn khách bị hụt qua đường hàng không. Ông Hoàng Gia Khánh - tổng giám đốc Tổng công ty Đường sắt Việt Nam - cho biết ngành đường sắt đang tích cực đổi mới, trong đó đầu tư mạnh hạ tầng, dịch vụ để phục vụ nhóm khách chọn du lịch bằng đường sắt. ""Ngành đường sắt hiện phối hợp với nhiều địa phương tổ chức các tuyến vận tải đưa đón khách du lịch tới các vùng miền. Chúng tôi đặt mục tiêu để mỗi chuyến du lịch bằng đường sắt là một trải nghiệm tuyệt vời với du khách"" - ông Khánh nói.",16/04/2024 16:34 GMT+7,https://tuoitre.vn/ngap-lut-o-hoi-an-thanh-san-pham-du-lich-doc-dao-cua-quang-nam-20240416155423202.htm,"Chiều 16-4, UBND tỉnh Quảng Nam tổ chức họp báo giới thiệu chương trình kích cầu du lịch 2024 với chủ đề ""Quảng Nam - Miền xanh di sản""."
