Title,Content,Date,Url,Summary
Khánh Hòa lại gia hạn cho Sailing Club kinh doanh trên bãi biển Nha Trang,"Khu Sailing Club ở phía đông đường Trần Phú, TP Nha Trang của Công ty TNHH liên doanh câu lạc bộ bơi thuyền Nha Trang (Sailing Club Nha Trang) được UBND tỉnh Khánh Hòa cho thuê hơn 2.369m2đất công viên bãi biển Nha Trang từ tháng 3-2005, để làm đất thương mại dịch vụ, kinh doanh các dịch vụ du lịch, nhà hàng, quầy bar. Năm 2023, tỉnh Khánh Hòa đã cho doanh nghiệp chủ khu nhà hàng Sailing Club Nha Trang gia hạn. Thời hạn thuê đất kinh doanh trên bãi biển Nha Trang đã được gia hạn đó cũng đã hết hạn vào ngày 31-12-2023. Thế nhưng sau khi hết hạn thuê đất đã gia hạn trên, chủ doanh nghiệp Sailing Club Nha Trang và giám đốc Sở Tài nguyên và Môi trường tỉnh Khánh Hòa lại tiếp tục có văn bản, tờ trình đề nghị tỉnh cho gia hạn tiếp. Theo đề nghị đó, UBND tỉnh Khánh Hòa vừa có quyết định điều chỉnh quyết định gia hạn cũ, cho phép Công ty TNHH liên doanh câu lạc bộ bơi thuyền Nha Trang được gia hạn thời gian sử dụng toàn bộ diện tích đất bãi biển Nha Trang đã được cho thuê kinh doanh (hơn 2.369m2) trong suốt gần 20 năm qua được tiếp tục kinh doanh đến ngày 31-12-2024. ",19/04/2024 10:44 GMT+7,https://tuoitre.vn/khanh-hoa-lai-gia-han-cho-sailing-club-kinh-doanh-tren-bai-bien-nha-trang-20240418192604582.htm,"Khu nhà hàng, quầy bar Sailing Club trên bãi biển Nha Trang gần 20 năm đã hết hạn thuê đất, vừa được UBND tỉnh Khánh Hòa gia hạn lần 2."
"Nội Bài vào top 100, Changi mất vị trí sân bay số 1 thế giới","Danh sách các sân bay tốt nhất trên thế giới năm 2024 do trang web đánh giá và xếp hạng sân bay và hãng hàng không có trụ sở tại Vương quốc Anh Skytrax tổng hợp. Để có được kết quả, hằng năm Skytrax đã khảo sát ý kiến khách du lịch từ khắp nơi trên thế giới. Nhiều sân bay châu Á vào top Dù thống trị vẫn là các sân bay châu Âu, bảng xếp hạng năm nay có sự xuất hiện của các sân bay châu Á, chiếm 7 vị trí trong số 20 sân bay hàng đầu do Skytrax công bố. Nhật Bản tỏa sáng với nhiều sân bay lọt vào danh sách xếp hạng năm nay. Cả hai sân bay ở Tokyo gồm Haneda (HND) và Narita (NRT) đều lọt vào top 10. Trong đó, Haneda dẫn trước sân bay anh em của nó một bậc, ở vị trí thứ tư. Ngoài ra, Nhật Bản còn có thêm sân bay Chitose mới ở Sapporo (CTS) giành được giải thưởng sân bay cải tiến nhất thế giới. Sân bay quốc tế Chubu Centrair ở Nagoya (NGO) được vinh danh là sân bay tốt nhất với hạng mục 5-10 triệu hành khách mỗi năm. Sân bay quốc tế Kansai (KIX), phục vụ khu vực Osaka, giành được giải thưởng dịch vụ vận chuyển hành lý sân bay tốt nhất thế giới. Sân bay Nội Bài ở Hà Nội đã có màn thăng hạng ấn tượng, từ hạng 127 vào năm 2023 lên hạng 96 năm 2024.  Kết quả này không chỉ giúp sân bay Nội Bài vào top 100 sân bay tốt nhất thế giới, mà còn vượt qua các sân bay của Mỹ, Trung Quốc, Đức, lần lượt ở các vị trí từ 97 đến 100. Bảng xếp hạng Skytrax đã được công bố tại Lễ trao giải sân bay thế giới ở Frankfurt, Đức vào ngày 17-4. Dữ liệu cho danh sách này được thu thập từ tháng 8-2023 đến tháng 3-2024 từ những người thuộc hơn 100 quốc tịch. Tổng cộng, có 570 sân bay đã được đánh giá trên khắp thế giới. Người tham gia khảo sát trả lời về nhiều chủ đề khác nhau, từ việc dễ dàng đi qua các trạm kiểm soát an ninh, đến chất lượng và sự đa dạng của đồ ăn, thức uống. Singapore và Qatar tranh giành vị trí đầu bảng Trong thập kỷ qua, sân bay quốc tế Changi (Singapore) và sân bay quốc tế Doha Hamad (Qatar) đã liên tục cạnh tranh nhau để giành danh hiệu sân bay tốt nhất thế giới. Năm nay, sân bay Doha Hamad vươn lên dẫn đầu nhờ thiết kế cực kỳ hiện đại, khu mua sắm cao cấp và trên hết là các nhà ga rất dễ điều hướng và định vị, không bị rối rắm như một số nơi khác. Singapore giữ ngôi đầu vào năm 2023 và 2020, trong khi sân bay Doha Hamad (DOH) giành vị trí đầu bảng vào năm 2022 và 2021. Năm nay, hai sân bay một lần nữa hoán đổi vị trí nhất, nhì. ""Năm nay, sân bay quốc tế Hamad kỷ niệm cột mốc 10 năm hoạt động. Chúng tôi thực sự vinh dự khi được hành khách bình chọn là Sân bay tốt nhất thế giới lần thứ ba,"" giám đốc điều hành của Tập đoàn Qatar Airways, Badr Mohammed Al Meer, cho biết trong một tuyên bố. ""Chúng tôi mong muốn tiếp tục gây bất ngờ và thích thú cho hành khách bằng cách tạo ra những hành trình đáng nhớ và đặc biệt trong những năm tới"", ông nói thêm. DOH là một trong số các sân bay cung cấp các chuyến tham quan thành phố miễn phí cho hành khách có thời gian quá cảnh dài. Dịch vụ này đã nhận được đánh giá cao từ những người được hỏi. Đây cũng là nơi tọa lạc của khách sạn sân bay Oryx, nơi du khách có thể tận hưởng các liệu pháp spa, sân bóng quần (môn thể thao dùng vợt, có hai người hoặc bốn người chơi, trong một sân kín bốn bên với một quả bóng cao su nhỏ và rỗng - PV), và hồ bơi dài 25m. Ngoài việc xếp hạng các sân bay, Skytrax còn trao giải thưởng cho các khách sạn sân bay xuất sắc. Trong đó, khách sạn sân bay Hilton Munich giữ vị trí tốt nhất châu Âu và khách sạn sân bay Crowne Plaza Changi lọt top tốt nhất thế giới, trong 9 năm hoạt động. ",19/04/2024 07:32 GMT+7,https://tuoitre.vn/noi-bai-thang-hang-changi-mat-vi-tri-san-bay-so-1-the-gioi-20240419064226431.htm,"Sân bay Nội Bài (Hà Nội) thăng hạng từ 127 vào năm 2023 lên hạng 96 năm nay, lọt vào top 100 sân bay tốt nhất thế giới. Trong khi đó, sân bay Changi (Singapore) mất vị trí hạng nhất, sân bay Doha Hamad (Qatar) vươn lên dẫn đầu."
"Cô giáo Mỹ gây sốt TikTok với vlog bánh mì Việt, 'cháo sườn IELTS'","Trong các video này, Emma đã gặp gỡ được với rất nhiều người bán hàng người Việt nói tiếng Anh rất giỏi, trong đó có hiện tượng ""cháo sườn IELTS"" được mạng xã hội chia sẻ mạnh gần đây. Trao đổi với Tuổi Trẻ Online, Emma cho biết cô tròn 24 tuổi, người Mỹ, đang là một giáo viên tiếng Anh trung học. Cô tới Việt Nam du lịch và có rất nhiều lý do khiến cô bắt đầu làm vlog về ẩm thực Việt Nam. ""Tôi đã đến Việt Nam vài lần, rồi đắm chìm trong tình yêu với đất nước này. Tôi luôn biết mình muốn trở lại Việt Nam để du lịch một mình và khám phá. Vì thế, tôi quyết định quay các vlog với chủ đề ẩm thực như một cách kết nối với mọi người, đặc biệt là khi tôi đang ở một mình và không quen ai ở đây"", cô kể. Từ cuối tháng 3 đến nay, Emma đã quay rất nhiều vlog thú vị, hỏi han người bán.  Cô review từ cháo sườn, bánh mì, nem nướng... Đi đến đâu, cô gái người Mỹ cũng không ngớt tò mò về ẩm thực Việt. Khoảnh khắc đáng nhớ nhất của Emma là video được viral đầu tiên. Khi ấy, cô trò chuyện với một phụ nữ bán bánh mì. Không ngờ viral này được cư dân mạng chú ý. Tiếp đến, cô trò chuyện với Lê Quang Tùng (21 tuổi, Hà Nội). Anh là chàng trai bán cháo sườn ở Hà Nội khiến nhiều người ngưỡng mộ khi kể các nguyên liệu của món cháo sườn bằng tiếng Anh thành thục. Sau đoạn clip kể trên, Quang Tùng và hàng cháo sườn trở nên nổi tiếng. Cô gái Mỹ rất ngạc nhiên khi gặp nhiều người Việt Nam nói tiếng Anh lưu loát. ""Tôi được biết tiếng Anh không phổ biến ở đây và tôi đã học tiếng Việt để tồn tại. Việc gặp những người nói tiếng Anh giỏi là một trải nghiệm thú vị. Đó là cơ hội tuyệt vời giúp tôi học hỏi và giao lưu với người bản địa"", cô nói. ""Rất nhiều người Việt muốn làm hướng dẫn viên cho tôi"" Emma cho biết kênh của cô đa số toàn người Việt xem. 99% lượt xem và bình luận đều là của người Việt. Tính đến thời điểm hiện tại, đã có gần 30 người Việt nhắn tin đề nghị làm hướng dẫn viên, phiên dịch cho cô. Chưa kể, nhiều người khi xem video còn nhiệt tình cung cấp địa chỉ của những người bán hàng đường phố tốt nhất, mời cô đến thăm các gánh hàng rong, cửa hàng... của họ. ""Người dân đều tốt bụng, không đòi hỏi bất cứ điều gì đổi lại. Điều này đối với tôi rất đáng nhớ, vì sự hào phóng này ít khi có được ở nơi tôi ở. Tôi hiếm khi nhận được sự hướng dẫn và giúp đỡ hết lòng như vậy mà không tính phí"", cô nói. Thế nhưng khi làm các vlog ẩm thực, cô gái Tây vẫn gặp nhiều khó khăn, chẳng hạn như mô tả hương vị, cô không biết phải so sánh với cái gì. ""Có lần tôi vô tình uống nhầm nước mắm, vì tưởng là canh. Một số người tốt bụng chỉ cho tôi biết tôi đã sai, nhưng cũng có người chỉ trích vì coi đó là thiếu tôn trọng"", Emma kể. Cô thấy nhiều món Việt nổi tiếng trên thế giới. Chẳng hạn như phở, bún chả và nem. Đây là những món cũng được phục vụ ở các nước phương Tây, nhưng cô rút ra được một điều là chúng không ngon bằng khi ăn các món này ở Hà Nội. Cô còn thấy sự khác nhau giữa ẩm thực các nước. Chẳng hạn, nhiều người nước ngoài không ăn canh nóng vào ngày nóng, mà dùng khi thời tiết lạnh hơn. Thế nhưng người Việt bữa nào cũng có một nồi canh nóng sốt. Cô nhận ra món trà đá rất ngon. Người dân địa phương thường thích thưởng thức trà đá trong các quán nhỏ, trên vỉa hè hoặc trong các quán cà phê. Trà đá không chỉ là một thức uống, mà còn là cách để người ta tận hưởng thời gian nghỉ ngơi, trò chuyện và thư giãn. Ngoài ra, bún chả và phở cũng là hai món ăn đặc trưng của Hà Nội và là một phần không thể thiếu của ẩm thực Việt Nam. ""Ẩm thực Việt Nam quá ngon. Tôi hy vọng người dân sẽ tận dụng tiếng Anh để ẩm thực của các bạn thu hút một lượng khách hàng lớn hơn, từ đó tăng doanh thu"", cô nói. Cô gái trẻ cho biết hiện tại cô không có kế hoạch trở về nước sớm vì muốn tìm lại công việc dạy học ở Đông Nam Á. Cô hy vọng sẽ sống ở đây ít nhất vài năm nữa trước khi quay trở về quê nhà. Cô dự định học thêm về tiếng Việt và xem điều đó sẽ đưa cô đi đến đâu. Cô còn muốn phát triển kênh TikTok của mình cho nhiều người trên thế giới biết đến. ""Tôi nghĩ video của tôi sẽ giúp mọi người biết thêm về cuộc sống ở Việt Nam, khuyến khích họ đến thăm. Tôi cũng muốn gặp gỡ và kết bạn với nhiều người địa phương hơn"", cô cho hay.",19/04/2024 02:52 GMT+7,https://tuoitre.vn/co-giao-my-gay-sot-tiktok-voi-vlog-banh-mi-viet-chao-suon-ielts-20240418212158887.htm,"Emma Ann Odom, chủ kênh @emmaa_eatss, có hơn 22.000 lượt follow trên TikTok, đã khiến cư dân mạng thích thú với những video khám phá ẩm thực Việt Nam khi du lịch."
Biển người về Cửa Lò xem trình diễn drone,"Từ chiều 18-4, dòng xe máy, ô tô của các địa phương lân cận thị xã Cửa Lò, Nghệ An và du khách nối đuôi nhau đổ xuống biển Cửa Lò. Do ngày khai mạc Lễ hội du lịch Cửa Lò năm 2024 trùng với dịp nghỉ lễ giỗ Tổ Hùng Vương nên lượng khách về với biển Cửa Lò tăng đột biến. Đến với Cửa Lò năm nay du khách chứng kiến nhiều thay đổi tích cực, mang đến diện mạo mới, hiện đại hơn, cảnh sắc đẹp hơn. Đặc biệt là khi chính quyền địa phương đã giải tỏa hơn 200 cửa hàng nằm án ngữ lối ra biển ở khu vực đường Bình Minh. Không chỉ cải tạo, mở rộng nhiều tuyến đường, thị xã Cửa Lò còn tạo thêm nhiều cảnh quan, vườn hoa cúc biển ở gần biển cho du khách check-in. Nhiều khách sạn hạng sang ở Cửa Lò đã được khách đặt gần kín chỗ, trung bình mỗi phòng có mức giá từ 1,5 đến 5 triệu đồng/ngày đêm.  Để trở thành một điểm đến hấp dẫn với du khách, lãnh đạo Cửa Lò đã ráo riết vào cuộc, yêu cầu các phường xã khắc phục triệt để những tồn tại, đặc biệt chú trọng dẹp nạn ""chặt chém"", chèo kéo khách. Trước mùa du lịch, các ki ốt phục vụ nước uống, dịch vụ ăn uống đều bắt buộc phải có bảng niêm yết giá, công khai các số điện thoại nóng của lãnh đạo phường, công an phường và thị xã. Phát biểu tại lễ khai mạc, ông Bùi Đình Long - phó chủ tịch UBND tỉnh Nghệ An - nhấn mạnh: ""Trải qua 117 năm hình thành địa danh du lịch và 30 năm xây dựng phát triển, thị xã Cửa Lò đang từng bước chuyển mình, mang dáng vóc của đô thị du lịch biển sầm uất, một địa chỉ nghỉ dưỡng trải nghiệm lý tưởng, hấp dẫn"". Hệ thống cơ sở hạ tầng, khách sạn, nhà nghỉ đáp ứng được cho hơn 30.000 lượt khách lưu trú ngày/đêm. Lễ hội du lịch Cửa Lò năm 2024 là dịp để tỉnh Nghệ An giới thiệu, quảng bá những giá trị, tài nguyên và sản phẩm du lịch đặc sắc tới bạn bè, du khách trong và ngoài nước. Ngoài chương trình nghệ thuật ""Cửa Lò - Khát vọng tỏa sáng"", màn pháo hoa đặc sắc, ban tổ chức còn mang đến màn trình diễn ánh sáng nghệ thuật bằng hàng trăm thiết bị bay không người lái (drone) tạo hình nghệ thuật trên không. Dịp này, thị xã Cửa Lò cũng đã đón nhận bằng công nhận di sản văn hóa phi vật thể cấp quốc gia Lễ hội đền Yên Lương - lễ hội dân gian gắn với tín ngưỡng thờ Tứ Vị Thánh Nương và các vị phúc thần của cư dân ven biển, được lưu truyền qua hàng trăm năm.",18/04/2024 23:04 GMT+7,https://tuoitre.vn/bien-nguoi-ve-cua-lo-xem-trinh-dien-drone-20240418224803182.htm,"Hàng vạn người cùng đổ về thị xã Cửa Lò, Nghệ An xem trình diễn drone và bắn pháo hoa trong lễ khai mạc Lễ hội du lịch Cửa Lò tối 18-4."
Khách Việt tìm kiếm nơi trốn nắng dịp lễ 30-4 và 1-5,"Tỉ lệ du khách Việt tìm đến những nơi có thời tiết mát mẻ nhằm giải nhiệt mùa hè lên tới 75%. Nhờ đó, Đà Lạt trở thành cái tên đứng đầu trong các bảng xếp hạng tìm kiếm của du khách Việt cho kỳ nghỉ kéo dài 5 ngày trong đợt 30-4 và 1-5 sắp tới đây, theo nền tảng Booking.com. Lên núi, xuống biển để trốn nóng Báo cáo mới nhất của ứng dụng đặt phòng này thông qua nghiên cứu theo dõi các lượt tìm kiếm trong khoảng thời gian từ ngày 17-3 đến 6-4 với ngày nhận phòng từ ngày 26-4 và 1-5, cho thấy nhu cầu chọn Đà Lạt gia tăng đột biến trong lượt tìm kiếm. Thành phố Đà Lạt nổi tiếng với không khí mát mẻ của thiên nhiên núi đồi cùng cảnh quan yên bình đang là lựa chọn của số đông. Nơi đây cũng là địa điểm đứng đầu danh sách những điểm đến trong nước được du khách Việt tìm kiếm nhiều nhất kỳ nghỉ lễ này. Những điểm đến mát mẻ nhằm thoát khỏi cơn nóng khi nhiệt độ trung bình ngày một tăng cũng thiên về những địa điểm gần biển. Có tới 82% du khách trong nước bày tỏ sự ưu ái đối với những địa điểm cận thủy. Xu hướng này phần nào lý giải sự ""thống trị"" của các địa điểm ven biển trong danh sách những điểm đến trong nước được tìm kiếm nhiều nhất. Đứng thứ 2 trong danh sách khách Việt quan tâm nhất là Đà Nẵng, thành phố nổi tiếng với những bãi biển quyến rũ và đời sống về đêm nhộn nhịp. Các điểm đến còn lại bao gồm Nha Trang, Bà Rịa - Vũng Tàu, TP.HCM, Hội An, Huế, Hà Nội, Phan Thiết, Mũi Né. Theo các công ty du lịch, với đặc thù ngày nghỉ năm nay, tour đi biển chủ yếu thực hiện dạng tour tự túc, các gia đình sử dụng xe tự lái để cùng trải nghiệm các cung đường mới, tuyến cao tốc. Ông Trần Thanh Vũ, tổng giám đốc Vinagroup Travel, cho biết các điểm đến không chỉ ở Phan Thiết, Mũi Né mà người dân có xu hướng đi xa hơn như về Nha Trang, Phú Yên... với hình thức tour F&E (Free & Easy) và tour option thiết kế theo nhu cầu riêng của nhóm khách. Bà Nguyễn Thị Ánh Hoa, giám đốc Sở Du lịch TP.HCM, cho biết mặc dù kỳ nghỉ lễ 30-4 và 1-5 được chốt nghỉ 5 ngày đến hơi muộn, nhưng một số doanh nghiệp lữ hành trên địa bàn cũng đã chủ động chào bán sản phẩm theo mọi nhu cầu của du khách. Sức hút tour nội đô Qua khảo sát, vẫn có nhiều doanh nghiệp chuẩn bị được sản phẩm du lịch 3, 4, 5 ngày để phục vụ nhu cầu du lịch trong và ngoài nước của du khách và cả những sản phẩm dài ngày. ""Dĩ nhiên nếu có kế hoạch sớm hơn, hoạt động quảng bá, giới thiệu sản phẩm du lịch sẽ hiệu quả và chủ động hơn. Tuy nhiên, qua kiểm tra, chúng tôi ghi nhận doanh nghiệp đã có sự chuẩn bị. Các sản phẩm đã sẵn sàng, chỉ cần tiếp thị thêm để tăng thêm lượng khách trong dịp lễ 30-4 và 1-5"", bà Hoa tin tưởng. Tại TP.HCM, chùm tour nội đô được tung ra trong dịp lễ năm nay cũng hứa hẹn hấp dẫn du khách. Trong dịp lễ năm nay, Lữ hành Saigontourist mở tour ""Theo dấu chân Biệt động Sài Gòn"", tham quan các địa điểm lịch sử nổi tiếng liên quan đến Biệt động Sài Gòn, tìm hiểu cuộc sống của những người anh hùng bí mật trong thời kỳ kháng chiến; TST có tour ""Thành phố bên dòng sông xanh"" khám phá điểm đến TP Thủ Đức. Hay Vietluxtour có chùm tour văn hóa, lịch sử Biệt động Sài Gòn, Sài Gòn xưa - TP.HCM nay, Ký ức Sài Gòn - Chợ Lớn, Rừng Sác kiêu hùng - Phố thị tương lai, Quận 1- Sắc màu đêm… Các doanh nghiệp cho biết trước đây tour trong ngày đa phần thu hút du khách trung niên. Tuy nhiên thời gian gần đây, nhóm du khách trẻ tham quan ngày càng đông, cho thấy sức hút các sản phẩm tour nội đô. Đặc biệt tour nội đô xe buýt 2 tầng hay buýt đường sông thu hút số lượng lớn du khách trong và ngoài nước tham quan bởi tính hấp dẫn và mới lạ. Du khách có thể ngắm nhìn thành phố từ trên cao và đi qua những địa điểm nổi tiếng như: Bưu điện thành phố, chợ Bến Thành, Bảo tàng Chứng tích chiến tranh…",18/04/2024 20:18 GMT+7,https://tuoitre.vn/khach-viet-tim-kiem-noi-tron-nang-dip-le-30-4-va-1-5-20240418174606434.htm,"75% du khách Việt đang tìm kiếm những điểm đến mát mẻ nhằm thoát khỏi cơn nóng khi nhiệt độ trung bình ngày một tăng. Trong khi đó, tour về biển xanh, cát trắng cũng chưa bao giờ hết ""nóng""."
"Dubai vật lộn vì trận mưa lịch sử, nhiều khách kẹt ở sân bay","Hôm nay 18-4, các hoạt động tại sân bay quốc tế Dubai vẫn bị gián đoạn khiến nhiều chuyến bay bị trì hoãn, phải chuyển hướng hoặc bị hủy. Đại diện sân bay quốc tế Dubai cho biết tại đây đã nối lại các chuyến bay ở nhà ga số 1, do các hãng hàng không nước ngoài khai thác. Tuy nhiên, các chuyến bay vẫn còn tình trạng chậm trễ hoặc gián đoạn. Theo đại diện từ Hãng hàng không Emirates, hãng đã bắt đầu làm thủ tục cho khách vào lúc 9h giờ địa phương, sau nhiều giờ tạm dừng. Nước láng giềng Oman cũng không khả quan hơn khi phải đối mặt với tình trạng ngập lụt gây mất điện nhiều giờ do nước mưa tràn vào nhà. Tính đến ngày 18-4, trận lũ lụt lịch sử đã khiến 20 người tại Oman thiệt mạng. Theo Hãng tin Reuters, các nhà chức trách nước này khuyến cáo người dân nên làm việc tại nhà nếu có thể. Nhiều người lao động cũng chọn ở nhà vì ngập lụt, dù một số vẫn mạo hiểm ra ngoài khiến phương tiện chết máy giữa đường. Các nhà nghiên cứu cảnh báo rằng biến đổi khí hậu sẽ kéo theo nhiệt độ và độ ẩm tăng cao, gây nguy cơ lũ lụt cho các quốc gia vùng Vịnh. Đặc biệt, vấn đề có thể trở nên tồi tệ hơn ở các quốc gia như UAE, nơi thiếu cơ sở hạ tầng thoát nước để đối phó với các trận mưa lớn. Hôm 17-4, Hãng thông tấn nhà nước UAE dẫn lời Tổng thống Mohammed bin Zayed Al Nahyan cho biết ông đã yêu cầu chính quyền khu vực đánh giá mức độ thiệt hại và hỗ trợ các gia đình bị ảnh hưởng do cơn bão.",18/04/2024 19:51 GMT+7,https://tuoitre.vn/dubai-vat-lon-vi-tran-mua-lich-su-nhieu-khach-ket-o-san-bay-20240418171806872.htm,"Ngày 18-4, Dubai tiếp tục vật lộn để xử lý hậu quả sau trận mưa lịch sử trong vòng 70 năm qua khiến toàn bộ thành phố chìm trong biển nước."
