Title,Content,Date,Url,Summary
Chuẩn bị Lễ hội sông nước TP.HCM 2024,"Chiều 15-4, Sở Du lịch TP.HCM tổ chức họp báo thông tin về các sự kiện xúc tiến du lịch TP.HCM quý 2-2024. Bà Nguyễn Thị Ánh Hoa, giám đốc Sở Du lịch TP.HCM, cho biết trong quý 2 này, thành phố sẽ có loạt hoạt động đón đầu xu hướng, chuẩn bị kỹ các chương trình kích cầu, nhằm tăng doanh thu cho ngành trong cao điểm hè.  Đặc biệt trong mục tiêu xây dựng một số sự kiện lễ hội thành sự kiện thương hiệu của thành phố, Lễ hội sông nước TP.HCM lần thứ 2 sẽ được tổ chức từ ngày 31-5 đến 9-6 với quy mô lớn hơn và kéo dài thời gian tổ chức hơn so với lần đầu tiên.  Thời gian tổ chức rơi vào thời điểm đầu hè, phù hợp với kế hoạch du lịch của các gia đình cũng như thói quen của một số thị trường châu Á. Lễ hội này được tổ chức tại khu bến Nhà Rồng - Khánh Hội, cảng Sài Gòn và nhiều điểm du lịch sông nước trên địa bàn. Sự kiện dự kiến có 22 hoạt động du lịch, văn hóa, giải trí, nghệ thuật, ẩm thực, thể thao, mua sắm diễn ra toàn địa bàn. Điểm nhấn của lễ hội sông nước năm nay là chương trình nghệ thuật ""Chuyến tàu huyền thoại"" tiếp nối câu chuyện ""Dòng sông kể chuyện"" năm 2023. Bên cạnh đó, lễ hội cũng sẽ tăng tính kết nối giữa các ngành ở TP.HCM cũng như với các khu vực Đông Nam Bộ, nhằm tối đa hóa độ dài lưu trú và chi tiêu của du khách, tạo ra chuỗi hoạt động quy mô và hứng thú cho du khách.  Qua đó đưa đến những sản phẩm đặc trưng không chỉ trong lĩnh vực du lịch mà cả văn hóa, hướng đến kích cầu du lịch bài bản hơn. Về mục tiêu cho lễ hội năm nay, bà Hoa cho biết hiện sở vẫn đang đánh giá lại các chỉ tiêu cụ thể. Tuy nhiên, từ kinh nghiệm tổ chức năm ngoái, du lịch thành phố đã chủ động trong công tác truyền thông hơn khi triển khai quảng bá đến một số thị trường khách quốc tế như Nhật Bản, Hàn Quốc, khu vực Đông Nam Á có Singapore, Thái Lan… Các hoạt động hưởng ứng trong thời gian diễn ra lễ hội như chương trình khuyến mãi mua sắm cho du khách và người dân, hội thi ẩm thực sông nước, Lễ hội trái cây Nam Bộ hay chợ trái cây Trên bến dưới thuyền quận 8… Năm ngoái, chương trình Lễ hội sông nước lần đầu tổ chức đã có tác động tích cực đến du lịch TP. Trong thời gian diễn ra sự kiện, công suất phòng nghỉ trên địa bàn TP tăng khoảng 20%, các dịch vụ nhà hàng đạt công suất 100%, doanh thu tăng 23% so với bình thường. Cùng với đó, tour du lịch đường thủy cũng thu hút được sự quan tâm của du khách khi lượng khách tăng 15% so với bình thường, các tuyến nội đô tăng đến 50%. Ngoài ra, TP.HCM cũng tổ chức ba chương trình xúc tiến du lịch tại nước ngoài trong quý 2, gồm: Triển lãm TP.HCM và các tỉnh, thành hữu nghị tại Savannakhet (Lào) lần thứ 4; chương trình xúc tiến du lịch Việt Nam - TP.HCM tại Úc trong tháng 5 và chương trình xúc tiến du lịch Việt Nam - TP.HCM tại Hội chợ IMEX Frankfurt (Đức) năm 2024 cũng trong tháng 5-2024.",15/04/2024 19:49 GMT+7,https://tuoitre.vn/chuan-bi-le-hoi-song-nuoc-tp-hcm-2024-20240415191408435.htm,"Loạt lễ hội, sự kiện diễn ra trong mùa hè 2024 tại TP.HCM hứa hẹn góp phần định vị điểm đến TP.HCM là thành phố của sự kiện khu vực."
Du lịch Phan Thiết 30-4: Ở đâu - ăn gì - chơi gì?,"Bật chế độ vui chơi giải trí thả ga Nói về điểm vui chơi ""xịn đét"" ở Phan Thiết, thì chắc chắn không thể bỏ qua loạt công viên giải trí quy mô, độc đáo có thể cân tất cả sở thích của mỗi du khách tại NovaWorld Phan Thiet. Lãnh địa khủng long Dino Park rộng đến 2,5ha được lấy cảm hứng thiết kế từ bộ phim Jurassic Park huyền thoại. Tại đây, du khách sẽ được tận mắt chiêm ngưỡng, check-in với gần 100 mô hình các loài khủng long đã bị tuyệt chủng từ trước kỷ băng hà, đặc biệt là mô hình khủng long T-rex động lớn nhất Việt Nam. Được chế tác tinh xảo, hiệu ứng chuyển động sống động kết hợp với hiệu ứng âm thanh chân thật, Dino Park đưa du khách đi từ ngạc nhiên này đến thích thú khác, còn các bé thì thích mê. Dino Park bao gồm không gian ngoài trời tái hiện hệ sinh thái tự nhiên nơi các loài khủng long sinh sống như bình nguyên khổng lồ, hẻm núi đá… và không gian trong nhà mô phỏng hình mẫu phòng thí nghiệm - nơi các nhà khoa học làm việc trong công cuộc nghiên cứu và chế ngự các loài khủng long. Ai mà mê khám khá thiên nhiên hoang dã châu Phi thì đừng bỏ qua ""tiểu châu Phi"" thu nhỏ Safari Cafe, với hơn 100 cá thể động vật hoang dã và mô hình ẩm thực độc đáo cà phê trên lầu cao tương tác với hươu cao cổ.  Tại đây, du khách ở mọi nhóm tuổi có thể chọn tour tham quan bằng xe đầu kéo độc đáo, khám phá nơi sinh sống của các loài động vật ăn cỏ như hươu cao cổ, ngựa vằn, bò sừng dài, linh dương Đông Phi, hươu sao, đà điểu, cừu...  Safari Cafe là lựa chọn du lịch ""xanh"", gần gũi với thiên nhiên được đông đảo du khách, đặc biệt là trẻ em yêu thích. Ngoài ra, hai địa điểm được các gia đình và giới trẻ luôn check-in mỗi khi đến NovaWorld Phan Thiet chính là công viên nước Wonderland Water Park có quy mô 7ha, với 14 cụm đường trượt cùng nhiều trò chơi nước hấp dẫn và công viên giải trí Circus Land.  Với loạt trò chơi siêu chất từ nhẹ nhàng đến ""dữ dội"", từ trên cạn đến dưới nước dành cho mọi lứa tuổi, chơi cả buổi vẫn chưa hết, hai công viên này lúc nào cũng tấp nập du khách, sôi động cả ngày lẫn đêm. Đặc biệt, để chào đón đại lễ 30-4, một hạng mục công trình độc đáo, quy mô, mang tên Wonder Hill - Đồi Kỳ quan sẽ được đưa vào hoạt động, kỳ vọng sẽ trở thành biểu tượng mới của du lịch Bình Thuận.  Đến NovaWorld Phan Thiet dịp lễ này, bạn sẽ trở thành những người đầu tiên check-in ""biểu tượng du lịch mới"" Wonder Hill và tận hưởng nhiều trải nghiệm mới mẻ, thú vị mà bất kỳ du khách nào cũng mong muốn được trải qua. Bản đồ ẩm thực từ ngon đến rất ngon Có thực mới vực được đạo. Có đồ ăn ngon mới có sức khám phá và quẩy hết ga với các trải nghiệm thú vị. ""Thiên đường ẩm thực"" phong phú tại NovaWorld Phan Thiet chắc chắn sẽ không chỉ thỏa mãn mọi nhu cầu ăn uống của thực khách mà còn là không gian check-in cực chill, gây thương nhớ với mọi du khách. Nếu là tín đồ của hải sản, Hải Cảng Seafood hay Làng hải sản ven biển Trùng Dương là lựa chọn cho những thực khách muốn tận hưởng hải sản tươi ngon trong không gian biển lộng gió.  Đặc biệt, Làng hải sản Trùng Dương mang phong cách Địa Trung Hải rực rỡ sắc màu, nơi được Tổ chức kỷ lục Việt Nam (VietKings) trao kỷ lục ""Làng hải sản ven biển lớn nhất Việt Nam"".  Ngoài ra, một địa điểm view biển nên thơ mà du khách khó lòng bỏ qua là Aloha Beach Club. Ngồi nơi đây, nhâm nhi một ly cocktail, lắng nghe tiếng sóng vỗ rì rào và cảm nhận làn gió biển mát rượi, đó thực sự là một cảm giác rất tuyệt diệu. ""Vơ đét"" trong lòng thực khách còn là hệ thống nhà hàng đa dạng phong cách Á - Âu, tọa lạc ngay quảng trường Bikini Beach đắt giá như nhà hàng lẩu HongKong Dragon Hotpot, nhà hàng món nướng Hàn Quốc K-House, nhà hàng Long Beach,…  Và ngay đối diện quảng trường là tuyến Miami shophouse, một địa điểm check-in và khám phá ẩm thực đã quá quen thuộc mà bất kỳ du khách đến với đô thị du lịch biển đều không nên bỏ lỡ. Tới thì ở đâu? Để thuận tiện tham gia các hoạt động lễ hội, vui chơi, giải trí sôi động cả ngày lẫn đêm trong suốt chuỗi sự kiện 30-4 tại NovaWorld Phan Thiet, bạn nên ở ngay trong nội khu đô thị. Ở đây có nhiều resort, biệt thự nghỉ dưỡng vừa chất vừa chill. Với các gia đình đông thành viên hay nhóm bạn 6 - 10 người, lựa chọn biệt thự nghỉ dưỡng cũng là một ý tưởng hay khi mọi người có không gian riêng để vui chơi thoải mái, sân vườn rộng để cùng nhau tổ chức tiệc nướng BBQ ngoài trời. Chi phí thuê biệt thự rất hợp lý nhưng tiện nghi không thiếu thứ gì từ clubhouse, hồ bơi, phòng tập gym…. Nếu chuộng không gian nghỉ dưỡng yên tĩnh, ấm cúng thì bungalow resort là lựa chọn mới mẻ để du khách cân nhắc. Wonderland Resort như một bức tranh tuyệt tác theo phong cách châu Âu, với những căn bungalow xinh xắn nằm trên một ngọn đồi thoai thoải, tầm nhìn hướng biển tuyệt đẹp.  Trong khi đó, K-Town Resort lại mang đến không gian nghỉ dưỡng yên bình, thơ mộng với dãy các bungalow mang đậm dấu ấn của ngôi làng truyền thống Hàn Quốc. Điểm cộng của các biệt thự, resort tại NovaWorld Phan Thiet là luôn có xe điện buggy cùng với tuyến xe buýt đưa đón khách đến những địa điểm vui chơi giải trí trong nội khu đô thị, giúp hành trình trải nghiệm của gia đình, bạn bè càng thêm tiện lợi. Chào đón lễ 30-4, NovaWorld Phan Thiet sẽ mang đến chuỗi hoạt động lễ hội bùng nổ diễn ra từ ngày 27-4 đến 30-4.  Những màn biểu diễn Carnival rộn rã sắc màu, những bữa tiệc âm nhạc hoành tráng, pháo hoa rực rỡ đêm 30-4 và hàng loạt hoạt động vui chơi hoạt náo tại các công viên giải trí sẽ mang đến cho du khách một kỳ nghỉ trọn trải nghiệm và thăng hoa.",15/04/2024 11:00 GMT+7,https://tuoitre.vn/du-lich-phan-thiet-30-4-o-dau-an-gi-choi-gi-20240415092348838.htm,"Cùng khám phá địa điểm lưu trú, vui chơi giải trí, ăn uống cho chuyến du lịch chất lừ dịp lễ 30-4."
Đón bình minh sớm nhất ở Mũi Đôi cực đông đất liền bằng đường bộ,"Hành trình chinh phục Mũi Đôi - Hòn Đầu của chúng tôi bắt đầu từ thôn Đầm Môn (xã Vạn Thạnh, huyện Vạn Ninh, tỉnh Khánh Hòa) và ngay lập tức ""trải nghiệm"" 3km băng qua những đồi cát khổng lồ ven biển. Sau chặng dừng chân nghỉ mệt trong thời gian ngắn, chúng tôi tiếp tục đi khoảng 8km đường rừng, băng qua những con dốc cheo leo, những bãi đá lởm chởm thử thách sức bền của bất kỳ du khách nào tham gia hành trình. Theo anh Nguyễn Thanh Tâm, người dân bản địa chuyên hướng dẫn du khách, cung đường đầy khó khăn trên đòi hỏi người tham gia phải chuẩn bị đầy đủ nước, các chất điện giải. Bên cạnh đó, phải có tinh thần mạnh mẽ, sức bền tốt để có thể vượt qua cung đường này. Vượt qua thử thách đó, du khách được dừng chân, nghỉ ngơi qua đêm tại bãi Rạng. Cuối cùng sẽ là một hành trình khoảng 500m từ bãi Rạng lúc sáng sớm để đến với cột mốc Mũi Đôi - Hòn Đầu, là điểm cực Đông trên đất liền của Việt Nam. Du khách được đón những tia nắng đầu tiên trong ngày. Thầy Phạm Vũ Thanh An - giáo viên Trường THCS Võ Văn Ký (TP Nha Trang) - nhận xét hành trình khám phá Mũi Đôi là gian nan, khó khăn, nhưng khi đặt chân đến cực Đông trên đất liền của Tổ quốc, cũng chính là lúc chúng ta thấy được thành quả xứng đáng với công sức đã bỏ ra. ""Đây là một cuộc hành trình cực kỳ thú vị và thiêng liêng. Tôi mong rằng trong tương lai, các cấp chính quyền sẽ quan tâm, đầu tư nhiều hơn vào các tour du lịch, trải nghiệm đến với Mũi Đôi, để mọi người dân Việt Nam có thể được đặt chân đến cực Đông trên đất liền của đất nước"" - thầy An chia sẻ.",15/04/2024 06:02 GMT+7,https://tuoitre.vn/don-binh-minh-som-nhat-o-mui-doi-cuc-dong-dat-lien-bang-duong-bo-20240414143545512.htm,"Vượt qua trập trùng đồi cát, băng qua những cánh rừng, du khách sẽ được đón những tia nắng đầu tiên trên đất liền Việt Nam tại danh thắng Mũi Đôi - cực đông trên đất liền Việt Nam."
Khách tàu biển đi xe đạp khám phá đồng quê Nha Trang,"Ngày 14-4, tàu du lịch biển Insignia quốc tịch Marshall Island với khoảng 600 khách đã đến TP Nha Trang. Ngoài tham quan các điểm du lịch trong thành phố, đi dạo biển bằng xích lô… nhiều du khách đã lựa chọn trải nghiệm tour đồng quê ở vùng ngoại ô TP Nha Trang thuộc xã Diên Hòa, huyện Diên Khánh. Ngay khi hành trình bắt đầu, du khách được đạp xe qua cổng làng, đi qua những vườn dừa, đồng lúa, ao sen… Thấy những chú trâu hay bò được người dân chăn thả, nhiều người không khỏi thích thú. Chị Lee Kreps (du khách Mỹ) cho hay: ""Đây là lần đầu tiên tôi đến Nha Trang, phong cảnh và con người thật tuyệt. Tôi được tập yoga như một bài khởi động, sau đó đạp xe đi khám phá làng quê. Tôi thích thời tiết và khí hậu ở đây"". Sau khi khám phá làng quê, du khách được tham gia lớp học nấu các món ăn truyền thống như nem cuốn, bánh xèo... từ việc xử lý nguyên liệu, cuốn nem… Suốt buổi học là những tiếng cười và cả sự tập trung cao của du khách. Được thưởng thức chiếc nem cuốn chính mình làm, ông Pruce Godke (du khách Mỹ) cho hay ông thường hay đi du lịch bằng tàu biển và đã đến Hà Nội, Đà Nẵng… Nha Trang mang đến cho ông một trải nghiệm rất khác về văn hóa, con người. ""Điều mà tôi ấn tượng nhất là nụ cười của trẻ em và những con trâu gặm cỏ bên đường, một khung cảnh yên bình đúng như tưởng tượng của tôi.  Tôi cũng rất thích lớp học nấu ăn khi có thể tự tay gói bánh. Khi quay về Mỹ chắc chắn tôi sẽ nấu cho các bạn của tôi ăn thử đồ ăn Việt Nam"", ông Pruce nói. Ông Pruce chia sẻ thêm rằng để tour đồng quê thực sự thu hút, nên bố trí các biển chỉ dẫn trong đường làng bằng tiếng Anh, vì nhiều du khách có thể nhầm đường. Nên có thêm các cửa hàng bán đặc sản địa phương, các vật dụng cần thiết và người bán phải giao tiếp tốt bằng tiếng Anh.  Đặc biệt các tour nên lồng ghép đưa du khách đến nhà người dân bản địa để xem cuộc sống, sinh hoạt của họ như thể nào… tăng tính trải nghiệm cho du khách như cùng tham gia với chủ nhà thu hoạch nông sản, nấu ăn. Ông Bùi Minh Thắng - giám đốc Công ty TNHH du lịch thương mại Phương Thắng - cho biết: ""Nha Trang - Khánh Hòa có nhiều tiềm năng để phát triển các tour du lịch đồng quê.  Với sự sáng tạo, các đơn vị lữ hành luôn tạo ra những tour hấp dẫn. Trong đó, vai trò của các hướng dẫn viên rất quan trọng, họ cần phải khơi gợi và làm nổi bật những nét đẹp văn hóa truyền thống của Việt Nam"". Theo ông Thắng, Nha Trang có lợi thế là cảng biển nằm ngay trong thành phố, do đó việc di chuyển tham quan rất thuận lợi. Chưa kể hiện nay các hãng tàu đang tập trung đóng mới du thuyền, vì vậy giá du lịch bằng tàu biển đã đáp ứng nhu cầu của khách trung lưu, đồng thời mở rộng nguồn khách từ các nước châu Á bên cạnh nguồn khách từ châu Âu, Mỹ, Úc…",14/04/2024 19:43 GMT+7,https://tuoitre.vn/khach-tau-bien-di-xe-dap-kham-pha-dong-que-nha-trang-20240414173827448.htm,"Trong chuyến đi khám phá tour đồng quê, nhiều du khách tàu biển không khỏi thích thú trước những cánh đồng lúa, sân đình, và những chú trâu ở làng quê vùng ngoại ô TP Nha Trang."
Phát hiện thêm 22 hang động mới ở Phong Nha - Kẻ Bàng,"Ngày 14-4, Ban quản lý Vườn quốc gia Phong Nha - Kẻ Bàng (Quảng Bình) cho biết thêm 22 hang động vừa được các nhà thám hiểm hang động phát hiện tại ""vương quốc hang động"" Quảng Bình. Các hang động mới này chủ yếu tập trung ở trong Vườn quốc gia Phong Nha - Kẻ Bàng và khu vực các huyện Minh Hóa, Tuyên Hóa. Các hang động được khảo sát có chiều dài dao động từ 30-572m, trong đó có 4 hang dài nhất, gồm: hang Va (516m), hang 12/2 Dry (404m); hang Vuc Hung (430m); hang Ong Dau (572m). Độ cao cửa hang dao động từ 46-550m, độ sâu dao động từ 32-154m. Trong đợt này, khu vực vùng lõi Vườn quốc gia Phong Nha - Kẻ Bàng có 7 hang động được khảo sát với chiều dài 1.415m; vùng đệm Vườn quốc gia Phong Nha - Kẻ Bàng có 7 hang động được khảo sát với chiều dài 1.027m; khu vực phụ cận thuộc xã Lâm Hóa (Tuyên Hóa) có 11 hang động được khảo sát với chiều dài 1.108m. Một nhà thám hiểm trong đoàn khảo sát cho biết đa số các hang động vừa phát hiện đều lung linh huyền ảo. Mỗi hang động mang những nét riêng biệt, đại diện cho giá trị nổi bật về địa chất - địa mạo, thủy văn từng khu vực của Vườn quốc gia Phong Nha - Kẻ Bàng. Ông Phạm Hồng Thái, giám đốc Ban quản lý Vườn quốc gia Phong Nha - Kẻ Bàng, cho biết các hang động mới được phát hiện trên chỉ mới nằm trong phạm vi nghiên cứu tiếp cận, xác định vị trí, mô tả sơ bộ.  Do vậy đơn vị cần phải có khảo sát, nghiên cứu chuyên sâu để làm rõ hơn giá trị, qua đó có những nhận định chính xác trong việc bảo tồn và khai thác bền vững cảnh quan, hang động này. Quảng Bình được mệnh danh là ""Vương quốc hang động"" với hơn 400 hang đã được khám phá. Trong đó có hang Sơn Đoòng - là hang động lớn nhất thế giới và hang Én - là hang lớn thứ ba thế giới.",14/04/2024 14:34 GMT+7,https://tuoitre.vn/phat-hien-them-22-hang-dong-moi-o-phong-nha-ke-bang-20240414140039898.htm,"'Vương quốc hang động' Phong Nha - Kẻ Bàng vừa có thêm 22 hang động mới được phát hiện, được đánh giá đẹp lung linh không kém 400 hang động đã phát hiện trước đó."
Một loạt hãng hàng không ngừng bay ngang Israel và Iran,"Theo Hãng tin Reuters, hãng hàng không Kuwait Airways của Kuwait thông báo chuyển hướng tất cả các chuyến bay đến và chuyến bay đi ra khỏi khu vực căng thẳng ở Trung Đông, do tình hình an ninh bất ổn vào sáng 14-4. Hãng hàng không United Airlines của Mỹ phát thông báo hủy chuyến bay từ thành phố Newark (tiểu bang New Jersey) đến thành phố Tel Aviv (Israel) hôm 13-4 (theo giờ địa phương) do sự hỗn loạn tại không phận Israel. Hãng hàng không quốc gia Úc Qantas cũng điều chỉnh đường bay của các chuyến bay giữa hai thành phố Perth (Úc) và London (Anh) do lo ngại vấn đề an ninh khi bay ngang Trung Đông, theo báo Telegraph. Các quan chức Israel đã thông báo đóng cửa không phận để đảm bảo an toàn từ đêm 13-4, khi Iran bắt đầu không kích vào vùng này. Tuy nhiên, đến 7h30 ngày 14-4 (theo giờ địa phương), cơ quan quản lý sân bay Israel vừa mở cửa lại không phận. Trước đó hôm 12-4, hãng hàng không quốc gia Đức Lufthansa Airlines đã gia hạn việc đình chỉ các chuyến bay đến và bay đi từ thủ đô Tehran (Iran), đồng thời hãng này sẽ không bay vào không phận Iran đến hết ngày 18-4. Cũng trong ngày 12-4, hãng hàng không quốc gia Áo Austrian Airlines cũng tuyên bố đình chỉ các chuyến bay đến Tehran đến hết ngày 18-4 do lo ngại căng thẳng leo thang ở Trung Đông. Lufthansa Airlines và Austrian Airlines là hai hãng hàng không phương Tây duy nhất có đường bay thẳng đến Tehran. Mỹ và các nước ở khu vực Trung Đông khác bắt đầu cảnh giác cao độ về cuộc trả đũa của Iran kể từ vụ tấn công tòa nhà Lãnh sự quán Iran ở Damascus (Syria) hôm 1-4.",14/04/2024 14:25 GMT+7,https://tuoitre.vn/mot-loat-hang-hang-khong-ngung-bay-ngang-israel-va-iran-20240414132551101.htm,"Ngay sau khi Iran tấn công Israel bằng drone và tên lửa, một loạt hãng hàng không trên khắp thế giới đã dừng đường bay ngang qua điểm nóng này."
