Title,Content,Date,Url,Summary
Việt Nam sẽ đầu tư 1 tỉ USD để đào tạo kỹ sư bán dẫn,"Trao đổi với Tuổi Trẻ, ông Võ Xuân Hoài, phó giám đốc Trung tâm đổi mới sáng tạo quốc gia (NIC), khẳng định hệ thống các cơ sở đào tạo, các trường đại học, viện nghiên cứu trên cả nước đủ khả năng để đào tạo đủ số kỹ sư như mục tiêu của Đề án phát triển nguồn nhân lực ngành công nghiệp bán dẫn đến năm 2030, định hướng đến năm 2045, do Bộ KH&ĐT chủ trì và phối hợp với các bộ, cơ quan liên quan hoàn thiện để trình Thủ tướng trước ngày 25-4. 40.000 học bổng cho kỹ sư bán dẫn * Là cơ quan trực tiếp soạn thảo đề án đào tạo 50.000 kỹ sư bán dẫn, đến nay NIC đã chuẩn bị những gì để thực hiện mục tiêu đề ra? - Theo chỉ đạo của Bộ KH&ĐT, NIC đã phối hợp với các đơn vị liên quan để triển khai hai nhóm công việc chính. Thứ nhất là xây dựng đề án phát triển ngành công nghiệp bán dẫn đến năm 2030, định hướng 2045. Thứ hai là triển khai các hoạt động kết nối đối tác trong và ngoài nước để hỗ trợ các trường đại học, cơ sở đào tạo tại Việt Nam phát triển nguồn nhân lực cho ngành bán dẫn. Từ tháng 9-2023, trong chuyến công tác của Thủ tướng tại Mỹ, NIC đã ký hợp tác với Synosys và Cadence - hai tập đoàn cung cấp phần mềm thiết kế chip lớn nhất trên thế giới. Thông qua hợp tác này, NIC cung cấp lại các bản quyền phần mềm cho các trường đại học trong nước để họ có cơ sở, nguồn lực sử dụng trong quá trình đào tạo. NIC cũng ký kết hợp tác với Đại học bang Arizona - trường đào tạo về ngành chip bán dẫn lớn nhất trên thế giới - để xây dựng các chương trình đào tạo, tận dụng các nguồn lực mà Chính phủ Mỹ hỗ trợ VN để triển khai các chương trình đào tạo. * Thưa ông, NIC sẽ phối hợp với các trường đại học, các viện thế nào trong đào tạo nhân lực cho ngành công nghiệp bán dẫn? - Thời gian qua NIC phối hợp với Google để mỗi năm cấp khoảng 30.000 suất học bổng, đặc biệt từ năm 2024 sẽ cấp khoảng 40.000 suất học bổng cho các ngành công nghiệp 4.0 với sinh viên các trường trên cả nước. Những sinh viên, học viên tốt nghiệp nhận được chứng chỉ của Google thì các doanh nghiệp công nghệ lớn tại nhiều quốc gia đều sẵn sàng tiếp nhận vào làm việc. NIC cũng phối hợp với USAID để triển khai đào tạo nguồn nhân lực cho đổi mới sáng tạo và hệ sinh thái khởi nghiệp. Trong ngành công nghiệp bán dẫn, NIC phối hợp với Synosys, Cadence, Siemens để được hỗ trợ các nền tảng phần mềm thiết kế chip, sau đó bàn giao lại cho các trường đại học nhằm phối hợp với các trường đại học triển khai các chương trình đào tạo dài hạn về ngành công nghiệp bán dẫn. NIC cũng phối hợp với Cadence và FPT để triển khai chương trình đào tạo dành cho sinh viên, cấp học bổng cho sinh viên xuất sắc trong ngành thiết kế vi mạch. Đồng thời phối hợp với Đại học Quốc gia Hà Nội, Đại học Quốc gia TP.HCM để thực hiện chương trình đào tạo dành cho giảng viên, sử dụng công nghệ nền tảng của Cadence. Cung cấp 90.000 kỹ sư chất lượng cao đến năm 2030 * Nhiều ý kiến lo ngại hiệu quả của việc đào tạo 50.000 kỹ sư bán dẫn, đề án có tính tới việc đảm bảo cho các kỹ sư này làm đúng ngành nghề sau khi ra trường? - Theo khảo sát của Bộ KH&ĐT, với khả năng cung cấp nhân lực của các trường đại học và cơ sở đào tạo của Việt Nam, hoàn toàn có thể cung cấp được 50.000 kỹ sư chất lượng cao trong giai đoạn từ nay đến 2030. Nếu kết hợp các chương trình đào tạo ngắn hạn tốt, hoàn toàn có thể có số lượng lớn hơn, chất lượng tốt trên cơ sở hợp tác quốc tế. Về nhu cầu, thời gian tới Việt Nam sẽ tiếp tục thu hút được các doanh nghiệp FDI công nghệ trong các khâu đóng gói, kiểm thử, sản xuất, thiết kế. Ước tính đến năm 2030, Việt Nam cần 35.000 kỹ sư cho khâu đóng gói, kiểm thử, sản xuất. Với khâu thiết kế chip, đến 2030 Việt Nam có khoảng 100 doanh nghiệp thiết kế vi mạch và cần khoảng 13.500 kỹ sư thiết kế chip. Dựa trên nhu cầu của các tập đoàn công nghệ đã làm việc với NIC thời gian qua, chúng ta hoàn toàn có khả năng dành một lượng kỹ sư để xuất khẩu sang Hàn Quốc, Đài Loan, Nhật Bản, Mỹ... Khảo sát của Hiệp hội Bán dẫn Hoa Kỳ cũng cho biết nhu cầu nguồn nhân lực của ngành công nghiệp bán dẫn thế giới rất lớn chứ không chỉ ở Việt Nam. * Ông cho rằng đâu là những khó khăn với đào tạo nhân lực cho ngành bán dẫn những năm tới? - Trong quá trình kết nối và triển khai, các chương trình đào tạo nhân lực cho ngành chip bán dẫn đang gặp một số khó khăn về cơ chế chính sách như chưa hoàn thiện chiến lược phát triển ngành công nghiệp bán dẫn nên chưa có định hướng cụ thể trong giai đoạn tới sẽ làm gì. Để phát triển nhân lực cho ngành bán dẫn đòi hỏi phải có đầu tư lớn, đặc biệt từ nguồn lực của Nhà nước. Muốn vậy, các văn bản luật, nghị quyết của Quốc hội phải đưa được các ưu đãi, hỗ trợ quá trình đào tạo nhân lực bán dẫn.  Hơn nữa, cần có cơ chế để thu hút các tài năng người Việt gốc Việt, chuyên gia quốc tế về tham gia công tác đào tạo tại Việt Nam. Tuy nhiên, chúng ta chưa có cơ chế cụ thể để thu hút. Về hạ tầng, chúng ta có một số trường như Đại học Bách khoa Hà Nội, Đại học Quốc gia TP.HCM, Đại học Quốc gia Hà Nội... đã chuẩn bị một số trung tâm nghiên cứu, phòng thí nghiệm cho ngành công nghiệp bán dẫn. Tuy nhiên mới dừng lại ở quy mô nhỏ, tập trung công đoạn thiết kế và một phần công đoạn nghiên cứu các vật liệu. * Việc đầu tư nâng cấp hạ tầng, đào tạo nhân lực ngành bán dẫn rất lớn. Đề án có tính tới nguồn lực cho vấn đề này không, thưa ông? - Việc đào tạo nhân lực ngành bán dẫn đòi hỏi phải đáp ứng các tiêu chuẩn quốc tế. Nguồn lực sau khi đào tạo một phần sử dụng trong nước, một phần sẽ làm việc ở các nước trên thế giới. Điều này đòi hỏi việc đào tạo phải theo chương trình quốc tế, có sự tham gia của chuyên gia quốc tế. Trong dự thảo đề án phát triển nguồn nhân lực cho ngành công nghiệp bán dẫn, chúng tôi dự kiến sẽ sử dụng nguồn ngân sách ở cả trung ương và địa phương, nguồn xã hội hóa để đầu tư các trung tâm đào tạo quy mô nhỏ và vừa tại các trường đại học, đồng thời tập trung đầu tư cho 3 cơ sở trung tâm nghiên cứu, đào tạo bán dẫn ở 3 miền tại Hà Nội, Đà Nẵng, TP.HCM. Các trung tâm này sẽ được đầu tư đạt chuẩn quốc tế để dùng chung cho các trường đại học, viện nghiên cứu, các doanh nghiệp và cá nhân có mong muốn khởi nghiệp trong ngành công nghiệp bán dẫn.",18/04/2024 09:32 GMT+7,https://tuoitre.vn/vn-se-dau-tu-1-ti-usd-de-dao-tao-ki-su-ban-dan-20240418080224388.htm,"Từ nay đến 2030, Việt Nam sẽ đầu tư khoảng 1 tỉ USD để đào tạo 50.000 kỹ sư bán dẫn. Theo tính toán của Bộ KH&ĐT, việc đào tạo đội ngũ nhân lực bán dẫn này sẽ gián tiếp tạo nguồn thu khoảng 15 - 16 tỉ USD cho nền kinh tế."
"Con trẻ và điện thoại: Cấm thì thương, buông thì... mệt đầu","Con đi ăn, đi ngủ đều ôm khư khư cái điện thoại. Việc sử dụng điện thoại và mạng xã hội trước tuổi khiến trẻ em đối mặt với nhiều nguy cơ thiếu an toàn trên không gian ảo này. Bẫy khiêu dâm qua điện thoại Ngày 9-4, Công an quận Cẩm Lệ (TP Đà Nẵng) vào cuộc điều tra vụ một nữ sinh lớp 6 bị kẻ xấu cắt ghép hình ảnh nóng và ép đọc truyện đồi trụy. Trước đó, Công an quận 8 (TP.HCM) đã khởi tố vụ án, khởi tố và lệnh bắt tạm giam một bị can nam về tội cưỡng đoạt tài sản. Thông qua mạng xã hội, người này làm quen nhiều trẻ em rồi dụ dỗ các nạn nhân chat sex, chia sẻ hình ảnh và clip nhạy cảm, sau đó ép buộc trẻ làm theo các yêu cầu như tiếp tục gửi hình ảnh và clip nhạy cảm để tống tiền. Đồng thời dọa đăng hình ảnh, clip nhạy cảm lên mạng xã hội nếu nạn nhân không làm theo yêu cầu. Cũng với cách làm tương tự, một nam thanh niên ngụ TP.HCM đã bị cơ quan Công an Hà Giang bắt giữ để điều tra về hành vi cưỡng đoạt tài sản. Trước đó, nam thanh niên này đã làm quen qua mạng, dụ dỗ bé gái 11 tuổi quay clip nóng rồi tống tiền. Trong nhiều nhóm chat của phụ huynh các trường trung học cơ sở, phụ huynh đã ""thất kinh"" khi nhận được thông báo từ thầy cô chủ nhiệm cho biết nhà trường phát hiện một nhóm học sinh thường dùng điện thoại để chat sex và vào các trang mạng không dành cho trẻ em. Phụ huynh cũng nhắc nhau về tình trạng trẻ ra vào các trang kích động bạo lực, hẹn nhau cùng cày game trên điện thoại kể cả vào giờ nghỉ trưa ở trường. Hàng trăm mối nguy Một khảo sát gần đây của Cục Trẻ em (Bộ Lao động - Thương binh và Xã hội) cho biết có 89% trẻ em sử dụng mạng Internet, trong đó 87% sử dụng hằng ngày. Một nghiên cứu khác cho biết độ tuổi trung bình sử dụng điện thoại và mạng xã hội hiện nay tại Việt Nam chỉ khoảng 9 tuổi. Trong khi đó, độ tuổi trung bình để được cập nhật kiến thức để sử dụng điện thoại hay mạng xã hội an toàn là 13 tuổi. Nói khác hơn, trẻ em Việt Nam hiện nay đang có khoảng 5 năm sử dụng điện thoại và truy cập mạng xã hội khi chưa có kiến thức, kỹ năng. Trẻ dùng điện thoại phải đối mặt với rất nhiều nguy cơ thiếu an toàn ở trên không gian mạng, trẻ không có năng lực bảo vệ bản thân trước những thông tin xấu, độc. Nhiều phụ huynh không hề để tâm đến việc con em mình đang sử dụng điện thoại ra sao, thường liên lạc hay kết bạn với ai. Nếu có quan tâm cũng chưa chắc biết hết những thứ đang lôi kéo con trên mạng. Các rủi ro trẻ có thể gặp trên mạng rất đa dạng gồm tin giả, tin kích động, bạo lực, những video và hình ảnh không phù hợp, hay bị phát tán thông tin, bị lôi kéo tham gia nội dung không lành mạnh. Việc cấm con trẻ sử dụng điện thoại thông minh hay mạng xã hội là điều không thể. Tuy nhiên, để giảm những tình trạng đáng tiếc, hậu quả đau lòng, phụ huynh luôn đóng vai trò quyết định. Dùng điện thoại lành mạnh không chỉ dừng lại ở việc tiếp xúc với màn hình bao lâu, mà còn nằm ở việc tiếp xúc với nội dung như thế nào trên một không gian số với đầy ắp thông tin như hiện nay.",18/04/2024 06:03 GMT+7,https://tuoitre.vn/con-tre-va-dien-thoai-cam-thi-thuong-buong-thi-met-dau-2024041722512378.htm,Những vụ án gây hại trẻ em có liên quan đến việc trẻ sử dụng điện thoại có lẽ chỉ là phần nổi. Những gì còn ẩn ngầm bên trong điện thoại trẻ đang cầm trên tay mới thật sự là nỗi lo lớn.
"Vi phạm bản quyền tràn lan trên môi trường số, luật pháp thôi không đủ?","Đây cũng là nhận định được chia sẻ chung tại tọa đàm Bản quyền và phát triển bền vững ngành công nghiệp sáng tạo nội dung số do Cục Bản quyền tác giả phối hợp với Hội Truyền thông số Việt Nam và Liên minh Sáng tạo nội dung số tổ chức ngày 17-4 tại Hà Nội. Bảo vệ bản quyền trên môi trường số chưa đáp ứng yêu cầu Phát biểu tại hội thảo, ông Trần Hoàng - cục trưởng Cục Bản quyền tác giả - cho biết sở hữu trí tuệ là một yếu tố không thể thiếu trong nền kinh tế sáng tạo, đặc biệt là gắn với các mục tiêu phát triển bền vững. Đổi mới sáng tạo và sở hữu trí tuệ là trung tâm để giải quyết những thách thức toàn cầu, thúc đẩy tăng trưởng và phát triển của xã hội. Hiện nay, các ngành công nghiệp văn hóa Việt Nam đã có những bước phát triển. Tại Việt Nam, qua số liệu ước tính, giá trị tăng thêm (giá hiện hành) của các ngành công nghiệp văn hóa đóng góp vào nền kinh tế năm 2018 ước đạt 5,82%; năm 2019 ước đạt 6,02%; năm 2020 và 2021 do ảnh hưởng của đại dịch nên số liệu có sự sụt giảm chỉ còn khoảng 4,32% và 3,92%. Đến năm 2022 các ngành đã bắt đầu phục hồi và giá trị đóng góp có sự tăng trưởng ước đạt 4,04%. Giá trị sản xuất của các ngành công nghiệp văn hóa Việt Nam giai đoạn 2018 - 2022 đóng góp ước đạt bình quân 1,059 triệu tỉ đồng (tương đương khoảng 44 tỉ USD). Làm tốt công tác bảo hộ bản quyền sẽ là một trong những yếu tố quan trọng để xây dựng nền công nghiệp văn hóa phát triển lành mạnh, đủ sức cạnh tranh; đóng góp ngày càng nhiều vào GDP, tạo thêm việc làm và tăng kim ngạch xuất khẩu của đất nước. Nhưng thực tế, Cục Bản quyền tác giả thừa nhận dù đã có nhiều nỗ lực từ phía các cơ quan quản lý, thực thi, nhưng tình trạng xâm phạm quyền tác giả, quyền liên quan trên môi trường kỹ thuật số vẫn đang diễn ra ngày càng phức tạp. Công tác bảo hộ quyền tác giả, quyền liên quan nói chung và trong môi trường kỹ thuật số nói riêng còn chưa đáp ứng yêu cầu. Ông Phạm Thanh Tùng, đại diện Cục Bản quyền tác giả, cho biết hệ thống pháp luật của Việt Nam cũng được đồng bộ và tương thích với luật quốc tế. Bên cạnh đó, chúng ta đã có cơ chế phối hợp giữa các cơ quan và thực thi bảo vệ bản quyền. Tuy nhiên, ông Tùng cũng khẳng định tỉ lệ vi phạm bản quyền của Việt Nam tương đối cao do nhiều nguyên nhân. Trong đó, yếu tố môi trường số là môi trường xuyên biên giới nên khó xác định các chủ thể và hành vi vi phạm. Bên cạnh đó, bộ máy thực thi của Việt Nam còn hạn chế nên khó xử lý vi phạm bản quyền trên môi trường số. Pháp luật phải đi cùng giải pháp công nghệ Đại diện Cục Bản quyền tác giả cho rằng giải pháp là tiếp tục rà soát, hoàn thiện hệ thống pháp luật về quyền tác giả, đặc biệt là quy định về bảo hộ quyền tác giả, quyền liên quan trên môi trường số hướng tới xây dựng Luật Bản quyền tác giả độc lập. Cũng cần phải nâng cao trách nhiệm của xã hội và doanh nghiệp, cảnh báo doanh nghiệp không nên mua quảng cáo các trang mạng hoặc mạng xã hội vi phạm bản quyền. Ngoài ra, chống vi phạm trên môi trường số cần chủ động từ chính chủ thể quyền tác giả, quyền liên quan bằng các giải pháp công nghệ. Ông Hoàng Đình Chung - giám đốc Trung tâm bản quyền số - cho rằng cần phải ứng dụng công nghệ, mã hóa nội dung trước khi đưa lên môi trường số để chống vấn nạn đánh cắp bản quyền. Ông Chung nói các doanh nghiệp làm nội dung của Việt Nam thường là doanh nghiệp nhỏ, khó có khả năng thuê luật sư, xử lý khi gặp vấn đề vi phạm bản quyền. Giải pháp đăng ký xác thực bản quyền để chống đánh cắp trên môi trường số là giải pháp hiệu quả mà doanh nghiệp có thể nghĩ đến. Với giải pháp công nghệ này, nội dung sẽ được mã hóa trước khi đưa lên môi trường số, rà quét tự động và sử dụng trí tuệ nhân tạo để phát hiện nội dung vi phạm bản quyền.",17/04/2024 21:22 GMT+7,https://tuoitre.vn/vi-pham-ban-quyen-tran-lan-tren-moi-truong-so-luat-phap-thoi-khong-du-20240417202012239.htm,"Đại diện Cục Bản quyền tác giả nói môi trường số là môi trường xuyên biên giới, khó xác định các chủ thể và hành vi vi phạm, nên nạn đánh cắp bản quyền càng nghiêm trọng, khó giải quyết."
"Fintech giúp nhà xuất bản, phát hành sách tiếp cận triệu người dùng","Ngày 17-4, hưởng ứng “Ngày Sách và văn hóa đọc Việt Nam” năm 2024, nền tảng Fintech (công nghệ tài chính) MoMo cho biết sẽ giúp các nhà xuất bản, nhà phát hành sách tiếp cận hơn 30 triệu người dùng thông qua giải pháp trang doanh nghiệp (Business page). Với “cửa hàng online” này, các nhà xuất bản, nhà phát hành sách có thể chủ động truyền thông để tiếp cận khách hàng tiềm năng nhanh chóng cũng như tương tác và chăm sóc khách hàng, tổng hợp, gợi ý các đầu sách hay kèm đánh giá của độc giả. Cùng với đó, MoMo còn xây dựng một cộng đồng dành cho những người yêu sách với tên gọi “Mê sách - Nghiện review” ngay trên nền tảng. Đây là nơi người dùng có thể đăng tải và tham khảo những bài đánh giá sách chất lượng về những cuốn sách hay, kết nối với những người có cùng sở thích về sách, từ đó góp phần lan tỏa văn hóa đọc trên môi trường số. Độc giả có thể tham gia cộng đồng này bằng cách tìm kiếm “Mê sách - Nghiện review” tại màn hình chính của ứng dụng MoMo. Ông Nguyễn Bá Diệp, đồng sáng lập MoMo, chia sẻ: “Với thế mạnh về công nghệ, MoMo mong muốn góp phần lan tỏa văn hóa đọc tại Việt Nam thông qua các giải pháp hữu ích cho độc giả, nhà xuất bản và doanh nghiệp phát hành sách"". Đồng thời, ông Diệp cũng bày tỏ mong muốn với các giải pháp của MoMo sẽ giúp các nhà xuất bản, doanh nghiệp phát hành sách tiếp cận độc giả hiệu quả hơn và đạt tăng trưởng”.",17/04/2024 18:52 GMT+7,https://tuoitre.vn/fintech-giup-nha-xuat-ban-phat-hanh-sach-tiep-can-trieu-nguoi-dung-20240417182711391.htm,"Nền tảng Fintech (công nghệ tài chính) MoMo cho biết sẽ giúp các nhà xuất bản, nhà phát hành sách đưa cửa hàng lên nền tảng tiếp cận hơn 30 triệu người dùng của mình."
