Title,Content,Date,Url,Summary
"Chuyên gia: Tuyển Việt Nam vào 'bảng tử thần', thách thức cho HLV Kim Sang Sik","Chiều 21-5, lễ bốc thăm chia bảng ASEAN Cup 2024 (tiền thân là AFF Cup) đã diễn ra tại Hà Nội. Kết quả, đội tuyển Việt Nam nằm ở ""bảng tử thần"" cùng Indonesia, Philippines, Myanmar và Lào. Bảng đấu ""nặng"" với HLV Kim Sang Sik Chuyên gia Phan Anh Tú cho rằng đội tuyển Việt Nam rơi vào bảng đấu nặng, nếu không muốn nói bảng B Asean Cup 2024 là ""bảng tử thần"", các đối thủ không dễ chơi, không phải muốn thắng là thắng. ""Đội tuyển Indonesia nổi lên như một thế lực mới, Philipines là một ẩn số, còn tuyển Myanmar không phải là đối thủ nhẹ mà chúng ta muốn thắng là thắng. Myanmar có tính chiến đấu cao. Đây là bảng đấu nặng cho tuyển Việt Nam"", ông Phan Anh Tú nhận định. Ở góc độ ngược lại, cựu quan chức Liên đoàn Bóng đá Hà Nội cho rằng: ""Kinh nghiệm của tôi cho thấy nếu đội bóng nào vượt qua các bảng đấu tử thần thì sẽ hoàn thiện được nhiều yếu tố, trong đó có bản lĩnh và lối chơi. Qua được vòng bảng, tuyển Việt Nam lại nhẹ gánh"". Ông Phan Anh Tú cho rằng thử thách với HLV Kim Sang Sik là tài nghệ cầm quân và con mắt nhìn người. Nhà cầm quân người Hàn Quốc đi tuyển quân ở khắp các sân cỏ V-League và có khoảng 6 tháng rèn dũa, hoàn thiện lối chơi trước khi ASEAN Cup 2024 diễn ra vào tháng 11. ""Khi Indonesia đang hoàn thiện, loay hoay định hướng phát triển dưới thời ông Shin Tae Yong thì HLV Park Hang Seo đã có trong tay đội hình thiện chiến. Còn bây giờ, chúng ta đang trông chờ và khả năng cầm quân của ông Kim Sang Sik thì Indonesia đã có lứa cầu thủ vào độ chín"", ông Tú đánh giá. Ông Phan Anh Tú đặt nhiều kỳ vọng vào khả năng kết hợp cầu thủ của tân HLV trưởng tuyển Việt Nam. ""Nếu thầy hay thì bóng đá Việt Nam qua giai đoạn này sẽ có một thế hệ mới"", ông nhấn mạnh. Đối thủ nào cũng khó với Việt Nam Trong khi đó, cựu tuyển thủ quốc gia Nguyễn Minh Phương cũng có cùng suy nghĩ khi đội tuyển Việt Nam rơi vào nhánh đấu khó, gặp lại Indonesia của HLV Shin Tae Yong. ""Tình hình hiện tại thì gặp đối thủ nào với chúng ta cũng đều khó. Hơn nữa, lứa cầu thủ của Việt Nam đang chững lại. Sự xuất hiện của HLV Kim Sang Sik là làn gió mới. Tôi hy vọng ông ấy sẽ tìm ra những con người mới, động lực mới cho bóng đá Việt Nam"", Minh Phương nhắn nhủ. Cựu đội trưởng tuyển Việt Nam ở AFF Cup 2008 đánh giá Indonesia là đối thủ khó chịu nhất bảng B. Ngay cả thời HLV Henrique Calisto, Minh Phương và đồng đội đã gặp không ít khó khăn. Giờ đây, bóng đá xứ vạn đảo phát triển theo xu hướng nhập tịch các cấu thủ có gốc gác quê nhà. Do đó, vấn đề càng khó. Minh Phương cho rằng: ""Bóng đá Indonesia giờ mạnh hơn nhiều ngày xưa. Họ đang nhập tịch nhiều cầu thủ từ châu Âu về để làm đối trọng với Việt Nam và Thái Lan trong khu vực. Động lực của họ, khát vọng chiến thắng của họ cao hơn nhiều"". Bóng đá Việt Nam đã thất bại ở 2 kỳ AFF Cup 2020 và AFF Cup 2022 dưới thời HLV Park Hang Seo. Trong khi HLV Troussier chưa có dịp thử lửa ở đấu trường này thì đã bị sa thải. HLV Kim Sang Sik đang đứng trước kỳ vọng và thách thức lớn ở giải đấu chính thức đầu tiên từ khi nhậm chức. Mục tiêu mà VFF đặt ra với ông Kim Sang Sik là phải đưa đội tuyển Việt Nam vào chung kết ASEAN Cup 2024.",21/05/2024 16:50 GMT+7,https://tuoitre.vn/chuyen-gia-tuyen-viet-nam-vao-bang-tu-than-thach-thuc-cho-hlv-kim-sang-sik-20240521155636926.htm,"Chuyên gia bóng đá Phan Anh Tú, cựu tuyển thủ Nguyễn Minh Phương đều cho rằng đội tuyển Việt Nam của HLV Kim Sang Sik sẽ gặp nhiều thách thức khi rơi vào ""bảng tử thần"" tại ASEAN Cup 2024."
Người hùng World Cup bị Argentina loại khỏi danh sách dự Copa America 2024,"Không có gì ngạc nhiên khi Messi và Di Maria tiếp tục được chọn làm người mang băng đội trưởng, đội phó của đội tuyển Argentina. Nhưng đáng ngạc nhiên là Paulo Dybala lại vắng mặt dù anh không hề dính chấn thương. Hai năm trước, Dybala là 1 trong 5 người thực hiện thành công cú sút 11m trong loạt luân lưu thắng Pháp ở chung kết World Cup 2022. Dù không ra sân nhiều trên đất Qatar năm đó vì chấn thương, nhưng Dybala vẫn được ông Scaloni tin tưởng chọn đá luân lưu vào thời khắc quyết định. Ngôi sao 30 tuổi luôn bị chấn thương hành hạ. Từ sau World Cup 2022, anh dính tổng cộng 10 ca chấn thương khác nhau. Dù vậy, Dybala vẫn có màn trình diễn ấn tượng trong màu áo AS Roma. Mùa giải này, Dybala ghi 16 bàn, góp 10 kiến tạo trong 38 lần ra sân cho đội bóng nước Ý. Thời điểm hiện tại, anh đã hoàn toàn khỏe mạnh. Theo truyền thông Argentina, lý do ông Scaloni loại Dybala là về chuyên môn. Thêm vào đó, tuyển Argentina lúc này có rất nhiều tiền đạo trẻ giàu tiềm năng. Chiến lược gia 46 tuổi muốn trao thêm cơ hội cho các cầu thủ trẻ thay vì ""đóng khung"" những người hùng World Cup. Garnacho - người nổi tiếng là fan của Ronaldo cũng được điền tên vào danh sách. Anh cùng với tiền đạo cánh Carboni và hậu vệ cánh Barco là những cầu thủ U20 có hy vọng đến Copa America 2024. Trừ Dybala và một số cầu thủ dự bị khác, HLV Scaloni cơ bản giữ lại dàn sao từng giúp Argentina vô địch World Cup 2022. Nòng cốt của họ vẫn là thủ thành Martinez; các hậu vệ Otamendi, Romero, Acuna, Molina; các tiền vệ Mac Allister, Enzo Fernandez, De Paul; các tiền đạo Julian Alvarez, Lautaro Martinez... Chấn thương hiện là nỗi lo lớn của ông Scaloni. Cách đây 1 tuần Messi cũng dính chấn thương trong màu áo CLB Inter Miami, trong khi nhiều cầu thủ quan trọng như Enzo, Lisandro Martinez chưa bình phục hoàn toàn. Ông Scaloni sẽ loại bớt 3 cái tên để chốt danh sách tham dự Copa America gồm 26 cầu thủ sau loạt trận giao hữu đầu tháng 6, gặp Ecuador và Guatemala. Đội tuyển Argentina sẽ đá trận mở màn bảng A ở Copa America với Canada vào ngày 20-6. Tiếp đó là 2 trận gặp Chile và Peru.",21/05/2024 09:24 GMT+7,https://tuoitre.vn/nguoi-hung-world-cup-bi-argentina-loai-khoi-danh-sach-du-copa-america-2024-20240521090944349.htm,"Sáng 21-5 (giờ Việt Nam), HLV Lionel Scaloni đã công bố danh sách sơ bộ của tuyển Argentina nhằm chuẩn bị cho Copa America 2024, giải đấu sẽ diễn ra vào giữa tháng 6."
Bốc thăm vòng bảng ASEAN Cup 2024: Chờ đối thủ của tuyển Việt Nam,"Theo kết quả phân chia hạt giống trước lễ bốc thăm ASEAN Cup (tiền thân là AFF Cup) 2024, tuyển Việt Nam và Thái Lan nằm ở nhóm 1. Nhóm 2 gồm Indonesia và Malaysia.  Philippines và Singapore nằm ở nhóm 3. Nhóm 4 gồm Myanmar và Campuchia. Lào và Brunei/Timor Leste là những đội nằm ở nhóm 5. Có thể vào bảng đấu khó Với kết quả phân chia hạt giống nói trên, tuyển Việt Nam sẽ không gặp Thái Lan ở vòng bảng. Dù vậy, thầy trò HLV Kim Sang Sik nhiều khả năng sẽ rơi vào bảng đấu nặng.  Đó là trường hợp lá thăm đưa tuyển Việt Nam nằm cùng bảng với Indonesia, Philippines, Myanmar và Lào. Đây đều là những đội mạnh nhất ở nhóm hạt giống của mình. Vài năm gần đây, bóng đá Indonesia có sự chuyển mình mạnh mẽ nhờ chính sách nhập tịch. Và chính tuyển Việt Nam là đội đã cảm nhận được sức mạnh của tuyển Indonesia.  Trong 3 trận gần nhất gặp Indonesia (2 trận ở vòng loại thứ 2 World Cup 2026 và 1 trận tại Asian Cup), tuyển Việt Nam đều nhận thất bại.  Tại ASEAN Cup 2024, tuyển Indonesia đã đặt mục tiêu đăng quang chức vô địch. Trong quá khứ, Indonesia từng 6 lần vào chung kết nhưng chưa từng đăng quang chức vô địch. Philippines cũng là đối thủ không hề dễ chịu với tuyển Việt Nam. Mới đây, Liên đoàn Bóng đá Philippines đã nhập tịch hàng loạt cầu thủ để tăng cường sức mạnh cho đội tuyển quốc gia.  Do đó, tuyển Philippines sẽ là rào cản lớn với Việt Nam trên con đường hướng tới mục tiêu vào bán kết ASEAN Cup 2024. Bên cạnh đó, thầy trò HLV Kim Sang Sik cũng không thể xem thường Lào và Myanmar bởi hai nền bóng đá này có nhiều tiến bộ trong thời gian qua. Bảng đấu dễ, bán kết khó Bảng đấu lý tưởng hơn với Việt Nam ở vòng bảng ASEAN Cup 2024 sẽ bao gồm các đội Malaysia, Singapore và Brunei/Timor Leste.  Xét về thực lực, các đối thủ này không mạnh bằng Indonesia, Philippines, Myanmar hay Lào. Vòng bảng vì vậy sẽ trở nên dễ thở hơn với tuyển Việt Nam. Nhưng vấn đề đặt ra là nếu rơi vào một vòng bảng nhẹ nhàng, tuyển Việt Nam hoàn toàn có thể gặp khó ở bán kết.  Hai đối thủ chờ đợi thầy trò HLV Kim Sang Sik ở bán kết nhiều khả năng là Thái Lan hoặc Indonesia. Về lý thuyết, sức mạnh hai đội lúc này là như nhau.  Ngược lại, nếu rơi vào bảng đấu khó (có Indonesia và Philippines) và cố gắng giành ngôi nhất bảng, tuyển Việt Nam nhiều khả năng sẽ có vòng bán kết dễ dàng hơn. ASEAN Cup 2024 sẽ diễn ra từ ngày 23-11 đến 21-12. Tại vòng bảng, 5 đội đá vòng tròn, mỗi đội đá 2 trận sân nhà 2 trận sân khách. Kết thúc vòng bảng, 2 đội nhất nhì mỗi bảng sẽ tiến vào bán kết.  Từ vòng bán kết các đội thi đấu theo thể thức sân nhà, sân khách. Tuyển Thái Lan đang là đương kim vô địch của giải.",21/05/2024 08:15 GMT+7,https://tuoitre.vn/boc-tham-vong-bang-asean-cup-2024-cho-doi-thu-cua-tuyen-viet-nam-20240521080434842.htm,"Lúc 14h hôm nay (21-5), tại Hà Nội sẽ diễn ra lễ bốc thăm chia bảng ASEAN Cup 2024 (VTV5 và FPT Play THTT). CĐV Việt Nam chờ đợi lá thăm đối thủ nào sẽ đến với thầy trò HLV Kim Sang Sik."
Xem bốc thăm ASEAN Cup 2024 trên kênh nào?,"Phân chia hạt giống trước lễ bốc thăm ASEAN Cup 2024 (tiền thân là AFF Cup - giải đấu quan trọng nhất của bóng đá Đông Nam Á), tuyển Việt Nam và Thái Lan nằm ở nhóm 1. Nhóm 2 gồm Indonesia và Malaysia. Philippines và Singapore nằm ở nhóm 3. Nhóm 4 gồm Myanmar và Campuchia. Lào và Timor Leste/Brunei là những đội nằm ở nhóm 5. Với kết quả phân chia hạt giống nói trên, tuyển Việt Nam sẽ không gặp Thái Lan ở vòng bảng. Dẫu vậy, thầy trò HLV Kim Sang Sik nhiều khả năng sẽ rơi vào bảng đấu nặng. Đó là trường hợp lá thăm đưa tuyển Việt Nam nằm cùng bảng với các đối thủ Indonesia, Philippines, Myanmar và Lào. Họ đều là những đội mạnh nhất ở nhóm hạt giống của mình. Bảng đấu lý tưởng hơn với Việt Nam ở vòng bảng ASEAN Cup 2024 sẽ bao gồm các đội Malaysia, Singapore và Timor Leste/Brunei. Xét về thực lực, các đối thủ này không mạnh bằng Indonesia, Philippines, Myanmar hay Lào. Vòng bảng vì vậy sẽ trở nên dễ thở hơn với tuyển Việt Nam. ASEAN Cup 2024 sẽ diễn ra từ 23-11 đến 21-12. Tại vòng bảng, 5 đội đá vòng tròn, mỗi đội đá 2 trận sân nhà, 2 trận sân khách. Kết thúc vòng bảng, 2 đội nhất nhì mỗi bảng sẽ tiến vào vòng bán kết. Từ vòng bán kết trở đi, các đội thi đấu theo thể thức sân nhà sân khách. Tuyển Thái Lan hiện đang là đương kim vô địch của giải đấu này. Lễ bốc thăm AFF Cup 2024 sẽ được trực tiếp trên FPT Play. Tuổi Trẻ Online sẽ cập nhật trực tuyến lễ bốc thăm từ 13h30, kính mời bạn đọc theo dõi.",21/05/2024 06:30 GMT+7,https://tuoitre.vn/xem-boc-tham-asean-cup-2024-tren-kenh-nao-2024052106035515.htm,"Lúc 14h hôm nay 21-5, tại Hà Nội, Liên đoàn Bóng đá Đông Nam Á (AFF) sẽ tổ chức lễ bốc thăm chia bảng ASEAN Cup 2024."
Tin tức thể thao sáng 21-5: Bình luận viên nổi tiếng bị bắt vì hiếp dâm trẻ em,"Một bình luận viên bị bắt giữ vì hiếp dâm trẻ em Tờ The Sun đăng tin rúng động về việc một bình luận viên thể thao nổi tiếng ở Anh bị cảnh sát bắt giữ vì tội hiếp dâm trẻ em. Danh tính người đàn ông này không được công bố, chỉ biết ông đã có gia đình. Vụ bắt giữ diễn ra vào lúc 4h sáng cách đây ít ngày. Ông bị tạm giam trong 18 tiếng rồi được thả ra nhờ đóng tiền bảo lãnh. Ngoài ra, bình luận viên này còn bị tịch thu máy tính và các tài liệu liên quan để phục vụ công tác điều tra. Đáng nói, vụ hiếp dâm này diễn ra nhiều hơn 1 lần. Nạn nhân là một đứa trẻ dưới 10 tuổi và danh tính cũng được giữ bí mật. Liverpool công bố HLV mới Sáng 21-5, Liverpool đã thông báo về việc chọn ông Arne Slot làm HLV trưởng. Được biết CLB đã đạt được thỏa thuận với chiến lược gia này nhiều tuần trước, nhưng quyết định chỉ đưa ra thông báo chính thức sau khi chia tay Jurgen Klopp. Hợp đồng giữa The Kop với HLV Arne Slot có thời hạn 3 năm. Vào tháng 1, HLV Jurgen Klopp xác nhận chia tay Liverpool vào cuối mùa. Từ đó đến nay, đội chủ sân Anfield đã tích cực đi tìm người thay thế. Tuy nhiên, nhiều ứng cử viên sáng giá như Xabi Alonso, Ruben Amorim đều từ chối những lời đề nghị. Cuối cùng, Liverpool quyết định lựa chọn Arne Slot, người đã có 3 năm thành công cùng Feyenoord khi đem về 1 danh hiệu vô địch quốc gia (Eredivisie) và 1 cúp quốc gia Hà Lan. Juventus có nguy cơ mất top 4 Ở trận đấu muộn vòng 37 Giải vô địch Ý (Serie A) sáng 21-5, Juventus đã để cho Bologna cầm hòa 3-3. Với kết quả này, ""bà đầm già"" hiện chỉ đang đứng thứ 4 với 68 điểm. Trong khi đó, Atalanta đứng ngay sau đang có 66 điểm nhưng đá ít hơn 1 trận. May mắn cho Juventus là ở mùa giải năm nay, họ vẫn có thể dự Champions League mùa sau trong trường hợp rơi xuống vị trí thứ 5. Tuy nhiên, đây vẫn là thứ hạng khó chấp nhận với Juventus. Trừ mùa giải 2022-2023 phải đứng thứ 7 do bị trừ 10 điểm, lần cuối đội bóng này rớt khỏi top 4 đã là vào năm 2011.",21/05/2024 06:26 GMT+7,https://tuoitre.vn/tin-tuc-the-thao-sang-21-5-binh-luan-vien-noi-tieng-bi-bat-vi-hiep-dam-tre-em-20240521062130289.htm,Một bình luận viên tại Anh bị bắt vì hành vi sai trái với trẻ em; Juventus có nguy cơ rơi khỏi top 4 Serie A là những tin tức thể thao đáng chú ý sáng 21-5.
Ho Chi Minh City Night Run Eximbank thành công rực rỡ,"Đặc biệt, với thông điệp ""bứt phá không giới hạn"" được Eximbank lan tỏa suốt mùa giải, giải chạy đêm năm nay đã chứng kiến nhiều màn ""bứt phá"" ấn tượng từ các vận động viên (VĐV). Thành công rực rỡ Giải chạy đêm Ho Chi Minh City Night Run Eximbank 2024 diễn ra vào tối 19-5 là một đêm đầy cảm xúc và màu sắc. Với sự tham gia đông đảo của gần 5.000 VĐV đến từ 37 quốc gia trên thế giới, sự kiện đã mang đến cho ""Sài Gòn - thành phố trẻ"" một đêm không ngủ trong bầu không khí vô cùng rạo rực và phấn chấn.    Ông Nguyễn Hồ Nam - phó chủ tịch HĐQT Eximbank, chia sẻ: ""Với tôn chỉ phát triển kinh doanh gắn liền với trách nhiệm xã hội, trong hơn 3 thập kỷ qua, Eximbank thường xuyên đồng hành cùng các hoạt động hướng về cộng đồng, văn hóa, thể thao lớn của Việt Nam.  Chúng tôi xem đây như là trách nhiệm, góp phần nâng cao chất lượng cuộc sống của mọi người.  Riêng đối với Ho Chi Minh City Night Run Eximbank 2024, Eximbank rất tự hào và hân hạnh khi được đồng hành cùng thành phố tổ chức một đêm giải thành công rực rỡ. Thông qua sự kiện, chúng tôi mong muốn thắp lửa tinh thần thể thao, lan tỏa lối sống văn minh, tích cực trong cộng đồng tại TPHCM nói riêng và cả nước nói chung"". Háo hức đến sự kiện từ rất sớm, chị Lan Anh, VĐV giải chạy đêm cho biết: ""Thực sự là rất vui, cứ nghĩ chạy đêm sẽ vắng nhưng tôi bất ngờ vì chương trình quá đông. Hoàn thành xong giải chạy, tôi có thêm những người bạn, họ đã ""dìu"" tôi hoàn thành chặng đường của mình để về đến đích. Cảm ơn Ban tổ chức rất nhiều"". Anh Xavier Perez, VĐV giải chạy đêm hào hứng chia sẻ: ""Tôi yêu thích môn chạy bộ ngay từ khi còn ở Mỹ. Khi sang Việt Nam tôi biết sự kiện này và ngay lập tức đăng ký tham gia. Thời tiết đang rất oi bức nhưng tôi đã hoàn thành cự ly của mình"". ""Bứt phá không giới hạn"" cùng Eximbank Khác biệt hẳn với hai mùa giải trước, Giải chạy đêm Ho Chi Minh City Night Run Eximbank 2024 đã tạo nhiều ấn tượng tốt đẹp với các VĐV khi lần đầu tiên linh vật Eximbank - Elias xuất hiện tại giải chạy.  Với tạo hình ""điển trai"", mạnh mẽ, ngân hàng muốn truyền tải thông điệp: Eximbank - Ngân hàng nổi tiếng với sự năng động và chuyên nghiệp nhưng cũng không kém phần thân thiện, ấm áp và vui vẻ.  Bên cạnh linh vật Elias, Eximbank còn ""truyền lửa"" một cách mạnh mẽ và quyết liệt tinh thần ""Bứt phá không giới hạn"" qua cuộc thi trực tuyến nội bộ ""Eximbank Virtual Run 2024 - Run As One"" dành cho các cán bộ nhân viên (Eximers).  Diễn ra trước thềm thi đấu Giải chạy đêm Ho Chi Minh City Night Run Eximbank 2024, ngay khi vừa phát động, cuộc thi đã thu hút hàng ngàn Eximer trên toàn quốc tham gia. ""Mỗi con người đều có những mục tiêu và ước mơ riêng của mình. Tại Eximbank, chúng tôi luôn khuyến khích nhân viên phát huy đam mê và năng lực thể thao.  Từng bước chạy sẽ tạo động lực thúc đẩy mỗi người bước ra khỏi vùng an toàn của chính mình, phát triển bản thân và vượt qua những giới hạn để chinh phục mục tiêu"", bà Lê Thị Mai Loan - phó tổng giám đốc Eximbank, khẳng định. ",20/05/2024 19:47 GMT+7,https://tuoitre.vn/ho-chi-minh-city-night-run-eximbank-thanh-cong-ruc-ro-20240520192221614.htm,Giải chạy đêm Ho Chi Minh City Night Run Eximbank 2024 đã chính thức khép lại với nhiều cung bậc cảm xúc và khoảnh khắc vô cùng đáng nhớ.
"Điền kinh Việt Nam giành huy chương đồng, phá kỷ lục quốc gia tại giải châu Á","Đội tuyển điền kinh Việt Nam bước vào ngày thi đấu đầu tiên với nội dung tiếp sức 4x400m hỗn hợp nam nữ tại Giải điền kinh tiếp sức châu Á 2024, diễn ra ở Thái Lan. Các chân chạy của tiếp sức 4x400m hỗn hợp nam nữ điền kinh Việt Nam, theo thứ tự xuất phát, gồm: Nguyễn Xuân Quang, Lê Thị Tuyết Mai, Lê Ngọc Phúc, Quách Thị Lan. Ngay từ lượt chạy đầu tiên, hai đội tuyển rất mạnh ở nội dung tiếp sức là Ấn Độ và Sri Lanka đã nhanh chóng bứt phá, tách tốp. Xuân Quang và Tuyết Mai chỉ có thể bám đuổi đội dẫn thứ ba là Kazakhstan. Bước ngoặt đến từ lượt chạy thứ ba khi Lê Ngọc Phúc có cú nước rút tốt để vượt qua đội Kazakhstan, tạo tiền đề cho đàn chị Quách Thị Lan duy trì khoảng cách cho đến vạch đích. Chung cuộc, tổ tiếp sức 4x400m hỗn hợp nam nữ điền kinh Việt Nam về thứ ba, giành huy chương đồng với thành tích 3 phút 18,45 giây. Thông số này cũng giúp các vận động viên phá kỷ lục quốc gia cũ là 3 phút 19,5 giây được lập tại Philippines vào năm 2019. Đội tuyển Ấn Độ giành huy chương vàng với thành tích 3 phút 14,12 giây. Về nhì là Sri Lanka với thành tích 3 phút 17,0 giây. Vào ngày mai 21-5, Giải điền kinh tiếp sức châu Á 2024 tiếp tục diễn ra phần thi chung kết các nội dung tiếp sức 4x100m nữ lúc 18h15, tiếp sức 4x400m nữ lúc 19h15 và tiếp sức 4x400m nam lúc 19h55. Đáng chú ý nhất là nội dung tiếp sức 4x400m nữ, đội nữ Việt Nam với những chân chạy Quách Thị Lan, Nguyễn Thị Hằng, Nguyễn Thị Ngọc, Hoàng Thị Minh Hạnh, Lê Thị Tuyết Mai đang được hy vọng có cơ hội giành vé chính thức đến Olympic Paris 2024 từ giải đấu này.",20/05/2024 19:40 GMT+7,https://tuoitre.vn/dien-kinh-viet-nam-gianh-huy-chuong-dong-pha-ky-luc-quoc-gia-tai-giai-chau-a-20240520192229929.htm,"Tối 20-5, tổ tiếp sức 4x400m hỗn hợp nam nữ điền kinh Việt Nam đã thi đấu xuất sắc để giành huy chương đồng, phá kỷ lục quốc gia tại Giải điền kinh tiếp sức châu Á 2024."
Huỳnh Như hết hợp đồng với Lank nhưng ở lại đá thêm giúp đội trụ hạng,"Huỳnh Như đã góp công lớn giúp CLB Lank thoát cảnh rớt hạng trực tiếp trong trận chung kết ngược hôm 12-5. Lank đã hạ Atletico Ouriense 2-0 ở vòng cuối Giải vô địch bóng đá nữ Bồ Đào Nha (Liga BPI) 2023-2024. Với chiến thắng ngoạn mục đó, Lank đẩy Ouriense xuống hạng trực tiếp. Lank kết thúc mùa giải với vị trí thứ 11 và cùng đội hạng 10 là Familicao thi đấu 2 trận play-off trụ hạng gặp 2 đội ở hạng dưới. Đối thủ của Lank được xác định là Amora. Hai đội sẽ thi đấu 2 lượt đi và về. Lank sẽ đá trận lượt đi vào lúc 18h ngày 26-5, trận lượt về diễn ra trên sân của Amora vào lúc 15h ngày 9-6. Huỳnh Như sẽ ở lại Bồ Đào Nha để thi đấu nốt 2 trận then chốt giúp Lank trụ hạng. Nữ tiền đạo gạo cội của tuyển nữ Việt Nam là thành viên có đóng góp quan trọng trong hành trình trụ hạng của Lank. Như vậy, thay vì mùa giải kết thúc vào ngày 12-5 và trở về nước sau khi kết thúc hợp đồng với Lank, cô gái quê Trà Vinh phải ở lại gần một tháng nữa mới xong nhiệm vụ. Mùa giải 2023-2024 cũng là mùa giải cuối cùng của nữ tiền đạo sinh năm 1991 thi đấu cho Lank. Cô đã chơi 23 trận, 1.929 phút với trung bình 83,87 phút/trận. Huỳnh Như ghi 3 bàn và 1 kiến tạo. Trong mùa giải vừa qua, đội bóng của cô gặp nhiều khó khăn do không được đầu tư. Trở về Việt Nam, Huỳnh Như cân nhắc một số lời đề nghị và có thể quay lại khoác áo CLB nữ TP.HCM.",20/05/2024 17:25 GMT+7,https://tuoitre.vn/huynh-nhu-het-hop-dong-voi-lank-nhung-o-lai-da-them-giup-doi-tru-hang-20240520170838302.htm,"Tiền đạo Huỳnh Như còn 2 trận đấu play-off trụ hạng cùng CLB Lank ở Bồ Đào Nha đến ngày 9-6, rồi mới có thể trở về Việt Nam."
