Title,Content,Date,Url,Summary
Giá vàng miếng SJC bốc hơi nửa triệu đồng/lượng,"Chiều nay, Ngân hàng Nhà nước đã công bố kết quả phiên đấu thầu vàng diễn ra sáng nay. Theo đó có 9 thành viên đã trúng thầu 79 lô, tương đương 7.900 lượng vàng miếng SJC. Giá trúng thầu là 89,42 triệu đồng/lượng. Theo nguồn tin của Tuổi Trẻ Online, có 9 đơn vị tham gia đấu thầu vàng hôm nay gồm: Công ty SJC, DOJI, PNJ, Phú Quý, Ngân hàng ACB, TPBank, HDBank, Sacombank và Eximbank. Cả 9 công ty vàng và ngân hàng đều đặt thầu và trúng thầu đúng bằng mức giá sàn mà Ngân hàng Nhà nước đưa ra. Theo ghi nhận, phiên đấu thầu vàng hôm nay diễn ra trong bối cảnh giá vàng thế giới lao dốc mạnh. Từ sát mức 2.450 USD/ounce chiều hôm qua, giá vàng thế giới đã bốc hơi khoảng 32 USD/ounce, tương đương 982.000 đồng/lượng, về mức 2.416 USD/ounce vào chiều nay. Quy đổi theo tỉ giá niêm yết tại ngân hàng, giá vàng thế giới tương đương 74,17 triệu đồng/lượng. Giá vàng miếng SJC sáng nay cũng bốc hơi nửa triệu đồng/lượng, còn 90,5 triệu đồng/lượng, giá mua vào ở mức 88,5 triệu đồng/lượng. Trong khi đó các ngân hàng cũng niêm yết giá bán vàng miếng SJC quanh mức 90,2 - 90,4 triệu đồng/lượng. Tại tiệm vàng Mi Hồng, giá bán vàng miếng SJC cũng giảm 200.000 đồng/lượng, còn 90,4 triệu đồng/lượng, mua vào 89,4 triệu đồng/lượng. Công ty Bảo Tín Minh Châu niêm yết giá bán vàng miếng SJC ở mức 90,3 triệu đồng/lượng, mua vào 88,7 triệu đồng/lượng, giảm 300.000 đồng/lượng ở chiều bán và 200.000 đồng/lượng ở chiều mua vào. Tại Công ty DOJI, giá bán vàng miếng SJC ở mức 90,3 triệu đồng/lượng, giữ nguyên so với hôm qua nhưng giá mua vào giảm 300.000 đồng/lượng, còn 88,5 triệu đồng/lượng. Trong khi đó giá vàng nhẫn 9999 bán ra hôm nay giảm 200.000 đồng/lượng, còn 77,25 triệu đồng/lượng, giá mua vào cũng giảm tương ứng, còn 75,55 triệu đồng/lượng. Công ty DOJI niêm yết giá bán vàng nhẫn ở mức 77,55 triệu đồng/lượng, mua vào 76,05 triệu đồng/lượng, giảm 250.000 đồng/lượng so với hôm qua. So với giá vàng thế giới quy đổi, giá vàng miếng SJC đang cao hơn 16,33 triệu đồng/lượng, giá vàng nhẫn cao hơn 3,08 triệu đồng/lượng.",21/05/2024 15:24 GMT+7,https://tuoitre.vn/gia-vang-mieng-sjc-boc-hoi-nua-trieu-dong-luong-20240521145834968.htm,"Hôm nay, 21-5, giá vàng miếng SJC bốc hơi còn 90,5 triệu đồng/lượng. Trong khi đó doanh nghiệp trúng thầu vàng miếng SJC với giá 89,42 triệu đồng/lượng."
"Lưu trữ điện sạch, đắt xắt ra miếng","Do đó theo các chuyên gia, cần sớm có cơ chế khuyến khích người dân và doanh nghiệp đầu tư hệ thống lưu trữ điện tái tạo. Hệ thống lưu trữ sẽ giúp giải quyết được bài toán bất ổn định của năng lượng tái tạo, nhất là điện mặt trời (ĐMT) mái nhà, và được lắp rộng rãi trên thế giới nhưng ở Việt Nam vẫn còn mới mẻ, thậm chí chưa có quy định để lắp đặt mà chỉ mới dừng ở khuyến khích. Đã đến lúc cần hành lang pháp lý để tính đường dài, giúp lưu trữ phát triển, đảm bảo an toàn hệ thống điện. Chi phí lưu trữ điện giảm mạnh nhưng vẫn cao Những năm qua, các chủ đầu tư các trang trại ĐMT đã tính toán đến phương án lắp đặt hệ thống lưu trữ điện (BESS) để lưu trữ nguồn điện giờ thấp điểm (ban ngày) và bán lại nguồn điện này lên lưới điện quốc gia vào giờ cao điểm (ban đêm). Tuy nhiên, đến nay vẫn chưa có cơ chế giá mua điện từ hệ thống lưu trữ điện trong khi giá lắp đặt hệ thống này quá cao, hiệu suất kém và khả năng thu hồi vốn thấp. Với các gia đình, các doanh nghiệp chào giá các hệ thống lưu trữ vài kW cũng lên đến hàng trăm triệu đồng nên rất ít người dân lắp đặt hệ thống này. Tuy nhiên, khảo sát của Tuổi Trẻ cho thấy giá hệ thống lưu trữ đã giảm mạnh thời gian qua và số lượng người dân lắp đặt cũng đã tăng cao. Nhiều nhà cung cấp đang lắp ĐMT, bao gồm cả hệ thống lưu trữ với mức giá dao động từ 14 - 30 triệu đồng cho 1 kW tùy thuộc vào tiêu chuẩn chất lượng sản phẩm, nguồn gốc thương hiệu... Với một hệ thống ĐMT 10kWp, có đơn vị chào giá 145 triệu đồng tại miền Bắc và 180 triệu đồng tại miền Nam, bao gồm các hệ thống lưu trữ. Theo doanh nghiệp này, chi phí bình quân đầu tư cho pin lưu trữ là 4 triệu đồng/kW với hệ số lưu trữ là 50%. Tuổi thọ trung bình của các loại pin lưu trữ này chỉ được từ 3-5 năm, loại có tuổi thọ nhiều hơn là 5-15 năm nhưng chi phí sẽ lớn hơn. Trao đổi với Tuổi Trẻ, ông Lưu Minh Đức - giám đốc Công ty TNHH Solar Miền Bắc - cho biết sau đợt thiếu điện năm ngoái, nhiều người dân đã chủ động lắp đặt hệ thống lưu trữ điện với chi phí khoảng 14-16 triệu đồng/kW cho cả hệ thống ĐMT, phổ biến nhất là người dân đầu tư hệ 6-10kW. Với hệ thống lưu trữ, theo ông Đức, mức giá sẽ rơi vào 80-100 triệu đồng cho hệ thống lưu trữ khoảng 6-7kW. Trong trường hợp cúp điện, pin lưu trữ vẫn đảm bảo cho các thiết bị điện cơ bản và điều hòa hoạt động trọn một đêm. Ngoài ra, nhiều doanh nghiệp có kho lạnh cũng đã lắp đặt hệ thống lưu trữ, với công suất khoảng 100kW, do chưa có cơ chế trong khi chi phí bỏ ra đầu tư khá lớn. Cần cơ chế mua bán từ điện lưu trữ Chính sách khuyến khích phát triển ĐMT mái nhà đang được Bộ Công Thương xây dựng với hai mô hình có nối lưới và không nối lưới với hệ thống điện quốc gia. Tuy nhiên, theo một đại diện của Cục Điện lực và Năng lượng tái tạo (Bộ Công Thương), việc lắp đặt hệ thống pin lưu trữ cho hệ thống ĐMT áp mái chỉ mang tính khuyến khích, không có quy định cụ thể trong dự thảo. Tuy nhiên, tại tờ trình gửi Chính phủ, Bộ Công Thương đã xin ý kiến Chính phủ về việc khuyến khích các tổ chức, cá nhân kết hợp ĐMT mái nhà với đầu tư, lắp đặt, vận hành hệ thống lưu trữ điện để chủ động trong hoạt động sản xuất, kinh doanh, đảm bảo ổn định hệ thống. Cũng bởi Luật Điện lực, các văn bản pháp luật của Chính phủ chưa có quy định về việc khuyến khích phát triển ĐMT mái nhà kết hợp hệ thống lưu trữ điện. Vì vậy, Bộ Công Thương đã kiến nghị Chính phủ xem xét, quyết định theo thẩm quyền. Một đại diện của EVN cũng cho hay việc mua điện từ các hệ thống ĐMT áp mái theo quyết định 11 và quyết định 13 trước đây sẽ không yêu cầu phải lắp đặt hệ thống pin lưu trữ. Việc lắp đặt hệ thống này tùy thuộc nhu cầu của từng đơn vị tổ chức, cá nhân, nhưng do chi phí lắp đặt hệ thống này ở mức cao, thông thường sẽ ""không ai đầu tư"" do lượng điện dư thừa đã được bán lên lưới. Tuy nhiên, kể từ khi các chính sách này không còn hiệu lực, nhiều tổ chức và cá nhân có nhu cầu vẫn lắp đặt ĐMT mái nhà đã đầu tư thêm hệ thống pin lưu trữ. Cũng theo vị này, về mặt kỹ thuật, hệ thống ĐMT áp mái vẫn phải bám lưới hoặc có pin lưu trữ để đáp ứng nhu cầu sử dụng. Bởi chỉ cần một đám mây và khi mặt trời tắt nắng, nguồn điện này sẽ không thể đáp ứng, nên lưới điện sẽ đóng vai trò là nguồn chạy nền để khi cần sẽ bù vào để vận hành các thiết bị. Vì vậy, đối với loại hình ĐMT mái nhà tự sản tự tiêu không nối lưới, nghị định vẫn cần phải cho phép các tổ chức và cá nhân được bám lưới, nhưng phải lắp đặt hệ thống chống phát ngược lên lưới để đảm bảo vận hành hệ thống. Tuy nhiên, cần phải có tiêu chuẩn kỹ thuật chung cho thiết bị này, cũng như có cơ chế khuyến khích các đơn vị muốn tận dụng năng lượng dư thừa lắp đặt hệ thống lưu trữ để phục vụ việc tự sử dụng.",21/05/2024 10:46 GMT+7,https://tuoitre.vn/luu-tru-dien-sach-dat-xat-ra-mieng-2024052108475259.htm,"Chi phí đầu tư hệ thống lưu trữ điện với năng lượng tái tạo đã giảm đến hơn 90% trong 10 năm qua, riêng từ năm ngoái đến nay đã giảm đến 50% nhưng vẫn còn khá cao."
"Mận hậu VietGap Sơn La ""giá bình ổn"" lên kệ siêu thị","Ba chiếc xe trong lễ xuất hành chở hàng chục tấn mận hậu Sơn La đã xuất phát từ thị trấn Mộc Châu (Sơn La) đi các trung tâm phân phối hàng hóa tại ba miền Bắc - Trung - Nam để đưa mận đến siêu thị. Ông Võ Trần Ngọc - giám đốc kinh doanh của Saigon Co.op - cho biết với hơn 800 điểm bán, phủ kín tất cả các phân khúc thị trường sẽ là lợi thế để sản phẩm mận hậu Sơn La đến tay người tiêu dùng trên cả nước với chất lượng tươi ngon và giá ""bình ổn nhất"". Sẵn sàng đưa đặc sản lên kệ Chia sẻ với Tuổi Trẻ, ông Ngọc cho hay chương trình này không chỉ đơn thuần là hoạt động kinh doanh mà còn có ý nghĩa thiết thực, gắn kết to lớn giữa TP.HCM và tỉnh Sơn La để sẻ chia lâu dài với bà con nông dân ""chịu thương chịu khó"" của tỉnh. ""Từ hai tháng trước, Saigon Co.op đã phối hợp với Trung tâm Xúc tiến thương mại tỉnh Sơn La cùng các vùng trồng mận nổi tiếng tại Mộc Châu và huyện Yên Châu để chuẩn bị sản phẩm.  Theo đó, các bên đã ký cam kết tiêu thụ nhằm đảm bảo sản lượng được cung ứng ổn định và có giá tốt nhất cho người tiêu dùng.  Đến nay, mọi công tác chuẩn bị đã hoàn thiện, từ phương tiện vận chuyển, kho bãi, logistics đến việc phân phối hàng hóa đã sẵn sàng, chờ đón những chuyến mận đầu tiên đưa lên quầy kệ"" - ông Ngọc cho biết. Là sản phẩm nông sản nên công tác bảo quản rất được chú trọng. Theo đó, quả mận sau khi được nhà vườn thu hái sẽ phân loại, đóng hộp, bảo quản và đưa vào các xe bảo ôn hoặc xe chuyên dụng.  Việc này nhằm đảm bảo cho sản phẩm từ khi thu hoạch đến các trung tâm phân phối, đưa lên quầy kệ và đến tay người tiêu dùng luôn ở nhiệt độ phù hợp để giữ được độ tươi, ngon nhất. Ông Nguyễn Thành Công - phó chủ tịch Ủy ban nhân dân tỉnh Sơn La - chia sẻ nếu như trước đây người nông dân sản xuất manh mún, thu hái bao nhiêu là bán ra thị trường bấy nhiêu thì hiện nay, việc thay đổi tư duy sản xuất gắn với xây dựng thương hiệu đã tạo sự thay đổi lớn giá trị của quả mận. ""Chúng tôi chưa bao giờ nghĩ đến việc tạo ra thương hiệu cho sản phẩm, chưa bao giờ nghĩ quả mận hậu lại có thể bán được với giá 150.000 đồng/kg"" - ông Công bày tỏ. Theo ông, mận hậu Sơn La được trồng từ nhiều năm, đặc trưng là vùng Mộc Châu và Yên Châu với diện tích 12.400ha, sản lượng bình quân 75.000 - 78.000 tấn, có năm nổi trội 100.000 tấn.  Với công cuộc ""hạ cành tạo tán"" đã tạo ra những quả mận ngon nhất, được trồng với quy trình sản xuất sạch, hữu cơ VietGap, GlobalGap. Bày tỏ niềm tự hào về quả mận Sơn La có ""vị"" khác hẳn, ông Công mong muốn đưa trái mận Sơn La ra cả nước với giá trị cao hơn thông qua việc đẩy mạnh các hoạt động xúc tiến thương mại, bắt tay hợp tác với các nhà phân phối, hệ thống siêu thị trên cả nước.  Nhờ sản phẩm có chất lượng vượt trội, giá bán tại vườn thời điểm đầu mùa lên tới 130.000 đồng/kg, còn hiện nay khoảng 80.000 - 100.000 đồng/kg (loại 20 quả/kg). Liên kết giữa nông dân và nhà phân phối Ông Công cho biết dù là tỉnh còn nhiều khó khăn, nhưng Sơn La vẫn sẵn sàng dành nguồn lực để triển khai các hoạt động xúc tiến tiêu thụ sản phẩm, xây dựng thương hiệu nông sản cả trong và ngoài nước.  Sản phẩm mận hậu và nhiều nông sản Sơn La đã được giới thiệu khắp các hội chợ nông sản tại Milan (Ý), hội chợ tại Nam Ninh (Trung Quốc).  Việc quảng bá giới thiệu nông sản đã giúp kích cầu tiêu thụ sản phẩm, đánh giá thương hiệu, truy xuất nguồn gốc và tổ chức sản xuất tốt hơn, hình thành chuỗi sản xuất từ nông dân, doanh nghiệp và hợp tác xã. Trên thực tế, sự hợp tác giữa hệ thống phân phối với chính quyền địa phương để cùng hỗ trợ người nông dân nâng cao giá trị sản phẩm, xây dựng thương hiệu nông sản đã mang lại ý nghĩa hết sức to lớn. Ông Trần Xuân Văn - giám đốc Hợp tác xã nông sản sạch Mộc Châu (Sơn La) - chia sẻ năm nay chúng tôi bán vào các hệ thống phân phối hiện đại, cửa hàng thực phẩm sạch có tính ổn định về đầu ra.  Mức giá mà người nông dân bán ra cũng tốt hơn nhiều so với kênh hàng chợ khoảng 30%, ổn định hơn và không bị ép giá như bán cho các kênh thương lái. ""Đặc biệt, chúng tôi nhận được sự hỗ trợ lớn từ chính quyền địa phương và nhà phân phối trong việc áp dụng quy trình sản xuất sạch, gửi mẫu cho bên thu mua để kiểm tra sản phẩm và thử nghiệm, thu hái phân loại theo tiêu chuẩn.  Điều này khác với trước đây khi thu hái đơn giản thì giờ phải phân loại sản phẩm nhưng giá trị thu về cao hơn, không chờ thu mua của thương lái mà đã có đơn đều"" - ông Văn nói. Ông Võ Trần Ngọc cũng cho hay sau sự kiện này, Saigon Co.op đã có kế hoạch làm việc với chính quyền địa phương tỉnh và các sở ngành để khảo sát và lựa chọn một số hợp tác xã nhằm ký kết bao tiêu vùng trồng, gắn với hỗ trợ vốn cho người nông dân.  Việc này vừa nhằm đảm bảo các sản phẩm được sản xuất theo tiêu chuẩn, vừa đảm bảo cung ứng giá tốt nhất cho người tiêu dùng. Đồng tình, Phó chủ tịch tỉnh Sơn La Nguyễn Thành Công cũng khẳng định sẽ chủ động hỗ trợ, kết nối giữa nhà sản xuất và phân phối để có được những hợp đồng với giá trị lớn hơn.  Từ đó tạo dựng thương hiệu nông sản Sơn La luôn sẵn sàng đáp ứng các tiêu chuẩn trong sản xuất, thương mại hàng hóa quy mô lớn, gắn sản xuất với chế biến sâu nhằm hướng tới phát triển kinh tế xanh, nhanh và bền vững, nâng cao thu nhập cho nông dân. ",21/05/2024 07:53 GMT+7,https://tuoitre.vn/man-hau-vietgap-son-la-gia-binh-on-len-ke-sieu-thi-20240521074127516.htm,"Đưa quả mận hậu Sơn La vào hệ thống phân phối của Saigon Co.op trên toàn quốc chính là sự hợp tác chặt chẽ giữa nhà phân phối, nhà sản xuất và chính quyền địa phương để đưa nông sản Việt lên kệ siêu thị."
"Quốc Cường Gia Lai muốn bán 2 nhà máy thủy điện, thu về hơn 600 tỉ đồng","Ngày 20-5, hội đồng quản trị Công ty cổ phần Quốc Cường Gia Lai (QCG) đã ban hành nghị quyết thông qua việc chuyển nhượng dự án nhà máy thủy điện Ia Grai 2 và nhà máy thủy điện Ayun Trung nhằm tái cơ cấu đầu tư. Hai nhà máy nêu trên đều do Công ty cổ phần Đầu tư xây dựng thủy điện Quốc Cường - một công ty con của Quốc Cường Gia Lai, làm chủ đầu tư. Trong đó, nhà máy thủy điện Ia Grai 2 nằm tại xã la Tô, la Krái, la Grăng, la Khai, huyện la Grai, tỉnh Gia Lai với công suất lắp máy 7,5MW (2 tổ máy công suất 3,75MW/tổ máy). Giá trị chuyển nhượng khoảng 235 tỉ đồng. Điều kiện đi kèm là bên nhận chuyển nhượng có trách nhiệm sử dụng nguyên trạng lực lượng lao động của nhà máy tại thời điểm chuyển nhượng và đảm bảo quy định quyền lợi của người lao động. Dự án thứ hai QCG muốn chuyển nhượng là nhà máy thủy điện Ayun Trung nằm tại xã Kon Thụp, huyện Mang Yang và xã Trang, huyện Đăk Đoa, tỉnh Gia Lai. Dự án có công suất lắp máy đạt 13MW. Giá trị chuyển nhượng dự kiến 380 tỉ đồng. Việc chuyển nhượng cả hai dự án đều sẽ diễn ra trong quý 2 và quý 3-2024. Ngoài bất động sản, Quốc Cường Gia Lai còn đầu tư vào lĩnh vực thủy điện.  Năm 2012, công ty này đã khai thác 3 tổ máy của dự án thủy điện Ia Grai 1 với công suất 10,8MW. Sau đó QCG tiếp tục đầu tư vào dự án thủy điện Ia Grai 2, Pleikeo và Ayun Trung.",21/05/2024 07:26 GMT+7,https://tuoitre.vn/quoc-cuong-gia-lai-muon-ban-2-nha-may-thuy-dien-thu-ve-hon-600-ti-dong-2024052022331659.htm,Công ty cổ phần Quốc Cường Gia Lai vừa thông qua nghị quyết chuyển nhượng 2 nhà máy thủy điện. Việc bán cả hai dự án sẽ diễn ra trong quý 2 và quý 3-2024.
"Đề nghị miễn, giảm phí, tặng quà cho khách nhân Ngày không tiền mặt 2024","Ngân hàng Nhà nước vừa có công văn đề nghị các tổ chức tín dụng, chi nhánh ngân hàng nước ngoài và tổ chức cung ứng dịch vụ thanh toán có những hoạt động nhằm thúc đẩy thanh toán không dùng tiền mặt nhân Ngày không tiền mặt 2024. Miễn, giảm phí dịch vụ khi thanh toán không dùng tiền mặt Ngân hàng Nhà nước cho biết thực hiện chủ trương của Chính phủ về việc tiếp tục thúc đẩy thanh toán không dùng tiền mặt (TTKDTM), tạo thuận lợi và khuyến khích người dân, doanh nghiệp sử dụng các dịch vụ thanh toán điện tử, hướng tới xã hội không tiền mặt; tiếp nối những thành công đã đạt được qua 5 năm tổ chức chuỗi sự kiện Ngày không tiền mặt 16-6, đề nghị các tổ chức tín dụng, chi nhánh ngân hàng nước ngoài, tổ chức cung ứng dịch vụ trung gian thanh toán có nhiều hoạt động thiết thực hưởng ứng. Theo đó, các đơn vị tích cực tiếp tục nghiên cứu, áp dụng chính sách ưu đãi, miễn, giảm phí dịch vụ thanh toán, phí dịch vụ trung gian thanh toán hợp lý để thúc đẩy TTKDTM. Trong đó, chính sách ưu đãi ưu tiên áp dụng đối với các giao dịch thanh toán trực tuyến dịch vụ công và khách hàng thuộc nhóm đối tượng hưởng chính sách an sinh xã hội khi mở, sử dụng tài khoản ngân hàng, ví điện tử để nhận trợ cấp an sinh xã hội. Bên cạnh đó, căn cứ nhu cầu, điều kiện hoạt động kinh doanh của mình, từng đơn vị xem xét, hưởng ứng, ủng hộ chủ trương nêu trên thông qua các chương trình ưu đãi, chính sách khuyến mại phù hợp trong thời gian diễn ra sự kiện (trong tháng 6 và đỉnh điểm vào Ngày không tiền mặt 16-6). Cụ thể, đối với tổ chức tín dụng, chi nhánh ngân hàng nước ngoài, Ngân hàng Nhà nước đề nghị nghiên cứu, áp dụng chính sách ưu đãi hợp lý. Phối hợp với các đơn vị chấp nhận thanh toán (đơn vị cung ứng điện, nước, dịch vụ viễn thông, trang thương mại điện tử, siêu thị, nhà hàng, trung tâm mua sắm…) thực hiện các chương trình khuyến mại, quảng bá dịch vụ, tri ân khách hàng nhằm khuyến mãi khách hàng sử dụng TTKDTM như miễn, giảm phí dịch vụ thanh toán; quà tặng, hoàn tiền, giảm giá hàng hóa dịch vụ, tặng điểm thưởng… cho khách hàng khi mở tài khoản thanh toán, thẻ ngân hàng…  Hoặc thanh toán hóa đơn, chi trả tiền mua hàng hóa, dịch vụ bằng các phương thức TTKDTM (thanh toán thẻ, thanh toán qua ứng dụng trên điện thoại di động, thanh toán qua mã QR…). Cùng với đó, các tổ chức tín dụng, chi nhánh ngân hàng nước ngoài xem xét ưu đãi phí chiết khấu cho các đơn vị chấp nhận thanh toán tham gia, đồng hành trong các chương trình khuyến mãi, quảng bá dịch vụ, tri ân khách hàng trong thời gian diễn ra sự kiện. Hoàn tiền, tặng điểm… khi liên kết ví với thẻ, tài khoản ngân hàng Đối với tổ chức cung ứng dịch vụ trung gian thanh toán, Ngân hàng Nhà nước cũng đề nghị phối hợp với tổ chức tín dụng, chi nhánh ngân hàng nước ngoài, tổ chức cung ứng hàng hóa, dịch vụ… nghiên cứu, áp dụng chính sách ưu đãi, khuyến mại hợp lý (giảm giá, chiết khấu, hoàn tiền, tặng/tích điểm thưởng, tặng quà…) cho khách hàng sử dụng dịch vụ trung gian thanh toán. Các tổ chức cung ứng dịch vụ ví điện tử có chính sách ưu đãi hợp lý như miễn, giảm phí, phiếu quà tặng… cho khách hàng đăng ký, mở, liên kết thành công ví điện tử với thẻ ghi nợ nội địa, tài khoản thanh toán của khách hàng mở tại ngân hàng. Tổ chức tín dụng, chi nhánh ngân hàng nước ngoài và tổ chức cung ứng dịch vụ trung gian thanh toán chủ động xây dựng các chương trình, chính sách ưu đãi của đơn vị mình, quảng bá tới khách hàng và phối hợp với các tổ chức, đơn vị liên quan để triển khai thực hiện. Về kết quả hoạt động thanh toán không tiền mặt, Ngân hàng Nhà nước cho biết đến nay hơn 87% người trưởng thành đã có tài khoản thanh toán tại ngân hàng. Xu hướng dịch chuyển từ thanh toán bằng tiền mặt sang thanh toán không dùng tiền mặt đang ngày càng phổ biến hơn. Trong 2 tháng đầu năm nay so với cùng kỳ năm ngoái, giao dịch TTKDTM tăng gần 60% về số lượng và hơn 32% về giá trị; qua kênh Internet tăng tương ứng 51% và 23%; qua kênh điện thoại di động tăng 63% và 33,4%.  Đặc biệt thanh toán qua phương thức QR code tăng mạnh mẽ nhất với 846% về số lượng và 1.100% về giá trị. Hạ tầng công nghệ ngân hàng thường xuyên được đầu tư nâng cấp, phát triển, đảm bảo hoạt động liên tục, thông suốt, an toàn. Hệ thống thanh toán điện tử liên ngân hàng xử lý bình quân 830 nghìn tỉ đồng/ngày, tương đương 40 tỉ USD. ",20/05/2024 20:39 GMT+7,https://tuoitre.vn/de-nghi-mien-giam-phi-tang-qua-cho-khach-nhan-ngay-khong-tien-mat-2024-20240520194217762.htm,"Nhằm thúc đẩy hoạt động thanh toán không dùng tiền mặt, dịp Ngày không tiền mặt 2024, Ngân hàng Nhà nước đề nghị miễn, giảm phí dịch vụ, tặng quà, hoàn tiền… cho khách hàng khi mở thẻ, tài khoản thanh toán."
