Title,Content,Date,Url,Summary
"Chuyên gia: Tuyển Việt Nam vào 'bảng tử thần', thách thức cho HLV Kim Sang Sik","Chiều 21-5, lễ bốc thăm chia bảng ASEAN Cup 2024 (tiền thân là AFF Cup) đã diễn ra tại Hà Nội. Kết quả, đội tuyển Việt Nam nằm ở ""bảng tử thần"" cùng Indonesia, Philippines, Myanmar và Lào. Bảng đấu ""nặng"" với HLV Kim Sang Sik Chuyên gia Phan Anh Tú cho rằng đội tuyển Việt Nam rơi vào bảng đấu nặng, nếu không muốn nói bảng B Asean Cup 2024 là ""bảng tử thần"", các đối thủ không dễ chơi, không phải muốn thắng là thắng. ""Đội tuyển Indonesia nổi lên như một thế lực mới, Philipines là một ẩn số, còn tuyển Myanmar không phải là đối thủ nhẹ mà chúng ta muốn thắng là thắng. Myanmar có tính chiến đấu cao. Đây là bảng đấu nặng cho tuyển Việt Nam"", ông Phan Anh Tú nhận định. Ở góc độ ngược lại, cựu quan chức Liên đoàn Bóng đá Hà Nội cho rằng: ""Kinh nghiệm của tôi cho thấy nếu đội bóng nào vượt qua các bảng đấu tử thần thì sẽ hoàn thiện được nhiều yếu tố, trong đó có bản lĩnh và lối chơi. Qua được vòng bảng, tuyển Việt Nam lại nhẹ gánh"". Ông Phan Anh Tú cho rằng thử thách với HLV Kim Sang Sik là tài nghệ cầm quân và con mắt nhìn người. Nhà cầm quân người Hàn Quốc đi tuyển quân ở khắp các sân cỏ V-League và có khoảng 6 tháng rèn dũa, hoàn thiện lối chơi trước khi ASEAN Cup 2024 diễn ra vào tháng 11. ""Khi Indonesia đang hoàn thiện, loay hoay định hướng phát triển dưới thời ông Shin Tae Yong thì HLV Park Hang Seo đã có trong tay đội hình thiện chiến. Còn bây giờ, chúng ta đang trông chờ và khả năng cầm quân của ông Kim Sang Sik thì Indonesia đã có lứa cầu thủ vào độ chín"", ông Tú đánh giá. Ông Phan Anh Tú đặt nhiều kỳ vọng vào khả năng kết hợp cầu thủ của tân HLV trưởng tuyển Việt Nam. ""Nếu thầy hay thì bóng đá Việt Nam qua giai đoạn này sẽ có một thế hệ mới"", ông nhấn mạnh. Đối thủ nào cũng khó với Việt Nam Trong khi đó, cựu tuyển thủ quốc gia Nguyễn Minh Phương cũng có cùng suy nghĩ khi đội tuyển Việt Nam rơi vào nhánh đấu khó, gặp lại Indonesia của HLV Shin Tae Yong. ""Tình hình hiện tại thì gặp đối thủ nào với chúng ta cũng đều khó. Hơn nữa, lứa cầu thủ của Việt Nam đang chững lại. Sự xuất hiện của HLV Kim Sang Sik là làn gió mới. Tôi hy vọng ông ấy sẽ tìm ra những con người mới, động lực mới cho bóng đá Việt Nam"", Minh Phương nhắn nhủ. Cựu đội trưởng tuyển Việt Nam ở AFF Cup 2008 đánh giá Indonesia là đối thủ khó chịu nhất bảng B. Ngay cả thời HLV Henrique Calisto, Minh Phương và đồng đội đã gặp không ít khó khăn. Giờ đây, bóng đá xứ vạn đảo phát triển theo xu hướng nhập tịch các cấu thủ có gốc gác quê nhà. Do đó, vấn đề càng khó. Minh Phương cho rằng: ""Bóng đá Indonesia giờ mạnh hơn nhiều ngày xưa. Họ đang nhập tịch nhiều cầu thủ từ châu Âu về để làm đối trọng với Việt Nam và Thái Lan trong khu vực. Động lực của họ, khát vọng chiến thắng của họ cao hơn nhiều"". Bóng đá Việt Nam đã thất bại ở 2 kỳ AFF Cup 2020 và AFF Cup 2022 dưới thời HLV Park Hang Seo. Trong khi HLV Troussier chưa có dịp thử lửa ở đấu trường này thì đã bị sa thải. HLV Kim Sang Sik đang đứng trước kỳ vọng và thách thức lớn ở giải đấu chính thức đầu tiên từ khi nhậm chức. Mục tiêu mà VFF đặt ra với ông Kim Sang Sik là phải đưa đội tuyển Việt Nam vào chung kết ASEAN Cup 2024.",21/05/2024 16:50 GMT+7,https://tuoitre.vn/chuyen-gia-tuyen-viet-nam-vao-bang-tu-than-thach-thuc-cho-hlv-kim-sang-sik-20240521155636926.htm,"Chuyên gia bóng đá Phan Anh Tú, cựu tuyển thủ Nguyễn Minh Phương đều cho rằng đội tuyển Việt Nam của HLV Kim Sang Sik sẽ gặp nhiều thách thức khi rơi vào ""bảng tử thần"" tại ASEAN Cup 2024."
HLV Kim Sang Sik: Sẽ cố gắng hết sức để thắng Indonesia,"Chiều 21-5, lễ bốc thăm ASEAN Cup 2024 đã diễn ra tại Hà Nội. Lá thăm may rủi đưa đội tuyển Việt Nam vào bảng B cùng Indonesia, Philippines, Myanmar và Lào. Ở bảng A, Thái Lan có phần dễ thở hơn khi đối thủ của họ chỉ là Malaysia, Singapore, Campuchia và Timor Leste/Brunei. Đội tuyển Việt Nam hướng tới ngôi vô địch Trong các đối thủ của đội tuyển Việt Nam tại bảng B, Indonesia được đánh giá khó nhằn nhất. Trong 3 trận gần nhất gặp Indonesia (2 trận ở vòng loại thứ 2 World Cup 2026 và 1 trận tại Asian Cup), tuyển Việt Nam đều nhận thất bại. Phát biểu với truyền thông ngay sau lễ bốc thăm, HLV Kim Sang Sik cho biết: ""Gần đây thành tích đối đầu của đội tuyển Việt Nam với Indonesia không được tốt. Nhưng nếu chúng ta chuẩn bị tốt ngay từ bây giờ, tôi nghĩ hoàn toàn có thể bù đắp lại những gì đã xảy ra. Chúng tôi sẽ cố gắng hết sức để giành chiến thắng"". Nói thêm về các đối thủ còn lại, vị HLV người Hàn Quốc đánh giá cao đội tuyển Philippines khi đã có sự bổ sung nhân tố mới. Ban huấn luyện đội tuyển Việt Nam sẽ nghiên cứu để có cách đối phó. Khi được hỏi về mục tiêu của đội tuyển Việt Nam tại ASEAN Cup 2024, ông Kim Sang Sik nêu quan điểm:  ""Mục tiêu ở mọi giải đấu của tôi luôn là chiến thắng và hướng tới chức vô địch. Dù các đối thủ không dễ dàng gì, nhưng như tôi đã nói, nếu có sự chuẩn bị tốt, chúng ta hoàn toàn có cơ hội chiến thắng trước mọi đối thủ. Chúng tôi sẽ chuẩn bị tốt để có thể hướng tới mục tiêu vô địch"". HLV Kim Sang Sik tham vấn từ ông Park Hang Seo Ông Kim cũng chia sẻ thêm về những kế hoạch cho đội tuyển Việt Nam khi tập trung vào đầu tháng 6 tới chuẩn bị cho vòng loại thứ 2 World Cup 2026. Ông nói: ""Tôi có đôi chút hồi hộp vì sự kỳ vọng của người hâm mộ. Tôi sẽ phải nghiên cứu, tìm ra phương án huấn luyện các cầu thủ hoàn thành mục tiêu. Tôi sẽ cố gắng giúp các cầu thủ thi đấu như một tập thể thống nhất, đem đến cho người hâm mộ Việt Nam những màn trình diễn đẹp mắt, xứng đáng được nhận sự tán dương"". Khi được hỏi về người tiền nhiệm HLV Park Hang Seo từng có rất nhiều thành công với bóng đá Việt Nam, ông Kim cho hay: ""Ông ấy là người hùng bóng đá của Việt Nam. Tôi rất tôn trọng và kính nể ông Park. Vì nền bóng đá Việt Nam và vì các cổ động viên Việt Nam, tôi sẽ cố gắng hết sức và cũng sẽ xin những lời khuyên từ HLV Park khi cần để tạo nên một đội tuyển tốt nhất có thể"".",21/05/2024 16:24 GMT+7,https://tuoitre.vn/hlv-kim-sang-sik-se-co-gang-het-suc-de-thang-indonesia-20240521160134933.htm,"HLV trưởng Kim Sang Sik tự tin nếu đội tuyển Việt Nam có sự chuẩn bị chu đáo ngay từ bây giờ, chúng ta sẽ có kết quả tốt trước Indonesia và đạt thành tích tại ASEAN Cup 2024."
Báo Indonesia gọi việc nằm cùng bảng với Việt Nam là 'bảng tử thần',"Chiều 21-5, lễ bốc thăm chia bảng ASEAN Cup 2024 đã diễn ra tại Hà Nội. Theo đó, bảng B có sự góp mặt của các đội Việt Nam, Indonesia, Philippines, Myanmar và Lào. Đáng nói, cả ba đội Việt Nam, Indonesia và Philippines vốn không xa lạ nhau. Hiện tại cả ba đang nằm chung bảng tại vòng loại 2 World Cup 2026 khu vực châu Á. Đánh giá về kết quả bốc thăm, tờ Okezone (Indonesia) gọi bảng B là ""bảng tử thần"" của ASEAN Cup 2024. Tờ này đánh giá Việt Nam, Philippines đều là những đối thủ khó chịu cho dù tuyển Indonesia đã có nhiều kết quả tích cực trước họ trong thời gian gần đây. ""Câu hỏi lúc này là liệu HLV Shin Tae Yong có thể đưa Indonesia lên ngôi vô địch ASEAN Cup (trước đây là AFF Cup) hay không? Từ năm 1996 đến nay, bóng đá của chúng ta chưa từng có được chiếc cúp danh giá nhưng đã có tới 6 lần về nhì"", Okezone đặt dấu hỏi trong bối cảnh rơi vào ""bảng tử thần"". Tờ Vivagoal thì cho rằng Indonesia sẽ không dễ dàng đánh bại tuyển Việt Nam giống như 3 lần đối đầu gần nhất trong năm 2024. Lý do là bởi ASEAN Cup không thuộc FIFA Days, vì vậy HLV Shin Tae Yong khó có thể triệu tập các cầu thủ đang thi đấu ở châu Âu. Báo Sindonews thì thận trọng nhận xét rằng Việt Nam là một trong những ứng viên vô địch cùng với Thái Lan. Tuy nhiên, cây viết Rachmansyah cũng cho rằng tuyển Indonesia đang có sự tự tin sau thành công gần đây. Về phía bảng A, đương kim vô địch Thái Lan nằm cùng bảng với Malaysia, Singapore, Campuchia và đội thắng tại vòng loại giữa Timor Leste/Brunei. Tờ Siamsport của Thái Lan nhận xét đây là bảng đấu nhẹ hơn khá nhiều so với bảng B.",21/05/2024 15:42 GMT+7,https://tuoitre.vn/bao-indonesia-goi-viec-nam-cung-bang-voi-viet-nam-la-bang-tu-than-20240521153424808.htm,Báo chí Indonesia đánh giá kết quả bốc thăm ASEAN Cup 2024 ngày 21-5 là khá nặng với đội tuyển nước này.
Premier League vẫn là giải đấu số 1,"Đầu mùa giải, Hãng thống kê Opta đưa ra dự đoán về bảng xếp hạng chung cuộc như sau: 1.Man City, 2.Arsenal, 3.Liverpool, 4.Man United, 5.Newcastle, 6.Chelsea, 7.Tottenham... Những kết quả không ngoài dự đoán Đó là một trong những dự đoán chuẩn xác nhất khi 3 vị trí đầu bảng hoàn toàn trùng khớp với đánh giá từ dữ liệu máy tính của Opta. Sự trỗi dậy của Aston Villa và màn sa sút của Man United là những biến số mà Opta không thể lường trước được. Ở phần còn lại, Opta nhìn chung đã đánh giá đúng thực lực của các đội bóng xếp sau. Newcastle, Chelsea, Tottenham có phong độ gần tương tự như nhận định. Còn nhóm các đội từ hạng 10 đến 16 gần như trùng khớp với dự đoán của Opta. Khác biệt đáng kể nhất có lẽ chỉ là việc Opta dự đoán Bournemouth rớt hạng thay vì Burnley. Thật ra, dữ liệu máy tính cũng đã nhìn nhận Man United sẽ sa sút ở mùa này, khi dự đoán họ rớt 1 bậc so với mùa trước (hạng 3). Vấn đề chỉ là ""quỷ đỏ""... quá tệ so với suy nghĩ của mọi người. Newcastle, Chelsea và Tottenham đều tràn trề hy vọng nằm trong top 4 khi mùa giải bắt đầu.  Nhưng nhìn chung, họ vẫn là những đội bóng còn yếu kém về nhiều mặt để được xem là ""đại gia"". Cụ thể, Tottenham thiếu lực lượng. Newcastle thiếu một HLV dày dạn kinh nghiệm. Chelsea thừa tài lực, truyền thống nhưng lại xây dựng một đội bóng quá nhiều cầu thủ trẻ và mắc nhiều sai lầm trong chuyển nhượng. Những nét lãng mạn Trong bối cảnh cả 4 đội bóng mạnh kể trên đều gặp khó khăn, Aston Villa đã vươn lên đúng thời điểm và tạo nên nét lãng mạn thú vị nhất. Đầu mùa, họ đón nhiều tin buồn khi nhiều trụ cột dính chấn thương dài hạn. Nhưng với mẫu HLV như Unai Emery, tình cảnh khó khăn càng giúp ông bộc lộ tài năng. Aston Villa bước vào top 4 từ vòng 13. Và họ thành công giữ vững vị trí của mình đến cuối mùa. Arsenal trở thành đối tượng bị châm chọc khi để Man City vượt mặt vào giai đoạn cuối mùa. Nhưng nhìn chung, ""pháo thủ"" vẫn đang duy trì đà tiến bộ. So với mùa trước, Arsenal giành nhiều hơn 5 điểm (89 so với 84), đã đua tranh với Man City đến phút cuối cùng đồng thời cũng có thành tích khá tốt ở đấu trường châu lục. Dù thất bại nhưng Arsenal lúc này vẫn tạo ra cảm giác rằng họ sẽ còn tiến bộ trong những năm tới. Và Man City không thể hùng mạnh mãi mãi. Tâm điểm của vòng đấu cuối Một khoảnh khắc đầy cảm xúc đã xuất hiện trong cuộc họp báo sau khi Man City vô địch. HLV Pep Guardiola khi được hỏi về người đồng nghiệp Jurgen Klopp đã tỏ ra xúc động, đến mức gần như rơi nước mắt. ""Tôi sẽ rất nhớ ông ấy. Jurgen là một phần quan trọng trong cuộc đời tôi. Ông ấy đưa tôi đến một đẳng cấp khác"", Guardiola nói.  Trước đó một ngày, Klopp cũng chia sẻ rằng ông luôn tin Guardiola là ""HLV giỏi nhất"", và ""dù có đối mặt 115 cáo buộc đi nữa, ông ấy vẫn là người giỏi nhất. Hãy thử đặt ai khác vào vị trí của ông ấy, sẽ không có kỳ tích vô địch 4 lần liên tiếp"".  Trong sự xúc động, Guardiola đã thừa nhận rằng mình may mắn hơn đồng nghiệp. ""Cá nhân Jurgen Klopp cũng hiểu rằng một mình tôi không thể tạo nên thành tích này. Đội bóng này đã mang đến cho tôi rất nhiều lợi thế"", Pep nói.  Và đây có lẽ là lần duy nhất trong sự nghiệp, HLV Guardiola thừa nhận (một cách ẩn ý) rằng ông may mắn khi dẫn dắt một đội bóng giàu có, sở hữu nhiều lợi thế. Jurgen Klopp là người duy nhất có thể chia sẻ sự chú ý của người hâm mô toàn cầu trong buổi tối 19-5. Buổi lễ tri ân ông kéo dài 1 giờ với rất nhiều khoảnh khắc xúc động. Nhưng khoảnh khắc thú vị nhất có lẽ là khi Klopp bước lên sân khấu và bắt nhịp câu hát cổ vũ: ""Arne Slot, Arne Slot, lalala""... Arne Slot sẽ là tân HLV trưởng mùa tới của Liverpool. Trong giây phút cuối cùng đứng giữa Anfield, ông Klopp vẫn không thôi nghĩ về tương lai của Liverpool!",21/05/2024 12:47 GMT+7,https://tuoitre.vn/premier-league-van-la-giai-dau-so-1-20240521091413918.htm,"Man City lại vô địch, Arsenal lại về nhì, M.U trở lại chu kỳ bết bát. Và những đội bóng vừa thăng hạng lập tức xuống hạng. Premier League mùa giải 2023-2024 không có nhiều bất ngờ, nhưng vẫn là giải đấu cuốn hút..."
Xem trực tiếp điền kinh Việt Nam tranh vé dự Olympic Paris 2024,"Giải điền kinh tiếp sức châu Á 2024 diễn ra trong hai ngày 20 và 21-5 tại Bangkok (Thái Lan) và được tính như vòng loại Olympic Paris 2024. Ở ngày thi đấu đầu tiên, tổ tiếp sức 4x400m hỗn hợp nam nữ điền kinh Việt Nam đã thi đấu xuất sắc để giành huy chương đồng, phá kỷ lục quốc gia tại Giải điền kinh tiếp sức châu Á 2024. Các vận động viên Nguyễn Xuân Quang, Lê Thị Tuyết Mai, Lê Ngọc Phúc, Quách Thị Lan về thứ ba chung cuộc với thành tích 3 phút 18,45 giây. Thông số này cũng phá kỷ lục quốc gia cũ là 3 phút 19,5 giây được lập tại Philippines vào năm 2019. Bước sang ngày thi đấu thứ 2 hôm nay 21-5, sự chú ý tập trung vào tổ tiếp sức 4x400m nữ. Đây là nội dung duy nhất của điền kinh Việt Nam được hy vọng có cơ hội giành vé chính thức đến Olympic Paris 2024. Tổ đấu có 4 chân chạy chính: Quách Thị Lan, Nguyễn Thị Hằng, Nguyễn Thị Ngọc, Hoàng Thị Minh Hạnh và Lê Thị Tuyết Mai ở vai trò dự bị. Để thực hiện mục tiêu giành suất trực tiếp đến Thế vận hội mùa hè 2024, các cô gái Việt Nam phải lọt vào top 16 đội tuyển hàng đầu thế giới. Theo bảng thống kê thành tích tính suất dự Olympic 2024 của Liên đoàn Điền kinh thế giới (IAAF), tính đến ngày 20-5, tổ tiếp sức 4x400m nữ Việt Nam đang xếp hạng 29 với thông số 3 phút 31,61 giây - đạt được tại Asiad 19. Các cô gái Việt Nam cần rút ngắn thông số ít nhất 4 giây để cạnh tranh với đội đang xếp thứ 16 thế giới là Nigeria (thành tích 3 phút 27,29 giây) và đội xếp thứ 15 là Cuba (thành tích 3 phút 26,08 giây). Ở các nội dung khác, điền kinh Việt Nam sẽ tham dự hai nội dung tiếp sức 4x100m nữ và tiếp sức 4x400m nam. Tổ tiếp sức 4x100m nữ gồm các vận động viên: Hà Thị Thu, Lê Thị Cẩm Tú, Kha Thanh Trúc, Phùng Thị Huệ. Trong khi tổ tiếp sức 4x400m nam có: Trần Đình Sơn, Trần Nhật Hoàng, Lê Ngọc Phúc, Nguyễn Xuân Quang, Nguyễn Tùng Lâm. Ngoại trừ Hà Thị Thu, Trần Nhật Hoàng và Nguyễn Tùng Lâm đã có kinh nghiệm thi đấu quốc tế trong màu áo đội tuyển điền kinh Việt Nam, những chân chạy còn lại đều là tài năng trẻ được kỳ vọng sẽ sớm bứt phá.",21/05/2024 11:20 GMT+7,https://tuoitre.vn/xem-truc-tiep-dien-kinh-viet-nam-tranh-ve-du-olympic-paris-2024-20240521110331405.htm,"Tối 21-5, tổ tiếp sức 4x400m nữ Việt Nam bước vào tranh tài tại Giải điền kinh tiếp sức châu Á 2024 với hy vọng giành được suất chính thức tham dự Olympic Paris 2024."
Người hùng World Cup bị Argentina loại khỏi danh sách dự Copa America 2024,"Không có gì ngạc nhiên khi Messi và Di Maria tiếp tục được chọn làm người mang băng đội trưởng, đội phó của đội tuyển Argentina. Nhưng đáng ngạc nhiên là Paulo Dybala lại vắng mặt dù anh không hề dính chấn thương. Hai năm trước, Dybala là 1 trong 5 người thực hiện thành công cú sút 11m trong loạt luân lưu thắng Pháp ở chung kết World Cup 2022. Dù không ra sân nhiều trên đất Qatar năm đó vì chấn thương, nhưng Dybala vẫn được ông Scaloni tin tưởng chọn đá luân lưu vào thời khắc quyết định. Ngôi sao 30 tuổi luôn bị chấn thương hành hạ. Từ sau World Cup 2022, anh dính tổng cộng 10 ca chấn thương khác nhau. Dù vậy, Dybala vẫn có màn trình diễn ấn tượng trong màu áo AS Roma. Mùa giải này, Dybala ghi 16 bàn, góp 10 kiến tạo trong 38 lần ra sân cho đội bóng nước Ý. Thời điểm hiện tại, anh đã hoàn toàn khỏe mạnh. Theo truyền thông Argentina, lý do ông Scaloni loại Dybala là về chuyên môn. Thêm vào đó, tuyển Argentina lúc này có rất nhiều tiền đạo trẻ giàu tiềm năng. Chiến lược gia 46 tuổi muốn trao thêm cơ hội cho các cầu thủ trẻ thay vì ""đóng khung"" những người hùng World Cup. Garnacho - người nổi tiếng là fan của Ronaldo cũng được điền tên vào danh sách. Anh cùng với tiền đạo cánh Carboni và hậu vệ cánh Barco là những cầu thủ U20 có hy vọng đến Copa America 2024. Trừ Dybala và một số cầu thủ dự bị khác, HLV Scaloni cơ bản giữ lại dàn sao từng giúp Argentina vô địch World Cup 2022. Nòng cốt của họ vẫn là thủ thành Martinez; các hậu vệ Otamendi, Romero, Acuna, Molina; các tiền vệ Mac Allister, Enzo Fernandez, De Paul; các tiền đạo Julian Alvarez, Lautaro Martinez... Chấn thương hiện là nỗi lo lớn của ông Scaloni. Cách đây 1 tuần Messi cũng dính chấn thương trong màu áo CLB Inter Miami, trong khi nhiều cầu thủ quan trọng như Enzo, Lisandro Martinez chưa bình phục hoàn toàn. Ông Scaloni sẽ loại bớt 3 cái tên để chốt danh sách tham dự Copa America gồm 26 cầu thủ sau loạt trận giao hữu đầu tháng 6, gặp Ecuador và Guatemala. Đội tuyển Argentina sẽ đá trận mở màn bảng A ở Copa America với Canada vào ngày 20-6. Tiếp đó là 2 trận gặp Chile và Peru.",21/05/2024 09:24 GMT+7,https://tuoitre.vn/nguoi-hung-world-cup-bi-argentina-loai-khoi-danh-sach-du-copa-america-2024-20240521090944349.htm,"Sáng 21-5 (giờ Việt Nam), HLV Lionel Scaloni đã công bố danh sách sơ bộ của tuyển Argentina nhằm chuẩn bị cho Copa America 2024, giải đấu sẽ diễn ra vào giữa tháng 6."
