Title,Content,Date,Url,Summary
ASEAN Cup 2024: Tuyển Việt Nam có thể lọt vào chung kết?,"14h ngày mai 21-5, lễ bốc thăm ASEAN Cup 2024 sẽ diễn ra tại Hà Nội, HLV trưởng đội tuyển Việt Nam Kim Sang Sik có mặt tham dự sự kiện. ASEAN Cup (tiền thân là AFF Cup) là giải đấu danh giá nhất của bóng đá Đông Nam Á. Đội tuyển Việt Nam chỉ mới 2 lần đăng quang ở AFF Cup 2008 và 2018, ít hơn Thái Lan (7 lần) và Singapore (4 lần). Dưới thời HLV Park Hang Seo, đội tuyển Việt Nam đăng quang ở AFF Cup 2018 sau khi đánh bại Malaysia chung cuộc 3-2 sau 2 lượt trận chung kết. Năm đó, Thái Lan bị Malaysia loại ở bán kết. Nhưng hai giải đấu sau đó, ông Park không thể nào đưa đội tuyển Việt Nam vượt qua người Thái. Đội tuyển Việt Nam thua Thái Lan chung cuộc 0-2 ở bán kết AFF Cup 2020 và thua Thái Lan chung cuộc 3-2 sau 2 lượt trận chung kết AFF Cup 2022. Khó khăn chờ đón HLV Kim Sang Sik Ngay cả khi có lực lượng tốt nhất và được dẫn dắt bởi HLV Park Hang Seo, bóng đá Việt Nam cũng không thể đánh bại Thái Lan ở cấp độ đội tuyển. Hai kỳ AFF Cup 2020 và 2022, đội tuyển Thái Lan đều đăng quang một cách thuyết phục cho dù năm nào cũng không có đủ lực lượng mạnh nhất, khi nhiều CLB không nhả quân do không phải dịp FIFA Days. Điều đó phần nào phản ánh đúng hiện trạng của bóng đá khu vực, khi Thái Lan là đội bóng số 1 Đông Nam Á. Nên ở ASEAN Cup 2024, ""bầy voi chiến"" vẫn là ứng viên sáng giá nhất cho chức vô địch. Nhưng không chỉ Thái Lan, Indonesia cũng đang vươn lên mạnh mẽ. Chính sách nhập tịch những cầu thủ đang thi đấu ở châu Âu có gốc gác Indonesia đã đưa đội tuyển nước này trở thành thế lực đáng gờm. Thất bại 3 lần liên tiếp của đội tuyển Việt Nam trước Indonesia ở Asian Cup 2023 và vòng loại thứ 2 World Cup 2026 vừa qua là một minh chứng rõ nét. Tiếp quản ghế HLV trưởng mà HLV Philippe Troussier để lại, HLV Kim Sang Sik có quá nhiều việc phải làm. Từ chuyện làm quen môi trường mới, tìm kiếm cầu thủ phù hợp với triết lý thi đấu mà mình xây dựng đến trải nghiệm thực tế. Hai trận cuối cùng ở vòng loại thứ 2 World Cup 2026 với Philippines và Iraq trong tháng 6 tới chính là thước đo công việc và những khó khăn mà HLV Kim Sang Sik sẽ đối mặt ở ASEAN Cup 2024 vào tháng 11. Chờ tài cầm quân của HLV Kim Sang Sik Thất bại của HLV Philippe Troussier cho thấy bóng đá Việt Nam không phù hợp với các nhà cầm quân châu Âu do khác biệt quá nhiều về văn hóa. Cuối cùng, đội tuyển Việt Nam quay trở về với HLV Hàn Quốc. Trên thực tế, bóng đá Việt Nam đã đạt nhiều thành công cùng HLV Park Hang Seo, nhưng không phải không có những vấn đề. Giai đoạn cuối dẫn dắt đội tuyển Việt Nam, ông Park liên tiếp thua Thái Lan tại AFF Cup như đã nói ở trên. Đội tuyển Việt Nam dưới thời ông Park ngày càng trở nên dễ đoán vì không có sự mới mẻ cả về lối chơi lẫn con người. Chiến thuật phòng ngự phản công không còn phát huy tối đa tác dụng, trong khi đội tuyển Việt Nam thiếu những phương án tấn công biến hóa để tiếp cận khung thành đối phương và giành chiến thắng. HLV Kim Sang Sik cũng xây dựng lối chơi dựa tương tự như ông Park. Nhưng chiến thuật của ông Kim tỏ ra mới mẻ hơn người đàn anh. Những HLV thế hệ cũ như ông Park chú trọng quản lý con người, nhồi thể lực và đề cao tính thực dụng trong lối chơi. Nhưng các HLV trẻ sau này như ông Kim có cách chơi khoa học và hiện đại. Sơ đồ chiến thuật cũng tỏ ra biến ảo hơn. Ngoài ra, nhà cầm quân 48 tuổi này cũng được đánh giá cao về khả năng xoay xở đội hình. Với bóng đá Việt Nam hiện tại, đó là điều rất cần. Bởi các cầu thủ thế hệ từng giành ngôi á quân Giải U23 châu Á 2018 đã sa sút nhiều, trong khi lứa cầu thủ mới không có những cái tên nổi bật. ASEAN Cup 2024 sẽ khởi tranh vào tháng 11. Gần 7 tháng tìm hiểu bóng đá Việt Nam và lựa chọn nhân sự là quãng thời gian đủ dài để HLV Kim Sang Sik chuẩn bị lực lượng từ đây đến khi đó. Còn quá sớm để nói HLV Kim Sang Sik sẽ thực hiệc được mục tiêu mà VFF đề ra khi còn chưa có trận ra mắt nào với đội tuyển Việt Nam để nhìn cách chơi và thẩm định. Nhưng rõ ràng, đội tuyển Việt Nam dưới thời HLV Kim Sang Sik đáng chờ đợi.",20/05/2024 15:38 GMT+7,https://tuoitre.vn/asean-cup-2024-tuyen-viet-nam-co-the-lot-vao-chung-ket-20240519094731367.htm,Chỉ tiêu Liên đoàn Bóng đá Việt Nam giao cho HLV Kim Sang Sik là đưa đội tuyển Việt Nam vào trận chung kết ASEAN Cup 2024. Điều đó liệu có quá sức với ông Kim?
"Jurgen Klopp rời Liverpool, lời từ biệt của một huyền thoại","Liverpool đã đánh bại Wolves 2-0 tại Anfield ở vòng đấu cuối cùng của Premier League đêm 19-5. Đó cũng là trận đấu kết thúc triều đại 9 năm trị vì của nhà cầm quân 56 tuổi Jurgen Klopp.  Chia tay một huyền thoại Trong 9 năm, Jurgen Klopp đã dẫn dắt Liverpool 491 trận, giành tổng cộng 7 danh hiệu, trong đó nổi bật là chức vô địch Premier League đầu tiên sau 30 năm. Bên cạnh đó là chức vô địch UEFA Champions League đầu tiên sau 14 năm, cúp FA đầu tiên sau 16 năm, vô địch World Cup các CLB đầu tiên trong lịch sử.  Tất cả những chiến tích đó đều là những ""kỳ công"", nhưng nó chưa đủ để nói lên tầm ảnh hưởng mà Jurgen Klopp mang đến cho Liverpool. Vì thành công trong bóng đá không phải lúc nào cũng được đo bằng những chiếc cúp bạc.  Cái quan trọng nhất, Jurgen Klopp đã vực dậy Liverpool. Ông đã đưa đội bóng này trở lại thời huy hoàng với thứ bóng đá ""gegenpress"" (phản công) năng lượng cao. Giờ đây người hâm mộ thành phố cảng không cần phải nhớ lại thời của Bill Shankly hay Bob Paisley ở thập niên 1960 hay 1970 để cảm thấy tự hào. Họ đã có được trọn vẹn sự vinh quang, kiêu ngạo dười thời của Jurgen Klopp. Với những cống hiến đó, Jurgen Klopp xứng đáng được tôn vinh. Người hâm mộ Liverpool đã dành cho ông buổi chia tay thật đặc biệt, xúc động. Trước trận đấu, đám đông người hâm mộ Liverpool xếp hàng dài trên đường để chào đón xe buýt của HLV Klopp và Liverpool đi qua. Bài hát truyền thống ""You'll Never Walk Alone"" liên tục vang lên, trong những ánh mắt tha thiết và nghẹn ngào của mọi người. Khi đó Klopp đã nhẹ nhàng đặt tay lên trước ngực, tim ông đang dâng trào những cảm xúc mãnh liệt. Đội trưởng Van Dijk khóc khi chia tay HLV Jurgen Klopp  Sau khi trận đấu kết thúc, trung vệ đội trưởng Van Dijk đã bật khóc và ôm chặt HLV Jurgen Klopp. Van Dijk nói: ""Tôi không biết nói gì, đây là một ngày rất xúc động. Bạn không thể chuẩn bị cho những khoảnh khắc như thế này. Ông ấy xứng đáng nhận được tình yêu của mọi người"".  Rất nhiều người hâm mộ Liverpool tại Anfield cũng bật khóc để tiễn ông thầy người Đức. Bất cứ ai khi tiếp nhận chiếc ghế nóng ở Anfield sau này đều sẽ phải đương đầu với áp lực rất lớn từ những di sản mà Jurgen Klopp để lại.  Phát biểu trước đám đông trong ngày chia tay, Jurgen Klopp nghẹn ngào rơi lệ: ""Tôi hoàn toàn bất ngờ, hạnh phúc và không thể tin được. Tôi rất vui vì tất cả các bạn, về bầu không khí, về trận đấu, về việc trở thành một phần của gia đình này. Thật không thể tin được. Cảm ơn các bạn rất nhiều"".  Ông nói tiếp: ""Nó không giống như sự kết thúc, nó chỉ giống như sự khởi đầu bởi vì tôi thấy hôm nay một đội bóng với đầy tài năng, sức trẻ, sáng tạo, khát khao, tham vọng... Đó là tất cả những gì mà chúng ta cần ở một đội bóng"".  Lời cuối cùng mà Jurgen Klopp muốn gửi đến Liverpool là: ""Tôi yêu các bạn. Trên áo khoác của tôi có dòng chữ ""Tôi yêu Liverpool"". Tôi sẽ không bao giờ bước đi một mình nữa. Cảm ơn vì điều đó"".",20/05/2024 13:37 GMT+7,https://tuoitre.vn/jurgen-klopp-roi-liverpool-loi-tu-biet-cua-mot-huyen-thoai-20240520041311891.htm,"Cuối cùng ngày đó cũng đến, HLV Jurgen Klopp đã chính thức chia tay người hâm mộ Liverpool sau 9 năm gắn bó."
Euro của những lão tướng,"Việc UEFA cho phép các đội bóng tăng danh sách cầu thủ dự giải lên con số 26 (so với 23 như thông lệ) đã tạo điều kiện để nhiều cầu thủ lớn tuổi tham dự thêm một kỳ Euro cuối cùng trong sự nghiệp. Hồi sinh sự nghiệp tại Saudi Arabia Ở Euro 2020 (diễn ra vào năm 2021), các đội bóng cũng được gọi 26 cầu thủ. Nhưng đó được xem là ngoại lệ đặc biệt vì đại dịch COVID-19. Sau 3 năm, UEFA quyết định giữ nguyên thể lệ thi đấu mới, khi vấn nạn chấn thương hiện tại còn đe dọa các đội bóng hơn dịch COVID-19. Các đội bóng được phép gọi 26 cầu thủ dự giải, nhưng trong riêng từng trận đấu, họ chỉ có thể đăng ký tối đa 23 người. Tức sẽ luôn có 3 cầu thủ phải ngồi trên khán đài xem đội nhà thi đấu. Không phải tất cả các đội bóng đều mặn mà với việc gọi đủ 26 cầu thủ. Tại Euro 2024, HLV Luis Enrique (Tây Ban Nha) cho biết ông không muốn để nhiều học trò của mình phải ngồi trên khán đài nên chỉ gọi 24 người. Đến Euro 2026, HLV Didier Deschamps của tuyển Pháp chỉ gọi 25 người. Dù vậy, 2 suất bổ sung này đã cho phép chiến lược gia 55 tuổi thoải mái gọi lên tuyển một số cựu binh, đáng chú ý nhất là tiền vệ N'Golo Kante. Trong năm cuối cùng chơi ở Chelsea, Kante chỉ ra sân vỏn vẹn 9 lần vì bị chấn thương hành hạ. Đến mùa hè 2023, anh tham gia làn sóng cầu thủ sang Saudi Arabia ""dưỡng già"". Nhưng rồi ở Trung Đông, sự nghiệp của Kante được hồi sinh. Mùa giải này anh đã chơi 41 trận cho Al-Ittihad, thậm chí ghi đến 4 bàn - con số đáng kể với một tiền vệ phòng ngự.  Có thể hiểu vì sao HLV Deschamps lại quyết định mạo hiểm với Kante. Tuyển Pháp đã trẻ hóa đáng kể trong những năm qua. Hướng đến mùa hè trên đất Đức năm nay, ông Deschamps đã gọi đến 3 tiền vệ U22 là Camavinga, Zaire-Emery và Barcola. Zaire-Emery thậm chí còn đang đi học. Pháp vẫn đang là nền bóng đá thực lực dồi dào hàng đầu thế giới hiện tại. Nếu ưu tiên phong độ, HLV Deschamps có thể phải gọi thêm Olise, Mateta, Moussa Diaby hay Malo Gusto - những ngôi sao đang tỏa sáng ở Premier League. Nhưng ông đã bỏ qua họ để chọn các cựu binh dày dạn kinh nghiệm như Kante, Giroud, Coman. Riêng Coman còn đang trong quá trình hồi phục chấn thương. Một ngôi sao cũng được gọi dự Euro 2024 dù đã sang Saudi Arabia ""dưỡng già"" là Georginio Wijnaldum (tuyển Hà Lan). Cựu tiền vệ Liverpool dính một chấn thương nặng vào năm 2022, khiến anh mất đến 6 tháng để hồi phục và đánh mất phong độ từ đó. Wijnaldum phải rời AS Roma để sang Al-Ettifaq cứu vãn sự nghiệp.  Trên đất Saudi Arabia, tiền vệ người Hà Lan không chơi quá nổi bật. Nhưng danh sách 26 cầu thủ đã tạo cơ hội cho Wijnaldum. HLV Koeman hiện chỉ mới công bố danh sách sơ bộ gồm 30 người, ít nhất 4 người sẽ bị loại, và Wijnaldum cần cho thấy lợi thế kinh nghiệm của anh trước những đàn em còn non nớt như Veerman, Timber, Gravenberch. Cựu binh hơn tuổi HLV Đức là đội bóng tích cực làm mới lực lượng nhất ở Euro năm nay khi HLV Nagelsmann gạt bỏ hàng loạt ngôi sao như Goretzka, Hummels, Gnabry... để gọi lên tuyển một dàn tân binh đông đảo. Trong danh sách sơ bộ 27 cầu thủ của Đức, có đến 9 cầu thủ khoác áo tuyển quốc gia ít hơn 5 lần. Nhưng mặt khác, tuyển Đức vẫn đón chào sự trở lại của Thomas Muller và Toni Kroos. Năm 2019, cựu HLV trưởng Joachim Low từng công khai gạt bỏ Muller khỏi đội tuyển, khiến ngôi sao của Bayern Munich tức giận và tính đến chuyện giã từ màu áo quốc gia.  Nhưng sau đó anh đã sớm quay trở lại, và bất chấp phong độ kém cỏi, vẫn giữ được một chân trong đội tuyển nhờ vị thế của mình. Kroos thậm chí đã giã từ tuyển Đức sau Euro 2020, nhưng dưới sự thuyết phục của ông Nagelsmann, anh quyết định trở lại vào đầu năm nay. Tương tự Muller, Gundogan năm nay đã 33 tuổi và có phong độ khá tệ mùa giải này nhưng vẫn được triệu tập dự Euro 2024, thậm chí là mang băng đội trưởng. Anh cùng với Neuer, Muller, Kroos là nhóm lão tướng đã có hơn 1 thập niên cống hiến cho tuyển quốc gia, thậm chí là trạc tuổi... HLV trưởng.  Ông Nagelsmann năm nay mới 36 tuổi, kém Neuer 2 tuổi, có thể sẽ là chiến lược gia trẻ tuổi nhất tại Euro 2024. Để điều phối một đội bóng có hậu trường phức tạp như Đức, Nagelsmann cần đến những lão tướng dày dạn kinh nghiệm giúp sức. Khi 24 đội bóng công bố đầy đủ danh sách dự Euro vào những ngày tới, người hâm mộ có thể sẽ thêm phần ngạc nhiên khi nhìn thấy những cái tên mà họ tưởng đã hết thời bấy lâu nay.",20/05/2024 12:55 GMT+7,https://tuoitre.vn/euro-cua-nhung-lao-tuong-20240520090216719.htm,"Bên cạnh những ""chú nhóc tuổi teen"", các đội bóng lớn tham dự Euro 2024 còn mở lại cánh cửa dành cho các cầu thủ lão tướng."
Những điều thú vị nhất của Premier League 2023-2024,"Man City - đội bóng nhiều điểm nhất (91): Kết thúc Premier League 2023-2024, Man City lên ngôi vô địch với 91 điểm (28 chiến thắng, 7 hòa và 3 thua). Man City cũng là đội có chuỗi trận thắng dài nhất (9 trận) và chuỗi trận bất bại dài nhất (23).   Arsenal và Man City thắng nhiều nhất (28 trận): Cả 2 cùng có 28 trận thắng, nhiều nhất Premier League. Tuy nhiên, Man City lại thua ít hơn Arsenal 2 trận, và đó cũng là lý do giúp họ đăng quang chức vô địch. Arsenal thủng lưới ít nhất (29 bàn): Arsenal là đội bóng chơi phòng ngự hiệu quả nhất Premier League. Đây là sự cải thiện rất đáng kể của Arsenal, bởi mùa trước họ để thủng lưới đến 43 bàn. Arsenal có số trận sạch lưới nhiều nhất (18): Cả mùa giải, Arsenal có 18 trận trắng lưới, trong đó thủ môn David Raya bắt chính 16 trận. Nhờ vậy, anh đoạt danh hiệu Găng tay vàng của Premier League. Man City ghi bàn nhiều nhất (96 bàn): Đội vô địch Man City thể hiện phong độ ấn tượng khi ghi đến 96 bàn thắng. Mùa trước Man City vô địch mà chỉ ghi có 94 bàn thắng. Erling Haaland đoạt danh hiệu Vua phá lưới (27 bàn): Đây là lần thứ 2 liên tiếp Erling Haaland đoạt danh hiệu Vua phá lưới Premier League. So với mùa trước, số bàn thắng của Haaland đã giảm xuống (27 so với 36). Tuy nhiên, thành tích của Haaland vẫn bỏ xa các đối thủ xếp sau như Cole Palmer (Chelsea) 5 bàn, Alexander Isak (Newcastle) 6 bàn, Phil Foden (Man City) 8 bàn. Trong số 27 bàn thắng của Haaland, có 20 bàn được ghi bằng chân trái, 4 bàn đánh đầu và 3 bàn bằng chân phải (chân không thuận). Ollie Watkin (Aston Villa) là Vua kiến tạo ở Premier League (13 lần kiến tạo thành bàn): Không phải là những tiền vệ hàng đầu Premier League, vua kiến tạo Premier League mùa này là Ollie Watkin (Aston Villa) khi anh có 13 lần dọn cỗ cho các đồng đội lập công.  Rodri là vua chuyền bóng ở Premier League: Cả mùa giải, Rodri cho thấy vai trò cực kỳ quan trọng cho Man City khi tung ra đến 3.632 đường chuyền, bỏ xa người xếp thứ 2 là Lewis Dunk (Brighton) 3.212 đường chuyền. Tổng số bàn thắng của Premier League mùa này là 1.246, trung bình 3,28 bàn/trận. Con số này vượt xa mùa bóng trước là 1.084 bàn (trung bình 2,85 bàn/trận). Tổng cộng đã có 14.249.531 khán giả đến sân theo dõi các trận đấu, trung bình 38.617 khán giả/trận. Trận đấu có số lượng khán giả đông nhất là trận Man United thắng 3-0 West Ham vào ngày 4-2-2024, khi sân Old Trafford đón 73.612 CĐV. Trận thắng trên sân nhà đậm nhất là chiến thắng 6-0 của Chelsea trước Everton. Sheffield là đội chủ nhà thua đậm nhất, khi để Newcastle nã vào lưới 8 bàn không gỡ.",20/05/2024 11:54 GMT+7,https://tuoitre.vn/nhung-dieu-thu-vi-nhat-cua-premier-league-2023-2024-20240520110803217.htm,Giải ngoại hạng Anh (Premier League) 2023-2024 khép lại với chức vô địch thuộc về Man City. Bên cạnh đó là những thống kê đáng chú ý.
Zverev vô địch Rome Masters 2024,"Chiến thắng này mang lại cho Zverev danh hiệu ATP Masters 1000 thứ 6. Đây là minh chứng cho sự trở lại mạnh mẽ của tay vợt người Đức sau chấn thương nghiêm trọng tại bán kết Pháp mở rộng 2022. Trận chung kết diễn ra với kịch bản hấp dẫn, Zverev thể hiện sự áp đảo ngay từ những bàn đấu đầu tiên. Anh dễ dàng giành chiến thắng với tỉ số 6-4 nhờ sự vượt trội về kỹ thuật và thể lực. Tuy nhiên, Nicolas Jarry cũng chứng tỏ sự lì lợm. Bước vào set thứ hai, Jarry đã thi đấu vô cùng quyết tâm, thậm chí còn có cơ hội giành chiến thắng khi dẫn trước 5-4 và có hai cơ hội để kết thúc ván 2. Thế nhưng, Zverev cho thấy bản lĩnh của một nhà vô địch khi bình tĩnh xoay chuyển tình thế. Anh giành lại hai điểm giao bóng, đưa trận đấu vào loạt tie-break và cuối cùng giành chiến thắng thuyết phục với tỉ số 7-5. Chiến thắng này đánh dấu sự trở lại đầy ấn tượng của Zverev trên đấu trường quần vợt thế giới. Đây đã là danh hiệu thứ 2 của Alexander Zverev tại Rome sau chức vô địch lần đầu năm 2017 với chiến thắng trước Novak Djokovic. Chiến thắng ở Rome giúp tay vợt người Đức vươn lên đứng thứ 4 trên bảng xếp hạng ATP thế giới. ""Tôi đã giành danh hiệu Masters 1000 đầu tiên trong sự nghiệp tại Rome, vì vậy Rome là một nơi rất đặc biệt đối với tôi"", Alexander Zverev nói sau khi đăng quang. Sau khi giành chức vô địch, Zverev đã dành tặng chiến thắng cho toàn bộ đội ngũ của mình, anh nói: ""Tôi muốn cảm ơn tất cả mọi người hiện đang ngồi trong khu vực của tôi ngày hôm nay và những ai phía sau hậu trường, chiếc cúp này dành cho tất cả mọi người"". Zverev cũng không quên dành lời khen ngợi cho đối thủ của mình: ""Tôi muốn chúc mừng Nicolas. Những đối thủ anh ấy đã đánh bại thực sự đáng kinh ngạc. Nicolas là một tay vợt xuất sắc và luôn tiến bộ mỗi mùa giải"". Chiến thắng tại Rome Masters là động lực to lớn cho Zverev trước thềm Roland Garros (Pháp mở rộng). Với phong độ hiện tại, anh hoàn toàn có thể đặt mục tiêu giành chức vô địch tại giải đấu này.",20/05/2024 10:15 GMT+7,https://tuoitre.vn/zverev-vo-dich-rome-masters-2024-20240520093521355.htm,"Alexander Zverev vô địch Rome Masters 2024 sau khi đánh bại Nicolas Jarry với tỉ số 6-4, 7-5 trong trận chung kết diễn ra đêm 19-5 (giờ Việt Nam)."
Điền kinh Việt Nam hướng tới tấm vé duy nhất đến Olympic Paris 2024,"Giải điền kinh tiếp sức châu Á 2024 diễn ra trong hai ngày 20 và 21-5 tại Bangkok (Thái Lan) và được tính như vòng loại Olympic Paris 2024. Đội tuyển điền kinh Việt Nam tham dự giải đấu được dẫn dắt bởi trưởng đoàn Nguyễn Mạnh Hùng (tổng thư ký Liên đoàn Điền kinh Việt Nam) cùng ba HLV Nguyễn Thị Bắc, Vũ Ngọc Lợi và Đặng Văn Thành. Thành phần VĐV tham gia tranh tài gồm: Hà Thị Thu, Lê Thị Cẩm Tú, Kha Thanh Trúc, Phùng Thị Huệ (tiếp sức 4x100m nữ); Trần Đình Sơn, Trần Nhật Hoàng, Lê Ngọc Phúc, Nguyễn Xuân Quang, Nguyễn Tùng Lâm (tiếp sức 4x400m nam); Quách Thị Lan, Nguyễn Thị Hằng, Nguyễn Thị Ngọc, Hoàng Thị Minh Hạnh, Lê Thị Tuyết Mai (tiếp sức 4x400m). Trong số các nội dung kể trên, nội dung được quan tâm nhất là nhóm các cô gái tiếp sức 4x400m. Các VĐV này đã sớm có mặt tại Thái Lan từ cuối tháng 4 trong đợt tập huấn làm quen điều kiện thời tiết và đường chạy. Tổ tiếp sức 4x400m nữ là nội dung duy nhất của điền kinh Việt Nam được hy vọng có cơ hội giành vé chính thức đến Olympic Paris.  Để thực hiện mục tiêu này, các cô gái Việt Nam phải lọt vào tốp 16 đội tuyển hàng đầu thế giới. Có như vậy, điền kinh Việt Nam mới có thể giành suất trực tiếp đến Thế vận hội mùa hè 2024.  Theo bảng thống kê thành tích tính suất dự Olympic 2024 của Liên đoàn Điền kinh thế giới (IAAF), tính đến ngày 20-5, tổ tiếp sức 4x400m nữ Việt Nam đang xếp hạng 29 với thông số 3 phút 31,61 giây - đạt được tại Asiad 19. Sau Giải điền kinh tiếp sức thế giới 2024 diễn ra tại Bahamas hồi đầu tháng 5, IAAF đã công bố 14 đội tiếp sức 4x400m nữ chắc suất dự Olympic 2024. Chính vì vậy, nếu muốn giành suất trực tiếp dự Olympic, các cô gái điền kinh Việt Nam cần rút ngắn thông số ít nhất 4 giây để cạnh tranh với đội đang xếp thứ 16 thế giới là Nigeria (thành tích 3 phút 27,29 giây) và đội xếp thứ 15 là Cuba (thành tích 3 phút 26,08 giây). Theo chia sẻ từ trưởng đoàn Nguyễn Mạnh Hùng, sau Giải tiếp sức châu Á 2024, tổ tiếp sức 4x400m nữ còn tham dự thêm hai giải đấu được tính là vòng loại Olympic để hướng tới mục tiêu giành suất trực tiếp tham dự Thế vận hội mùa hè. Lịch thi đấu của đội tuyển Việt Nam cụ thể: ngày 20-5 sẽ diễn ra chung kết nội dung tiếp sức 4x400 hỗn hợp nam nữ lúc 18h35; ngày 21-5 lần lượt có phần thi chung kết các nội dung tiếp sức 4x100m nữ lúc 18h15, tiếp sức 4x400m nữ lúc 19h15 và tiếp sức 4x400m nam lúc 19h55.",20/05/2024 09:36 GMT+7,https://tuoitre.vn/dien-kinh-viet-nam-huong-toi-tam-ve-duy-nhat-den-olympic-paris-2024-2024051923380865.htm,Đội tuyển điền kinh tiếp sức 4x400m nữ Việt Nam chuẩn bị bước vào cuộc đấu quan trọng với hy vọng giành được tấm vé đến Olympic Paris tại Giải tiếp sức châu Á 2024.
