Title,Content,Date,Url,Summary
Cùng LPBank phủ xanh Việt Nam trong Ngày hội trồng cây năm 2024,"Kết nối nhiều hoạt động trồng cây Với thông điệp ""Vì một Việt Nam xanh"", Ngày hội trồng cây của LPBank nhằm hưởng ứng đề án ""Trồng 1 tỉ cây xanh giai đoạn 2021-2025"" của Chính phủ, hướng tới bảo vệ môi trường, giảm thiểu các tác động tiêu cực do biến đổi khí hậu, góp phần phát triển kinh tế - xã hội. Ngay khi phát động chương trình, LPBank đã tuyên truyền, kết nối nhiều hoạt động trồng cây tới cộng đồng, khách hàng, đối tác. LPBank phối hợp với các địa phương như Hà Nội, Hưng Yên, Thanh Hóa, Quảng Nam… để phủ xanh trong các khuôn viên lớn như trường học, công viên, vườn hoa, các khu công trình văn hóa, lịch sử. Toàn bộ kinh phí trồng cây được cán bộ, nhân viên LPBank đóng góp. Trong tháng 4 vừa qua, LPBank cũng thực hiện trồng 1.248 cây xanh tại Vườn quốc gia Xuân Sơn, tỉnh Phú Thọ. Số lượng cây được LPBank ủng hộ và quy đổi từ chương trình ""Triệu tài khoản - Một màu xanh"". Hoạt động nằm trong chiến dịch ""Gây quỹ trồng rừng năm 2024"" do Đoàn thanh niên Bộ Nông nghiệp và Phát triển nông thôn phát động, nhằm lan tỏa phong trào trồng cây xanh bảo vệ môi trường, ứng phó với biến đổi khí hậu trong tầng lớp thanh niên nói riêng và người dân trong cả nước nói chung. Vào ngày 19-5, hành trình trồng cây của LPBank tiếp tục được triển khai tại tỉnh Tuyên Quang. Tham gia hoạt động này, ban lãnh đạo LPBank đã trồng mới nhiều cây xanh trong khuôn viên Khu di tích lịch sử ngành ngân hàng Việt Nam. Đây là nơi Ngân hàng Quốc gia Việt Nam (nay là Ngân hàng Nhà nước Việt Nam) đặt trụ sở hoạt động từ khi thành lập cho đến khi chuyển về Hà Nội sau năm 1954. Tạo ảnh hưởng tích cực cho thế hệ tương lai Phát biểu tại sự kiện, ông Hoàng Văn Phúc - phó tổng giám đốc LPBank - cho biết phát huy tinh thần cả nước chung tay hưởng ứng đề án của Chính phủ trồng mới 1 tỉ cây xanh, LPBank cam kết đồng hành và phối hợp cùng các cơ quan, bộ ngành và địa phương tích cực thực hiện các chiến dịch trồng cây, phủ xanh Việt Nam. ""LPBank cũng đảm bảo việc chăm sóc và bảo vệ cây sau khi trồng, giúp cây sinh trưởng và phát triển tốt. Qua đó, đóng góp vào việc phục hồi hệ sinh thái, giảm biến đổi khí hậu, tạo ra những ảnh hưởng tích cực cho thế hệ tương lai"" - ông Hoàng Văn Phúc cho biết. Với mục tiêu phát triển kinh doanh bền vững, song song với bảo vệ môi trường, LPBank luôn bắt đầu từ những hành động thiết thực như tiết kiệm tài nguyên (điện, nước…), giảm rác thải, đồ dùng nhựa trong mọi hoạt động của ngân hàng, giảm giấy in… Đồng thời, ngân hàng này còn tổ chức nhiều hoạt động tuyên truyền và giáo dục về việc bảo vệ môi trường, phát động ngày hội trồng cây. LPBank cũng chú trọng đầu tư vào các dự án thân thiện môi trường, nghiên cứu các sáng kiến và sản phẩm xanh, chuyển đổi hoạt động vận hành nhằm tối ưu hóa tài nguyên sử dụng, giảm thiểu chất thải, khí thải ra môi trường. Trong năm 2024 và các năm tiếp theo, LPBank tích cực gắn trách nhiệm xã hội trong kinh doanh, quyết tâm và nỗ lực thực hiện những hành động xanh, góp phần làm thay đổi nhận thức, hành vi bảo vệ môi trường và lan tỏa các hoạt động này đến khách hàng, đối tác, cổ đông, cộng đồng...",20/05/2024 14:00 GMT+7,https://tuoitre.vn/cung-lpbank-phu-xanh-viet-nam-trong-ngay-hoi-trong-cay-nam-2024-20240520130231113.htm,"‘Ngày hội trồng cây - Vì một Việt Nam xanh’ là hoạt động cộng đồng ý nghĩa được LPBank phát động triển khai trong năm 2024. Số lượng cây xanh được trồng mới sẽ góp phần phục hồi hệ sinh thái, bảo vệ môi trường..."
Cảnh báo lừa đảo: Giả danh quản lý thị trường yêu cầu chuyển tiền,"Ngày 20-5, Cục Quản lý thị trường thành phố Cần Thơ cho biết đã có thông báo cảnh giác hành vi giả danh lực lượng quản lý thị trường để lừa đảo. Thời gian gần đây, Cục Quản lý thị trường thành phố Cần Thơ nhận được tin báo phản ánh của các cơ sở kinh doanh và người dân về việc có người giả danh lực lượng quản lý thị trường thành phố Cần Thơ để lừa đảo. Người giả danh quản lý thị trường gọi điện thoại cho cơ sở kinh doanh thông báo sẽ kết hợp với lực lượng chức năng kiểm tra tại cơ sở kinh doanh, đồng thời yêu cầu cơ sở kinh doanh chuyển một số tiền nếu không muốn bị kiểm tra xử lý vi phạm hành chính. Cục Quản lý thị trường thành phố Cần Thơ khẳng định đây là hành vi lừa đảo, giả danh lực lượng quản lý thị trường để trục lợi, vi phạm pháp luật, làm ảnh hưởng đến uy tín và hình ảnh của lực lượng quản lý thị trường, gây ảnh hưởng tiêu cực đến các cơ sở kinh doanh và người dân trên địa bàn thành phố. “Khi kiểm tra, kiểm soát thị trường, Cục Quản lý thị trường thành phố Cần Thơ thực hiện đúng quy định về nội dung, trình tự, thủ tục hoạt động kiểm tra, xử lý vi phạm hành chính. Không gọi điện thoại thông báo cho cơ sở kinh doanh được kiểm tra”, thông báo của Cục Quản lý thị trường thành phố Cần Thơ, nêu. Cục Quản lý thị trường thành phố Cần Thơ đề nghị khi phát hiện hành vi giả danh nên thông báo qua đường dây nóng cho lực lượng quản lý thị trường, hoặc công an gần nhất để kịp thời xử lý.",20/05/2024 12:30 GMT+7,https://tuoitre.vn/canh-bao-lua-dao-gia-danh-quan-ly-thi-truong-yeu-cau-chuyen-tien-20240520111231646.htm,"Người giả danh quản lý thị trường TP Cần Thơ gọi điện cho cơ sở kinh doanh yêu cầu chuyển tiền để khỏi bị kiểm tra, xử lý vi phạm."
Đề nghị Chính phủ làm rõ việc các ngân hàng lãi lớn trong khi doanh nghiệp khó khăn,"Báo cáo thẩm tra về tình hình phát triển kinh tế - xã hội và ngân sách nhà nước được trình bày tại phiên khai mạc kỳ họp thứ 7 sáng 20-5, Chủ nhiệm Ủy ban Kinh tế Vũ Hồng Thanh đánh giá trong bối cảnh tình hình thế giới có nhiều diễn biến phức tạp, kinh tế vĩ mô cơ bản ổn định, lạm phát được kiểm soát, các cân đối lớn cơ bản được bảo đảm là những thành tựu nổi bật, tạo tiền đề cho quá trình phục hồi tăng trưởng và phát triển kinh tế. Doanh nghiệp khó khăn, ngân hàng lãi lớn Tuy vậy, cơ quan thẩm tra cho rằng tình hình kinh tế - xã hội còn hạn chế, tồn tại cần khắc phục khi cả năm 2023 có 5/15 chỉ tiêu không đạt mục tiêu. Trong đó, tăng trưởng kinh tế theo giai đoạn có xu hướng giảm dần, chất lượng tăng trưởng kinh tế còn thấp, chậm được cải thiện. Ngành công nghiệp chế biến, chế tạo giảm tốc mạnh và đánh mất vai trò động lực chính của tăng trưởng trong khi khu vực dịch vụ chưa chứng tỏ được vai trò đầu tàu dẫn dắt tăng trưởng. Cơ quan thẩm tra đánh giá đầu tư tư nhân tiếp tục tăng trưởng thấp. Hoạt động sản xuất, kinh doanh của doanh nghiệp gặp nhiều khó khăn khi năm 2023 bình quân một tháng có 14.400 doanh nghiệp rút lui khỏi thị trường. Ủy ban Kinh tế cũng đánh giá công tác điều hành tăng trưởng tín dụng còn bất cập; thấp hơn mục tiêu đề ra, tiếp cận tín dụng khó khăn. Thị trường vốn còn nhiều vấn đề khiến nhu cầu vốn trung và dài hạn cho nền kinh tế phần lớn qua kênh tín dụng ngân hàng, làm gia tăng áp lực và tiềm ẩn rủi ro đối với hệ thống. Theo đó, cơ quan thẩm tra đề nghị Chính phủ có đánh giá, phân tích về nguyên nhân, mức độ tác động của tăng trưởng tín dụng đến tình hình phát triển kinh tế - xã hội năm 2023 và làm rõ việc các ngân hàng thương mại lãi lớn năm 2023 trong bối cảnh doanh nghiệp khó khăn. Báo cáo dẫn chứng lợi nhuận sau thuế của một số ngân hàng trong năm 2023 như Vietcombank là 33.054 tỉ đồng, tăng 10% so với năm 2022; BIDV 22.027 tỉ đồng, tăng 20%; MB 21.053 tỉ đồng, tăng 16%; VietinBank 20.044 tỉ đồng, tăng 18%... Trong khi đó, tình trạng sở hữu chéo, thao túng, lợi ích nhóm trong lĩnh vực ngân hàng vẫn rất đáng lo ngại. Việc xử lý các tổ chức tín dụng yếu kém, dự án tồn đọng gặp nhiều khó khăn. Kinh doanh vàng, ngoại tệ đã hình thành thị trường ngầm? Báo cáo thẩm tra tình hình thực hiện kinh tế - xã hội trong các tháng đầu năm 2024 cũng nêu ra thị trường tài chính, tiền tệ còn tiềm ẩn rủi ro, thách thức, nợ xấu tăng tiếp tục diễn ra. Báo cáo thẩm tra dẫn số liệu của Ủy ban Giám sát tài chính quốc gia, tỉ lệ nợ xấu bình quân toàn hệ thống là 4,86%, dư nợ xấu (đã trừ Ngân hàng SCB) tăng 8,7% so với cuối năm 2023. Chính vì nợ xấu có xu hướng tăng nên các ngân hàng đã kiểm soát chặt chẽ hơn hoạt động cho vay để giảm bớt rủi ro.  Đến ngày 23-4-2024 tín dụng chỉ mới tăng 1,6% trong bối cảnh mặt bằng lãi suất đã giảm cho thấy khả năng tiếp cận vốn của doanh nghiệp và khả năng hấp thụ vốn của nền kinh tế còn gặp nhiều thách thức. Cùng đó, thị trường vàng có nhiều biến động, chỉ số giá vàng trong nước bình quân 4 tháng đầu năm tăng 20,8% so với cùng kỳ khi giá vàng thế giới tăng cao kỷ lục. Có ý kiến cho rằng ngoài yếu tố biến động tình hình kinh tế thế giới và bất ổn địa chính trị, một số hạn chế trong quản lý hoạt động kinh doanh vàng, ngoại tệ đã hình thành thị trường ngầm về giao dịch vàng, ngoại tệ từ lâu với quy mô giao dịch lớn, phức tạp và khó kiểm soát… Đặc biệt là hành vi ưa thích vàng ngày càng gia tăng, nhưng chưa được điều chỉnh phù hợp, có thể ảnh hưởng đến công tác điều hành kinh tế vĩ mô, ổn định thị trường, phản ánh qua tình hình buôn lậu vàng, ngoại tệ, tội phạm gia tăng…",20/05/2024 11:29 GMT+7,https://tuoitre.vn/de-nghi-chinh-phu-lam-ro-viec-cac-ngan-hang-lai-lon-trong-khi-doanh-nghiep-kho-khan-20240520104440041.htm,"Cơ quan thẩm tra đề nghị Chính phủ phân tích về nguyên nhân, mức độ tác động của tăng trưởng tín dụng đến tình hình kinh tế - xã hội năm 2023 và làm rõ việc các ngân hàng thương mại lãi lớn năm 2023 trong bối cảnh doanh nghiệp khó khăn."
Một công ty bất động sản ở Huế bị xử phạt 500 triệu đồng,"Ngày 20-5, UBND tỉnh Thừa Thiên Huế cho biết vừa ra quyết định xử phạt 500 triệu đồng với Công ty CP Đầu tư IMG Huế vì vi phạm trong lĩnh vực kinh doanh bất động sản. Theo đó, công ty trên đã kinh doanh bất động sản không đảm bảo đầy đủ các điều kiện theo quy định. Cụ thể, chủ đầu tư đã bán các căn nhà liền kề M21, N26, S21 thuộc dự án khu đô thị mới An Cựu (TP Huế) theo hình thức bán nhà ở hình thành trong tương lai nhưng không có văn bản thông báo cho cơ quan quản lý nhà nước về việc nhà ở đủ điều kiện được bán. Sở Xây dựng tỉnh cũng không có văn bản chấp thuận cho phép được mở bán các căn nhà nói trên. Việc bán nhà ở hình thành trong tương lai khi chưa được Sở Xây dựng xác nhận bằng văn bản là không phù hợp quy định tại điều 55 Luật Kinh doanh bất động sản năm 2014. Căn cứ hành vi trên, UBND tỉnh Thừa Thiên Huế đã ra quyết định xử phạt hành chính 500 triệu đồng đối với Công ty CP Đầu tư IMG Huế. Ngoài ra, công ty còn bị đình chỉ hoạt động kinh doanh bất động sản 4 tháng 15 ngày đối với dự án khu đô thị mới An Cựu.",20/05/2024 11:04 GMT+7,https://tuoitre.vn/mot-cong-ty-bat-dong-san-o-hue-bi-xu-phat-500-trieu-dong-20240520104015153.htm,Công ty CP Đầu tư IMG Huế vừa bị UBND tỉnh Thừa Thiên Huế xử phạt 500 triệu đồng và đình chỉ 4 tháng 15 ngày do vi phạm trong lĩnh vực kinh doanh bất động sản.
Tiết kiệm được 680.000 tỉ để cải cách tiền lương,"Sáng 20-5, phát biểu phiên khai mạc kỳ họp thứ 7, Quốc hội khóa XV, Phó thủ tướng Lê Minh Khái đã có báo cáo đánh giá bổ sung kết quả thực hiện phát triển kinh tế - xã hội và ngân sách nhà nước năm 2023, tình hình thực hiện kế hoạch phát triển kinh tế - xã hội và ngân sách nhà nước những tháng đầu năm 2024. Quy mô kinh tế 430 tỉ USD, là nhóm các nước có trung bình cao Theo phó thủ tướng, trong năm 2023 mặc dù có nhiều khó khăn nhưng GDP tăng 5,05% (báo cáo trước là 5%). Quy mô nền kinh tế đạt 430 tỉ USD, bước vào nhóm các nước có thu nhập trung bình cao. Lạm phát được kiểm soát với 3,25%, thị trường tiền tệ, ngoại hối cơ bản ổn định, mặt bằng lãi suất giảm. Thu ngân sách nhà nước đạt trên 1,75 triệu tỉ đồng, vượt 8,2% và tăng 133.400 tỉ đồng so với dự toán. Trong bối cảnh đó, nhiều chính sách, giải pháp đã được đưa ra như miễn, giảm, gia hạn thuế, phí, lệ phí và tiền thuê đất gần 191.500 tỉ đồng.  Bội chi ngân sách khoảng 3,5% GDP, dư nợ công khoảng 37% GDP, dư nợ Chính phủ khoảng 34% GDP, thấp hơn nhiều so với mức trần và ngưỡng cảnh báo. Tính đến hết năm 2023, đã dành được khoảng 680.000 tỉ đồng để thực hiện chính sách tiền lương mới. Tổng kim ngạch xuất nhập khẩu đạt 681 tỉ USD; xuất siêu 28,3 tỉ USD.  Thu hút vốn FDI đạt 39,4 tỉ USD, vốn FDI thực hiện đạt 23,2 tỉ USD, tăng 3,5%, cao nhất từ trước đến nay. Mặc dù các kết quả đạt được là “đáng ghi nhận”, song phó thủ tướng đánh giá vẫn còn những hạn chế, khó khăn.  Tăng trưởng kinh tế chưa đạt mục tiêu đề ra. Hoạt động sản xuất kinh doanh, tiếp cận tín dụng còn nhiều khó khăn. Tốc độ tăng năng suất lao động chưa đạt yêu cầu. Thủ tục đầu tư kinh doanh còn rườm rà. Chấp hành kỷ luật, kỷ cương của một bộ phận cán bộ, công chức còn chưa nghiêm. Trong bối cảnh năm 2024 tiếp tục đối mặt với nhiều diễn biến phức tạp, khó lường, tiềm ẩn rủi ro, nhưng các tổ chức quốc tế đánh giá triển vọng tăng trưởng của Việt Nam. Kinh tế - xã hội những tháng đầu năm chuyển biến tích cực, đạt nhiều kết quả tốt. Trong đó, GDP quý 1 tăng trưởng 5,66%, là mức cao nhất giai đoạn 2020 - 2023, chỉ số CPI bình quân 4 tháng tăng 3,93%. Thu ngân sách đạt 43,1% dự toán, tăng 10,1%; kim ngạch xuất khẩu tăng 15%; xuất siêu 8,4 tỉ USD. FDI thực hiện đạt 6,28 tỉ USD, tăng 7,4%, cao nhất trong 5 năm trở lại đây. Nhiều tập đoàn lớn đã cam kết đầu tư vào Việt Nam trong các ngành điện tử, chip, bán dẫn, năng lượng tái tạo… Nhiều tồn đọng kéo dài được xử lý Cũng theo phó thủ tướng, nhiều vấn đề, dự án tồn đọng, kéo dài được tập trung xử lý, đạt kết quả tích cực. Trong đó, đã chuẩn bị hồ sơ, điều kiện để xem xét phê duyệt chủ trương chuyển giao bắt buộc các ngân hàng yếu kém, bảo đảm an toàn hệ thống. Dự kiến, việc định giá 3 ngân hàng mua bắt buộc sẽ hoàn thành và trình cấp có thẩm quyền phê duyệt phương án chuyển giao bắt buộc trong tháng 5-2024, hoàn thành chuyển giao bắt buộc trong năm 2024. Tuy vậy, báo cáo Chính phủ nhìn nhận sức ép chỉ đạo điều hành kinh tế vĩ mô còn cao, nhất là trong kiểm soát lạm phát, điều hành lãi suất, tỉ giá; tăng trưởng tín dụng còn thấp, giá vàng thế giới và trong nước biến động mạnh. Hoạt động sản xuất, kinh doanh của doanh nghiệp, người dân gặp nhiều khó khăn. Thị trường bất động sản phục hồi chậm, tiến độ triển khai gói cho vay nhà ở xã hội 120.000 tỉ đồng chưa đạt yêu cầu. Chỉ ra nguyên nhân, phó thủ tướng cho rằng trước sức ép từ bên ngoài, những tồn tại, yếu kém nội tại của nền kinh tế kéo dài từ lâu, bộc lộ rõ hơn. Bao gồm các thị trường bất động sản, trái phiếu doanh nghiệp, chứng khoán, ngân hàng yếu kém. Một số cán bộ, công chức còn chưa chủ động, quyết liệt, còn tâm lý né tránh, đùn đẩy, sợ trách nhiệm... Về các giải pháp, phó thủ tướng cho rằng sẽ ưu tiên thúc đẩy tăng trưởng gắn với ổn định kinh tế vĩ mô, kiểm soát lạm phát và đảm bảo các cân đối lớn. Làm mới các động lực tăng trưởng, tiếp tục miễn giảm gia hạn thuế phí, tiết kiệm chi, quản lý giá các mặt hàng do Nhà nước quản lý… Tiếp tục đổi mới và nâng cao chất lượng xây dựng văn bản pháp luật, đẩy mạnh phân cấp phân quyền, chấm dứt tình trạng sợ sai, né tránh và đùn đẩy trách nhiệm.  Tiếp tục đơn giản hóa thủ tục hành chính, đẩy nhanh số hóa, thực chất cơ cấu lại nền kinh tế gắn với đổi mới mô hình tăng trưởng, nâng cao năng suất… Tiếp tục cơ cấu lại các tổ chức tín dụng gắn với xử lý nợ xấu, tập trung chuyển giao bắt buộc các ngân hàng yếu kém. Đẩy mạnh cơ cấu lại các ngành công nghiệp, nhất là công nghiệp chế biến, chế tạo. Đẩy nhanh tiến độ các công trình hạ tầng giao thông quan trọng quốc gia, liên vùng...",20/05/2024 10:09 GMT+7,https://tuoitre.vn/tiet-kiem-duoc-680-000-ti-de-cai-cach-tien-luong-20240520094938716.htm,"Theo báo cáo của Chính phủ, GDP năm 2023 tăng 5,05%, với quy mô nền kinh tế đạt 430 tỉ USD, bước vào nhóm các nước trung bình cao."
