Title,Content,Date,Url,Summary
Bất ổn ở CLB Công An Hà Nội,"Đánh rơi 6 điểm trên sân khách trong chuyến hành quân vào Bình Dương và TP.HCM khiến CLB Công An Hà Nội giờ đang cách đội đầu bảng 8 điểm. Khoảng cách này còn xa hơn nếu Nam Định thắng ở vòng 20. Chuyện gì đang diễn ra ở CLB Công An Hà Nội sau khi HLV Kiatisak Senamuang xin từ chức? Thủ môn đẳng cấp Filip Nguyễn mắc sai lầm hay bản chất các cầu thủ đã không còn nhìn về một phía trước bất cập ở ghế HLV. Giám đốc kỹ thuật Trần Tiến Đại ""hết phép"" Chuyện CLB Công An Hà Nội thay huấn luyện viên thứ 5 trong 2 mùa giải vừa qua không còn mới. Sau sự ra đi của cựu HLV tuyển Thái Lan Kiatisak, ông Trần Tiến Đại (giám đốc kỹ thuật) tiếp tục được tin tưởng giao trọng trách quen thuộc tạm thời dẫn dắt đội bóng. 5 trận tạm quyền trước đó, ông Đại bất bại với 3 trận thắng và 2 trận hòa. Niềm tin vào 2 trận tạm quyền ở vòng 19 và 20 được lãnh đạo CLB đặt trọn vào vị tướng bất đắc dĩ. Thế nhưng kết quả đã không như ý muốn. Lần đầu tiên HLV tạm quyền Trần Tiến Đại nếm mùi thất bại, thậm chí là 2 trận thua liên tiếp. Kết quả khiến người ta phải đặt dấu hỏi. Chuyện gì đang xảy ra với CLB Công An Hà Nội? Đây không phải lần đầu tiên Công An Hà Nội thua 2 trận liên tiếp từ ngày lên V-League mùa giải 2023. Đáng báo động là trong 5 trận gần nhất, họ đã thua 4 lần (2 trận thời HLV Kiatisak trước Nam Định và Quảng Nam, 2 trận thời ông Đại trước Bình Dương và TP.HCM). Ông Trần Tiến Đại có lẽ cũng bất lực, ""hết phép"", nhiều khả năng sẽ để lại ""chiếc ghế nóng"" cho người kế nhiệm là HLV Mano Polking. Ngày 23-5, ông Polking quay lại Việt Nam và có thể tiếp quản công việc mới ở Công An Hà Nội. Tuy nhiên, chưa có gì bảo đảm có HLV mới thì CLB Công An Hà Nội sẽ ổn định. Công An Hà Nội cần HLV giỏi Sở hữu hàng loạt cầu thủ ngôi sao trong đội hình đã mang về danh hiệu vô địch V-League cho Công An Hà Nội ở mùa giải 2023, nhưng cũng chính họ trở thành điểm yếu khi đội bóng không còn là một tập thể. Hình ảnh Filip Nguyễn bực tức trước cách tổ chức phòng ngự của đồng đội ở các vòng đấu vừa qua là có lý do. Thủ môn Việt kiều Czech không thể thuyết phục đồng đội phòng thủ theo ý mình. Bản thân anh cũng mắc sai lầm trong 2 trận đấu quan trọng trước Nam Định và Bình Dương. Filip Nguyễn bị cất trên ghế dự bị trong trận đấu với TP.HCM tối 21-5. Thế nhưng các cầu thủ Công An Hà Nội vẫn chơi mơ màng. Huỳnh Tấn Sinh phải trả giá bằng tấm thẻ đỏ sau 2 tình huống chơi hớ hênh ở trận thua CLB TP.HCM 1-2. Bị mất người, HLV Trần Tiến Đại phải rút Phan Văn Đức ra ở phút 33.   Phan Văn Đức chào khán giả và không bắt tay HLV. Các đồng đội phải an ủi anh sau đó. Nhưng không chỉ có vậy, sự bất mãn hay bất tuân chiến thuật còn thể hiện trên sân. Bùi Hoàng Việt Anh cho thấy sự cẩu thả của mình trong khâu phòng ngự. Anh có pha giữ bóng trong vòng cấm địa để tiền đạo đối phương cướp bóng rồi dẫn đến bàn thua 1-2 trước CLB TP.HCM. Những lỗ hổng phòng thủ của Công An Hà Nội bị các HLV khác nghiên cứu kỹ. HLV Lê Huỳnh Đức nói đã ""mổ băng"" kỹ vị trí của đội trưởng Việt Anh để khai thác và mang về chiến thắng 4-1 cho Bình Dương ở vòng 19. Trung vệ mang áo 68 giỏi phát động tấn công, khả năng không chiến tốt. Do đó, anh thường bỏ quên nhiệm vụ trước khung thành đội nhà. Đó là bề nổi để lý giải phần nào bất ổn ở CLB Công An Hà Nội thời gian qua. Như giám đốc kỹ thuật Trần Tiến Đại thừa nhận, Công An Hà Nội cần một HLV đẳng cấp, am hiểu bóng đá Việt Nam và chuyên nghiệp.",22/05/2024 15:39 GMT+7,https://tuoitre.vn/bat-on-o-clb-cong-an-ha-noi-20240522145346511.htm,Hai trận thua liên tiếp ở vòng 19 và vòng 20 V-League 2023-2024 khiến CLB Công An Hà Nội sắp trở thành cựu vương. Đội bóng bất ổn ngay cả khi giao cho giám đốc kỹ thuật Trần Tiến Đại.
"Bí kíp tập luyện, ăn kiêng khiến Shakira trẻ hơn hàng chục tuổi","Shakira (ca sĩ, vũ công nổi tiếng thế giới người Colombia) đã phát hành 12 album phòng thu, thực hiện 6 chuyến lưu diễn, 4 trong số đó là trên toàn thế giới. Cô được mệnh danh là ""nữ hoàng World Cup"", khi các ca khúc của cô như Hips Don't Lie, Waka Waka, La la la từng làm dậy sóng ở các kỳ World Cup 2006, 2010 và 2014. Mới đây bài hát Puntería của Shakira đã được chọn làm bài hát chính thức ở Copa America 2024. Sau hơn 30 năm hoạt động trong làng giải trí, Shakira dường như không già đi. Một bức ảnh của cô ở độ tuổi 20 dường như chẳng khác nhiều so với bức ảnh bây giờ - ở tuổi 47. Không chỉ có vẻ ngoài trẻ trung, Shakira lúc nào cũng luôn tràn đầy năng lượng. Năm ngoái cô đã được tạp chí People của Tây Ban Nha bình chọn danh hiệu: ""Người phụ nữ đẹp nhất năm 2023"". Để có được điều đó, Shakira phải nỗ lực rất nhiều để giữ phong độ. Chế độ ăn kiêng kỷ luật của Shakira Shakira tuân thủ một chế độ ăn kiêng nghiêm ngặt, bao gồm việc thực hiện các bữa ăn nhỏ, giàu chất dinh dưỡng để duy trì năng lượng trong ngày. Để chuẩn bị cho những buổi biểu diễn quan trọng như Super Bowl, cô tạm thời cắt giảm lượng đường và sữa. Kaiser là huấn luyện viên của Shakira cho biết: ""Nói chung Shakira thực hiện chế độ ăn kiêng rất nghiêm ngặt. Bữa sáng có thể là trứng hoặc bơ với dầu ô liu, cà chua, sau đó là sinh tố, quả mọng, protein thực vật, đôi khi là rau xanh hoặc bột màu xanh lá cây. Vào bữa trưa, cô ăn cá và rau tươi hoặc salad nhiều màu sắc. Buổi chiều luôn rất bận rộn, nhưng Shakira sẽ ăn món xúp như: xúp atisô, xúp tỏi tây và cà tím, đôi khi có thêm dưa chuột với chanh và muối. Với bữa tối, Shakira sẽ ăn cá và rau. Tập thể dục 6 ngày mỗi tuần, đặc biệt là khiêu vũ Các bài tập thể thao của Shakira là sự kết hợp hoàn hảo giữa sức mạnh và các buổi tập tim mạch. Huấn luyện viên của ngôi sao này tập trung vào ""các buổi tập tim mạch cường độ thấp kéo dài"".  Đó có thể là đi bộ trên máy, chạy bộ, đạp xe, bơi lội. Các buổi tập của Shakira thay đổi theo từng ngày, với các bài tập được thực hiện bằng tạ, dây kháng lực... Trong suốt 20 năm qua, ngôi sao ca nhạc thế giới Shakira có thói quen tập thể dục 6 ngày mỗi tuần. Đặc biệt cô rất thích khiêu vũ.  Những bài khiêu vũ kinh điển, trong đó có động tác lắc hông điệu nghệ được cô thể hiện ở các bài hát như Hips Don't Lie, Waka Waka khiến Shakira được yêu mến trên khắp thế giới.  Thành quả này đến từ các bài tập khiêu vũ, nó giúp Shakira nâng cao thể lực, tính linh hoạt và khả năng phối hợp trong khi hòa mình vào giai điệu của âm nhạc. Cho dù đang đổ mồ hôi trong phòng tập hip hop hay đắm mình trong nhịp điệu thoải mái của phòng khách, khiêu vũ sẽ đẩy nhanh nhịp tim và giúp cơ thể hoạt động tốt hơn.  Theo báo cáo của Trường Y Harvard, xen kẽ các buổi rèn luyện sức mạnh  bằng các buổi khiêu vũ, có thể giúp đốt cháy 90 đến 252 calo trong 30 phút khiêu vũ. Ngoài việc giảm cân, khiêu vũ còn giúp tăng cường năng lực trí tuệ, giúp trái tim khỏe mạnh hơn, mật độ xương được cải thiện. Điều thú vị là mỗi buổi sáng sau khi thức dậy, Shakira không sử dụng điện thoại cho đến khi hoàn thành tất cả các bài tập thể dục và chương trình tập luyện đã đề ra.",22/05/2024 14:52 GMT+7,https://tuoitre.vn/bi-kip-tap-luyen-an-kieng-khien-shakira-tre-hon-hang-chuc-tuoi-20240520172448.htm,"Ngôi sao ca nhạc Shakira tiết lộ thói quen tập luyện cường độ cao, chế độ ăn kiêng nghiêm ngặt giúp cô không bị chấn thương, duy trì sức khỏe, vẻ đẹp rực rỡ ở tuổi 47."
Lần đầu tổ chức Giải bóng đá U15 các dân tộc thiểu số tỉnh Điện Biên,"Ngày 22-5 tại Hà Nội, báo Thiếu Niên Tiền Phong và Nhi Đồng phối hợp với Sở Văn hóa, Thể thao và Du lịch tỉnh Điện Biện công bố tổ chức Giải bóng đá U15 các dân tộc thiểu số tỉnh Điện Biên 2024. Giải đấu nằm trong chuỗi các hoạt động hưởng ứng Năm Du lịch quốc gia - Điện Biên 2024; chào mừng kỷ niệm 70 năm Chiến thắng Điện Biên Phủ (7-5-1954 - 7-5-2024); Tháng Hành động vì trẻ em năm 2024. Bên cạnh đó, ban tổ chức hướng đến mục tiêu tổ chức giải đấu thường niên để phát hiện và bồi dưỡng tài năng bóng đá trẻ cho tỉnh Điện Biên nói riêng và khu vực Tây Bắc nói chung. Dự kiến, Giải bóng đá U15 các dân tộc thiểu số tỉnh Điện Biên sẽ diễn ra từ ngày 8 đến 15-6 tại sân vận động tỉnh Điện Biên. Thành phần vận động viên tham dự giải là các em thiếu niên dân tộc thiểu số đang học tập, sinh sống trên địa bàn tỉnh Điện Biên có độ tuổi từ 13-15 (sinh năm 2009 - 2011). Trong năm đầu tiên tổ chức, giải quy tụ 8 đội bóng đến từ các huyện, thành phố trên địa bàn tỉnh Điện Biên, bao gồm: U15 Thành phố Điện Biên Phủ 1 và 2, U15 huyện Điện Biên 1 và 2, U15 thị xã Mường Lay, U15 huyện Tủa Chùa, U15 huyện Tuần Giáo, U15 huyện Mường Ảng. Cơ cấu giải thưởng, bên cạnh cúp và huy chương, đội vô địch sẽ được nhận 15 triệu đồng, đội á quân nhận 10 triệu đồng, đội hạng ba và tư lần lượt nhận 5 triệu đồng, 3 triệu đồng. Ngoài ra còn các giải cá nhân gồm: Vua phá lưới, Thủ môn xuất sắc nhất, Cầu thủ xuất sắc nhất - trị giá 1 triệu đồng/giải cùng quà tặng từ nhà tài trợ. Đây là giải bóng đá có ý nghĩa rất lớn đối với các em nhỏ dân tộc thiểu số, khơi gợi niềm đam mê thể thao, tình đoàn kết. Góp phần khích lệ các em trên con đường phía trước, đóng góp cho sự phát triển của tỉnh Điện Biên và Tổ quốc.",22/05/2024 13:44 GMT+7,https://tuoitre.vn/lan-dau-to-chuc-giai-bong-da-u15-cac-dan-toc-thieu-so-tinh-dien-bien-20240522125855433.htm,Giải bóng đá U15 các dân tộc thiểu số tỉnh Điện Biên lần đầu được tổ chức với 8 đội bóng tranh tài và hướng đến mục tiêu trở thành giải đấu thường niên.
Chung kết Europa League: Chờ Leverkusen làm nên kỳ tích,"Đó sẽ là trận đấu thứ 52 của thầy trò HLV Xabi Alonso trên mọi đấu trường ở mùa giải này. Và không có gì ngạc nhiên nếu chuỗi trận bất bại của họ lại tiếp tục kéo dài. Leverkusen hứng khởi Không giống như Bundesliga, Leverkusen từng vô địch Europa League (vào năm 1988). Đó cũng gần như là chiếc cúp danh giá duy nhất trong phòng truyền thống của Leverkusen - đội bóng thường bị trêu chọc là Neverkusen (Never: không bao giờ) vì thường về nhì ở mọi giải đấu. Giờ đây, thầy trò HLV Xabi Alonso tràn đầy hứng khởi hướng đến danh hiệu Europa League thứ hai trong lịch sử. Có quá nhiều yếu tố thôi thúc lòng quyết tâm của họ. Trong đó rõ ràng nhất là kỳ tích bất bại trọn vẹn một mùa giải. Vô địch Europa League, rồi vô địch nốt Cúp quốc gia Đức (chỉ phải gặp đội hạng dưới Kaiserlautern), Leverkusen sẽ hoàn thành mùa giải 2023-2024 mà không thua bất kỳ trận nào. Một chiến tích vô tiền khoáng hậu của làng bóng đá đỉnh cao.  Mọi yếu tố dường như đều đứng về phía Leverkusen vào lúc này. Về mặt thể lực, các học trò HLV Xabi Alonso hoàn toàn sung sức. Họ đã vô địch Bundesliga từ sớm và trải qua vòng đấu gần nhất một cách nhàn nhã (nhưng vẫn thắng).  Trước đối thủ Augsburg cuối tuần rồi, HLV Alonso đã cất Wirtz, Xhaka, Hincapie, Stanisic… trên ghế dự bị. Thành quả là họ bước vào chung kết Europa League mà không mất bất kỳ cầu thủ nào. Atalanta kiệt sức Atalanta trái lại đang đối diện nguy cơ kiệt sức vì phải đeo đuổi tham vọng trên nhiều đấu trường. Họ vào đến chung kết Cúp quốc gia Ý nhưng rồi bị Juventus đánh bại với tỉ số tối thiểu hồi giữa tuần rồi. Tại Giải vô địch Ý (Serie A), Atalanta chỉ vừa chính thức giành vé dự Champions League sau khi đánh bại Lecce cách đây 3 ngày. Suốt tuần qua, họ đã phải đá đến 3 trận ""chung kết"" ở mọi đấu trường. Và hậu quả là 2 trụ cột Kolasinac cùng De Roon dính chấn thương phải vắng mặt ở trận đấu sắp tới. Nhưng tất nhiên sẽ là sai lầm lớn nếu xem thường một đội bóng của Ý. Hành trình của Atalanta ở mùa giải năm nay phi thường chẳng kém là bao so với Leverkusen. Ở Serie A, họ vượt mặt những đội bóng có ngân sách cao hơn là AS Roma, Lazio và Napoli để giành vé dự Champions League. Còn tại Europa League, Atalanta đã quật ngã ứng viên vô địch số 1 là Liverpool. Chỉ với chiến tích đó, việc họ vô địch giải đấu cũng hoàn toàn xứng đáng. Khắc tinh của bóng đá Đức Theo truyền thống, bóng đá Ý thường là khắc tinh của bóng đá Đức. Bản thân Atalanta từng đánh bại Leverkusen 2 năm trước trong cả hai trận lượt đi và về ở vòng 16 đội Europa League. Mặt khác, HLV Gian Piero Gasperini được xem là một bậc thầy chiến thuật trong những trận cầu lớn. Và ông cũng là một tín đồ của bóng đá tấn công khi biến Atalanta trở thành một trong những đội chơi đẹp mắt nhất châu Âu trong vòng 5 năm trở lại đây. Và cũng như Leverkusen, phòng truyền thống của Atalanta chẳng có gì đáng kể đến trước thềm mùa giải này. Kỳ tích bất bại của thầy trò HLV Alonso giúp họ trở thành đội bóng được yêu thích bậc nhất mùa giải năm nay, nhưng trước mắt họ sẽ là một Atalanta đầy lãng mạn, quyết tâm và mưu mẹo.",22/05/2024 10:22 GMT+7,https://tuoitre.vn/chung-ket-europa-league-cho-leverkusen-lam-nen-ky-tich-20240522094040038.htm,"Sau kỳ tích bất bại ở Giải vô địch Đức (Bundesliga), Leverkusen sẽ tiếp tục hành trình phi thường của họ khi chạm trán Atalanta ở chung kết Europa League, diễn ra lúc 2h ngày 23-5 (giờ VN) trên sân Aviva (Ireland)."
Atalanta có cản nổi Leverkusen?,"Atalanta có một chân sút đang đạt phong độ đỉnh cao vào thời điểm này, trong khi Leverkusen có một sứ mệnh to lớn đang cần hoàn thành.  Trận chung kết Europa League 2023/2024 giữa Atalanta và Leverkusen diễn ra lúc 2h ngày 23-5 (giờ Việt Nam), được truyền hình trực tiếp và độc quyền trên FPT Play. Scamacca chực chờ ""nổ súng"" Atalanta của Gianluca Scamacca đã lọt vào trận chung kết Conference League mùa trước, nhưng tiền đạo này đã không thể tận hưởng trải nghiệm trọn vẹn.  Cựu cầu thủ Sassuolo đã ghi ba bàn sau 16 lần ra sân cho West Ham ở Premier League trước khi chấn thương đầu.  Khi đó, Gianluca Scamacca không thể ra sân và nhìn các đồng đội tại The Hammers đánh bại Fiorentina trong trận chung kết UEFA Europa Conference League 2022-2023 ở Praha. Đến trận chung kết mùa này, có vẻ như cầu thủ 25 tuổi quyết tâm tận dụng tối đa cơ hội. Đã ghi một bàn ở vòng bảng, Scamacca hiện có thêm động lực sau khi sút tung lưới tất cả các đối thủ ở vòng loại trực tiếp của Atalanta - bao gồm cả cú đúp trong chiến thắng ấn tượng 3-0 của La Dea trước Liverpool ở tứ kết. Leverkusen muốn giành cú ăn ba Sau khi đội bóng kiêu hùng Leverkusen tại mùa giải 2001-2002 lần lượt giành được vị trí á quân ở Bundesliga, Cúp quốc gia Đức và UEFA Champions League, mãi đến 22 năm sau, thời khắc huy hoàng mới trở lại cùng Werkself. Leverkusen về nhì Bundesliga 5 lần.  Mới đây, đội đã giành được danh hiệu dưới sự dẫn dắt của Xabi Alonso và vẫn đầy quyết tâm có một mùa giải tuyệt vời, vẻ vang chiến thắng. Nhà vô địch UEFA Cup năm 1988, Leverkusen đang mong muốn giành được chiếc cúp châu lục thứ hai tại Dublin. Nếu đánh bại Atalanta, ba ngày sau Leverkusen có cơ hội giành cú ăn ba khi tiếp Kaiserslautern trong trận chung kết Cúp quốc gia Đức. Đây là những thử thách đầy chông gai, nhưng Leverkusen quyết tâm thực hiện từng bước một.  ""Bây giờ chúng tôi phải tập trung cao độ vào Atalanta. Cuối cùng thì giành chiến thắng trong trận chung kết mới là tất cả. Và chúng tôi vẫn phải làm cho bằng được"". Tiền vệ Jonas Hofmann nói sau trận bán kết thành công trước Roma. Khát vọng của nhà cầm quân Từng vô địch Champions League cùng Liverpool và Real Madrid, cũng như hai lần vô địch Euro và một lần vô địch World Cup cùng Tây Ban Nha, Xabi Alonso là một trong những tiền vệ xuất sắc nhất thế giới ở thế hệ của anh.  Giờ đây, Xabi Alonso đang nổi lên như một trong những huấn luyện viên sáng giá nhất, tài năng nhất. Leverkusen là đội bóng đầu tiên Xabi Alonso chính thức huấn luyện. Sau khi đưa Leverkusen từ khu vực xuống hạng lọt vào top 6 trong mùa giải đầu tiên, Xabi Alonso đã vượt quá mọi kỳ vọng trong mùa giải thứ hai.  ""Tại thời điểm này, tôi cảm thấy đây là nơi thích hợp để tôi phát triển với tư cách là một huấn luyện viên"" - Xabi Alonso đã nói vậy để khẳng định sự gắn bó với Leverkusen. Biết mình thuộc về đâu luôn là chủ đề trong sự nghiệp của Gian Piero Gasperini, kể từ khi ông mang phong cách tấn công siêu linh hoạt của mình đến Atalanta vào năm 2016.  Đội bóng của Gasperini đã thường xuyên góp mặt ở đấu trường châu Âu, bản thân Gasperini cũng đã hai lần là huấn luyện viên xuất sắc nhất mùa giải ở Ý. Thực tế, ở tuổi 66, Gasperini vẫn chưa dẫn dắt một câu lạc bộ giành được bất kỳ danh hiệu nào. ""Rõ ràng là chúng tôi đề cao việc giành được một danh hiệu. Bên cạnh đó, sự đoàn kết của cả tập thể cũng là một thành công đáng kể"" - Gasperini đã nói sau trận đấu thành công ở tứ kết của Atalanta trước Liverpool. Xabi Alonso trẻ trung nhưng lão luyện đối đầu cùng Gian Piero Gasperini kinh nghiệm và khát khao chiến thắng. Ai sẽ là nhà vô địch UEFA Europa League mùa này? Câu trả lời sẽ có vào rạng sáng 23-5.",22/05/2024 10:18 GMT+7,https://tuoitre.vn/atalanta-co-can-noi-leverkusen-20240522095556617.htm,"Atalanta có cản bước được đội bóng bất bại của Alonso, khi hai đội chạm trán nhau ở chung kết Europa League rạng sáng 23-5."
VFF bổ nhiệm 3 trợ lý chuyên môn người Việt cho HLV Kim Sang Sik,"Sáng 22-5, VFF thông báo bổ nhiệm các trợ lý Lê Đức Tuấn, Lưu Danh Minh và Ngô Việt Trung tham gia ban huấn luyện, phụ giúp HLV trưởng Kim Sang Sik tại tuyển U23, đội tuyển Việt Nam. Trong số 3 trợ lý kể trên, ông Lê Đức Tuấn có lần đầu tham gia ban huấn luyện cấp độ đội tuyển quốc gia. Hiện ông Tuấn đang là trợ lý HLV trưởng tại CLB Hà Nội, và từng có thời gian chính thức cầm quân đội bóng này tại AFC Champions League 2023. Thành tích nổi bật nhất của trợ lý Lê Đức Tuấn là từng giúp CLB Phù Đổng vô địch Giải hạng nhì 2018. Tính đến hiện tại, ông cũng là một trong số 22 HLV Việt Nam sở hữu bằng Pro - bằng cấp cao nhất của Liên đoàn Bóng đá châu Á (AFC). Trợ lý Lưu Danh Minh đã thường xuyên tham gia vào ban huấn luyện U23, đội tuyển Việt Nam từ thời HLV Park Hang Seo. HLV thủ môn Ngô Việt Trung thời gian gần đây nổi bật với công tác chuyên môn ở đội U23 Việt Nam tham dự vòng chung kết U23 châu Á 2024. Trước đó, VFF đã công bố các vị trí trợ lý cho HLV Kim Sang Sik, gồm: Choi Kwon Won - chuyên môn, Sang Wuk An - thể lực, Kim Jinn Seong và Đỗ Anh Văn - ngôn ngữ. Bên cạnh đó, VFF cũng đã kiện toàn đội ngũ thể lực, chuyên gia phân tích, y tế và hậu cần. Đội tuyển Việt Nam dự kiến tập trung vào ngày 1-6, chuẩn bị cho trận tiếp Philippines trên sân nhà vào ngày 6-6 và làm khách trên sân của Iraq vào ngày 11-6 (rạng sáng ngày 12-6 theo giờ Việt Nam), thuộc khuôn khổ vòng loại World Cup 2026 khu vực châu Á.",22/05/2024 10:14 GMT+7,https://tuoitre.vn/vff-bo-nhiem-3-tro-ly-chuyen-mon-nguoi-viet-cho-hlv-kim-sang-sik-20240522092820519.htm,"Liên đoàn Bóng đá Việt Nam (VFF) chính thức công bố 3 trợ lý chuyên môn người Việt, hỗ trợ chính cho HLV Kim Sang Sik tại U23 và đội tuyển Việt Nam."
