Title,Content,Date,Url,Summary
Bắn súng Việt Nam đặt mục tiêu vào chung kết Olympic Paris 2024,"Sáng 23-5, ông Hoàng Đạo Cương - thứ trưởng Bộ Văn hóa, Thể thao và Du lịch - đã có buổi thăm hỏi, động viên VĐV ở các đội tuyển đã giành vé tham dự Olympic Paris 2024 là bắn súng, cử tạ và boxing đang tập luyện tại Trung tâm Huấn luyện thể thao quốc gia Hà Nội (Nhổn). Bắn súng có thể vào chung kết Olympic 2024 Trong buổi làm việc, đội tuyển bắn súng Việt Nam thông tin về tình hình chuẩn bị cho Olympic 2024 của hai nữ xạ thủ đã giành vé tham dự là Trịnh Thu Vinh (10m súng ngắn hơi, 25m súng ngắn thể thao) và Lê Thị Mộng Tuyền (10m súng trường hơi).   Theo đó, xạ thủ Trịnh Thu Vinh đang duy trì được điểm số đủ khả năng vào đến loạt bắn chung kết (có 8 VĐV giành quyền vào loạt bắn chung kết ở mỗi nội dung) ở cả hai nội dung sẽ tham dự. Trong khi xạ thủ Lê Thị Mộng Tuyền cần cố gắng hơn khi chỉ đang tiệm cận mức điểm có thể vào chung kết. Trong thời gian sắp tới, hai xạ thủ kể trên sẽ có chuyến tập huấn tại Hungary, Hàn Quốc. Đây là cơ hội để Thu Vinh và Mộng Tuyền nâng cao khả năng chuyên môn, trau dồi kỹ thuật với loại đạn phù hợp thi đấu tại Olympic.  Cử tạ Việt Nam được tạo điều kiện tối đa Đội tuyển cử tạ Việt Nam có 1 suất tham dự Olympic 2024 của đô cử Trịnh Văn Vinh ở hạng cân 61kg nam. Hiện ban huấn luyện đã có kế hoạch tập luyện, tính toán phong độ để giúp Trịnh Văn Vinh đạt trạng thái thi đấu tốt nhất rơi vào thời điểm diễn ra Thế vận hội mùa hè Paris. Bên cạnh đó, đội tuyển cử tạ cũng đang có những biện pháp y tế cải thiện tình trạng quá tải cơ cho đô cử sinh năm 1995. Đội ngũ bác sĩ cho biết hiện Vinh đang hồi phục 90% các vấn đề chấn thương và được chăm sóc, trị liệu toàn thân chuyên biệt 3 ngày/tuần. Dự kiến Trịnh Văn Vinh sẽ có chuyến tập huấn nước ngoài vào đầu tháng 6 đến giữa tháng 7. Võ Thị Kim Ánh sẵn sàng cho Olympic 2024 Đội tuyển boxing Việt Nam hiện đang chuẩn bị cho vòng loại cuối Olympic Paris 2024 của môn boxing sẽ diễn ra tại Thái Lan từ ngày 23-5 đến 3-6. Võ sĩ đã giành vé Võ Thị Kim Ánh ở hạng cân 54kg đang tập duy trì trong nước. Dự kiến sau vòng loại cuối, cô cùng đội tuyển boxing Việt Nam tiếp tục lên đường tập huấn tại Kazakhstan trước thềm Thế vận hội. Chia sẻ với Tuổi Trẻ Online, Kim Ánh cho biết: ""Lần đầu tôi dự Olympic có hơi áp lực vì ra đấu trường lớn, danh giá. Nhưng tôi sẽ luôn giữ cho mình tinh thần sẵn sàng, lên đài là chiến trước bất cứ đối thủ nào. Khi có kết quả bốc thăm thi đấu, HLV và tôi sẽ tìm hiểu kỹ về đối thủ để có phương án thi đấu"".",23/05/2024 12:54 GMT+7,https://tuoitre.vn/ban-sung-viet-nam-dat-muc-tieu-vao-chung-ket-olympic-paris-2024-20240523120758767.htm,Đội tuyển bắn súng Việt Nam dự báo nữ xạ thủ Trịnh Thu Vinh có khả năng giành suất vào thi đấu loạt bắn chung kết tại Olympic Paris 2024.
CLB Công An Hà Nội gửi công văn chất vấn Ban trọng tài VFF,"Ngày 21-5, CLB Công An Hà Nội (CAHN) đã gửi công văn cho Liên đoàn Bóng Đá Việt Nam (VFF), Ban trọng tài VFF và Công ty cổ phần Bóng đá chuyên nghiệp Việt Nam (VPF).  Ngày 21-5 cũng là ngày CLB CAHN thi đấu với CLB TP.HCM ở vòng 20 V-League 2023-2024 và nhận thất bại 1-2. Sau trận đấu, CAHN ""tố"" những sai phạm của tổ trọng tài điều hành trận đấu và công tác phân công tổ trọng tài. Trợ lý trọng tài bị nêu tên Đội bóng ngành công an cho rằng mình chịu nhiều quyết định bất lợi, thiếu khách quan, không công bằng từ tổ trọng tài. Hậu quả là CLB CAHN đánh mất vị trí trong cuộc đua bảo vệ ngôi vô địch. CLB CAHN thắc mắc và đề nghị được giải đáp các vấn đề trong trận CLB CAHN thua 1-2 trước CLB TP.HCM ở vòng 20 V-League 2023-2024 diễn ra tối 21-5: Phút 13, tiền vệ Geovane chuyền cho Phạm Gia Hưng ghi bàn vào lưới CLB TP.HCM. Trợ lý trọng tài Trần Duy Khánh phất cờ việt vị. CLB CAHN khẳng định băng ghi hình cho thấy Gia Hưng chưa việt vị. Sau đó, trợ lý Duy Khánh ""liếc mắt nhìn về cabin huấn luyện CAHN với biểu hiện thiếu khách quan, trung thực"". CLB CAHN nhắc lại ở trận thua 1-4 trước CLB Bình Dương, trợ lý Duy Khánh đã bỏ qua tình huống Kizito đánh nguội Lê Phạm Thành Long của CAHN, và pha chuồi bóng từ phía sau của Trần Đình Khương với Jeferson Elias. Đội bóng cho rằng trợ lý có góc quan sát tốt nhưng không phối hợp với trọng tài chính. Có vấn đề trong phân công trọng tài? Không những chỉ ra sai sót của trợ lý trọng tài, CLB CAHN còn nghi ngờ Ban trọng tài VFF. Cụ thể, đội bóng cho rằng Ban trọng tài VFF tiếp tục phân công trợ lý Duy Khánh làm ở trận đấu giữa CAHN với CLB TP.HCM. CLB CAHN đã gửi công văn sau vòng 19 (sau trận thua Bình Dương) để phản ánh tổ trọng tài có ""sai sót cực kỳ nghiêm trọng làm thay đổi kết quả trận đấu"" nhưng Ban trọng tài VFF không có sự điều chỉnh. Đội bóng của HLV Trần Tiến Đại đặt vấn đề Ban trọng tài VFF ""thiếu trách nhiệm khi phân công trợ lý Trần Duy Khánh ở vòng 20… dẫn đến hậu quả làm thay đổi kết quả trận đấu"". CLB CAHN đặt dấu hỏi ""có sự sắp xếp chủ đích ngay cả khi CLB CAHN có công văn phản ánh"". Đội còn chỉ ra ""các hoạt động làm thay đổi kết quả trận đấu được FIFA xem xét là hành vi tiêu cực nghiêm trọng"". Một điểm nữa, CLB CAHN có ý kiến khi Ban trọng tài VFF phân công trọng tài Nguyễn Ngọc Châu (đơn vị Bình Dương) làm trọng tài thứ 4 ở trận CAHN gặp CLB TP.HCM. Lý do là bởi CAHN và Bình Dương đang cạnh tranh trực tiếp trong tốp đầu bảng xếp hạng. Sau khi có ý kiến, Ban trọng tài VFF mới đổi người. Dọa gửi văn bản lên tận FIFA CLB CAHN khẳng định họ có đầy đủ tài liệu, cơ sở về các sự việc nêu trên. Đội bóng đặt câu hỏi có hay không việc sắp xếp trọng tài làm thay đổi kết quả trận đấu, sắp xếp thành tích các đội bóng và có thế lực nào đứng sau chi phối sự sắp xếp của Ban trọng tài VFF không? Nhà đương kim vô địch V-League 2023 đề nghị VFF, Ban trọng tài và VPF có công văn phúc đáp CLB CAHN thay vì chỉ trả lời chung chung, không có ai chịu trách nhiệm. Bên cạnh đó, đội bóng đề nghị Ban trọng tài kỷ luật tổ trọng tài làm nhiệm vụ trận CLB TP.HCM với CAHN ở vòng 20. Ngoài ra, CAHN xem xét khả năng gửi công văn và tài liệu đến Ủy ban trọng tài thế giới (IFAB), FIFA, cũng như các cơ quan chức năng trong nước nếu thấy các dấu hiệu đe dọa sự phát triển bóng đá Việt Nam. Ngày 23-5, trao đổi với Tuổi Trẻ Online, lãnh đạo Công ty VPF, VFF cho biết đã nhận được văn bản của CLB CAHN và sẽ có phản hồi chính thức. Dù vậy, văn bản nặng lời, nhiều nghi vấn tiêu cực của CLB CAHN khiến giới trọng tài, các cơ quan điều hành bóng đá Việt Nam bức xúc. ",23/05/2024 12:53 GMT+7,https://tuoitre.vn/clb-cong-an-ha-noi-gui-cong-van-chat-van-ban-trong-tai-vff-20240523121538172.htm,CLB Công An Hà Nội đặt vấn đề có hay không việc sắp xếp trọng tài nhằm thay đổi kết quả trận đấu và sắp xếp thành tích các CLB và để ngỏ khả năng gửi công văn lên FIFA.
Điền kinh Việt Nam còn cơ hội tranh suất dự Olympic Paris?,"Tối 21-5, tổ tiếp sức 4x400m nữ điền kinh Việt Nam đã giành HCV tại Giải điền kinh tiếp sức châu Á 2024. Bốn VĐV gồm Nguyễn Thị Ngọc, Quách Thị Lan, Hoàng Thị Minh Hạnh, Nguyễn Thị Hằng về đích đầu tiên với thời gian 3 phút 30,81 giây và giành HCV châu Á, thiết lập kỷ lục quốc gia mới. Dù vậy, thành tích này chưa đủ giúp các VĐV có suất chính thức tham dự Olympic Paris 2024. Trên bảng xếp hạng thành tích hiện tại, đội nữ Việt Nam phải cạnh tranh với đội đang xếp thứ 16 thế giới là Nigeria (thành tích 3 phút 27,29 giây) và đội xếp thứ 15 là Cuba (thành tích 3 phút 26,08 giây). Từ đây cho đến ngày 30-6 (thời điểm chốt sổ vé chính thức dự Olympic), các cô gái Việt Nam sẽ còn hai cơ hội cải thiện thành tích tại Giải điền kinh Đài Loan mở rộng (từ ngày 30-5 đến 3-6) và Giải điền kinh Thái Lan mở rộng (từ ngày 14 đến 17-6). Việc phải rút ngắn thành tích thêm 3 giây nữa thực sự là thử thách với các chân chạy Việt Nam.  Nhận định về cơ hội giành vé đến Paris, ông Nguyễn Mạnh Hùng, tổng thư ký Liên đoàn Điền kinh Việt Nam, cho biết: ""Trong giai đoạn đầu khi tính xếp hạng, đội tiếp sức nữ Việt Nam đứng thứ 19 thế giới. Nhưng càng gần giai đoạn quyết định, các đội tuyển đều đã tăng tốc.  Hiện tại rất khó để cạnh tranh suất trực tiếp ở nội dung 4x400m nữ. Chuẩn Olympic đã vượt qua cả kỷ lục Asiad mới được thiết lập vào tháng 9-2023. Dù biết khó nhưng chúng tôi xác định phải vượt qua chính mình, còn mục tiêu là còn chiến đấu"". Bên cạnh nội dung tiếp sức 4x400m nữ, điền kinh Việt Nam đã có những tín hiệu lạc quan sau Giải điền kinh tiếp sức châu Á 2024. Đội có nhiều VĐV trẻ, ít kinh nghiệm thi đấu quốc tế như Phùng Thị Huệ, Lê Thị Cẩm Tú, Lê Thị Tuyết Mai, Nguyễn Xuân Quang. Vậy nhưng các VĐV đã giành 3 HCĐ ở các nội dung: 4x100m nữ, 4x400m nam, 4x400m hỗn hợp. Ngoại trừ nội dung 4x100m nữ, hai nội dung còn lại đều thiết lập kỷ lục quốc gia mới. ""Song song với mục tiêu Olympic, điền kinh Việt Nam cũng luôn chú trọng công tác đào tạo lớp VĐV kế thừa. Sắp tới hai giải đấu ở Đài Loan và Thái Lan, những VĐV trẻ sẽ tiếp tục được tạo điều kiện cọ xát"", ông Nguyễn Mạnh Hùng chia sẻ.",23/05/2024 11:43 GMT+7,https://tuoitre.vn/dien-kinh-viet-nam-con-co-hoi-tranh-suat-du-olympic-paris-20240522234526758.htm,"Tổ tiếp sức 4x400m nữ của điền kinh Việt Nam còn hai giải đấu nữa để có thể cải thiện vị trí trên bảng xếp hạng, hy vọng giành suất trực tiếp dự Olympic Paris 2024."
Ademola Lookman: Cậu bé không nhà 'kết liễu' giấc mộng của Leverkusen,"Câu chuyện đặc biệt về Lookman Rạng sáng 23-5, Atalanta đã đè bẹp Leverkusen 3-0 ở trận chung kết, qua đó đăng quang chức vô địch Europa League. Giấc mơ lập cú ăn ba lịch sử của Leverkusen phải dừng lại bởi cái tên Ademola Lookman. Lookman là một cầu thủ rất đặc biệt, con đường sự nghiệp của anh cũng giống như cuộc đời của người dân du mục. Anh thường không có một nơi ở cố định và lâu dài, mà thay đổi liên tục. Theo lời kể của Lookman, anh sinh ra trong một gia đình rất khó khăn. Mẹ anh phải làm những công việc bấp bênh, họ phải sống ở một khu vực thiếu thốn tại London. Điều đó thật khó khăn vì tủ lạnh lúc nào cũng trống rỗng. Lookman thường đến ""ăn chực"" ở nhà bạn bè. Con đường bóng đá của anh cũng rất khó khăn, đầu tiên anh chơi bóng ở đường phố, các giải nghiệp dư rồi đá chuyên nghiệp cho nhiều đội bóng nhỏ ở Anh. Sau đó Ademola Lookman được cho mượn đến Đức đá bóng trước khi định cư ở Ý để tìm một chỗ gọi là nhà tại thành phố Bergamo, nơi mà Atalanta đóng quân. Nhiều chuyên gia bóng đá Anh nhận định Lookman là một cầu thủ tài năng, nhưng anh lại chưa từng có một bến đỗ an toàn. Hầu hết các đội bóng mà anh trải qua đều là khoảng thời gian ""tạm cư"" ngắn ngủi, không để lại nhiều dấu ấn. Phải đến năm 2022, Lookman cập bến Atalanta, anh dường như đã tìm được nơi gọi là nhà. Tại đây Lookman đã chơi tổng cộng 75 trận cho Atalanta trên mọi đấu trường, đóng góp 30 bàn thắng và trong đó có cú hat-trick để đời ở trận chung kết rạng sáng 23-5. Cựu tuyển thủ Anh Joe Cole ca ngợi Lookman khi nói với TNT Sports: ""Lookman là một đứa trẻ đến từ Wandsworth, người từng chơi bóng đá đường phố, đi khắp các nhà nhưng không tìm thấy nơi nào là nhà... Cuối cùng đến Atalanta, cậu ấy đã tìm thấy một ngôi nhà ở đây. Họ sẽ yêu cậu ấy mãi mãi. Tên của cậu ấy sẽ được khắc vào lịch sử của CLB Atalanta"". ""Đây là đêm tuyệt vời nhất đời tôi"" Với màn trình diễn tuyệt vời ở trận chung kết Europa League, Lookman đã được trao danh hiệu ""Cầu thủ xuất sắc nhất trận"". Nắm chặt giải thưởng và nở nụ cười toe toét, tiền đạo người Nigeria cho biết: ""Đây là một trong những đêm tuyệt vời nhất trong cuộc đời tôi. Màn trình diễn tuyệt vời của đội. Chúng tôi làm được rồi. Tôi không có nhiều điều để nói. Tôi rất vui vì chúng tôi đã thắng ngày hôm nay. Đêm nay chúng tôi đã làm nên lịch sử"". Khi được hỏi về cảm giác của mình với thành phố Bergamo, Lookman cho biết: ""Tôi cảm nhận được sự ủng hộ từ người hâm mộ ngay từ phút đầu tiên tôi đến Bergamo. Thành phố Bergamo mang lại cho tôi cảm giác yên bình. Đó là một thành phố rất bình yên, thư thái và điều đó đã giúp ích rất nhiều cho lối sống của tôi"". Người cố vấn của Lookman cũng đã nói chuyện với TNT Sports sau trận đấu rằng: ""Tôi thực sự không thể diễn tả cho bạn biết cảm xúc của mình - cao ngất trời. Chúng tôi đã mơ về điều này từ lâu, kể từ khi Lookman còn là một cậu bé ở Waterloo.  Đêm nay giấc mơ đã trở thành hiện thực. Tôi đã khóc khi cậu ấy ghi bàn thắng thứ 3 vào lưới Leverkusen. Tôi rất mừng cho Lookman. Cậu ấy làm việc rất chăm chỉ và là chàng trai trầm tính. Đôi khi bị hiểu lầm vì tính trầm lặng nhưng Lookman là một đứa trẻ tuyệt vời"".",23/05/2024 11:25 GMT+7,https://tuoitre.vn/ademola-lookman-cau-be-khong-nha-ket-lieu-giac-mong-cua-leverkusen-20240523091145692.htm,"Với cú hat-trick vào lưới Leverkusen, tiền đạo 26 tuổi Ademola Lookman (Atalanta) đã đi vào lịch sử với tư cách cầu thủ đầu tiên lập hat-trick ở chung kết Europa League kể từ năm 1975."
Vì sao Công Phượng bị thay ra sau 16 phút đấu cho Yokohama?,"Tối 22-5, Công Phượng được tung vào sân ở phút 41. Đây là lần thứ 2 anh thi đấu cho Yokohama ở J-League Cup 2024. Đến phút 57, HLV Yomoda bất ngờ thay tiền đạo người Việt Nam ra sân. Công Phượng tranh thủ chạy nhanh khỏi sân do đội đang bị dẫn 1-2. Mặt anh có vẻ không thoải mái. Sau trận đấu, HLV trưởng Yomoda cho biết: ""Rất đáng tiếc là Công Phượng bị đau ở bắp chân"". CLB Yokohama sẽ kiểm tra chấn thương của cựu tiền đạo Hoàng Anh Gia Lai. Công Phượng chỉ chơi 16 phút nhưng có nhiều pha tranh chấp và va chạm với cầu thủ Nagoya Grampus ở khu vực giữa sân. Ở trận đấu này, Công Phượng chơi tiền vệ trung tâm. Anh xử lý ít chạm, chủ yếu là quay lưng về phía khung thành đội bạn khi nhận bóng. Công Phượng bị cầu thủ Nagoya ""chăm sóc"" rất kỹ. Phút 54, anh bị hai cầu thủ đối phương đốn ngã. Có thể sau pha bóng đó, anh bị đau. Phút 56, Công Phượng nhận bóng trong thế quay lưng từ thủ môn và bị anh này ra dấu nhanh chóng đưa bóng lên. Chấn thương khiến Công Phượng mất cơ hội tăng số phút thi đấu ở J-League Cup. Bên cạnh đó, Yokohama cũng thua 1-3 trước Nagoya và dừng chân ở vòng ba giải đấu này. Công Phượng sẽ chờ cơ hội ra sân khi Yokohama thi đấu vòng 2 Cúp Hoàng đế Nhật Bản vào ngày 12-6. Đối thủ của Yokohama chưa được xác định. Ở J-League 2, Công Phượng không được đăng ký thi đấu. Ngoài ra, Công Phượng bị chấn thương trước thời điểm đội tuyển Việt Nam chuẩn bị hội quân. Tân HLV trưởng HLV Kim Sang Sik đang đi tuyển quân và sẽ công bố danh sách trước ngày 1-6. Cơ hội cho Công Phượng trở lại đội tuyển Việt Nam vào tháng 6 này để chuẩn bị cho hai trận đấu tại vòng loại World Cup 2026 đang bỏ ngỏ.",23/05/2024 10:37 GMT+7,https://tuoitre.vn/vi-sao-cong-phuong-bi-thay-ra-sau-16-phut-dau-cho-yomoda-20240523095903634.htm,HLV Shuhei Yomoda tiết lộ tình trạng chấn thương của tiền đạo Nguyễn Công Phượng trong trận thua 1-3 của Yokohama FC trước Nagoya Grampus ở vòng 3 J-League Cup 2024.
HLV Alonso: Leverkusen đã có một đêm tồi tệ,"Leverkusen đã tạo nên một trong những chuyến phiêu lưu vĩ đại nhất ở mùa giải này, khi trải qua 51 trận bất bại liên tiếp trên mọi đấu trường. Đó là chuỗi kỷ lục dài nhất trong lịch sử của một đội bóng ở châu Âu. Đồng thời họ cũng vô địch Bundesliga với thành tích bất bại chưa từng có trong lịch sử. Nhưng hy vọng chấm dứt sự chờ đợi lâu dài cho vinh quang châu Âu của họ đã tan thành mây khói, với trận thảm bại đau đớn 0-3 trước Atalanta trên sân Aviva của Dublin. Đó là thất bại đầu tiên của họ kể từ ngày 27-5-2023. HLV Xabi Alonso tự hào về thành tích của đội mình trong năm qua, nhưng nói rằng trận thua ở chung kết Europa League là điều khó chấp nhận. Ông cho biết: ""Atalanta chơi tốt hơn chúng tôi và họ xứng đáng giành được cúp vô địch. Đây không phải là ngày của chúng tôi. Leverkusen đã có một đêm tồi tệ. Thật đau lòng khi điều đó lại xảy ra trong một trận đấu quan trọng như vậy. Những gì chúng tôi đạt được trong suốt một năm qua thật đặc biệt và nên tự hào. Nhưng thất bại ở chung kết như thế này, nó thật đau đớn"".  Alonso nói chi tiết hơn về trận chung kết: ""Chúng tôi đã không thể chơi như mong muốn. Sau bàn thua đầu tiên, Atalanta đã rất hưng phấn, họ thể hiện rất nhiều năng lượng trong lối chơi và Leverkusen không thể tìm ra giải pháp nào để chống lại điều đó"".  Trước mắt Leverkusen vẫn có cơ hội để giành thêm một danh hiệu nữa, khi họ gặp đội hạng hai Kaiserslautern trong trận chung kết Cúp quốc gia Đức vào ngày 26-5.  Nói với tờ TNT Sports, Alonso cho biết: ""Đạt được những gì chúng tôi có ở một câu lạc bộ như Leverkusen là điều tuyệt vời... Sau thất bại ở chung kết Europa League, Leverkusen muốn giành được Cúp quốc gia Đức, nó có ý nghĩa rất lớn"".",23/05/2024 08:04 GMT+7,https://tuoitre.vn/hlv-alonso-leverkusen-da-co-mot-dem-toi-te-20240523073555475.htm,"HLV Xabi Alonso nói rằng Leverkusen đã có một đêm tồi tệ, sau thất bại 0-3 trước Atalanta ở chung kết Europa League rạng sáng 23-5. Trận thua này cũng chấm dứt kỷ lục 51 trận bất bại liên tiếp của Leverkusen."
Tin tức thể thao sáng 23-5: Bayern Munich gây sốc với kế hoạch bổ nhiệm HLV Kompany?,"Bayern Munich gây sốc với HLV Kompany? Theo The Telegraph (Anh) đưa tin, gã khổng lồ nước Đức Bayern Munich đang đàm phán và dự kiến sẽ bổ nhiệm HLV Vincent Kompany thay thế ông Thomas Tuchel - người sẽ ra đi vào cuối mùa bóng năm nay.  Telegraph còn cho biết thêm, việc HLV Kompany đến Bayern Munich có thể được chính thức thông báo trong vài ngày tới. Bayern phải bồi thường cho Burnley một số tiền (tất nhiên không quá lớn) để có được HLV Kompany. Việc bổ nhiệm HLV Kompany có thể là động thái gây sốc của Bayern Munich bởi cựu cầu thủ người Bỉ chưa có kinh nghiệm dẫn dắt đội bóng lớn.  Thậm chí, ở các đội bóng nhỏ, HLV Kompany cũng gặp không ít khó khăn. Mùa bóng vừa qua, Burnley của HLV Kompany đã thi đấu không thành công khi rớt hạng ở Giải ngoại hạng Anh. Man United sa thải HLV Erik Ten Hag bất chấp kết quả chung kết FA Cup Theo báo chí Anh, Man United đang lên kế hoạch chia tay HLV Erik Ten Hag sau mùa bóng năm nay, bất chấp ""Quỷ đỏ"" có vô địch Cúp FA hay không. Báo chí Anh khẳng định Man United đang tìm kiếm HLV mới để thay ông Ten Hag. Dẫn đầu danh sách ứng viên ngồi vào ghế nóng ở Old Trafford là Kieran McKenna, HLV của Ipswich Town. Những cái tên như Roberto De Zerbi hay Mauricio Pochettino cũng được Man United nhắm đến. Djokovic kỷ niệm sinh nhật thứ 37 đáng nhớ Rạng sáng 23-5, tay vợt số 1 thế giới Novak Djokovic đã kỷ niệm sinh nhật lần thứ 37 bằng chiến thắng trước Yannick Hanfmann (Đức) 2-0 ở vòng 2 Giải quần vợt Geneva Open. Đây cũng là trận đấu thứ 1.100 trong sự nghiệp của Djokovic. Sau trận thắng Yannick Hanfmann, Djokovic nhận được chiếc bánh kem chúc mừng sinh nhật từ ban tổ chức Giải quần vợt Geneva Open. ",23/05/2024 05:54 GMT+7,https://tuoitre.vn/tin-tuc-the-thao-sang-23-5-bayern-munich-gay-soc-voi-ke-hoach-bo-nhiem-hlv-kompany-20240523054858279.htm,Bayern Munich gây sốc với HLV Kompany; Man United sa thảỉ HLV Erik Ten Hag bất chấp kết quả chung kết FA Cup... là những tin chính trong tin thể thao sáng 23-5.
