Title,Content,Date,Url,Summary
Giá vàng miếng SJC lên 91 triệu đồng/lượng,"Ngân hàng Nhà nước vừa thông báo sẽ tiếp tục tổ chức bán đấu thầu vàng miếng SJC vào ngày mai, 21-5. Tổng khối lượng vàng miếng dự kiến đấu thầu không đổi so với các phiên đấu thầu trước đó là 16.800 lượng vàng SJC. Khối lượng vàng miếng của một lô giao dịch là 100 lượng. Giá tham chiếu để tính giá đặt cọc là 88,6 triệu đồng/lượng, tăng 1,1 triệu đồng/lượng so với phiên đấu thầu trước đó. Thành viên tham gia đấu thầu sẽ phải tạm ứng 10% giá trị đấu thầu. Mỗi thành viên có thể đặt thầu tối thiểu là 5 lô, tương đương 500 lượng vàng miếng SJC, tối đa là 40 lô, tương đương 4.000 lượng. Đây là phiên đấu thầu vàng đầu tiên trong tuần này. Dự kiến còn một phiên đấu thầu nữa vào ngày 23-5. Sau bốn phiên đấu thầu thành công, Ngân hàng Nhà nước đã tung ra thị trường 27.200 lượng vàng miếng SJC, tương đương hơn 1 tấn vàng. Cuối ngày hôm nay, giá bán vàng miếng tại Công ty SJC tăng lên mức 91 triệu đồng/lượng, giá mua vào cũng tăng lên mức 89 triệu đồng/lượng. Tại các tiệm vàng, giá bán vàng miếng SJC cũng tăng lên mức 90,6 triệu đồng/lượng, mua vào 89,4 triệu đồng/lượng. Trong khi đó giá vàng nhẫn 9999 vẫn duy trì ở mức 77,45 triệu đồng/lượng, mua vào 75,75 triệu đồng/lượng. So với giá vàng thế giới quy đổi, giá vàng miếng SJC đang cao hơn 16,19 triệu đồng/lượng, giá vàng nhẫn cao hơn 2,64 triệu đồng/lượng. ",20/05/2024 19:00 GMT+7,https://tuoitre.vn/gia-vang-mieng-sjc-len-91-trieu-dong-luong-20240520184604069.htm,"Ngày mai, Ngân hàng Nhà nước lại đấu thầu vàng trong bối cảnh giá vàng miếng SJC cuối ngày hôm nay (20-5) đã lên mức 91 triệu đồng/lượng."
Nước mắt chảy dài ở vương quốc tôm hùm Phú Yên,"Chiều 20-5, ông Lâm Duy Dũng - phó chủ tịch UBND thị xã Sông Cầu - cho biết những ngày qua tôm hùm lại chết hàng loạt ở vùng nuôi được xem là ""vương quốc tôm hùm"" ở phía bắc thị xã này. Ở xã Xuân Thịnh đã có 160 hộ bị thiệt hại với khối lượng tôm hùm chết hơn 60 tấn. Lại nuôi tôm hùm quá dày Nguyên nhân tôm chết, theo bà Lê Thị Hằng Nga - phó chi cục trưởng Chi cục Thủy sản Phú Yên, là do nuôi quá dày. ""Nguyên nhân ban đầu do người dân nuôi trồng thủy sản quá dày đặc nên môi trường nước bị ô nhiễm, đồng thời gặp thời tiết nắng nóng kết hợp mưa dông dẫn đến môi trường nước thay đổi đột ngột, nên tôm chết hàng loạt"", bà Nga giải thích. Chi cục này đã vận động người dân khẩn trương vớt tôm đưa lên bờ để bán nhằm vớt vát được phần nào hay phần đó. Một lãnh đạo Sông Cầu thừa nhận mặc dù chính quyền vẫn thường xuyên khuyến cáo bà con thả nuôi tôm với mật độ vừa phải nhưng bà con vẫn thấy lợi trước mắt, đổ xô thả nuôi dày đặc nên vùng nuôi bị ô nhiễm, đồng thời nắng nóng khiến tảo có hại phát triển làm ngộp tôm. Cũng trong ngày 20-5, ông Lê Tấn Hổ - phó chủ tịch thường trực UBND tỉnh Phú Yên - đã đến các vùng nuôi tôm hùm bị chết hàng loạt để chỉ đạo khắc phục thiệt hại. Ông Hổ đề nghị người nuôi thu hoạch các loại tôm hùm, cá đã đạt kích cỡ thương phẩm để bán, giảm thiệt hại. Đồng thời, chính quyền địa phương hướng dẫn cho người nuôi không bỏ xác thủy sản chết tại các vùng nuôi mà đem vào xử lý để tránh ô nhiễm trên diện rộng. Phải kiểm soát chặt chẽ Theo bà Nga, để giảm thiểu rủi ro khi nuôi trồng thủy sản, người dân khi nuôi trồng thủy sản phải kiểm soát được mật độ thả nuôi, kiểm soát nguồn thức ăn, theo dõi tình hình thời tiết, trong quá trình nuôi phải có ý thức bảo vệ môi trường, thu gom thức ăn thừa. ""Các chất thải phát sinh trong quá trình nuôi trồng thủy sản phải đưa vào bờ để xử lý không được vứt bừa bãi ở vùng nuôi. Khi tôm hùm xảy ra bệnh dịch phải thu gom, xử lý theo quy định. Hiện Chi cục Thủy sản Phú Yên đang lập đề án nuôi trồng thủy sản của toàn tỉnh. Đồng thời khuyến cáo người nuôi tuân thủ quy hoạch, kế hoạch sử dụng đất mặt nước của địa phương để phát triển nuôi trồng thủy sản theo hướng bền vững"", bà Nga cho hay. Theo lãnh đạo Sông Cầu, sau khi đề án được ban hành thì công tác quản lý các hộ nuôi tôm hùm sẽ tốt hơn.",20/05/2024 19:28 GMT+7,https://tuoitre.vn/nuoc-mat-chay-dai-o-vuong-quoc-tom-hum-phu-yen-2024052012512883.htm,Hầu như năm nào tôm hùm ở Sông Cầu (tỉnh Phú Yên) cũng bị chết hàng loạt. Vậy làm sao để tránh?
"Dự án bệnh viện tại Đắk Nông: Bên tư vấn giám sát tố cáo, chủ đầu tư đề nghị cắt hợp đồng","Do nghi ngờ một gói thầu trong dự án sửa chữa, nâng cấp Bệnh viện Đa khoa Đắk Nông có giá thiết bị cao bất thường, thiếu minh bạch, đơn vị tư vấn giám sát là Công ty cổ phần Sản xuất thương mại và dịch vụ khoa học kỹ thuật Việt Nam có báo cáo gởi ngành chức năng đề nghị xem xét. Đơn vị giám sát: Giá thiết bị cao bất thường, thiếu minh bạch Đơn vị giám sát trúng thầu gói thầu tư vấn giám sát lắp đặt thiết bị (gói thầu số 15) có giá trị 596 triệu đồng, có nhiệm vụ giám sát gói thầu thi công xây dựng công trình, cung cấp, lắp đặt thiết bị xây dựng, văn phòng, thiết bị y tế (gói số 12, kinh phí 712 tỉ đồng, do Tổng công ty Xây dựng số 1 - CC1 trúng thầu). Gói thầu số 12 và 15 đều thuộc dự án sửa chữa, nâng cấp Bệnh viện Đa khoa tỉnh Đắk Nông, tổng vốn 753 tỉ đồng do Ban Quản lý các dự án đầu tư xây dựng tỉnh Đắk Nông (Ban A) làm chủ đầu tư. Trong đơn gửi ngành chức năng, đơn vị giám sát khẳng định các thiết bị, hàng hóa khi đưa đến chân công trình chưa có chứng thư giám định, một số hạng mục không có xuất xứ rõ ràng. Ngoài ra, bản vẽ kỹ thuật hệ thống xử lý nước thải đã được chủ đầu tư phê duyệt lại một số hạng mục, nhưng không kèm bảng dự toán đã được phê duyệt. Chủ đầu tư đã tổ chức họp nhiều lần và yêu cầu đơn vị giám sát phải ký nghiệm thu trên các hồ sơ chưa phù hợp pháp lý, nên đơn vị này không chấp nhận.  Khi có sự không thống nhất thì chủ đầu tư, nhà thầu thi công có thái độ, tác phong không phù hợp với cán bộ của đơn vị giám sát… ""Ngành chức năng tỉnh Đắk Nông cần xem xét lại về giá trang thiết bị, vật liệu cao bất thường, xuất xứ hàng hóa không rõ ràng, tránh thiệt hại kinh phí Nhà nước"", đơn vị giám sát đề nghị. Chủ đầu tư: Giá mua thiết bị thấp hơn báo giá Trong khi đó, ông Nguyễn Văn Nghĩa - giám đốc Ban A - cho hay dự án xây dựng và nâng cấp Bệnh viện Đa khoa tỉnh Đắk Nông khởi công ngày 13-12-2022, dự kiến hoàn thành trong 3 năm, với tổng vốn 753 tỉ đồng, quy mô 700 giường bệnh.  Dự án đã bố trí 481 tỉ đồng, giải ngân được 340 tỉ đồng. Phần xây dựng dự án đã đạt khoảng 27% khối lượng, phần lắp đặt thiết bị chưa thực hiện. Ông Nghĩa nói thêm khi đơn vị giám sát có các văn bản nêu nghi ngờ về các thiết bị không có nhãn mác rõ ràng, giá cao bất thường, Ban A đã mời họp nhưng đơn vị này không cử cán bộ dự họp mà tiếp tục có văn bản tương tự. Theo ông, các thiết bị xây dựng, y tế đã được đơn vị tư vấn thiết kế xây dựng dựa trên quy mô, yêu cầu và được ngành chức năng kiểm tra, phê duyệt. Đối với một số thiết bị xây dựng, nhà thầu chưa nêu nhãn hiệu nhưng các thông số kỹ thuật, cấu hình đáp ứng theo hồ sơ mời thầu và sẽ được các bên liên quan xác nhận, chấp thuận để được triển khai thi công thực tế. Để giải quyết khó khăn, chủ đầu tư đã mời họp, tháo gỡ nhưng đơn vị giám sát không tham gia, buộc chủ đầu tư phải có phụ lục hợp đồng ghi rõ các thiết bị (đối với các thiết bị mới, không đúng như hồ sơ thiết kế - PV) với đủ cấu hình, thông số kỹ thuật là không cần thiết và phát sinh nhiều thủ tục rườm rà. Cũng theo ông Nghĩa, về việc đơn vị giám sát cho rằng một số loại thiết bị có giá chênh lệch cao hơn 100 lần so với giá thị trường là không có căn cứ, chủ quan. Ông ví dụ thiết bị màng MBR có giá hợp đồng là 2,382 tỉ đồng/2 hệ thống. Đơn vị giám sát cho rằng giá của thiết bị này chỉ 1,368 tỉ đồng (tham khảo nhà cung cấp Công ty Môi Trường Xanh). Ban A đã tham khảo thực tế chính nhà cung cấp này thì thiết bị có giá hơn 2,577 tỉ đồng, cao hơn giá trong hợp đồng gần 200 triệu đồng. Hay như máy xét nghiệm nước tiểu, đơn vị giám sát cho rằng chỉ 95 triệu đồng/máy thì khi khảo sát chính những doanh nghiệp đã tham khảo, chủ đầu tư được cung cấp mức giá là 185 triệu đồng (báo giá ngày 15-4), trong khi giá hợp đồng đã ký chỉ 173 triệu đồng.",20/05/2024 18:58 GMT+7,https://tuoitre.vn/du-an-benh-vien-tai-dak-nong-ben-tu-van-giam-sat-to-cao-chu-dau-tu-de-nghi-cat-hop-dong-20240519145412504.htm,"Một đơn vị tư vấn giám sát đã gửi báo cáo đến nhiều cơ quan chức năng tỉnh Đắk Nông vì nghi giá thiết bị cao bất thường, có dấu hiệu sai phạm."
Thép Trung Quốc nhập khẩu giá mềm lại đe dọa thị trường Việt,"Dòng thép giá rẻ ồ ạt vào Việt Nam Ngành thép Việt Nam đang gặp nhiều khó khăn, trong đó nguy cơ bị bóp nghẹt bởi thép nhập khẩu, nhất là lượng thép Trung Quốc đang ngày càng nhiều. Số liệu mới nhất từ Tổng cục Hải quan cho thấy trong tháng 4-2024, sản lượng thép cán nóng (HRC) nhập khẩu vào Việt Nam tăng mạnh với 890.000 tấn, hơn 1,5 lần so với sản xuất nội địa, trong đó thép HRC Trung Quốc chiếm 71%. Lũy kế 4 tháng đầu năm 2024, thép nhập khẩu vào Việt Nam là 3,9 triệu tấn, tăng 32% so với cùng kỳ năm ngoái và bằng 159% sản lượng của các doanh nghiệp thép nội địa đang sản xuất thép HRC. Trong đó, lượng nhập từ Trung Quốc chiếm 73% tổng số lượng nhập khẩu 2,9 triệu tấn, gấp hơn 2 lần cùng kỳ năm 2023. Doanh nghiệp sản xuất thép cho rằng thép nhập khẩu tiếp tục vào Việt Nam với số lượng lớn, không phải chịu bất kỳ biện pháp phòng vệ thương mại nào là một nghịch lý. Chưa kể, xu hướng thép Trung Quốc có dấu hiệu cạnh tranh không lành mạnh về giá. Chẳng hạn cùng loại mặt hàng thép HRC, Trung Quốc luôn bán rẻ hơn nhiều quốc gia khác để xuất khẩu sang Việt Nam, giá nhập khẩu HRC từ Trung Quốc 4 tháng đầu năm luôn thấp hơn giá bình quân so với các thị trường khác từ 32 - 59 USD/tấn. Nếu so sánh riêng với thép HRC nhập từ Hàn Quốc, thép cán nóng từ Trung Quốc thấp hơn đến 123 USD/tấn. Tại Việt Nam, các doanh nghiệp như Hòa Phát, Tôn Hoa Sen, Tôn Đông Á... sản xuất đa dạng sản phẩm từ thép xây dựng, thép cuộn cán nóng, cán nguội, tôn mạ đáp ứng nhu cầu trong nước và xuất khẩu sang Mỹ, châu Âu, Canada, Nhật Bản, Hàn Quốc. Do đó, việc thép nhập khẩu ồ ạt vào thị trường nội địa, ngành sản xuất thép gặp khó ngay trên sân nhà. Ứng phó ra sao với thép nhập khẩu? Thép là mặt hàng quan trọng, đầu vào cho nhiều ngành khác, đặc biệt liên quan tới công nghiệp quốc phòng. Một doanh nghiệp sản xuất thép cho rằng gia tăng nhập khẩu thép, chắc chắn ngành sản xuất trong nước sẽ gặp khó, từ đó không tự chủ được sản xuất các sản phẩm hạ nguồn khác. Thép HRC là nguyên liệu thượng nguồn sản xuất các sản phẩm tôn thép mạ kẽm, mạ lạnh, mạ màu, ống thép, các sản phẩm thép khác được sử dụng trong nhiều ứng dụng của ngành xây dựng, cơ khí và các ngành công nghiệp khác. Cơ quan chức năng Việt Nam đang tiến hành tổng hợp, thẩm định hồ sơ về đề nghị của doanh nghiệp trong nước điều tra chống bán phá giá thép Trung Quốc. Trong khi đó, nhiều nước đang áp dụng các chính sách phòng vệ thương mại đối với sản phẩm nhập khẩu từ Trung Quốc. Thái Lan đang tiến hành điều tra và xem xét triển khai các biện pháp chống bán phá giá đối với một số công ty thép cuộn cán nóng từ Trung Quốc, do thép nhập giá rẻ tràn ngập khiến doanh nghiệp thép Thái Lan chỉ sản xuất được 30% công suất, thấp hơn mức trung bình 58% của Đông Nam Á. Mới đây ngày 16-5, Ủy ban châu Âu (EC) bắt đầu điều tra áp dụng thuế chống bán phá giá đối với thép cuộn nhập từ Trung Quốc, nếu phát hiện hàng nhập khẩu đó đang bị bán phá giá và gây thiệt hại cho ngành công nghiệp địa phương. Theo các chuyên gia kinh tế, biện pháp phòng vệ thương mại sẽ là công cụ nhằm mục đích bảo vệ doanh nghiệp sản xuất nội địa, trước các hành vi cạnh tranh không lành mạnh của hàng hóa nhập khẩu. Nếu không có sự bảo vệ hợp lý và hợp pháp này, ngành sản xuất trong nước khó có thể cạnh tranh với hàng nhập khẩu và dẫn tới nguy cơ bị triệt tiêu.",20/05/2024 17:09 GMT+7,https://tuoitre.vn/thep-trung-quoc-nhap-khau-gia-mem-lai-de-doa-thi-truong-viet-20240520153455334.htm,"Xu hướng nhập khẩu thép Trung Quốc đang tăng trở lại, đe dọa sản xuất trong nước. Nhiều quốc gia đang tiến hành điều tra và mở rộng các biện pháp chống bán phá giá đối với thép cuộn cán nóng từ Trung Quốc."
Phạt 21 triệu đồng cơ sở bánh mì chảo có pate lúc nhúc giòi,"Trao đổi với Tuổi Trẻ Online ngày 21-5, một lãnh đạo UBND thành phố Thái Bình cho biết sau quá trình kiểm tra, thành phố đã ban hành quyết định xử phạt vi phạm hành chính đối với hộ kinh doanh bánh mì chảo Cột Điện Quán, địa chỉ tại Lô MG1-06, khu Vincom Shophouse, phường Đề Thám, tổng số tiền 21 triệu đồng. Đây là cơ sở kinh doanh bánh mì chảo mà trước đó thực khách ghi lại hình ảnh, tố việc có giòi lúc nhúc trên miếng pate đăng lên mạng xã hội gây xôn xao dư luận. Trước đó, ngay sau khi xảy ra sự việc, ban quản trị của chuỗi cửa hàng bánh mì chảo Cột Điện Quán cũng đã thống nhất đình chỉ vĩnh viễn cơ sở tại Thái Bình khi để xảy ra sự việc trên. Theo quyết định xử phạt vi phạm hành chính, cơ quan chức năng xác định hộ kinh doanh đã có các hành vi vi phạm như: kinh doanh dịch vụ ăn uống không có giấy chứng nhận cơ sở đủ điều kiện an toàn thực phẩm quy định tại Khoản 1, Điều 18, Nghị định 115/2018/NĐ-CP ngày 4-9-2018 của Chính phủ. Đồng thời, cơ sở này còn vi phạm quy định về điều kiện bảo đảm an toàn thực phẩm theo quy định của pháp luật trong kinh doanh dịch vụ ăn uống tại Điểm d, Khoản 4, Điều 15, Nghị định 115/2018/NĐ-CP. Căn cứ mức độ vi phạm, UBND thành phố Thái Bình ra quyết định xử phạt hộ kinh doanh bánh mì chảo trên 21 triệu đồng, đồng thời đình chỉ toàn bộ hoạt động sản xuất, chế biến, kinh doanh, cung cấp thực phẩm của đơn vị này trong hai tháng. Như Tuổi Trẻ Online phản ánh trước đó, mạng xã hội xuất hiện đoạn video ghi lại ít nhất 3 chảo đồ ăn với pate lúc nhúc giòi vẫn còn đang ngọ nguậy, thực khách tá hỏa rời đi, từ chối dùng bữa dù nhân viên ngỏ ý đổi đồ mới. Ngay sau sự cố này, hệ thống bánh mì chảo Cột Điện Quán có ra thông báo về việc đình chỉ hoạt động đối với cơ sở Cột Điện Quán chi nhánh Thái Bình cho đến khi làm rõ nguyên nhân của việc không đảm bảo vệ sinh an toàn thực phẩm.",21/05/2024 16:24 GMT+7,https://tuoitre.vn/phat-21-trieu-dong-co-so-banh-mi-chao-co-pate-luc-nhuc-gioi-20240521153710044.htm,"UBND thành phố Thái Bình, tỉnh Thái Bình quyết định xử phạt hành chính 21 triệu đồng đối với cơ sở bánh mì chảo đưa pate lúc nhúc giòi cho thực khách."
