Title,Content,Date,Url,Summary
HLV Kim Sang Sik: Sẽ cố gắng hết sức để thắng Indonesia,"Chiều 21-5, lễ bốc thăm ASEAN Cup 2024 đã diễn ra tại Hà Nội. Lá thăm may rủi đưa đội tuyển Việt Nam vào bảng B cùng Indonesia, Philippines, Myanmar và Lào. Ở bảng A, Thái Lan có phần dễ thở hơn khi đối thủ của họ chỉ là Malaysia, Singapore, Campuchia và Timor Leste/Brunei. Đội tuyển Việt Nam hướng tới ngôi vô địch Trong các đối thủ của đội tuyển Việt Nam tại bảng B, Indonesia được đánh giá khó nhằn nhất. Trong 3 trận gần nhất gặp Indonesia (2 trận ở vòng loại thứ 2 World Cup 2026 và 1 trận tại Asian Cup), tuyển Việt Nam đều nhận thất bại. Phát biểu với truyền thông ngay sau lễ bốc thăm, HLV Kim Sang Sik cho biết: ""Gần đây thành tích đối đầu của đội tuyển Việt Nam với Indonesia không được tốt. Nhưng nếu chúng ta chuẩn bị tốt ngay từ bây giờ, tôi nghĩ hoàn toàn có thể bù đắp lại những gì đã xảy ra. Chúng tôi sẽ cố gắng hết sức để giành chiến thắng"". Nói thêm về các đối thủ còn lại, vị HLV người Hàn Quốc đánh giá cao đội tuyển Philippines khi đã có sự bổ sung nhân tố mới. Ban huấn luyện đội tuyển Việt Nam sẽ nghiên cứu để có cách đối phó. Khi được hỏi về mục tiêu của đội tuyển Việt Nam tại ASEAN Cup 2024, ông Kim Sang Sik nêu quan điểm:  ""Mục tiêu ở mọi giải đấu của tôi luôn là chiến thắng và hướng tới chức vô địch. Dù các đối thủ không dễ dàng gì, nhưng như tôi đã nói, nếu có sự chuẩn bị tốt, chúng ta hoàn toàn có cơ hội chiến thắng trước mọi đối thủ. Chúng tôi sẽ chuẩn bị tốt để có thể hướng tới mục tiêu vô địch"". HLV Kim Sang Sik tham vấn từ ông Park Hang Seo Ông Kim cũng chia sẻ thêm về những kế hoạch cho đội tuyển Việt Nam khi tập trung vào đầu tháng 6 tới chuẩn bị cho vòng loại thứ 2 World Cup 2026. Ông nói: ""Tôi có đôi chút hồi hộp vì sự kỳ vọng của người hâm mộ. Tôi sẽ phải nghiên cứu, tìm ra phương án huấn luyện các cầu thủ hoàn thành mục tiêu. Tôi sẽ cố gắng giúp các cầu thủ thi đấu như một tập thể thống nhất, đem đến cho người hâm mộ Việt Nam những màn trình diễn đẹp mắt, xứng đáng được nhận sự tán dương"". Khi được hỏi về người tiền nhiệm HLV Park Hang Seo từng có rất nhiều thành công với bóng đá Việt Nam, ông Kim cho hay: ""Ông ấy là người hùng bóng đá của Việt Nam. Tôi rất tôn trọng và kính nể ông Park. Vì nền bóng đá Việt Nam và vì các cổ động viên Việt Nam, tôi sẽ cố gắng hết sức và cũng sẽ xin những lời khuyên từ HLV Park khi cần để tạo nên một đội tuyển tốt nhất có thể"".",21/05/2024 16:24 GMT+7,https://tuoitre.vn/hlv-kim-sang-sik-se-co-gang-het-suc-de-thang-indonesia-20240521160134933.htm,"HLV trưởng Kim Sang Sik tự tin nếu đội tuyển Việt Nam có sự chuẩn bị chu đáo ngay từ bây giờ, chúng ta sẽ có kết quả tốt trước Indonesia và đạt thành tích tại ASEAN Cup 2024."
Báo Indonesia gọi việc nằm cùng bảng với Việt Nam là 'bảng tử thần',"Chiều 21-5, lễ bốc thăm chia bảng ASEAN Cup 2024 đã diễn ra tại Hà Nội. Theo đó, bảng B có sự góp mặt của các đội Việt Nam, Indonesia, Philippines, Myanmar và Lào. Đáng nói, cả ba đội Việt Nam, Indonesia và Philippines vốn không xa lạ nhau. Hiện tại cả ba đang nằm chung bảng tại vòng loại 2 World Cup 2026 khu vực châu Á. Đánh giá về kết quả bốc thăm, tờ Okezone (Indonesia) gọi bảng B là ""bảng tử thần"" của ASEAN Cup 2024. Tờ này đánh giá Việt Nam, Philippines đều là những đối thủ khó chịu cho dù tuyển Indonesia đã có nhiều kết quả tích cực trước họ trong thời gian gần đây. ""Câu hỏi lúc này là liệu HLV Shin Tae Yong có thể đưa Indonesia lên ngôi vô địch ASEAN Cup (trước đây là AFF Cup) hay không? Từ năm 1996 đến nay, bóng đá của chúng ta chưa từng có được chiếc cúp danh giá nhưng đã có tới 6 lần về nhì"", Okezone đặt dấu hỏi trong bối cảnh rơi vào ""bảng tử thần"". Tờ Vivagoal thì cho rằng Indonesia sẽ không dễ dàng đánh bại tuyển Việt Nam giống như 3 lần đối đầu gần nhất trong năm 2024. Lý do là bởi ASEAN Cup không thuộc FIFA Days, vì vậy HLV Shin Tae Yong khó có thể triệu tập các cầu thủ đang thi đấu ở châu Âu. Báo Sindonews thì thận trọng nhận xét rằng Việt Nam là một trong những ứng viên vô địch cùng với Thái Lan. Tuy nhiên, cây viết Rachmansyah cũng cho rằng tuyển Indonesia đang có sự tự tin sau thành công gần đây. Về phía bảng A, đương kim vô địch Thái Lan nằm cùng bảng với Malaysia, Singapore, Campuchia và đội thắng tại vòng loại giữa Timor Leste/Brunei. Tờ Siamsport của Thái Lan nhận xét đây là bảng đấu nhẹ hơn khá nhiều so với bảng B.",21/05/2024 15:42 GMT+7,https://tuoitre.vn/bao-indonesia-goi-viec-nam-cung-bang-voi-viet-nam-la-bang-tu-than-20240521153424808.htm,Báo chí Indonesia đánh giá kết quả bốc thăm ASEAN Cup 2024 ngày 21-5 là khá nặng với đội tuyển nước này.
Xem trực tiếp điền kinh Việt Nam tranh vé dự Olympic Paris 2024,"Giải điền kinh tiếp sức châu Á 2024 diễn ra trong hai ngày 20 và 21-5 tại Bangkok (Thái Lan) và được tính như vòng loại Olympic Paris 2024. Ở ngày thi đấu đầu tiên, tổ tiếp sức 4x400m hỗn hợp nam nữ điền kinh Việt Nam đã thi đấu xuất sắc để giành huy chương đồng, phá kỷ lục quốc gia tại Giải điền kinh tiếp sức châu Á 2024. Các vận động viên Nguyễn Xuân Quang, Lê Thị Tuyết Mai, Lê Ngọc Phúc, Quách Thị Lan về thứ ba chung cuộc với thành tích 3 phút 18,45 giây. Thông số này cũng phá kỷ lục quốc gia cũ là 3 phút 19,5 giây được lập tại Philippines vào năm 2019. Bước sang ngày thi đấu thứ 2 hôm nay 21-5, sự chú ý tập trung vào tổ tiếp sức 4x400m nữ. Đây là nội dung duy nhất của điền kinh Việt Nam được hy vọng có cơ hội giành vé chính thức đến Olympic Paris 2024. Tổ đấu có 4 chân chạy chính: Quách Thị Lan, Nguyễn Thị Hằng, Nguyễn Thị Ngọc, Hoàng Thị Minh Hạnh và Lê Thị Tuyết Mai ở vai trò dự bị. Để thực hiện mục tiêu giành suất trực tiếp đến Thế vận hội mùa hè 2024, các cô gái Việt Nam phải lọt vào top 16 đội tuyển hàng đầu thế giới. Theo bảng thống kê thành tích tính suất dự Olympic 2024 của Liên đoàn Điền kinh thế giới (IAAF), tính đến ngày 20-5, tổ tiếp sức 4x400m nữ Việt Nam đang xếp hạng 29 với thông số 3 phút 31,61 giây - đạt được tại Asiad 19. Các cô gái Việt Nam cần rút ngắn thông số ít nhất 4 giây để cạnh tranh với đội đang xếp thứ 16 thế giới là Nigeria (thành tích 3 phút 27,29 giây) và đội xếp thứ 15 là Cuba (thành tích 3 phút 26,08 giây). Ở các nội dung khác, điền kinh Việt Nam sẽ tham dự hai nội dung tiếp sức 4x100m nữ và tiếp sức 4x400m nam. Tổ tiếp sức 4x100m nữ gồm các vận động viên: Hà Thị Thu, Lê Thị Cẩm Tú, Kha Thanh Trúc, Phùng Thị Huệ. Trong khi tổ tiếp sức 4x400m nam có: Trần Đình Sơn, Trần Nhật Hoàng, Lê Ngọc Phúc, Nguyễn Xuân Quang, Nguyễn Tùng Lâm. Ngoại trừ Hà Thị Thu, Trần Nhật Hoàng và Nguyễn Tùng Lâm đã có kinh nghiệm thi đấu quốc tế trong màu áo đội tuyển điền kinh Việt Nam, những chân chạy còn lại đều là tài năng trẻ được kỳ vọng sẽ sớm bứt phá.",21/05/2024 11:20 GMT+7,https://tuoitre.vn/xem-truc-tiep-dien-kinh-viet-nam-tranh-ve-du-olympic-paris-2024-20240521110331405.htm,"Tối 21-5, tổ tiếp sức 4x400m nữ Việt Nam bước vào tranh tài tại Giải điền kinh tiếp sức châu Á 2024 với hy vọng giành được suất chính thức tham dự Olympic Paris 2024."
Vòng 20 V-League 2023-2024: Căng thẳng né play-off,"""Chung kết ngược"" trên sân Pleiku Sau chuỗi 9 trận bất bại, thua 0-2 trước chủ nhà Hà Nội ở vòng 19, CLB HAGL đã trở lại với nỗi lo trụ hạng. Hiện khoảng cách giữa HAGL với SLNA chỉ còn 3 điểm. Muốn không bị đối thủ bắt kịp, CLB HAGL (22 điểm) phải đánh bại Hồng Lĩnh Hà Tĩnh (HLHT, 24 điểm) để thoát khỏi vùng nguy hiểm. Ở trận lượt đi, CLB HLHT đã khiến tân HLV Vũ Tiến Thành có màn ra mắt buồn khi thắng HAGL 1-0. Giờ đây, HLHT đang cho thấy những dấu hiệu tích cực sau khi 5 cầu thủ bị bắt và khởi tố vì sử dụng trái phép chất ma túy. Cụ thể, ở hai trận gần nhất, HLHT đã hòa CLB Hà Nội 2-2 và thắng CLB TP.HCM 2-1. Tuy nhiên, HLV Nguyễn Thành Công đang đau đầu khi vắng 2 trụ cột Viết Triều và Đình Tiến do đã nhận đủ 3 thẻ vàng ở trận gặp chủ nhà HAGL này. Trên sân nhà, HLV Vũ Tiến Thành liệu có thay đổi lối chơi phòng ngự phản công bằng lối chơi tấn công trước HLHT để hướng tới chiến thắng? Câu hỏi này đặt ra do trong 4 trận còn lại trên sân nhà, so với Thanh Hóa, Bình Định và Hải Phòng, HLHT là đối thủ yếu nhất để HAGL có thể giành trọn 3 điểm. Khó khăn chờ đón CLB TP.HCM tại Hai chuyến làm khách trước SLNA và HLHT, CLB TP.HCM chỉ giành được 1 điểm trên sân Vinh. Kết quả này khiến họ tụt xuống vị trí 11/14 đội với 23 điểm. Nguy cơ rơi xuống vị trí thấp hơn càng hiện rõ nếu chủ nhà CLB TP.HCM không thể giành ít nhất 1 điểm trước đương kim vô địch Công An Hà Nội (CAHN). Vừa thua ""muối mặt"" 1-4 trước chủ nhà B.Bình Dương ở vòng 19, CAHN đang rất cần một chiến thắng để lấy lại thể diện và khi cuộc đua vô địch cũng vẫn còn chút hy vọng sau khi đội đầu bảng Nam Định thua Thể Công Viettel 1-2. Với lực lượng trội hơn, dù vắng Văn Thanh vì án kỷ luật, chiến thắng là điều không khó với CLB CAHN. Trong khi đó, CLB TP.HCM khó lại càng thêm khó khi mất hậu vệ Hạ Long và tiền đạo Patino vì thẻ phạt. Tương tự, CLB Quảng Nam phải nỗ lực có điểm trước B.Bình Dương - đội đang xếp thứ 2 trên bảng xếp hạng. Dù chỉ đặt mục tiêu tốp 3, nhưng B.Bình Dương cũng sẽ không bỏ lỡ cơ hội vô địch nếu cờ đến tay, nhất là khi chỉ kém Nam Định 6 điểm. Chiến thắng trước chủ nhà Quảng Nam sẽ giúp B.Bình Dương tiếp tục bám đuổi, thậm chí là rút ngắn khoảng cách nếu như CLB Nam Định không thắng được Hải Phòng ở vòng này. Đánh bại Quảng Nam là điều B.Bình Dương hoàn toàn có thể làm được khi 2 tiền đạo của họ là Tiến Linh và Bùi Vĩ Hào đang có phong độ rất ấn tượng và liên tục ghi bàn. Ở tình thế các đội xếp sau đang phả hơi nóng vào gáy, CLB Quảng Nam không cho phép mình sẩy chân. Chơi trên sân Hòa Xuân, đoàn quân của HLV Văn Sỹ Sơn từng đánh bại CAHN 2-0 ở vòng 17. Vì vậy, họ sẽ nỗ lực đánh bại B.Bình Dương nhằm an tâm trong cuộc đua trụ hạng.",21/05/2024 08:56 GMT+7,https://tuoitre.vn/vong-20-v-league-2023-2024-cang-thang-ne-play-off-20240521080837688.htm,"Ngoài đội chót bảng Khánh Hòa gần như cầm chắc vé xuống hạng trực tiếp, suất đá play-off giờ là cuộc chiến với ít nhất 6 CLB ở nửa cuối bảng xếp hạng. Vòng 20 V-League 2023-2024 diễn ra vào chiều nay (21-5) vì thế hứa hẹn rất căng thẳng."
Premier League vẫn là giải đấu số 1,"Đầu mùa giải, Hãng thống kê Opta đưa ra dự đoán về bảng xếp hạng chung cuộc như sau: 1.Man City, 2.Arsenal, 3.Liverpool, 4.Man United, 5.Newcastle, 6.Chelsea, 7.Tottenham... Những kết quả không ngoài dự đoán Đó là một trong những dự đoán chuẩn xác nhất khi 3 vị trí đầu bảng hoàn toàn trùng khớp với đánh giá từ dữ liệu máy tính của Opta. Sự trỗi dậy của Aston Villa và màn sa sút của Man United là những biến số mà Opta không thể lường trước được. Ở phần còn lại, Opta nhìn chung đã đánh giá đúng thực lực của các đội bóng xếp sau. Newcastle, Chelsea, Tottenham có phong độ gần tương tự như nhận định. Còn nhóm các đội từ hạng 10 đến 16 gần như trùng khớp với dự đoán của Opta. Khác biệt đáng kể nhất có lẽ chỉ là việc Opta dự đoán Bournemouth rớt hạng thay vì Burnley. Thật ra, dữ liệu máy tính cũng đã nhìn nhận Man United sẽ sa sút ở mùa này, khi dự đoán họ rớt 1 bậc so với mùa trước (hạng 3). Vấn đề chỉ là ""quỷ đỏ""... quá tệ so với suy nghĩ của mọi người. Newcastle, Chelsea và Tottenham đều tràn trề hy vọng nằm trong top 4 khi mùa giải bắt đầu.  Nhưng nhìn chung, họ vẫn là những đội bóng còn yếu kém về nhiều mặt để được xem là ""đại gia"". Cụ thể, Tottenham thiếu lực lượng. Newcastle thiếu một HLV dày dạn kinh nghiệm. Chelsea thừa tài lực, truyền thống nhưng lại xây dựng một đội bóng quá nhiều cầu thủ trẻ và mắc nhiều sai lầm trong chuyển nhượng. Những nét lãng mạn Trong bối cảnh cả 4 đội bóng mạnh kể trên đều gặp khó khăn, Aston Villa đã vươn lên đúng thời điểm và tạo nên nét lãng mạn thú vị nhất. Đầu mùa, họ đón nhiều tin buồn khi nhiều trụ cột dính chấn thương dài hạn. Nhưng với mẫu HLV như Unai Emery, tình cảnh khó khăn càng giúp ông bộc lộ tài năng. Aston Villa bước vào top 4 từ vòng 13. Và họ thành công giữ vững vị trí của mình đến cuối mùa. Arsenal trở thành đối tượng bị châm chọc khi để Man City vượt mặt vào giai đoạn cuối mùa. Nhưng nhìn chung, ""pháo thủ"" vẫn đang duy trì đà tiến bộ. So với mùa trước, Arsenal giành nhiều hơn 5 điểm (89 so với 84), đã đua tranh với Man City đến phút cuối cùng đồng thời cũng có thành tích khá tốt ở đấu trường châu lục. Dù thất bại nhưng Arsenal lúc này vẫn tạo ra cảm giác rằng họ sẽ còn tiến bộ trong những năm tới. Và Man City không thể hùng mạnh mãi mãi. Tâm điểm của vòng đấu cuối Một khoảnh khắc đầy cảm xúc đã xuất hiện trong cuộc họp báo sau khi Man City vô địch. HLV Pep Guardiola khi được hỏi về người đồng nghiệp Jurgen Klopp đã tỏ ra xúc động, đến mức gần như rơi nước mắt. ""Tôi sẽ rất nhớ ông ấy. Jurgen là một phần quan trọng trong cuộc đời tôi. Ông ấy đưa tôi đến một đẳng cấp khác"", Guardiola nói.  Trước đó một ngày, Klopp cũng chia sẻ rằng ông luôn tin Guardiola là ""HLV giỏi nhất"", và ""dù có đối mặt 115 cáo buộc đi nữa, ông ấy vẫn là người giỏi nhất. Hãy thử đặt ai khác vào vị trí của ông ấy, sẽ không có kỳ tích vô địch 4 lần liên tiếp"".  Trong sự xúc động, Guardiola đã thừa nhận rằng mình may mắn hơn đồng nghiệp. ""Cá nhân Jurgen Klopp cũng hiểu rằng một mình tôi không thể tạo nên thành tích này. Đội bóng này đã mang đến cho tôi rất nhiều lợi thế"", Pep nói.  Và đây có lẽ là lần duy nhất trong sự nghiệp, HLV Guardiola thừa nhận (một cách ẩn ý) rằng ông may mắn khi dẫn dắt một đội bóng giàu có, sở hữu nhiều lợi thế. Jurgen Klopp là người duy nhất có thể chia sẻ sự chú ý của người hâm mô toàn cầu trong buổi tối 19-5. Buổi lễ tri ân ông kéo dài 1 giờ với rất nhiều khoảnh khắc xúc động. Nhưng khoảnh khắc thú vị nhất có lẽ là khi Klopp bước lên sân khấu và bắt nhịp câu hát cổ vũ: ""Arne Slot, Arne Slot, lalala""... Arne Slot sẽ là tân HLV trưởng mùa tới của Liverpool. Trong giây phút cuối cùng đứng giữa Anfield, ông Klopp vẫn không thôi nghĩ về tương lai của Liverpool!",21/05/2024 12:47 GMT+7,https://tuoitre.vn/premier-league-van-la-giai-dau-so-1-20240521091413918.htm,"Man City lại vô địch, Arsenal lại về nhì, M.U trở lại chu kỳ bết bát. Và những đội bóng vừa thăng hạng lập tức xuống hạng. Premier League mùa giải 2023-2024 không có nhiều bất ngờ, nhưng vẫn là giải đấu cuốn hút..."
"Lịch trực tiếp vòng 20 V-League 2024: Xem Nam Định, Bình Dương đua vô địch","Kết thúc vòng 19 V-League 2023-2024, Nam Định có trong tay 39 điểm, tiếp tục dẫn đầu bảng xếp hạng. Tuy nhiên họ đã bị đội đứng thứ 2 là Bình Dương rút ngắn điểm số xuống còn 6 điểm. Cuộc đua vô địch vì vậy trở nên hấp dẫn hơn bao giờ hết. Ở vòng 20, Bình Dương sẽ đến làm khách trên sân của Quảng Nam. Chủ nhà đang có phong độ không tốt và được đánh giá thấp hơn Bình Dương khá nhiều. Đây là cơ hội để thầy trò HLV Lê Huỳnh Đức giành trọn ba điểm. Nếu đánh bại Quảng Nam, Bình Dương sẽ gây sức ép lớn lên Thép Xanh Nam Định - đội thi đấu vào ngày mai. Vòng này, Nam Định được đá trên sân nhà nhưng phải tiếp đón đối thủ khá xương là Hải Phòng. Sau thất bại trước Thể Công - Viettel, các CĐV Nam Định chờ đợi đội nhà sẽ trở lại mạnh mẽ. Tuy nhiên, Hải Phòng luôn ra sân với tinh thần quyết tâm và rực lửa hứa hẹn sẽ là thử thách lớn cho Nam Định. Ngoài hai trận đấu nói trên, vòng 20 V-League còn có những trận đấu đáng chú ý khác: Hoàng Anh Gia Lai - Hà Tĩnh, Hà Nội - Thanh Hóa, TP.HCM - Công An Hà Nội, Khánh Hòa - Thể Công Viettel, và Bình Định - Sông Lam Nghệ An. Trong đó, Hoàng Anh Gia Lai, Sông Lam Nghệ An đang mấp mé bờ vực rớt hạng rất cần điểm để trụ hạng.",21/05/2024 06:24 GMT+7,https://tuoitre.vn/lich-truc-tiep-vong-20-v-league-2024-xem-nam-dinh-binh-duong-dua-vo-dich-20240521061851496.htm,Vòng 20 V-League sẽ diễn ra trong 2 ngày 21 và 22-5 với tâm điểm là cuộc đua vô địch giữa Bình Dương và Nam Định.
Cựu danh thủ Lê Công Vinh: Indonesia là đội bóng khó đánh bại,"Lê Công Vinh là chân sút giữ kỷ lục ghi nhiều bàn thắng nhất cho đội tuyển Việt Nam với 51 bàn thắng trong 83 trận. Anh chia tay đội tuyển Việt Nam sau thất bại chung cuộc 3-4 trước Indonesia ở bán kết AFF Cup 2016. Trước thềm lễ bốc thăm chia bảng ASEAN Cup (trước đây là AFF Cup) 2024 diễn ra lúc 14h chiều nay 21-5 tại Hà Nội, Công Vinh đã có trao đổi với Tuổi Trẻ Online về các đối thủ của đội tuyển Việt Nam. Gặp đội nào cũng phải ""chiến đấu"" Lê Công Vinh cho biết với việc phân chia hạt giống đã công bố, đội tuyển Việt Nam có khả năng sẽ gặp Indonesia, Malaysia hoặc Philippines ở vòng đấu bảng ASEAN Cup 2024 diễn ra vào tháng 11 tới. Indonesia giờ là đội bóng khó bị đánh bại ở Đông Nam Á. Họ đang vươn lên mạnh mẽ với lứa cầu thủ trẻ tài năng và dàn cầu thủ nhập tịch chất lượng đang thi đấu ở châu Âu. Malaysia cũng có sự tiến bộ và chưa bao giờ là đối thủ dễ chơi cả. Philippines thực chất chưa từng là trở ngại đối với đội tuyển Việt Nam. Nhưng họ bây giờ cũng là một ẩn số sau khi nhập tịch thêm 8 cầu thủ nữa. Có lẽ chờ trận gặp Philippines ở vòng loại thứ 2 World Cup 2026 vào ngày 6-6 tới trên sân Mỹ Đình (Hà Nội) chúng ta sẽ biết sức mạnh của họ thế nào. Nhưng cho dù gặp đối thủ nào ở vòng bảng thì đội tuyển Việt Nam cũng phải chiến đấu thôi. Chờ đội tuyển Việt Nam thi đấu thì mới đánh giá được Đội tuyển Việt Nam đang trong quá trình chuyển giao HLV và thế hệ cầu thủ. Chia tay HLV Park Hang Seo, chúng ta đã chuyển giao đến HLV thứ 2 rồi, từ HLV Philippe Troussier và giờ là HLV Kim Sang Sik. Cầu thủ thì lứa thế hệ trước cũng có những người trên 30 tuổi, phải chuyển giao qua thế hệ mới. Vì thế đội tuyển Việt Nam không phải là ứng viên vô địch hay còn ở vị thế như cách đây mấy năm. Đa số những con người cũ thời HLV Park Hang Seo vẫn còn, nên tôi nghĩ vượt qua vòng bảng không phải là vấn đề quá khó của đội tuyển Việt Nam. Vấn đề chỉ là đội tuyển Việt Nam sẽ đi đến đâu mà thôi. Bởi chúng ta đã biết HLV Kim Sang Sik sẽ huấn luyện thế nào đâu và đội tuyển Việt Nam sẽ vận hành chiến thuật ra sao? Cái đó thì cần thời gian để quan sát và thẩm định. Indonesia là đội bóng đáng xem CV (sơ yếu lý lịch) của các HLV Hàn Quốc thường rất đẹp. Họ ra nước ngoài làm việc sau khi đã có thành công nhất định với các CLB trong nước hay đội tuyển quốc gia. Bản thân HLV Kim Sang Sik chưa từng dẫn dắt một đội tuyển trẻ hay đội tuyển quốc gia nào, nhưng tôi nghĩ đó không phải là vấn đề lớn. Điều tôi chờ đợi là HLV Kim Sang Sik nếu có cơ hội đối đầu với HLV Shin Tae Yong (Indonesia) sẽ như thế nào? Trước đây, ông Park đối đầu với ông Shin luôn thắng, nên giờ ông Kim đối đầu ra sao với ông Shin là điều rất được chờ đợi. Indonesia là đội bóng đáng xem hiện tại. Họ đánh bại đội tuyển Việt Nam 3 lần trong thời gian ngắn ở Asian Cup 2023 và vòng loại thứ 2 World Cup 2026. Tôi nghĩ chúng ta phải quen dần với điều đó, vì Indonesia bây giờ đâu phải là Indonesia của ngày xưa. Những cầu thủ trẻ Indonesia đã lên đội tuyển quốc gia thi đấu 2-3 năm nay rồi, nên kinh nghiệm trận mạc không hề yếu. Thứ hai, nền tảng thể lực của Indonesia chưa bao giờ là yếu ở khu vực. Trước đây, Indonesia đá hùng hục, dùng sức nhiều. Giờ thì họ đá bằng đầu óc, có mảng miếng chiến thuật đa dạng nữa nên Indonesia càng chơi khó chịu, không dễ đánh bại.",21/05/2024 06:31 GMT+7,https://tuoitre.vn/cuu-danh-thu-le-cong-vinh-indonesia-la-doi-bong-kho-danh-bai-2024052022314249.htm,"Nhận định trước lễ bốc thăm chia bảng ASEAN Cup 2024 diễn ra vào 14h hôm nay (21-5), cựu tuyển thủ Lê Công Vinh cho rằng nếu đội tuyển Việt Nam nằm chung bảng với Indonesia sẽ rất khó khăn."
