Title,Content,Date,Url,Summary
Vòng 20 V-League 2023-2024: Căng thẳng né play-off,"""Chung kết ngược"" trên sân Pleiku Sau chuỗi 9 trận bất bại, thua 0-2 trước chủ nhà Hà Nội ở vòng 19, CLB HAGL đã trở lại với nỗi lo trụ hạng. Hiện khoảng cách giữa HAGL với SLNA chỉ còn 3 điểm. Muốn không bị đối thủ bắt kịp, CLB HAGL (22 điểm) phải đánh bại Hồng Lĩnh Hà Tĩnh (HLHT, 24 điểm) để thoát khỏi vùng nguy hiểm. Ở trận lượt đi, CLB HLHT đã khiến tân HLV Vũ Tiến Thành có màn ra mắt buồn khi thắng HAGL 1-0. Giờ đây, HLHT đang cho thấy những dấu hiệu tích cực sau khi 5 cầu thủ bị bắt và khởi tố vì sử dụng trái phép chất ma túy. Cụ thể, ở hai trận gần nhất, HLHT đã hòa CLB Hà Nội 2-2 và thắng CLB TP.HCM 2-1. Tuy nhiên, HLV Nguyễn Thành Công đang đau đầu khi vắng 2 trụ cột Viết Triều và Đình Tiến do đã nhận đủ 3 thẻ vàng ở trận gặp chủ nhà HAGL này. Trên sân nhà, HLV Vũ Tiến Thành liệu có thay đổi lối chơi phòng ngự phản công bằng lối chơi tấn công trước HLHT để hướng tới chiến thắng? Câu hỏi này đặt ra do trong 4 trận còn lại trên sân nhà, so với Thanh Hóa, Bình Định và Hải Phòng, HLHT là đối thủ yếu nhất để HAGL có thể giành trọn 3 điểm. Khó khăn chờ đón CLB TP.HCM tại Hai chuyến làm khách trước SLNA và HLHT, CLB TP.HCM chỉ giành được 1 điểm trên sân Vinh. Kết quả này khiến họ tụt xuống vị trí 11/14 đội với 23 điểm. Nguy cơ rơi xuống vị trí thấp hơn càng hiện rõ nếu chủ nhà CLB TP.HCM không thể giành ít nhất 1 điểm trước đương kim vô địch Công An Hà Nội (CAHN). Vừa thua ""muối mặt"" 1-4 trước chủ nhà B.Bình Dương ở vòng 19, CAHN đang rất cần một chiến thắng để lấy lại thể diện và khi cuộc đua vô địch cũng vẫn còn chút hy vọng sau khi đội đầu bảng Nam Định thua Thể Công Viettel 1-2. Với lực lượng trội hơn, dù vắng Văn Thanh vì án kỷ luật, chiến thắng là điều không khó với CLB CAHN. Trong khi đó, CLB TP.HCM khó lại càng thêm khó khi mất hậu vệ Hạ Long và tiền đạo Patino vì thẻ phạt. Tương tự, CLB Quảng Nam phải nỗ lực có điểm trước B.Bình Dương - đội đang xếp thứ 2 trên bảng xếp hạng. Dù chỉ đặt mục tiêu tốp 3, nhưng B.Bình Dương cũng sẽ không bỏ lỡ cơ hội vô địch nếu cờ đến tay, nhất là khi chỉ kém Nam Định 6 điểm. Chiến thắng trước chủ nhà Quảng Nam sẽ giúp B.Bình Dương tiếp tục bám đuổi, thậm chí là rút ngắn khoảng cách nếu như CLB Nam Định không thắng được Hải Phòng ở vòng này. Đánh bại Quảng Nam là điều B.Bình Dương hoàn toàn có thể làm được khi 2 tiền đạo của họ là Tiến Linh và Bùi Vĩ Hào đang có phong độ rất ấn tượng và liên tục ghi bàn. Ở tình thế các đội xếp sau đang phả hơi nóng vào gáy, CLB Quảng Nam không cho phép mình sẩy chân. Chơi trên sân Hòa Xuân, đoàn quân của HLV Văn Sỹ Sơn từng đánh bại CAHN 2-0 ở vòng 17. Vì vậy, họ sẽ nỗ lực đánh bại B.Bình Dương nhằm an tâm trong cuộc đua trụ hạng.",21/05/2024 08:56 GMT+7,https://tuoitre.vn/vong-20-v-league-2023-2024-cang-thang-ne-play-off-20240521080837688.htm,"Ngoài đội chót bảng Khánh Hòa gần như cầm chắc vé xuống hạng trực tiếp, suất đá play-off giờ là cuộc chiến với ít nhất 6 CLB ở nửa cuối bảng xếp hạng. Vòng 20 V-League 2023-2024 diễn ra vào chiều nay (21-5) vì thế hứa hẹn rất căng thẳng."
Bốc thăm vòng bảng ASEAN Cup 2024: Chờ đối thủ của tuyển Việt Nam,"Theo kết quả phân chia hạt giống trước lễ bốc thăm ASEAN Cup (tiền thân là AFF Cup) 2024, tuyển Việt Nam và Thái Lan nằm ở nhóm 1. Nhóm 2 gồm Indonesia và Malaysia.  Philippines và Singapore nằm ở nhóm 3. Nhóm 4 gồm Myanmar và Campuchia. Lào và Brunei/Timor Leste là những đội nằm ở nhóm 5. Có thể vào bảng đấu khó Với kết quả phân chia hạt giống nói trên, tuyển Việt Nam sẽ không gặp Thái Lan ở vòng bảng. Dù vậy, thầy trò HLV Kim Sang Sik nhiều khả năng sẽ rơi vào bảng đấu nặng.  Đó là trường hợp lá thăm đưa tuyển Việt Nam nằm cùng bảng với Indonesia, Philippines, Myanmar và Lào. Đây đều là những đội mạnh nhất ở nhóm hạt giống của mình. Vài năm gần đây, bóng đá Indonesia có sự chuyển mình mạnh mẽ nhờ chính sách nhập tịch. Và chính tuyển Việt Nam là đội đã cảm nhận được sức mạnh của tuyển Indonesia.  Trong 3 trận gần nhất gặp Indonesia (2 trận ở vòng loại thứ 2 World Cup 2026 và 1 trận tại Asian Cup), tuyển Việt Nam đều nhận thất bại.  Tại ASEAN Cup 2024, tuyển Indonesia đã đặt mục tiêu đăng quang chức vô địch. Trong quá khứ, Indonesia từng 6 lần vào chung kết nhưng chưa từng đăng quang chức vô địch. Philippines cũng là đối thủ không hề dễ chịu với tuyển Việt Nam. Mới đây, Liên đoàn Bóng đá Philippines đã nhập tịch hàng loạt cầu thủ để tăng cường sức mạnh cho đội tuyển quốc gia.  Do đó, tuyển Philippines sẽ là rào cản lớn với Việt Nam trên con đường hướng tới mục tiêu vào bán kết ASEAN Cup 2024. Bên cạnh đó, thầy trò HLV Kim Sang Sik cũng không thể xem thường Lào và Myanmar bởi hai nền bóng đá này có nhiều tiến bộ trong thời gian qua. Bảng đấu dễ, bán kết khó Bảng đấu lý tưởng hơn với Việt Nam ở vòng bảng ASEAN Cup 2024 sẽ bao gồm các đội Malaysia, Singapore và Brunei/Timor Leste.  Xét về thực lực, các đối thủ này không mạnh bằng Indonesia, Philippines, Myanmar hay Lào. Vòng bảng vì vậy sẽ trở nên dễ thở hơn với tuyển Việt Nam. Nhưng vấn đề đặt ra là nếu rơi vào một vòng bảng nhẹ nhàng, tuyển Việt Nam hoàn toàn có thể gặp khó ở bán kết.  Hai đối thủ chờ đợi thầy trò HLV Kim Sang Sik ở bán kết nhiều khả năng là Thái Lan hoặc Indonesia. Về lý thuyết, sức mạnh hai đội lúc này là như nhau.  Ngược lại, nếu rơi vào bảng đấu khó (có Indonesia và Philippines) và cố gắng giành ngôi nhất bảng, tuyển Việt Nam nhiều khả năng sẽ có vòng bán kết dễ dàng hơn. ASEAN Cup 2024 sẽ diễn ra từ ngày 23-11 đến 21-12. Tại vòng bảng, 5 đội đá vòng tròn, mỗi đội đá 2 trận sân nhà 2 trận sân khách. Kết thúc vòng bảng, 2 đội nhất nhì mỗi bảng sẽ tiến vào bán kết.  Từ vòng bán kết các đội thi đấu theo thể thức sân nhà, sân khách. Tuyển Thái Lan đang là đương kim vô địch của giải.",21/05/2024 08:15 GMT+7,https://tuoitre.vn/boc-tham-vong-bang-asean-cup-2024-cho-doi-thu-cua-tuyen-viet-nam-20240521080434842.htm,"Lúc 14h hôm nay (21-5), tại Hà Nội sẽ diễn ra lễ bốc thăm chia bảng ASEAN Cup 2024 (VTV5 và FPT Play THTT). CĐV Việt Nam chờ đợi lá thăm đối thủ nào sẽ đến với thầy trò HLV Kim Sang Sik."
Cựu danh thủ Lê Công Vinh: Indonesia là đội bóng khó đánh bại,"Lê Công Vinh là chân sút giữ kỷ lục ghi nhiều bàn thắng nhất cho đội tuyển Việt Nam với 51 bàn thắng trong 83 trận. Anh chia tay đội tuyển Việt Nam sau thất bại chung cuộc 3-4 trước Indonesia ở bán kết AFF Cup 2016. Trước thềm lễ bốc thăm chia bảng ASEAN Cup (trước đây là AFF Cup) 2024 diễn ra lúc 14h chiều nay 21-5 tại Hà Nội, Công Vinh đã có trao đổi với Tuổi Trẻ Online về các đối thủ của đội tuyển Việt Nam. Gặp đội nào cũng phải ""chiến đấu"" Lê Công Vinh cho biết với việc phân chia hạt giống đã công bố, đội tuyển Việt Nam có khả năng sẽ gặp Indonesia, Malaysia hoặc Philippines ở vòng đấu bảng ASEAN Cup 2024 diễn ra vào tháng 11 tới. Indonesia giờ là đội bóng khó bị đánh bại ở Đông Nam Á. Họ đang vươn lên mạnh mẽ với lứa cầu thủ trẻ tài năng và dàn cầu thủ nhập tịch chất lượng đang thi đấu ở châu Âu. Malaysia cũng có sự tiến bộ và chưa bao giờ là đối thủ dễ chơi cả. Philippines thực chất chưa từng là trở ngại đối với đội tuyển Việt Nam. Nhưng họ bây giờ cũng là một ẩn số sau khi nhập tịch thêm 8 cầu thủ nữa. Có lẽ chờ trận gặp Philippines ở vòng loại thứ 2 World Cup 2026 vào ngày 6-6 tới trên sân Mỹ Đình (Hà Nội) chúng ta sẽ biết sức mạnh của họ thế nào. Nhưng cho dù gặp đối thủ nào ở vòng bảng thì đội tuyển Việt Nam cũng phải chiến đấu thôi. Chờ đội tuyển Việt Nam thi đấu thì mới đánh giá được Đội tuyển Việt Nam đang trong quá trình chuyển giao HLV và thế hệ cầu thủ. Chia tay HLV Park Hang Seo, chúng ta đã chuyển giao đến HLV thứ 2 rồi, từ HLV Philippe Troussier và giờ là HLV Kim Sang Sik. Cầu thủ thì lứa thế hệ trước cũng có những người trên 30 tuổi, phải chuyển giao qua thế hệ mới. Vì thế đội tuyển Việt Nam không phải là ứng viên vô địch hay còn ở vị thế như cách đây mấy năm. Đa số những con người cũ thời HLV Park Hang Seo vẫn còn, nên tôi nghĩ vượt qua vòng bảng không phải là vấn đề quá khó của đội tuyển Việt Nam. Vấn đề chỉ là đội tuyển Việt Nam sẽ đi đến đâu mà thôi. Bởi chúng ta đã biết HLV Kim Sang Sik sẽ huấn luyện thế nào đâu và đội tuyển Việt Nam sẽ vận hành chiến thuật ra sao? Cái đó thì cần thời gian để quan sát và thẩm định. Indonesia là đội bóng đáng xem CV (sơ yếu lý lịch) của các HLV Hàn Quốc thường rất đẹp. Họ ra nước ngoài làm việc sau khi đã có thành công nhất định với các CLB trong nước hay đội tuyển quốc gia. Bản thân HLV Kim Sang Sik chưa từng dẫn dắt một đội tuyển trẻ hay đội tuyển quốc gia nào, nhưng tôi nghĩ đó không phải là vấn đề lớn. Điều tôi chờ đợi là HLV Kim Sang Sik nếu có cơ hội đối đầu với HLV Shin Tae Yong (Indonesia) sẽ như thế nào? Trước đây, ông Park đối đầu với ông Shin luôn thắng, nên giờ ông Kim đối đầu ra sao với ông Shin là điều rất được chờ đợi. Indonesia là đội bóng đáng xem hiện tại. Họ đánh bại đội tuyển Việt Nam 3 lần trong thời gian ngắn ở Asian Cup 2023 và vòng loại thứ 2 World Cup 2026. Tôi nghĩ chúng ta phải quen dần với điều đó, vì Indonesia bây giờ đâu phải là Indonesia của ngày xưa. Những cầu thủ trẻ Indonesia đã lên đội tuyển quốc gia thi đấu 2-3 năm nay rồi, nên kinh nghiệm trận mạc không hề yếu. Thứ hai, nền tảng thể lực của Indonesia chưa bao giờ là yếu ở khu vực. Trước đây, Indonesia đá hùng hục, dùng sức nhiều. Giờ thì họ đá bằng đầu óc, có mảng miếng chiến thuật đa dạng nữa nên Indonesia càng chơi khó chịu, không dễ đánh bại.",21/05/2024 06:31 GMT+7,https://tuoitre.vn/cuu-danh-thu-le-cong-vinh-indonesia-la-doi-bong-kho-danh-bai-2024052022314249.htm,"Nhận định trước lễ bốc thăm chia bảng ASEAN Cup 2024 diễn ra vào 14h hôm nay (21-5), cựu tuyển thủ Lê Công Vinh cho rằng nếu đội tuyển Việt Nam nằm chung bảng với Indonesia sẽ rất khó khăn."
Xem bốc thăm ASEAN Cup 2024 trên kênh nào?,"Phân chia hạt giống trước lễ bốc thăm ASEAN Cup 2024 (tiền thân là AFF Cup - giải đấu quan trọng nhất của bóng đá Đông Nam Á), tuyển Việt Nam và Thái Lan nằm ở nhóm 1. Nhóm 2 gồm Indonesia và Malaysia. Philippines và Singapore nằm ở nhóm 3. Nhóm 4 gồm Myanmar và Campuchia. Lào và Timor Leste/Brunei là những đội nằm ở nhóm 5. Với kết quả phân chia hạt giống nói trên, tuyển Việt Nam sẽ không gặp Thái Lan ở vòng bảng. Dẫu vậy, thầy trò HLV Kim Sang Sik nhiều khả năng sẽ rơi vào bảng đấu nặng. Đó là trường hợp lá thăm đưa tuyển Việt Nam nằm cùng bảng với các đối thủ Indonesia, Philippines, Myanmar và Lào. Họ đều là những đội mạnh nhất ở nhóm hạt giống của mình. Bảng đấu lý tưởng hơn với Việt Nam ở vòng bảng ASEAN Cup 2024 sẽ bao gồm các đội Malaysia, Singapore và Timor Leste/Brunei. Xét về thực lực, các đối thủ này không mạnh bằng Indonesia, Philippines, Myanmar hay Lào. Vòng bảng vì vậy sẽ trở nên dễ thở hơn với tuyển Việt Nam. ASEAN Cup 2024 sẽ diễn ra từ 23-11 đến 21-12. Tại vòng bảng, 5 đội đá vòng tròn, mỗi đội đá 2 trận sân nhà, 2 trận sân khách. Kết thúc vòng bảng, 2 đội nhất nhì mỗi bảng sẽ tiến vào vòng bán kết. Từ vòng bán kết trở đi, các đội thi đấu theo thể thức sân nhà sân khách. Tuyển Thái Lan hiện đang là đương kim vô địch của giải đấu này. Lễ bốc thăm AFF Cup 2024 sẽ được trực tiếp trên FPT Play. Tuổi Trẻ Online sẽ cập nhật trực tuyến lễ bốc thăm từ 13h30, kính mời bạn đọc theo dõi.",21/05/2024 06:30 GMT+7,https://tuoitre.vn/xem-boc-tham-asean-cup-2024-tren-kenh-nao-2024052106035515.htm,"Lúc 14h hôm nay 21-5, tại Hà Nội, Liên đoàn Bóng đá Đông Nam Á (AFF) sẽ tổ chức lễ bốc thăm chia bảng ASEAN Cup 2024."
Tin tức thể thao sáng 21-5: Bình luận viên nổi tiếng bị bắt vì hiếp dâm trẻ em,"Một bình luận viên bị bắt giữ vì hiếp dâm trẻ em Tờ The Sun đăng tin rúng động về việc một bình luận viên thể thao nổi tiếng ở Anh bị cảnh sát bắt giữ vì tội hiếp dâm trẻ em. Danh tính người đàn ông này không được công bố, chỉ biết ông đã có gia đình. Vụ bắt giữ diễn ra vào lúc 4h sáng cách đây ít ngày. Ông bị tạm giam trong 18 tiếng rồi được thả ra nhờ đóng tiền bảo lãnh. Ngoài ra, bình luận viên này còn bị tịch thu máy tính và các tài liệu liên quan để phục vụ công tác điều tra. Đáng nói, vụ hiếp dâm này diễn ra nhiều hơn 1 lần. Nạn nhân là một đứa trẻ dưới 10 tuổi và danh tính cũng được giữ bí mật. Liverpool công bố HLV mới Sáng 21-5, Liverpool đã thông báo về việc chọn ông Arne Slot làm HLV trưởng. Được biết CLB đã đạt được thỏa thuận với chiến lược gia này nhiều tuần trước, nhưng quyết định chỉ đưa ra thông báo chính thức sau khi chia tay Jurgen Klopp. Hợp đồng giữa The Kop với HLV Arne Slot có thời hạn 3 năm. Vào tháng 1, HLV Jurgen Klopp xác nhận chia tay Liverpool vào cuối mùa. Từ đó đến nay, đội chủ sân Anfield đã tích cực đi tìm người thay thế. Tuy nhiên, nhiều ứng cử viên sáng giá như Xabi Alonso, Ruben Amorim đều từ chối những lời đề nghị. Cuối cùng, Liverpool quyết định lựa chọn Arne Slot, người đã có 3 năm thành công cùng Feyenoord khi đem về 1 danh hiệu vô địch quốc gia (Eredivisie) và 1 cúp quốc gia Hà Lan. Juventus có nguy cơ mất top 4 Ở trận đấu muộn vòng 37 Giải vô địch Ý (Serie A) sáng 21-5, Juventus đã để cho Bologna cầm hòa 3-3. Với kết quả này, ""bà đầm già"" hiện chỉ đang đứng thứ 4 với 68 điểm. Trong khi đó, Atalanta đứng ngay sau đang có 66 điểm nhưng đá ít hơn 1 trận. May mắn cho Juventus là ở mùa giải năm nay, họ vẫn có thể dự Champions League mùa sau trong trường hợp rơi xuống vị trí thứ 5. Tuy nhiên, đây vẫn là thứ hạng khó chấp nhận với Juventus. Trừ mùa giải 2022-2023 phải đứng thứ 7 do bị trừ 10 điểm, lần cuối đội bóng này rớt khỏi top 4 đã là vào năm 2011.",21/05/2024 06:26 GMT+7,https://tuoitre.vn/tin-tuc-the-thao-sang-21-5-binh-luan-vien-noi-tieng-bi-bat-vi-hiep-dam-tre-em-20240521062130289.htm,Một bình luận viên tại Anh bị bắt vì hành vi sai trái với trẻ em; Juventus có nguy cơ rơi khỏi top 4 Serie A là những tin tức thể thao đáng chú ý sáng 21-5.
"Lịch trực tiếp vòng 20 V-League 2024: Xem Nam Định, Bình Dương đua vô địch","Kết thúc vòng 19 V-League 2023-2024, Nam Định có trong tay 39 điểm, tiếp tục dẫn đầu bảng xếp hạng. Tuy nhiên họ đã bị đội đứng thứ 2 là Bình Dương rút ngắn điểm số xuống còn 6 điểm. Cuộc đua vô địch vì vậy trở nên hấp dẫn hơn bao giờ hết. Ở vòng 20, Bình Dương sẽ đến làm khách trên sân của Quảng Nam. Chủ nhà đang có phong độ không tốt và được đánh giá thấp hơn Bình Dương khá nhiều. Đây là cơ hội để thầy trò HLV Lê Huỳnh Đức giành trọn ba điểm. Nếu đánh bại Quảng Nam, Bình Dương sẽ gây sức ép lớn lên Thép Xanh Nam Định - đội thi đấu vào ngày mai. Vòng này, Nam Định được đá trên sân nhà nhưng phải tiếp đón đối thủ khá xương là Hải Phòng. Sau thất bại trước Thể Công - Viettel, các CĐV Nam Định chờ đợi đội nhà sẽ trở lại mạnh mẽ. Tuy nhiên, Hải Phòng luôn ra sân với tinh thần quyết tâm và rực lửa hứa hẹn sẽ là thử thách lớn cho Nam Định. Ngoài hai trận đấu nói trên, vòng 20 V-League còn có những trận đấu đáng chú ý khác: Hoàng Anh Gia Lai - Hà Tĩnh, Hà Nội - Thanh Hóa, TP.HCM - Công An Hà Nội, Khánh Hòa - Thể Công Viettel, và Bình Định - Sông Lam Nghệ An. Trong đó, Hoàng Anh Gia Lai, Sông Lam Nghệ An đang mấp mé bờ vực rớt hạng rất cần điểm để trụ hạng.",21/05/2024 06:24 GMT+7,https://tuoitre.vn/lich-truc-tiep-vong-20-v-league-2024-xem-nam-dinh-binh-duong-dua-vo-dich-20240521061851496.htm,Vòng 20 V-League sẽ diễn ra trong 2 ngày 21 và 22-5 với tâm điểm là cuộc đua vô địch giữa Bình Dương và Nam Định.
Ho Chi Minh City Night Run Eximbank thành công rực rỡ,"Đặc biệt, với thông điệp ""bứt phá không giới hạn"" được Eximbank lan tỏa suốt mùa giải, giải chạy đêm năm nay đã chứng kiến nhiều màn ""bứt phá"" ấn tượng từ các vận động viên (VĐV). Thành công rực rỡ Giải chạy đêm Ho Chi Minh City Night Run Eximbank 2024 diễn ra vào tối 19-5 là một đêm đầy cảm xúc và màu sắc. Với sự tham gia đông đảo của gần 5.000 VĐV đến từ 37 quốc gia trên thế giới, sự kiện đã mang đến cho ""Sài Gòn - thành phố trẻ"" một đêm không ngủ trong bầu không khí vô cùng rạo rực và phấn chấn.    Ông Nguyễn Hồ Nam - phó chủ tịch HĐQT Eximbank, chia sẻ: ""Với tôn chỉ phát triển kinh doanh gắn liền với trách nhiệm xã hội, trong hơn 3 thập kỷ qua, Eximbank thường xuyên đồng hành cùng các hoạt động hướng về cộng đồng, văn hóa, thể thao lớn của Việt Nam.  Chúng tôi xem đây như là trách nhiệm, góp phần nâng cao chất lượng cuộc sống của mọi người.  Riêng đối với Ho Chi Minh City Night Run Eximbank 2024, Eximbank rất tự hào và hân hạnh khi được đồng hành cùng thành phố tổ chức một đêm giải thành công rực rỡ. Thông qua sự kiện, chúng tôi mong muốn thắp lửa tinh thần thể thao, lan tỏa lối sống văn minh, tích cực trong cộng đồng tại TPHCM nói riêng và cả nước nói chung"". Háo hức đến sự kiện từ rất sớm, chị Lan Anh, VĐV giải chạy đêm cho biết: ""Thực sự là rất vui, cứ nghĩ chạy đêm sẽ vắng nhưng tôi bất ngờ vì chương trình quá đông. Hoàn thành xong giải chạy, tôi có thêm những người bạn, họ đã ""dìu"" tôi hoàn thành chặng đường của mình để về đến đích. Cảm ơn Ban tổ chức rất nhiều"". Anh Xavier Perez, VĐV giải chạy đêm hào hứng chia sẻ: ""Tôi yêu thích môn chạy bộ ngay từ khi còn ở Mỹ. Khi sang Việt Nam tôi biết sự kiện này và ngay lập tức đăng ký tham gia. Thời tiết đang rất oi bức nhưng tôi đã hoàn thành cự ly của mình"". ""Bứt phá không giới hạn"" cùng Eximbank Khác biệt hẳn với hai mùa giải trước, Giải chạy đêm Ho Chi Minh City Night Run Eximbank 2024 đã tạo nhiều ấn tượng tốt đẹp với các VĐV khi lần đầu tiên linh vật Eximbank - Elias xuất hiện tại giải chạy.  Với tạo hình ""điển trai"", mạnh mẽ, ngân hàng muốn truyền tải thông điệp: Eximbank - Ngân hàng nổi tiếng với sự năng động và chuyên nghiệp nhưng cũng không kém phần thân thiện, ấm áp và vui vẻ.  Bên cạnh linh vật Elias, Eximbank còn ""truyền lửa"" một cách mạnh mẽ và quyết liệt tinh thần ""Bứt phá không giới hạn"" qua cuộc thi trực tuyến nội bộ ""Eximbank Virtual Run 2024 - Run As One"" dành cho các cán bộ nhân viên (Eximers).  Diễn ra trước thềm thi đấu Giải chạy đêm Ho Chi Minh City Night Run Eximbank 2024, ngay khi vừa phát động, cuộc thi đã thu hút hàng ngàn Eximer trên toàn quốc tham gia. ""Mỗi con người đều có những mục tiêu và ước mơ riêng của mình. Tại Eximbank, chúng tôi luôn khuyến khích nhân viên phát huy đam mê và năng lực thể thao.  Từng bước chạy sẽ tạo động lực thúc đẩy mỗi người bước ra khỏi vùng an toàn của chính mình, phát triển bản thân và vượt qua những giới hạn để chinh phục mục tiêu"", bà Lê Thị Mai Loan - phó tổng giám đốc Eximbank, khẳng định. ",20/05/2024 19:47 GMT+7,https://tuoitre.vn/ho-chi-minh-city-night-run-eximbank-thanh-cong-ruc-ro-20240520192221614.htm,Giải chạy đêm Ho Chi Minh City Night Run Eximbank 2024 đã chính thức khép lại với nhiều cung bậc cảm xúc và khoảnh khắc vô cùng đáng nhớ.
