Title,Content,Date,Url,Summary
HLV Kim Sang Sik dự lễ bốc thăm ASEAN Cup 2024,"Lễ bốc thăm ASEAN Cup 2024 (tiền thân là AFF Cup) sẽ diễn ra lúc 14h chiều 21-5 tại một khách sạn 5 sao ở Hà Nội. ASEAN Cup là giải đấu quan trọng nhất của bóng đá Đông Nam Á, được tổ chức 2 năm một lần, do Liên đoàn Bóng đá Đông Nam Á (AFF) tổ chức. ASEAN Cup 2024 cũng là giải đấu quan trọng nhất trong nhiệm kỳ 2 năm của HLV Kim Sang Sik với đội tuyển Việt Nam. Mục tiêu VFF đề ra với ông Kim là phải đưa đội tuyển Việt Nam vào chung kết giải đấu. Đây là lần thứ hai Việt Nam được AFF lựa chọn là địa điểm đăng cai tổ chức lễ bốc thăm xếp lịch thi đấu của sự kiện bóng đá lớn nhất Đông Nam Á. Lần đầu tiên là giải đấu năm 2014. Buổi lễ sẽ có sự hiện diện của tân HLV trưởng đội tuyển Việt Nam Kim Sang Sik cùng trợ lý. Do bận lịch thi đấu vòng 20 V-League diễn ra trong 2 ngày 21 và 22-5 nên không có tuyển thủ Việt Nam nào tham dự sự kiện. Dự kiến sau lễ bốc thăm, ông Kim sẽ đến sân Hàng Đẫy dự khán trận đấu tâm điểm giữa Hà Nội và Thanh Hóa, diễn ra vào lúc 19h15. Tại lễ bốc thăm ASEAN Cup 2024, Brunei và Timor Leste sẽ bốc thăm xác định chủ nhà của mỗi lượt play-off vòng loại. Đội thắng trong cặp đấu này ở nhóm hạt giống số 5. Các nhóm hạt giống Thái Lan, Việt Nam (số 1), Indonesia, Malaysia (2), Singapore, Philippines (3), Myanmar, Campuchia (số 4), Lào, đội thắng ở play-off (5) sẽ bốc thăm để xác định hai bảng đấu vòng bảng. Mỗi bảng có 5 đội thi đấu theo thể thức vòng tròn tính điểm với hai trận sân nhà và hai trận sân khách theo mã số bốc thăm. Hai đội đứng đầu mỗi bảng giành quyền vào bán kết. Vòng bán kết và chung kết vẫn sẽ diễn ra theo thể thức lượt đi và lượt về trên sân nhà và sân khách giống như các kỳ ASEAN Cup trước đó.",20/05/2024 09:29 GMT+7,https://tuoitre.vn/hlv-kim-sang-sik-du-le-boc-tham-asean-cup-2024-20240520091100381.htm,HLV trưởng đội tuyển Việt Nam Kim Sang Sik sẽ tham dự lễ bốc thăm ASEAN Cup 2024 diễn ra chiều 21-5 tại Hà Nội.
Thái Lan hay Indonesia là đối thủ đáng ngại nhất của tuyển Việt Nam?,"Lễ bốc thăm chia bảng ASEAN Cup 2024 sẽ diễn ra vào lúc 14h ngày 21-5 tại Hà Nội. Theo phân chia hạt giống, nhóm 1 là đội tuyển Thái Lan và Việt Nam, còn nhóm 2 là Indonesia và Malaysia. Ba đội tuyển hàng đầu khu vực theo bảng xếp hạng của FIFA, lần lượt là Thái Lan (hạng 101), Việt Nam (hạng 115) và Indonesia (hạng 134) sẽ có những cuộc đua tranh kịch tính tại giải đấu. Đội tuyển Thái Lan vẫn đẳng cấp Từ năm 2019 đến nay, đội tuyển Thái Lan chưa bao giờ lọt top 100 thế giới trên bảng xếp hạng FIFA. Điều mà đội tuyển Việt Nam đã duy trì được cho đến hết năm 2023. Nhưng trong thời gian này, đội tuyển Việt Nam đã không thể một lần thắng Thái Lan trong giải đấu chính thức - thành tích 4 hòa, 2 thua. Nếu tính riêng đấu trường ASEAN Cup, Thái Lan vẫn giữ được vị thế vượt trội với 4 chức vô địch trong 5 giải đấu gần nhất. Thời điểm hiện tại, ""Voi chiến"" còn mạnh hơn. Những mâu thuẫn nội bộ của Hiệp hội Bóng đá Thái Lan (FAT) nhiều năm qua đã được giải quyết với tân chủ tịch Madam Pang. Vị nữ tỉ phú này bước đầu đã có thành công khi tập hợp mọi nguồn lực trong nước để làm nền tảng vững chắc cho đội tuyển quốc gia. Đội hình ""Voi chiến"" đang có sự gắn kết giữa nhiều lớp cầu thủ, gồm: trụ cột lâu năm như Theerathon Bunmathan, Pansa Hemviboon, Sarach Yooyen, Chanathip Songkrasin; với lớp cầu thủ thay thế (dưới 26 tuổi) như Kritsada Kaman, Supachok Sarachat, Supachai Chaided, Ekanit Panya, Suphanat Mueanta. Bên cạnh đó, bóng đá Thái Lan vẫn chú trọng nguồn lực cầu thủ nước ngoài gốc Thái. Hiện ở Thái League mùa giải 2023 - 2024 có 30 cầu thủ Thái kiều được đăng ký thi đấu. Điều đó giúp đội tuyển Thái Lan có thêm những tài năng mới như: Nicholas Mickelson (sinh năm 1999), James Beresford (2002), Ben Davis (2000). Ở ban huấn luyện, bà Madam Pang cũng giải quyết tốt bài toán HLV trưởng phù hợp với lối chơi và có kinh nghiệm làm việc ở Thái Lan. Sau khi chia tay ông Manuel Polking đã rất thành công với 2 chức vô địch ASEAN Cup liên tiếp, đội tuyển Thái Lan lập tức có HLV Masatada Ishii (Nhật Bản) - người đã giúp CLB Buriram có 2 mùa giải liên tiếp ""ăn ba"" danh hiệu quốc nội. Trước khi trở thành thuyền trưởng ""Voi chiến"", vị HLV người Nhật Bản cũng có vài tháng làm giám đốc kỹ thuật FAT. Cách làm bài bản này đã giúp đội tuyển Thái Lan gặt hái kết quả tương đối tốt tính từ đầu năm 2024 đến nay với thành tích lọt vào tứ kết Asian Cup 2023 sau 3 trận không thua ở vòng bảng, cầm hòa 1-1 trước Hàn Quốc ở sân khách tại vòng loại World Cup 2026 khu vực châu Á. ""Dớp"" thua Indonesia Với cách xếp hạt giống như vậy, đội tuyển Việt Nam chỉ có thể gặp Thái Lan từ bán kết ASEAN Cup 2024. Trong khi khả năng cao hơn là từ vòng bảng, tân HLV trưởng Kim Sang Sik sẽ phải đối đầu với Indonesia. Đội tuyển Indonesia đã đánh bại chúng ta ở cả 3 lần đối đầu gần nhất và khiến người tiền nhiệm của ông Kim là HLV Philippe Troussier phải ra đi. Những gương mặt nổi bật của Indonesia có thể kể đến: Ernando Ari, Rizky Ridho, Witan Sulaeman, Pratama Arhan, Elkan Baggott, Muhammad Ferarri, Marselino Ferdinan, Ramadhan Sananta. Ngoài ra, thời gian qua đội tuyển Indonesia trở nên mạnh hơn khi được bổ sung những cầu thủ gốc Indonesia, phần lớn đang thi đấu ở châu Âu, như: Justin Hubner, Ivar Jenner, Rafael Struick, Nathan Tjoe-A-On, Jay Idzes, Sandy Walsh, Thom Haye, Ragnar Oratmangoen. Thầy trò HLV Shin Tae Yong đã có những thành tích khả quan thời gian qua là vào tứ kết Asian Cup 2023, đang có khả năng cao lọt đến vòng loại thứ 3 World Cup 2026 khu vực châu Á. Mục tiêu của đội tuyển Việt Nam là vào đến trận chung kết ASEAN Cup 2024. Trên bước đường đó, Thái Lan, Indonesia sẽ là những tảng đá cực lớn ngáng đường thầy trò ông Kim Sang Sik.",20/05/2024 08:26 GMT+7,https://tuoitre.vn/thai-lan-hay-indonesia-la-doi-thu-dang-ngai-nhat-cua-tuyen-viet-nam-20240520031520214.htm,"Với 2 lần liên tiếp vô địch AFF Cup (tên mới ASEAN Cup), đội tuyển Thái Lan được đánh giá cao nhất giải đấu năm nay, trong khi Indonesia đang trỗi dậy mạnh mẽ từ dàn cầu thủ nhập tịch."
Nhân sự đội tuyển Việt Nam dưới thời Kim Sang Sik có gì?,"Dĩ nhiên, không phải những cầu thủ nào nằm trong danh sách gợi ý của Liên đoàn Bóng đá Việt Nam (VFF) cũng thể hiện tốt để HLV Kim Sang Sik kiểm tra trực tiếp. Nhưng nhà cầm quân người Hàn Quốc cũng có thêm những lựa chọn mới, phục vụ cho lối chơi mà mình sắp xây dựng. 7 chuyến ""vi hành"" Hai tuần qua, V-League 2023-2024 thi đấu với mật độ dày đặc 3-4 ngày/trận nhằm bù lại quãng nghỉ cho đội tuyển Việt Nam và U23 tập trung trước đó. HLV Kim Sang Sik vì thế cũng tranh thủ tối đa thời gian đi xem trực tiếp các trận đấu, rà soát và chọn ra những cái tên phù hợp nhất cho lần triệu tập đầu tiên kể từ khi trở thành HLV trưởng đội tuyển Việt Nam. Tính tổng cộng, nhà cầm quân 48 tuổi này đã dự khán 7 trận đấu từ sân Hàng Đẫy (4 lần), Thiên Trường, Lạch Tray ở phía Bắc cho đến tận sân Gò Đậu ở Bình Dương. Không biết vô tình hay cố ý, HLV Kim Sang Sik đã xem các cầu thủ Thể Công Viettel thi đấu đến 4 trận, mới nhất là trận ngược dòng thắng đội đầu bảng Nam Định 2-1 ở vòng 19 trên sân Hàng Đẫy vào hôm 18-5. Nam Định cũng là đội bóng mà ông Kim xem 3 trận, trong đó có trận thắng B.Bình Dương 3-1 trên sân Thiên Trường ở vòng 17. Ba đội bóng mà HLV Kim Sang Sik xem nhiều nhất gần như là đại diện cho lối chơi phòng ngự phản công (Thể Công Viettel, B.Bình Dương) và tấn công ấn tượng (Nam Định) ở V-League mà ông có thể sẽ kết hợp trong lối chơi của đội tuyển Việt Nam sắp tới. Khó hiểu ở chỗ HLV Kim Sang Sik lại không chọn xem nhiều trận thi đấu của đương kim vô địch Công An Hà Nội (CAHN) - đội bóng sở hữu rất nhiều tuyển thủ quốc gia trong đội hình. Như vòng 18, ông Kim chọn đi Hải Phòng xem trận Hải Phòng - Quảng Nam vốn không có tuyển thủ quốc gia nào thi đấu thay vì ở lại Hà Nội xem trận CAHN - Khánh Hòa diễn ra cùng ngày. Trận duy nhất HLV Kim Sang Sik xem CLB CAHN thi đấu chính là với chủ nhà B.Bình Dương ở vòng 19. CAHN thua 1-4 khi các ngôi sao khoác áo đội tuyển quốc gia đều chơi mờ nhạt như Quang Hải hay thủ môn Việt kiều Nguyễn Filip. Các trụ cột thể hiện phong độ tốt Theo kế hoạch, đội tuyển Việt Nam sẽ hội quân vào ngày 1-6 và chỉ có 5 ngày chuẩn bị cho trận gặp Philippines trên sân Mỹ Đình (Hà Nội) ở vòng loại thứ 2 World Cup 2026. Sau đó, thầy trò HLV Kim Sang Sik sẽ có trận đấu trên sân khách với Iraq vào ngày 11-6. Đội tuyển Việt Nam còn rất ít cơ hội đi tiếp, nhưng ông Kim ở 2 trận ra mắt sẽ không muốn nhận thất bại. Đặc biệt là trước đối thủ Philippines mà đội tuyển Việt Nam thời HLV Philippe Troussier từng thắng 2-0 ở lượt đi. Dù vậy, mới đây Philippines đã nhập tịch một lúc đến 8 cầu thủ, khiến màn ra mắt của tân HLV Kim Sang Sik trở nên vô cùng khó khăn. Bảy chuyến ""vi hành"", HLV Kim Sang Sik không phải lúc nào cũng xuống sân hỏi thăm các cầu thủ sau trận đấu. Nhưng các cầu thủ mà ông thầy mới đến bắt tay và hỏi chuyện đều là những gương mặt từng chơi ấn tượng dưới thời HLV Park Hang Seo nhưng ít được trọng dụng thời HLV Philippe Troussier. Đó là thủ môn Đặng Văn Lâm, tiền đạo Tiến Linh, Nguyễn Văn Toàn, tiền vệ Hoàng Đức, trung vệ Đức Chiến, Bùi Tiến Dũng - những cầu thủ thích hợp với lối chơi phòng ngự phản công mà ông Kim cần. Quan trọng hơn, tất cả 6 cầu thủ trên đều gần như đang có phong độ tốt. Ba trận vừa qua, Đặng Văn Lâm chỉ để thủng lưới 2 bàn - con số ấn tượng nếu như so với 7 bàn thua mà thủ môn Nguyễn Filip phải nhận với cùng số trận. Không chỉ các chân sút Tiến Linh, Văn Toàn đều đặn ghi bàn mà Hoàng Đức, Đức Chiến cũng lập công ngay trong ngày HLV Kim Sang Sik dự khán. Bên cạnh đó, những cầu thủ khác cũng ghi dấu ấn với ông Kim và hứa hẹn sẽ là các nhân tố mới trong đợt tập trung tới như Bùi Vĩ Hào, Minh Khoa (B.Bình Dương), Tô Văn Vũ, Trần Văn Đạt (Nam Định), Trần Danh Trung (Thể Công Viettel)... Trong số các tuyển thủ cũ, sự sa sút của Nguyễn Filip - thủ môn số 1 đội tuyển Việt Nam dưới thời HLV Philippe Troussier - trong thời gian qua khiến anh mất điểm không ít với HLV Kim Sang Sik. Nhất là ngay ngày ông Kim dự khán, Nguyễn Filip lại mắc sai lầm trong bàn thua đầu tiên của CLB CAHN trước B.Bình Dương. Lựa chọn thủ môn đẳng cấp châu Âu này lên tuyển và bắt chính hay không trong thời gian tới rõ ràng là điều mà ông Kim phải cân nhắc sau 3 vòng đấu nữa. Đó cũng là quãng thời gian mà nhà cầm quân người Hàn Quốc cùng các trợ lý sẽ tiếp tục đi xem và đánh giá lại bản danh sách đang có một lần nữa trước khi công bố.",20/05/2024 05:45 GMT+7,https://tuoitre.vn/nhan-su-doi-tuyen-viet-nam-duoi-thoi-kim-sang-sik-co-gi-20240519233258162.htm,"Qua theo dõi 4 vòng đấu ở V-League 2023-2024, HLV Kim Sang Sik cùng các trợ lý đã có sự chuẩn bị nhân sự tốt cho đợt tập trung sắp tới của đội tuyển Việt Nam."
"'Hãy tiếp tục cố gắng, rồi một ngày chiến thắng sẽ đến với Arsenal'","Dù đã cố gắng đánh bại Everton 2-1, nhưng Arsenal vẫn ""chỉ là người đến sau"" Manchester City. Kết thúc mùa giải, Pháo thủ xếp thứ hai chung cuộc với 89 điểm, ít hơn 2 điểm so với nhà vô địch Manchester City.  Đây là kết quả rất đáng khen ngợi, nhưng cũng rất đáng tiếc cho đoàn quân của HLV Mikel Arteta. Có thời điểm họ đã dẫn đầu bảng xếp hạng và chiếm ưu thế trong cuộc đua vô địch, nhưng những cái sẩy chân đáng tiếc đã khiến họ bất lực nhìn giấc mơ vô địch lần đầu tiên sau 20 năm tan thành mây khói.  Nhưng nếu cứ tiếp tục cố gắng và cống hiến như thế này, Arsenal sẽ có một ngày đạt được ước mơ đó. Trả lời phỏng vấn ESPN sau khi mùa giải này kết thúc, HLV Mikel Arteta cho biết: ""Bây giờ là lúc để nghỉ ngơi, suy nghĩ, suy ngẫm và hãy tiếp tục nỗ lực. Hãy tiếp tục truyền cảm hứng cho đội bóng này. Đừng hài lòng với vị trí á quân vì chúng tôi muốn nhiều hơn thế và chúng ta sẽ có được nó"".  Khi được hỏi: ""Tại sao ông lại tự tin đến vậy?"". Arteta trả lời: ""Nếu chúng tôi làm những gì phải làm, chúng tôi sẽ tiến gần hơn đến mục tiêu và cuối cùng sẽ giành chiến thắng. Khi nào thì tôi không biết. Nhưng nếu chúng tôi cứ tiếp tục gõ cửa và chắc chắn đến một lúc nào đó cánh cửa sẽ mở ra thôi"".  Đội trưởng Martin Odegaard (Arsenal) hơi cảm thấy thất vọng nhưng cũng tự hào vì sự tiến bộ của đội bóng này. Anh cho biết: ""Tôi nghĩ tất cả chúng tôi đều hơi thất vọng. Chúng tôi đã chiến đấu rất lâu vì giấc mơ lớn. Chúng tôi đã đến rất gần nó... Tôi rất tự hào về các chàng trai, rất tự hào về đội bóng, những người hâm mộ. Tôi rất tự hào về những tiến bộ mà chúng tôi đang đạt được. Chúng tôi đã thay đổi câu lạc bộ và tôi nghĩ bây giờ tất cả các bạn đều tin tưởng vào chúng tôi"".  Cựu danh thủ Manchester United Rio Ferdinand nhận định Arteta là người đã mang lại niềm tin cho Arsenal. Rio Ferdinand nói với TNT Sports: ""Arsenal là một câu lạc bộ thiếu niềm tin trong một thời gian dài và Arteta đã mang lại rất nhiều điều đó. Dù họ đã không đạt được một số mục tiêu đã đặt ra trong mùa giải, nhưng Arteta đã tạo ra một đội bóng mà người hâm mộ muốn sát cánh"". ",20/05/2024 05:16 GMT+7,https://tuoitre.vn/hay-tiep-tuc-co-gang-roi-mot-ngay-chien-thang-se-den-voi-arsenal-20240520045836295.htm,"Thất vọng sau khi Arsenal không thể giành được chức vô địch Premier League mùa này, nhưng HLV Mikel Arteta đã kêu gọi mọi người hãy tiếp tục cố gắng với niềm tin ""sau cùng chiến thắng sẽ đến""..."
'Cỗ máy chiến thắng' của Guardiola đã đi vào sử sách,"Foden đã ghi hai bàn thắng khi đoàn quân xanh của Guardiola đánh bại West Ham 3-1 vào ngày cuối cùng để kéo dài chuỗi trận bất bại trên sân nhà của họ lên con số 44 trận trên mọi đấu trường. Điều đó có nghĩa là họ kết thúc chiến dịch Premier League mùa này với hai điểm nhiều hơn Arsenal dù ""Pháo thủ"" đã đánh bại Everton 2-1 trong trận đấu cùng giờ.  ""Thật khó để diễn tả thành lời những gì chúng tôi đã làm. Chúng tôi đã ghi tên mình vào sử sách. Chưa có đội nào từng làm được điều đó"", Foden nói sau trận đấu. HLV Guardiola đã khen ngợi Arsenal vì đã áp sát đội bóng của mình và đẩy họ đến giới hạn. ""Arsenal là đội bóng mạnh mẽ, có một nhà cầm quân trẻ tài năng. Họ gửi cho chúng tôi thông điệp rằng chúng tôi phải cẩn thận trong những năm tới. Nhưng hôm nay là một ngày để ăn mừng. Nếu mọi người nói với tôi trong bảy năm tới chúng tôi sẽ giành được sáu chức vô địch Premier League thì tôi sẽ nói bạn thật điên rồ, điều đó sẽ không xảy ra.  Nhưng nó đã xảy ra. Bây giờ là thời kỳ của chúng tôi. Chúng tôi là một phần trong đó"", ông nói. Các chuyên gia bóng đá Anh một lần nữa ca ngợi Guardiola, họ gọi ông là người tạo ra ""cỗ máy chiến thắng"".  Cựu hậu vệ tuyển Anh Gary Neville nói với Sky Sports: ""Pep Guardiola đã thiết kế một phong cách bóng đá đang được sao chép không chỉ trên khắp đất nước này mà còn trên khắp châu Âu. Trên hết, anh ấy là một cỗ máy chiến thắng, truyền cảm hứng đó cho mọi người làm việc với anh ấy"".  Cựu hậu vệ Manchester City Micah Richards cho rằng danh hiệu thứ tư liên tiếp là ""khó tin"", trong khi cựu đội trưởng Manchester United Rio Ferdinand ca ngợi sức mạnh tinh thần của Manchester City.",20/05/2024 05:08 GMT+7,https://tuoitre.vn/co-may-chien-thang-cua-guardiola-da-di-vao-su-sach-20240520034130482.htm,"Sự thống trị của Manchester City ở nước Anh lớn đến mức chức vô địch Premier League thứ tư liên tiếp mang tính lịch sử lại được coi như là chuyện ""bình thường thôi"". Và Guardiola đã thật sự biến Manchester City thành ""cỗ máy chiến thắng""."
