Title,Content,Date,Url,Summary
Hôm nay hết hạn đăng ký dự thi đánh giá năng lực Đại học Quốc gia TP.HCM đợt 2,"Kỳ thi đánh giá năng lực đợt 2 năm 2024 sẽ được Đại học Quốc gia TP.HCM phối hợp với các đơn vị tổ chức vào sáng ngày 2-6 tại 14 tỉnh, thành phố. Thanh toán lệ phí thi đánh giá năng lực đến hết ngày 10-5 Hôm nay (7-5) là ngày cuối đăng ký dự thi đánh giá năng lực đợt 2. Thí sinh đăng ký dự thi trực tuyến tại: https://thinangluc.vnuhcm.edu.vn/dgnl/. Thí sinh lưu ý, đăng ký được cho là thành công khi các bạn hoàn tất các bước đăng ký trên trang https://thinangluc.vnuhcm.edu.vn/dgnl/login và đóng phí trước. Thời gian thực hiện thanh toán đến hết ngày 10-5. Năm nay Đại học Quốc gia TP.HCM tiếp tục cải tiến phương thức thanh toán cho thí sinh khi tập trung sử dụng thanh toán lệ phí thi thông qua các ví điện tử. Thí sinh sẽ lựa chọn 1 trong 4 phương thức thanh toán qua Viettel Money, Foxpay, MoMo và Payoo để hoàn thành thủ tục đăng ký. Khi đóng phí xong, thí sinh kiểm tra trên hệ thống có dòng chữ ""Đã thanh toán"" thì các bạn đã đăng ký thành công. Thí sinh đã đăng ký cần kiểm tra kỹ các thông tin cá nhân. Nếu có sai sót cần liên hệ ngay với Trung tâm Khảo thí và đánh giá chất lượng đào tạo Đại học Quốc gia TP.HCM (email, hotline) để điều chỉnh. Trước ngày thi 1 tuần, thí sinh đăng nhập vào hệ thống để in phiếu báo dự thi. Trong giấy báo dự thi sẽ có thông tin chi tiết về địa điểm thi, phòng thi, số báo danh, thời gian thí sinh cần có mặt tại phòng thi. Đại học Quốc gia TP.HCM sẽ phối hợp với các đơn vị tổ chức kỳ thi đánh giá năng lực đợt 2 vào sáng chủ nhật ngày 2-6, tại 14 tỉnh/thành phố, gồm: Thừa Thiên Huế, Đà Nẵng, Bình Định, Khánh Hòa, Ninh Thuận, Đắk Lắk, Lâm Đồng, TP.HCM, Bà Rịa - Vũng Tàu, Đồng Nai, Bình Dương, Tiền Giang, An Giang và Cà Mau (tăng thêm 2 tỉnh so với kế hoạch công bố trước đó). Kết quả của đợt 2 sẽ được công bố vào ngày 10-6. Đăng ký xét tuyển bằng kết quả thi đánh giá năng lực đến 16-5 Kỳ thi đánh giá năng lực của Đại học Quốc gia TP.HCM chú trọng đánh giá các năng lực cơ bản để học đại học của thí sinh như: sử dụng ngôn ngữ, tư duy logic, xử lý số liệu, giải quyết vấn đề. Về hình thức, bài thi gồm 120 câu hỏi trắc nghiệm khách quan đa lựa chọn với thời gian làm bài 150 phút. Cấu trúc bài thi đánh giá năng lực của Đại học Quốc gia TP.HCM gồm 3 phần: sử dụng ngôn ngữ; toán học, tư duy logic, phân tích số liệu; và giải quyết vấn đề, nhằm đánh giá các năng lực cơ bản để học đại học của thí sinh. Bài thi chú trọng đánh giá năng lực suy luận và giải quyết vấn đề, không đánh giá khả năng học thuộc lòng của thí sinh. Việc tham dự kỳ thi đánh giá năng lực sẽ giúp thí sinh có thêm cơ hội trúng tuyển vào ngành và trường phù hợp với lựa chọn của bản thân. Cùng với việc đăng ký dự thi đánh giá năng lực đợt 2, theo quy định của Đại học Quốc gia TP.HCM, thí sinh đăng ký xét tuyển bằng phương thức thi đánh giá năng lực năm 2024 đến hết ngày 16-5. TS Nguyễn Quốc Chính - giám đốc Trung tâm Khảo thí và Đánh giá chất lượng đào tạo (Đại học Quốc gia TP.HCM), cho biết thêm: ""Năm 2024, Đại học Quốc gia TP.HCM dành tối thiểu 45% tổng chỉ tiêu xét tuyển bằng phương thức thi đánh giá năng lực. Hiện số cơ sở giáo dục đã đăng ký sử dụng kết quả kỳ thi đánh giá năng lực do Đại học Quốc gia TP.HCM tổ chức xét tuyển đã tăng lên 109 trường đại học, cao đẳng. Thí sinh có thể tham gia dự thi đợt 1, đợt 2, hay cả 2 đợt để tăng cơ hội trúng tuyển. Kết quả của đợt thi nào cao hơn sẽ được sử dụng để xét tuyển"". Trong kỳ thi đánh giá năng lực Đại học Quốc gia TP.HCM đợt 1 vừa qua có 93.828 thí sinh dự thi. Thí sinh có điểm thi cao nhất là 1.076 điểm và thí sinh có điểm thi thấp nhất là 203 điểm.",07/05/2024 14:32 GMT+7,https://tuoitre.vn/hom-nay-het-han-dang-ky-du-thi-danh-gia-nang-luc-dai-hoc-quoc-gia-tp-hcm-dot-2-20240507140536399.htm,Cổng đăng ký dự thi đánh giá năng lực Đại học Quốc gia TP.HCM đợt 2 năm 2024 sẽ đóng vào cuối ngày hôm nay 7-5.
Vụ học sinh nhập viện ở TP.HCM: Không phát hiện ngộ độc tập thể,"Ngày 7-5, Sở Y tế TP.HCM cho biết không phát hiện ngộ độc thực phẩm tập thể tại hai trường tiểu học ở quận 4 và Thủ Đức. Trước đó, ngày 4-5, Sở Y tế nhận được thông tin từ Bệnh viện Nhi đồng 2 về các trường hợp nhập viện có triệu chứng nghi ngờ ngộ độc thực phẩm có địa chỉ TP Thủ Đức và quận 4. Ngay trong đêm, Sở Y tế đã chỉ đạo Trung tâm Kiểm soát bệnh tật thành phố (HCDC) phối hợp các trung tâm y tế địa phương điều tra dịch tễ và đánh giá nguy cơ tại cộng đồng. Tổ công tác ghi nhận các trẻ nhập viện đều là học sinh tiểu học. Điều tra tại hai trường học  đều không ghi nhận dấu hiệu của ngộ độc thực phẩm tập thể, bữa trưa bán trú của hai trường được cung cấp bởi hai công ty khác nhau. Sự trùng hợp ngẫu nhiên là tại thời điểm này (ngày 4-5), Trường tiểu học Linh Chiểu, TP Thủ Đức ghi nhận có 82 trẻ nghỉ học. Trung tâm Kiểm soát bệnh tật TP.HCM đã tìm hiểu sự trùng hợp này. Theo báo cáo của nhà trường, trong số 82 trẻ nghỉ học thì có trên 50 trẻ nghỉ vì lý do không liên quan đến sức khỏe. Cụ thể như trẻ đi thi tiếng Anh, đi du lịch cùng gia định, do việc nhà…  Số còn lại nghỉ học vì các lý do thông thường như ho, cảm, mệt (không có triệu chứng rối loạn tiêu hóa)… ""Số học sinh nghỉ học này cũng tương đương số trường hợp nghỉ học trung bình hằng ngày của trường"", theo báo cáo.  Ngoài hai học sinh nhập viện tại Bệnh viện Nhi đồng 2, nhà trường khẳng định không ghi nhận thêm học sinh nào đi khám bệnh hoặc nhập viện vì nhiễm trùng tiêu hóa.",07/05/2024 14:01 GMT+7,https://tuoitre.vn/vu-hoc-sinh-nhap-vien-o-tp-hcm-khong-phat-hien-ngo-doc-tap-the-20240507130822614.htm,Sở Y tế TP.HCM cho biết không phát hiện vụ ngộ độc tập thể nào tại hai trường tiểu học ở quận 4 và TP Thủ Đức.
Khi sinh viên 'nghiện' dùng AI,"Ngành nào cũng dùng AI Minh Tâm - hiện đang theo học tại ĐH RMIT Việt Nam - nói hầu hết môn học của Tâm đều được giảng dạy bằng tiếng Anh nên các phần mềm AI được Tâm thường xuyên sử dụng. Gần 2 năm qua, Gemini và ChatGPT được Tâm dùng nhiều nhất, hỗ trợ tìm kiếm ý tưởng và xây dựng dàn bài lúc viết luận. “Mình thấy AI có thể trợ giúp đưa ra thông tin rất nhanh. Chỉ cần đưa chủ đề, AI có thể tìm kiếm và chọn lọc những nội dung phù hợp kèm trích nguồn”, Tâm nói. Hoặc khi cần đọc nội dung của một bài giảng tiếng Anh từ file ghi âm, Tâm dùng OtterAi, phần mềm áp dụng AI xử lý giọng nói thành văn bản. Chỉ trong chưa đầy 5 phút, phần mềm có thể rã băng ghi âm thành text từ một audio bài giảng dài đến 30 phút. Mai Thư, sinh viên khoa báo chí truyền thông, Trường ĐH Khoa học xã hội và Nhân văn (ĐH Quốc gia TP.HCM), cho biết đang dùng rất nhiều app tích hợp AI để học tiếng Anh như Toeic Exam, Duolingo, Cake, LingoDeer... Ngoài ra, Thư dùng ChatGPT để bổ trợ, kiểm tra lại cách dùng từ tiếng Anh, “nhờ” chỉnh sửa câu cú và ngữ pháp tiếng Anh. Còn Thu Thủy, hiện đang là sinh viên hệ cử nhân tài năng, ĐH Kinh tế TP.HCM, đã tập dùng Google Analytics từ năm nhất để phân tích xu hướng thị trường.  Qua phần mềm, Thủy sớm tiếp xúc với các thuật ngữ trong chuyên ngành marketing như Users, Pageviews, Bounce Rate, và Conversion Rate… giúp bạn bắt đầu làm quen với phương pháp phân tích hiệu quả website và các chiến dịch marketing. “Mình cũng học được cách phân tích cách thức mà người dùng tìm đến website của bạn, hiểu thêm về hiệu quả của SEO, quảng cáo trả tiền, xã hội, và các kênh khác”, Thu Thủy nói nói. Thầy cô “tuyển” AI làm trợ lý Trương Quang Nhật, 28 tuổi, đang là giáo viên IELTS tại huyện Hóc Môn (TP.HCM), đã sớm ứng dụng các chatbot như Gemini hay ChatGPT vào việc dạy IELTS của mình. Các chatbot có thể hỗ trợ đưa ra ví dụ và bài tập theo đúng với trình độ của người học. Ngoài ra, chatbot có thể đưa ra các ý tưởng, góc nhìn đa chiều cho các bài viết IELTS Writing. Quang Nhật nói thêm các chatbot có thể “tự học” nên người dùng có thể “dạy” chúng thành những trợ lý riêng.  Chẳng hạn, có bạn cung cấp cho Gemini hay ChatGPT những bài viết IELTS mẫu tương ứng với các thang điểm 6.5, 7.5 và 8.5, sau đó có thể yêu cầu chatbot học cách viết, cách sử dụng từ theo từng mức điểm đó. “Tuy nhiên để kiểm chứng các thông tin do AI đưa ra, thầy cô có thể là một nguồn uy tín để học sinh đối chiếu lại những thông tin AI cung cấp trong quá trình tự học”, Quang Nhật nói. ThS Trương Kiều Trinh, ĐH Sheffield Hallam (Anh), cho rằng các ứng dụng công nghệ nói chung và AI nói riêng đang thay đổi nhiều các lớp học truyền thống.  Chẳng hạn, ChatGPT có thể được giáo viên sử dụng tại lớp để làm một kênh tham khảo các ví dụ, case study, các app như Kahoot!, Menti giúp học sinh tham gia các hoạt động kiểm tra bài ngay tại lớp, hoặc các biểu mẫu Google Forms giúp người dạy có thể khảo sát nhanh mức độ hài lòng của người học trong lớp học. Ngoài ra, AI có thể được học sinh, sinh viên ứng dụng trong nghiên cứu, quản lý công việc học tập hằng ngày. Theo cô Trinh, vì hiện đang có nhiều ứng dụng công nghệ hay AI nên một thách thức là làm thế nào để có thể hiểu và khai thác hết những ứng dụng AI phù hợp với nhu cầu. Chỉ biết dùng sơ lược một ứng dụng AI nhưng chưa hết tiềm năng là khá uổng phí. Bà Hà Lâm Tú Quỳnh, giám đốc truyền thông Google châu Á - Thái Bình Dương, phụ trách Việt Nam, cho biết khả năng tiếp cận AI và công nghệ số của học sinh, sinh viên Việt Nam và khu vực Đông Nam Á đang có những bước phát triển tích cực.  Nhiều nước đã đẩy mạnh tiếp cận, xây dựng chương trình giáo dục lấy AI và kỹ thuật số làm trọng tâm. “AI sẽ đóng vai trò quan trọng trong nhiều ngành nghề và lĩnh vực khác nhau, và việc ứng dụng AI vào giáo dục sẽ giúp học sinh có được những kỹ năng cần thiết để thích nghi với thị trường lao động trong tương lai”, bà Tú Quỳnh nói.",07/05/2024 14:00 GMT+7,https://tuoitre.vn/khi-sinh-vien-nghien-dung-ai-20240507122840116.htm,"Có sinh viên đang dùng một lúc đến 4 ứng dụng AI cho học tập, nghiên cứu, từ chương trình chính khóa đến luyện thi tiếng Anh…"
"Làm mực viết, màu vẽ từ rác thải hữu cơ","Mực viết, màu vẽ từ nghiên cứu của nhóm bạn trẻ đã giải quyết cùng lúc hai vấn đề. Đó là vừa tận dụng được nguồn rác thải hữu cơ vừa khai sinh một dòng mực thực vật an toàn cho sức khỏe người sử dụng. Biến rác thải hữu cơ thành mực Trưởng nhóm Trần Nhân Kiệt kể ý tưởng sử dụng rau củ quả bị loại bỏ để tạo ra mực viết và màu vẽ đã được nhóm hình thành khoảng một năm về trước. Nhận thấy ô nhiễm môi trường do rác thải hữu cơ tại địa phương đang là vấn đề đáng báo động trong khi lượng thực phẩm bị vứt bỏ ở các chợ, siêu thị và nhà máy chế biến là rất lớn. Lượng phế phẩm thực vật này bị bỏ chủ yếu do hỏng, quá chín hoặc không đạt tiêu chuẩn thương phẩm. Điều này gây lãng phí tài nguyên nghiêm trọng và tạo ra nhiều bãi rác, góp phần làm gia tăng ô nhiễm môi trường. Từ tháng 6-2023, nhóm bắt đầu nghiên cứu để quyết tâm tìm cách tái sử dụng triệt để nguồn nguyên liệu hữu cơ đang bị bỏ đi. Sau giờ học, các bạn lại lặn lội khảo sát thực tế tại một số chợ truyền thống, siêu thị và nhà máy thực phẩm ở Đà Nẵng.  Qua quan sát, nhóm ước tính lượng rau củ quả bị loại bỏ hằng ngày có thể lên tới hàng tấn. Con số khủng khiếp đó càng thôi thúc nhóm hành động, mục tiêu tận dụng tối đa nguồn nguyên liệu hữu cơ này thông qua việc sản xuất mực viết và màu vẽ. Kiệt cho biết để tạo ra mực viết và màu vẽ từ thực vật, nhóm bạn đã nghiên cứu và áp dụng các kỹ thuật chiết xuất, tinh chế và ổn định màu sắc dựa trên hợp chất anthocyanin - một nhóm sắc tố thực vật tự nhiên. Theo đó, nhóm tiến hành các bước như thu thập nguyên liệu, xử lý sơ bộ, chiết xuất sắc tố, lọc và nồng độ hóa để thu được các dung dịch màu sắc đa dạng. Sau nhiều lần nghiên cứu, thử nghiệm, cuối cùng nhóm cũng thu được những lọ mực, màu thực vật mang tên ""Botanical Inks"" đầu tiên trong niềm vỡ òa hạnh phúc.  ""Sản phẩm có tốc độ khô nhanh gấp sáu lần so với màu nước thông thường, có độ bền màu cao, an toàn cho sức khỏe người dùng và môi trường. Sự kết hợp giữa tính thẩm mỹ và tính bền vững sẽ làm nên sự khác biệt của Botanical Inks so với các sản phẩm màu vẽ truyền thống"", Kiệt nói. Để có được những sản phẩm như ý, nhóm đã gặp không ít thách thức, đặc biệt là trong việc tối ưu hóa quy trình trích ly và ổn định màu sắc của các dung dịch. Việc tìm ra được những thông số kỹ thuật phù hợp để đạt được chất lượng sản phẩm như mong muốn đòi hỏi các bạn phải thử nghiệm rất nhiều lần, kiên trì điều chỉnh các thông số.  Bên cạnh đó, việc tìm kiếm nguồn nguyên liệu ổn định và đáp ứng nhu cầu sản xuất cũng là một thách thức không hề nhỏ. Giải quyết vấn đề môi trường Đến nay, nhóm đã đưa sản phẩm Botanical Inks thử nghiệm tại một số trường mỹ thuật, trung tâm sáng tạo và các cộng đồng họa sĩ ở Đà Nẵng. Các giảng viên, họa sĩ chuyên môn đều đánh giá rất cao chất lượng, độ bền màu và tính an toàn của những sản phẩm này. Họa sĩ Thanh Hoàng (Đà Nẵng) - một trong số những người đã sử dụng màu thực vật của nhóm trong quá trình giảng dạy - cho biết rất ấn tượng với màu sắc rực rỡ, tươi mới và khả năng tạo nên những đường nét mềm mại của sản phẩm.  ""Tôi đánh giá cao việc sử dụng nguyên liệu hoàn toàn từ thực vật, không chứa hóa chất tổng hợp, đảm bảo an toàn cho người dùng. Mức giá dự kiến khi đưa ra thị trường chỉ vài chục nghìn đồng mỗi lọ là khá hợp lý, phù hợp với phân khúc khách hàng trung lưu"", cô Thanh Hoàng nói. Sinh viên năm 3 Nguyễn Hoàng Thanh Trâm - một thành viên trong nhóm - chia sẻ hiện các bạn đang kết nối thêm các doanh nghiệp và cơ sở giáo dục có quy mô hàng trăm học sinh sử dụng sản phẩm để tạo tiền đề mở rộng quy mô dự án.  ""Dự kiến trong tương lai, chúng mình sẽ mở rộng sản xuất, đa dạng hóa sản phẩm và phát triển kênh bán hàng trực tuyến để phục vụ nhu cầu ngày càng tăng của khách hàng"", Trâm chia sẻ. Phạm Như Uyên Nhi, một thành viên khác, cho biết nhóm hiện có kế hoạch mở rộng thêm lĩnh vực màu nhuộm vải. ""Từ những ưu điểm của sản phẩm, nhóm tin có thể tạo ra sự khác biệt khi phát triển công thức nhuộm mới, mở rộng danh mục sản phẩm để có thể cạnh tranh hiệu quả trên thị trường. Hy vọng ý tưởng của chúng mình sẽ góp phần nhỏ bé nhưng ý nghĩa vào việc giảm thiểu lượng rác thải hữu cơ, bảo vệ hệ sinh thái và cải thiện sức khỏe cộng đồng"", Nhi chia sẻ. Dự án Mực thực vật Botanical Inks đã vượt qua hàng trăm dự án trên toàn quốc lọt vào top 50 của cuộc thi Khởi nghiệp trong học sinh, sinh viên năm 2024 do Bộ GD-ĐT tổ chức. ",07/05/2024 11:42 GMT+7,https://tuoitre.vn/lam-muc-viet-mau-ve-tu-rac-thai-huu-co-20240507103558081.htm,"Từ các loại rác thải hữu cơ, nhóm năm sinh viên của Viện Nghiên cứu và đào tạo Việt - Anh (Đại học Đà Nẵng) đã hiện thực hóa ý tưởng làm ra loại mực viết, màu vẽ đặc biệt."
"Tuyển dụng nhà khoa học trẻ xuất sắc, lương thấp nhất 15,4 triệu","Sau khi công bố kết quả tuyển dụng đợt 1 năm 2024, Đại học Quốc gia TP.HCM tiếp tục thông báo tuyển dụng các nhà khoa học trẻ xuất sắc, các nhà khoa học đầu ngành về công tác tại đại học này đợt 2 (chương trình VNU350). Cần tuyển 64 nhà khoa học trong đợt 2 Đợt này, Đại học Quốc gia TP.HCM tuyển dụng 64 chỉ tiêu làm việc tại các đơn vị thành viên và trực thuộc. Trong đó Trường đại học Bách khoa tuyển 10 chỉ tiêu; Trường đại học Khoa học tự nhiên: 11 chỉ tiêu; Trường đại học Khoa học xã hội và Nhân văn: 6 chỉ tiêu; Trường đại học Quốc tế: 5 chỉ tiêu; Trường đại học Công nghệ thông tin: 13 chỉ tiêu; Trường đại học Kinh tế - Luật: 3 chỉ tiêu; Trường đại học An Giang: 3 chỉ tiêu; Viện Môi trường và Tài nguyên: 5 chỉ tiêu; Khoa Y: 5 chỉ tiêu; Trung tâm Nghiên cứu vật liệu cấu trúc nano và phân tử (INOMAR): 2 chỉ tiêu; Viện Công nghệ nano: 2 chỉ tiêu. Đại diện hội đồng tuyển dụng Đại học Quốc gia TP.HCM cho biết nếu lĩnh vực mà ứng viên quan tâm không có trong danh mục tuyển dụng của các đơn vị thì ứng viên có thể nộp hồ sơ trực tiếp cho Đại học Quốc gia TP.HCM. Để tham gia ứng tuyển chương trình VNU350, ứng viên cần đáp ứng các điều kiện, tiêu chuẩn chung: có trình độ tiến sĩ; có khả năng giảng dạy, nghiên cứu độc lập; có khát vọng, hoài bão, mong muốn đóng góp, cống hiến cho sự nghiệp phát triển của đất nước và của Đại học Quốc gia TP.HCM. Đối với nhà khoa học trẻ, cần đáp ứng ít nhất 1 trong 4 tiêu chí: (1) có bài báo khoa học được công bố trên các tạp chí, hội nghị uy tín; (2) có bằng phát minh, sáng chế đã được đăng ký thành công; (3) có sản phẩm khoa học, công nghệ đã được chuyển giao; (4) có hướng nghiên cứu mới, triển vọng, phù hợp với chiến lược phát triển Đại học Quốc gia TP.HCM. Đối với nhà khoa học đầu ngành, cần đáp ứng đủ 5 tiêu chí về kinh nghiệm và năng lực: (1) đứng đầu nhóm nghiên cứu hoặc trưởng phòng thí nghiệm; (2) chủ trì đề tài, dự án khoa học - công nghệ; (3) có công trình công bố trên các tạp chí khoa học uy tín hoặc sở hữu bằng độc quyền phát minh, sáng chế; (4) có kinh nghiệm giảng dạy, hướng dẫn nghiên cứu sinh; (5) có mối quan hệ, hợp tác trong nước và quốc tế. Thu nhập dành cho các nhà khoa học ra sao? Các nhà khoa học tham gia chương trình VNU350 sẽ được hưởng chính sách hỗ trợ từ Đại học Quốc gia TP.HCM và chính sách hỗ trợ cụ thể của từng đơn vị tuyển dụng. Trong đợt tuyển dụng này, các đơn vị thành viên còn công bố mức lương, thu nhập dành cho các ứng viên người Việt Nam và người nước ngoài. Đối với ứng viên người Việt Nam, tất cả đơn vị đều trả lương theo quy định của Nhà nước (tiến sĩ có hệ số 3.0): 5,4 triệu đồng/tháng, còn có thêm lương theo vị trí việc làm, thu nhập tăng thêm với mức từ 10 - 23,2 triệu đồng/tháng (tùy đơn vị). Bên cạnh đó, một số trường có chính sách thu nhập riêng, như Trường đại học Công nghệ thông tin hỗ trợ các bài báo khoa học thuộc danh mục ISI/Scopus, mức tối đa 200 triệu đồng/năm. Trong 1 năm đầu, được cấp 1 đề tài nghiên cứu khoa học cấp trường (kinh phí 35 triệu đồng). Trường đại học Kinh tế - Luật thu nhập trung bình của tiến sĩ có kinh nghiệm trên 3 năm 28 triệu đồng/tháng, phó giáo sư 45 triệu đồng/tháng, giáo sư: 51 triệu đồng/tháng. Chính sách thu hút ứng viên mới về trường: 350 triệu đồng (giáo sư), 250 triệu đồng (phó giáo sư), 150 triệu đồng (tiến sĩ) và hỗ trợ kinh phí khi đạt chức danh giáo sư 150 triệu đồng, phó giáo sư 100 triệu đồng. Đối với ứng viên người nước ngoài, lương vị trí việc làm tương ứng gấp 2-3 lần ứng viên người Việt Nam và các chế độ đãi ngộ khác theo thỏa thuận nêu rõ trong hợp đồng lao động (tùy trường).",07/05/2024 09:32 GMT+7,https://tuoitre.vn/tuyen-dung-nha-khoa-hoc-tre-xuat-sac-luong-thap-nhat-15-4-trieu-20240507084635602.htm,"Đại học Quốc gia TP.HCM vừa công bố chỉ tiêu tuyển dụng đợt 2 chương trình thu hút, giữ chân và phát triển các nhà khoa học trẻ xuất sắc, các nhà khoa học đầu ngành."
