Title,Content,Date,Url,Summary
Các ưu tiên xét tuyển thẳng của Đại học Quốc gia TP.HCM,"Đây là các phương thức xét tuyển do Đại học Quốc gia TP.HCM quy định, trong đó ưu tiên xét tuyển thẳng thí sinh giỏi, tài năng của trường THPT chiếm không quá 5% tổng chỉ tiêu, và ưu tiên xét tuyển tối đa 20% tổng chỉ tiêu ngành/nhóm ngành tại các đơn vị. Hiệu trưởng giới thiệu 1 học sinh thuộc top 5 có điểm cao nhất Phương thức ưu tiên xét tuyển thẳng thí sinh giỏi, tài năng của trường THPT áp dụng cho các trường THPT bao gồm: trường tiểu học - THCS - THPT, trường THCS - THPT và trường THPT (không gồm trung tâm giáo dục thường xuyên). Hiệu trưởng chỉ giới thiệu 1 học sinh thuộc nhóm 5 học sinh có điểm trung bình cộng học lực 3 năm THPT cao nhất trường. Các trường hợp vi phạm nguyên tắc đăng ký trên sẽ bị loại khỏi danh sách đăng ký xét tuyển đối với phương thức này. Điều kiện đăng ký: thí sinh được hiệu trưởng trường THPT giới thiệu là học sinh tài năng của trường, đảm bảo các tiêu chí chính: học lực giỏi và hạnh kiểm tốt trong 3 năm THPT, và điểm trung bình cộng học lực 3 năm THPT thuộc nhóm 5 học sinh cao nhất trường. Các tiêu chí kết hợp: giấy chứng nhận hoặc giấy khen đạt giải thưởng học sinh giỏi cấp tỉnh/thành phố giải nhất, nhì, ba (chọn giải thưởng cao nhất đạt được ở THPT); các chứng chỉ ngoại ngữ quốc tế; giấy chứng nhận hoặc giấy khen, hồ sơ khác liên quan đến thành tích học tập, năng khiếu trong các cuộc thi thể thao, nghệ thuật và rèn luyện trong quá trình học THPT. Thí sinh đăng ký xét tuyển tối đa 3 nguyện vọng ngành/nhóm ngành vào 1 trường đại học thành viên, phân hiệu và khoa trực thuộc Đại học Quốc gia TP.HCM (chỉ giới hạn 1 đơn vị). Ưu tiên xét tuyển học sinh 149 trường THPT Đối tượng của phương thức ưu tiên xét tuyển là học sinh học tập và tốt nghiệp THPT tại 149 trường THPT thuộc diện ưu tiên xét tuyển theo quy định của đại học này năm 2024. Điều kiện đăng ký theo nội dung chi tiết về các ngành/nhóm ngành/chương trình xét tuyển áp dụng cho phương thức này (tham khảo thông tin tại đề án tuyển sinh năm 2024 của đơn vị). Thí sinh được đăng ký không giới hạn số lượng nguyện vọng, không giới hạn số đơn vị (có phân biệt thứ tự nguyện vọng). Chi tiết danh sách 149 trường THPT thuộc diện ưu tiên xét tuyển theo quy định của Đại học Quốc gia TP.HCM năm 2024 và các mẫu phiếu đăng ký xét tuyển tại đây. Cách thức đăng ký và nộp hồ sơ xét tuyển Từ ngày 15-5 đến 15-6, những thí sinh là học sinh giỏi, tài năng trong học tập và học sinh 149 trường THPT có thể nộp hồ sơ xét tuyển vào Đại học Quốc gia TP.HCM theo hai phương thức trên. Để đăng ký xét tuyển, thí sinh truy cập trang thông tin điện tử của Đại học Quốc gia TP.HCM tại https://tuyensinh.vnuhcm.edu.vn hoặc trang https://vnuhcm.edu.vn/Đào tạo/Đại học/Cổng thông tin tuyển sinh để đăng ký hồ sơ trực tuyến. Đối với ưu tiên xét tuyển thẳng thí sinh giỏi, tài năng, sau khi đăng ký thành công, thí sinh in phiếu đăng ký xét tuyển, ký tên và xác nhận giới thiệu của hiệu trưởng trường THPT về việc đảm bảo các tiêu chí chính. Sau đó, thí sinh gửi hồ sơ giấy đăng ký xét tuyển trực tiếp hoặc trực tuyến đến các trường đại học thành viên, phân hiệu và khoa trực thuộc Đại học Quốc gia TP.HCM theo thông báo hướng dẫn của các đơn vị. Trong đó thí sinh lưu ý phải nộp bài luận viết tay của thí sinh về nguyện vọng xét tuyển vào ngành/nhóm ngành. Đối với ưu tiên xét tuyển, thí sinh cũng đăng ký trực tuyến trên trang thông tin điện tử của Đại học Quốc gia TP.HCM. Sau khi đăng ký thành công, thí sinh in phiếu đăng ký ưu tiên xét tuyển, ký tên và xác nhận thông tin của trường THPT. Sau đó nộp hồ sơ giấy đăng ký ưu tiên xét tuyển trực tiếp hoặc gửi qua đường bưu điện về các đơn vị. Phiếu đăng ký ưu tiên xét tuyển (được in từ hệ thống đăng ký ưu tiên xét tuyển Đại học Quốc gia TP.HCM sau khi hoàn thành hai bước trên). Số lượng bộ hồ sơ đăng ký ưu tiên xét tuyển tương ứng với số lượng đơn vị đã đăng ký. Thí sinh có nguyện vọng xét tuyển vào đơn vị nào thì nộp hồ sơ tại đơn vị đó. Các hồ sơ yêu cầu đính kèm tương ứng cho từng đơn vị (tham khảo điều kiện đăng ký xét tuyển do hội đồng tuyển sinh các đơn vị quy định tại đề án tuyển sinh năm 2024 của đơn vị). Đại học Quốc gia TP.HCM thực hiện lọc ảo, xét tuyển từ ngày 20-6 đến ngày 24-6. Các trường thuộc Đại học Quốc gia TP.HCM sẽ công bố kết quả xét tuyển hai phương thức trên trước ngày 25-6.",09/05/2024 19:05 GMT+7,https://tuoitre.vn/cac-uu-tien-xet-tuyen-thang-cua-dai-hoc-quoc-gia-tp-hcm-20240509184925363.htm,"Đại học Quốc gia TP.HCM vừa công bố triển khai phương thức ưu tiên xét tuyển thẳng thí sinh giỏi, tài năng của trường THPT, ưu tiên xét tuyển học sinh giỏi của các trường THPT năm 2024."
Tuổi Trẻ và Google tổ chức sự kiện AI Day tại TP.HCM,"Chương trình là cơ hội để học sinh, sinh viên tiếp cận những kiến thức thú vị, bổ ích, giúp cho quá trình định hướng nghề nghiệp và tìm kiếm việc làm sau này. Trí tuệ nhân tạo (AI) ngày càng chứng minh được sự tiện ích, hiệu quả vượt trội khi các ứng dụng của AI xuất hiện trong đa dạng mọi lĩnh vực giáo dục, y tế, ngân hàng, giải trí… AI không chỉ giúp tối ưu hóa quy trình làm việc mà còn mở ra những cánh cửa mới cho sự sáng tạo và đổi mới. Với mong muốn giúp học sinh, sinh viên tiếp cận và sử dụng các ứng dụng AI trong tìm kiếm việc làm và định hướng nghề nghiệp, bắt kịp xu hướng thời đại, báo Tuổi Trẻ phối hợp với Google tổ chức sự kiện ""Hiểu AI làm giàu hành trang nghề nghiệp"". Trong khuôn khổ chương trình AI Day, người tham gia sẽ được tiếp cận các thông tin bổ ích được trình bày bởi các chuyên viên AI của Google, diễn giả, KOL nổi tiếng về AI, tham quan các gian hàng liên quan đến các ngành nghề có ứng dụng AI. Khu vực hội thảo với các phiên sáng chiều, có sự góp mặt của giám đốc quốc gia của Google, Samsung cùng các chuyên gia của những nền tảng công nghệ hàng đầu hiện nay.  Những cái tên nổi bật sẽ góp mặt bao gồm, ông Marc Woo - giám đốc điều hành, phụ trách Việt Nam, Google châu Á - Thái Bình Dương, bà Trương Mỹ Thy - quản lý chiến lược sản phẩm điện thoại cao cấp - ngành hàng chiến lược sản phẩm, Công ty Điện Tử Samsung Vina, bà Đào Thu Phương - giám đốc điều hành tại Việc làm 24h, TS Lê Văn Quốc Anh, trưởng khoa Công nghệ thông tin, Trường ĐH Giao thông vận tải TP.HCM (UTH)... Các diễn giả sẽ chia sẻ những bước phát triển mới nhất của AI trong khu vực và trên thế giới cũng như xu hướng nghề nghiệp trong tương lai, ứng dụng của AI trong nghề nghiệp và các lĩnh vực như giáo dục, y tế, kinh doanh quản lý… Đặc biệt, hội thảo ""Hiểu AI, làm giàu hành trang nghề nghiệp"" cung cấp những góc nhìn và hiểu biết sâu sắc về cách AI sẽ định hình nghề nghiệp tương lai, chương trình cũng cung cấp các khóa học cấp tốc về việc ứng dụng bộ kỹ năng AI trong thực tế.  Talkshow ""Ứng dụng AI trong Y tế"" với các diễn giả có chuyên môn, kinh nghiệm trong lĩnh như TS.BS Trương Nguyễn Khánh Hưng - tốt nghiệp tiến sĩ về Trí truệ nhân tạo trong Y khoa tại ĐH Y khoa Đài Bắc, khoa Ngoại Chấn thương - chỉnh hình, Bệnh viện Chợ Rẫy; ThS Lê Thị Thu Thảo - phó lab Trung tâm Hỗ trợ sinh sản, Bệnh viện Đa khoa Tâm Anh; bác sĩ chuyên khoa 1 Trương Chí Bảo thuộc Nha khoa Nhân Tâm… Buổi chiều diễn ra phiên đối thoại (AMA) do Google & Tinh Tế chủ trình, sẽ cùng khán giả giao lưu về tính ứng dụng AI trong sáng tạo nội dung.  Các diễn giả hàng đầu trong lĩnh vực công nghệ thông tin sẽ góp mặt bao gồm bà Xiuxian Ho - giám đốc Truyền thông, phụ trách Singapore & Việt Nam, Google Châu Á - Thái Bình Dương, ông Nguyễn Đoàn Minh Đức - moderator tại diễn đàn công nghệ Tinh Tế, bà Đinh Hằng - blogger mảng du lịch, ông Nguyễn Ngọc Long - chuyên gia truyền thông tại Biệt đội Trăng Đen 4.0… Trong suốt chương trình AI Day, các gian hàng của công ty công nghệ, trường đại học, cơ sở y tế… giới thiệu những công nghệ mới nhất được áp dụng trong lĩnh vực tương ứng. Hơn 400 sinh viên được đào tạo thực hành kỹ năng AI trong hai buổi do các kỹ sư của Google trực tiếp hướng dẫn. Đơn vị này cũng giới thiệu nhiều khóa học trang bị kỹ năng số và AI cho giới trẻ Việt Nam hoàn toàn miễn phí. Tại gian hàng của các trường đại học tham gia AI Day, các bạn học sinh còn được tư vấn xu hướng nghề nghiệp ""hot"" liên quan đến AI ở các đại học hiện nay. Nhiều phần quà hấp dẫn cũng sẽ được gửi đến khách tham dự khi vượt qua những trò chơi minigame thú vị tại chương trình. Bà Hà Lâm Tú Quỳnh, giám đốc Quan hệ công chúng và Truyền thông, phụ trách Việt Nam, Google châu Á - Thái Bình Dương, cho biết qua sự kiện ""Hiểu AI, làm giàu hành trang nghề nghiệp"", Google muốn nâng cao nhận thức về tầm quan trọng của công cụ AI trong môi trường làm việc.  Từ đó các bạn trẻ sẽ có được những định hướng nghề nghiệp phù hợp và có ý thức phát triển kỹ năng sử dụng công cụ AI bởi đây sẽ là bộ kỹ năng cần thiết cho quá trình làm việc của các bạn. ""Các công cụ AI có thể làm gì? Phải làm gì để sử dụng công cụ AI một cách hiệu quả? Thông qua sự hướng dẫn của các chuyên gia tại sự kiện, các bạn trẻ có thể nắm được phương thức hiệu quả nhất để sử dụng công cụ AI"", bà Tú Quỳnh cho biết.",09/05/2024 19:00 GMT+7,https://tuoitre.vn/tuoi-tre-va-google-to-chuc-su-kien-ai-day-tai-tp-hcm-20240509172150026.htm,"Ngày 10-5, AI Day - 'Hiểu Al làm giàu hành trang nghề nghiệp' được Tuổi Trẻ phối hợp với Google tổ chức tại TP.HCM với nhiều hoạt động hấp dẫn."
"Sinh viên làm màng bọc thực phẩm từ vỏ thanh long, chanh dây","Nhóm gồm ba nữ sinh Nguyễn Hoàng Kim Long, Lê Thùy Linh, Nguyễn Ngọc Thùy Dương (khoa công nghệ sinh học) đã tận dụng vỏ trái chanh dây và thanh long để tạo ra màng bọc thực phẩm có tên gọi ""Yummy Plastic"". Nguyên liệu 100% tự nhiên Bạn Nguyễn Hoàng Kim Long cho biết qua nghiên cứu, nhóm nhận thấy người nông dân chỉ tập trung khai thác kinh tế từ nông sản, ít ai nghĩ đến phế phẩm nông nghiệp có thể tạo ra sản phẩm thân thiện môi trường. ""Chúng tôi làm ra màng bọc hoàn chỉnh chỉ trong khoảng một tuần. Sản phẩm có được qua các bước như thu gom vỏ trái cây từ các hàng quán, làm sạch, phơi khô, tách chiết pectin, phối trộn với nước, sấy mẫu ở nhiệt độ 60℃ trong 24 tiếng và thu thành phẩm. Sản phẩm của chúng tôi sử dụng công nghệ xanh, thành phần hoàn toàn tự nhiên nên rất an toàn cho cơ thể, dễ phân hủy trong môi trường, phối trộn nguyên liệu phụ gia trong thực phẩm nên hoàn toàn có thể ăn được"" - Kim Long nói thêm. Lê Thùy Linh chia sẻ: ""Thời gian sử dụng màng bọc khoảng 3-4 tuần nếu bảo quản ở nhiệt độ thấp hoặc trong ngăn mát tủ lạnh. Chúng tôi thử nghiệm thấy màng bọc rất phù hợp cho những thực phẩm tươi như thịt heo, gà, cá… và dễ dàng sử dụng ở những thực phẩm khác. Ngoài ra, trong thanh long chứa betacyanin, đây là chất chỉ thị màu tự nhiên, nhạy với môi trường pH. Khi môi trường pH tăng, chiết xuất trong thanh long sẽ thay đổi, chuyển từ màu đỏ sang mất màu. Nhờ đó mà người tiêu dùng có thể dễ dàng nhận biết thực phẩm bị hư hỏng khi sử dụng màng bọc từ vỏ thanh long"". Mong muốn tạo ra nguồn thu mới cho người nông dân Nguyễn Ngọc Thùy Dương cho biết với 200g vỏ trái cây, có thể tạo ra được một cuộn màng bọc dài 50m. ""Nhóm đã dựa trên môn hóa phân tích, hóa hữu cơ... để ứng dụng và phát triển sản phẩm. Ra thị trường sẽ có giá 70.000 đồng/cuộn màng bọc từ vỏ thanh long, 60.000 đồng/cuộn màng bọc từ vỏ chanh dây. Nhóm mong muốn có thể giải quyết được vỏ phế phẩm trong trồng trọt, giúp người nông dân có thêm nguồn thu nhập mới từ sản phẩm bỏ đi. Bên cạnh đó, nhóm cũng mong người dân có thể giảm rác thải nhựa, thay đổi thói quen sinh hoạt, sử dụng sản phẩm thân thiện để môi trường thêm xanh hơn"" - Dương bộc bạch. TS Lê Quang Phong - trưởng bộ môn hóa ứng dụng Trường đại học Quốc tế, Đại học Quốc gia TP.HCM - nhận xét đề tài có tính sáng tạo. ""Tôi thấy các bạn biết sử dụng nguồn nguyên liệu tái tạo, hữu cơ thân thiện với con người. Nhóm đã tận dụng vỏ trái cây để làm ra sản phẩm có giá trị kinh tế cao, hỗ trợ người nông dân, phù hợp nhu cầu của người tiêu dùng. Ngày nay người tiêu dùng rất quan tâm đến sức khỏe, môi trường nên nhu cầu sử dụng sản phẩm xanh lớn, màng bọc này của các bạn hoàn toàn có khả năng thương mại hóa"" - TS Phong nhấn mạnh. Thầy Phong cho biết nhóm cũng cần khắc phục thời gian sử dụng của màng bọc, tìm thêm nguồn nguyên liệu khác giá rẻ hơn.",09/05/2024 18:33 GMT+7,https://tuoitre.vn/sinh-vien-lam-mang-boc-thuc-pham-tu-vo-thanh-long-chanh-day-20240509154246665.htm,"Tận dụng vỏ trái cây, nhóm nữ sinh viên Trường đại học Quốc tế (Đại học Quốc gia TP.HCM) đã làm ra màng bọc thực phẩm 100% nguyên liệu tự nhiên, có thể ăn được."
Hơn 56.000 chứng chỉ IELTS cấp trái phép: Bộ Giáo dục và Đào tạo chấp nhận sử dụng bình thường,"Theo đó, các chứng chỉ năng lực ngoại ngữ của nước ngoài do các đơn vị liên kết tổ chức thi cấp, khi đáp ứng các điều kiện bảo đảm chất lượng, sẽ tiếp tục được sử dụng bình thường theo quy định của Bộ Giáo dục và Đào tạo về thi, tuyển sinh và đào tạo, không ảnh hưởng tới quyền lợi của người được cấp chứng chỉ. Thời gian tới, Cục Quản lý chất lượng sẽ phối hợp với các cơ quan chức năng tiếp tục tăng cường công tác kiểm tra, giám sát hoạt động của các đơn vị, tổ chức thực hiện đào tạo, liên kết đào tạo, tổ chức thi và cấp chứng chỉ ngoại ngữ và kịp thời phát hiện, xử lý hoặc kiến nghị xử lý đối với sai phạm (nếu có), bảo đảm quyền lợi chính đáng của người học và người dự thi, đúng quy định của pháp luật. Sáng cùng ngày, IDP Việt Nam cũng chính thức phát đi thông báo thông tin về việc hơn 56.000 chứng chỉ IELTS do tổ chức này cấp ở Việt Nam năm 2022 bị Thanh tra Bộ Giáo dục và Đào tạo kết luận là trái phép. ""IELTS là bài kiểm tra ngôn ngữ có giá trị cao và đáng tin cậy nhất trên thế giới. Chúng tôi biết rằng vấn đề về tính hợp lệ của chứng chỉ IELTS trong năm 2022 đang thu hút sự quan tâm của truyền thông cũng như các thí sinh. Chúng tôi xin khẳng định các chứng chỉ được cấp trong giai đoạn này vẫn được hơn 12.000 tổ chức trên toàn thế giới công nhận. Chúng tôi sẽ tiếp tục phối hợp làm việc chặt chẽ với Bộ Giáo dục và Đào tạo như từ trước đến nay để đảm bảo tuân thủ theo mọi yêu cầu của cơ quan quản lý các cấp sở tại"", trích thông báo của IDP Việt Nam.",09/05/2024 17:09 GMT+7,https://tuoitre.vn/hon-56-000-chung-chi-ielts-cap-trai-phep-bo-gd-dt-chap-nhan-su-dung-binh-thuong-20240509114717861.htm,"Chiều 9-5, Cục Quản lý chất lượng, Bộ Giáo dục và Đào tạo chính thức thông tin về phương án xử lý với hơn 56.000 chứng chỉ IELTS do IDP tổ chức thi tại Việt Nam trong thời gian chưa được cấp phép."
"Kiểm định đại học: Sinh viên phụ bán cà phê, bưng phở cũng được coi là có việc làm","Theo nhiều bạn đọc, lỗ hổng kiểm định đại học tuy là chuyện cũ nhưng vẫn phải nói. Để làm đẹp báo cáo kiểm định, một số trường đại học công bố tỉ lệ có việc làm của sinh viên sau tốt nghiệp cao ngất ngưởng. Có trường tỉ lệ này lên đến 100% ở tất cả các ngành. Ngán ngẩm kiểm định đại học Bạn đọc Minh chỉ ra thực trạng: ""Nhiều nơi khi kiểm định cơ sở vật chất thì đi mượn trang thiết bị về trưng bày. Phòng học thì làm hợp đồng thuê nhà, thuê cơ sở giảng dạy, hợp đồng hợp tác cơ sở thực tập chỉ cho có hình thức. Thu thập việc làm sinh viên sau tốt nghiệp thì em đi phụ bán cà phê, bưng phở cũng xếp vào có việc làm. Giáo trình thì cóp nhặt, chỉ có cái tiêu đề cho đẹp, ruột thì chắp vá. Đội ngũ giảng viên trước khi kiểm định thì ký hợp đồng làm việc, hợp đồng lao động, kiểm định xong giải tán"". Từng tham dự buổi công bố kết quả đánh giá năng lực của một trường đại học, độc giả Do Nhat ngán ngẩm: ""Nghe một thành viên trong đoàn kiểm định giáo dục nhận xét về các tiêu chí lĩnh vực khoa học công nghệ mà phát hoảng. Nói chung vô thưởng vô phạt và sai các thuật ngữ, khái niệm về công bố khoa học và chuyển giao công nghệ. Vậy mà cuối cùng trường đại học này vẫn nhận được kết quả đạt và một số khuyến nghị mà áp dụng cho trường nào cũng đúng!"". Độc giả Hai minh chứng: ""Trường đạt kiểm định chưa chắc gì có điểm đầu vào cao, sinh viên ra trường có nhiều việc làm tốt. Trường có xếp hạng cao nhất thì điểm sàn thấp nhất. Bên cạnh đó, không thể không lo ngại hiện nay đội ngũ giảng viên chất lượng cực thấp trong một số trường đại học, đặc biệt là các trường đại học đi lên từ trung cấp hay cao đẳng. Vì thế, nên tìm phương án khác để nâng cao chất lượng kiểm định. Một trong những phương án là cần chuẩn hóa đội ngũ giảng viên"". Cách nào nâng chất kiểm định đại học? ""Tư tưởng trọng bằng cấp đã ăn sâu nên người người, nhà nhà bằng mọi giá để vào được đại học bất chấp, còn các trường đại học thì luôn thỏa mãn nhu cầu này, miễn là thu được càng nhiều tiền càng tốt. Hãy để các nhà tuyển dụng đánh giá năng lực thực sự của sinh viên"" - bạn đọc Lại Quang Tấn bình luận. Vì thế, theo độc giả Vinh: ""Có lẽ không nên bắt buộc các trường thực hiện kiểm định, mà nên để trường tự quyết định khi nào, bao lâu mới kiểm định một lần cho những ngành cần thiết và kiểm định đủ chuyên môn sâu. Mặt khác, phụ huynh cũng cần thay đổi cách chọn trường cho con. Không dựa vào danh tiếng và thứ hạng của kiểm định đại học nữa, mà dựa vào thực tế việc làm của sinh viên sau khi tốt nghiệp"". Bạn đọc Phạm Xuân Thanh có ý kiến: ""Quy chế kiểm định và quy trình kiểm định là chung cho tất cả các lĩnh vực, nhưng chuyên gia kiểm định phải có chuyên môn sâu về từng lĩnh vực được kiểm định. Ngoài ra, Bộ Giáo dục và Đào tạo nên thuê chuyên gia thẩm định kín một số báo cáo đánh giá độc lập với các trung tâm kiểm định"". Độc giả Đạt Nguyễn cho rằng: ""Khó có tiêu chuẩn kiểm định nào chuẩn được vì thước đo đầu ra của sinh viên không rõ ràng và không có số liệu đúng. Ngoài ra yếu tố thị trường làm cho các trường đại học đua nhau mở ngành theo ""trend"" để thu hút sinh viên nhưng giáo trình, giảng viên chuyên môn được đào tạo đúng ngành thì không có. Cần mời những người đang làm chuyên môn kỹ thuật, kinh doanh giỏi được đào tạo thêm về kỹ năng sư phạm qua giảng dạy cũng là cách tăng chất lượng đào tạo thực tiễn cho sinh viên. Khi đó sinh viên ra trường mới có kỹ năng tốt, hiểu được thực tế môi trường thì mới có việc làm tốt"".",09/05/2024 15:59 GMT+7,https://tuoitre.vn/kiem-dinh-dai-hoc-sinh-vien-phu-ban-ca-phe-bung-pho-cung-duoc-coi-la-co-viec-lam-20240509150950204.htm,"Làm thế nào để bịt lỗ hổng kiểm định đại học khi sinh viên tốt nghiệp đi phụ bán cà phê, bưng phở cũng xếp vào có việc làm?"
