Title,Content,Date,Url,Summary
Đề nghị hỗ trợ học phí cho học sinh TP.HCM,"Chỉ hỗ trợ học phí cho học sinh THCS Sở Giáo dục và Đào tạo TP.HCM vừa có tờ trình gởi UBND TP về việc hỗ trợ học phí năm học 2024 - 2025 cho học sinh thành phố. Tờ trình nêu rõ xét yếu tố phục hồi và tăng trưởng kinh tế năm 2024, Sở Giáo dục và Đào tạo đề xuất UBND TP chấp thuận chủ trương xây dựng chính sách hỗ trợ học phí năm học 2024 - 2025. Trong đó, đối tượng được áp dụng là học sinh THCS công lập, ngoài công lập và học viên giáo dục thường xuyên THCS trên địa bàn thành phố. Không áp dụng với các học sinh đang học tại cơ sở giáo dục có vốn đầu tư nước ngoài. Thời gian áp dụng 9 tháng năm học 2024 - 2025.  Nguồn kinh phí thực hiện hỗ trợ học phí trích từ nguồn ngân sách thành phố. Mức hỗ trợ dự kiến 100.000 đồng/học sinh/tháng đối với nhóm 1 và 85.000 đồng/học sinh/tháng đối với nhóm 2. Nhóm 1 là học sinh tại các trường ở thành phố Thủ Đức và các quận: 1, 3, 4, 5, 6, 7, 8, 10, 11, 12, Bình Thạnh, Phú Nhuận, Gò Vấp, Tân Bình, Tân Phú, Bình Tân. Nhóm 2 là học sinh học các trường ở các huyện Bình Chánh, Hóc Môn, Củ Chi, Nhà Bè và Cần Giờ. Theo sở thì dự toán kinh phí thực hiện chính sách hỗ trợ học phí là 421 tỉ đồng. Trong đó, kinh phí thực hiện miễn học phí cho học sinh công lập là 399 tỉ đồng, ngoài công lập 22 tỉ đồng. Chính sách ưu việt đặc thù Theo Sở Giáo dục và Đào tạo TP.HCM, qua tổng kết, đánh giá việc thực hiện chính sách hỗ trợ học phí trong 3 năm học vừa qua, sở nhận thấy chính sách này luôn nhận được sự ủng hộ, đồng thuận của người dân và xã hội. Việc hỗ trợ học phí được khẳng định là chính sách ưu việt đặc thù của riêng thành phố. Chính sách đặc thù hỗ trợ học phí cho học sinh thể hiện rõ sự quan tâm đầu tư của thành phố cho giáo dục. Việc này đảm bảo chất lượng giáo dục và cơ hội học tập cho người dân; thực hiện tốt các nhiệm vụ sau khi gia nhập Mạng lưới thành phố học tập toàn cầu của UNESCO…",10/05/2024 21:13 GMT+7,https://tuoitre.vn/de-nghi-ho-tro-hoc-phi-cho-hoc-sinh-tp-hcm-20240510203656305.htm,Mức hỗ trợ học phí cho học sinh THCS là 100.000 đồng/học sinh/tháng đối với nhóm 1 và 85.000 đồng/học sinh/tháng đối với nhóm 2.
"Ngoài IDP, Hội đồng Anh cũng cấp sai phép hơn 90.000 chứng chỉ IELTS, Aptis","Bộ Giáo dục và Đào tạo vừa có kết luận thanh tra về việc liên kết tổ chức thi, cấp chứng chỉ năng lực ngoại ngữ của nước ngoài tại Việt Nam đối với Công ty TNHH British Council (Hội đồng Anh) Việt Nam. Kết luận thanh tra của Bộ Giáo dục và Đào tạo chỉ ra từ ngày 1-1-2022 đến hết ngày 31-12-2022, Hội đồng Anh đã liên kết tổ chức thi, cấp 45.679 chứng chỉ tiếng Anh Aptis và 58.414 chứng chỉ tiếng Anh IELTS trên toàn quốc. Trong đó, giai đoạn từ ngày 1-1-2022 đến ngày 9-9-2022 khi chưa được Bộ Giáo dục và Đào tạo phê duyệt liên kết tổ chức thi, Hội đồng Anh đã thực hiện liên kết tổ chức 343 đợt thi, cấp 31.871 chứng chỉ tiếng Anh Aptis và tổ chức 393 đợt thi IELTS trên giấy, cấp 33.196 chứng chỉ và 589 đợt thi IELTS trên máy tính, cấp 11.149 chứng chỉ. Tổng cộng 76.216 chứng chỉ tiếng Anh bao gồm Aptis và IELTS được Hội đồng Anh cấp trong giai đoạn này. Thanh tra Bộ Giáo dục và Đào tạo khẳng định: ""Giai đoạn 1-1-2022 đến ngày 9-9-2022, Công ty TNHH British Council thực hiện liên kết tổ chức thi, cấp chứng chỉ Aptis và chứng chỉ IELTS trên lãnh thổ Việt Nam là vi phạm quy định tại điều 21, điều 22 và điều 23 nghị định 86/2018/NĐ-CP ngày 6-6-2018 của Chính phủ"". Tiếp đó trong giai đoạn từ ngày 10-9 đến trước ngày Hội đồng Anh được Bộ Giáo dục và Đào tạo phê duyệt liên kết tổ chức thi cấp chứng chỉ tiếng Anh, Hội đồng Anh tiếp tục liên kết tổ chức thi cấp 6.046 chứng chỉ Aptis (đến trước ngày 10-11) và 8.219 chứng chỉ IELTS (đến trước ngày 17-11). Tổng cộng cả hai loại là 14.265 chứng chỉ. Thanh tra Bộ Giáo dục và Đào tạo kết luận: ""Giai đoạn từ 10-9-2022 đến ngày được Bộ Giáo dục và Đào tạo cho phép, Công ty TNHH British Council thực hiện liên kết tổ chức thi, cấp chứng chỉ Aptis và chứng chỉ IELTS trên lãnh thổ Việt Nam là vi phạm quy định tại thông tư số 11/2022/TT-BGDĐT ngày 26-7-2022 của Bộ Giáo dục và Đào tạo và điều 21 nghị định 86/2018/NĐ-CP ngày 6-6-2018 của Chính phủ"". Tổng cộng cả hai giai đoạn từ 1-1-2022 đến ngày 10-11-2022 (với chứng chỉ Aptis) và ngày 17-11-2022 (với chứng chỉ IELTS), Hội đồng Anh đã cấp sai phép 90.481 chứng chỉ, trong đó có 52.564 chứng chỉ IELTS. Thanh tra Bộ Giáo dục và Đào tạo đề nghị Hội đồng Anh rà soát, báo báo Cục Quản lý chất lượng, đề xuất hướng xử lý đối với số lượng chứng chỉ ngoại ngữ mà công ty đã liên kết tổ chức thi cấp chứng chỉ năng lực ngoại ngữ của nước ngoài trên lãnh thổ Việt Nam khi chưa được phép của cơ quan quản lý nhà nước có thẩm quyền.",10/05/2024 20:46 GMT+7,https://tuoitre.vn/ngoai-idp-hoi-dong-anh-cung-cap-sai-phep-hon-90-000-chung-chi-ielts-aptis-20240510202738308.htm,"Hội đồng Anh đã cấp 90.481 chứng chỉ tiếng Anh, trong đó có 52.564 chứng chỉ IELTS khi chưa được cấp phép liên kết tổ chức thi."
Đại học Kinh tế TP.HCM kết luận gì vụ nhà khoa học bị gỡ bài báo quốc tế?,"Trao đổi với Tuổi Trẻ Online chiều 10-5, TS Đinh Công Khải - phó giám đốc UEH - cho biết về việc GS.TS Võ Xuân Vinh có liên quan đến bài báo khoa học trên tạp chí Environmental Science and Pollution Research thuộc Nhà xuất bản Springer bị gỡ bỏ, nhà trường đã họp, làm rõ và có biên bản kết luận đối với vụ việc từ tháng 3-2024. Bài báo của nhóm nghiên cứu chính thức xuất bản trực tuyến vào ngày 13-4-2021 và tạp chí khoa học này gỡ bài vào 14-3-2024 vì lý do chứa một số cụm từ bị xuyên tạc (tortured phrases), bao gồm cả trong tiêu đề. Bài báo này thuộc nhóm các bài báo được bình duyệt bởi biên tập viên khách mời được tạp chí tổng điều tra, rà soát. GS Võ Xuân Vinh, trực thuộc Viện Nghiên cứu kinh doanh UEH, là tác giả thứ 5 trong số 9 tác giả của công trình. Ông Võ Xuân Vinh giải trình những gì? Theo ông Khải, UEH đã làm việc và lập biên bản ghi nhận, xử lý vụ việc với GS Vinh vào ngày 27-3. Tại buổi làm việc, ông Vinh đã tường trình và cung cấp các minh chứng cần thiết. Theo đó, ngay sau khi phát hiện bị lạm danh, ông Vinh đã chủ động liên hệ tổng biên tập tạp chí từ ngày 15-2, một tháng trước khi bài báo bị gỡ bỏ. Trong nội dung thư gửi, ông Vinh khẳng định không liên quan đến bài báo, quy trình nộp bài báo, không đồng ý và không cho phép việc ghi tên mình ở mục tác giả của bài báo. Ông Vinh đã đề nghị tạp chí xóa tên mình ra khỏi bài báo. Ngày 21-3, ông Vinh nhận được email hồi đáp từ tổng biên tập tạp chí cho biết tác giả Mohammed Musah đã gửi thư cho tổng biên tập xác nhận về việc tự ý đưa tên ông Võ Xuân Vinh vào bài báo mà không có sự đồng thuận từ phía ông Vinh, đồng thời xin lỗi về sự việc này. Tạp chí cũng đã chuyển tiếp thư này đến bộ phận liêm chính học thuật của nhà xuất bản để xử lý các bước tiếp theo. Giải trình thêm với nhà trường, trong số tác giả của bài báo này, ông Vinh đã từng làm việc với tác giả thứ nhất Mohammed Musah và tác giả thứ hai Yusheng Kong trong một dự án Nature Fund về phát triển bền vững. Hai tác giả này ở Đại học Giang Tô, một đại học lớn ở Trung Quốc. ""Ông Vinh không nhận tài trợ, thưởng từ UEH cho bài báo này"" Sau khi làm việc với ông Vinh, UEH đã có kết luận ban đầu về vụ việc. Lãnh đạo UEH cho biết với quy trình làm việc chặt chẽ, định hướng nhìn nhận thẳng thắn các sai phạm (nếu có) của cá nhân nhà nghiên cứu, đồng thời, không quy kết thành tựu của cả quá trình, UEH đã cân nhắc kỹ các luận cứ, bằng chứng và kết luận bài báo bị rút liên quan đến quy trình xử lý của biên tập viên khách mời và hoạt động bình duyệt của tạp chí. ""Cá nhân ông Vinh không nhận tài trợ/thưởng từ nhà trường cho bài báo này. Ông Vinh cũng đã đưa được các minh chứng về việc bị lạm danh. Đây là trường hợp rút bài báo nghiên cứu có liên quan đến quyền tác giả"", ông Khải nhận định. Đồng thời cho biết nhà trường đề nghị ông Vinh nghiêm túc rút kinh nghiệm trong hoạt động hợp tác công bố quốc tế của cá nhân. Bên cạnh đó, với vai trò viện trưởng Viện Nghiên cứu kinh doanh, ông Vinh cần có chính sách quản lý và cơ chế kiểm soát chặt chẽ mạng lưới các chuyên gia nghiên cứu cộng tác rộng khắp của đơn vị trên cơ sở bộ quy tắc của hội đồng liêm chính học thuật để tránh xảy ra vụ việc tương tự.",10/05/2024 19:04 GMT+7,https://tuoitre.vn/dai-hoc-kinh-te-tphcm-ket-luan-gi-vu-nha-khoa-hoc-bi-go-bai-bao-quoc-te-20240510184702642.htm,"Đại học Kinh tế TP.HCM (UEH) vừa có kết luận ban đầu về xử lý vụ GS.TS Võ Xuân Vinh thuộc Viện Nghiên cứu kinh doanh UEH, có tên trên bài báo vừa bị một tạp chí quốc tế gỡ bỏ."
Chứng nhận kỷ lục kỳ thi thường niên lâu năm nhất Việt Nam,"Đây là kỳ thi lần thứ 30 tại TP.HCM. Kỳ thi này đã ghi nhận màn tranh tài của 2.200 thí sinh từ 250 trường THCS, THPT trên địa bàn thành phố. Cùng ngày, Sở Giáo dục và Đào tạo TP.HCM và Công ty Cổ phần Xuất nhập khẩu Bình Tây (BITEX) đón nhận kỷ lục ""Kỳ thi học sinh giỏi giải Toán trên máy tính cầm tay thường niên lâu năm nhất tại Việt Nam"" do Trung ương Hội Kỷ lục gia Việt Nam, Tổ chức Kỷ lục Việt Nam xác lập. 30 năm thu hút 14.200 học sinh tham gia Năm 1995, Sở Giáo dục và Đào tạo TP.HCM là đơn vị đầu tiên tổ chức ""Kỳ thi học sinh giỏi giải Toán trên máy tính cầm tay"". Kỳ thi đầu tiên đã được tổ chức thành với sự đón nhận của đông đảo học sinh, giáo viên, phụ huynh ghi nhận những thiết thực trong việc sử dụng máy tính cầm tay vào giải toán. Những năm thi đầu tiên thành công đặt nền móng cho sự phát triển vững mạnh của các kỳ thi về sau. Từ những kết quả tốt đẹp của kỳ thi tại TP.HCM, kỳ thi đã được Bộ Giáo dục và Đào tạo nâng tầm kỳ thi cấp quốc gia vào năm 2001, thành công tổ chức 17 kỳ thi cấp quốc gia liên tiếp và nhanh chóng lan tỏa khắp 63 tỉnh thành khác trên cả nước. Đến nay, kỳ thi này đã tổ chức đến lần thứ 30 tại TP.HCM. Trong hành trình 30 lần tổ chức ấy, có những năm gặp những trở ngại lớn như diễn biến phức tạp của dịch COVID-19 những năm 2021, 2022. Tuy vậy, Sở Giáo dục và Đào tạo TP.HCM và công ty BITEX đã linh hoạt ứng phó để duy trì kỳ thi qua các năm. Đến thời điểm này, Sở Giáo dục và Đào tạo TP.HCM cũng là đơn vị duy nhất đã duy trì tổ chức kỳ thi 30 lần liên tiếp, thu hút hơn 14.200 học sinh tham gia, trao hơn 7.000 giải thưởng cho các em đạt thành tích cao từ cuộc thi. Hiện nay, kỳ thi không chỉ có giải toán mà còn có cả giải lý, hóa, sinh bằng máy tính cầm tay. Đây không chỉ là dấu mốc một kỳ thi mà còn là hành trình phát triển quan trọng của giáo dục thành phố. Phát biểu tại buổi lễ, ông Nguyễn Văn Hiếu - giám đốc Sở Giáo dục và Đào tạo TP.HCM, nhìn nhận: ""Những ngày đầu, kỳ thi học sinh giỏi trên máy tính bỏ túi do đoàn thanh niên của Sở tổ chức. Nhưng dần dần với nhu cầu của học sinh, kỳ thi đặt rất nhiều mục tiêu, vừa là một sân chơi, vừa là nơi để các em có thể sử dụng máy tính hiệu quả đặc biệt là trong thi, lập trình, rút ngắn quá trình giải các bài toán, giải chính xác bài toán trong phục vụ đề thi trắc nghiệm. Ban tổ chức kiên trì nâng cấp kỳ thi. Chất lượng của kỳ thi tồn tại được với thời gian. Nhân kỷ niệm 30 năm tổ chức kỳ thi này, cảm ơn các thầy cô đã kiên trì tổ chức các cuộc thi này liên tục, ngay cả trong thời gian dịch đây là nỗ lực lớn của Bitex và Sở. Cảm ơn ông Nguyễn Xuân Dũng, cảm ơn Bitex và các thầy cô đã nỗ lực kiên trì tạo một sân chơi, tạo một kỳ thi bổ ích về sử dụng máy tính cầm tay trong học tập, trong kiểm tra thi cử và trong cuộc sống để giải quyết các vấn đề"". Đồng hành cùng Sở Giáo dục và Đào tạo TP.HCM suốt hành trình tổ chức các kỳ thi trong suốt thời gian qua, phát biểu tại buổi lễ, ông Nguyễn Xuân Dũng - Chủ tịch Hội đồng Quản trị Công ty BITEX - chia sẻ: ""Đã 30 năm chúng tôi kiên trì theo đuổi mục tiêu phát triển ứng dụng máy tính cầm tay vào hỗ trợ dạy và học cho học sinh, sinh viên Việt Nam. Trên hành trình đầy cảm hứng ấy, tôi may mắn gặp gỡ, học hỏi và có được sự hỗ trợ lớn từ các vị lãnh đạo Sở Giáo dục và Đào tạo TP.HCM các thời kỳ, các chuyên viên, giáo viên ngành giáo dục. Chính sự ủng hộ quý báu đó là tạo niềm tin rất lớn để công ty nỗ lực nhiều hơn trong việc phát triển các thiết bị dụng cụ học tập hỗ trợ công tác giảng dạy và học tập ngày một hữu ích hơn. Tất cả các dòng sản phẩm của công ty đều phải được thường xuyên cải tiến phù hợp với xu hướng phát triển giáo dục tại Việt Nam. Việt Nam là thị trường duy nhất trên thế giới mà một chiếc máy tính cầm tay CASIO có thời gian sử dụng trọn đời học sinh. Việt Nam cũng là thị trường có giá bán máy tính CASIO rẻ nhất thế giới."" Cuộc thi mang đến những điều mới mẻ, thiết thực, bổ ích Em Trần Quốc Việt Hải - lớp 12 chuyên lý 1 (Trường THPT chuyên Lê Hồng Phong) - giải nhất máy tính bỏ túi môn Vật lý kỳ thi năm học 2023-2024, chia sẻ: ""Cuộc thi thực sự mở ra cho em những điều mới mẻ, thiết thực, bổ ích trong sử dụng máy tính cầm tay, em khám phá ra nhiều công dụng. Máy tính cầm tay giúp làm toán nhanh hơn rất nhiều, cho kết quả nhanh và có nhiều chức năng như đổi đơn vị trong vật lý. Em nghĩ máy tính cầm tay còn nhiều hữu ích khi em vào đại học để tính toán, thực hiện nhiều những nghiên cứu khoa học"" Trong khi đó, em Nghiêm Minh Châu, lớp 12A4, Trường THPT Bùi Thị Xuân, một học sinh được giải môn sinh cho biết ""máy tính quá tiện lợi, tính toán nhanh những bài toán số lớn, rất hữu dụng trong học tập, nó dễ dùng, đơn giản"". Minh Châu cũng cho biết, em trải nghiệm kỳ thi này rất vui vẻ với những trải nghiệm thú vị không chỉ về khía cạnh sử dụng máy tính. Đánh giá về hiệu quả của kỳ thi, cô Trinh - hiệu trưởng Trường TH Thực hành Sài Gòn, cho biết: ""Việc sử dụng máy tính cầm tay rất quan trọng với định hướng làm bài thi khoa học tự nhiên phương án trắc nghiệm hiện nay của học sinh. Vì máy tính cầm tay cho các em có được kết quả nhanh chóng, chính xác. Năm nay, kỳ thi đổi mới khi vừa tổ chức thi cá nhân và thi đồng đội nên kỳ thi không chỉ nâng cao năng lực sử dụng máy tính trong học tập mà còn gắn kết các em học sinh trong giải quyết các vấn đề của cuộc sống"".",10/05/2024 19:00 GMT+7,https://tuoitre.vn/chung-nhan-ky-luc-ky-thi-thuong-nien-lau-nam-nhat-viet-nam-20240510181412015.htm,"Sáng 10-5, Sở Giáo dục và Đào tạo TP.HCM tổ chức “Lễ trao giải học sinh giỏi giải Toán trên máy tính cầm tay cấp thành phố năm học 2023 - 2024”."
Mẹ bức xúc khi giáo viên gửi ảnh con không có đồng phục 'mỉa mai' trên nhóm,"Theo đó, phụ huynh này đăng tải đoạn hội thoại giáo viên chụp một nhóm học sinh đang ngồi trên ghế. Tất cả học sinh đều mặc đồng phục áo xanh, riêng một học sinh mặc áo đỏ in hình sao vàng. Bức xúc vì con bị cô giáo ""mỉa mai"" Kèm theo hình ảnh trên, giáo viên này viết trong nhóm phụ huynh: ""Cả lớp tươm tất đang chuẩn bị xuống đi trường TH nhưng có một bạn lúc nào cũng mặc khác cả lớp"". Ngay sau đó, mẹ của học sinh này trả lời tin nhắn của cô: ""Là một cô giáo, đừng nên có những lời nói thiếu tôn trọng và khiếm nhã… Nhà trường mỗi năm một kiểu đồng phục, mẹ theo không kịp… Làm nghề thì nên có chút tâm với nghề. Đừng thấy con có chút thiếu sót mà so sánh, mỉa mai. Không động viên các con thì thôi, đừng làm vậy cô nhé"". Bài đăng của người mẹ chia sẻ trên mạng viết: ""Hôm nay con và các bạn cùng lớp đi tham quan trường tiểu học để chuẩn bị cho năm sau vào lớp 1. Trước khi đi, cô giáo chụp lại ảnh con mình cùng các bạn và gửi vào group chung của lớp bao gồm tất cả các phụ huynh của các bạn khác, và nhắc rằng con mình luôn mặc khác với các bạn. Cô nhắc vậy nhưng mình cảm giác cô mỉa mai và có sự phân biệt với con mình vì mẹ đã không mua đồng phục cho con. Hiện tại cháu nhà mình 3 năm học tại mầm non đều có 3 bộ đồng phục khác nhau, mỗi năm trường bắt đổi một kiểu. Đến năm nay là năm cuối, mình quyết định không mua cho con nữa thì vào hôm nay cô mỉa mai như vậy, thấy rất khổ thân con. Mà trong khi nhóm chung đó lại có rất nhiều bậc phụ huynh khác nữa. Đối với mình con ăn mặc sao cũng được, miễn lịch sự và sạch sẽ, không làm phiền tới ai, chứ trường mỗi năm một loại đồng phục, mẹ cháu theo chẳng kịp. Đáng lý ra là người ươm mầm non, cô hoàn toàn có thể xử lý theo cách khác mà không khiến cả cháu lẫn phụ huynh phải tự ái như thế này"". Cô giáo, nhà trường hay phụ huynh sai? Sau khi câu chuyện của phụ huynh này được đăng tải đã nhận về sự quan tâm đặc biệt từ cộng đồng mạng. Rất nhiều hội nhóm, trang mạng chia sẻ và nhận nhiều ý kiến trái chiều. Tài khoản Ý Như bình luận: ""Trong việc này, nhà trường sai nhất. Đồng phục học sinh không nên thay đổi mỗi năm, gây bất tiện và lãng phí. Con mình 2 năm mua 2 bộ mà 1 bộ vẫn còn cất tủ"". Tài khoản Thuy Doan cho rằng: ""Thực ra nên rèn luyện tính kỷ luật từ bé, ở đâu cũng cần có nguyên tắc và đặc biệt là trường học. Việc bỏ tiền mua thêm cho con một bộ đồng phục không quá khó khăn với phụ huynh"". Không chỉ tranh luận việc có nên thay đổi đồng phục mỗi năm một bộ, dân mạng chia làm hai ""phe"" tranh luận về cách ứng xử của cô giáo và người mẹ. Tài khoản Bao Toan bình luận: ""Sao giáo viên không nhắc nhở riêng với mẹ mà lại chụp ảnh trẻ gửi lên nhóm chung để tạo sự phân biệt? Chưa kể câu nói đầy ẩn ý mỉa mai của cô là một bạn lúc nào cũng mặc khác cả lớp, lời này không giống với nhắc nhở"". ""Giáo viên sai khi nhắc nhở chung trên nhóm phụ huynh như thế nhưng tin nhắn phản bác có phần nặng lời của phụ huynh cũng thiếu tôn trọng giáo viên. Nếu là tôi, tôi sẽ mang câu chuyện này lên gặp ban giám hiệu trường"", tải khoản Ánh Hồng nhận xét.",10/05/2024 18:57 GMT+7,https://tuoitre.vn/me-buc-xuc-khi-giao-vien-gui-anh-con-khong-co-dong-phuc-mia-mai-tren-nhom-20240510174812824.htm,Bài đăng về việc một giáo viên chụp ảnh trẻ không có đồng phục gửi lên nhóm phụ huynh kèm lời nhắn có phần phân biệt đang nhận nhiều sự quan tâm trên mạng xã hội.
