Title,Content,Date,Url,Summary
"Nhà thầu liên danh tuyên bố giải thể, dự án trường học 60 tỉ làm kiểu 'rùa bò'","5 năm được phê duyệt, dự án trường học vẫn chưa xong Dự án Trường THPT Trần Đại Nghĩa được tỉnh Quảng Nam phê duyệt năm 2019, địa điểm xây dựng trường học này tại huyện Quế Sơn với mức đầu tư hơn 60 tỉ đồng, chủ đầu tư là Ban Quản lý dự án đầu tư xây dựng Quảng Nam (Ban quản lý). Dự án có quy mô gồm khối lớp học, khối nhà bộ môn, khối nhà hiệu bộ, nhà đa năng, nhà bảo vệ, nhà xe, sân nền, tường rào cổng ngõ và một số hạng mục khác. Tháng 3-2020, dự án được tỉnh phê duyệt kế hoạch lựa chọn nhà thầu, thời gian thực hiện hợp đồng gói thầu thi công xây dựng 360 ngày. Việc giải phóng mặt bằng do huyện thực hiện với diện tích hơn 27.000m2. Tháng 7-2020, Ban quản lý ký hợp đồng thi công xây dựng với nhà thầu liên danh: Công ty TNHH Thuận Gia, Công ty CP Xây dựng và Kinh doanh nhà Tam Kỳ và Công ty TNHH MTV Thương mại dịch vụ Đại Thiên với giá trị hợp đồng khoảng 45 tỉ đồng. Trong đó Công ty TNHH Thuận Gia (thành viên đứng đầu liên danh) là 24 tỉ đồng thực hiện các hạng mục: khối lớp học, nhà bảo vệ, nhà xe, sân nền, tường rào cổng ngõ, san nền, kè chắn đất, thoát nước, điện… Công ty CP Xây dựng và Kinh doanh nhà Tam Kỳ (thành viên liên danh) 18 tỉ đồng thực hiện các hạng mục khối nhà bộ môn, hiệu bộ, nhà đa năng. Còn Công ty TNHH MTV Thương mại dịch vụ Đại Thiên 1,4 tỉ đồng hạng mục hệ thống, thiết bị phòng cháy chữa cháy. Tuy nhiên đến giữa tháng 2-2022, sau 574 ngày kể từ ngày ký hợp đồng, huyện Quế Sơn mới bàn giao phần diện tích mặt bằng khối lớp học, tháng 5-2022 bàn giao khối hiệu bộ… Và phải đến tháng 3-2024 mới bàn giao phần diện tích còn lại của dự án (đạt 100%). Do việc bàn giao mặt bằng chậm không đảm bảo theo kế hoạch nên các hạng mục triển khai thi công chậm không đảm bảo theo tiến độ. Cụ thể hạng mục khối lớp học đã thi công xong phần thân, đang thi công phần hoàn thiện. Hạng mục phụ trợ: san nền, kè đá hộc, tường rào cổng ngõ, sân vườn, mương thoát nước đang triển khai thi công (đạt được khoảng 25% khối lượng). Đáng chú ý, 3 hạng mục chính: khối hiệu bộ, khối nhà bộ môn, khối nhà đa năng do thành viên liên danh Công ty CP Xây dựng và Kinh doanh nhà Tam Kỳ đảm nhận. Ngay sau khi huyện bàn giao mặt bằng theo các mốc thời gian như trên, Ban quản lý mời thành viên liên danh này đến nhận mặt bằng để tổ chức triển khai thi công nhưng thành viên liên danh từ chối không đồng ý nhận. Lý do thời gian bàn giao mặt bằng chậm dẫn đến giá vật liệu, nhân công tăng cao. Mặc dù hiện nay đã có mặt bằng nhưng vẫn chưa triển khai thi công. Tháng 6-2023, Ban quản lý tiếp tục làm việc với tất cả các thành viên liên danh. Tại buổi làm việc, lãnh đạo Công ty CP Xây dựng và Kinh doanh nhà Tam Kỳ cho biết công ty đã tổ chức đại hội cổ đông dừng mọi hoạt động kinh doanh và đang làm thủ tục giải thể. Sau đó liên danh nhà thầu đã gửi công văn đề nghị Ban quản lý chấm dứt hợp đồng thi công đối với phần việc do công ty trên đảm nhận. Do chậm tiến độ nên tháng 3-2024, dự án được tỉnh gia hạn tiến độ, kéo dài đến cuối năm 2024. Trường mới thì chậm tiến độ trong khi thầy trò vẫn phải dạy và học ở ngôi trường cũ đã xuống cấp. Năm học này trường có 560 học sinh từng ngày học tại trường cũ đã xuống cấp nghiêm trọng. Giáo viên, học sinh mong dự án sớm hoàn thành để có cơ sở khang trang dạy và học. Xử lý sao? Cuối tháng 4-2024, UBND tỉnh Quảng Nam có văn bản giao Ban quản lý nghiên cứu, rà soát quy định pháp luật về hợp đồng xây dựng, các điều khoản của hợp đồng dự án đã ký kết với nhà thầu. Xác định trách nhiệm của các bên trong việc Công ty CP Xây dựng và Kinh doanh nhà Tam Kỳ không thực hiện phần công việc theo hợp đồng đã ký kết, thực hiện xử lý theo thẩm quyền trong trường hợp nhà thầu vi phạm hợp đồng. Trước tình huống này, ngày 2-5 vừa qua, Ban quản lý đã có báo cáo gửi các cơ quan chức năng, đưa ra 2 phương án xử lý. Phương án thứ nhất là chấm dứt hợp đồng phần khối lượng do Công ty CP Xây dựng và Kinh doanh nhà Tam Kỳ thực hiện, tổ chức thực hiện đấu thầu rộng rãi. Tuy nhiên phương án này sẽ kéo dài thời gian thực hiện dự án do việc tổ chức đấu thầu lại tốn nhiều thời gian. Phương án thứ hai là cho phép giao phần khối lượng do Công ty CP Xây dựng và Kinh doanh nhà Tam Kỳ đảm nhận theo hợp đồng đã ký (bao gồm khối nhà bộ môn, khối nhà hiệu bộ; nhà đa năng) cho Công ty TNHH Thuận Gia thực hiện. Mới đây UBND tỉnh Quảng Nam có văn bản gửi bí thư Tỉnh ủy. Theo đó qua nghiên cứu các quy định pháp luật, để có cơ sở nhằm tiếp tục triển khai thi công xây dựng hoàn thành công trình, Ban quản lý đã kiến nghị UBND tỉnh, Sở Xây dựng cho phép áp dụng quy định tại nghị định số 24 của Chính phủ để ký phụ lục hợp đồng giao phần khối lượng do Công ty CP Xây dựng và Kinh doanh nhà Tam Kỳ đảm nhận theo hợp đồng đã ký cho Công ty TNHH Thuận Gia thực hiện.",05/05/2024 10:35 GMT+7,https://tuoitre.vn/nha-thau-lien-danh-tuyen-bo-giai-the-du-an-truong-hoc-60-ti-lam-kieu-rua-bo-20240505094304291.htm,"Một trong ba liên danh nhà thầu thi công dự án trường học gần 60 tỉ đồng ở Quảng Nam tuyên bố giải thể khiến dự án chậm tiến độ, 5 năm vẫn chưa làm xong trong khi ngôi trường cũ xuống cấp."
Giảng viên lý thuyết 'chê' giảng viên dạy thực chiến,"Kiến thức và kỹ năng nghề nghiệp Anh D. có 20 năm làm nghề truyền thông - quảng cáo, xây dựng format, viết kịch bản và sản xuất chương trình truyền hình. Anh dạy sinh viên bằng những kinh nghiệm thực tế, những tình huống cụ thể, những va vấp đã trải qua, những bài học đúc kết trong hàng chục năm làm nghề và cũng kèm theo đó những lý thuyết cốt lõi mà anh đã chuẩn bị. Theo anh D., người dạy thực chiến cũng phải nắm lõi lý thuyết và người dạy lý thuyết cũng phải nắm rõ và có thực tế nội dung mình giảng dạy. Chẳng hạn, đối với môn truyền thông đa phương tiện, chỉ riêng phim quảng cáo đã có khoảng 20 thể loại khác nhau. ""Tôi biết lý thuyết rất quan trọng, là nền tảng để các bạn thực hành tốt. Trước khi dạy thực hành, tôi cung cấp cho sinh viên lý thuyết lõi về thể loại, đặc trưng thể loại để các bạn không bị nhầm lẫn khi làm sản phẩm thực tế. Thời gian có hạn và tôi chú trọng dạy kiến thức, kỹ năng thực tế nên tôi không thể nói chi tiết về lý thuyết như các môn thuần lý thuyết mà các bạn học trước đó"" - anh D. cho biết. Chia sẻ thêm về phương pháp dạy thực chiến của mình, anh D. cho biết công ty của mình nhận sinh viên thực tập khá nhiều. Thực tế làm việc cho thấy các bạn thiếu va vấp thực tế, phải học hỏi rất nhiều từ các anh chị trong công ty. ""Tôi biết các bạn thiếu kỹ năng nào và tôi muốn truyền đạt lại những kinh nghiệm thực tế của mình, cho các bạn làm sản phẩm cụ thể để hiểu được các công đoạn của một phần công việc sau này. Sinh viên học xong phải làm được sản phẩm. Bản thân tôi đi dạy ngoài kinh nghiệm cũng phải đọc tài liệu rất nhiều"" - anh D. nói thêm. Giảng viên cần nắm cả lý thuyết và thực hành Thực tế việc sinh viên thiếu kỹ năng, kiến thức thực tế đã được doanh nghiệp nêu ra từ nhiều năm nay. Một trong những lý do được đưa ra đó là việc các trường đào tạo thiên về lý thuyết, xa rời thực tế. Trường đào tạo theo những gì mình có chứ chưa phải những thứ xã hội cần. Điều này đã thúc đẩy các trường đại học thay đổi cách đào tạo. Trong nhiều trường hợp, một môn học nhưng trường mời người làm nghề dạy thực chiến, giảng viên của trường đảm nhận phần lý thuyết. Chia sẻ về vấn đề này, ông Nguyễn Hữu Long - giảng viên Trường đại học Mở TP.HCM - cho biết đúng là có sự xung đột này trong thực tế. Lý thuyết hay thực hành đều quan trọng trong đào tạo. Trong đó lý thuyết là tiên quyết. Giảng viên muốn dạy lý thuyết giỏi cũng phải có thực hành và ngược lại dạy thực hành cũng đọc lý thuyết để liên hệ khi vận dụng. Đó là lý do trong chương trình đào tạo các trường sắp xếp các môn học theo trình tự môn nào trước, môn nào sau, môn cơ sở, tiên quyết trước rồi mới đến chuyên ngành, thực hành. Bên cạnh đó, tùy vào định hướng đào tạo của các trường theo hướng nghiên cứu hay ứng dụng, phương pháp đào tạo sẽ chú trọng, đào sâu hơn vào lý thuyết hay thực hành. Thông thường sẽ kết hợp, mời người làm nghề dạy thực hành hay đưa sinh viên xuống đào tạo tại doanh nghiệp. Do đó, giảng viên dạy thực chiến, thực hành không cần phải dạy lý thuyết sâu như giảng viên chuyên dạy lý thuyết nhưng cũng phải nắm lý thuyết cốt lõi môn học. Tương tự, ông Trần Nam - giảng viên Trường đại học Khoa học xã hội và Nhân văn (Đại học Quốc gia TP.HCM) - cho rằng sinh viên phải có lý thuyết chắc thì thực hành mới vững. ""Dạy đại học không phải dạy nghề, sinh viên phải có nền tảng lý thuyết trước. Tuy nhiên, thời gian môn học có hạn, giảng viên dạy thực hành chỉ nói những lý thuyết, nội dung cốt lõi của môn học, phần lớn thời gian cho sinh viên thực hành. Sinh viên rất cần những kiến thức nghề nghiệp. Nhưng cái khó của những người dạy thực chiến là đôi khi lý thuyết không sâu"" - ông Nam nói. Để giải quyết xung đột lý thuyết - thực hành, ông Nam cho rằng giảng viên dạy thực chiến cho sinh viên đọc tài liệu trước khi thực hành. ",05/05/2024 10:25 GMT+7,https://tuoitre.vn/giang-vien-ly-thuyet-che-giang-vien-day-thuc-chien-20240504220944696.htm,"Anh D. có 20 năm kinh nghiệm trong lĩnh vực truyền thông. Sau buổi dạy về truyền thông đa phương tiện tại một trường đại học ở TP.HCM, anh bị một số giảng viên dạy lý thuyết cho rằng kiến thức anh chưa vững."
2 năm bỏ toán vẫn đoạt giải đặc biệt kỳ thi Olympic toán học sinh viên,"Kỳ thi Olympic toán học sinh viên và học sinh toàn quốc lần thứ 30 do Hội Toán học Việt Nam phối hợp với Liên hiệp các Hội Khoa học kỹ thuật Việt Nam, Trường đại học Khoa học Tự nhiên, Đại học Quốc gia Hà Nội tổ chức. Khối đại học có 699 sinh viên của 95 trường đăng ký dự thi. Khối phổ thông có 400 học sinh của 46 trường THPT tham gia. Trần Ngọc Quỳnh Giang (sinh viên năm 3) là nữ sinh duy nhất đoạt giải đặc biệt với thành tích nhất hai môn đại số và giải tích. Mê toán từ khi học cấp 1 Bạn Trần Ngọc Quỳnh Giang cho biết đam mê toán từ bé nên khi lên đại học có cơ hội đi thi nên đăng ký ngay. ""Ban đầu tôi chỉ nghĩ thi thử xem kiến thức còn nhớ đến đâu, nào ngờ đạt được giải cao. Tôi ôn luyện tất cả kiến thức đại số và giải tích trong khoảng 4 tháng, cảm xúc bất ngờ và vui dù không dám kỳ vọng nhiều"" - Giang nói thêm. Quỳnh Giang cho biết dù lịch trình học tập và ôn luyện khá dày, ban ngày học trên trường, chiều đi dạy thêm cho học trò, tối đến luyện bài online cùng thầy cô nhưng bạn vẫn cố gắng cân bằng để chinh phục đam mê. ""Vô đội tuyển của trường tôi được thầy cô ôn luyện rất kỹ, mỗi môn ôn trong 10 buổi. Trung bình trong ngày tôi giải khoảng 5 bài tập. Tôi nghĩ muốn học giỏi toán phải thực hành, ôn tập và giải bài nhiều. Ngoài thời gian học trên lớp, tôi còn đi dạy thêm cho học sinh cấp 2 và cấp 3. Việc đi dạy này giúp tôi nuôi dưỡng lửa đam mê với toán và có thêm nguồn thu nhập trang trải cuộc sống để ba mẹ đỡ cực"" - Quỳnh Giang chia sẻ. ""Với tôi, môn toán rất bí ẩn, tiếp xúc với nó, tôi cảm thấy được rèn luyện tư duy tốt hơn, không chỉ trong môn học mà còn ra thực tế. Học ngành kinh tế đối ngoại sẽ không áp dụng kiến thức toán quá sâu như những bạn học khối tự nhiên nhưng tôi thấy bản thân được rèn cách lập luận, lên kế hoạch hợp lý"" - Giang nói thêm. Sinh viên Trang Sĩ Trọng (ngành khoa học máy tính, Trường đại học Bách khoa, Đại học Quốc gia TP.HCM) cho biết cùng học chuyên toán chung trường cấp 3 với Giang nên cả hai rủ nhau dự thi Olympic toán. ""Bạn Quỳnh Giang có quyết tâm nhiều khi ôn luyện toán để đi thi, ngành của tôi có học toán cao cấp nên khi bạn không nhớ hoặc cần biết kiến thức mới tôi đều hỗ trợ bạn hết mình. Việc sinh viên đi thi toán giúp chúng tôi gợi nhớ khoảng thời gian học tập, mài giũa tư duy không bị mai một"" - Trọng nói thêm. Tự tin ôn luyện lại từ đầu Trần Ngọc Quỳnh Giang chia sẻ: ""Đã lâu tôi không học đến toán nên kiến thức cũng vơi đi ít nhiều, tôi có chút tâm lý khi đi thi nhưng chỉ cần tập trung vô giải bài là tự tin ngay. Mục tiêu hiện tại tôi sẽ cố gắng hoàn thành 3 môn và khóa luận để ra trường sớm"". ThS Nguyễn Hoàng Huy Tú - giảng viên bộ môn khoa học cơ bản, Trường đại học Ngoại thương cơ sở II tại TP.HCM, cho biết để tham gia cuộc thi dường như Quỳnh Giang phải nỗ lực ôn tập lại từ đầu. ""Tôi nhận thấy Quỳnh Giang rất say mê môn toán, bạn học ngành kinh tế đối ngoại sẽ khác với toán nên phải ôn lại từ đầu. Giang đi thi khi đang là sinh viên năm 3, trước đó bạn bỏ trống không học toán 2 năm, nên phải nỗ lực nhiều để ôn 2 môn đại số và giải tích. Năm nay trường có 7 bạn đi thi, tôi rất vinh dự và vui mừng cho các bạn vì đã thể hiện được năng lực, đa năng và đa tài. Về học lực của Giang rất tốt, đạt điểm tích lũy 3.85/4.0 điểm và chỉ còn vài môn nữa bạn sẽ kết thúc chương trình học"" - ThS Nguyễn Hoàng Huy Tú nói thêm. Quỳnh Giang cũng khá năng động khi tham gia nhiều cuộc thi của trường như: Nghiên cứu khoa học, Thi toán, Duyên dáng Ngoại thương...",05/05/2024 07:54 GMT+7,https://tuoitre.vn/2-nam-bo-toan-van-doat-giai-dac-biet-ky-thi-olympic-toan-hoc-sinh-vien-20240504140854084.htm,"Trần Ngọc Quỳnh Giang, sinh viên năm 3 Trường đại học Ngoại thương cơ sở II tại TP.HCM, đã đoạt giải đặc biệt tại kỳ thi Olympic toán học sinh viên và học sinh toàn quốc năm 2024."
Phó thủ tướng: Tránh phát triển nóng khi đào tạo nhân lực vi mạch bán dẫn,"Ngày 4-5, tại Trường đại học Phenikaa đã diễn ra hội thảo quốc tế ""Nguồn nhân lực bán dẫn Việt Nam trong chuỗi cung ứng toàn cầu"". Phát biểu tại hội thảo, Phó thủ tướng Trần Hồng Hà nhấn mạnh ngành công nghiệp vi mạch bán dẫn đóng vai trò quan trọng định hình sự phát triển của nhiều lĩnh vực khác nhau trong nền kinh tế toàn cầu; thúc đẩy xu thế chuyển đổi xanh, chuyển đổi số, phát triển dựa vào tri thức của toàn cầu. Ở chiều ngược lại, chuyển đổi xanh, chuyển đổi số và sự phát triển của công nghiệp điện tử là chỗ dựa mạnh mẽ công nghiệp vi mạch bán dẫn. Phó thủ tướng lưu ý, trong xu thế chuyển dịch chuỗi sản xuất khu vực và toàn cầu, công tác đào tạo nhân lực ngành vi mạch bán dẫn không chỉ phục vụ chiến lược phát triển ngành công nghiệp bán dẫn, nhu cầu của các doanh nghiệp tại Việt Nam mà cần nằm trong bài toán tổng thể của ngành vi mạch bán dẫn, công nghiệp điện tử toàn cầu. Phó thủ tướng nêu rõ, việc nhanh chóng xây dựng được đội ngũ nhân lực chất lượng cao, có chuyên môn sâu về vi mạch bán dẫn là mấu chốt, là cơ hội, cũng là thách thức lớn nhất để Việt Nam phát huy tốt tiềm năng, lợi thế. Theo Phó thủ tướng, mỗi công đoạn của ngành vi mạch bán dẫn cần dự báo, đánh giá nhu cầu nhân lực của thị trường trong nước, thế giới, cũng như xu hướng phát triển của các ngành công nghiệp điện tử. Phó thủ tướng cho rằng cần xác định thế mạnh của Việt Nam, có thể nghiên cứu, tiếp nhận, chuyển giao, làm chủ ngay những công đoạn nào trong chuỗi giá trị công nghiệp bán dẫn, từ đó đánh giá nền tảng, tiềm năng nguồn nhân lực. Những công đoạn cần đi xa, đi vững chắc thì xác định những lĩnh vực đầu tư nghiên cứu cơ bản, đào tạo chuyên sâu. Vấn đề đặt ra là cần xây dựng tháp nhân lực phù hợp đối với từng trình độ đào tạo theo lộ trình triển khai chiến lược phát triển công nghiệp bán dẫn của Việt Nam. Trong đó, chú trọng những ngành nền tảng căn bản của công nghiệp bán dẫn, thiết kế chip, như STEM (science, technology, engineering, maths) với các ngành khoa học vật lý, vật liệu, toán học, hóa chất, điện tử, tin học, thiết kế hệ thống. Đồng thời thu hút nguồn nhân lực chất lượng cao từ bên ngoài; thúc đẩy hình thức đào tạo chuyển đổi cử nhân, kỹ sư từ các ngành nghề gần hơn, như điện tử, vật liệu, vật lý, hóa chất, lập trình. ""Đào tạo ngành vi mạch bán dẫn cần có tính toán, dự báo dựa trên tín hiệu thị trường, thực sự đáp ứng nhu cầu của thị trường, tránh phát triển nóng, tràn lan, thiếu hiệu quả. Việc đào tạo nhân lực ngành bán dẫn đòi hỏi phải đáp ứng các tiêu chuẩn quốc tế, tiếp cận với các công nghệ tiên tiến, hiện đại. Nhà nước giữ vai trò chủ đạo"", Phó thủ tướng nói.",04/05/2024 19:07 GMT+7,https://tuoitre.vn/pho-thu-tuong-tranh-phat-trien-nong-khi-dao-tao-nhan-luc-vi-mach-ban-dan-20240504185739396.htm,"Theo Phó thủ tướng Trần Hồng Hà, việc đào tạo ngành vi mạch bán dẫn cần có tính toán, dự báo dựa trên tín hiệu thị trường, thực sự đáp ứng nhu cầu của thị trường, tránh phát triển nóng, tràn lan, thiếu hiệu quả."
"Nha Trang 'cấm' trường tiểu học, THCS tổ chức hoạt động trải nghiệm tự phát","Theo đó, nghiêm cấm lợi dụng việc tổ chức hoạt động trải nghiệm để đi tham quan, du lịch, dâng hương; thu tiền của học sinh, phụ huynh trái quy định. Việc xây dựng và thực hiện kế hoạch hoạt dộng trải nghiệm hướng nghiệp, kế hoạch hoạt động ngoài giờ lên lớp phải phù hợp chương trình dạy học và theo đúng các văn bản hướng dẫn. Các trường phải xác định hình thức tổ chức, quy mô tổ chức đảm bảo phù hợp với các chủ đề trong chương trình hoạt động trải nghiệm, hướng nghiệp và hoạt động ngoài giờ lên lớp, phù hợp với đặc điểm của nhà trường và địa phương. Trong trường hợp tổ chức các hoạt động trải nghiệm theo hình thức bên ngoài nhà trường phải đảm bảo sự tự nguyện, đồng thuận của học sinh và phụ huynh. Việc tổ chức lấy ý kiến phụ huynh và học sinh bảo đảm rộng rãi, công khai. Nội dung phải có trong kế hoạch giáo dục nhà trường và triển khai trong kế hoạch giáo dục của các tổ/nhóm chuyên môn, được hội đồng trường phê duyệt kế hoạch. Khi tổ chức hoạt động phải có phương án tổ chức dạy học đảm bảo. Hạn chế tổ chức hoạt động toàn trường, nhiều khối hoặc quá đông học sinh trong cùng một thời điểm; chỉ tổ chức theo đơn vị lớp, nhóm lớp hoặc câu lạc bộ phù hợp với định hướng nghề nghiệp, nhu cầu, nguyện vọng của học sinh, phụ huynh và khả năng tổ chức của đơn vị. Kinh phí tổ chức phải được thực hiện theo đúng quy định; đảm bảo tiết kiệm, công khai, minh bạch. Thực hiện nghiêm túc các hoạt động theo kế hoạch đã đề ra, phối kết hợp hiệu quả giữa các lực lượng để đảm bảo an ninh, an toàn, sức khỏe cho học sinh và giáo viên trong quá trình tổ chức trải nghiệm.",04/05/2024 18:19 GMT+7,https://tuoitre.vn/nha-trang-cam-truong-tieu-hoc-thcs-to-chuc-hoat-dong-trai-nghiem-tu-phat-20240504165025554.htm,"Phòng Giáo dục và Đào tạo TP Nha Trang (Khánh Hòa) vừa có văn bản gửi các trường tiểu học, THCS trên địa bàn không tự tổ chức các hoạt động trải nghiệm mang tính tự phát."
