Title,Content,Date,Url,Summary
"Nhà văn Lê Hải Triều, người chuyên chấp bút hồi ký cho các tướng lĩnh, qua đời","Từng có thời gian công tác với ông Lê Hải Triều ở Phòng Tuyên huấn, Cục Chính trị Quân đoàn 3, nhà thơ, nhà báo Hồng Thanh Quang cho biết Lê Hải Triều trước tiên là người lính trực tiếp cầm súng chiến đấu, trưởng thành từ chiến trường B3 từ những năm 1960. Tình yêu văn học mạnh mẽ đã dẫn ông tới cùng nghiệp cầm bút.  Ông có những đóng góp không nhỏ vào mảng sách tư liệu về chiến tranh và quân đội, đặc biệt là việc chấp bút viết hồi ký cho hơn 20 tướng lĩnh quân đội. Trong cuộc sống hằng ngày, Lê Hải Triều đã luôn là người đồng đội, người bạn tình nghĩa, có trách nhiệm cao, bao dung và chân thành... Lê Hải Triều - nhà văn của quân đội Nhà văn - đại tá Lê Hải Triều sinh ngày 12-7-1947 tại thôn Phú Yên, xã Hương Sơn, huyện Mỹ Đức, Hà Nội. Ông là hội viên Hội Nhà văn Việt Nam năm 2016. Ông nhập ngũ năm 1966, từng ""vào sinh ra tử"" trong những trận chiến ác liệt nhất mặt trận phía Nam. Đặc biệt trong chiến dịch Tết Mậu Thân năm 1968, với thành tích tiêu diệt 17 lính Mỹ, ông được kết nạp Đảng, được tặng thưởng Huân chương Chiến công Giải phóng hạng nhì cùng danh hiệu Dũng sĩ diệt Mỹ khi mới 21 tuổi. Nhưng Lê Hải Triều còn có năng khiếu và đam mê viết, nên khi đang đương chức trưởng Phòng Tuyên huấn Quân đoàn 3, ông lại rẽ ngang làm biên tập viên Nhà xuất bản Quân Đội Nhân Dân. Từ đó, ông miệt mài viết sách về lịch sử chiến tranh, tham gia sưu tầm, biên soạn và xuất bản nhiều cuốn sách về quân sự có giá trị. Ông cũng tham gia viết kịch bản phim về lịch sử chiến tranh cho Hãng phim tài liệu Đài Truyền hình Việt Nam và Hãng phim Mê Kông TP.HCM. Người được các tướng lĩnh chọn chấp bút Nhưng Lê Hải Triều thành công hơn cả với việc viết hồi ký cho các tướng lĩnh. ""Mở hàng"" thành công với cuốn Ký ức Tây Nguyên của thượng tướng Đặng Vũ Hiệp được tái bản nhiều lần, được dịch sang tiếng Anh, tác giả Lê Hải Triều lần lượt được nhiều tướng lĩnh khác ""chọn mặt gửi vàng"" chấp bút hồi ký. Có thể kể đến những cuốn tiêu biểu như Thời sôi động của đại tướng Chu Huy Mân; cuốn Một thời Quảng Trị của thượng tướng Nguyễn Huy Hiệu, Những miền ký ức của trung tướng Tiêu Văn Mẫn… Trong đó cuốn Một thời Quảng Trị phát hành lần đầu trên 1 vạn bản, đến nay đã tái bản ba lần. Cuốn sách cũng đã được giáo sư Lê Quang Long dịch sang tiếng Anh và Bộ Ngoại giao chọn làm quà tặng Tổng thống Mỹ Barack Obama trong chuyến thăm Việt Nam.",30/05/2024 14:14 GMT+7,https://tuoitre.vn/nha-van-le-hai-trieu-nguoi-chuyen-chap-but-hoi-ky-cho-cac-tuong-linh-qua-doi-20240530134939457.htm,"Đại tá, nhà văn Lê Hải Triều - người chuyên chấp bút hồi ký của các tướng lĩnh như Đặng Vũ Hiệp, Chu Huy Mân, Khuất Duy Tiến, Tiêu Văn Mẫn… - vừa qua đời đêm 29-5 tại Hà Nội, hưởng thọ 77 tuổi."
Ý Lan hát tưởng nhớ Đức Tiến tại Mỹ: Hôm nay chị mặc áo dài hát cho em nghe lần cuối,"Sinh thời, người mẫu, diễn viên Đức Tiến thường xuyên tham gia các chương trình văn nghệ. Vì vậy, ban tang lễ quyết định tổ chức đêm nhạc tưởng nhớ như lời từ biệt của anh chị em nghệ sĩ dành cho anh. Mở đầu đêm nhạc, các văn nghệ sĩ trong gia đình nghệ sĩ Tâm Linh, cũng là ngôi nhà thứ hai của Đức Tiến, hát tiễn biệt anh về với Chúa và dành những lời chia sẻ chân tình, động viên vợ Đức Tiến và con gái vượt qua giai đoạn khó khăn này. Ca sĩ Ý Lan nói lời chia tay Đức Tiến bằng hai ca khúc Những gì sẽ đem theo vào cõi chết và Nghìn trùng xa cách. Trong đó, ca khúc Những gì sẽ đem theo vào cõi chết (sáng tác Phạm Duy) là ca khúc lần đầu Ý Lan hát trong cuộc đời. Còn ca khúc Nghìn trùng xa cách, Ý Lan muốn gửi tặng Bình Phương, như thay lời chia tay của Bình Phương đối với Đức Tiến. ""Tiến ơi, em thích chị mặc áo dài nhất. Hôm nay, chị mặc áo dài hát cho em nghe lần cuối, chào tạm biệt em"" - Ý Lan nghẹn ngào chia sẻ. Ca sĩ Hương Lan hát tặng Đức Tiến ca khúc Trăm nhớ ngàn thương, như thay lời tâm tình của Bình Phương gửi cho người mẫu Đức Tiến. Trước khi hát, Hương Lan kể lại kỷ niệm đáng nhớ về show diễn dịp Tết vừa qua. Hương Lan cho biết dù hai cô cháu diễn ở hai nơi xa nhau nhưng Đức Tiến gọi điện hỏi chị diễn xong chưa để chạy qua trò chuyện, rất dễ thương. Hương Lan trân quý tình cảm Đức Tiến dành cho mình.  Còn nghệ sĩ Ngọc Huyền tiễn đưa Đức Tiến bằng ca khúc Khuya nay anh đi rồi. Chị nói có lẽ nỗi lo của Đức Tiến trước khi đi xa chính là về vợ, con, đại gia đình văn nghệ sĩ sẽ luôn bên cạnh Bình Phương và bé Mèo để hỗ trợ. Nhiều đồng nghiệp khác cũng đã mang lời ca tiếng hát để tiễn đưa Đức Tiến đoạn đường cuối. Bình Phương khóc nghẹn trước những chia sẻ, tấm chân tình mà văn nghệ sĩ dành cho chồng mình.",30/05/2024 13:19 GMT+7,https://tuoitre.vn/y-lan-hat-tuong-nho-duc-tien-tai-my-hom-nay-chi-mac-ao-dai-hat-cho-em-nghe-lan-cuoi-20240530115311237.htm,"Tối 29-5 (theo giờ Mỹ), nhiều văn nghệ sĩ đã góp mặt trong đêm nhạc tưởng nhớ người mẫu, diễn viên Đức Tiến."
Khám phá ‘bản ngã’ con người qua vở múa đương đại Phản chiếu,"Vở múa đương đại Phản chiếu là tác phẩm múa đôi từ nghệ sĩ Xuân Lê, biên đạo múa kiêm vũ công người Pháp gốc Việt, trình diễn cùng nghệ sĩ Shihya Peng người Đài Loan. Mê hoặc khán phòng qua đôi giày patin Suốt 50 phút, toàn bộ khán giả trong khán phòng của Idecaf đã bị bộ đôi Xuân Lê và Shihya Peng thu hút bằng phần trình diễn đầy lôi cuốn và tính ẩn dụ. Nhẹ nhàng lướt trên đôi giày patin tựa như ở trạng thái không trọng lượng, Xuân Lê đưa khán giả cuốn theo dòng năng lượng mãnh liệt nhưng cũng hết sức tĩnh tại. Điều khiến màn trình diễn trở nên đặc biệt là sự giao thoa giữa các loại hình nghệ thuật múa đương đại, hip hop, trượt patin và nghệ thuật thị giác.  Thông qua sự kết hợp đặc biệt này, biên đạo múa Xuân Lê đã đặt ra câu hỏi về tính hai mặt của bản thể thông qua ngôn ngữ hình thể đầy chất thơ và tinh tế. Xuân Lê và bạn diễn dẫn dắt khán giả cùng song hành trong hành trình tìm kiếm bản ngã của chính mình.  Tất cả bắt đầu từ những cái nhìn, chuyển động, và phần biên đạo chú trọng chi tiết đến từng ngón tay, hơi thở, phản ứng của hai cơ thể... Khi nghệ sĩ được chính phủ hỗ trợ Khi vở diễn kết thúc, khán giả còn ngỡ ngàng vì vẫn còn đang ""phiêu"" theo nghệ sĩ. Trong phần trò chuyện sau đó, nhiều người đã đặt câu hỏi về cảm hứng và quá trình sáng tạo vở diễn. Anh chia sẻ về quá trình biên đạo: ""Tôi và Shihya đã dành hơn 4 tháng để biên đạo tiết mục.  Tôi luôn đặt câu hỏi về nguồn gốc của con người và mối quan hệ của chúng ta đối với những chuyển động trong cuộc sống.  Cái tên Phản chiếu của vở diễn thể hiện tính hai mặt của bản thể. Trong cuộc sống chúng ta luôn phải đối diện với người khác và đối diện với chính mình"". Có khán giả đặt câu hỏi về việc những vở diễn tương tự có thu hút được đông đảo công chúng ở nơi khác, tương tự như ở khán phòng Idecaf tối 29-5 hay không.  Xuân Lê cho biết ở Pháp chính phủ hỗ trợ các hoạt động văn hóa rất nhiều, nghệ sĩ có thể tự do sáng tạo và mang vở diễn đến với công chúng mà không nghĩ nhiều đến việc kiếm sống bằng nghề.",30/05/2024 10:01 GMT+7,https://tuoitre.vn/kham-pha-ban-nga-con-nguoi-qua-vo-mua-duong-dai-phan-chieu-20240530095132468.htm,"Sau khi vở múa đương đại Phản chiếu tại TP.HCM kết thúc tối 29-5, hầu hết khán giả nán lại khán phòng Idecaf rất lâu để nghe các nghệ sĩ chia sẻ về vở múa kết hợp nghệ thuật thị giác đặc biệt này."
"Ngôi sao miệt vườn có gì mà Lệ Thủy, Minh Vương, Thoại Mỹ, Ngọc Huyền... cũng đến diễn","Đài truyền hình TP.HCM vừa đến sân khấu này (tại Trung tâm Văn hóa, Thể thao và Truyền thông huyện Bình Chánh) để ghi hình chương trình Âm vang phù sa, phát sóng vào cuối tháng 6. Đi coi hát ở Ngôi sao miệt vườn vui quá Buổi ghi hình của HTV diễn ra sau cơn mưa tầm tã không lâu, 18h30 nhiều người dân đến sân khấu ngồi chờ. Đến 20h, bà con kéo đến thêm đông, ban tổ chức phải bố trí thêm chỗ ngồi. Ở hàng ghế đầu, chú Nhơn (69 tuổi) đi cùng chị ruột gần 80 tuổi và một người bạn đến từ Bình Dương, vui vẻ nói: ""Nhà chị em tôi gần đây nè, mê cải lương lắm, tuần nào cũng đến xem hết. Những ngày đầu tuần không có nghệ sĩ nổi tiếng thì xem khi nào chán sẽ về. Còn cuối tuần nhiều nghệ sĩ lớn đến hát là xem hết chương trình luôn. Đi coi hát sướng dễ sợ"". Một khán giả trung thành khác là chú Nguyễn Văn Điều, 63 tuổi. Chú Điều người nhỏ bé, đen nhẻm, bán vé số, nhà ở quận 8, hầu như không bỏ lỡ buổi diễn cuối tuần nào. ""Tui mê cải lương lắm. Hồi nhỏ được ba má dẫn đi coi, giờ ông bà mất hết rồi. Tui không có điều kiện đến sân khấu xem diễn nên cứ đến đây coi hoài à"", chú tâm sự. Trên sân khấu hôm ấy trong hơn 90 phút, các nghệ sĩ Bình Tinh, Tiêu Minh Phụng, Nguyễn Văn Khởi, Như Ý, Phan Văn Nhân… nhận những tràng pháo tay vang dội của khán giả. Hát xong, nghệ sĩ Phan Văn Nhân còn đi xuống bắt tay vài khán giả, nói vui ""Bắt tay hết khán giả đây chắc khỏi ngủ luôn vì mỏi tay á"" khiến mọi người bật cười. Ngôi sao miệt vườn là điểm hẹn giải trí vùng ven do Khương Dừa - YouTuber nổi tiếng - hợp tác cùng Trung tâm Văn hóa, Thể thao và Truyền thông huyện Bình Chánh tổ chức. Khương Dừa bảo: ""Âm vang phù sa là chương trình của HTV sản xuất, mượn sân khấu quay quảng bá cuộc thi tài tử cải lương Chuông vàng vọng cổ. Còn Ngôi sao miệt vườn của tụi tui diễn định kỳ tuần ba buổi. Thứ ba, năm là hát giao lưu với nhau. Riêng ngày thứ bảy mời nghệ sĩ tên tuổi, khán giả đông lắm, có khi lên đến gần 1.000 người"". Rất nhiều ngôi sao lớn của sân khấu cải lương đã đến với Ngôi sao miệt vườn như Lệ Thủy, Minh Vương, Thoại Mỹ, Ngọc Huyền, Châu Thanh, Trọng Hữu… Ban đầu, Ngôi sao miệt vườn chủ yếu phục vụ bà con trong khu vực. Khi đưa lên YouTube, nhiều người biết nên ở các tỉnh khác như Bình Dương, Vĩnh Long, Đồng Tháp… cũng mướn xe đến xem và giao lưu. ""Một số bà con Việt kiều xem chương trình còn gửi tiền cho tôi nhắn mua mỗi tối cuối tuần khoảng 20 phiếu bán nước tặng lại bà con nào không có tiền nhưng muốn vào xem"", anh Khương Dừa nói. Sân khấu này gắn kết rất lạ Khương Dừa chia sẻ thêm: ""Nguồn thu của chúng tôi là bán nước uống. Thứ ba, thứ năm giá nước bình thường. Đến thứ bảy giá có tăng một chút là 90 ngàn đồng/ly. Hội quán hoạt động cũng còn khó khăn. Nghệ sĩ thương nên chỉ lấy cát sê tượng trưng hoặc có người không lấy. Họ đến rồi trực tiếp giao lưu khán giả chân thành, vui vẻ. Bà con yêu thương nghệ sĩ lên tặng bông có ít tiền. Số tiền này nghệ sĩ trao lại cho ban nhạc khiếm thị và những nghệ sĩ không chuyên khác diễn ở đây"". Nghệ sĩ Bình Tinh tham gia điểm hẹn Ngôi sao miệt vườn nhiều lần. Chị bảo: ""Mỗi lần hát tôi thấy gần gũi, mộc mạc, dịu dàng và dễ thương. Sân khấu phù hợp cảm xúc những câu vọng cổ, ca khúc dân ca tôi hay hát. Bà con rất quý và thương nghệ sĩ. Tôi thích Ngôi sao miệt vườn vì ở đây tạo điều kiện cho ban nhạc khiếm thị và cả người khiếm thị có tài năng vượt qua mặc cảm, gần gũi hơn nghệ sĩ chuyên nghiệp"". Bình Tinh kể: ""Có lần tôi tặng hoa cho một nghệ sĩ khiếm thị, khi nói anh mới biết Bình Tinh tặng hoa. Anh mừng rỡ bảo tại sao Bình Tinh tặng hoa cho anh? Tôi cũng nói tại sao em không được tặng hoa cho anh? Thương lắm"". Còn diễn viên Tiêu Minh Phụng bảo mỗi lần hát ở đây là mỗi lần cảm xúc khác nhau. Ấn tượng lưu lại cũng chính là sự gần gũi của khán giả khi họ trực tiếp lên sân khấu để giao lưu, tặng hoa. ""Khán giả như những người thân của mình. Mình hát như hát cho bà, cho mẹ, cho anh em trong gia đình xem. Sân khấu này có sự gắn kết rất lạ, nhất là với một người con Nam Bộ như tôi"", Tiêu Minh Phụng nói. Nghệ sĩ Nguyễn Văn Khởi - quán quân Chuông vàng vọng cổ năm 2017 - thì nói đây đúng là sân chơi thật tuyệt cho bà con yêu mến cải lương: ""Sân khấu nào cũng là nơi để nghệ sĩ tỏa sáng. Ở đây cũng vậy, để nghệ sĩ đến được với nhu cầu thèm nghe hát của bà con ở xa trung tâm"". ",07/06/2024 11:11 GMT+7,https://tuoitre.vn/ngoi-sao-miet-vuon-co-gi-ma-le-thuy-minh-vuong-thoai-my-ngoc-huyen-cung-den-dien-20240607085917463.htm,Sân khấu Ngôi sao miệt vườn ở Bình Chánh (TP.HCM) trở thành điểm hẹn yêu thích của người dân mê đờn ca tài tử cải lương.
"‘Đói hiểu, đói thương’ hãy uống trà ban sớm","Trong khuôn khổ chương trình Tết Đoan ngọ Thăng Long xưa năm 2024 do Trung tâm Bảo tồn di sản Thăng Long - Hà Nội tổ chức ngày 6-6, nghệ nhân trà Hoàng Anh Sướng đã có buổi chia sẻ về thú thưởng trà của người Việt xưa, đặc biệt là thú thưởng trà trong các gia đình phong lưu. Lý do người xưa uống trà vào sáng sớm Trong bài chia sẻ tâm huyết với văn hóa uống trà của người Việt, nghệ nhân Hoàng Anh Sướng lý giải về việc tại sao các cụ ta xưa có cái thú tao nhã uống trà vào sáng sớm. Theo ông Sướng, có ba lý do cho việc này. Thứ nhất, vào sáng sớm (các cụ ta xưa uống trà sớm vào 4-5h sáng), tâm ta tĩnh lặng, sẽ cảm nhận trọn vẹn được buổi uống trà. Sáng sớm, các cụ vệ sinh răng miệng xong, chưa ăn sáng, giữ miệng sạch uống trà, để cảm nhận trọn vẹn hương vị của ""chén trà trong sương sớm"". Thứ hai, sáng sớm là lúc bóng đêm đang tan, mặt trời đang ló rạng, âm dương trời đất giao hòa, sẽ rất tốt cho sức khỏe. Uống trà là một phép tu Thứ ba, uống trà với người xưa chính là một phép tu. Uống trà một mình vào sáng sớm chính là cơ hội để trở về với ngôi nhà tâm của mình, khám phá, tìm hiểu nó. Để biết, trong mỗi chúng ta ai cũng có những hạt giống tốt và hạt giống xấu. Nhìn sâu hơn, ta hiểu cái tốt - xấu ấy là do ta được tiếp nối từ tổ tiên của mình. Những người khác cũng vậy. Hiểu được điều đó, ta sẽ biết chấp nhận bản thân mình và chấp nhận những người khác với sự không hoàn hảo của họ, để có thể dễ dàng cảm thông, yêu thương nhau hơn, cởi bỏ được những oán giận. ""Hiểu mình là nền tảng để hiểu người. Uống trà để khám phá ngôi nhà bên trong mình, để hiểu mình, và cũng là cách để hiểu người. Từ hiểu mới có thể thương, một tình thương đích thực"", ông Sướng nói. Theo nghệ nhân trà, trong xã hội bận rộn và ngồn ngộn thông tin hiện nay, con người bị ""đói hiểu và đói thương"" rất nhiều. Chúng ta sống trong một thế giới rất kết nối nhờ công nghệ, nhưng thực ra lại rất mất kết nối, không trò chuyện được với nhau. Nên số người gặp phải vấn đề về sức khỏe tâm thần ở các thành phố chiếm tỉ lệ lớn. Trong tình cảnh ấy, ông Hoàng Anh Sướng cho rằng những buổi uống trà một mình trong sương sớm có thể mang lại nhiều bình an cho mọi người.",07/06/2024 05:49 GMT+7,https://tuoitre.vn/doi-hieu-doi-thuong-hay-uong-tra-ban-som-20240606202057784.htm,"Theo nghệ nhân trà Hoàng Anh Sướng, có ba lý do khiến người Việt xưa chọn uống trà vào sáng sớm, trong đó có lý do với người xưa, uống trà còn là một phép tu."
Cấm đại đức Thích Nhuận Đức thuyết giảng dưới mọi hình thức trong một năm,"Theo báo Giác Ngộ, Văn phòng II Trung ương Giáo hội Phật giáo Việt Nam cho biết Giáo hội nghiêm cấm đại đức Thích Nhuận Đức thuyết giảng dưới mọi hình thức trong một năm. Đại đức Thích Nhuận Đức thuộc Tổ đình Hộ Pháp, thị xã Phú Mỹ, tỉnh Bà Rịa - Vũng Tàu. Trung ương Giáo hội Phật giáo Việt Nam giao Ban pháp chế Trung ương, Ban kiểm soát Trung ương và Ban Trị sự Giáo hội Phật giáo Việt Nam tỉnh Bà Rịa - Vũng Tàu giám sát việc thi hành kỷ luật đối với đại đức Thích Nhuận Đức trong vòng một năm. Sau thời gian thi hành kỷ luật, Ban Trị sự Giáo hội Phật giáo Việt Nam tỉnh Bà Rịa - Vũng Tàu báo cáo về đạo hạnh, việc hành trì oai nghi, giới luật của đại đức Thích Nhuận Đức. Trước đó, ngày 4-6, lãnh đạo Ban Thường trực Hội đồng Trị sự; lãnh đạo các Ban Hoằng pháp, Pháp chế, Kiểm soát, Thông tin - Truyền thông và Ban Trị sự Giáo hội Phật giáo Việt Nam tỉnh Bà Rịa - Vũng Tàu làm việc với đại đức Thích Nhuận Đức, tại thiền viện Quảng Đức (quận 3, TP.HCM). Theo đó, các phát ngôn, nội dung thuyết giảng trong các video trên mạng xã hội của đại đức Thích Nhuận Đức sai với tôn chỉ, giáo lý, giáo luật Phật giáo; đồng thời vi phạm các quy tắc thuyết giảng của Ban Hoằng pháp Trung ương Giáo hội Phật giáo Việt Nam. Tại buổi làm việc, đại đức Thích Nhuận Đức đã nhận thức về sai phạm của mình và xin sám hối. ""Những bài giảng mang tính nhạy cảm con đều gỡ xuống hết trên các nền tảng mạng xã hội của con. Đồng thời, con nguyện sẽ không thuyết giảng trong vòng một năm để thời gian này chuyên lo sám hối"" - trích thư sám hối của đại đức Thích Nhuận Đức.",06/06/2024 20:33 GMT+7,https://tuoitre.vn/cam-dai-duc-thich-nhuan-duc-thuyet-giang-duoi-moi-hinh-thuc-trong-mot-nam-20240606202711498.htm,Văn phòng II Trung ương Giáo hội Phật giáo Việt Nam thông báo nghiêm cấm đại đức Thích Nhuận Đức thuyết giảng dưới mọi hình thức trong một năm vì liên quan những video thuyết giảng được cho là phản cảm.
Ông Đôi Truân liên quan gì với nguồn gốc Tết Đoan Ngọ giết sâu bọ?,"Theo Phòng nghiên cứu sưu tầm di sản của Trung tâm Bảo tồn di sản Thăng Long - Hà Nội, Tết Đoan Ngọ là ngày Tết truyền thống tại một số quốc gia và vùng lãnh thổ Đông Á như Việt Nam, Trung Quốc, Triều Tiên, Nhật Bản, Đài Loan, Hàn Quốc… Tại Việt Nam, ngày này còn được gọi với cái tên dân dã là ngày ""giết sâu bọ"". Tết Đoan Ngọ diễn ra vào ngày mùng 5-5 âm lịch hằng năm. Đây là thời điểm nắng nóng kéo dài, sâu bọ phát triển nhiều. Tết Đoan Ngọ còn có tên gọi khác là Tết Đoan Dương. Đoan Ngọ (Đoan là mở đầu, Ngọ là giữa trưa) là bắt đầu giữa trưa. Dương là mặt trời, là khí dương, Đoan Dương nghĩa là bắt đầu lúc khí dương đang thịnh. Ông Đôi Truân trong truyền thuyết về Tết Đoan Ngọ Về nguồn gốc Tết Đoan Ngọ, theo truyền thuyết, vào một vụ mùa bội thu, người nông dân ăn mừng vì trúng mùa. Thế nhưng sâu bọ năm ấy lại kéo đến đông đảo, ăn hết cây trái, thực phẩm đã thu hoạch được. Người dân rất lo lắng không biết cách gì để có thể giải quyết được nạn sâu bọ thì xuất hiện một ông lão xưng là Đôi Truân. Ông chỉ cho dân chúng mỗi nhà lập một đàn cúng gồm những lễ vật đơn giản: bánh gio, trái cây, sau đó đi ra trước nhà mình vận động thể dục. Mọi người làm theo lời ông thì chỉ một lúc sau, sâu bọ đàn lũ té ngã rã rượi. Đôi Truân dặn dò thêm: sâu bọ hằng năm vào ngày này rất hung hăng, mỗi năm vào đúng ngày này cứ làm theo những gì ông đã dặn thì sẽ trị được chúng. Dân chúng biết ơn và để tưởng nhớ việc này, đã đặt cho ngày này là ngày Tết ""diệt sâu bọ"". Từ đó, ngày Tết Đoan Ngọ trở thành một ngày lễ truyền thống của người dân Việt Nam. Họ thường dành ngày này để vận động thể dục và cúng tạ để đẩy lùi sâu bọ và các loại bệnh tật khác. Ngoài ra, người ta còn có thể thưởng thức những món ăn đặc trưng của ngày Tết này, như bánh tro, bánh ú tro, chè trôi nước và nhiều loại trái cây khác. Tết kỳ lạ nhất của người Việt Theo Trung tâm Bảo tồn di sản Thăng Long - Hà Nội, Đoan Ngọ được xem là Tết kỳ lạ nhất của người Việt. Sách Hà Nội địa dư, mục phong tục ghi ""Tết Đoan Dương bó lá ngải, nhuộm móng tay, buộc chỉ cổ tay"". Hay Đồng Khánh địa dư chí chép: ""Tết Đoan Ngọ chuẩn bị đầy đủ rượu và hoa quả lễ tổ tiên từ sáng sớm. Mọi người đều uống rượu, ăn hoa quả, gọi là giết sâu bọ. Hôm ấy người ta hái các loại thuốc cất giữ để sử dụng, hái lá ngải tùy theo năm mà bó thành hình con vật tượng trưng của năm đó..."". Đặc biệt, những phong tục này đã được khắc họa một cách chân thực và sống động trong bộ sách Kỹ thuật cổ của người An Nam. Bên cạnh các phong tục truyền thống, các nguồn sử liệu như Đại Việt sử ký toàn thư, Lê Triều hội điển, Khâm định Đại Nam hội điển sự lệ... cho biết trong cung đình xưa, Tết Đoan Ngọ là lễ thường triều, hoàng đế chịu mệnh trời thực hiện một số nghi lễ như cúng tế các tiên đế, báo hiếu bậc sinh thành, ban yến và ban quạt cho văn võ bá quan...",06/06/2024 20:29 GMT+7,https://tuoitre.vn/ong-doi-truan-lien-quan-gi-voi-nguon-goc-tet-doan-ngo-giet-sau-bo-2024060619073895.htm,"Một vụ mùa bội thu nhưng sâu bọ kéo đến rất đông. Ông Đôi Truân xuất hiện, bày cho dân làng lập đàn cúng gồm bánh gio, trái cây, sau đó đi ra trước nhà mình vận động thể dục để giết sâu bọ. Tết Đoan Ngọ có từ đó."
