Title,Content,Date,Url,Summary
Thú vị với teqball,"Trong ngày thi đấu đầu tiên, đã có 40 trận đấu ở nội dung đôi nam nữ diễn ra từ sáng tới chiều tối. Thích thú với teqball Anh Trần Văn Nhân (TP Quy Nhơn) nói: ""Tôi thấy teqball khá thú vị. Người chơi phải thật khéo léo và chính xác mới có thể điều khiển được trái bóng. Tôi rất thích những pha dứt điểm kiểu xe đạp chổng ngược. Nhìn là mê vì nó quá đẹp và đã mắt!"". Chị Nguyễn Kim Hằng (du khách đến từ TP.HCM) cho biết đây là lần đầu tiên chị thấy môn teqball. Đỗ Thành Vinh (VĐV teqball Việt Nam) cho biết mình đến với teqball rất tình cờ. ""Trước đây tôi có xem một vài chương trình về teqball và được một người anh rủ chơi. Sau khi chơi, tôi thấy khá thú vị và bắt đầu tập chơi nhiều hơn. Môn này nhẹ nhàng và phù hợp với những người có thể trạng không quá lớn"", Vinh chia sẻ. Còn với anh Ánas (VĐV đến từ Ấn Độ), giải đấu tại Quy Nhơn có thời tiết rất đẹp, không gian vô cùng thoáng mát. ""Đây là lần đầu tiên tôi đến Quy Nhơn. Tôi rất thích nơi này vì mọi thứ đều rất nhẹ nhàng, thanh bình. Tôi tập teqball cũng được một thời gian, thi đấu quốc tế vài lần. Teqball tuy không có sự va chạm nhưng rất khó vì đòi hỏi kỹ thuật, kỹ năng của nhiều môn thể thao hòa cùng với nhau. Điều tôi thích ở môn này là nó mới mẻ và ai cũng có thể tham gia"", anh Ánas nói. Ông Laszlo Vajda - tổng thư ký Liên đoàn Teqball thế giới (FITEQ) - cho biết lý do được chọn làm nơi tổ chức Giải teqball thế giới 2024 bởi Quy Nhơn là thành phố biển rất đẹp, năng động, con người thân thiện, lãnh đạo địa phương cởi mở. ""Chúng tôi nhận thấy Việt Nam là một trong những đất nước có giá trị về mặt điều kiện tại châu Á nói chung và khu vực Đông Nam Á nói riêng để phát triển teqball"", ông Laszlo Vajda cho hay. Ông cũng cho biết Liên đoàn Teqball thế giới muốn đưa teqball vào thi đấu tại các kỳ SEA Games và Olympic trong tương lai gần. Việc phát triển teqball ở Việt Nam cũng được liên đoàn thế giới hỗ trợ để đào tạo VĐV, HLV, trọng tài. Khi Messi chơi... teqball Ngoài bóng đá, Messi thường chơi gì với các cậu con trai ở nhà? Câu trả lời khá thú vị: teqball - môn thể thao đang từng bước lan tỏa ra thế giới. Năm 2018, chỉ 4 năm sau khi ra đời, teqball bỗng chốc nổi tiếng toàn thế giới nhờ một đoạn clip ngắn ghi lại cảnh Messi chơi teqball với con trai lớn Thiago. Đó cũng gần như là lần đầu tiên người hâm mộ toàn cầu nghe đến tên trò chơi này. Một đoạn GIF ngắn ngủi chỉ kéo dài chừng 2 giây nhưng đạt sức lan tỏa cực lớn. Trong clip, Messi và Thiago đối đầu nhau trước một chiếc bàn cong khá kỳ lạ. Bàn teqball có chiều dài và chiều cao gần tương tự với bàn bóng bàn nhưng bề mặt cong hướng lên ở giữa. Trong đó, người chơi sử dụng quả bóng tương tự môn bóng đá, và kỹ thuật chơi khá giống với cầu mây. Teqball ra đời vào năm 2014 tại Hungary. Nó được phát minh bởi Gabor Borsanyi (cựu cầu thủ chuyên nghiệp), Gyorgy Gattyan (doanh nhân) và Viktor Huszár (chuyên gia máy tính). Borsanyi là người đưa ra ý tưởng và rồi nhận ra mặt bàn bóng bàn nằm ngang khiến trò chơi không mấy thu hút. Ông cùng Huszar nghiên cứu tạo ra mặt bàn cong, đồng thời phổ biến luật chơi. Sau đó, với tầm ảnh hưởng của mình, Gattyan đã biến teqball thành một trò chơi toàn cầu, có liên đoàn quốc tế và các giải quốc tế trong thời gian ngắn. Sở hữu một tập đoàn truyền thông đa phương tiện hàng đầu, Gattyan nằm trong danh sách những người giàu nhất Hungary. Ông hiện là phó chủ tịch FITEQ - Liên đoàn Teqball thế giới. Ông cũng là người đề ra chiến lược quảng bá teqball thông qua các siêu sao bóng đá. Năm 2016, họ mời được Ronaldinho làm đại sứ cho trò chơi mới lạ này. Sau đó, teqball trở nên phổ biến tới mức xuất hiện rộng rãi trên sân tập của các đội bóng lớn. Trong ngày đầu tiên ra sân tập ở PSG, Messi đã biểu diễn kỹ năng chơi teqball dưới sự hưởng ứng của nhiều đồng đội. Trò chơi này khá phù hợp với phong cách kỹ thuật của các cầu thủ Nam Mỹ nên dễ hiểu vì sao Messi, Neymar hay Ronaldinho đặc biệt yêu thích teqball. Giai đoạn năm 2018 - 2019, teqball được ghi nhận là môn thể thao phát triển nhanh nhất toàn cầu. Giải vô địch thế giới teqball ra đời lần đầu tiên vào năm 2017 và tổ chức thường niên sau đó. Năm 2023, teqball đi vào chương trình thi đấu của European Games (Đại hội thể thao châu Âu - tương tự Asian Games của châu Á). Hiện nay, teqball đang được thảo luận để đưa vào chương trình thi đấu Olympic trong những năm tới. Theo ghi nhận của FITEQ, hiện có khoảng 5.000 VĐV teqball chuyên nghiệp trên toàn thế giới. Việt Nam cũng có một số hội nhóm chơi teqball. Đây là lần đầu tiên Giải teqball thế giới được tổ chức tại Bình Định.",07/06/2024 12:01 GMT+7,https://tuoitre.vn/thu-vi-voi-teqball-20240607095600188.htm,"Ngày 6-6, Giải teqball thế giới 2024 khởi tranh tại TP Quy Nhơn (Bình Định). Đông đảo người dân, du khách đã đổ về bờ biển để theo dõi môn thể thao mới lạ được kết hợp giữa bóng đá, cầu mây, bóng bàn này."
Hai vận động viên Hy Lạp cầu hôn ngay tại Giải Teqball thế giới 2024,"Giải Teqball thế giới 2024 được tổ chức tại quảng trường Chiến Thắng, TP Quy Nhơn, Bình Định, từ ngày 6-6 đến ngày 9-6. Chủ nhân màn cầu hôn lãng mạn ngay trên sân thi đấu Teqball tại Quy Nhơn là Georgios MiLonas và bạn gái Paraskevi Stafilidou. Khoảnh khắc chàng trai đến từ Hy Lạp quỳ gối xuống và trao nhẫn cho bạn gái ngay bên bàn thi đấu khiến các khán giả vô cùng phấn khích. Paraskevi cũng tỏ ra vô cùng xúc động và đã chấp nhận lời cầu hôn của bạn trai. Chứng kiến màn cầu hôn tình tứ và lãng mạn của hai vận động viên đến từ Hy Lạp, chị Nguyễn Ngọc Hương (trú Quy Nhơn) cho biết: ""Tôi rất bất ngờ và ngưỡng mộ cặp đôi này, họ thật dễ thương và tình cảm"".",07/06/2024 11:21 GMT+7,https://tuoitre.vn/hai-van-dong-vien-hy-lap-cau-hon-ngay-tai-giai-teqball-the-gioi-2024-20240607110534646.htm,Hai vận động viên Teqball đến từ Hy Lạp khiến khán giả Quy Nhơn (Bình Định) vỡ òa bởi màn cầu hôn đầy bất ngờ ngay trên sân thi đấu.
6 cầu thủ CLB Bà Rịa - Vũng Tàu bị bắt: Bài học đau xót cho các cầu thủ trẻ,"Vào đầu tháng 2, cơ quan cảnh sát điều tra đã khởi tố vụ án, khởi tố bị can với 5 cầu thủ CLB Bà Rịa - Vũng Tàu. Thông tin mới là có thêm một cầu thủ nữa bị bắt giam sau khi cơ quan điều tra mở rộng điều tra vụ án, phát hiện các cầu thủ còn dính tiêu cực thêm một trận nữa ở Cúp quốc gia 2023 - 2024. Trao đổi với Tuổi Trẻ, HLV Nguyễn Minh Phương cho biết khi những trận đấu đó diễn ra bất thường, ban huấn luyện mới xem băng lại và hỏi cầu thủ bởi nó không phải lỗi về chuyên môn, mà có dấu hiệu tiêu cực. Sau đó, CLB nhờ cơ quan công an vào cuộc. ""Khi có những trận đấu dưới sức, chúng tôi đã răn đe, cảnh báo các cầu thủ. Nhưng có lẽ họ nghĩ chúng tôi chỉ dọa mà không dám làm"", anh nói. Điều đáng nói ngoài thủ môn Sơn Hải 30 tuổi, 5 cầu thủ còn lại chỉ mới 20 đến 22 tuổi. HLV Minh Phương chia sẻ: ""Tôi thấy thương và tội các em khi làm điều dại dột. Các em còn trẻ quá, số tiền kiếm được cũng không lớn, mà không biết tại sao lại làm vậy dù đã có nhiều bài học tiêu cực trước đây. Khó khăn thì ở đâu cũng khó khăn. Nhưng không thể lấy khó khăn để làm bậy, nhất là với các cầu thủ trẻ.  Ở CLB Bà Rịa - Vũng Tàu, cầu thủ luôn được giáo dục không được dính đến tiêu cực. Thậm chí chúng tôi còn làm tư tưởng cho các cầu thủ. Khó khăn chỉ là trước mắt, làm nghề thì lâu dài. Phát triển chuyên môn được thì các đội bỏ tiền ra chuyển nhượng, nâng tầm các bạn lên. Nói đến thế mà sự việc đau lòng vẫn xảy ra"". Chủ tịch CLB Bà Rịa - Vũng Tàu Đinh Hồng Vinh cho biết việc quản lý và giáo dục cầu thủ được đội thực hiện rất nghiêm từ những mùa trước. Vì thế mới cảnh giác và phát hiện được vụ việc để nhờ cơ quan điều tra hỗ trợ.  Từ vụ việc đau lòng trên, ông Vinh cho rằng công tác quản lý, giáo dục phải được đẩy mạnh từ các trung tâm đào tạo hay học viện bóng đá.  ""Môi trường sống bây giờ rất khác thời xưa, cầu thủ ra bên ngoài nhiều sự cám dỗ của tệ nạn xã hội. Do đó, chúng ta phải thường xuyên mời chuyên gia tâm lý hoặc chuyên gia về pháp luật để nói chuyện và hướng dẫn các em, cảnh tỉnh cho các cầu thủ nếu lỡ có ý định xấu thì suy nghĩ và luôn hướng đến sự tích cực để thành công trong nghề nghiệp"", ông Vinh nói.",07/06/2024 10:43 GMT+7,https://tuoitre.vn/6-cau-thu-clb-ba-ria-vung-tau-bi-bat-bai-hoc-dau-xot-cho-cac-cau-thu-tre-2024060710051076.htm,Thông tin 6 cầu thủ CLB Bà Rịa - Vũng Tàu bị Cơ quan cảnh sát điều tra Công an tỉnh Bà Rịa - Vũng Tàu bắt tạm giam vào sáng 6-6 về tội đánh bạc và tổ chức đánh bạc khiến người hâm mộ ngỡ ngàng.
Tuyển bóng chuyền nam Việt Nam thua Pakistan vì sai sót của trọng tài?,"Trận tứ kết AVC Challenge Cup 2024 tối 6-6 đã diễn ra hấp dẫn. Tuyển bóng chuyền nam Việt Nam dù bị đánh giá thấp hơn lại gây ra không ít khó khăn với Pakistan. Trong cả 4 ván đầu, hai đội đều giằng co nhau từng điểm số và cầm hòa nhau 2-2. Do đó, họ phải bước vào ván 5 để định đoạt kết quả. Tại đây, một tình huống bước ngoặt đã xảy ra. Tuyển bóng chuyền nam Việt Nam có được lợi thế dẫn 6-5. Trong pha tấn công, Ngọc Thuân đập bóng trúng chắn của Pakistan dội ngược lại. Điểm rơi của bóng ở sát vị trí mà chuyền hai Đinh Văn Duy vừa ngã xuống. Ban đầu, các trọng tài xác định bóng đi ra ngoài và Việt Nam tạo ra khoảng cách 7-5. Pakistan lập tức sử dụng quyền khiếu nại (challenge) bóng trong/ngoài. Tranh cãi nổ ra từ đây, khi hình ảnh chiếu chậm cho thấy bóng còn trong sân. Do đó, điểm thuộc về Pakistan và tỉ số trở thành 6-6. Lần này đến lượt các VĐV của Việt Nam phân trần với trọng tài. Và họ có lý do để nêu ý kiến về tình huống chiếu chậm. Nếu để ý kỹ, ở khoảnh khắc bóng chạm đất lần đầu, Văn Duy nằm rất sát quả bóng. Thế nhưng ở hình ảnh được sử dụng khi khiếu nại thì chuyền hai này bất ngờ… biến mất. Không rõ hệ thống challenge có sự nhầm lẫn nào không. Rất có thể họ dùng hình ảnh khi bóng chạm đất lần thứ hai hoặc thứ ba, chứ không phải lần đầu. Sau pha bóng đáng tiếc này, các cầu thủ Việt Nam dường như cũng bị ảnh hưởng tâm lý. Họ để cho Pakistan dần vượt lên giành thắng lợi 15-12 ở ván 5 và đoạt vé vào bán kết. Rất nhiều CĐV Việt Nam tỏ ra bất bình về tình huống khiếu nại bước ngoặt ở ván 5. Đa số đều dẫn chứng về việc hình ảnh chiếu chậm không có Đinh Văn Duy. Ông Nam Nguyễn, chuyên gia bóng chuyền từng nhiều lần đi theo hỗ trợ các đội tuyển nam, nữ Việt Nam dự giải quốc tế, nhận định rằng: ""Đối với khiếu nại bóng trong/ngoài, vị trí mà trọng tài challenge chiếu lên là giai đoạn sau thời điểm bóng đã chết. Theo luật bóng chuyền thì giai đoạn đó vô hiệu. Trọng tài phải kiểm tra ở vị trí thời điểm bóng chạm đất lần đầu tiên (vị trí xảy ra bóng chết) thì mới đúng luật"". Ngoài tình huống đáng tiếc này thì tuyển bóng chuyền nam Việt Nam đã có một trận đấu xuất sắc đến bất ngờ.  Pakistan là một đối thủ mạnh và đã đánh bại cả Kazakhstan lẫn đương kim vô địch Thái Lan một cách dễ dàng 3-0. Thế nhưng tuyển Việt Nam lại khiến cho đội bóng này vất vả trong cả 5 ván. Dù thất bại nhưng thầy trò HLV Trần Đình Tiền vẫn sẽ tiếp tục tham dự các trận phân hạng từ 5 đến 8 của AVC Challenge Cup 2024. Trận đầu tiên của họ diễn ra vào lúc 23h ngày 7-6, gặp chủ nhà Bahrain.",07/06/2024 10:21 GMT+7,https://tuoitre.vn/tuyen-bong-chuyen-nam-viet-nam-thua-pakistan-vi-sai-sot-cua-trong-tai-20240607092728537.htm,"Tuyển bóng chuyền nam Việt Nam đã để mất điểm quan trọng trước Pakistan, trong tình huống gây ra rất nhiều tranh cãi."
Bảng A Euro 2024: Chủ nhà Đức vượt trội,"Dẫu vậy ""cỗ xe tăng"" Đức vẫn được xem là ứng viên số 1 cho vị trí đầu bảng A Euro 2024, bởi lợi thế sân nhà và chất lượng cầu thủ vượt trội. Đức: Hành trình tìm lại vị thế Với tư cách đội chủ nhà, tuyển Đức mang trên vai trọng trách bảo vệ danh dự và truyền thống của bóng đá Đức. Áp lực chiến thắng đè nặng lên vai thầy trò HLV Julian Nagelsmann, đặc biệt sau những kết quả đáng thất vọng trong những năm gần đây.  “Die Mannschaft” đã trải qua giai đoạn khủng hoảng với thành tích bết bát tại World Cup 2018 và 2022, cùng thất bại sớm ở Euro 2020.  Họ đánh mất vị thế ứng cử viên vô địch của mình trong nhiều giải đấu lớn. Bản lĩnh bóng đá Đức dường như đã mất đi trong nhiều năm trở lại đây. HLV Hansi Flick bị sa thải, nhường chỗ cho Julian Nagelsmann, người đang nỗ lực vực dậy đội bóng với lối chơi tấn công hiệu quả.  Đội hình tuyển Đức dựa trên sự kết hợp giữa các cựu binh giàu kinh nghiệm như Manuel Neuer, Thomas Muller, Antonio Rüdiger, Ilkay Gundogan… và những tài năng trẻ triển vọng như Florian Wirtz, Jamal Musiala. Đặc biệt ở Euro năm nay, đội chủ nhà chào đón sự trở lại của tiền vệ Toni Kroos. Anh vừa giành chức vô địch Champions League lần thứ 6 với CLB Real Madrid.  Đây gần như là giải đấu chính thức cuối cùng của cầu thủ 34 tuổi này, khi Toni Kroos đã tuyên bố giải nghệ sau Euro 2024. Đây là sự nâng cấp sức mạnh đáng kể cho tuyến giữa của đội chủ nhà hướng đến mục tiêu lên ngôi vô địch. Tuy đụng độ những đối thủ khó chịu ngay từ vòng bảng, thế nhưng nếu thi đấu đúng bản lĩnh của đội tuyển từng 3 lần đăng quang Euro (1972, 1980, 1996), tuyển Đức hoàn toàn có thể tự tin độc chiếm vị trí nhất bảng để hướng đến mục tiêu xa hơn tại Euro 2024. Hungary: Đối thủ trực tiếp của chủ nhà Đức Hungary đang sở hữu chuỗi trận bất bại ấn tượng kéo dài từ năm 2022, với Dominik Szoboszlai là đầu tàu dẫn dắt lối chơi.  Szoboszlai hiện đang thi đấu cho Liverpool, là một trong những tiền vệ tấn công nguy hiểm nhất ở châu Âu. Anh sở hữu khả năng kiểm soát bóng, kiến tạo sắc sảo, cùng những cú sút xa uy lực. Tuyển Hungary thể hiện ấn tượng với phong cách thi đấu đầy tốc độ và hiệu quả. HLV Marco Rossi đã biến đội bóng này trở thành một thế lực đáng gờm ở châu Âu. Với lối chơi phòng ngự phản công đầy hiệu quả, họ thường xuyên gây bất ngờ cho đối thủ với những pha phản công nhanh và chính xác. Hungary từng gây bất ngờ khi cầm hòa cả Pháp và Đức tại Euro 2020. Thậm chí, họ còn đánh bại Đức 1-0 tại Nations League 2022-2023. Hungary đặt mục tiêu vượt qua vòng bảng, thậm chí còn mơ về những chiến tích trong quá khứ, như vị trí thứ ba tại Euro 1964 hay bán kết Euro 1972. Thụy Sĩ và Scotland: Sẵn sàng tạo bất ngờ Thụy Sĩ luôn được biết đến với lối chơi chặt chẽ, kỷ luật và giàu kinh nghiệm. Họ từng tạo nên kỳ tích khi lọt vào tứ kết Euro 2020. Thụy Sĩ lại có phong độ không ổn định trong những trận đấu giao hữu gần đây. Họ sẽ phải dựa vào những trụ cột giàu kinh nghiệm như Granit Xhaka, Xherdan Shaqiri để cạnh tranh với Hungary và Scotland cho vị trí thứ 2. Scotland lần đầu tiên góp mặt ở Euro sau 26 năm. Họ từng tạo nên những bất ngờ tại vòng loại, khi đánh bại cả Tây Ban Nha và Na Uy.  Tuy nhiên phong độ của Scotland đã giảm sút trong thời gian gần đây, và họ sẽ phải dựa vào sự tỏa sáng của những cầu thủ như Scott McTominay, Andrew Robertson để hy vọng giành suất vào vòng knock-out. Bảng A hứa hẹn có những trận đấu kịch tính, với Đức chiếm ưu thế nhưng không thể xem thường những đối thủ đầy khó nhằn như Hungary, Thụy Sĩ và Scotland.",07/06/2024 10:05 GMT+7,https://tuoitre.vn/bang-a-euro-2024-chu-nha-duc-vuot-troi-20240607092232808.htm,"Ngay từ vòng bảng, đội chủ nhà Euro 2024 là tuyển Đức sẽ phải đối đầu với những cái tên vô cùng khó nhằn là Hungary, Scotland, Thụy Sĩ."
Tuyển Việt Nam - Philippines 3-2: Màn ra mắt cảm xúc,"Nghẹt thở, kịch tính và vỡ òa là tất cả những gì có thể miêu tả về trận đấu. HLV Kim Sang Sik đã có những ý tưởng chiến thuật rõ ràng cho tuyển Việt Nam sau tiếng còi khai cuộc. Tuy nhiên, đội bóng áo đỏ đã vận dụng chưa thành công và rơi vào trạng thái bế tắc. Nhưng rồi ông Kim đã có những điều chỉnh hợp lý giúp tuyển Việt Nam giành chiến thắng. Một vài thử nghiệm chưa ổn Trận này, HLV Kim Sang Sik gần như sử dụng toàn bộ những cầu thủ đã từng được HLV Park Hang Seo triệu tập lên tuyển Việt Nam trước đây. Tuy nhiên ông Kim lại ít nhiều gây bất ngờ khi xếp Đức Chiến đá ở trung tâm hàng thủ.  Ngôi sao trẻ Văn Khang thi đấu ở vị trí tiền vệ trái, còn Xuân Mạnh chơi ở cánh đối diện. Có thể thấy ý đồ của ông Kim là chơi tấn công biên với những đường mở bóng dài từ các tiền vệ. Lối chơi này khiến Philippines bối rối những phút đầu trận. Nhưng đội khách nhanh chóng điều chỉnh khi lùi sâu đội hình, không để lộ ra các khoảng trống giữa trung vệ và hậu vệ biên. Tuyển Việt Nam từ đó rơi vào thế bế tắc và chỉ biết cầm bóng chuyền qua chuyền lại.  Việc bố trí Văn Khang đá cánh trái thực sự là quyết định mạo hiểm của HLV Kim Sang Sik. Do đây không phải là vị trí sở trường của Văn Khang nên anh chơi khá mờ nhạt. Đó là lý do khiến ở hiệp 1 tuyển Việt Nam hầu như chỉ lên bóng bên cánh phải của Xuân Mạnh. Đội hình tấn công của tuyển Việt Nam cũng vì thế tỏ ra thiếu cân bằng và có cảm giác ngột ngạt. Văn Khang không những thiếu sự hiện diện trên mặt trận tấn công mà còn liên tục để lộ khoảng trống ở hàng thủ.  Hiệp 1, tuyển Philippines đã rất nhiều lần khai thác cánh trái của Văn Khang. Và nếu may mắn hơn họ đã sớm có bàn vượt lên. Dấu ấn của HLV Kim Sang Sik HLV Kim Sang Sik đã có sự thay người cực kỳ hợp lý vào đầu hiệp 2 khi đưa ""cỗ máy tạt bóng"" Tuấn Tài vào sân thay Văn Khang. Tuấn Tài đã gây ấn tượng với những pha tạt bóng hoặc căng ngang khá ""quái"". Và một trong số đó là pha kiến tạo đẹp mắt giúp Tiến Linh đánh đầu nâng tỉ số lên 2-1 cho tuyển Việt Nam.  Những sự thay đổi người tiếp theo của HLV Kim Sang Sik là Tuấn Anh (thay Hùng Dũng) và Tuấn Hải (thay Quang Hải) cũng phát huy tác dụng. Chính Tuấn Anh là người tung cú sút xa trái phá khiến thủ môn Neil Etheridge không thể bắt dính bóng. Tuấn Hải có mặt đúng lúc đệm bóng ấn định chiến thắng 3-2 cho tuyển Việt Nam ở phút 90+5. Thay người vào sân rồi tỏa sáng, HLV Kim Sang Sik dường như đã thừa hưởng ""vía"" của HLV tiền nhiệm Park Hang Seo - người trước đây cũng rất mát tay trong việc thay người.   Ở bàn cân bằng tỉ số 1-1 (phút 65), tuyển Việt Nam đã có pha phối hợp đẹp mắt. Hoàng Đức thả bóng cho Văn Toàn thoát xuống rồi căng ngang cho Tiến Linh dứt điểm ghi bàn. Đây là lối chơi đã được tuyển Việt Nam theo đuổi từ đầu trận và các cầu thủ đã rất kiên trì thực hiện để đạt được thành quả. Dù vậy tuyển Việt Nam vẫn bộc lộ rất nhiều vấn đề. Nhất là khả năng chống phản công không tốt khi các cầu thủ dâng cao và để lộ quá nhiều khoảng trống sau lưng. Philippines đã khai thác tốt điều này để tìm được bàn thắng vượt lên nhờ công của Patrick Reichelt (phút 62).  Kế đến là khả năng chống bóng bổng lẫn sự tập trung của các cầu thủ Việt Nam đều chưa tốt. Đó là lý do họ để đối thủ gỡ hòa 2-2 (phút 89). Dù vậy mọi thứ hoàn toàn có thể được cải thiện nếu HLV Kim Sang Sik có nhiều thời gian làm việc với tuyển Việt Nam hơn nữa. Thắng trận này, tuyển Việt Nam vẫn còn hy vọng đi tiếp. Sau 5 lượt trận, với trận thắng chủ nhà Indonesia 2-0, Iraq đã chắc chắn giành ngôi nhất bảng F với 15 điểm. Indonesia đứng thứ 2 với 7 điểm, còn Việt Nam xếp thứ ba khi có trong tay 6 điểm. Việt Nam sẽ đi tiếp nếu thắng Iraq và Indonesia không đánh bại được Philippines.",07/06/2024 09:26 GMT+7,https://tuoitre.vn/tuyen-viet-nam-philippines-3-2-man-ra-mat-cam-xuc-20240607092138988.htm,"Tối 6-6, HLV Kim Sang Sik đã có trận đấu ra mắt giàu cảm xúc khi tuyển Việt Nam đánh bại Philippines 3-2 ở lượt trận thứ 5 bảng F vòng loại thứ 2 World Cup 2026 khu vực châu Á."
