Title,Content,Date,Url,Summary
"Giá vàng giảm nhanh trong vài phút, còn 81 triệu đồng/lượng","Như vậy từ cuối tuần đến nay giá vàng miếng SJC đã mất tổng cộng 8 triệu đồng/lượng. Người đu đỉnh vàng với giá 92,5 triệu đồng/lượng nếu bán ra ở thời điểm này đã lỗ 13,5 triệu đồng/lượng. Giá vàng giảm sốc Sáng nay (3-6) là ngày đầu tiên bốn ngân hàng là Vietcombank, Agribank, BIDV, Vietinbank và Công ty SJC tham gia bán vàng bình ổn. Việc bán vàng bình ổn sẽ bắt đầu từ 14h30. Theo ghi nhận, giá vàng hôm nay mở cửa ở 82,5 triệu đồng/lượng, giảm 500.000 đồng/lượng so với cuối tuần trước. Nhưng chỉ sau đó ít phút giá vàng lao dốc rất nhanh về 81 triệu đồng/lượng. So với cuối tuần trước, giá vàng bốc hơi thêm 2 triệu đồng/lượng. Giá mua vào rớt về 79 triệu đồng/lượng. Tại thị trường, giá vàng miếng SJC cũng bám sát theo mức giá ""định hướng"" này. Tiệm vàng Mi Hồng sáng nay niêm yết giá mở cửa ở 82,5 triệu đồng/lượng. Sau đó giá vàng miếng SJC giảm nhẹ về 82,2 triệu đồng/lượng, rồi đột ngột lao dốc về 81 triệu đồng/lượng. Người dân chủ yếu quan sát Trong khi đó giá vàng thế giới ở mức 2.329 USD/ounce. Quy đổi theo tỉ giá niêm yết tại ngân hàng, giá vàng thế giới tương đương 71,53 triệu đồng/lượng. So với giá vàng thế giới quy đổi, giá vàng miếng SJC hiện nay chỉ còn chênh 9,47 triệu đồng/lượng. Mức chênh này đã giảm một nửa so với một tuần trước và ngang với trước thời điểm Ngân hàng Nhà nước đấu thầu vàng. Theo ghi nhận, dù giá vàng giảm mạnh nhưng tại Công ty SJC sáng nay không có cảnh xếp hàng mua vàng. Nhiều người chủ yếu quan sát và chờ giá vàng miếng SJC về sát giá vàng thế giới rồi mới xuống tiền. Chị Phượng (ngụ tại quận Gò Vấp) cho biết chưa bao giờ thấy giá vàng miếng SJC giảm mạnh như những ngày gần đây. ""Có thể chiều nay khi các ngân hàng tham gia bán vàng, giá vàng miếng SJC còn sập mạnh hơn. Theo tôi, cách biệt giá vàng trong nước - thế giới về mức 2-3 triệu đồng/lượng là hợp lý"", chị Phượng nêu nhận định.",03/06/2024 10:09 GMT+7,https://tuoitre.vn/gia-vang-giam-nhanh-trong-vai-phut-con-81-trieu-dong-luong-20240603095734759.htm,"Chỉ trong vài phút, giá vàng miếng SJC bốc hơi 2 triệu đồng/lượng, còn 81 triệu đồng/lượng."
"Chứng khoán giằng co: Khối ngoại bán ròng quyết liệt, dòng tiền lớn bao giờ hết lưỡng lự?","VN-Index vừa trải qua tuần giao dịch giằng co với 2 phiên tăng và 3 phiên giảm, chỉ số gần đi ngang khi dừng ở mốc 1.261,7 điểm. Trao đổi với Tuổi Trẻ Online, ông Đỗ Bảo Ngọc - phó tổng giám đốc Chứng khoán Kiến Thiết -  cho rằng thị trường vẫn đang chờ dòng tiền lớn trong nước để vượt qua các mốc quan trọng. Khối ngoại quyết liệt bán ròng, nhiều mã vốn hóa lớn là tâm điểm * Tuần qua, thanh khoản giảm mạnh so với tuần trước đó. Chỉ số loanh quanh mãi vùng 1.250, vì sao, thưa ông? - Nhóm vốn hóa trung bình, nhỏ có sự cải thiện tốt hơn, trong khi nhóm bluechip lại yếu đi. Nhà đầu tư nước ngoài bán ròng mạnh với giá trị đột biến tuần này, tập trung vào một số mã lớn. Trong khi, điểm số muốn vượt qua ngưỡng quan trọng cần sự hỗ trợ lớn từ nhóm bluechip, vốn hóa lớn. * Việc dòng tiền tìm sang nhóm cổ phiếu nhỏ với tính chất đầu cơ cao, có gây rủi ro lo ngại gì, thưa ông? - Nhiều người vẫn quan điểm khi cổ phiếu nhỏ tăng “nóng” là cuối sóng. Nhưng thị trường luôn diễn biến linh hoạt. Xu hướng này có thể đúng ở một số thời điểm, nhưng không có nghĩa luôn đúng. Nếu tuần này, khối ngoại giảm xả ròng, cầu nội tăng hấp thụ nhóm bluechip ở vùng giá thấp, kỳ vọng điểm số tăng tốt trở lại. * Tuy nhiên thống kê, nhà đầu tư nước ngoài tiếp tục xu hướng bán ròng mạnh với giá trị khá đột biến trong tuần này, tập trung ở cả những mã hiếm khi trống “room” ngoại. Xu hướng bán ròng khối ngoại ngày càng rất quyết liệt và chưa có dấu hiệu ngừng lại, có lý do nào khác ngoài tỉ giá, thưa ông? - Ở từng trường hợp cụ thể sẽ có các câu chuyện khác nhau. Nhưng tôi cho rằng điểm dễ thấy nhất vẫn là chênh lệch lãi suất đồng USD và đồng Việt Nam, áp lực tỉ giá. Nhiều tổ chức vẫn dự báo khả năng tiền đồng còn mất giá nữa, trong bối cảnh Fed sẽ chưa hạ lãi suất trong quý 2 này. Việc bán ròng theo thống kê, chủ yếu từ các quỹ chủ động, điều này đáng lo ngại. Thông thường, quỹ chủ động có chiến lược đầu tư dài hạn, không như các ETF biến động liên tục. Sự hồi phục của nền kinh tế Việt Nam vừa qua có nhưng còn chậm, trong khi số liệu công bố cho thấy kinh tế Mỹ phục hồi rõ nét, thị trường chứng khoán Mỹ tăng trưởng cao và hút lượng lớn USD về nước. Dòng đầu tư luôn tìm tới những thị trường có tỉ suất lợi nhuận vượt trội hơn. Chỉ trong hơn 5 tháng đầu năm, lượng bán ròng vượt 1 tỉ USD, bằng cả năm ngoái thì là vấn đề cần được xem xét một cách nghiêm túc. Thị trường chứng khoán chờ dòng tiền lớn * Thị trường vẫn đang rất quan tâm đến khả năng nâng lãi suất điều hành từ Ngân hàng Nhà nước. Với áp lực tỉ giá, lạm phát và các chỉ số vĩ mô khác, ông đánh giá vấn đề này như thế nào? - Có áp lực lạm phát, nhưng không phải quá lớn, bởi cầu trong nước còn yếu, sản xuất trong nước phục hồi tương đối chậm. Cơ quan điều hành vẫn chưa có bất kỳ tín hiệu nào cho việc sắp nâng lãi suất điều hành. Vừa qua, Ngân hàng Nhà nước chủ yếu tác động qua lãi suất liên ngân hàng, có thời điểm tất cả các kỳ hạn đều trên 5%. Tuy nhiên, khi Fed duy trì kéo dài lãi suất cao, tỉ giá gây áp lực thì nhà điều hành cũng cần cân nhắc. Cần thấy dù lãi suất duy trì thấp, nhưng cầu tín dụng ì ạch. Dường như duy trì lãi suất thấp không đem lại quá nhiều lợi ích nền kinh tế, trong khi lại ảnh hưởng đến dòng vốn nước ngoài, rõ nhất là động thái bán ròng khối ngoại… * Vậy theo ông, những yếu tố quan trọng nào hội tụ để kéo thị trường bật lên tốt hơn? - Dòng tiền nội rất quan trọng. Nhưng vừa qua, cầu nội ảnh hưởng do nhiều yếu tố về kinh tế lẫn chính trị, tạo nên sự lưỡng lự nhất định. Khi dòng tiền lớn quay lại, thị trường sẽ cân bằng, cân đối được lượng xả ra từ khối ngoại. Lực cầu bắt đáy vừa qua vẫn chủ yếu đến từ nhà đầu tư cá nhân và thanh khoản chỉ tốt hơn trong các phiên giảm điểm. Còn các phiên tăng điểm dòng tiền yếu hơn nhiều.",03/06/2024 09:08 GMT+7,https://tuoitre.vn/chung-khoan-giang-co-khoi-ngoai-ban-rong-quyet-liet-dong-tien-lon-bao-gio-het-luong-lu-20240603080821359.htm,"Chuyên gia cho rằng thanh khoản thị trường chứng khoán vẫn thấp khi dòng tiền lớn chưa nhập cuộc, trong khi việc bán ròng khối ngoại chủ yếu từ các quỹ chủ động, điều này rất đáng lo ngại."
Nhận thông báo số dư qua app thay 'ting ting',"Gần đây song song với khuyến khích, các ngân hàng cũng tăng phí và đặt ra ngưỡng tối thiểu không gửi thông báo qua tin nhắn SMS để đẩy nhanh quá trình chuyển đổi này. Đồng loạt tăng phí tin nhắn SMS Trước đây trong suốt nhiều năm, người dùng hầu như chỉ có một phương thức nhận thông báo biến động số dư là qua SMS. Nhưng khoảng ba năm trở lại, trước nạn bùng phát tin nhắn giả brandname (tên thương hiệu) ngân hàng cộng với giá thành tin nhắn SMS brandname cao, khiến ngân hàng hướng người dùng sang nhận tin nhắn qua app. Các ngân hàng Vietcombank, BIDV, Techcombank… đã ""phát pháo"" cho xu hướng mới. Cuối năm 2021, Vietcombank gửi email cho khách hàng tuyên bố giảm toàn bộ phí dịch vụ trên ứng dụng ngân hàng số như phí duy trì tài khoản, phí chuyển tiền nhưng tăng phí SMS banking theo hướng thu theo số lượng tin nhắn thay vì thu gói 11.000 đồng/tháng. Sau đó cuối mỗi tháng, ngân hàng đều gửi tin nhắn thống kê số lượng tin nhắn SMS biến động số dư và mức phí, kèm theo cú pháp tin nhắn để hủy dịch vụ nhận tin nhắn qua SMS và hướng dẫn để nhận số dư qua app miễn phí. Từ năm 2022 đến nay, các ngân hàng có nhiều đợt tăng phí dịch vụ tin nhắn SMS, đồng thời dừng gửi tin nhắn biến động số dư với các giao dịch có giá trị nhỏ. Mới nhất, từ 1-6, Agribank áp dụng mức phí mới là 13.200 đồng/tháng/số điện thoại và không giới hạn số lượng tin nhắn (chưa bao gồm VAT). So với mức phí cũ, phí dịch vụ SMS banking của Agribank tăng thêm 3.200 đồng. Đồng thời, Agribank dừng gửi tin nhắn biến động số dư với các giao dịch có giá trị dưới 20.000 đồng. Từ 3-6, HDBank cũng không thông báo biến động số dư với giao dịch dưới 100.000 đồng. Nếu muốn nhận thông báo đầy đủ các mức, khách có thể nhận qua app HDBank. Trước đó, từ tháng 1-2024, ACB cũng đã thay đổi cơ chế tính phí và mức thu phí SMS banking với khách hàng cá nhân và khách hàng doanh nghiệp. Theo đó, mức phí thấp nhất là 15.000 đồng/tháng/thuê bao với các khách hàng có nhu cầu nhận SMS thông báo giao dịch. Nam A Bank cũng thay đổi chính sách phí SMS banking từ đầu năm 2024 theo hướng áp dụng mức phí cố định khi khách hàng phát sinh giao dịch dưới 15 tin nhắn/tháng/số điện thoại là 12.000 đồng. Từ 15 tin nhắn trở lên, khách phải trả thêm phí 695 đồng/tin nhắn. Đua chuyển qua nhận tin qua app Chị Vân, một người kinh doanh online tại quận 3 (TP.HCM), cho biết giờ phần lớn khách thanh toán bằng chuyển khoản nên tiền ra vô tài khoản liên tục. ""Trước ngân hàng thu một gói khoảng vài chục ngàn, nhưng sau này thu theo số tin nhắn thực nhận. Có tháng tôi nhận đến 239 tin và đóng phí đến 167.300 đồng"", chị Vân nói và cho biết đã chuyển đổi sang nhận tin nhắn qua app để không mất phí. Tương tự, chị N.M. (quận Tây Hồ, Hà Nội) - chủ cửa hàng bán đồ chuyên làm bánh - cho biết hai năm trở lại đây, khách thanh toán bằng quét mã QR là chủ yếu, mỗi tháng chị phải trả hơn 100.000 đồng phí thông báo biến động số dư tin nhắn SMS là không nhỏ nếu tính theo năm. Do đó, chị chuyển sang theo dõi biến động số dư qua app ngân hàng. Anh T.H. (quận Thanh Xuân, Hà Nội) cho biết vừa hủy dịch vụ thông báo nhận biến động số dư qua tin nhắn SMS. Vừa không phải trả phí mà người dùng còn yên tâm vì không lo tin nhắn giả mạo gửi qua tin nhắn SMS nữa. ""Tôi luôn lo lỡ một ngày không may bấm vào đường link chứa mã độc khiến mình có nguy cơ bị chiếm đoạt tiền trong tài khoản. Nhưng mối lo này giờ không còn nữa từ khi tôi hủy dịch vụ nhận tin nhắn SMS. Muốn kiểm tra biến động số dư, tôi vào app ngân hàng chỉ sau vài giây là biết liền"" - anh T.H. nói. Miễn phí, hết lo tin nhắn giả mạo Đại diện ACB cho biết có nhiều điều lợi khi nhận thông báo giao dịch qua ngân hàng số, đặc biệt là không tốn phí vì các ngân hàng hiện nay đều miễn hầu hết các loại phí giao dịch và quản lý tài khoản. Bên cạnh đó, người dùng nhận tin nhắn thông báo trực tiếp và tức thời qua ứng dụng ngân hàng cho bất kỳ giao dịch nào và mọi lúc mọi nơi ngay cả khi đang ở nước ngoài. Nhờ đó, khách hàng sẽ dễ dàng theo dõi và kiểm soát được biến động số dư. ""Quan trọng là khách hàng tránh được tình trạng bị lừa đảo qua tin nhắn giả SMS brandname ngân hàng. Về phía ngân hàng cũng sẽ tiết giảm khoản chi phí lớn phải trả cho dịch vụ SMS banking của các công ty viễn thông và chi phí đó sẽ được tiếp tục dùng để đầu tư nâng cấp và cập nhật các công nghệ, giải pháp bảo mật mới cho ngân hàng số"", đại diện ACB cho biết. BIDV cho hay chỉ cần vài thao tác đơn giản trên ứng dụng BIDV SmartBanking, người dùng có thể chuyển sang nhận thông báo biến động số dư qua app mà không phải trả phí. ""Đặc biệt do không bị hạn chế về ký tự và phải viết không dấu như tin nhắn SMS, tin OTT cung cấp đầy đủ thông tin về thời gian giao dịch, tài khoản thanh toán, số tiền giao dịch, số dư cuối và nội dung giao dịch. Người dùng có thể chuyển sang nhận thông báo biến động số dư trên app mà không phải trả phí"", đại diện BIDV nói. Cũng theo BIDV, do tin nhắn app ngân hàng được sinh ra và chuyển trực tiếp trong hệ thống ngân hàng, không qua dịch vụ của bên thứ ba nên chính xác, an toàn, hạn chế tối đa rủi ro cho người dùng. Để tiết kiệm chi phí ít nhất 15.000 đồng/tháng cho dịch vụ nhận tin nhắn SMS và đảm bảo an toàn hơn, SHB cũng khuyến nghị khách hàng chuyển sang sử dụng tính năng nhận thông báo biến động số dư qua app ngân hàng. ""Khi giao dịch thành công, khách hàng sẽ nhận được tin nhắn OTT thông báo qua ứng dụng ngân hàng ngay cả khi đang ở nước ngoài, không mất một đồng phí nào"", đại diện SHB nhấn mạnh.  ",03/06/2024 08:01 GMT+7,https://tuoitre.vn/nhan-thong-bao-so-du-qua-app-thay-ting-ting-20240602222608234.htm,"Một xu thế mới mà các ngân hàng đang đẩy mạnh là hướng người dùng nhận thông báo số dư qua app ngân hàng số, thay vì tin nhắn SMS vì ""nhất cử tam tứ lợi""."
"Bán hàng qua Amazon: Bán còn trầy trật, doanh thu 'chưa ăn thua'","Có doanh nghiệp nói doanh thu khá tốt nhưng vẫn phải dừng vì ""không ăn thua"". Bán ế, mất cả tiền hủy hàng Ông Nguyễn Ngọc Luận, tổng giám đốc Meet More, kể doanh nghiệp từng mở rộng kênh bán hàng trên Amazon. Tuy nhiên hiện phải tạm dừng vì sau khi trừ chi phí, doanh nghiệp không lãi, thậm chí lỗ. ""Doanh thu khá tốt, nhưng chi phí vận chuyển và lưu kho cao"", ông Luận nói. Theo chia sẻ của doanh nghiệp, có hai hình thức các nhà bán hàng có thể lựa chọn để bán qua Amazon. Thứ nhất, FBA - dịch vụ gồm lưu kho, tiếp nhận đóng gói và chuyển hàng cho những người bán hàng trên Amazon, nôm na Amazon sẽ lo ""trọn gói"", doanh nghiệp chỉ lo bán hàng. Thứ hai, FBM - một hình thức quản lý đơn hàng trên Amazon, trong đó người bán tự chịu trách nhiệm xử lý và giao hàng cho khách. ""Chúng tôi chưa có điều kiện xây dựng được kho hàng, cũng chưa kết nối được đối tác hay đại lý phân phối bên Mỹ, nên sử dụng FBA. Nhưng biên lợi nhuận sản phẩm thấp, không thể hy sinh lợi nhuận để có đơn hàng"", ông Luận nói. Tiết lộ hướng đi sắp tới, ông Luận cho biết đang tìm kiếm đối tác bên Mỹ, xử lý được rào cản về chi phí mới có thể tiếp tục mở rộng bán hàng trên Amazon hay bất kỳ sàn thương mại điện tử quốc tế nào khác. Ông N.C.T., một doanh nghiệp ngành mỹ phẩm, cũng cho biết năm ngoái có lô hàng FBA đầu tiên gửi sang kho Amazon. Tuy nhiên, do chiến lược nghiên cứu sản phẩm với hành vi người dùng bên Mỹ chưa phù hợp, trong 5 dòng sản phẩm doanh nghiệp gửi sang chỉ có 2 sản phẩm phát sinh đơn hàng. Không riêng các trường hợp nêu trên, ông Nguyễn Dũng - CEO CTCP thương mại điện tử 5MSTAR, nhà sáng lập cộng đồng những nhà bán hàng Việt Nam trên Amazon với gần 100.000 thành viên - cho biết doanh nghiệp thất bại rất nhiều. ""Người ta hay truyền thông, quảng bá những đơn vị thành công hoặc bản thân các DN cũng chỉ muốn nói khi kiếm được nhiều tiền. Nhưng thực tế thất bại rất nhiều"" - ông Dũng nhấn mạnh và kể về một doanh nghiệp bán sản phẩm ""trending"" (xu hướng) trên Amazon, nhưng đáng tiếc qua mùa vẫn không bán hết được, tồn kho lớn. Xoay đủ cách không bán hết, họ còn phải mất thêm cả chi phí hủy lô hàng bởi càng để thì tiền lưu kho càng lớn. Một doanh nghiệp tại huyện Củ Chi (TP.HCM) cũng đã đưa bánh tráng, bún phở khô bán trên Amazon. Đại diện đơn vị này thừa nhận vẫn còn nhiều bất cập và tính hiệu quả chưa được như mong muốn. Dù gần 3 năm đưa hàng lên sàn nhưng doanh số vẫn khiêm tốn, chỉ tăng 15 - 20% so với thời điểm ban đầu và chiếm tỉ lệ ít ỏi trong cơ cấu doanh thu. ""Giá bán trên sàn thương mại điện tử quốc tế có thể cao gấp nhiều lần giá bán trong nước, nhưng lợi nhuận không nhiều hơn. Các chi phí như vận hành, quảng cáo phải trả khi lên sàn thương mại điện tử quốc tế khá cao, chưa kể các chi phí về vận tải, kho bãi, đóng gói... Điều này khiến doanh nghiệp chưa mặn mà đầu tư đẩy mạnh kênh này"", đại diện đơn vị này lý giải. Ngược lại, ông Cao Thúc Uy, giám đốc Công ty Cao Phát (Bà Rịa - Vũng Tàu), lại thấy so với chi phí để tiếp cận khách hàng quốc tế theo cách thức truyền thống, chi phí trên Amazon hay Alibaba thấp hơn. Tuy nhiên, doanh nghiệp chưa ""mặn mà"" với hình thức này vì chưa có kinh nghiệm và ngại phát sinh trong quá trình giao nhận hàng hóa... Phải làm bài bản Theo số liệu từ Amazon, năm 2023 số lượng các đối tác bán hàng Việt Nam sử dụng hoàn thiện đơn hàng bởi Amazon tăng hơn 300% so với năm 2019. Đồng thời số lượng nhà bán hàng Việt Nam có doanh thu hơn 1 triệu USD trên Amazon trong năm 2023 cũng tăng gần 10 lần so với năm 2019. Ông Phùng Quốc Mẫn, phó chủ tịch Hội Mỹ nghệ và Chế biến gỗ TP.HCM (HAWA), cho biết năm 2023 kim ngạch xuất khẩu gỗ và các sản phẩm gỗ của Việt Nam giảm 15,9% so với 2022, chỉ đạt 13,18 tỉ USD. Khi phân khúc thị trường xuất khẩu truyền thống gặp nhiều thách thức do tăng trưởng kinh tế toàn cầu thấp, hàng rào bảo hộ gia tăng... thì doanh số thương mại điện tử nội thất và thủ công mỹ nghệ vẫn tăng trưởng. ""Tuy nhiên, mức độ tham gia xuất khẩu qua thương mại điện tử của doanh nghiệp Việt Nam hạn chế khi phần lớn doanh nghiệp chủ yếu gia công theo đơn hàng và mẫu mã của các nhà phân phối nước ngoài"", ông Mẫn nói. Ông Trần Hữu Hậu, phó tổng thư ký Hiệp hội Điều Việt Nam, cho rằng về lý thuyết, ưu điểm của kênh thương mại điện tử quốc tế là ""giúp ngồi nhà nhưng vẫn bán hàng đi muôn nơi"". Tuy nhiên với hàng nông sản như điều, tiêu, cà phê... hiện hầu hết bán qua môi giới, kể cả những sản phẩm được chế biến sâu. ""Thị trường đã hình thành từ sớm nên các doanh nghiệp gần như đã biết nhau, hệ thống thanh toán và giao nhận hàng hóa quốc tế bằng đường biển khá thuận lợi, giá thành khá rẻ. Do đó, hầu hết doanh nghiệp vẫn ưu tiên chọn kênh buôn bán này, thay vì ""ăn đong"" trên sàn"", ông Hậu nhìn nhận. Thất bại, khó khăn khi bán hàng trên sàn thương mại điện tử quốc tế đến từ nhiều lý do. Nhưng theo ông Nguyễn Dũng, thiếu kinh nghiệm, ""ăn xổi, lướt sóng"" vẫn là nguyên nhân phổ biến. Nhiều doanh nghiệp lên kế hoạch nghiên cứu thị trường còn sơ sài, chỉ chú tâm cạnh tranh về giá. Trong khi nhu cầu khách hàng thay đổi quá nhanh. Ông Nguyễn Dũng cho rằng doanh nghiệp không còn cách nào khác phải có tầm nhìn dài hạn, xây dựng chiến lược lâu dài, nghiêm túc cùng với nỗ lực xây dựng thương hiệu. Thực tế có không ít đơn vị bán rất tốt nhưng chỉ được thời gian ngắn là bão hòa vì không xây dựng được thương hiệu bền vững.",03/06/2024 07:30 GMT+7,https://tuoitre.vn/ban-hang-qua-amazon-ban-con-tray-trat-doanh-thu-chua-an-thua-20240602223118674.htm,"Nhiều doanh nghiệp kiếm triệu USD nhờ có bạn hàng mới qua sàn thương mại điện tử quốc tế Amazon. Tuy nhiên, thất bại cũng không ít."
Thêm Công ty SJC tham gia bán vàng bình ổn,"5 đơn vị cùng bán vàng bình ổn Thông tin vừa được Ngân hàng Nhà nước phát cuối ngày 2-6. Như vậy có đến 5 đơn vị cùng mua vàng của Ngân hàng Nhà nước và bán vàng trực tiếp tới người dân. Từ đó kéo giảm chênh lệch giá vàng trong nước - thế giới theo chỉ đạo của Chính phủ. SJC là doanh nghiệp kinh doanh vàng 100% vốn nhà nước trực thuộc UBND TP.HCM. SJC có 36 cửa hàng được phép giao dịch vàng miếng SJC. ""SJC được Ngân hàng Nhà nước lấy thương hiệu để sản xuất vàng miếng và chịu trách nhiệm về chất lượng vàng miếng SJC. Việc tham gia của SJC sẽ bổ sung thêm số lượng đơn vị tham gia bán vàng trực tiếp tới người dân"", Ngân hàng Nhà nước nhấn mạnh. Hôm nay, trên các website Vietcombank, VietinBank, BIDV, Agribank và Công ty SJC đã công bố địa điểm, thời gian bán vàng miếng. Về thời gian, dự kiến ngày mai các ngân hàng sẽ bán vàng bắt đầu từ 14h30. Còn từ 4-6, các ngân hàng này sẽ bán vàng bình ổn từ 9h. Về giá bán vàng, căn cứ vào giá mua vàng miếng từ Ngân hàng Nhà nước, các đơn vị này sẽ công bố giá bán trên website và tại các địa điểm bán vàng. Ngân hàng chỉ bán chứ không mua vàng Các ngân hàng cũng lưu ý chỉ bán vàng miếng SJC cho khách hàng cá nhân chứ không mua vàng. Còn Công ty SJC thực hiện tất cả các giao dịch mua bán vàng miếng SJC. Việc bán vàng của các ngân hàng và Công ty SJC vì mục tiêu bình ổn thị trường, không vì mục tiêu lợi nhuận. Trong trường hợp dự kiến mua vàng với khối lượng lớn, để đảm bảo tuân thủ các quy định pháp luật về phòng chống rửa tiền, khách hàng chuẩn bị sẵn thông tin để khai báo hoặc thực hiện mở tài khoản tại các ngân hàng này trước khi giao dịch. Khách hàng cũng có thể thanh toán bằng hình thức chuyển khoản để thuận tiện, nhanh chóng hơn trong giao dịch.",02/06/2024 19:21 GMT+7,https://tuoitre.vn/them-cong-ty-sjc-tham-gia-ban-vang-binh-on-20240602185151721.htm,"Cùng với Agribank, BIDV, Vietcombank và VietinBank, Công ty SJC sẽ tham gia mua vàng từ Ngân hàng Nhà nước để bán vàng trực tiếp tới người dân."
