Title,Content,Date,Url,Summary
"Nhắm mắt lại, trôi theo cảm xúc cùng kịch đọc","Kịch đọc là chương trình hoàn toàn mới của sân khấu Hồng Hạc, do đạo diễn Việt Linh khởi xướng thực hiện. Im lặng tuyệt đối với kịch đọc Kịch đọc diễn ra tại Café La Rotonde (185B, Trần Hưng Đạo, Q.1, TP.HCM), định kỳ mỗi tháng hai lần, vào tối thứ ba giữa tháng và thứ ba cuối tháng. Số đầu tiên là vở Thiên Thiên (diễn ra tối 4-6), được Việt Linh viết từ sự kết hợp ý tưởng của hai truyện ngắn Hạnh phúc là cùng (Vũ Hồi Nguyên) và Xoa (Tăng Song Nam).  Vở từng diễn trên sân khấu năm 2014. Trong không gian ấm cúng của quán cà phê nhỏ, đèn hắt thứ ánh sáng yếu ớt và cứ thế không một tiếng động, người xem nhắm mắt trôi theo câu chuyện. Ê kíp đọc kịch ngồi tầng trên hoàn toàn không tiếp xúc với khán giả.  Cái họ tiếp xúc là giọng nói, là xúc cảm trong từng cái nấc nghẹn, hơi thở, tiếng cười lúc xót xa, lúc chơi vơi, cũng có lúc đểu giả… Hỗ trợ cho diễn kịch bằng giọng của diễn viên là tiếng động, âm nhạc. Cứ thế, người nghe nương tựa cùng Thiên Thiên, người đàn bà gánh chịu nhiều tổn thương, để lắng nghe chuyện đời của những phận người khác nhau. Nhân vật nào dường như cũng kỳ lạ, nhưng nhìn kỹ sẽ phát hiện họ là ai đó, trà trộn đâu đó trong vạn nẻo đời nhọc nhằn. Đó là cô Si, gã Trầm Luân, Xoa, ông bệ vệ, cô tiểu thư… Những câu chuyện nhỏ nhưng đau. Thế giới dường như thu nhỏ trong căn nhà của Thiên Thiên. Họ chỉ ngồi đó, thủ thỉ thôi mà những vết thương lòng của họ khiến người nghe xao xác. Hóa ra, xã hội càng hiện đại thì tổn thương dường như càng nhiều. Đôi khi, cần lắm một tri âm xuất hiện đúng lúc. Có thể nói ra được nỗi đau, chịu đối diện sự thật và được ai đó tận tâm lắng nghe, xoa dịu có lẽ sẽ bớt đi những hậu quả đau lòng. Tập trung nội lực Đạo diễn Việt Linh, cũng là người thể hiện giọng nhân vật chính Thiên Thiên, chia sẻ dạng kịch đọc chị nghe rất nhiều lần ở châu Âu và khóc rất nhiều. Vậy nên chị nhất quyết phải làm loại hình này ở Việt Nam. Tiền vé dù bán hết cũng không thể bù vào chi phí thực hiện một vở kịch đọc. Nhưng đạo diễn không muốn tăng tiền vé để những người có thu nhập thấp, học sinh, sinh viên có cơ hội tiếp xúc loại hình kịch lan tỏa chất văn học này. Rất may là khi chị thực hiện dự án ý nghĩa này, diễn viên và nhiều người đã đồng lòng hỗ trợ không tính toán. Việt Linh xúc động nói: ""Khi ta gọi lời hay sẽ có rất nhiều người ""Ơi!"""". Nhà nghiên cứu văn hóa Phúc Tiến cho biết đây là lần đầu tiên ông thưởng thức kịch đọc. Ban đầu ông cứ nghĩ như là kịch truyền thanh, tuy nhiên nghe xong ông cảm thấy đầu óc mình được thăng hoa. Câu chuyện thông qua loại hình này cho ông nhiều cảm xúc và cứ nhớ mãi câu thoại trong kịch: ""Khi chúng ta hết hy vọng thì hãy nghĩ đến những người đang hy vọng về chúng ta"". Với kịch đọc, diễn viên không thể dựa vào tổng thể của một sân khấu hoàn chỉnh có cảnh trí, ánh sáng, những hiệu ứng, hình thể diễn viên, nên buộc lòng họ phải tập trung nội lực cao độ. Thoại không thể tùy tiện thêm bớt, vì vậy trong vở có diễn viên vì căng thẳng quá nên đọc lộn ""muồi rục"" thành… mụt ruồi! Nghệ sĩ Võ Minh Lâm vào vai mà như đạo diễn Việt Linh nói vui là ""phi công"" của nhân vật Thiên Thiên, tâm sự: ""Tham gia chương trình này tôi rất áp lực và cảm thấy khó quá. Bởi lợi thế ngoại hình giấu hết, chỉ có thể khoe giọng sao cho tâm lý, tình cảm đầy đủ để khán giả có thể cảm nhận được. Đọc kịch phải hết sức tập trung, chỉ cần lơ là là dòng chữ chạy đi không biết đường nào mà lần. Khó vậy nhưng làm được thì cảm thấy vô cùng hạnh phúc"". Với loại hình kịch này, sân khấu Hồng Hạc mong muốn có thể đem đến các trường học hoặc các gia đình đều phù hợp để những tác phẩm văn học hay được lan tỏa.",05/06/2024 11:11 GMT+7,https://tuoitre.vn/nham-mat-lai-troi-theo-cam-xuc-cung-kich-doc-20240605104116256.htm,"Không phải đi coi kịch, mà đi nghe đọc kịch. Ủa, kỳ vậy? Kỳ, nhưng vẫn có 50 khán giả đồng điệu ngồi suốt hơn một tiếng, nhắm mắt mà nghe kịch đọc."
Nói chuyện bao cao su và thuốc ngừa thai trong vở cải lương xã hội là bình thường?,"Những ý kiến trên do bạn đọc gửi về cho Tuổi Trẻ Online sau bài viết Đem cả bao cao su và thuốc ngừa thai vào câu ca cải lương: Trực diện hay thô thiển?, phản ánh một đoạn trích trong vở Thế giới ảo diễn trong tập 8 của chương trình Học viện cải lương với những câu từ nhắc đến chuyện ngừa thai gây tranh cãi. Tuổi Trẻ Online liên hệ với NSND Bạch Tuyết, viện trưởng Học viện cải lương, thông qua quản lý Dunal Trần nhưng không nhận được câu trả lời chính thức. Sử dụng câu từ mạnh cần đúng bối cảnh Trên fanpage của Học viện cải lương, nhà sản xuất giải thích: ""Đoạn trích nói về những người trẻ có quan niệm yêu cuồng sống vội, nên dẫn đến hậu quả có thai ngoài ý muốn.  Thông qua đây, chúng tôi muốn cảnh báo giới trẻ về thực trạng trên, cũng như đề cao sự quan tâm đúng mực của gia đình, đặc biệt trong bối cảnh xã hội hôm nay. Hơn nữa, trong việc giáo dục giới tính, nhất là vấn đề sức khỏe sinh sản của người vị thành niên, thành niên thì cần gọi tên đúng các hình thức, biện pháp, nhân tố… để mọi người có thể nắm, hiểu rõ"". Một số ý kiến thì cho rằng đây là vở diễn xã hội nên chuyện đề cập đến bao cao su hay thuốc tránh thai là bình thường. Độc giả Đảm Ý của Tuổi Trẻ Online viết: ""Tên tuổi của diễn viên Bạch Tuyết gắn liền với loại hình cải lương ""xã hội"", đương thời cũng có nhiều ý kiến không hài lòng về tuồng tích, cách ăn mặc. Nếu nhìn nhận một cách cởi mở theo phương diện xã hội thì đúng là có không ít nam nữ đổ lỗi cho nhau khi có thai ngoài ý muốn.  Thật sự nếu nói tránh đi chắc cũng chỉ quanh quẩn cù cưa ""tại anh"", ""tại em"" mà thôi.  Đúng là hơi gượng, nhưng lời ca như trên tôi thấy không có gì là thô thiển hết, bây giờ trường học cũng đã giáo dục giới tính rồi.  Việc tuyên truyền tránh thai đúng cách với cách tiếp cận sân khấu như vậy cũng không xấu"". Với bạn đọc Thanh thì chuyện này là bình thường. So với phim Việt chiếu rạp thì ngôn từ và diễn xuất trong chương trình cải lương này chưa thấy gì là dữ dằn.  Trao đổi với Tuổi Trẻ Online, nghệ sĩ Hạ Nắng, diễn viên đoàn Đồng ấu Bạch Long, cho biết việc sử dụng câu từ mạnh như: bao cao su, thuốc ngừa thai là chuyện bình thường ở các vở diễn xã hội, nhưng cần đặt trong một bối cảnh hợp lý: ""Nếu đặt trong bối cảnh là nhân vật mang tính chất hài hoặc nhân vật bác sĩ nói chuyện với bệnh nhân hoặc nhân vật nói nội dung tuyên truyền thì sẽ hợp lý, nhưng hai nhân vật chính đang nói chuyện tình cảm, đề cập đến vấn đề có con trong một bối cảnh nghiêm túc thì việc này sẽ làm giảm giá trị của lời ca. Khán giả sẽ không tin và cảm thấy rất hài hước"". Hạ Nắng cũng cho biết khi học tại Trường đại học Sân khấu - Điện ảnh, các giảng viên rất nghiêm khắc trong việc dựng bài, tiểu phẩm. Đạo diễn, tác giả có thể đưa những cái mới của đời sống hiện thực vào nhưng bắt buộc phải hợp lý, đúng với tình huống, bối cảnh.  ""Bởi cải lương phản ánh hiện thực đời sống xã hội, nhưng một khi đã đem lên sân khấu thì phải biết chắt lọc, nghệ thuật hóa"" - anh chia sẻ. Dưới góc nhìn của một nghệ sĩ trẻ, Hạ Nắng bảo có nhiều cách để phản ánh vấn đề hiện thực trong ca từ cải lương mà không nhất thiết phải nói thẳng ra. Trong các vở cải lương xưa, lời thoại thường đơn giản, dễ hiểu. Ví dụ, khi nhân vật nữ nói với nhân vật nam về chuyện mình có thai thì có thể thoại: ""Em đang mang trong mình giọt máu của anh"" . Làm mới cải lương nhưng đừng vượt khuôn khổ Đa số độc giả của Tuổi Trẻ Online đều đồng tình rằng việc đưa những từ ngữ như vậy vào cải lương là không phù hợp, dù có muốn thể hiện sự thực tế đến đâu đi chăng nữa. Độc giả Tùng Việt bảo: ""Việc sử dụng những từ ngữ như vậy trong ca từ cải lương không thể nói là trực diện với thực tế, mà phải gọi là thô thiển, không còn tính nghệ thuật"". Còn độc giả Duy Anh nói: ""Làm mới cải lương nhưng đừng vượt qua những khuôn khổ cho phép"". Bạn đọc Vương Nữ Kiều Đoan Trinh ghi nhận những ""điểm sáng"" xuyên suốt của chương trình. Thế nhưng ""đem cả bao cao su và thuốc ngừa thai vào câu ca cải lương"" là không ổn. Với bạn đọc Tý Cô Nương, trong câu ca cải lương mà hát như thế thì rất thô thiển. Độc giả Gia Lạc khẳng định: """"Văn hay, ý đẹp"" là tôn chỉ của người cầm bút viết văn, thơ, nhạc của tổ tiên truyền dạy..."".",04/06/2024 13:58 GMT+7,https://tuoitre.vn/noi-chuyen-bao-cao-su-va-thuoc-ngua-thai-trong-vo-cai-luong-xa-hoi-la-binh-thuong-20240604091517184.htm,"'Sử dụng những từ ngữ như vậy trong cải lương không thể nói là trực diện, mà phải gọi là thô thiển, không còn tính nghệ thuật'; 'Đây là vở diễn xã hội nên mấy từ đó là bình thường. Không dùng từ tục tĩu, chửi thề là được...'"
"Nhà cổ ông Hai Thái, từng vào phim Mẹ chồng, xuống cấp nặng vì vắng du khách","Khu nhà cổ ông Hai Thái này được xây dựng từ năm 1925, theo kiến trúc Gothic của Pháp. Chủ nhân là ông Nguyễn Đình Thái (hay được gọi là ông Hai Thái), người xã Vĩnh Trung, TP Nha Trang, đến xây dựng tại khu đất này. Sau ngày 30-4-1975, khu nhà được giao cho địa phương quản lý. Từ năm 1977 đến 1990, khu nhà được sử dụng để làm trường học. Đến cuối năm 2008, UBND tỉnh Khánh Hòa giao cho khách sạn Yasaka - Sài Gòn - Nha Trang tiếp quản, tôn tạo thành điểm tham quan. Khai thác nhà cổ không hiệu quả? Hiện tại, khu nhà cổ ông Hai Thái bị bỏ hoang, xuống cấp nghiêm trọng. Nhiều khu vực đổ nát, hư hỏng, khiến không ít người dân và du khách tiếc nuối. Ông Trần Tấn Ngọc - tổng giám đốc khách sạn Yasaka - Sài Gòn - Nha Trang, cho hay trước đây khu nhà cổ ông Hai Thái cũng hoang hóa, doanh nghiệp này tiếp nhận và đầu tư tu bổ, sửa chữa, phục dựng lại và biến thành địa chỉ hút khách du lịch, nhất là du khách nước ngoài. Tuy nhiên, gần đây du khách nước ngoài đến Khánh Hòa ít, trong khi chi phí vận hành lớn, doanh nghiệp thu không đủ bù chi nên đã trả lại khu nhà cho chính quyền. ""UBND tỉnh Khánh Hòa giao khu nhà cổ ông Hai Thái cho UBND huyện Diên Khánh quản lý. Chúng tôi đã bàn giao xong cả rồi"", ông Ngọc nói. Một lãnh đạo UBND xã Suối Tiên thông tin, nhà cổ vẫn còn nguyên hiện trạng, nhưng bên trong không còn tài sản nên xã chỉ bảo vệ an ninh khu vực, niêm phong cửa.  May mắn hơn nhà cổ ông Hai Thái, nhà cổ Phú Vinh hơn 200 năm tuổi (xã Vĩnh Thạnh, TP Nha Trang) được ông Nguyễn Xuân Hải (86 tuổi) kế thừa vừa làm điểm tham quan vừa làm nơi thờ tự ông bà và sinh sống.  Tuy nhiên nhà cổ này cũng gặp tình trạng ""ế"" khách. Nhà cổ Phú Vinh phụ thuộc phần lớn vào nguồn khách tàu biển, nhưng cuối tháng 4 đến hết tháng 10 khách tàu biển không đến Nha Trang. ""Khách nội địa ít ai đến đây. Doanh thu hiện không đáng bao nhiêu. Tôi có đề nghị tỉnh hỗ trợ kinh phí trùng tu, bảo dưỡng nhưng chưa được phản hồi. Trước mắt do gia đình tự bỏ tiền ra sửa chữa"", ông Hải chia sẻ. Đừng để nhà cổ ""ngủ quên"" Trao đổi với Tuổi Trẻ, ông Nguyễn Văn Nhuận - giám đốc Sở Văn hóa và Thể thao tỉnh Khánh Hòa, nói nhà cổ ông Hai Thái không phải là di tích cấp tỉnh, do đó không thuộc phạm vi chính quyền phải đầu tư để trùng tu, sửa chữa. Ở góc độ người làm du lịch, ông Bùi Minh Thắng - giám đốc Công ty TNHH Dịch vụ du lịch Thương mại Phương Thắng, cho rằng nhà cổ được khách châu Âu yêu thích.  ""Đối với khách tàu biển đến từ châu Âu, chúng tôi vẫn thiết kế đưa khách đến nhà cổ Phú Vinh.  Còn khách Hàn Quốc, nếu được kết nối sẽ phát huy giá trị của điểm đến vì họ thích trải nghiệm văn hóa.  Tại Hàn Quốc những khu nhà cổ luôn thu hút khách, bởi họ biết cách truyền tải văn hóa, phục dựng và khai thác tốt"", ông Thắng nói. Theo ông Thắng, nhà cổ ông Hai Thái từng được công ty ông kết hợp với tham quan khu du lịch sinh thái Suối Tiên. Nhưng chỉ đưa khách đến rồi về thì rất khó để duy trì hoạt động. ""Phải kết nối điểm đến trong khu vực, nếu nhà cổ được phục hồi chúng ta có thể xây dựng một tour Cam Lâm hoàn chỉnh, khu nhà cổ phải tăng tiện ích như shoping, ăn uống... thậm chí cho khách thuê trang phục xưa chụp ảnh nhằm kéo chi tiêu của du khách kết hợp quảng bá, truyền thông.  Để nhà cổ hư hỏng vậy, chúng tôi rất xót nhưng cũng chẳng biết làm thế nào"", ông Thắng kết luận.",04/06/2024 11:33 GMT+7,https://tuoitre.vn/nha-co-ong-hai-thai-tung-vao-phim-me-chong-xuong-cap-nang-vi-vang-du-khach-20240603171734342.htm,"Nhà cổ ông Hai Thái (xã Suối Tiên, huyện Diên Khánh, Khánh Hòa) là bối cảnh chính trong bộ phim ăn khách 'Mẹ chồng' nay đang bỏ hoang, xuống cấp nặng do khai thác du lịch không hiệu quả, không thuộc diện được đầu tư bảo tồn."
Mũ nồi xanh Việt Nam: Người đi gieo hạt hòa bình,"Bộ phim truyền hình Hàn Quốc này đã góp phần đưa hình ảnh những người lính đang thực hiện nhiệm vụ quốc tế ở nước ngoài trở nên gần gũi, hấp dẫn hơn. Năm 2024, chân dung những người lính mũ nồi xanh lại được khắc họa một cách sinh động. Nhưng lần này, riêng với độc giả Việt Nam, cảm giác còn thân thuộc hơn nữa. Bởi trong cuốn sách Mũ nồi xanh Việt Nam: Người đi gieo hạt hòa bình (NXB Kim Đồng) là câu chuyện do chính người lính Việt Nam đang tham gia Lực lượng gìn giữ hòa bình Liên Hiệp Quốc kể lại. Vào một ngày đầu tháng 9-2020, trung úy Nguyễn Sỹ Công nhận được quyết định cử đi công tác ở Nam Sudan. Quyết định này không chỉ giúp chàng trung úy trẻ quê Nghệ An có những trải nghiệm hiếm có trong cuộc đời binh nghiệp của mình. Nó còn giúp độc giả có cái nhìn tiệm cận hơn vào thế giới những người lính mang theo sứ mệnh hòa bình cao cả, trong bối cảnh lịch sử, địa chính trị phức tạp của thế kỷ 21. Qua từng chương, ""Từ khát khao cống hiến đến hành trình vạn dặm"", ""Gia đình và nhiệm vụ"", ""Gian nan nhưng không nản"", ""Những điều chưa biết về Nam Sudan"", ""Gieo hạt hòa bình"", ""Tự hào hát lên Việt Nam ơi"", ""Ngày trở về thương nhớ""... Độc giả được dõi theo những ngày làm việc tại bệnh viện dã chiến cấp 2 số 4 tại căn cứ quân sự Juba Compound Bentiu (Nam Sudan) của trung úy Công cùng các đồng nghiệp và cũng là đồng hương Việt Nam như trung tá bác sĩ sản khoa Bùi Thị Thu Trang, thiếu tá Tạ Thị Hường, thượng úy bác sĩ Vũ Thế Anh... Đó còn là cái Tết cổ truyền của dân tộc trên nước bạn, thấy những nữ quân nhân hóa thành các ""nàng tiên"" trong dịp Trung thu. Cuốn sách không dày, với đầy ắp hình ảnh, gần với báo chí hơn là văn chương. Tác giả Nam Kha, người chấp bút cho tác phẩm, đã chuyển tải sinh động dòng hồi tưởng của trung úy Công để thấy những khó khăn vất vả của người lính mũ nồi xanh. Đồng thời cũng thấy được tình cảm gắn bó của người dân một đất nước ở châu Phi với những người lính đến từ một đất nước châu Á xa xôi.",04/06/2024 10:23 GMT+7,https://tuoitre.vn/mu-noi-xanh-viet-nam-nguoi-di-gieo-hat-hoa-binh-2024060410192805.htm,"Còn nhớ cách đây gần mười năm, tác phẩm Hậu duệ mặt trời từng làm mưa làm gió khắp thế giới."
"Việt Hương chơi lớn, làm động đất khiến trẻ con khoái chí","Như đã hứa, Việt Hương đã sử dụng nhiều kỹ xảo, trong đó có hiệu ứng làm ghế rung lắc ở lần đầu tiên giữ vai trò đạo diễn, kỷ niệm 30 năm chị theo nghiệp hát. Việt Hương làm động đất, bọn trẻ kêu: Nữa đi! Mễ Cốc phiêu lưu ký (tác giả: Việt Hương - Thạch Thảo, đạo diễn: Việt Hương) sẽ diễn suốt tại Sân khấu Trương Hùng Minh từ tháng 6 đến tháng 9 năm nay. Vở là câu chuyện ở xứ sở Ngũ Cốc. Hoàng tử Mễ Cốc còn trẻ người nên buột miệng chê hạt gạo khiến Thần Lúa Nước tức giận quyết định thu hồi hạt gạo, đẩy xứ sở Ngũ Cốc vào đói kém, thiên tai, dịch bệnh. Để cứu xứ sở, chuộc lại lỗi lầm, Mễ Cốc dấn thân vào hành trình cam go để mong thần tha thứ, ban lại cho dân hạt gạo ấm no. Hai thầy trò Minh Nhí, Việt Hương đại diện cho ""phe ác"" trong vở. Họ biến hóa thân phận liên tục để phá đám Mễ Cốc. Minh Nhí lúc là người bí ẩn ở xứ sở Cà Ri, lúc là Thần Thiên Tai. Còn Việt Hương lạng qua lách lại với nhân vật bà Bếp và Thần Sâu Bọ. Tuy mang tiếng là ác nhưng thầy trò Thần Thiên Tai và Sâu Bọ làm rần rần nhưng không ai thèm sợ. Kiểu ác chơi… cho vui! Trong vở, có những đoạn thầy trò họ liên tục hóa phép để hủy hoại xứ sở Ngũ Cốc. Lúc thì làm mưa ngập lụt, lúc động đất, lúc tuyết rơi, lúc thì phun bong bóng độc… Và đúng như Việt Hương mong muốn làm cho ""đã nư"" vở diễn xem như thay thế live show kỷ niệm 30 năm làm nghề của mình. Chị đã cất công tính toán, thực hiện nhiều hiệu ứng để khán giả nhí choáng ngợp. Cảnh mưa là có mưa thật, cảnh tuyết là trắng xóa, bong bóng độc nhưng phun ra mùi thơm tỏa khắp khán phòng, đu bay trên không cảnh Mễ Cốc bay đến xứ sở Nhân Sâm. Đặc biệt, khi Thần Thiên Tai hét lên: ""Động đất"" thì khán giả giật mình khi thấy ghế của mình đang ngồi rung mạnh. Sau giây phút ngỡ ngàng, nhiều khán giả nhí phấn khích la lên: ""Nữa đi, nữa đi…"". Câu chuyện dễ thương Xem Mễ Cốc phiêu lưu ký nhiều khán giả tỏ vẻ thích thú vì câu chuyện rất dễ thương. Không quá nhiều kịch tính nhưng vở dẫn khán giả nhí qua những miền mộng mơ, qua đó lồng ghép những bài học nho nhỏ như biết trân trọng hạt gạo, biết dũng cảm đối diện sai lầm và trưởng thành, biết đoàn kết, thương yêu nhau để chống lại cái xấu… Trang phục, đạo cụ được đầu tư ""tới bến"" để tạo hình ảnh đẹp lung linh. Đặc biệt là hình ảnh của nước Việt xưa thấp thoáng bóng vua Hùng, trống đồng, lúa nước… Thiết kế sân khấu nhiều lớp tạo độ sáng, vừa rực rỡ vừa có chiều sâu, giàu sức gợi để câu chuyện được bay bổng. Mỗi nhân vật được xây dựng theo cách duyên dáng từ vua, vương mẫu, Mễ Cốc của vương quốc Ngũ Cốc tới gia đình nhà Táo, vương quốc Nhân Sâm, Cà Ri, Bà Tiên Truyện. Ngay cả ""bọn ác"" cũng nhộn nhạo theo kiểu rất… đáng yêu! Vở tiết chế được hài ""xàm"" để giữ sự trong trẻo cho khán giả nhí. Ngoài Minh Nhí, Việt Hương, Mễ Cốc phiêu lưu ký còn có sự góp mặt của các nghệ sĩ Cát Phượng, Hứa Minh Đạt, Mạc Văn Khoa, Quỳnh Lam, Gia Bảo, Thạch Thảo, Trung Tín, Quỳnh Hồ, Bảo Bảo, Chenco, Di Dương…",04/06/2024 07:53 GMT+7,https://tuoitre.vn/viet-huong-choi-lon-lam-dong-dat-khien-tre-con-khoai-chi-20240604074524769.htm,"Chương trình Truyện thần tiên 2 với vở Mễ Cốc phiêu lưu ký của thầy trò Minh Nhí, Việt Hương đã bước vào đường đua mùa hè để phục vụ khán giả nhí."
TP.HCM vào top 20 thành phố có ẩm thực ngon nhất thế giới,"Tờ Time Out miêu tả ẩm thực Việt Nam luôn đảm bảo về hương vị, với sự kết hợp tinh tế của những yếu tố ngọt, cay, thơm và lạ. Đặc biệt, du khách và người dân có thể thưởng thức những món ăn đặc trưng và hấp dẫn nhất tại TP.HCM. Theo tạp chí của Anh, ngoài các món ăn đường phố như bánh mì, cơm tấm, cháo lòng, thành phố còn có những nhà hàng đạt sao Michelin, phục vụ các món ăn truyền thống được chế biến một cách sáng tạo. Trong cuộc khảo sát của Time Out, phở là món ăn được nhắc đến nhiều nhất tại TP.HCM. Tại miền Nam, món phở thường được ăn kèm với húng quế, rau mùi, tương ớt và tương đen. Du khách có thể tìm thấy món ăn này ở khắp thành phố. Tạp chí trên dẫn nhà văn người Mỹ gốc Việt Dan Q Dao đánh giá: ""Mặc dù Hà Nội có thể là cái nôi của ẩm thực và văn hóa Việt Nam, nhưng TP.HCM lại nổi lên như một trong những điểm đến ẩm thực đặc sắc nhất đất nước"". Danh sách 20 thành phố có nền ẩm thực ngon nhất thế giới do Time Out bình chọn lần này cũng có sự góp mặt của những thành phố nổi tiếng như Napoli (Ý), Johannesburg (Nam Phi), Lima (Peru), Bắc Kinh (Trung Quốc), Bangkok (Thái Lan), Kuala Lumpur (Malaysia), Mumbai (Ấn Độ), Dubai (Các Tiểu vương quốc Ả Rập thống nhất), Portland (Mỹ)... Danh sách được đưa ra sau khi Time Out xem xét các tiêu chí như bữa ăn chất lượng đi kèm giá cả hợp lý. Tạp chí này cũng dựa trên ý kiến của người dân địa phương về những nhà hàng ngon nhất trong thành phố, những món ăn nhất định phải thử...",03/06/2024 20:30 GMT+7,https://tuoitre.vn/tp-hcm-vao-top-20-thanh-pho-co-am-thuc-ngon-nhat-the-gioi-20240603202851548.htm,Tạp chí Time Out (Anh) vừa xếp TP.HCM ở vị trí thứ 4 trong danh sách 20 thành phố có ẩm thực ngon nhất thế giới.
