Title,Content,Date,Url,Summary
"Doanh thu vài tỉ đồng nhưng một cổ phiếu tăng giá 100%, top 'siêu đắt' sàn chứng khoán","Doanh thu thuần vài tỉ đồng, nhưng VEF lãi rất khủng? Kết ngày 4-6, cổ phiếu VEF của CTCP Trung tâm Hội chợ triển lãm Việt Nam (VEFAC) quay đầu giảm sau nhiều phiên tăng tốt, thị giá về mức 224.000 đồng/CP. Thống kê từ đầu năm đến nay, cổ phiếu VEF tăng hơn 100%, đi từ vùng giá 111.000 đồng lên 229.900 đồng trước khi điều chỉnh về mức hôm nay. 3 sàn có hàng nghìn cổ phiếu, nhưng số mã thị giá ""3 số"" hiện trên bảng điện tử chiếm khá thưa thớt. Thị giá nêu trên được tính cuối phiên ngày 4-6. Thị giá cao, tính đến ngày 4-6, giá trị vốn hóa VEF đạt hơn 37.318 tỉ đồng (1,46 tỉ USD), tăng gấp đôi so với đầu năm. Tại báo cáo thường niên năm 2023, VEF cho biết có hai dự án đang triển khai ở Đông Anh có tổng diện tích hơn 300ha, cách trung tâm Hà Nội 15km, gồm: dự án trung tâm hội chợ triển lãm quốc gia và dự án khu đô thị mới Đông Anh. Ngoài ra, VEF còn có dự án tổ hợp trung tâm thương mại dịch vụ hỗn hợp tại 148 Giảng Võ, Hà Nội... Về tình hình kinh doanh, VEF có doanh thu thuần từ cung cấp dịch vụ chỉ vài tỉ đồng, nhưng lợi nhuận sau thuế hàng trăm tỉ đồng nhờ doanh thu tài chính cao. Như tại báo cáo tài chính năm 2023, doanh thu thuần cả năm VEF đạt 8,99 tỉ đồng, gấp hơn 9 lần so với năm trước. Tuy nhiên, doanh thu hoạt động tài chính (chủ yếu từ lãi tiền gửi, tiền cho vay) lại đạt 564 tỉ đồng, năm ngoái cũng ghi nhận 512 tỉ đồng. Nhờ vậy, dù lỗ gộp về cung cấp dịch vụ, nhưng VEF vẫn báo lãi sau thuế hơn 434 tỉ đồng, tăng gần 36%. Sang đến quý 1-2024, doanh thu thuần từ cung cấp dịch vụ của VEF hơn 268 triệu đồng, giảm 88% cùng kỳ, doanh thu tài chính đạt gần 125 tỉ đồng. Kết quả, lợi nhuận sau thuế đạt 91,6 tỉ đồng, giảm hơn 10%. Với mức vốn hóa nêu trên, VEF nằm trong câu lạc bộ các doanh nghiệp vốn hóa tỉ USD trên sàn UpCOM, sau những ""ông lớn"" nổi tiếng ""bề thế"" như Tổng công ty Cảng hàng không Việt Nam - ACV (252.500 tỉ đồng) hay Viettel Global - VGI (278.800 tỉ đồng)… Cũng cần nói thêm, ACV hay VGI đều có tốc độ tăng giá tốt trên sàn UPCoM từ đầu năm đến nay. Như ACV, thị giá tăng hơn 80%, còn VGI tăng tới hơn 250%. Những 'ngôi sao' tăng giá tới 100% trong 1 tháng trên UPCoM, HNX Thống kê từ Sở Giao dịch chứng khoán Hà Nội, sàn UPCoM diễn biến sôi động về thanh khoản trong tháng 5 vừa qua. Cụ thể, giá trị giao dịch bình quân đạt hơn 1.327 tỉ đồng/phiên, tăng 93,43% so với tháng 4 liền trước. Về biến động giá cổ phiếu, tăng giá mạnh nhất tháng 5 theo xếp hạng của HNX là mã chứng khoán ALV của CTCP xây dựng ALVICO với giá đóng cửa cuối kỳ đạt 10.900 đồng, tăng 122,45% so với cuối tháng trước. Tiếp theo là VLP của CTCP Công trình công cộng Vĩnh Long với giá đóng cửa đạt 200 đồng, tăng 100%. Trong nhóm tăng giá mạnh nhất còn có cổ phiếu BSD của Công ty CP Bia, rượu Sài Gòn, SAC của Công ty CP Xếp dỡ và dịch vụ Sài Gòn, AAH của CTCP Hợp Nhất. Còn trên sàn HNX, giá cổ phiếu trong tháng 5 tăng nhưng giảm nhẹ về thanh khoản so với tháng trước. Giá trị giao dịch bình quân đạt 1.976 tỉ đồng/phiên, giảm 4,6%. Về giá giao dịch, tăng giá mạnh nhất là mã chứng khoán API của CTCP đầu tư Châu Á - Thái Bình Dương với giá đóng cửa tháng 5 tăng 168,29% (tương đương 6.900 đồng/CP), đạt 11.000 đồng/CP so với cuối tháng trước. Đứng thứ 2 là cổ phiếu HMR của Công ty CP đá Hoàng Mai với mức tăng 108,28% (tương ứng 18.300 đồng/CP), đạt 9.300 đồng/CP. Tiếp sau đó là cổ phiếu IDJ của CTCP đầu tư IDJ Việt Nam có mức tăng 73,91% (tương ứng 3.400 đồng/CP) đạt 8.000 đồng/CP. Tiếp đến là cổ phiếu APS của CTCP chứng khoán Châu Á - Thái Bình Dương có mức tăng 66,04% (tương ứng 3.500 đồng/CP) đạt 8.800 đồng/CP. Như vậy, cả 3 cổ phiếu ""họ"" APEC đều trở thành ""ngôi sao"" tăng giá tháng này. ",04/06/2024 19:43 GMT+7,https://tuoitre.vn/doanh-thu-vai-ti-dong-nhung-mot-co-phieu-tang-gia-100-top-sieu-dat-san-chung-khoan-20240604173327179.htm,"Dòng tiền chảy vào thị trường UPCoM tốt hơn thời gian qua, đẩy giá nhiều cổ phiếu tăng tốt. Có cổ phiếu thuộc “top” đắt đỏ trên sàn chứng khoán và đã tăng giá cả 100% kể từ đầu năm đến nay."
Pacific Airlines sắp có máy bay trở lại,"Vietnam Airlines sẽ chuyển tàu sang Pacific Airlines Nguồn tin Tuổi Trẻ Online tại Vietnam Airlines, giữa Vietnam Airlines và Pacific Airlines đang thỏa thuận đến bước cuối cùng để chuyển tàu bay sang Pacific Airlines trong tháng 6-2024 nhằm tiếp tục hoạt động. Vietnam Airlines đang sở hữu Pacific Airlines, tức là công ty mẹ. Tháng 3-2024, Pacfic Airlines thỏa thuận với chủ tàu xóa nợ hơn 3.000 tỉ đồng. Hãng buộc phải trả tất cả tàu tại Việt Nam cho chủ tàu. Do đó, hơn hai tháng qua, Pacific Airlines là hãng bay duy nhất Việt Nam hoạt động nhưng không có máy bay khai thác. Cục Hàng không Việt Nam đã ra nhiều văn bản, thúc Vietnam Airlines và Pacific Airlines tiến hành phương án để tiếp tục khai thác, sớm trở lại phục vụ khách hàng.  Tuy nhiên, giữa hai hãng vẫn còn nhiều vướng mắc trong cơ chế giá thuê, phương án chuyển tàu khai thác... Cuối tháng 6-2024, theo nguồn tin Tuổi Trẻ Online, Vietnam Airlines đã thống nhất chuyển một máy bay sang Pacific Airlines để khai thác. Pacific Airlines đang xây dựng kế hoạch thuê khô (chỉ thuê máy bay, không gồm tổ lái) 3 máy bay từ Vietnam Airlines để duy trì số lượng tàu tối thiểu nhằm giữ giấy chứng nhận người khai thác tàu bay (AOC). Mở rộng phục vụ dịch vụ mặt đất cho ba hãng bay Trong quá trình tạm dừng bay, Pacific Airlines vẫn ""sáng đèn"" duy trì lực lượng lao động nhờ phục vụ mặt đất cho Bamboo Airways, Vietstar, Vasco. Từ ngày 1-6, Pacific Airlines mở rộng dịch vụ, cung cấp xe chở khách cho Công ty bay dịch vụ hàng không VASCO - đơn vị thành viên trong Vietnam Airlines Group (Vietnam Airlines, Pacific Airlines, Vasco).  Bình quân mỗi ngày VASCO khai thác khoảng 20 chuyến bay đi và đến sân bay Tân Sơn Nhất, các ngày cao điểm cuối tuần số chuyến bay tăng lên gần 30 chuyến đi và đến mỗi ngày. Theo các hãng bay, tình trạng thiếu máy bay đang diễn ra căng thẳng, tải cung ứng giảm nên giá vé máy bay sẽ khó giảm như kỳ vọng. Vietnam Airlines, Vietjet đang dừng bay trên hơn chục tàu để bảo dưỡng động cơ trên máy bay Airbus A321neo, có thể đến năm sau mới hoàn tất.  Bamboo Airways sau tái cấu trúc giảm từ 30 hiện còn 5 máy bay, Vietravel Airlines có 3 máy bay.  Cùng với đó, chi phí nhiên liệu bay vẫn neo cao, tỉ giá tăng mạnh cũng ảnh hưởng lớn hoạt động của các hãng. Để tăng thêm máy bay, cải thiện năng lực cung ứng trên thị trường nội địa theo các hãng lúc này cũng gần như bất khả thi khi cả thế giới cũng thiếu máy bay. Ông Trương Việt Cường - phó tổng giám đốc Bamboo Airways - dẫn ví dụ giai đoạn Tết, Bamboo Airways thuê ướt tàu (gồm cả phi công, tiếp viên) với giá 3.000 USD một giờ, thì hiện nay tăng đến 4.500 USD một giờ nhưng cũng không thể tìm được tàu.  Thuê ướt đã khó như vậy thì thuê khô càng không có hy vọng.",04/06/2024 19:41 GMT+7,https://tuoitre.vn/pacific-airlines-sap-co-may-bay-tro-lai-20240604175549421.htm,"Sau thương vụ xóa nợ 3.000 tỉ đồng, đóng góp vào lợi nhuận đột biến cho Vietnam Airlines trong quý 1-2024, Pacific Airlines không còn máy bay hoạt động. Hai tháng qua, hãng đã xoay xở, phục vụ mặt đất cho ba hãng bay, sắp có tàu trở lại."
"4 tháng, người Việt chi 2.000 tỉ đồng mua cá hồi, saba, cua nâu... từ Na Uy","Thông tin này được ông Asbjørn Warvik Rørtveit, giám đốc khu vực Đông Nam Á của Hội đồng Thủy sản Na Uy, cho biết tại lễ ký kết thỏa thuận hợp tác giữa Hội đồng Thủy sản Na Uy với WinCommerce diễn ra tại Hà Nội ngày 4-6. Theo ông Asbjørn, hiện Việt Nam là thị trường nhập khẩu hải sản Na Uy lớn thứ hai trong khu vực Đông Nam Á.  Trong giai đoạn 2020 - 2023, giá trị nhập khẩu của Việt Nam tăng trưởng 113%, nếu như năm 2020 Việt Nam chi khoảng 95 triệu USD để nhập khẩu thì đến năm 2023 đã tăng lên khoảng 210 triệu USD. ""Tính riêng 4 tháng đầu năm nay, Việt Nam đã chi khoảng 80 triệu USD (khoảng 2.000 tỉ đồng) để nhập khẩu khoảng 21.300 tấn hải sản từ Na Uy.  Trong bối cảnh thị trường toàn cầu sụt giảm 15% thì đây là sự tăng trưởng ấn tượng, Việt Nam nổi lên như một thị trường quan trọng đối với hải sản Na Uy"" - ông Asbjørn nói và cho biết riêng mặt hàng cá hồi tăng trưởng 44% về lượng và 103% về giá trị so với năm 2021. Ông Asbjørn cũng tiết lộ cá saba Na Uy tăng trưởng ấn tượng.  Nếu như năm 2020 Việt Nam chỉ nhập khoảng 19.000 tấn thì năm 2023 con số này đã tăng lên hơn 30.000 tấn. Nói về việc ký kết với WinCommerce, ông Asbjørn cho biết mục tiêu lớn nhất của hợp tác này là giúp cho người tiêu dùng Việt truy suất nguồn gốc, chất lượng hải sản Na Uy thông qua nhãn hiệu ""Seafood from Norway"" (Hải sản từ Na Uy). Ông Nguyễn Tiến Dũng, phó tổng giám đốc chuỗi Winmart, cho rằng Na Uy từ lâu đã nổi tiếng với chất lượng hải sản tươi ngon, dinh dưỡng hàng đầu thế giới. Đây là một trong những quốc gia xuất khẩu hải sản lớn nhất và có chuỗi giá trị phát triển tốt nhờ áp dụng những quy định và kiểm soát nghiêm ngặt trong quá trình đánh bắt và nuôi trồng tự nhiên, áp dụng các phương pháp với giá trị cốt lõi như phát triển bền vững, bảo vệ môi trường, nâng cao giá trị kinh tế và uy tín của thủy hải sản quốc gia trên toàn cầu. ""Hải sản Na Uy, đặc biệt là cá hồi và cua nâu ngày càng phổ biến và được nhiều người tiêu dùng Việt lựa chọn, cho thấy tiềm năng vô cùng mạnh mẽ của thị trường Việt Nam"" - ông Dũng nói và cho biết trong năm vừa qua, với tổng sản lượng tiêu thụ cá hồi và cua nâu lên tới hơn 1.000 tấn.  Hải sản Na Uy luôn nằm trong danh sách những mặt hàng nhập khẩu được khách hàng yêu thích. Theo ông Dũng, sự hợp tác giữa WinCommerce với Hội đồng Hải sản Na Uy là minh chứng cho cam kết của chúng tôi trong việc mang đến cho khách hàng những sản phẩm chất lượng. Ông Dũng cũng tin rằng người tiêu dùng Việt Nam xứng đáng sử dụng những sản phẩm hải sản Na Uy có chất lượng tốt nhất, đáp ứng các tiêu chuẩn quốc tế với giá cả hợp lý.",04/06/2024 19:31 GMT+7,https://tuoitre.vn/4-thang-nguoi-viet-chi-2-000-ti-dong-mua-ca-hoi-saba-cua-nau-tu-na-uy-20240604190041628.htm,"Việt Nam đang có xu hướng ăn nhiều cá hồi, saba, cua nâu, cua hoàng đế... của Na Uy và 4 tháng đầu năm nay Việt Nam đã chi khoảng 2.000 tỉ đồng để nhập khẩu hải sản từ quốc gia này."
Quảng bá bằng truyền thông quốc tế: Sản phẩm độc đáo là chưa đủ," Hậu trường những buổi ""đàm phán"" đưa thương hiệu quê hương Quảng Bình xuất hiện trên các kênh truyền thông quốc tế lớn, hay những bộ phim Hollywood bom tấn cho đến MV của ca sĩ nổi tiếng Alan Walker, đã lần đầu tiên được ông Nguyễn Châu Á - CEO Oxalis tiết lộ trong buổi trò chuyện thân tình với host Nguyễn Tiến Huy - Tổng giám đốc Pencil Group, trưởng ban nội dung CSMO Miền Nam, ở tập 7 của chương trình talkshow ""Đi cùng thương hiệu - Walk and Talk"" mùa 2. Sản phẩm độc đáo, con người chân thành Xuất thân là hướng dẫn viên du lịch quốc tế nhưng ông Nguyễn Châu Á có kinh nghiệm làm việc từ chuyên viên kiểm toán cao cấp cho PwC cho đến chuyên viên cao cấp về CSR cho Nike Việt Nam. Đến năm 2011, khi đang là Giám đốc điều hành OneStep Vietnam - Công ty chuyên về kiểm toán xã hội, phát triển bền vững ở Việt Nam và Đông Nam Á, ông đã quyết định trở về quê hương Quảng Bình để phát triển du lịch, thành lập công ty Oxalis Adventure. Và bước ngoặt cho sự thay đổi này là cơn lũ lịch sử năm 2010. Khi chứng kiến những mái nhà thấp thoáng trong làn nước lũ đục ngầu, người dân địa phương trong đó có cả ba mẹ ông phải đi tránh lũ, đã khiến ông đau đáu một suy nghĩ:  ""Tại sao ở Phong Nha có nhiều cảnh quan hùng vĩ mà người dân vẫn đói nghèo? Nhà thì lụp xụp nên mỗi lần lụt là người dân không biết đi đâu. Điều đó thôi thúc tôi tạo ra sản phẩm độc đáo, hấp dẫn du khách đến mảnh đất quê hương Quảng Bình và phần nào đó tạo công ăn việc làm cho người dân địa phương"". Với tư duy làm du lịch khác biệt, ông Nguyễn Châu Á lựa chọn mô hình du lịch mạo hiểm thông qua khám phá, cắm trại qua đêm tại hang động: ""Đó gần như là điều mà cả thế giới chưa ai làm, chứ không riêng Việt Nam"", ông khẳng định. Thế nhưng, chỉ độc đáo là chưa đủ. CEO Oxalis còn đặt ra số lượng du khách giới hạn tham gia trên mỗi tour. Điển hình là tour thám hiểm hang Sơn Đoòng chỉ nhận tối đa 1.000 khách/năm. Chiến lược tạo sự ""khan hiếm"" về nguồn cung không chỉ là bài toán kinh doanh hiệu quả mà còn góp phần phát triển bền vững, hạn chế tối đa tác động của con người đến tự nhiên. Khi đã có trong tay sản phẩm du lịch ""độc và hiếm"", Oxalis bắt đầu thực hiện chiến lược quảng bá thương hiệu ra thế giới. Bước đầu tiên là mang vẻ đẹp ẩn giấu của hang Sơn Đoòng ra ""ánh sáng"". Sự bùng nổ của hang Sơn Đòong trên truyền thông quốc tế đã trở thành bước đệm và là tư liệu để ông và Oxalis tiếp tục đàm phán với các hãng truyền thông quốc tế lớn. Cứ thế, Oxalis từng bước tiếp cận các đoàn làm phim lớn như đội ngũ sản xuất MV của Alan Walker hay gần đây nhất là dự án phim tài liệu Planet Earth III của đài BBC. Quá trình thương lượng với những ""ông lớn"" truyền thông không hề dễ dàng. Cũng như lần hợp tác cùng Legendary - đơn vị sản xuất bộ phim bom tấn ""Kong: Đảo đầu lâu"", khi quá trình khảo sát gần như hoàn tất, con đường dẫn vào địa điểm quay vào mùa lầy lụt, chặn đứng những chiếc xe container chở thiết bị, máy móc.  Ông Châu Á kể: ""Khi đó đạo diễn bảo với tôi rằng họ có thể sẽ chuyển sang Trung Quốc để quay. Lúc đó, tôi thực sự hoang mang"". Với mong muốn chân thành là Việt Nam được xuất hiện trên phim Hollywood và được thế giới biết đến. CEO Oxalis đã có những buổi thượng lượng để tìm ra giải pháp thực hiện.  ""Qua tìm hiểu, tôi biết Legendary luôn mong muốn đóng góp cho người dân địa phương ở mỗi bối cảnh họ đi qua. Vì vậy, sau đó tôi đề nghị họ chi trả phần chi phí xây dựng con đường, Như vậy, họ sẽ có được ""tiếng thơm"" về trách nhiệm với cộng đồng"", ông Châu Á nhớ lại. Và cuối cùng, ông nhận được câu trả lời là Legendary sẽ chi trả toàn bộ chi phí xây dựng con đường, đồng thời vẫn lựa chọn Tú Làn là địa điểm ghi hình.  Cũng từ đó, CEO này nhận ra rằng đôi khi tiền không phải vấn đề. Ta phải đặt mình vào cùng hệ quy chiếu với đối tác để từ đó có được chiến lược thương lượng hợp lý. Trong đó, chân thành là yếu tố quyết định sự thành - bại trong hợp tác. Đắt nhưng xứng đáng Nhìn lại chặng đường 13 năm phát triển, ông Châu Á khẳng định sự kiên trì, chân thành và nỗ lực của từng cá nhân không chỉ tạo nên thương hiệu công ty mà còn của cả vùng đất này. Trước kia, ngoài trồng lúa, người dân Phong Nha sống bằng nghề khai thác gỗ và săn bắt thú rừng cung cấp cho miền xuôi. Tâm sự về khó khăn khi sử dụng nhân lực địa phương, ông Châu Á khẳng định: ""Không dễ để một anh ""lâm tặc"" chuyển sang bưng nước, nấu cơm, phục vụ du khách. Đó là hai thế giới hoàn toàn khác"". Suốt 6 tháng đầu, CEO phải kiêm luôn công việc hướng dẫn, nấu nướng cho khách, kể cả lái xe để ""làm mẫu"" cho nhân viên. Dần dần, công ty với vỏn vẹn 3 thành viên ban đầu, tới nay đã tạo được công ăn việc làm ổn định trực tiếp cho hơn 500 lao động địa phương. 1 trong 3 tôn chỉ xuyên suốt hoạt động kinh doanh của Oxalis là có sự tham gia của người dân địa phương. Danh hiệu ""Làng du lịch tốt nhất thế giới năm 2023"" do Tổ chức du lịch thế giới (UNWTO) trao cho làng Tân Hóa là một trong lộ trình đưa cả cộng đồng địa phương cùng phát triển và hưởng lợi từ du lịch. Chỉ trong một năm chuyển mình làm du lịch, Tân Hóa đã đáp ứng hàng trăm tiêu chuẩn khắt khe của UNWTO, từ những việc nhỏ như xử lý chất thải đến việc lớn là đáp ứng đúng ý nghĩa của du lịch cộng đồng. Điểm nhấn của làng Tân Hóa là các homestay tiện nghi được trang hoàng từ những căn nhà phao chống lũ của người dân, đáp ứng tiêu chí thích ứng thời tiết, biến đổi khí hậu. Ông Châu Á khẳng định: ""Sự tham gia của cộng đồng địa phương là chiến lược kinh doanh của công ty. Chúng tôi không xem đó là công cụ để quảng bá và phục vụ mục đích bán hàng"". ""Mặc dù các tour của Oxalis có giá rất cao nhưng sau hành trình đó, du khách đều cho là xứng đáng. Vì họ hiểu đồng tiền không chỉ ‘chui’ vào túi của Oxalis mà còn của cả nhiều người dân nghèo. Ngày xưa, họ không có tiền để cho con cái đi học. Giờ đây, nhiều đứa trẻ đã lên Đại học, thậm chí quay trở lại làm việc tại Oxalis với vai trò hướng dẫn viên du lịch"", ông Châu Á cho biết. Mời bạn đọc xem tập 7 của talkshow ""Đi cùng thương hiệu: Walk&Talk"" mùa 2 ",04/06/2024 19:30 GMT+7,https://tuoitre.vn/quang-ba-bang-truyen-thong-quoc-te-san-pham-doc-dao-la-chua-du-20240604180706088.htm,"Năm 2015, lần đầu tiên vẻ đẹp kỳ vĩ và độc đáo của hang Sơn Đoòng (Quảng Bình) xuất hiện trong chương trình truyền hình nổi tiếng “Chào buổi sáng nước Mỹ” của kênh truyền hình ABC."
Hải Phòng có tân cục trưởng Cục Thuế thành phố,"Ngày 4-6, tại Cục Thuế thành phố Hải Phòng, Tổng cục Thuế tổ chức hội nghị công bố quyết định điều động, bổ nhiệm cục trưởng Cục Thuế thành phố Hải Phòng. Theo đó, Tổng cục Thuế quyết định điều động, bổ nhiệm ông Nguyễn Tiến Trường - phó cục trưởng Cục Thuế thành phố Hà Nội - giữ chức vụ cục trưởng Cục Thuế thành phố Hải Phòng. Đồng thời điều động, bổ nhiệm ông Hà Văn Trường - cục trưởng Cục Thuế thành phố Hải Phòng - giữ chức vụ cục trưởng Cục Thuế tỉnh Quảng Ninh. Tại hội nghị, ông Mai Xuân Thành - tổng cục trưởng Tổng cục Thuế - ghi nhận và đánh giá cao quá trình công tác của ông Nguyễn Tiến Trường tại Cục Thuế thành phố Hà Nội. Ông Thành mong muốn trên cương vị công tác mới, ông Trường sẽ tiếp tục trau dồi kinh nghiệm, năng lực lãnh đạo, phát huy tinh thần đoàn kết cùng tập thể lãnh đạo và công chức, viên chức Cục Thuế thành phố Hải Phòng hoàn thành xuất sắc nhiệm vụ được giao.",04/06/2024 19:28 GMT+7,https://tuoitre.vn/hai-phong-co-tan-cuc-truong-cuc-thue-thanh-pho-20240604190427766.htm,"Phó cục trưởng Cục Thuế thành phố Hà Nội Nguyễn Tiến Trường được điều động, bổ nhiệm làm cục trưởng Cục Thuế thành phố Hải Phòng."
