Title,Content,Date,Url,Summary
Phụ nữ tuổi 30 có gì hấp dẫn?,"Thực tế, không có nhóm tuổi hay giới tính nào có thể thống trị hoàn toàn thị trường nội dung truyền hình, nhưng phụ nữ độ tuổi 30 đang nổi lên là đối tượng tiêu dùng chính cho truyền hình hay nền tảng nội dung phát trực tuyến OTT.  Họ dần trở thành thước đo thành công cho truyền hình hay OTT, theo báo Hankook Ilbo. Phụ nữ tuổi 30 năng động và thích sự đa dạng Phụ nữ tuổi 30 bước vào giai đoạn trưởng thành, chín chắn sau một khoảng thời gian khá dài trải nghiệm cuộc sống. Theo thống kê ở Hàn Quốc, nhóm tuổi này đăng ký trung bình 2,5 các loại dịch vụ phát trực tuyến, cao nhất trong các nhóm tuổi, tạo thành nhóm người dùng lớn nhất của mỗi nền tảng phát trực tuyến. Mặt khác, phụ nữ ở độ tuổi 30 thích nhiều loại nội dung, từ phim truyền hình lãng mạn đến chương trình giải trí. Họ cũng được đánh giá cao nhờ thói quen xem các chương trình năng động, tích cực tìm kiếm nội dung mà họ quan tâm trên nhiều nền tảng khác nhau. Ngoài ra, họ còn giúp thu hút người xem mới bằng cách chia sẻ nội dung yêu thích lên mạng xã hội theo nhiều cách khác nhau. Thu hút sự chú ý của nhóm nữ 30 tuổi kéo theo thu hút cả người xem trẻ tuổi và lớn tuổi. Công cụ dự đoán tin cậy Nắm bắt đối tượng khán giả quan trọng này, các đơn vị OTT đã tung ra nhiều nội dung phục vụ họ. The Glory - bộ phim kể về cô gái tuổi 30 Moon Dong Eun từng bị bắt nạt học đường lên kế hoạch trả thù những người bắt nạt mình phát trên Netflix - là ví dụ điển hình cho bộ phim thu hút đông đảo khán giả nữ ở độ tuổi 30 thành công. ENA - kênh truyền hình trả tiền của Hàn Quốc - gây sự chú ý với chương trình hẹn hò I am solo, thu hút phụ nữ ở độ tuổi 30. Hai nền tảng phát nội dung trực tuyến là Wavve và Coupang Play phát hành bộ phim Weak hero class 1 và Anna cũng từng thu hút đông khán giả nữ tuổi 30. Chính sự tương tác tích cực và nhạy cảm với nội dung khiến phụ nữ tuổi 30 trở thành công cụ dự đoán tin cậy về nội dung. Kênh tvN tăng tỉ lệ phụ nữ trong độ tuổi 30 lên 70% trong nhóm đánh giá phim truyền hình của nội bộ. Điều này phản ánh trọng tâm chiến lược của kênh đối với nhóm tuổi này.",03/06/2024 11:15 GMT+7,https://tuoitre.vn/phu-nu-tuoi-30-co-gi-hap-dan-20240602180331442.htm,"Nhiệm vụ của các kênh truyền hình, nền tảng OTT của Hàn Quốc là thu hút đối tượng khán giả nữ trong độ tuổi 30. Vì sao họ lại được truyền hình chú ý trong giai đoạn này?"
BTS công bố chuỗi sự kiện Festa kỷ niệm 11 năm thành lập,"Sự kiện này dự kiến bắt đầu vào ngày 13-6 tại khu liên hợp thể thao Seoul (Seoul Sports Complex) ở thủ đô của Hàn Quốc. Festa là một dịp quan trọng trong năm của BTS, nơi nhóm nhạc đình đám này gặp gỡ và gửi lời cảm ơn tới người hâm mộ trung thành của mình. Năm nay, Festa sẽ có sự xuất hiện của thành viên Jin, đánh dấu hoạt động chính thức đầu tiên của nam ca sĩ sau khi anh hoàn thành nghĩa vụ quân sự. Theo kế hoạch, Jin sẽ giao lưu cùng 1.000 người hâm mộ may mắn tại Seoul Sports Complex. Đồng thời, anh cũng sẽ truyền đạt một thông điệp đặc biệt cho ARMY - tên gọi của cộng đồng người hâm mộ nhóm nhạc BTS. Thông điệp này sẽ được truyền trực tiếp (livestream) đến những người đăng ký membership (thẻ thành viên) trên nền tảng Weverse. Ngoài sự kiện chính với Jin, Festa năm nay cũng sẽ mang đến nhiều hoạt động và trải nghiệm thú vị cho người hâm mộ. Một trong số đó là việc phát hành một cuốn nhật ký vẽ tranh đặc biệt để ghi nhận và kỷ niệm 11 năm hoạt động của BTS. Trước đó, để kỷ niệm ngày quan trọng này, BTS đã chia sẻ những bức ảnh chưa từng được công bố, phát trực tiếp các buổi hòa nhạc đã diễn ra trước đây và đăng tải những bài viết viết tay từ mỗi thành viên của nhóm. Các thành viên còn lại của BTS đang thực hiện nghĩa vụ quân sự tại Hàn Quốc. Tuy nhiên, nhóm dự định tái hợp và tiếp tục hoạt động chung vào năm 2025.",03/06/2024 11:05 GMT+7,https://tuoitre.vn/bts-cong-bo-chuoi-su-kien-festa-ky-niem-11-nam-thanh-lap-20240603104217168.htm,"Nhóm nhạc BTS vừa công bố kế hoạch tổ chức chuỗi sự kiện Festa 2024, nhằm kỷ niệm 11 năm thành lập."
"Hãy giữ gìn sự trong sáng cho Nobita, Shizuka của manga Doraemon","Thời gian gần đây, do sự nổi tiếng của phim Doraemon: Nobita và bản giao hưởng Địa Cầu, trên nền tảng mạng xã hội TikTok, Facebook bỗng nổi lên nhiều bài viết nhạy cảm có các nhân vật trong Doraemon. Trong đó có cả nhiều video, tranh, ảnh mang nội dung 18+ xuyên tạc tác phẩm trong sáng dành cho trẻ thơ này. Nhân vật trẻ em là đối tượng của tình dục hóa Cụ thể, một số tài khoản trên TikTok và hội nhóm trên Facebook bị phản ánh là đăng tải hình ảnh cậu bé Nobita ghép đôi cùng Dekisugi hoặc Luka (một nhân vật trong phim Doraemon: Nobita và Mặt trăng phiêu lưu ký), với nhiều cách thể hiện tình cảm mang tính người lớn. Văn hóa ghép đôi các nhân vật truyện tranh, anime đã tồn tại từ lâu trong cộng đồng những người yêu thích văn hóa Nhật Bản. Tuy nhiên, nhân vật của nhóm bạn Doraemon nói chung và Nobita nói riêng chỉ mới ở lứa tuổi tiểu học (10 tuổi). Vậy nên việc chia sẻ nội dung như trên là góp phần tình dục hóa hình ảnh trẻ em trên mạng xã hội. Đáng chú ý hơn, những video, tranh ảnh 18+ của Doraemon thu hút hàng trăm nghìn lượt xem và tương tác. Dưới phần bình luận là những ngôn từ phản cảm, được viết bởi những em nhỏ mới chỉ học cấp 2, cấp 3. Các em bình luận về tình yêu, tình dục đồng tính giữa nhân vật một cách bỗ bã, tùy tiện, thậm chí đề cập đến hành động hiếp dâm. Bài đăng phản ánh tình trạng này trên Facebook cũng thu hút hàng nghìn lượt tương tác, đa số lên án việc truyền bá những hình ảnh đồi trụy của các nhân vật trong Doraemon. ""Việc tình dục hóa nhân vật trong văn hóa phẩm cho trẻ em sẽ khiến khán giả có tư tưởng lệch lạc từ nhỏ. Hình ảnh lệch lạc đó sẽ hằn sâu vào trong tiềm thức các em... Việc tiếp cận những nội dung về tình dục trên mạng xã hội với đủ thể loại, lứa tuổi người dùng dễ dàng như vậy thì mình nghĩ việc giáo dục giới tính cần được coi trọng hơn"" - chủ bài viết nhận định. Trong đó, có một người dùng cũng phản ánh rằng thuật toán gợi ý video TikTok thường vô tình hiện lên nội dung 18+ dù từ khóa chỉ là ""Doraemon"" hoặc ""Năm anh em siêu nhân"", cảnh tỉnh phụ huynh nên cẩn thận khi cho con sử dụng mạng xã hội, tránh để các em tiếp xúc nội dung liên quan đến tình dục quá sớm.",03/06/2024 09:25 GMT+7,https://tuoitre.vn/hay-giu-gin-su-trong-sang-cho-nobita-shizuka-cua-manga-doraemon-20240603072906348.htm,"Hình ảnh các nhân vật trong Doraemon, đặc biệt là Nobita, bị tình dục hóa đang xuất hiện tràn lan trên TikTok, Facebook, những người chia sẻ nội dung này vẫn còn đang ngồi trên ghế nhà trường."
The Housemaid là kiệt tác hay nhất Hàn Quốc mọi thời đại,"The Korean Times đưa tin Cơ quan Lưu trữ phim Hàn Quốc (KOFA) và 240 chuyên gia trong ngành điện ảnh đã cùng lựa chọn ra những bộ phim Hàn hay nhất mọi thời đại.  Đây là lần thứ ba cơ quan này đưa ra danh sách tổng hợp 100 phim Hàn Quốc hay nhất sau 2 lần bình chọn trước là năm 2006 và năm 2014. The Housemaid là kiệt tác hay nhất Hàn Quốc Phim hay nhất Hàn Quốc mọi thời đại thuộc về tác phẩm tâm lý kinh dị The Housemaid (1960) của đạo diễn Kim Ki Young. Ở vị trí tiếp theo là Hồi ức kẻ sát nhân (2003) và Ký sinh trùng (2019) của đạo diễn tài năng Bong Joon Ho. The Housemaid (Người hầu gái) của đạo diễn Kim Ki Young là tác phẩm được xếp vào hàng kinh điển của điện ảnh Hàn Quốc. Đây là tác phẩm yêu thích và là nguồn cảm hứng cho nhiều nhà làm phim Hàn Quốc đương đại, trong đó có đạo diễn Bong Joon Ho. Tuy phát hành năm 1960, nhưng đến năm 1997 khi được chiếu lại tại Liên hoan phim quốc tế Busan, The Housemaid mới nhận được sự chú ý của khán giả và giới phê bình phim. Bộ phim được nhận xét là một ""kho báu bỏ quên"" thời kỳ hoàng kim của điện ảnh Hàn Quốc, những năm 1960 và đầu 1970. The Housemaid kể về sự tan rã của một gia đình thượng lưu ở Hàn Quốc sau sự trả thù kinh hoàng và tàn nhẫn của một cô hầu gái. The Criterion Collection nói đây là sự ám ảnh về tình dục và những ranh giới đạo đức.  Ngoài ra, bộ phim còn là một câu chuyện đầy hấp dẫn về đấu tranh giai cấp, sự phản bội, sự hận thù cùng xoáy chung dưới một mái nhà. Nhiều trang tin quốc tế nhận định The Housemaid là một viên ngọc quý của điện ảnh Hàn Quốc với cách thể hiện đầy gợi cảm, châm biếm xã hội thượng lưu. 2 phim của Bong Joon Ho đồng hạng hai   Đồng hạng 2 trong danh sách phim hay nhất Hàn Quốc mọi thời đại là Ký sinh trùng và Hồi ức kẻ sát nhân của đạo diễn Bong Joon Ho. Hai tác phẩm của vị đạo diễn tài năng này đều gây được nhiều tiếng vang trong nước và quốc tế. Đặc biệt, Parasite (Ký sinh trùng) còn làm nên lịch sử cho điện ảnh Hàn Quốc khi trở thành bộ phim châu Á đầu tiên được tượng vàng Phim hay nhất, điều chưa hề có tiền lệ tại Oscar. Theo The Korean Times, danh sách 100 phim Hàn Quốc hay nhất năm nay có đến 9 bộ phim của đạo diễn nữ, khác biệt hoàn toàn với năm 2014. Đây là dấu hiệu cho thấy sự thay đổi nhận thức trong xã hội Hàn Quốc về phim do phụ nữ đạo diễn. Quá trình lựa chọn danh sách phim Hàn Quốc hay nhất dựa trên ý kiến của 69 nhà làm phim (gồm đạo diễn, quay phim, nhà sản xuất) và 171 người xem (gồm các nhà phê bình, chuyên gia...).  Được chọn từ tất cả các phim Hàn Quốc, từ bộ phim lâu đời nhất còn tồn tại là Crossroads of Youth (1934), cho đến những bộ phim được sản xuất vào năm 2022.",03/06/2024 07:18 GMT+7,https://tuoitre.vn/the-housemaid-la-kiet-tac-hay-nhat-han-quoc-moi-thoi-dai-20240602184414687.htm,Bộ phim tâm lý kinh dị The Housemaid (1960) của đạo diễn Kim Ki Young được vinh danh là phim hay nhất của Hàn Quốc. Theo sau đó là Hồi ức kẻ sát nhân và Ký sinh trùng.
Doraemon vượt Conan thành anime ăn khách nhất Việt Nam,"Diễn biến này nối tiếp việc Doraemon và Conan liên tục thay nhau lập kỷ lục anime ăn khách nhất ở Việt Nam. Cụ thể, tính đến những ngày gần đây, anime ăn khách nhất vẫn là Conan: Tàu ngầm sắt màu đen (2023) với 96 tỉ đồng. Nhưng sau dịp cuối tuần vừa qua, Doraemon: Nobita và bản giao hưởng Địa Cầu đã vươn lên trên 100 tỉ đồng, phá kỷ lục. Sai số lớn đến 15% vì quá nhiều vé giảm giá Con số doanh thu của Doraemon: Nobita và bản giao hưởng Địa Cầu hiển thị trên Box Office Vietnam sáng 3-6 là 108 tỉ đồng. Đại diện trang web cho Tuổi Trẻ Online biết đây là con số đã điều chỉnh, sau góp ý của nhà rạp vì sai số trước đó lên đến 15%. Cuối tuần qua, có thông tin cho rằng Doraemon: Nobita và bản giao hưởng Địa Cầu đã vượt 100 tỉ đồng do con số hiển thị trên Box Office Vietnam vào sáng sớm ngày 2-6. Nhưng khi Tuổi Trẻ Online liên hệ, ông Nguyễn Khánh Dương - đại diện Box Office Vietnam - cho biết con số này quá cao so với thực tế và trang web đang điều chỉnh theo góp ý của các nhà rạp để sát thực hơn. Nếu với các phim khác, Box Office Vietnam thường sai số từ 5% đến 10% thì riêng Doraemon: Nobita và bản giao hưởng Địa Cầu là 15%. ""Vì tuần vừa rồi trùng với tổng kết cuối năm học, số lượng vé tập thể, vé giảm giá học sinh của Doraemon rất nhiều, dẫn tới giá vé trung bình của Doraemon giảm, khiến doanh thu của đơn vị phát hành chắc chắn không nhiều như chúng tôi hiển thị. Chính sách giảm giá vé cho học sinh sinh viên của tất cả các cụm rạp đều không thể mua online, chỉ có thể áp dụng khi đến trực tiếp tại rạp do cần xác nhận độ tuổi trực tiếp. Do đó, Box Office Vietnam không đo được số liệu giảm giá này"" - ông Khánh Dương lý giải. Ở thời điểm có thông tin ""Doraemon đạt 100 tỉ đồng"" (ngày 2-6), ông Khánh Dương ước tính doanh thu thực mới đạt 90 tỉ đồng nếu như trừ 5% VAT và các khoản chiết khấu, giảm giá cho học sinh sinh viên. Đến hiện tại (sáng 3-6), sau khi Box Office Vietnam điều chỉnh số liệu, có thể khẳng định Doraemon đã vượt 100 tỉ đồng và phá kỷ lục của Conan: Tàu ngầm sắt màu đen. Doraemon - thương hiệu bất bại ở Việt Nam Doraemon: Nobita và bản giao hưởng Địa Cầu không phải một phần phim xuất sắc của loạt phim chiếu rạp đã lên đến 43 phần của thương hiệu Doraemon. Nhưng phim may mắn ra rạp vào giai đoạn khán giả Việt Nam có thói quen xem phim tại rạp, chiếu vào dịp nghỉ hè để phục vụ nhóm khán giả mục tiêu đông đảo: học sinh, gia đình, người lớn hoài niệm tuổi thơ... Kể từ lần đầu được dịch ở Việt Nam vào năm 1992, đến nay đã 32 năm, Doraemon vẫn là ""thương hiệu bất bại ở Việt Nam"" và được yêu thích qua nhiều thế hệ. Cách đây ít năm, một số khán giả trung thành của bộ truyện tranh gốc từng lo ngại trẻ em thế hệ mới sẽ không đọc truyện tranh Doraemon nữa. Thế nhưng thương hiệu này vẫn có cách đến với khán giả thế hệ mới thông qua anime, cả xem trực tuyến lẫn xem rạp. Khi Doraemon đang gây sốt tại rạp, nhiều khán giả chia sẻ đây vẫn là ""loạt phim ăn cơm"" của họ thông qua hình thức xem trực tuyến.",03/06/2024 08:19 GMT+7,https://tuoitre.vn/doraemon-vuot-conan-thanh-anime-an-khach-nhat-viet-nam-20240603063354805.htm,"Sáng 3-6, Doraemon vượt Conan trở thành anime ăn khách nhất phòng vé Việt. Nhưng số liệu trên Box Office Vietnam từng quá cao so với thực tế, khiến nhà rạp đề nghị điều chỉnh."
Ngân Quỳnh: Trùm vai mẹ trên màn ảnh nhỏ,"Ngân Quỳnh đang ""làm mẹ"" trong ba phim Dâu hào môn, Tình yêu bất tử, Trăm năm hạnh phúc được không? Ngân Quỳnh nhìn hiền vào vai ác được không? Dâu hào môn đang nhận ý kiến khen chê trái chiều.  Trong đó, nhân vật bà Xuân - mẹ chồng nữ chính - nổi lên như một người đàn bà quyền lực, mê tín dị đoan, tính cách đẩy lên hơi phóng đại gây bức xúc vì ác quá.  Khán giả bảo khá bất ngờ vì Ngân Quỳnh thay đổi hình ảnh và hỏi rằng mặt chị hiền thế, liệu vào vai ác được không? Ngân Quỳnh thừa nhận khi đóng vai ác chị cảm thấy rất mệt vì mỗi cái ác cần thể hiện khác nhau. ""Trong Dâu hào môn là mẹ chồng độc đoán, mê tín. Trong Tình yêu bất tử (đang phát sóng trên THVL1) là người mẹ sắc sảo, vì người chồng mưu mô chiếm đoạt gia tài nên bà luôn nghi kỵ, luôn sẵn sàng xù lông, đối phó.  Còn người mẹ trong Trăm năm hạnh phúc được không? (HTV7) dễ bắt gặp trong cuộc sống hiện nay khi luôn lo lắng một cách thái quá cho các con, nóng nảy, không giữ được bình tĩnh.  Nhân vật này cũng vui lắm"", Ngân Quỳnh nói về các vai diễn. Hỏi Ngân Quỳnh thích vai mẹ trong phim nào nhất, chị bảo vai nào cũng quý nhưng Mẹ trùm khiến chị nhớ nhất bởi số phận lạ.  Vai diễn này giúp Ngân Quỳnh đoạt giải nữ diễn viên xuất sắc tại Liên hoan truyền hình toàn quốc lần thứ 41. Mẹ ngoài đời khó khăn và thích thú nhất ""Nhưng với tôi, làm mẹ ngoài đời là vai diễn khó khăn và thích thú nhất, đặc biệt người mẹ ấy lại là nghệ sĩ"", chị bộc bạch. Ngân Quỳnh kể cuộc đời chị trải qua nhiều giai đoạn khó khăn. Khi lập gia đình, chị quyết định về Huế sống trọn vai trò làm mẹ, làm vợ.  Sau một thời gian vợ chồng chị lại khăn gói lên thành phố, bám trụ nghề kiếm sống. Tối tối, vợ chồng chị đèo nhau trên xe máy đến các điểm hát, xong lại đèo nhau về.  ""Tôi nhớ có những buổi diễn kết thúc lúc 1, 2h sáng, đường vắng, chúng tôi còn gặp cả cướp nữa, may mà chồng tôi rồ ga xe chạy thật nhanh thoát được"". Rồi mối duyên đóng phim truyền hình đến với chị ngày một nhiều. Ngân Quỳnh chuyển hướng làm diễn viên. Với vai trò làm mẹ, chị bảo dù con không trách gì nhưng chị thấy mình không làm tròn bổn phận bởi cứ mãi chạy theo những vai diễn, những buổi đi hát nên không gần gũi, không cho con nhiều giây phút sum họp gia đình. ""Năm cháu học lớp 12, chúng tôi muốn cho cháu đi du học, thế là vợ chồng cày ngày cày đêm. Giờ con ra trường và đi làm rồi nên tôi nhẹ gánh chút"", chị kể. Giờ chị đã sắm được ô tô làm phương tiện đi lại. ""Tuổi này mà tôi vẫn còn đi làm được là hạnh phúc lắm rồi. Vì vậy, tôi luôn cố gắng chăm chỉ, nghiêm túc. Có lẽ vì vậy mà tổ nghề vẫn còn thương, đạo diễn và nhà sản xuất phim vẫn thương và vẫn mời tôi vô phim nữa"", Ngân Quỳnh cười nói. ",02/06/2024 13:18 GMT+7,https://tuoitre.vn/ngan-quynh-trum-vai-me-tren-man-anh-nho-20240602094544004.htm,"Diễn viên Ngân Quỳnh trở thành bà trùm đóng vai mẹ trên màn ảnh nhỏ, khi tham gia rất nhiều vai diễn dạng này."
"Hát dở: Đừng gọi là nhóm nhạc, hãy gọi là nhóm chị đẹp, nhóm anh tài hợp hơn","Khi người ta vẫn chưa hết bình luận về giọng hát khiến người khác có thể ""tắt điện"" của Lan Ngọc, Huyền Baby, Diệp Lâm Anh và Khổng Tú Quỳnh thì VibeQueens - nhóm nhạc của hai ""chị đẹp"" khác là Lưu Hương Giang và Phương Vy - tung sản phẩm đầu tiên là Chị em mình trên tivi vào chiều 1-6. Các nhóm nhạc toàn hoa hậu, diễn viên Dù không phải là nhóm nhạc thành đoàn nhưng thành viên LUNAS và VibeQueens đều bước ra từ game show Chị đẹp đạp gió rẽ sóng. VibeQueens hoạt động độc lập. Và so với LUNAS với 4/5 thành viên hát dở thì VibeQueens ổn hơn bởi Lưu Hương Giang và Phương Vy đều là ca sĩ thứ thiệt.  Tới đây có hai game show dành cho các anh là Anh trai vượt ngàn chông gai và Anh trai say hi. Nhiều người dự đoán, sau đó, sẽ có thêm ít nhất một nhóm nhạc nam dạng LUNAS ra đời. Không chỉ chị đẹp, anh trai, có lẽ ca hát là giấc mơ ""quốc dân"" nên người mẫu, hoa hậu, diễn viên cũng mong cầm micro hát và được gọi là ca sĩ. Giờ đây, công chúng có lẽ sẽ phải quen dần với việc ngày càng nhiều các nhóm nhạc toàn hoa hậu, người đẹp, diễn viên. Có thể kể ra nhóm Slaydies gồm toàn hoa hậu, thông báo sẽ ra mắt trong năm nay. Đơn vị chủ quản của nhóm này mới ""đánh tiếng"", hiện tại vẫn chưa có sản phẩm âm nhạc nào để thực chứng. Mô hình nhóm nhạc đa dạng hơn nhiều Nếu so sánh với các ban nhạc/nhóm nhạc truyền thống (gồm những nghệ sĩ ít nhiều hiểu nhạc, âm nhạc là yếu tố quan trọng nhất, hoạt động trong một thời gian tương đối) thì mô hình ban/nhóm nhạc ngày nay đa dạng hơn nhiều. Bên cạnh những nhóm nhạc chơi nhạc, cũng sẽ có cả những nhóm nhạc nhưng không hẳn chơi nhạc. Cũng sẽ có những nhóm nhạc khiến khán giả vừa nghe/xem vừa hoang mang. Không bàn tới những nhóm nhạc nghiêm túc, giờ đây sẽ có những nhóm nhạc mà các thành viên đến với âm nhạc không phải vì âm nhạc mà bởi nhiều mục đích khác nhau. Họ hiểu nhóm nhạc chỉ là một dự án ngắn hạn như bao nhiêu dự án khác trong sự nghiệp. Nó ra đời nhằm tận dụng sức nóng của một game show hay chương trình nào đó. Và có khi họ tham gia nhóm nhạc chỉ nhằm làm hình ảnh mà thôi. Theo dõi những tranh cãi liên quan đến LUNAS, đặc biệt là giọng hát của Ninh Dương Lan Ngọc trên một số diễn đàn mạng những ngày qua, có thể thấy những bàn luận sẽ không có hồi kết. Ở đây, điểm nhìn của công chúng khá quan trọng. Nếu xem họ là nhóm nhạc thì âm nhạc phải là yếu tố tiên quyết, khán giả sẽ bất bình vì âm nhạc không được tôn trọng.  Còn nếu nhìn họ như bao nhóm nhạc thần tượng, nhóm nhạc ""giải trí"" thì thôi, chỉ nên tận hưởng sự ""giải trí"" mà họ mang đến, cũng phong phú, nhiều màu sắc và có thêm những giá trị mới. Dẫu vậy khi định danh là ""nhóm nhạc"" thì có lẽ những nghệ sĩ cũng nên có sự đầu tư cho âm nhạc. Còn không đừng gọi là ""nhóm nhạc"" mà hãy gọi là ""nhóm chị đẹp"", ""nhóm anh tài"". Đại loại thế! Có phải vừa lòng thiên hạ không?",02/06/2024 11:57 GMT+7,https://tuoitre.vn/hat-do-dung-goi-la-nhom-nhac-hay-goi-la-nhom-chi-dep-nhom-anh-tai-hop-hon-20240602093946747.htm,"2,5 triệu view sau 11 ngày ra mắt MV Moonlight của LUNAS là một số liệu ấn tượng cho sự chào sân của nhóm nhạc toàn chị đẹp, gồm: Trang Pháp, Ninh Dương Lan Ngọc, Diệp Lâm Anh, Huyền Baby, Khổng Tú Quỳnh."
