Title,Content,Date,Url,Summary
Phim Hollywood sẽ phủ sóng Liên hoan phim Venice năm nay?,"Theo nguồn tin từ Variety, Liên hoan phim Venice 2024 sẽ có sự góp mặt nhiều tên tuổi lớn của kinh đô điện ảnh Hollywood như: Lady Gaga, Joaquin Phoenix, Angelina Jolie, Daniel Craig, Johnny Depp, George Clooney, Brad Pitt, Gal Gadot hay Ana de Armas. Nhiều tác phẩm nặng ký từ Hollywood  Lady Gaga và Joaquin Phoenix sẽ đóng cặp trong Joker 2: Folie à Deux (tạm dịch: Joker 2: Điên có đôi), phần tiếp theo của phim về nguồn gốc ác nhân Joker từng đoạt giải Sư Tử Vàng năm 2019. Một phim cũng đang nhận nhiều sự chú ý là Maria, kể về câu chuyện cuộc đời Maria Callas - người được mệnh danh là diva đầu tiên trong lịch sử. Người thủ vai danh ca huyền thoại là Angelina Jolie, cô trở lại một vai diễn hàn lâm sau nhiều năm đóng những bộ phim thương mại bom tấn như Eternals, Maleficent,... Hai phim trên được đánh giá là nặng ký bậc nhất trong Liên hoan phim Venice năm nay khi Pablo Larraín (đạo diễn Maria), Todd Phillips (Joker 2) đều là những cái tên từng gây tiếng vang tại Venice và các giải thưởng hàn lâm lớn. Johnny Depp trở lại ghế đạo diễn Ngoài ra Venice còn chào đón sự trở lại của Johnny Depp trong vai trò đạo diễn với Modi, lấy cảm hứng từ cuộc đời danh họa người Ý Amedeo Modigliani (Riccardo Scamarcio thủ vai), diễn viên gạo cội Al Pacino cũng góp mặt. Chàng điệp viên 007 Daniel Craig cũng tái xuất trong phim Queer chuyển thể từ tiểu thuyết cùng tên của William S. Burroughs. Queer kể câu chuyện tình yêu đồng tính về một người Mỹ đang chiến đấu với cơn nghiện ma túy tại Mexico đem lòng say mê một người lính hải quân. Một phim đáng chú ý khác là In the Hand of Dante do Julian Schnabel đạo diễn (ông từng làm At Eternity’s Gate). Nội dung của phim xoay quanh hành trình bản thảo viết tay bài thơ The Divine Comedy (Thần khúc - Dante Alighieri) vô tình thất lạc từ thư viện Tòa thánh Vatican và rơi vào tay một ông trùm băng đảng. Đây là một phim toàn sao khi có sự góp mặt của dàn diễn viên đình đám Oscar Isaac, Jason Momoa, Gerard Butler, Al Pacino. Đặc biệt, đạo diễn Martin Scorsese cũng sẽ sắm một vai trong In the Hand of Dante. Ở hạng mục không tranh giải, có hai phim cũng khá đáng chú ý là Wolfs do ông lớn Apple TV đầu tư, đánh dấu sự tái hợp của hai cái tên đình đám Brad Pitt và George Clooney cùng phim Eden gồm toàn sao nữ hàng đầu thế hệ Hollywood mới như Ana de Armas, Sydney Sweeney và Jude Law.",02/06/2024 11:53 GMT+7,https://tuoitre.vn/phim-hollywood-se-phu-song-lien-hoan-phim-venice-nam-nay-20240602103852228.htm,"Liên hoan phim Venice năm nay là cuộc tranh tài của nhiều sao hàng đầu Hollywood như Johnny Depp, Brad Pitt, Angelina Jolie, Joaquin Phoenix..."
"Erik bán 'bắp luộc đê', Obito hát dưới mưa sôi động đêm nhạc hè Forest Playground","Đêm nhạc Forest Playground 2024 diễn ra tối 1-6, ở công biên bờ sông Sài Gòn (Thủ Đức), có sự tham gia biểu diễn của Erik, Rhyder, Obito, Winno và Sean. Nhiều bản hit và cả ca khúc mới chưa phát hành được các ca sĩ trình diễn, tặng khán giả. Có thời điểm trời mưa nhưng khán giả vẫn che dù xem, cổ vũ nhiệt tình, khiến nghệ sĩ ấm lòng. Obito giữ chân khán giả dù trời mưa Thời điểm Obito trình diễn trời mưa lất phất nhưng khán giả vẫn đứng yên, che dù cổ vũ nhiệt tình cho anh. Obito hát Hà Nội một mình trên sân khấu Forest Playground mà thiếu Vstra khiến khán giả tiếc nuối. Bởi Vstra và Obito là đồng tác giả ca khúc Hà Nội mang đến một góc nhìn mới lạ về thủ đô. Cả hai đều là những rapper trẻ, thể hiện thành công Hà Nội, đưa cả hai đến gần với khán giả. Hát ca khúc tình yêu giữa trời mưa nhưng Obito không cảm thấy cô đơn vì khán giả đội mưa nghe anh hát. Sau đó, Obito khiến khán giả thay đổi cảm xúc cùng bản hit Buồn hay vui với phần góp giọng của Vsoul và Hustlang. Sau phần trình diễn của Obito mưa dần tạnh. Erik bán ""bắp luộc đê"" cùng khán giả Có lẽ phần khán giả mong chờ nhất là sự xuất hiện và biểu diễn của Erik. Anh không làm khán giả thất vọng khi xuất hiện cùng dàn vũ công, khoe vũ đạo ấn tượng. Bản hit Em không sai chúng ta sai vang lên trong sự hò reo, cổ vũ và hát theo của hàng ngàn khán giả, tạo nên hiệu ứng khó quên trong khán giả và cả Erik. Nhiều khán giả cho rằng Erik dần lấy lại phong độ như ban đầu sau một thời gian tạo nên nhiều tranh cãi trong cách xử lý bài hát. Đến với đêm nhạc, anh còn hát Chạy về khóc với anh. Erik cũng không ngần ngại chạy về phía khán giả giao lưu và đưa micro cho khán giả hô to ""bắp luộc đê"". Rhyder cũng khiến sân khấu sôi động bởi ca khúc Sao băng. Đây là một ca khúc mới toanh, lần đầu Rhyder trình diễn trước khán giả. Sao băng là một trong những ca khúc nằm trong album mới được Rhyder phát hành trong thời gian tới. Không những vậy, Rhyder còn khiến khán giả phải nhún nhảy theo qua bản hit Chịu cách mình nói thua, Anh quen với cô đơn… Sean - một ca sĩ Gen Z - chinh phục khán giả với màu sắc riêng qua ca khúc Yêu là đây cùng bản hit gắn liền tên tuổi là Em thích. Còn Winno sở hữu chất giọng khàn đặc trưng, anh mang đến hàng loạt bản hit như: Say đắm trong lần đầu, Tell Ur Mom 2, Giọt nước mắt, Muốn anh đau… Khán giả ấn tượng bởi cách sử dụng flow, lyrics cuốn hút của Winno.",02/06/2024 08:25 GMT+7,https://tuoitre.vn/erik-ban-bap-luoc-de-obito-hat-duoi-mua-soi-dong-dem-nhac-he-forest-playground-20240602070350381.htm,"Gần 4.000 khán giả tham dự, cổ vũ cho các nghệ sĩ trong đêm nhạc đầu tiên nằm trong khuôn khổ Lễ hội mùa hè 2024 diễn ra tại TP.HCM."
Tin tức giải trí 2-6: Xác minh các phát ngôn về tôn giáo của Angela Phương Trinh,"Xác minh những phát ngôn về tôn giáo của Angela Phương Trinh Liên quan những phát ngôn gây tranh cãi về tôn giáo trên tài khoản Angela Phương Trinh (có tích xanh xác nhận chính chủ), đại diện Sở Văn hóa và Thể thao TP.HCM cho biết đã nắm vụ việc. ""Sở Văn hóa và Thể thao sẽ trao đổi với Sở Thông tin và Truyền thông thêm về trường hợp này trên góc độ chuyên môn văn hóa"" - đại diện Sở Văn hóa và Thể thao nói với Tuổi Trẻ Online. Sở Thông tin và Truyền thông cho biết cũng sẽ xác minh vụ việc. Trước đó Angela Phương Trinh liên tục đăng những thông tin gây tranh cãi trên Facebook liên quan ông Thích Minh Tuệ, nhằm hạ thấp uy tín của một số cá nhân, tổ chức.  Cô cho rằng những quan điểm trái ngược với mình là ""truyền thông bẩn"", còn những người có quan điểm trái ngược là ""giặc"". Hiện bài viết đăng gần nhất trên Facebook Angela Phương Trinh vào trưa 2-6, có những ngôn từ nặng nề. Các bài viết của Angela Phương Trinh đã giới hạn người bình luận. Trước đó, Angela Phương Trinh từng đăng các thông tin sai lệch, phản khoa học là nuốt giun đất sống sẽ chữa khỏi COVID-19 và bị phạt 7,5 triệu đồng. Hà Anh Tuấn làm MV 'Hoa hồng' bằng hình ảnh từ AI Ca sĩ Hà Anh Tuấn vừa ra mắt video âm nhạc ở định dạng music visualizer mang tên Hoa hồng. MV còn có sự kết hợp hình ảnh từ AI và tranh vẽ của trẻ em có hoàn cảnh đặc biệt. Xuyên suốt MV, hình ảnh chân dung của Hà Anh Tuấn và những khoảnh khắc anh thư giãn giữa vườn hồng, hòa vào thiên nhiên là sự sáng tạo của trí tuệ nhân tạo. Nghệ sĩ thị giác Cao Hoàng Long và CABE Studio đã kết hợp với hình ảnh 3D từ AI, lấy cảm hứng từ phong cách hội họa siêu thực của danh họa René Magritte để tạo ra sản phẩm âm nhạc mới nhất của Hà Anh Tuấn. Khởi nguồn từ tựa đề vở kịch Tin ở hoa hồng của tác giả Lưu Quang Vũ, ca khúc Hoa hồng mang âm hưởng tích cực, gửi gắm lời động viên những trái tim đang lạc lối, yếu lòng.  Phan Mạnh Quỳnh là tác giả của ca khúc này. Anh cũng là một trong ba nghệ sĩ khách mời tại concert Sketch a rose chặng Singapore của Hà Anh Tuấn, bên cạnh Vũ và Trần Duy Khang vào 29-9. Nhân viên bảo vệ của Liên hoan phim Cannes bị kiện Người mẫu Sawa Pontyjska vừa đệ đơn khiếu nại pháp lý Liên hoan phim Cannes về việc một nữ nhân viên bảo vệ sử dụng ""vũ lực vô lý"" trên thảm đỏ với cô.  Trả lời BBC, Sawa Pontyjska cho biết cô bị nhân viên bảo vệ “tấn công” khi đi thảm đỏ.  Nữ bảo vệ được nhắc tới cũng gây tranh cãi vì có tương tác hung hãn, phân biệt chủng tộc với các ngôi sao trên thảm đỏ như: ca sĩ Kelly Rowland, hoa hậu Cộng hòa Dominica 2007 Massiel Taveras hay Yoona (SNSD)… Theo video ghi lại, người bảo vệ này ôm Sawa Pontyjska kéo ra khỏi thảm đỏ, mặc cho cô phản kháng. Sau đó nhiều nhân viên nam bước đến và đưa cô đi bằng cửa khác.  Pontyjska cho rằng cô không làm gì sai đến mức bị ""đuổi"" đi một cách thô bạo. Cô đã chia sẻ tài liệu cáo buộc người nhân viên này ""tấn công thể xác và gây tổn hại tâm lý"" cho cô và đòi bồi thường thiệt hại 163.000 USD. CEO ẩm thực Việt bảo phở ở nhà hàng Chi Pu mặn Ông Nguyễn Trung Dũng, CEO Dh Foods, có chuyến đi Thượng Hải vào tuần trước và đã ghé đến nhà hàng La Ganh của Chi Pu ăn phở.  Sau đó, ông Dũng đăng tải một bài viết nhận xét về những trải nghiệm ẩm thực của mình tại đây. Đáng chú ý, ông đã chỉ ra một số hạn chế.  Ông viết: ""Phở quá mặn (theo ý kiến của cá nhân mình, bạn trẻ đứng bếp kiểu dạng nhân viên quán ăn nhanh, không phải đầu bếp chuyên nghiệp và không phải người Việt nên không biết nước phở phải có vị thế nào).  Cả team phải thêm... nước suối vào bát phở thì mới tạm ăn được. Nước phở... không có mùi gia vị phở và không có vị ninh xương..."". Cũng theo ông, nếu các chuỗi phở Việt khác tham gia thị trường Trung Quốc, nhà hàng La Ganh sẽ khó cạnh tranh.  ""Tôi nghĩ nên có đầu bếp Việt biết nấu ăn, ít nhất là ban đầu, sau có thể đào tạo người bản xứ và có thể phát triển thêm một số món như phở xào, bánh mì và gỏi cuốn"", ông Dũng viết.  Ông Dũng cũng cho biết quán chỉ có một ít khách, trong khi các quán Trung Quốc xung quanh rất đông. Chi Pu bắt đầu kinh doanh ở Trung Quốc sau thành công tại chương trình Đạp gió năm 2023. Người đẹp mở chi nhánh phở La Ganh đầu tiên ở đường Diên Bình, quận Tĩnh An. Soyeon (G)I-DLE tạm dừng hoạt động  Cube Entertainment vừa phát đi thông báo thành viên Soyeon, trưởng nhóm của (G)I-DLE, sẽ tạm dừng hoạt động quảng bá do tình trạng sức khỏe kém.  Cụ thể, Cube Entertainment đã viết trên các trang mạng xã hội của công ty:  ""Chúng tôi xin phép thông báo về sự vắng mặt của thành viên (G)I-DLE Soyeon trong lịch trình sắp tới. Gần đây, Soyeon gặp tình trạng sức khỏe suy giảm và phải nhập viện.  Cô ấy được khuyên nên nghỉ ngơi đầy đủ để hỗ trợ quá trình phục hồi của mình.  Do đó, Soyeon sẽ không thể tham dự sự kiện ký tặng fan offline của YIZHIYU & (G)I-DLE dự kiến diễn ra vào ngày 1-6.  Công ty đã quyết định để Soyeon tạm dừng mọi hoạt động trong thời gian này để cô ấy có thể tập trung vào việc nghỉ ngơi và bình phục"". Trước thông tin Soyeon sẽ tạm dừng hoạt động nghệ thuật một thời gian, nhiều khán giả đã tỏ ra bối rối: ""Tôi không thể tưởng tượng việc (G)I-DLE biểu diễn mà không có Soyeon"";  ""Soyeon đảm nhận nhiều vị trí và là trưởng nhóm của (G)I-DLE, sẽ ra sao nếu họ thiếu đi cô ấy""; ""Tôi rất mong chờ sự xuất hiện của (G)I-DLE với đội hình bốn thành viên""... Hương Tràm tung teaser cho ca khúc tự sáng tác Ca sĩ Hương Tràm vừa tung teaser của MV Sweet home. Đây là ca khúc do cô tự sáng tác trong thời gian ở Mỹ. Ở teaser vừa hé lộ, Hương Tràm xuất hiện trong bộ váy trắng dịu dàng, ôm guitar và nghêu ngao hát trên cung trăng: ""Home, sweet home, nơi đâu em có anh là nhà"". Khi được hỏi về người đàn ông tạo cảm hứng cho mình khi viết nên câu hát này, Hương Tràm cho biết:  ""Những người đang yêu khi nghe câu hát nói riêng và bài hát nói chung có thể nghĩ rằng đó là tình yêu nam nữ nhưng thực ra trái tim yêu của tôi rộng lớn hơn.  Thực sự lời ca đó chất chứa tình cảm gia đình, suy nghĩ đến nơi tôi luôn luôn hướng về. Căn nhà tôi nghĩ tới khi viết ca khúc đó chính là nơi có gia đình, bố mẹ và khán giả"". Nữ ca sĩ từng biểu diễn ca khúc này trong minishow Em gái mưa ở Hà Nội cuối tháng 5. Hương Tràm cho biết cô viết Sweet home trước khi về Việt Nam, có sự đồng hành của nhạc sĩ Dương Khắc Linh. ",02/06/2024 16:32 GMT+7,https://tuoitre.vn/tin-tuc-giai-tri-2-6-xac-minh-cac-phat-ngon-ve-ton-giao-cua-angela-phuong-trinh-20240602152220158.htm,Một số tin tức đáng chú ý: Xác minh những phát ngôn gây tranh cãi về tôn giáo của Angela Phương Trinh; Hà Anh Tuấn làm MV 'Hoa hồng' bằng hình ảnh từ AI; Soyeon (G)I-DLE tạm dừng hoạt động...
"Dù bị chê, hoa hậu H'Hen Niê vẫn tiếp tục hát","Sau MV chủ đề chiến dịch Ngừng ăn thịt thú rừng - Góp thiện cho đời, H'Hen Niê tiếp tục phát hành MV Nụ cười Việt Nam dù trước đó cô nhận nhiều ý kiến chê giọng hát. H'Hen Niê khẳng định mình không phải ca sĩ H'Hen Niê cho biết MV Nụ cười Việt Nam không phải là sản phẩm debut của cô. MV là món quà âm nhạc mang thông điệp ý nghĩa hướng đến cộng đồng mà cô và ê kíp dành tặng khán giả. Lần này H'Hen Niê đảm nhận vai trò người kết nối, gửi thông điệp ý nghĩa qua âm nhạc, để chạm đến cảm xúc của mỗi người. H'Hen Niê giải thích với Tuổi Trẻ Online: ""Hen biết giọng hát của mình chưa hay nhưng Hen nghĩ rằng âm nhạc cũng là một cách để kết nối với khán giả và mang những giá trị tích cực cho xã hội. Hen muốn thông qua âm nhạc để truyền tải những thông điệp nhân văn. Và Nụ cười Việt Nam là một ca khúc cho Hen nhiều cảm xúc, với hy vọng gửi đến cho khán giả và bạn bè quốc tế thông điệp bình dị về niềm hạnh phúc giản đơn có thể trao nhau, đó là Nụ cười Việt Nam"". H'Hen Niê cho biết thêm đây là món quà âm nhạc thể hiện sự biết ơn đối với các anh hùng liệt sĩ, thế hệ cha ông đã cho chúng ta cuộc sống yên bình và nụ cười hạnh phúc. Trước đó giọng hát của H'Hen Niê bị chê nhưng cô đều vui vẻ đón nhận và cho rằng rất cần những ý kiến đóng góp của khán giả để cô hoàn thiện hơn. ""Hen không phải là ca sĩ, Hen hát bằng cảm xúc và đó cũng là cách để Hen nói lên những thông điệp cộng đồng mà mình đang theo đuổi. Hen vẫn luyện thanh kể từ sau chương trình Chị đẹp đạp gió rẽ sóng. Tuy nhiên cường độ không nhiều bằng khi tham gia chương trình nhưng Hen vẫn sắp xếp để luyện thanh và vũ đạo"" - H'hen Niê chia sẻ. Truyền năng lượng tích cực qua nụ cười Ca khúc Nụ cười Việt Nam do nhạc sĩ Trương Quý Hải sáng tác. H'Hen Niê quyết định quay MV ca khúc này vì muốn thông qua âm nhạc sẽ truyền tải những thông điệp ý nghĩa nhanh chóng hơn và tiếp cận được nhiều người hơn. MV Nụ cười Việt Nam quay hình ba ngày tại tỉnh Điện Biên.  Có lúc cô mặc trang phục dân tộc Thái hát ở cao nguyên đá Tủa Chùa, có lúc cô đeo chiếc gùi đi qua những địa điểm nổi tiếng của Điện Biên: cầu treo Pa Phông, Bảo tàng Chiến thắng Điện Biên Phủ… Ngoài ra, trong MV còn có những phân cảnh H'Hen Niê hát cùng người dân địa phương, các em học sinh… tất cả thể hiện sự kết nối và đặc biệt là hình ảnh nụ cười hạnh phúc của nhiều người.",02/06/2024 11:26 GMT+7,https://tuoitre.vn/du-bi-che-hoa-hau-h-hen-nie-van-tiep-tuc-hat-20240602102700118.htm,H'Hen Niê nói với Tuổi Trẻ Online cô biết giọng hát của mình chưa hay nhưng muốn dùng âm nhạc để trò chuyện với khán giả và gửi những giá trị tích cực đến cộng đồng.
Thời của nhạc ngắn 2 phút,"I Had Some Help của Post Malone và Morgan Wallen dài 2 phút 58 giây. Million Dollar Baby của Tommy Richman dài 2 phút 35 giây. A Bar Song (Tipsy) của Shaboozey là 2 phút 53 giây. Cuối cùng là Lunch của Billie Eilish, 2 phút 59 giây. Nhạc ngắn là xu hướng mới? Ngay cả trong album mới của Beyoncé, Cowboy Carter, một album được coi là rất dài, tận 78 phút, nhưng khi chia đều ra thì mỗi bài cũng không tới 3 phút. Các ca khúc của Taylor Swift không đến mức ngắn thế, nhưng ngay cả với Swift thì theo thời gian, độ dài trung bình các bài hát trong các album cũng giảm dần, từ Speak Now gần 5 phút một bài đến Midnights cũng chỉ còn khoảng 3 phút rưỡi. Đây không chỉ là xu hướng ở US-UK. Khi nhóm nhạc nữ NewJeans của K-pop ra mắt mini album Get Up, người hâm mộ cũng phàn nàn, ngắn quá! Mini album có tới 6 track nhạc, nhưng tổng thời gian chỉ khoảng 12 phút. Bài ngắn nhất 37 giây. Bài dài nhất 2 phút 35 giây. Còn tại Việt Nam, hiện tượng này rất rõ ở nghệ sĩ trẻ: từ Loi Choi: The Neo Pop Punk của Wren Evans đến Em của Mỹ Anh, từ ái của tlinh đến 99% của rapper MCK, tất cả đều có thời lượng một bài trung bình chỉ hơn 2 phút. Cả thế giới dường như đều không còn hứng thú nghe những ca khúc trường thiên. Đâu rồi cái thời thịnh trị của rock những năm 1970 - 1980, khi nghe một ca khúc của Gun ""n"" Roses hay Led Zeppelin cũng đã dài tới tận mười mấy phút? Đi kèm với sự ngắn gọn là sự tối giản về lời ca. Báo cáo từ một nghiên cứu dựa vào hơn 350.000 ca khúc tiếng Anh đăng trên tạp chí Nature, xu hướng chung trong các ca khúc hiện đại là ngôn từ ngày một đơn giản hơn, cấu trúc ca khúc cũng ngày một ít phức tạp hơn, lặp đi lặp lại cùng một câu nhiều hơn. Phải chăng các nhạc sĩ đang ngày càng làm biếng? Nhiều người đổ cho TikTok. Sự lên ngôi của âm nhạc mì ăn liền, chỉ nhanh nhanh chóng chóng nhảy ùm vào một đoạn hook hay điệp khúc bắt tai? Chắc chắn là do TikTok khuyến khích. Khả năng tập trung ngày một thui chột? Cũng là do văn hóa video ngắn TikTok lan tỏa mà ra cả. Bên cạnh TikTok, nền tảng nghe nhạc trực tuyến Spotify cũng thường bị cho là thủ phạm của sự đơn điệu hóa ca khúc. Khán giả phải nghe ít nhất 30 giây để lượt stream mang lại doanh thu cho nghệ sĩ. Vậy thì ca khúc càng ngắn, càng sớm đi vào phần hấp dẫn càng tốt. Chưa kể, nghe một bản All Too Well dài 10 phút của Taylor Swift thì số tiền thu được cũng chỉ ngang với bản All Too Well gốc dài hơn 3 phút. Vậy thì ngoài một số người có sẵn ""đặc quyền"" dù đăng nhạc ngắn ra sao cũng có sẵn đông đảo người nghe, với những người còn lại, tại sao họ phải sáng tác nhạc dài? Âm nhạc lúc này trở thành một bài toán kinh tế chứ không chỉ là một cảm hứng sáng tạo nữa. Tuy nhiên, đã có thời âm nhạc từng rất ngắn. Suốt những năm 1930 - 1950, vì sự hạn chế của những chiếc đĩa than 78 vòng mà các ca khúc thường đủ ngắn để được lưu giữ ở đó. Phải đến thập niên 1960, khi những chiếc đĩa LP ghi được 22 phút âm thanh ra đời thì các ca khúc mới bắt đầu dài hơi hơn, và ta bắt đầu có những Hey Jude hay A Day in The Life dài 6, 7 phút của The Beatles. Mặc dù có thể cho rằng thời xa xưa, nhạc sĩ làm nhạc ngắn vì không còn lựa chọn nào khác, và điều đó về bản chất là khác với hiện nay, khi các nhạc sĩ chủ đích làm nhạc ngắn để tối ưu hiệu quả kinh tế. Nhưng chẳng phải lịch sử của những xu hướng thẩm mỹ luôn là một đường xoáy trôn ốc? Ta sẽ luôn thấy mình quay trở lại nơi đã từng. Và biết đâu, trong vài năm nữa, khi những ca khúc ngắn bão hòa thì sẽ lại có một lớp nhạc sĩ mới chiều chuộng ta bằng những ca khúc dài không hồi kết? Sự thật là, các ca khúc đang ngày một ngắn đi. Chúng ta còn chưa kịp chìm vào thế giới của một bài ca thì nó đã kết thúc mất rồi.",02/06/2024 10:48 GMT+7,https://tuoitre.vn/thoi-cua-nhac-ngan-2-phut-20240602092817975.htm,"Trong số 5 ca khúc xếp đầu bảng xếp hạng Billboard Hot 100 tuần qua, có tới 4 ca khúc dài dưới 3 phút."
