Title,Content,Date,Url,Summary
"Hoa hậu Lụa di sản Việt Nam sẽ nhận vương miện kèm giải thưởng hơn 2,5 tỉ đồng","Nhà thiết kế Võ Việt Chung - chủ tịch Hoa hậu Lụa di sản Việt Nam 2024, trưởng ban tổ chức - cho Tuổi Trẻ Online biết ban tổ chức bắt đầu nhận hồ sơ dự thi từ nay đến hết ngày 30-9. Dự kiến vòng chung kết sẽ diễn ra cuối tháng 11-2024, tại phố cổ Hội An. Chấp nhận thí sinh phẫu thuật thẩm mỹ  Cuộc thi Hoa hậu Lụa di sản Việt Nam 2024 do Công ty TNHH Silk Fashion World và thành phố Hội An (tỉnh Quảng Nam) phối hợp tổ chức. Đây là mùa tổ chức đầu tiên. Đối tượng dự thi là nữ từ 18 đến 30 tuổi, cao từ 1,6m, có bằng tốt nghiệp trung học phổ thông, chưa lập gia đình, chưa đăng ký kết hôn, chưa sinh con. Thí sinh có thể đã qua phẫu thuật thẩm mỹ nhưng chỉ làm hoàn thiện một số khiếm khuyết như làm răng sứ, lệch hàm, vẹo sống mũi, mắt lác… Nhà thiết kế Võ Việt Chung cho biết các thí sinh đoạt một số danh hiệu trong các cuộc thi hoa hậu, hoa khôi, người đẹp diễn ra trong năm 2022 và 2023 được xem xét đặc cách vào vòng bán kết hoặc chung kết. Người đẹp giành danh hiệu hoa hậu cuộc thi Hoa hậu Lụa di sản Việt Nam 2024 nhận được giải thưởng có tổng giá trị hơn 2,5 tỉ đồng. Á hậu 1 và 2 sẽ nhận tổng giá trị giải thưởng hơn 1 tỉ đồng.  Ngoài ra, ban tổ chức còn trao nhiều giải thưởng phụ, mỗi giải thưởng tổng trị giá 100 triệu đồng. Giữ gìn, phát huy làng nghề truyền thống Với chủ đề ""Hành trình dệt gấm thêu hoa"", cuộc thi Hoa hậu Lụa di sản Việt Nam 2024 đề cao những giá trị truyền thống tốt đẹp, trang phục truyền thống, đặc biệt là các làng nghề truyền thống, trong đó có làng nghề dệt lụa. Đây cũng là lý do ban tổ chức chọn Hội An là nơi tổ chức cuộc thi. Hội An được nhiều người biết đến là một địa phương có ngành may mặc phát triển. Còn tỉnh Quảng Nam là một trong những cái nôi của ngành tơ tằm của nước ta. Thông qua cuộc thi này, ban tổ chức mong muốn tôn vinh các giá trị truyền thống, đồng thời quảng bá đến đông đảo bạn bè quốc tế. Điều thú vị, trong khuôn khổ cuộc thi, ban tổ chức sẽ tổ chức cuộc thi thiết kế áo dài truyền thống. ""Các thiết kế tôn dáng, mang đậm dấu ấn áo dài truyền thống. Các thí sinh có thể thiết kế cách điệu nhưng trong chừng mực. Thí sinh thiết kế trên chất liệu lụa của nước ta như lụa Vạn Phúc, lụa Hà Đông, Lãnh Mỹ A…"" - Võ Việt Chung cho biết thêm.",01/06/2024 17:18 GMT+7,https://tuoitre.vn/hoa-hau-lua-di-san-viet-nam-se-nhan-vuong-mien-kem-giai-thuong-hon-2-5-ti-dong-2024053116195144.htm,"Đại diện ban tổ chức cuộc thi Hoa hậu Lụa di sản Việt Nam 2024 cho biết giá trị giải thưởng dành cho ngôi vị hoa hậu hơn 2,5 tỉ đồng. Tổng giải thưởng cuộc thi hơn 4,5 tỉ đồng gồm tiền mặt và quà tặng."
Tin tức giải trí 1-6: Lật mặt 7 chinh chiến nước ngoài; Phương Mỹ Chi đóng phim kinh dị,"Phương Mỹ Chi đóng chính phim của Huỳnh Lập Sáng 1-6, buổi lễ khai máy phim điện ảnh Nhà gia tiên của đạo diễn Huỳnh Lập diễn ra, với sự tham gia của ê kíp và dàn diễn viên gồm Phương Mỹ Chi, NSƯT Hạnh Thúy, Huỳnh Đông, Puka, Đào Anh Tuấn... Trong đó, gương mặt gây bất ngờ nhất có lẽ là ca sĩ Phương Mỹ Chi, khi lần đầu tiên cô thử sức với vai trò nữ chính trong một bộ phim điện ảnh. Trong Nhà gia tiên, Phương Mỹ Chi đảm nhận vai Mỹ Tiên - một nhân vật ở lứa tuổi gen Z, bất đồng quan điểm với những người lớn trong gia đình và dần dần mất đi sự kết nối với các thành viên. Theo thông tin từ nhà sản xuất, bộ phim dự kiến ghi hình trong khoảng 30 ngày và sẽ ra mắt khán giả cả nước vào dịp cuối năm 2024. Phim thuộc thể loại hài - kinh dị, tập trung khai thác tình cảm gia đình và những giá trị cốt lõi bên trong một căn nhà đặc biệt được truyền qua nhiều thế hệ ông cha. Lật mặt 7 tiếp tục chiếu ở nước ngoài Sau loạt thành tích ấn tượng, dẫn đầu phòng vé Việt Nam trong suốt thời gian qua và đạt kỷ lục doanh thu, Lật mặt 7: Một điều ước sẽ tiếp tục được công chiếu tại thị trường quốc tế. Theo nhà sản xuất, Lật mặt 7 sẽ chiếu tại thị trường Bắc Mỹ và 11 quốc gia khác gồm Canada, Úc, New Zealand, Anh, Đức, Pháp, Na Uy, Thụy Điển, Cộng hòa Czech, Slovakia và Ba Lan từ ngày 14-6. Riêng tại thị trường khổng lồ Bắc Mỹ, phim sẽ được cho ra mắt vào đúng vào tuần lễ Ngày của cha (Father's Day). Trang tin Deadline dành nhiều lời khen và nhận xét rằng Lật mặt là loạt phim thành công nhất lịch sử điện ảnh Việt Nam. Lật mặt 7 hiện đang là phim thứ 3 có doanh thu cao nhất mọi thời đại tại Việt Nam và vẫn đang trong top phim bán được nhiều vé nhất trong ngày, dù đã bước sang tuần chiếu thứ 5. Jennifer Lopez hủy bỏ tour lưu diễn vì tin đồn ly hôn The Hollywood Reporter đưa tin tour diễn This Is Me… Live Tour sắp tới của Jennifer Lopez đã bị hủy bỏ với lý do nữ ca sĩ đang dành thời gian nghỉ ngơi để ở bên các con, gia đình và bạn bè thân thiết. ""Tôi thật sự cũng rất buồn vì đã khiến các bạn thất vọng. Xin hãy hiểu rằng tôi đưa ra lựa chọn này vì nó thực sự cần thiết vào thời điểm này. Tôi hứa sẽ bù đắp nhiều hơn cho các bạn. Tôi yêu tất cả mọi người rất nhiều..."" - nữ ca sĩ viết cho người hâm mộ. Thông báo này được đưa ra trong bối cảnh truyền thông đưa tin về việc Jennifer Lopez và chồng là nam diễn viên Ben Affleck đang có nguy cơ tan vỡ, khi hai người bị bắt gặp tranh cãi gay gắt nhiều lần. This Is Me… Live Tour ban đầu được ấn định sẽ khởi động vào ngày 26-6 tại Orlando (Mỹ) và kết thúc tour vào ngày 31-8 tại thành phố Houston. NewJeans lọt vào danh sách 21 Under 21 của Billboard Billboard vừa công bố danh sách 21 Under 21 vào ngày 31-5 (giờ Mỹ). NewJeans là nghệ sĩ Hàn Quốc duy nhất có mặt trong danh sách này năm nay. Danh sách 21 Under 21 của Billboard được bình chọn hằng năm, dựa trên các tiêu chí khác nhau: doanh số bán album, lượt phát trực tuyến, mức độ hiển thị trên mạng xã hội và phạm vi tiếp cận trên các đài phát thanh, truyền hình. Billboard nhấn mạnh rằng vị trí mà NewJeans đạt được là nhờ vào những thành tích xuất sắc trong suốt 2 năm kể từ khi ra mắt. Trên thực tế, NewJeans đã nhiều lần đứng đầu bảng xếp hạng Billboard 200 nhờ các ca khúc hit của mình. Trước đó, nhóm cũng từng nhận giải Nhóm nhạc của năm tại Billboard Women in Music Awards 2024. Kim Soo Hyun đến ủng hộ phim của Thang Duy, Suzy Dispatch đưa tin bộ phim điện ảnh Wonderland vừa tổ chức một buổi họp báo ra mắt phim hoành tráng vào tối 31-5, với sự tham gia của nhiều ngôi sao xứ Hàn. Đạo diễn Kim Tae Yong và dàn diễn viên chính của phim: Thang Duy, Bae Suzy, Park Bo Gum, Jung Yu Mi, Choi Woo Sik đều có mặt tại sự kiện. Wonderland là một trong những bộ phim điện ảnh được mong chờ nhất trong năm nay, phim được chiếu sau 4 năm trì hoãn do dịch COVID-19. Phim thuộc thể loại khoa học viễn tưởng, nói về sự kết nối của AI với con người trong tương lai. Trong sự kiện ra mắt phim, dàn sao nổi tiếng gồm Kim Soo Hyun, Byeon Woo Seok, Hyeri, Seohyun (SNSD)... cũng đến tham dự để ủng hộ các đồng nghiệp. Trong đó, Kim Soo Hyun và Suzy từng đóng chung bộ phim Dream High (Bay cao ước mơ), cả hai cũng trở thành đồng nghiệp thân thiết sau lần hợp tác đó. Wonderland sẽ chính thức khởi chiếu tại Hàn vào ngày 5-6 tới.",01/06/2024 16:14 GMT+7,https://tuoitre.vn/tin-tuc-giai-tri-1-6-lat-mat-7-chinh-chien-nuoc-ngoai-phuong-my-chi-dong-phim-kinh-di-20240601155755861.htm,"Một số tin tức đáng chú ý: Lật mặt 7 tiếp tục chiếu ở nước ngoài; Jennifer Lopez hủy bỏ tour lưu diễn vì tin đồn ly hôn; Kim Soo Hyun đến ủng hộ phim của Thang Duy, Suzy..."
"Cái giá của hạnh phúc có cái kết rùng rợn, tầm thường hóa bạo lực và lừa dối","'Phim Lật mặt 7, Mai, Cái giá của hạnh phúc đều nói lên những thực trạng có thật trong đời sống gia đình hiện nay. Đó là mâu thuẫn giữa các thế hệ cha mẹ, vợ chồng, con cái... Ở họ, khó có sự kết nối, thông cảm với nhau'. Đây là nhận định của TS Bùi Trân Phượng, diễn giả chương trình trong sự kiện bàn luận về quan hệ giữa các thành viên gia đình trong các phim Việt gần đây như: Lật mặt 7, Cái giá của hạnh phúc, Mai, diễn ra tại Salon văn hóa Cà phê Thứ Bảy sáng 1-6. Buổi trò chuyện là những nghiên cứu, quan điểm của bà Phượng và khán giả về các tình tiết kết nối giữa nhân vật, gia đình trong các phim trên. Những người phụ nữ đau khổ Bà Bùi Trân Phượng cho rằng cả ba phim Lật mặt 7, Mai, Cái giá của hạnh phúc đều là tác phẩm đại chúng, thu hút khán giả ở mọi độ tuổi bởi chúng đánh vào cảm xúc người xem, nặng tình nhẹ lý. Trong cả ba phim, chúng ta cũng bắt gặp những người phụ nữ có sự đau khổ, bi kịch trong đời sống gia đình. Tuy cách thể hiện khác nhau, theo bà Phượng, chủ đề này đã trở thành đề tài muôn thuở của văn học nghệ thuật từ xưa đến nay. ""Người xem thích thấy nhân vật nữ chính đau khổ và ngưỡng mộ, yêu quý họ vì sự đau khổ ấy. Có thể gọi đó là sự chìm đắm trong thú đau thương. Lúc này, những bi kịch với người phụ nữ là bình thường, lẽ đời"" - bà Phượng nêu quan điểm. Tuy có thể bị phản bội, thua thiệt, có phần yếu thế, nhưng những người phụ nữ ấy lại có rất nhiều quyền năng. Họ tác động đến gia đình, đời sống xã hội rất mạnh mẽ. Họ có thể khiến người liên quan cảm thấy được chăm sóc, yêu thương, nhưng cũng có thể làm người ta điêu đứng, bị giày vò. Cái kết của phim Mai gây bất ngờ cho nhiều khán giả. Với bà Phượng, đó là một cái kết thú vị bởi nó là sự thừa nhận thực tế cho những đau khổ, bất hạnh của nhân vật nữ chính. Trong một nghiên cứu khảo sát về truyện ngôn tình (tình cảm) Việt Nam do bà Phượng thực hiện, đa số tác phẩm đều có kết thúc hạnh phúc. Chỉ khoảng 10% tác phẩm không có cái kết đẹp. ""Các tác phẩm này không có kết thúc đẹp khi sự xúc phạm của nhân vật phản diện đối với nhân vật chính diện quá nghiêm trọng để có thể được tha thứ. Đó là sự phản kháng, đánh giá đúng mức cái ác. Rộng lượng bao dung tới đâu cũng không thể tha thứ"" - bà Phượng phân tích. Khác với cái kết của phim Mai, Cái giá của hạnh phúc lại có kết thúc khiến bà ""hơi rợn xương sống"". Phim kết lại bằng hình ảnh một bữa cơm gia đình hạnh phúc, với sự hối hận của người mẹ khi đã gây ra nhiều âm mưu để trả thù người chồng ngoại tình. ""Biên kịch cho ta thấy sự sum họp của một gia đình sau từng đó chuyện xảy ra và đó mới là hạnh phúc. Đối với tôi, đây là sự ""rùng rợn"" bởi phim đã tầm thường hóa sự bạo lực và lừa đảo trắng trợn trong nội bộ thành viên gia đình. Vậy cái giá của hạnh phúc lúc này được hiểu như thế nào?"" - TS Bùi Trân Phượng nói. Cha mẹ có cần nhận sự đền đáp của con cái? Còn phim Lật mặt 7 đi sâu vào mối quan hệ giữa mẹ và các con trong gia đình. Từ đây, nhiều khán giả cũng đặt ra câu hỏi về cách mà con cái phụng dưỡng ba mẹ hiện nay. Có khán giả cho rằng chuyện nào ra chuyện đó. Khi về già, ba mẹ không cần quá kỳ vọng vào việc con cái phải quay về chăm sóc mình. Còn dưới góc nhìn của một khán giả trung niên, bà bảo hoàn cảnh của bà mẹ trong phim Lật mặt 7 rất giống với gia đình bà. Một người mẹ có nhiều con, khi các con lớn có gia đình riêng, người mẹ lựa chọn sống một mình. Vị khán giả nói: ""Một người già hơn 70 tuổi cũng muốn không phiền con cái, nhưng khi mắt đã mờ, bệnh tật bắt đầu ập đến thì họ rất cần sự hỗ trợ, quan sát của con cái. Nhưng lúc này những người con cũng có gia đình nhỏ của mình, công việc bộn bề nên không thể kề cận bên ba mẹ suốt. Ở các nước phát triển, việc người già vào viện dưỡng lão, có y tá chăm sóc, được bầu bạn là chuyện hết sức bình thường. Nhưng ở Việt Nam vẫn còn đó những định kiến. Điều này tạo ra một vòng luẩn quẩn bế tắc"". Bà Bùi Trân Phượng đồng tình với quan điểm trên. Bà cho rằng áp lực xã hội còn lớn và đè nặng lên vai con cái Việt Nam. Từ đó, chúng ta cần xem lại quyền tự chủ và trách nhiệm của ba mẹ đối với bản thân mình và con cái. ""Trẻ cậy cha, già cậy con. Nhưng cậy theo kiểu nào thì chính đáng và theo kiểu nào thì sẽ không hiệu quả cho cả hai bên mới là cái đáng để suy nghĩ. Và với sự phát triển, thay đổi của xã hội thì không thể khăng khăng giữ truyền thống gia đình theo kiểu Nho gia: Tam đại đồng đường, tứ đại đồng đường như xưa"" - bà Phượng nêu quan điểm.",01/06/2024 15:55 GMT+7,https://tuoitre.vn/cai-gia-cua-hanh-phuc-co-cai-ket-rung-ron-tam-thuong-hoa-bao-luc-va-lua-doi-20240601130659124.htm,"Khác với cái kết của phim Mai, Cái giá của hạnh phúc kết thúc khiến TS Bùi Trân Phượng nói 'hơi rợn xương sống' khi phim kết lại bằng hình ảnh một bữa cơm gia đình hạnh phúc, với sự hối hận của người mẹ..."
"Tranh cãi Doraemon, Kungfu Panda: Phim thiếu nhi có mất chất và 'vắt sữa'?","Mùa hè này tiếp tục có phim điện ảnh thứ 43 - Doraemon: Nobita và bản giao hưởng Địa Cầu. Phim tiếp tục đứng đầu phòng vé Nhật Bản và Việt Nam, cho thấy đây vẫn là một thương hiệu bất bại trong lòng khán giả nhí và cả khán giả lớn thích hoài niệm tuổi thơ. Nhưng phim cũng gây ra tranh luận ở Việt Nam, như có người cho rằng phim ""nhạt nhẽo, chắp vá, rời rạc"", kịch bản không có điểm nhấn và cao trào. Có người bảo vệ vì ""phim cho trẻ con sao người lớn lại đánh giá là nhạt nhẽo?"". Doraemon nhạt nhẽo hay chữa lành? Dù Doraemon: Nobita và bản giao hưởng Địa Cầu không xúc động bằng các phần phim trước, hay ""cốt truyện nhạt, xem buồn ngủ, hơi lãng xẹt"", thì phim vẫn quy tụ lượng khán giả trung thành ổn định. Những người bênh phim cho rằng phần này nhẹ nhàng, chữa lành chứ không chú trọng kịch tính. Đã đến phần phim thứ 43, mô típ quen thuộc lặp đi lặp lại: Nobita hậu đậu gây ra vấn đề, Doraemon và cả nhóm hợp lực lên đường phiêu lưu, tìm cách giải quyết. Sự tin tưởng của khán giả là do nhiều năm nay các nhà làm phim Doraemon duy trì chất lượng nhất quán về kể chuyện, hình ảnh đồ họa và phát triển nhân vật. Tất nhiên, chất lượng đó cần duy trì đồng đều chứ không thể đi xuống quá mức bởi nó sẽ kéo theo sự thụt lùi của thương hiệu. Nhiều khán giả trung thành với Doraemon cũng kể ra những phần phim chiếu rạp hay vượt trội so với phần 43 nhiều như Chú khủng long của Nobita hay Nobita và chuyến thám hiểm Nam Cực. Họ cho rằng Doraemon không chỉ dành cho trẻ con mà người trưởng thành vẫn tìm được nhiều bài học nhân văn, thấm thía và sâu sắc. Không phải ngẫu nhiên Doraemon trở thành biểu tượng văn hóa đại chúng chứ không chỉ là nhân vật truyện tranh nổi tiếng. Với doanh thu khổng lồ so với thể loại anime như vậy (hiện Doraemon 43 đã thu 27,5 triệu USD từ thị trường Nhật Bản và Việt Nam), dự báo thương hiệu này sẽ vẫn khai thác tiếp phiên bản chiếu rạp. Trong mắt một số khán giả, việc các thương hiệu cứ liên tục ra phần mới trong khi nội dung không thực sự mới và đột phá bị coi là ""vắt sữa"". Thương hiệu hoạt hình Thám tử lừng danh Conan liên tiếp bị phản ứng trong hai năm qua vì ""bịa"" thêm các tình tiết ""vắt sữa"" như Haibara hôn Conan hay Conan và Kaito Kid là anh em họ. Cũng mang tiếng ""vắt sữa"" là các thương hiệu hoạt hình Hollywood nổi tiếng như Kung Fu Panda với phần 4 vừa ra mắt, Toy Story, Frozen, The Lion King, Shrek... Lý do chủ yếu là phần mới nhất không có gì đột phá. Khi Hollywood loay hoay với việc đưa các thương hiệu mới trở nên nổi tiếng và hút khách, các thương hiệu ăn khách cũ vẫn sẽ tiếp tục được khai thác, từ hậu truyện, tiền truyện đến câu chuyện riêng về từng nhân vật ăn khách trong series... Phim thiếu nhi ăn khách có thể thành kinh điển? Bên cạnh việc những thương hiệu nhượng quyền lớn ra hàng loạt các phần tiếp theo và thu lợi nhuận, câu hỏi đặt ra là phim cho thiếu nhi ngày nay có đủ chất lượng để lại những tác phẩm kinh điển như thời trước? Tuần này, The Garfield Movie - bộ phim hoạt hình riêng lẻ về chú mèo Garfield nổi tiếng - dẫn đầu phòng vé Mỹ. Mặc dù vậy, phim nhận phản hồi khá tiêu cực, bị chấm điểm thấp trên các trang đánh giá phim. The Hollywood Reporter cho rằng phim không trung thành với hình tượng chú mèo Garfield trong truyện tranh gốc của tác giả Jim Davis. Nếu bản gốc của Garfield mê ăn pizza, lasagna hay nói dối và mỉa mai thì bản điện ảnh biến chú mèo thành nhân vật hành động theo phong cách Mission: Impossible. Trang Movie Marker viết về Kung Fu Panda 4: ""Thật không may, Kung Fu Panda 4 lại có cảm giác như một phần phim kém ấn tượng và không cần thiết trong một loạt phim đáng lẽ phải dừng lại sau phần 3 xúc động"". Khi bộ phim đang chiếu, những hình ảnh và tình tiết hài hước, ấn tượng ""viral"" trên mạng xã hội lại là từ phần 2 của loạt phim. Còn Toy Story 4, phần mới nhất và có thể là cuối cùng của loạt phim hoạt hình kiệt tác, cũng bị cho là phá vỡ tổng thể đẹp của ba phần trước đó với cái kết viên mãn. Một khán giả bình luận trên BuzzFeed rằng phim quá chú trọng lôi kéo nhóm khán giả thế hệ Y đời cuối và gây cảm giác thao túng về mặt cảm xúc. Các nhân vật phụ được yêu mến đều bị gạt sang một bên để lấy đất diễn cho Woody và Bo Peep, kể cả Buzz cũng thụt lùi. Câu trả lời tạm thời là các phim thiếu nhi mới, những phần tiếp theo từ các thương hiệu lớn vẫn sẽ ăn khách trong thời gian tới, thu hút khán giả nhí thế hệ mới. Nhưng nếu không giữ vững chất lượng, đột phá sáng tạo thì chưa chắc những phim ăn khách này có thể đứng vào hàng ngũ phim thiếu nhi kinh điển như tác phẩm gốc hay các phần trước đó.",01/06/2024 11:53 GMT+7,https://tuoitre.vn/tranh-cai-doraemon-kungfu-panda-phim-thieu-nhi-co-mat-chat-va-vat-sua-20240601103653774.htm,Có những loạt phim thiếu nhi kéo dài như Doraemon hay các phim hoạt hình Disney làm thêm nhiều phần nhưng bị chê thiếu đột phá. Điều này liệu có đúng?
"Đa dạng kịch, xiếc cho khán giả nhí, xem Hoa vui ca trên truyền hình mỗi ngày","Sân khấu Trương Hùng Minh có hai suất diễn lúc 15h30 và 19h30 ngày quốc tế thiếu nhi 1-6 là Truyện thần tiên 2 với vở Mễ Cốc phiêu lưu ký đã ""cháy"" vé, sẽ diễn liên tục đến tháng 9 năm nay. Vở được đầu tư hơn 1 tỉ đồng với sự tham gia của các nghệ sĩ Minh Nhí, Việt Hương, Cát Phượng, Hứa Minh Đạt... Sân khấu kịch Quốc Thảo cũng chọn ngày 1-6 (hai suất diễn lúc 16h và 19h) để ra mắt Đảo muôn màu và cuộc thử thách sinh tồn. Nhà hát kịch 5B sẽ diễn hai vở cũ là Đại náo Long cung và Thế giới đồ chơi - Câu chuyện cậu bé rồng. Từ ngày 31-5 đến 2-6, Nhà hát kịch Idecaf diễn mỗi ngày hai suất vở Cuộc phiêu lưu của thuyền trưởng Sinbad: Huyền thoại mắt thần tại Nhà hát Bến Thành. Trong ba ngày 31-5, 1 và 2-6, sân khấu Ban Mai ra mắt vở Colora - Xứ sở rực rỡ (đạo diễn: Bảo Chu) tại Nhà thiếu nhi TP.HCM. Tại Nhà hát TP, vở vũ kịch Cô bé Lọ Lem sẽ tái ngộ với khán giả trong hai ngày 1 và 2-6. Nhà hát nghệ thuật Phương Nam diễn vở kịch xiếc Ầu ơ - Thanh âm đầu đời tại rạp xiếc công viên Gia Định (quận Gò Vấp) trong hai ngày 1 và 2-6, mỗi ngày hai suất (lúc 17h và 19h30). Cùng thời điểm này, nhà hát diễn rối nước với các trò rối cổ truyền trong chương trình Hoa đất Việt (suất 10h30 và 14h30) tại Bảo tàng Lịch sử TP.HCM. Hoa vui ca vừa học vừa chơi Ngày Quốc tế thiếu nhi 1-6 vào lúc 18h50 trên VTV3 trình làng chương trình mới toanh dành cho thiếu nhi - Hoa vui ca. Theo VTV3, Hoa vui ca được thiết kế vui tươi, trẻ trung phù hợp với lứa tuổi và phát sóng liên tục mỗi ngày trong tuần. Mỗi tuần công bố một bài hát chủ đề được lựa chọn kỹ và hòa âm phối khí mới. Trong khoảng 10 phút phát sóng, khán giả nhí sẽ học hát, nhảy múa, làm thủ công, xem video các bạn nhỏ biểu diễn và gửi đến chương trình. Vào ngày công diễn, các tiết mục được lựa chọn sẽ diễn trên sân khấu lớn với vũ đoàn cùng nhóm bè các ca sĩ nhí. Lúc 20h ngày 2-6, THVL1 phát sóng phim cổ tích Đứa con ngỗ nghịch. Chuyện kể ngày xưa có hai vợ chồng tên Sửu hiếm muội con. Trong một lần tình cờ cứu chú thỏ rớt xuống suối, họ được thỏ đền đáp công ơn bằng cách dẫn họ đến dòng suối thần tiên. Sau khi uống nước tại đây, họ có cậu con trai kháu khỉnh. Ước nguyện thành hiện thực nhưng vì được cha mẹ quá cưng chiều, đứa trẻ lớn lên rất ngỗ nghịch, hỗn hào với mẹ cha và ăn chơi sa đọa.",01/06/2024 11:09 GMT+7,https://tuoitre.vn/da-dang-kich-xiec-cho-khan-gia-nhi-xem-hoa-vui-ca-tren-truyen-hinh-moi-ngay-20240601103142257.htm,Dịp 1-6 năm nay rơi vào ngày cuối tuần nên rất nhiều sân khấu chọn để đồng loạt ra quân kịch thiếu nhi.
