Title,Content,Date,Url,Summary
Tranh đồ họa Việt ‘đang lên’ hay đáng báo động?,"Hai họa sĩ Nguyễn Nghĩa Phương và Trịnh Tuân chia sẻ khi trả lời câu hỏi của Tuổi Trẻ Online tại lễ phát động Cuộc thi và triển lãm tranh đồ họa các nước ASEAN lần thứ 4 - Việt Nam 2024 do Cục Mỹ thuật, Nhiếp ảnh và Triển lãm tổ chức ngày 31-5. Đồ họa Việt Nam đang ở đâu? PGS.TS Nguyễn Nghĩa Phương cho biết ông tham gia hội đồng nghệ thuật của Cuộc thi và triển lãm tranh đồ họa các nước ASEAN ngay từ lần đầu tổ chức vào năm 2012. Xem tranh của họa sĩ các nước khác trong khu vực ASEAN thấy phương tiện kỹ thuật trong sáng tác cũng như hình thức thể hiện của tranh đồ họa rất phong phú, nhiều sáng tạo mới, như có cả tranh đồ họa sắp đặt, tranh đồ họa nhiều lớp… Trong khi đó, tranh đồ họa Việt Nam có lịch sử lâu đời nhưng những năm qua đầu tư cho đào tạo họa sĩ đồ họa ở các nhà trường Việt Nam chưa được nhiều như các nước trong khu vực. Tuy nhiên, gần đây, các họa sĩ đồ họa Việt Nam rất tích cực tham gia triển lãm ở các nước châu Á, châu Âu, châu Mỹ Latin. Khi tham gia các triển lãm quốc tế này, cũng như Cuộc thi và triển lãm tranh đồ họa các nước ASEAN, các họa sĩ Việt Nam được học hỏi rất nhiều. Nhờ vậy hiện nay chất lượng tranh đồ họa Việt Nam đang ngày càng được nâng lên, thuộc top các nước mạnh ở ASEAN. Tuy nhiên họa sĩ Trịnh Tuân - một người cũng có nhiều năm giảng dạy tại Trường đại học Mỹ thuật công nghiệp Hà Nội - thì không lạc quan như vậy. Ông Tuân nói không chỉ riêng kết quả các Cuộc thi và triển lãm tranh đồ họa ASEAN do Việt Nam tổ chức mà nhiều hoạt động giao lưu quốc tế thường niên về tranh đồ họa cho thấy trình độ của các họa sĩ Việt Nam đang ở đâu. Ông Tuân dẫn một ví dụ: cộng lại các máy in ấn, các kỹ thuật in ấn của tất cả các trường có đào tạo chuyên nghiệp về đồ họa ở Việt Nam cũng không bằng máy móc, kỹ thuật tại một xưởng nhỏ của một trường mỹ thuật nhỏ của một tỉnh nhỏ ở Thái Lan hay một vài nước khác ở khu vực ASEAN. Mà kỹ thuật tranh đồ họa thì phụ thuộc rất lớn vào cơ sở vật chất máy móc in ấn. Và Cuộc thi và triển lãm tranh đồ họa các nước ASEAN chính là cơ hội để các nghệ sĩ Việt biết thế mạnh ở từng quốc gia, các nghệ sĩ sẽ tự đánh giá được trình độ của mình để học hỏi thêm. Sẽ tổ chức triển lãm tại Hải Phòng Về Cuộc thi và triển lãm tranh đồ họa các nước ASEAN lần thứ 4 - Việt Nam 2024, đại diện Cục Mỹ thuật, Nhiếp ảnh và Triển lãm cho biết đây là hoạt động được tổ chức định kỳ 4 năm/lần, bắt đầu từ 2012. Các tác giả là công dân của các nước ASEAN đều có thể tham dự.  Đề tài không bó buộc, tác phẩm là đồ họa tranh in, thuộc các thể loại: tranh in nổi, tranh in lõm, tranh in phẳng, tranh in xuyên, tranh in độc bản, tranh in các kỹ thuật khác, tranh in đa chiều (sắp đặt tranh in, book art tranh in, tranh in nhiều lớp). Các tác phẩm tham dự được sáng tác từ năm 2020 đến nay. Mỗi tác giả được gửi tham gia tối đa 3 tác phẩm, từ nay đến hết ngày 5-8. Dự kiến Triển lãm tranh đồ họa các nước ASEAN lần thứ 4 sẽ khai mạc tháng 12 tới, tại Bảo tàng Hải Phòng (TP Hải Phòng), chứ không phải ở Hà Nội như các kỳ trước.",31/05/2024 19:45 GMT+7,https://tuoitre.vn/tranh-do-hoa-viet-dang-len-hay-dang-bao-dong-20240531181550596.htm,"Ông Nguyễn Nghĩa Phương - phó hiệu trưởng Trường đại học Mỹ thuật Việt Nam - cho biết chất lượng tranh đồ họa Việt Nam đang ngày càng được nâng lên, thuộc top các nước mạnh ở ASEAN, nhưng họa sĩ Trịnh Tuân thì có ý kiến khác."
Công bố hội đồng chuyên môn Giải thưởng sách thiếu nhi TP.HCM,"Đến dự buổi khai mạc có Phó bí thư thường trực Thành ủy TP.HCM Nguyễn Hồ Hải, Phó vụ trưởng, Phó trưởng Cơ quan thường trực miền Nam Ban Tuyên giáo Trung ương Dương Minh Tuấn, Trưởng Ban Dân vận Thành ủy TP.HCM Nguyễn Mạnh Cường, nhà nghiên cứu Nguyễn Đình Tư… Dịp này, ban tổ chức đã công bố hội đồng chuyên môn Giải thưởng sách thiếu nhi TP.HCM lần đầu tiên. Đó là hội đồng 5 người của Giải thưởng sách thiếu nhi TP ở giai đoạn 1, gồm tiến sĩ Quách Thu Nguyệt, nhà văn Trịnh Bích Ngân, PGS.TS Bùi Thanh Truyền, nhà thơ Cao Xuân Sơn và nhà thơ Lê Minh Quốc. Muốn nâng chất và lượng sách thiếu nhi Phát biểu tại lễ khai mạc, ông Lâm Đình Thắng, giám đốc Sở Thông tin và Truyền thông TP.HCM, cho biết đây là giải thưởng sách thiếu nhi đầu tiên ở TP.HCM được khởi động từ Hội sách thiếu nhi TP.HCM lần 4 năm 2023. Qua một năm, sở đã nhận được sự quan tâm, gửi tác phẩm tham dự của nhiều tác giả, nhà xuất bản và đơn vị phát hành sách. Hôm nay, ban tổ chức chính thức công bố danh sách thành viên hội đồng chuyên môn.  Theo ông Thắng: ""Hội đồng chuyên môn là những chuyên gia đầu ngành, nhà phê bình lý luận văn học có uy tín, phù hợp với lĩnh vực sách. Họ được mời tham gia hội đồng nhằm thực hiện công tác đánh giá các tác phẩm công tâm, khách quan và có chất lượng cao"". Sở sẽ tiếp tục tham mưu cho lãnh đạo các cấp tiếp tục có những chính sách, cơ chế, tạo điều kiện môi trường bồi dưỡng đội ngũ tác giả viết sách cho thiếu nhi. Đồng thời tạo động lực thúc đẩy nâng cao chất lượng, số lượng sách dành cho thiếu nhi TP.HCM nói riêng và cả nước nói chung. Ươm mầm tình yêu với sách Nói về Hội sách thiếu nhi TP.HCM lần 5, ông Thắng nhấn mạnh hội sách do Sở Thông tin và Truyền thông TP.HCM tổ chức đến nay là lần thứ 5. Hội sách đã trở thành một trong những điểm đến quen thuộc trong dịp hè về. Đây là chương trình dành riêng cho thanh thiếu nhi, thể hiện sự quan tâm của lãnh đạo TP, các cấp, các ngành đối với các em trong việc tạo lập thói quen và nâng cao văn hóa đọc. Hội sách năm nay có chủ đề Vui hè cùng sách hay tiếp tục được đầu tư tổ chức với nhiều điểm mới. Nhiều hoạt động bổ ích, với những tựa sách hay, ý nghĩa được chọn lọc và giới thiệu với bạn đọc, đáp ứng nhu cầu đọc sách của thanh thiếu nhi và quý phụ huynh diễn ra xuyên suốt 10 ngày tại Đường sách TP.HCM (từ 31-5 đến 9-6). Trong thời gian này, có gần 100 chương trình diễn ra, trong đó có 59 chương trình tại Đường sách TP.HCM (tăng 50% so với Hội sách thiếu nhi TP.HCM năm 2023), gần 30 chương trình tại Đường sách Thủ Đức, giới thiệu hơn 40.000 tựa sách đa dạng thể loại, phong phú về nội dung. Nhiều hoạt động trải nghiệm như hệ thống thiết bị kính thực tế ảo với các nội dung kiến thức về khoa học kỹ thuật, thư viện sách; Các chương trình tọa đàm, giới thiệu sách của các đơn vị tham gia; Trình diễn trống kèn của các trường học trên địa bàn TP.",31/05/2024 19:35 GMT+7,https://tuoitre.vn/cong-bo-hoi-dong-chuyen-mon-giai-thuong-sach-thieu-nhi-tp-hcm-20240531183605277.htm,"Chiều 31-5, Hội sách thiếu nhi TP.HCM lần 5 năm 2024 đã chính thức khai mạc tại Đường sách TP.HCM."
Loạt bài 'cô bé bom hàng hiếu thảo' của Tuổi Trẻ đạt giải B Giải thưởng báo chí tỉnh Bình Định,"Ngày 31-5, ông Đỗ Nguyên Hùng - chủ tịch Hội Nhà báo tỉnh Bình Định, chủ tịch hội đồng xét thưởng Giải thưởng báo chí tỉnh Bình Định năm 2024 - cho biết hội đồng xét thưởng đã họp và quyết định chọn, trao giải thưởng cho 38 tác phẩm, chùm tác phẩm thuộc 5 thể loại báo chí. Trong đó, có 4 tác phẩm đoạt giải A, 1 tác phẩm đoạt giải B, 10 tác phẩm đoạt giải C và 13 tác phẩm đoạt giải khuyến khích. Báo Tuổi Trẻ đạt giải B phóng sự báo điện tử với loạt bài về ""Cô bé bom hàng hiếu thảo Phan Thị Ca và chị chủ shop tốt bụng"" và giải C ảnh báo chí với phóng sự ảnh ""Bắt bệnh bốc thuốc cho tàu cá ra khơi"". Cả hai tác phẩm này do phóng viên Lâm Thiên thực hiện. Theo nhà báo Đỗ Nguyên Hùng, lễ trao Giải thưởng báo chí tỉnh Bình Định năm 2024 sẽ được tổ chức vào chiều 21-6-2024, đúng dịp kỷ niệm 99 năm Ngày Báo chí cách mạng Việt Nam.",31/05/2024 18:22 GMT+7,https://tuoitre.vn/loat-bai-co-be-bom-hang-hieu-thao-cua-tuoi-tre-dat-giai-b-giai-thuong-bao-chi-tinh-binh-dinh-20240531161254685.htm,"Trong 38 tác phẩm, chùm tác phẩm thuộc 5 thể loại báo chí đạt Giải thưởng báo chí tỉnh Bình Định năm 2024, loạt bài về ""cô bé bom hàng hiếu thảo và chị chủ shop tốt bụng"" của báo Tuổi Trẻ đạt giải B thể loại báo điện tử."
"Người Việt khoe vàng, tiền trên mạng, xấu hay tốt?","Hàng chục KOL bị phía Trung Quốc cấm tài khoản với lý do ""vi phạm tiêu chuẩn cộng đồng"" do thường xuyên lên mạng khoe của, phô trương cuộc sống thượng lưu, ảnh hưởng tiêu cực tới người dùng. Truyền thông Trung Quốc mô tả những nội dung tôn thờ vật chất này là một sự ""ảnh hưởng độc hại"". Bạn đọc Bạch Ngọc Duy Đức bình luận dưới bài viết Hàng chục KOL chuyên flexing cuộc sống xa xỉ ở Trung Quốc đã bị phong sát trên Tuổi Trẻ Online: ""Hy vọng Việt Nam cũng sẽ làm tương tự để thanh lọc KOLs mang lại những ảnh hưởng tiêu cực cho giới trẻ"". Việt Nam đầy người khoe của Không chỉ Trung Quốc, Việt Nam cũng đầy người khoe của, khoe tiền bạc, khoe vàng, phô trương cuộc sống thượng lưu, sang chảnh… trên mạng xã hội. Mục đích câu view, câu like là chính. Chỉ cần gõ từ khóa ""khoe tiền"", ""khoe của"", ""khoe vàng""… trên thanh công cụ tìm kiếm của các mạng xã hội như YouTube, TikTok… dễ nhận thấy có vô số clip có nội dung tương tự. Các clip này đều thu hút lượng người xem lẫn tương tác, bình luận lớn. Thậm chí, có những tài khoản hay khoe đến độ được xem là hiện tượng mạng. Có thể kể tới một số cái tên như ""Huấn Hoa Hồng"", ""Phúc Xo"", ""Tùng Vâu""… Không chỉ hiện tượng mạng, một số nghệ sĩ nổi tiếng trong giới showbiz cũng từng khoe vàng, khoe tiền.  Thậm chí có nghệ sĩ còn khoe được fan tặng vòng vàng, bó hoa tiền mặt… trên trang cá nhân. Giới showbiz còn có trào lưu ""đập hộp"", khoe hàng hiệu… Bình luận dưới clip một hot girl đập heo ăn Tết tiền tỉ khiến nhiều người trầm trồ, tài khoản @tanvo1186 cho rằng: ""Khoe tiền. Chả có gì hay cả. Chỉ đánh vào tâm lý thích tiền của người ta"". Bạn @chungchung6012 thì bình luận: ""Cô ấy đang tạo sự chú ý và đã được chú ý"". Thời gian gần đây trên TikTok, tài khoản Ư.T. được biết đến với các clip khoe của, khoe vàng, rải tiền khắp nhà hoặc các túi/thùng tiền với các mệnh giá khác nhau… thu hút hàng chục triệu view. Bên cạnh những ý kiến bình luận ""phản cảm"", ""câu view là chính""… có không ít dân mạng ùa vào xin tiền của tài khoản này. Khoe khoang tốt hay xấu? Trao đổi với Tuổi Trẻ Online, TS Đặng Vũ Cảnh Linh - giám đốc Viện Nghiên cứu Thanh niên Việt Nam - cho hay hiện khó ai có thể phủ nhận những lợi ích từ công nghệ hay mạng xã hội đem lại. Mạng cung cấp những thông tin nhanh, đa chiều, đồng thời khẳng định vai trò của các nhóm nhỏ, cá nhân khi họ có quyền được nói lên tiếng nói của mình. ""Bên cạnh những mặt tích cực, mạng xã hội là một nơi vô cùng phức tạp. Khi ai cũng có quyền chia sẻ hình ảnh, clip, suy nghĩ của mình mà không cần quan tâm người khác nghĩ gì, dễ gây ra những lẫn lộn giữa xấu - tốt, đúng - sai,… Trong đó có không ít những điều tiêu cực dẫn dắt dư luận, tạo một xu hướng xấu hoặc làm người ta tốn nhiều thời gian, tiền bạc.."", ông Linh chia sẻ góc nhìn. Theo TS Linh, thay vì lao động sản xuất, có một bộ phận suốt ngày lên mạng, theo dõi những nội dung tiêu cực. ""Các bạn trẻ, vị thành niên, thanh niên chưa hoàn thiện về mặt nhận thức nên khi tham gia mạng xã hội với tư thế học hỏi thì nguy cơ học những cái xấu rất nhanh, rất dễ"", ông nói. Vì sao việc khoe khoang tiền bạc, vàng, cuộc sống thượng lưu… được xem là một nội dung xấu độc? Đại diện Viện Nghiên cứu Thanh niên Việt Nam cho rằng đồng tiền quan trọng nhưng nó không phải là thước đo cho tất cả sự lao động, cống hiến… hay giá trị nhân văn của con người. Ông Đặng Vũ Cảnh Linh chia sẻ, việc một số người cứ thích khoe của, khoe tiền, khoe vàng... dễ khiến một bộ phận thấy đồng tiền quá ý nghĩa và họ có thể bất chấp tất cả để có được nhiều tiền, để được giàu có. Vô hình trung tạo ra sự phân hóa trong xã hội, giữa người giàu - người nghèo, không mang lại những giá trị tích cực và nhân văn trong xã hội. ""Nhất là hiện nay, có nhiều người lên mạng khoe vàng, tiền, tài sản… nhưng chưa chắc do họ làm ra. Một số thanh niên nhờ vào tiền của bố mẹ, hoặc làm ăn phi pháp…  Điều đó làm ảnh hưởng tới những thanh niên cùng lứa tuổi - những người đang ngày đêm học tập, lao động vất vả để tìm chỗ đứng trong xã hội"", ông nói thêm.",31/05/2024 17:19 GMT+7,https://tuoitre.vn/nguoi-viet-khoe-vang-tien-tren-mang-xau-hay-tot-20240531164120423.htm,"Nhiều người lên mạng khoe tiền, khoe vàng, khoe sự giàu có. Việc này là tốt hay xấu?"
Lễ hội Vì hòa bình lần đầu tiên được tổ chức tại Quảng Trị,"Đây cũng là lần đầu tiên lễ hội mang thông điệp hòa bình, tri ân các anh hùng liệt sĩ, tưởng niệm các nạn nhân chiến tranh tổ chức tại Việt Nam. Lễ hội Vì hòa bình được tổ chức đúng vào dịp kỷ niệm 70 năm ngày ký kết Hiệp định Giơnevơ về đình chỉ chiến tranh, lập lại hòa bình Đông Dương (20-7-1954 - 20-7-2024), 77 năm Ngày Thương binh - Liệt sĩ (27-7-1947 - 2-7-2024). Xây dựng Quảng Trị thành điểm đến vì hòa bình Ông Võ Văn Hưng - chủ tịch UBND tỉnh Quảng Trị - tại buổi họp báo về lễ hội ngày 31-5 tại Hà Nội cho biết Quảng Trị đã ấp ủ tổ chức lễ hội này từ 5 năm trước và vừa được Thủ tướng Chính phủ phê duyệt. Ban tổ chức kỳ vọng lễ hội sẽ góp phần nâng cao vị thế, hình ảnh của đất nước, con người Việt Nam; xây dựng Quảng Trị trở thành một không gian văn hóa vì hòa bình, là điểm đến vì hòa bình, nơi hội ngộ của bạn bè bốn phương yêu chuộng hòa bình. Đặc biệt, trong bối cảnh thế giới hiện nay đang còn có những điểm xung đột, Lễ hội Vì hòa bình được tổ chức trên vùng đất Quảng Trị từng nhiều đau thương, hủy diệt bởi chiến tranh, nơi “đất thiêng nở đóa hoa hòa bình” sẽ truyền đi thông điệp về sức sống mãnh liệt của dân tộc Việt Nam yêu chuộng hòa bình, kêu gọi nhân loại chung tay xây dựng nền hòa bình bền vững trên thế giới. Tại buổi họp báo, ông Hà Kim Ngọc - thứ trưởng Bộ Ngoại giao - cho biết tổng giám đốc Quỹ Văn hóa, Khoa học UNESCO rất hoan nghênh việc tổ chức Lễ hội Vì hòa bình của Việt Nam. Dù bận công tác không thể sắp xếp tham gia lễ hội nhưng bà sẽ có Thông điệp hòa bình gửi tới lễ hội. Thông điệp của bà sẽ được đọc trong lễ khai mạc tối 6-7 tại Di tích quốc gia đặc biệt Đôi bờ Hiền Lương - Bến Hải. Lễ khai mạc là một chương trình nghệ thuật đặc biệt mang chủ đề “Kết nối những nhịp cầu” với gần 1.000 nghệ sĩ, diễn viên tham gia. Đêm nhạc Trịnh Công Sơn “Khúc ca hòa bình” và những hoạt động khác Sau khai mạc là nhiều hoạt động văn hóa, âm nhạc, thể thao, giải trí như: Lễ hội văn hóa - ẩm thực “Hương vị miền hoa nắng” từ ngày 12 đến 14-7 tại khu du lịch biển Cửa Việt, huyện Gio Linh, tỉnh Quảng Trị. Đêm nhạc Trịnh Công Sơn “Khúc ca hòa bình” vào 20h ngày 13-7 tại công viên Fidel, thành phố Đông Hà, tỉnh Quảng Trị. Chương trình giao lưu âm nhạc quốc tế “Giai điệu hòa bình” vào 20h ngày 20-7, tại Trung tâm Văn hóa - Điện ảnh tỉnh Quảng Trị, thành phố Đông Hà, tỉnh Quảng Trị, với sự tham gia của các nghệ sĩ quốc tế và Việt Nam. Chương trình “Ước nguyện hòa bình” vào 18h ngày 26-7 tại thị xã Quảng Trị, tỉnh Quảng Trị, với nhiều hoạt động ý nghĩa như lễ viếng các anh hùng liệt sĩ tại Thành cổ Quảng Trị, đại lễ cầu siêu tại quảng trường Giải Phóng, lễ hoa đăng tại bờ Nam sông Thạch Hãn.",31/05/2024 16:13 GMT+7,https://tuoitre.vn/le-hoi-vi-hoa-binh-lan-dau-tien-duoc-to-chuc-tai-quang-tri-20240531151838788.htm,"Lần đầu tiên, tỉnh Quảng Trị sẽ tổ chức Lễ hội Vì hòa bình năm 2024 với chủ đề 'Chung tay kiến tạo thế giới hòa bình' vào tháng 7 tới với quy mô quốc gia và quốc tế."
Thi ảnh Chim - Thú hoang dã Việt Nam không nhận ảnh làm tổn hại đời sống thiên nhiên hoang dã,"Cuộc thi ảnh Chim - Thú hoang dã Việt Nam do Tổ chức Bảo tồn chim quốc tế (BirdLife International), Công ty Hoang Dã (Wildtour) và Câu lạc bộ Nhiếp ảnh thiên nhiên hoang dã Việt Nam (VWPC) phối hợp tổ chức. Thi ảnh Chim - Thú hoang dã Việt Nam mùa 2 Cuộc thi dành cho các nhà nhiếp ảnh chuyên nghiệp và không chuyên, người yêu thích nhiếp ảnh trong và ngoài nước. Tuy nhiên, ảnh phải được chụp trên lãnh thổ Việt Nam. Ông Nguyễn Hoài Bảo - chủ tịch hội đồng giám khảo, đại diện ban tổ chức - cho biết cuộc thi này được tổ chức lần thứ hai, với nhiều điểm mới. ""Năm nay, ban tổ chức mở rộng đối tượng chụp ảnh, không chỉ chụp ảnh chim mà tác giả có thể gửi ảnh chụp thú; không giới hạn thời điểm chụp ảnh nên những bức ảnh được chụp vài chục năm trước cũng có thể được tham gia dự thi. Ngoài ra, thông qua cuộc thi này, ban tổ chức mong muốn các nhiếp ảnh gia, người dân hiểu thêm về thực trạng của các loài chim, thú hoang dã; những chính sách, nghị định về bảo vệ động vật hoang dã của nước ta"" - ông Nguyễn Hoài Bảo nói với Tuổi Trẻ Online. Tác phẩm dự thi ghi lại hình dáng, khoảnh khắc đẹp của tất cả các loài chim, thú hoang dã đang sinh sống trong môi trường tự nhiên, khuyến khích gửi ảnh những loài được pháp luật bảo vệ (nghị định 84/2021/NĐ-CP về quản lý thực vật rừng, động vật rừng nguy cấp, quý, hiếm và thực thi Công ước về buôn bán quốc tế các loài động vật, thực vật hoang dã nguy cấp) nhằm tuyên truyền, bảo vệ động vật hoang dã. Đặc biệt, ban tổ chức không chấp nhận những bức ảnh làm tác động tổn hại đến đời sống thiên nhiên hoang dã của chim, thú hoang dã khi chụp ảnh. Giám khảo tên tuổi Ban giám khảo là các nhiếp ảnh gia tên tuổi và các chuyên gia về động vật, bảo tồn thiên nhiên hoang dã như: ông Nguyễn Hoài Bảo (chủ tịch hội đồng giám khảo), bà Nguyễn Hồng Nga (phó chủ tịch Hội Nhiếp ảnh TP.HCM), ông Hoàng Thế Nhiệm, ông Bùi Trọng Hiếu, ông Đặng Ngọc Sâm Thương (phó chủ nhiệm Câu lạc bộ Nhiếp ảnh thiên nhiên hoang dã Việt Nam), ông Yong Ding Li, ông Lê Khắc Quyết. Dự kiến thời gian nhận ảnh dự thi từ 15-7 đến 30-8. Thời gian công bố kết quả ảnh triển lãm dự kiến giữa tháng 10-2024.",31/05/2024 15:18 GMT+7,https://tuoitre.vn/thi-anh-chim-thu-hoang-da-viet-nam-khong-nhan-anh-lam-ton-hai-doi-song-thien-nhien-hoang-da-20240531142703992.htm,"Ban tổ chức cuộc thi ảnh 'Chim - Thú hoang dã Việt Nam' không nhận những ảnh dự thi làm tổn hại đến đời sống thiên nhiên của chim, thú hoang dã và không giới hạn thời gian chụp ảnh."
