Title,Content,Date,Url,Summary
Roland Garros 2024: Sự hồi sinh của Dimitrov,"Đây là thành tích tốt nhất của Dimitrov tại một giải Grand Slam trên sân đất nện. Từng có thời gian Grigor Dimitrov được xem là thần đồng mới của làng quần vợt. Anh đến từ Bulgaria - một đất nước ít có truyền thống quần vợt và chưa từng có VĐV được vinh danh là huyền thoại nhờ lọt vào tốp đầu thế giới.  Cho đến khi Dimitrov xuất hiện, anh thay đổi hình ảnh quần vợt của Bulgaria với lối chơi hào hoa nhưng mạnh mẽ. Đỉnh cao trong sự nghiệp Dimitrov đến lúc này chính là chức vô địch ATP Finals 2017. Tay vợt người Bulgaria để lại hình ảnh biểu tượng khi giơ cao chiếc cúp chỉ với một tay. Cũng trong năm đó, anh vươn lên hạng 3 thế giới - thứ hạng cao nhất trong sự nghiệp. Nhưng rồi đó cũng là lần hiếm hoi người ta nhớ đến Dimitrov vì yếu tố chuyên môn. Còn lại, hình ảnh của anh thường dính chặt với những câu chuyện hậu trường. Từ bé, anh đã bị trêu chọc bằng biệt danh ""baby Fed"" (nghĩa là em bé Federer). Trong một cuộc trả lời phỏng vấn vào năm 2021, Dimitrov từng chia sẻ anh chán ghét biệt danh này dù được so sánh với một trong những huyền thoại của làng quần vợt thế giới. Anh khẳng định mình rất tôn trọng và xem Federer như người hùng. Nhưng lối đánh giữa hai người hoàn toàn khác nhau. Và khi anh không thể vươn tầm lên số 1 thế giới và cũng chưa từng vô địch Grand Slam, giới truyền thông lại càng có dịp ví von anh như một ""em bé Federer"" vì mãi không thể lớn, không thể tiến bộ.  Một chuyện hậu trường khác khiến dư luận liên tục soi mói là quãng thời gian anh hẹn hò với Serena Williams. Rất lâu sau khi cặp đôi này chia tay, nhiều tờ báo lá cải vẫn đào lại những câu chuyện giữa hai người. Chấn thương cũng khiến sự nghiệp của Dimitrov dang dở. Từ chỗ từng nằm trong top 3 thế giới, Dimitrov trượt dài và bị lãng quên. Nhưng từ cuối năm ngoái đến thời điểm này, Dimitrov đánh dấu sự hồi sinh ngoạn mục ở độ tuổi xế chiều của sự nghiệp. Anh giành nhiều chiến thắng ấn tượng để âm thầm trở lại top 10 thế giới. Rồi tại Giải Brisbane International diễn ra hồi tháng 1, Dimitrov lại có dịp thể hiện màn nâng cúp một tay ấn tượng khi giành chức vô địch. Anh nối dài chuỗi phong độ ấn tượng và việc lần đầu vào đến tứ kết Roland Garros là thành quả xứng đáng của Dimitrov.  ""Tôi luôn ao ước được thi đấu từ tứ kết của giải này, bởi Roland Garros là giải Grand Slam luôn khiến tôi chùn bước. Nhưng sau 15 năm, tôi đã vượt qua thử thách và tôi hạnh phúc vì điều đó"", Dimitrov chia sẻ.",04/06/2024 14:19 GMT+7,https://tuoitre.vn/roland-garros-2024-su-hoi-sinh-cua-dimitrov-2024060409063998.htm,"Ở tuổi 33, tay vợt Grigor Dimitrov đang sống lại quãng thời gian đỉnh cao trong sự nghiệp quần vợt. Tại Roland Garros 2024 đang diễn ra, Dimitrov đã giành vé vào vòng tứ kết gặp Jannik Sinner."
"Thua chóng vánh, Thùy Linh lại bị loại từ vòng 1 Indonesia Open","Indonesia Open là giải Super 1000, cấp độ cao nhất trong hệ thống World Tour của Liên đoàn Cầu lông thế giới (BWF). Do đó, giải đấu này quy tụ gần như đầy đủ những tay vợt hàng đầu. Việc Nguyễn Thùy Linh phải đối mặt với khó khăn cũng là điều dễ hiểu. Tuy nhiên, cách cô để thua Kirsty Gilmour khiến người hâm mộ không thể không thất vọng. Tay vợt người Scotland đang đứng hạng 22 thế giới, chỉ trên Thùy Linh 1 bậc. Tuy nhiên, diễn biến trận đấu cho thấy đẳng cấp của hai tay vợt phải xa hơn như thế. Ngay tại ván 1, Thùy Linh đã nhiều lần tự mắc sai lầm và để bị dẫn tới 0-5. Việc xuất phát không tốt khiến cô gái của Việt Nam khó bám đuổi. Tâm lý của Nguyễn Thùy Linh cũng bị ảnh hưởng nặng nề. Gilmour đã tận dụng thời cơ để đào sâu cách biệt và giành thắng lợi 21-10. Ở ván 2, Thùy Linh có một vài sự cải thiện nhưng không đáng kể. Lối đánh của cô vẫn dễ bị bắt bài và thiếu tính đột biến. Ngược lại, đối phương vẫn duy trì được trạng thái hưng phấn. Không có thời điểm nào mà Thùy Linh đuổi kịp được Gilmour. Tay vợt người Scotland sớm kết thúc trận đấu bằng tỉ số 21-18 ở ván 2. Toàn bộ trận đấu chỉ kéo dài vỏn vẹn 35 phút. Đây là giải đấu quốc tế thứ 3 liên tiếp mà Thùy Linh bị loại ngay từ vòng 1. Trước Indonesia Open, cô cũng phải nhận kết quả tương tự tại Malaysia Masters và Singapore Open nhưng là trước những đối thủ có thứ hạng thấp hơn. Phong độ đáng báo động thời gian qua của ""hot girl"" cầu lông Việt Nam khiến người hâm mộ lo lắng khi Olympic Paris 2024 đang đến gần.",04/06/2024 13:31 GMT+7,https://tuoitre.vn/thua-chong-vanh-thuy-linh-lai-bi-loai-tu-vong-1-indonesia-open-20240604123439113.htm,Tay vợt cầu lông Nguyễn Thùy Linh chưa thể cải thiện phong độ khi để thua Kirsty Gilmour tại vòng 1 Giải Indonesia Open ngày 4-6.
Vòng loại World Cup 2026: Cơ hội cho Đinh Thanh Bình,"Trước khi lên tuyển, Thanh Bình ghi 4 bàn trong 6 trận gần nhất ở V-League 2023-2024. Con số này hơn hai chân sút Phạm Tuấn Hải (3 bàn) hay Tiến Linh (2 bàn) với cùng số trận. Phong độ ấn tượng Khi danh sách đội tuyển Việt Nam chuẩn bị cho hai trận cuối cùng vòng loại thứ 2 World Cup 2026 với Philippines (ngày 6-6) và Iraq (12-6) được HLV Kim Sang Sik công bố trước vòng 22, dư luận đã nói nhiều về sự bất hợp lý ở hàng công. Trong đó, rõ nhất là trường hợp của Nguyễn Văn Tùng - chân sút ít được thi đấu ở CLB Hà Nội và chưa có bàn thắng nào lại có tên. Trong khi đó, Đinh Thanh Bình lại đang thể hiện phong độ ấn tượng trong màu áo CLB LPBank Hoàng Anh Gia Lai (HAGL). Anh ghi 4 bàn trong 6 trận, đa phần đều là bàn thắng đem về điểm số quan trọng cho HAGL. Và mới nhất là giúp CLB HAGL có 1 điểm trên sân nhà trước Thanh Hóa. Đáng nói hơn, chân sút 26 tuổi này chỉ mới trở lại thi đấu sau khi phải nghỉ 4 tháng vì bị tổn thương dây chằng gối trái, phải sang Singapore thăm khám. Không chỉ thể hiện phong độ tốt, 4 bàn thắng đều cho thấy khả năng ""đánh hơi"" và dứt điểm tốt ở mọi vị trí của Đinh Thanh Bình. Ở bàn thắng vào lưới Sông Lam Nghệ An, anh nhanh chân sút bóng trong tình huống lộn xộn trong vòng cấm từ tình huống đá phạt góc. Trong bàn thắng ở trận gặp Hồng Lĩnh Hà Tĩnh, anh lao vào đánh đầu bồi cận thành sau cú đánh đầu đầu tiên của Jairo bị thủ môn đẩy ra.  Ở bàn thắng vào lưới CLB TP.HCM, có bóng trong vòng cấm ở tình huống đá phạt, anh bình tĩnh khống chế bóng một nhịp rồi dứt điểm hạ thủ môn Patrik Lê Giang. Còn trong bàn thắng ở trận gặp CLB Thanh Hóa, anh di chuyển thông minh đón đường chọc khe của Minh Vương rồi sút chéo góc. Cơ hội thể hiện với HLV Kim Sang Sik HLV Kim Sang Sik chỉ xem Đinh Thanh Bình đá đúng một trận ở vòng 16, khi CLB HAGL gặp chủ nhà Thể Công Viettel. Trận này Thanh Bình chơi xông xáo, nhưng nhận một thẻ vàng trước khi được thay ra ở phút 59. Và điều này khiến HLV Kim Sang Sik không có nhiều ấn tượng với Thanh Bình. Ngay cả khi tiền đạo Văn Tùng bất ngờ chấn thương buộc phải bổ sung nhân sự, ông Kim cũng dự định gọi Nhâm Mạnh Dũng để thay thế khi có đến 5 trận theo dõi CLB Thể Công - Viettel thi đấu ở V-League 2023-2024.  Nhưng do Nhâm Mạnh Dũng đang không có thể trạng tốt nhất, nên cơ hội mới được trao cho Đinh Thanh Bình. Đây là điều mà Thanh Bình cần phải nỗ lực chứng minh khả năng của mình trên sân tập để có thể lọt vào danh sách 23 cầu thủ chính thức cũng như có cơ hội ra sân ở trận gặp Philippines.  Ngoài Tiến Linh, Đinh Thanh Bình là tiền đạo cắm còn lại của tuyển Việt Nam. Vì vậy, anh có cơ hội để trụ lại nhờ lối chơi xông xáo, không ngại va chạm và chịu khó chạy chỗ. Vấn đề chỉ là liệu chân sút cao 1,77m này có thể hiện được hay không sau khi thất bại dưới thời HLV Park Hang Seo lẫn Philippe Troussier. Cụ thể, Thanh Bình từng được gọi vào tuyển Việt Nam chuẩn bị cho VCK Asian Cup 2019 ở UAE. Nhưng sau đó anh bị ông Park loại.  Ở thời HLV Troussier, anh cũng được gọi vào tuyển Việt Nam vào tháng 6-2023. Khi đó, anh được vào sân đá tiền đạo cắm thay cho Văn Tùng trong hai trận giao hữu thắng Hong Kong và Syria 1-0. Tuy nhiên, do không gây được ấn tượng nên từ đó không còn được triệu tập. Dưới thời HLV Kim Sang Sik, mọi thứ đều đang khá ""bí ẩn"" với giới chuyên môn và người hâm mộ. Với quỹ thời gian ngắn ngủi trong 5 ngày tập trung, HLV Kim Sang Sik nhiều khả năng sẽ ưu tiên bộ khung cũ dưới thời ông Park. Nếu hòa nhập tốt, Thanh Bình là nhân tố bí ẩn mà HLV Kim Sang Sik có thể trình làng cho hai trận ra mắt của mình cùng đội tuyển Việt Nam.",04/06/2024 12:02 GMT+7,https://tuoitre.vn/vong-loai-world-cup-2026-co-hoi-cho-dinh-thanh-binh-20240604090121771.htm,"Được HLV Kim Sang Sik triệu tập bổ sung giờ chót, tiền đạo Đinh Thanh Bình đang có nhiều cơ hội để thể hiện mình trong màu áo tuyển Việt Nam ở vòng loại thứ 2 World Cup 2026."
Djokovic đối diện nguy cơ rút lui khỏi Roland Garros,"Tay vợt người Serbia thắng nhọc nhằn Francisco Cerundolo ở vòng 4 với thời gian 4 giờ 39 phút. Trước đó ở vòng 3, tay vợt người Serbia cũng mất tới 5 set đấu để vượt qua Lorenzo Musetti. Chỉ vỏn vẹn 3 ngày, Djokovic đã trải qua 2 cuộc ""marathon"" nặng đô, khiến cho thể lực và đặc biệt là chấn thương đầu gối của anh ở trong tình trạng khẩn cấp. Djokovic nghi ngờ khả năng tiếp tục thi đấu ở Roland Garros, anh nói: ""Hôm nay tôi đã tự làm mình bị thương. Tôi đã thắng trận đấu, cảm giác thật tuyệt vời. Nhưng tôi không biết bản thân có thể thi đấu ở trận tiếp theo hay không"". Anh cho biết đã phải nhận sự chăm sóc của huấn luyện viên đối với đầu gối bị đau. ""Lúc đó tôi không biết liệu mình có nên tiếp tục hay không vì trận đấu đang diễn ra. Tôi đã dùng thuốc, và sau khi kết thúc ván thứ ba, tôi yêu cầu thêm thuốc. Đó là liều lượng tối đa"", Djokovic chia sẻ sau trận. Bên cạnh việc bị chấn thương hoành hành, Djokovic cũng chỉ trích sân đất nện quá trơn trượt, khiến anh phải trượt ngã nhiều lần trong trận đấu: ""Chấn thương đầu gối của tôi hôm nay xảy ra chính xác bởi vì điều đó, vì tôi đã trượt ngã rất nhiều"". Djokovic yêu cầu ban tổ chức giải đấu phải chú ý hơn đến việc bảo dưỡng sân. Đối thủ của tay vợt Serbia ở trận tứ kết là hạt giống số 7 Casper Ruud. Trận tứ kết này tái hiện cuộc gặp gỡ giữa hai tay vợt ở trận chung kết Roland Garros 2023. Theo Reuters, hiện tại Djokovic đang chờ kết quả kiểm tra y tế để xác định mức độ nghiêm trọng của chấn thương.  Novak Djokovic có thể tiếp tục hành trình bảo vệ danh hiệu Pháp mở rộng hay không vẫn là một dấu hỏi lớn. Nếu anh không thể thi đấu sẽ là điều vô cùng tiếc nuối, cú sốc lớn cho người hâm mộ ở Roland Garros 2024.",04/06/2024 11:55 GMT+7,https://tuoitre.vn/djokovic-doi-dien-nguy-co-rut-lui-khoi-roland-garros-20240604111144779.htm,"Novak Djokovic bỏ ngỏ khả năng thi đấu tứ kết Roland Garros 2024, bởi chấn thương đầu gối sau trận đấu với Francisco Cerundolo vào rạng sáng 4-6."
Tuyển Đức bị chê thậm tệ vì sút 24 quả không ghi được bàn nào,"Đội tuyển Đức đã phung phí cơ hội một cách khó tin, khiến người hâm mộ thất vọng và giới chuyên môn phải đặt dấu hỏi về khả năng của họ tại Euro 2024 sắp tới. Ngay từ những phút đầu tiên, Đức đã thể hiện rõ quyết tâm giành chiến thắng. Họ tung ra đội hình gồm những ngôi sao hàng đầu như Gundogan, Kimmich, Musiala, Havertz và Neuer đã kiểm soát hoàn toàn thế trận, tạo ra vô số cơ hội nguy hiểm. Tuy nhiên, hàng công của Đức lại thi đấu thiếu hiệu quả một cách đáng ngạc nhiên. ""Những cỗ xe tăng"" sút tổng cộng 24 quả, trong đó có 7 lần dứt điểm trúng đích, nhưng không thể xuyên thủng mành lưới Ukraine. Thủ môn Trubin của Ukraine đã thi đấu xuất sắc, cản phá mọi cú sút nguy hiểm của các chân sút Đức. ""Đây là một màn trình diễn đáng thất vọng của đội tuyển Đức. Họ có đủ cơ hội để giành chiến thắng nhưng lại thiếu hiệu quả trong khâu dứt điểm. Tôi không biết liệu họ có thể ghi bàn trong những trận đấu chính thức tại Euro 2024 hay không"", bình luận viên người Đức Lothar Matthaus và là cựu danh thủ nhận xét. Trên mạng xã hội, người hâm mộ Die Mannschaft cũng tỏ ra vô cùng thất vọng với màn trình diễn của đội nhà. Nhiều người cho rằng đội tuyển Đức đã đánh mất đi sự tự tin và hiệu quả vốn có. ""Họ chơi bóng như thể đang sợ hãi vậy"", một người bình luận trên X. ""Tôi không hiểu chuyện gì đang xảy ra với hàng công của tuyển Đức. Họ sút bóng như thể những gã tay mơ"", một người hâm mộ khác bày tỏ sự thất vọng. ""Tuyển Đức ngày nay chẳng có chân sút nào ra hồn"", một tài khoản khác nhận định. Kết quả hòa này đã gióng lên hồi chuông cảnh báo cho đội tuyển Đức. Họ cần phải cải thiện khả năng ghi bàn nếu muốn lên ngôi vô địch Euro 2024. Tuyển Đức sẽ còn một trận giao hữu cuối cùng với Hy Lạp vào cuối tuần, trước khi bước vào chiến dịch Euro trên sân nhà. Tin vui là chân sút Fullkrug có thể sẽ ra sân ở trận này. Tiền đạo của Dortmund lên tuyển muộn vì phải đá chung kết Champions League. Anh được xem là tiền đạo số 1 của Đức hiện nay.",04/06/2024 10:48 GMT+7,https://tuoitre.vn/tuyen-duc-bi-che-tham-te-vi-sut-24-qua-ko-ghi-duoc-ban-nao-2024060409473349.htm,"Tung ra đội hình mạnh và áp đảo hoàn toàn đối thủ, nhưng chủ nhà Euro 2024 Đức vẫn bị Ukraine cầm hòa ở trận giao hữu rạng sáng 4-6 (giờ Việt Nam)."
Euro 2024: Đừng xem thường những đội 'hạt tiêu',"Năm 2016, UEFA cách tân Euro khi mở rộng số đội bóng từ 16 lên 24. Kể từ đó, người hâm mộ dần quen với việc những nền bóng đá nằm ngoài top 50 thế giới (theo bảng xếp hạng FIFA) hiện diện tại Euro. Những siêu sao bằng cả đội bóng Nhưng ngay ở giải đấu phiên bản mới đầu tiên, Xứ Wales đã cho người hâm mộ cả thế giới thấy rằng những đội bóng ""hạt tiêu"" ở Euro vẫn có thể làm nên bất ngờ, thậm chí là sở hữu các siêu sao làm điên đảo những đối thủ hàng đầu. Sau 8 năm, các nền bóng đá trung bình của châu Âu đang ngày càng sở hữu nhiều ngôi sao hơn. Theo định giá của Transfermarkt, nhiều cầu thủ thậm chí có giá trị ngang ngửa với toàn đội cộng lại. Nổi bật là Benjamin Sesko - chân sút 21 tuổi của tuyển Slovenia. Transfermarkt định giá toàn đội Slovenia (danh sách sơ bộ đến 30 người) chỉ 149 triệu euro, xếp thứ 22/24 đội dự Euro 2024. Nhưng mỗi Sesko đã có giá trị 50 triệu euro. Tiền đạo của Leipzig đã có một mùa giải thành công khi ghi được 18 bàn, trở thành đối tượng được nhiều CLB lớn như Arsenal theo đuổi. Không chỉ vậy, Sesko còn thể hiện duyên làm bàn đáng nể trong màu áo tuyển quốc gia khi ghi 4 bàn ở giai đoạn vòng loại, góp công lớn giúp Slovenia giành vé dự Euro 2024.  Cầu thủ đắt giá thứ hai của Slovenia là thủ thành Jan Oblak - người luôn được xếp vào nhóm những thủ thành xuất sắc nhất thế giới. Dù đã 31 tuổi, Oblak vẫn được Transfermarkt định giá 30 triệu euro. Gruzia, đội tuyển lần đầu tiên xuất hiện ở một giải đấu lớn, cũng mang đến Euro 2024 hai ngôi sao chia đều cho mặt trận tấn công và phòng ngự. Đó là Kvaratskhelia (siêu sao trị giá 80 triệu euro của Napoli) và thủ thành Mamardashvili (Valencia) - người có giá 35 triệu euro. Hai siêu sao này cũng gần như là hai cầu thủ Gruzia được người hâm mộ toàn cầu biết đến. Với Hungary, quá dễ dàng để điểm mặt cái tên số 1 của họ: tiền vệ trị giá 75 triệu euro Szoboszlai - hiện đang khoác áo Liverpool. Với ngoại hình bắt mắt cùng phong cách thi đấu đầy cuốn hút, Szoboszlai hứa hẹn sẽ trở thành một trong những cầu thủ đáng xem nhất Euro 2024. Trung vệ Hancko (35 triệu euro) của Slovakia hay Dragusin (25 triệu euro) của Romania là những trường hợp hiếm hoi khi siêu sao số 1 đội bóng lại là trung vệ. Sẽ không có ""đội bóng lót đường""? Euro tăng lên 24 đội, và số đội giành vé vượt qua vòng bảng tăng từ 8 lên 16 đội. Sức ép cạnh tranh với các đội bóng lớn giảm đi đáng kể. Đồng thời, những đội tuyển yếu hơn lại có thể nuôi hy vọng đi tiếp xuyên suốt 3 trận vòng bảng, gần như không có trường hợp bỏ cuộc sớm ở Euro. Đan Mạch ở Euro 2020 là một ví dụ. Họ thua cả 2 trận đấu đầu tiên nhưng đã đứng dậy một cách thần kỳ bằng chiến thắng 4-1 trước Nga ở vòng đấu cuối cùng. Sau đó, Đan Mạch tiến một mạch vào tận bán kết, trở thành một trong những đội bóng được cổ vũ nhiều nhất Euro 2020.  Trên đất Đức mùa hè năm nay, Albania là đội bóng kém may mắn nhất khi rơi vào bảng đấu có Tây Ban Nha, Ý và Croatia. Nhưng sự phập phù của Ý và Tây Ban Nha mang đến nhiều hy vọng cho Albania.  Dù không có siêu sao quá nổi bật nào, họ vẫn có Asllani, Broja, Djimsiti - những cầu thủ dày dạn kinh nghiệm ở các giải đấu lớn. Đặc biệt đội trưởng Djimsiti là trụ cột giúp Atalanta vô địch Europa League mùa này. Không chỉ hứa hẹn gây bất ngờ, các đội bóng ""hạt tiêu"" ở Euro 2024 còn hứa hẹn chơi tưng bừng. Thành tích vòng bảng nói lên điều đó, khi cả Albania, Hungary và Romania đều đứng đầu bảng đầy ấn tượng. Hungary, Slovenia và Slovakia thậm chí còn lựa chọn lối chơi đẹp mắt.",04/06/2024 09:39 GMT+7,https://tuoitre.vn/euro-2024-dung-xem-thuong-nhung-doi-hat-tieu-20240604091004918.htm,"Hungary, Albania, Slovenia, Gruzia… là những đội tuyển bị đánh giá thấp bậc nhất Euro 2024. Dù vậy, họ vẫn sở hữu những cái tên giàu sức hút."
Vì sao người Việt thường học bơi ếch trước bơi sải?,"Nên chọn học bơi ếch hay bơi sải là thắc mắc cực kỳ phổ biến của những người mới bắt đầu học bơi. Chọn học bơi ếch vì quen… ngồi xổm Có một quan điểm thường được nhắc đến là ""học bơi ếch dễ hơn học bơi sải"". Hầu như khi đi học bơi, mọi người thường sẽ được HLV tư vấn nên học bơi ếch trước. Khi bơi ếch được rồi mới chuyển qua học bơi sải. Dưới phương diện ""sự thật"" thì chưa hẳn đúng. Nhưng dưới góc nhìn địa phương thì thật sự người Việt bắt đầu học bơi ếch dễ hơn. Đơn giản vì... người Việt mình có thể ngồi xổm, ngồi xổm được từ nhỏ, và còn sử dụng động tác này trong sinh hoạt hằng ngày. Động tác bơi ếch cổ điển lại rất tương tự với dáng chân ngồi xổm - thành ra người Việt học bơi ếch sẽ cảm thấy gần gũi, dễ làm hơn. Ở một số quốc gia khác trên thế giới, họ hiếm khi ngồi xổm nên khi mới xuống hồ, học bơi ếch hay bơi sải đều là những động tác mới hoàn toàn với họ. Nếu mục tiêu của bạn đơn giản là học bơi để rớt xuống nước không bị chìm, có thể di chuyển được dưới nước, thể dục nhẹ nhàng, vui vẻ, chỉ cần bơi hồ thì bơi ếch là đủ. Học bơi ếch cổ điển xong, học thêm cả bơi ếch hiện đại nếu có thời gian cũng được. Bơi ếch hiện đại là kiểu bơi không quá phổ biển trong giới bơi lội phong trào, đủ làm cho bạn thật ngầu trong hồ bơi đông người. Bơi sải sẽ phát triển lâu dài Riêng đối với người quan tâm đến việc bơi đường dài, bơi biển, chơi aquathlon (2 môn phối hợp), triathlon (3 môn phối hợp) thì chắc chắn nên học thêm bơi sải. Ai chưa biết thì bắt đầu học 3-6 tháng trước ngày dự giải. Nếu chỉ bơi ếch, mình có thể hoàn thành các giải đấu nhiều môn phối hợp không? Vẫn được chứ. Nhưng nếu bơi sải, bạn có thể vừa bơi dài hơn với cùng một lượng sức, vừa có thể lên bờ trong sự tỉnh táo, đủ sức để ""bung"" ở phần đạp và chạy. Trong bơi lội chuyên nghiệp, cự ly dài nhất của bơi ếch/ngửa/bướm là 200m, nhưng riêng bơi sải (freestyle - nội dung tự do) cự ly dài nhất là 1.500m. Đây là quy định cự ly thi đấu bơi lội chuyên nghiệp đang áp dụng trên toàn thế giới và là một ví dụ rất điển hình để chứng minh rằng bơi sải là kiểu bơi lý tưởng nhất dành cho bơi đường dài.  Bên cạnh đó, đối với bơi ếch, phát lực chủ yếu là từ chân. So với bơi sải, phát lực chủ yếu là từ tay. Đối với aquathlon hay triathlon, lực chân của mọi người nên dành để đạp và chạy, chứ bơi sải chân nhiều rồi lên bờ chạy chậm hơn, đạp chậm hơn, thành tích hoàn thành sẽ bị kéo dài ra rất nhiều. Nếu bơi sải, trong tương lai nhiều năm nữa khi mọi người bắt đầu quan tâm tới việc rút ngắn thời gian, mình sẽ rút ngắn được bằng việc tăng lực tay sải, giảm lực đạp chân. Với bơi ếch thì rất khó. Đương nhiên đổi lại, thời gian học bơi sải cũng sẽ lâu hơn, khó phối hợp tay chân hơn. Quan trọng nhất, bạn phải xác định mục tiêu chính xác từ đầu. Học bơi để phục vụ mục tiêu gì, rèn luyện sức khỏe thông thường hay tham dự các cuộc thi phong trào.",04/06/2024 07:53 GMT+7,https://tuoitre.vn/vi-sao-nguoi-viet-thuong-hoc-boi-ech-truoc-boi-sai-20240601175155802.htm,"Cựu kình ngư nổi tiếng từng giành 2 HCV SEA Games, nay là vận động viên 3 môn phối hợp Lâm Quang Nhật đưa ra quan điểm thú vị về việc nên chọn kiểu bơi gì khi mới bắt đầu học bơi."
