Title,Content,Date,Url,Summary
Giá hồ tiêu tăng cao và có khả năng lên nữa,"Chưa đầy một tháng qua, giá hồ tiêu trong nước đã tăng từ 100.000 đồng/kg lên trên 140.000 đồng/kg. Doanh nghiệp nhận định giá tiêu sẽ tiếp tục đà tăng và có khả năng quay lại đỉnh lịch sử 220.000 đồng/kg đã thiết lập năm 2015. Giá hồ tiêu tăng vọt trong thời gian ngắn Theo ghi nhận của Tuổi Trẻ Online, ngày 5-6 giá hồ tiêu thu mua ở các vùng trọng điểm như Tây Nguyên, Đông Nam Bộ đang dao động ở mức 142.000 đồng/kg. Đà tăng giá của hồ tiêu rất nhanh. Giữa tháng 5-2024, giá hồ tiêu loanh quanh mốc 100.000 đồng/kg, nhưng chỉ khoảng 20 ngày sau đã vọt lên 142.000 đồng/kg. Đây được coi là mức giá rất cao trong nhiều năm trở lại đây. Nhìn rộng ra, nếu so với thời điểm đầu năm 2023, giá hồ tiêu 55.000 đồng/kg, thì hiện nay giá đã tăng gần gấp 3 lần. Dù giá tiêu đang trên đà tăng, rất ít nông dân Tây Nguyên lao vào trồng mới, họ chỉ trồng thăm dò diện tích nhỏ, trồng thay thế cây chết. Từng có 2.000 gốc tiêu nhưng bỏ vườn vì thua lỗ và dịch bệnh, hai năm gần đây ông Lê Đình Nguyên (45 tuổi, trú huyện Đak Đoa, tỉnh Gia Lai) mới trồng lại 100 gốc xen trong rẫy cà phê. Theo ông Nguyên, để hấp dẫn người dân quay lại với hồ tiêu, giá phải giữ ổn định ở mức 150.000 đồng/kg. Với mức giá này người trồng tiêu mới đảm bảo có lời để mạnh dạn đầu tư vì hồ tiêu là loại cây cần vốn lớn, dễ bị ảnh hưởng nấm bệnh và thời tiết. Có yếu tố đầu cơ? Trao đổi với Tuổi Trẻ Online, ông Hoàng Phước Bính - phó chủ tịch thường trực Hiệp hội Hồ tiêu Chư Sê, Gia Lai - cho hay giá tiêu tăng nhanh gần đây do tác động của yếu tố đầu cơ. Theo ông, hiện giá thế giới đang tăng, giá nội địa thấp hơn thế giới nên nhiều đại lý nhỏ lẻ đang găm giữ hàng và đẩy giá lên. Ông Bính nói lịch sử trước nay chưa khi nào giá hồ tiêu Brazil cao hơn Việt Nam nhưng vừa qua điều này đã thay đổi. Ông Bính nhận định hồ tiêu đang bước vào chu kỳ tăng giá và sẽ tiếp tục tăng cao bởi cung không đủ cầu. Được biết, đỉnh giá hồ tiêu lập năm 2015 ở mức 220.000 đồng/kg rồi lao xuống đáy còn 34.000 đồng/kg vào năm 2020. Sau chu kỳ 5 năm, giá hồ tiêu đang quay đầu tăng trở lại. Nguyên nhân Việt Nam là nước xuất khẩu hồ tiêu chủ lực, chiếm 60% sản lượng xuất khẩu toàn thế giới nhưng diện tích, sản lượng những năm qua liên tục giảm. Cùng với đó, các nước trồng hồ tiêu hàng đầu như Brazil, Indonesia cũng mất mùa do biến đổi khí hậu.",05/06/2024 11:37 GMT+7,https://tuoitre.vn/gia-ho-tieu-tang-cao-va-co-kha-nang-len-nua-2024060511072448.htm,"Những ngày gần đây, giá hồ tiêu tăng từ 100.000 đồng/kg lên 142.000 đồng/kg. Người trồng tiêu nhận định hồ tiêu đang vào chu kỳ tăng giá mới."
"Đại biểu truy trách nhiệm của kiểm toán trong vụ SCB, hai tư lệnh ngành nói gì?","Theo đại biểu Mai Văn Hải (đoàn Thanh Hóa), vụ việc SCB xảy ra thời gian vừa qua được cử tri và nhân dân đặc biệt quan tâm, theo dõi. Tuy nhiên, thông tin đại chúng cho thấy nhiều công ty kiểm toán thực hiện kiểm toán báo cáo tài chính của SCB nhưng không phát hiện dấu hiệu bất thường tại ngân hàng này. Vì vậy, nhiều cử tri đặt câu hỏi về vai trò và trách nhiệm của kiểm toán. Trách nhiệm của cơ quan kiểm toán là gì? ""Xin Tổng Kiểm toán Nhà nước cho biết vai trò và trách nhiệm của Kiểm toán Nhà nước với các vụ việc như SCB trong thời gian qua"" - đại biểu Hải nêu vấn đề. Trả lời nội dung này, Tổng kiểm toán Ngô Văn Tuấn cho hay Ngân hàng SCB bị truy tố và được xét xử với ba tội danh: thao túng thị trường chứng khoán, chiếm đoạt tài sản, nhận và đưa hối lộ. Vì vậy, ông Tuấn cho rằng công ty này không liên quan, không thuộc đối tượng và phạm vi của Kiểm toán Nhà nước. ""Theo quy định của Luật Kiểm toán độc lập thì đây là công ty đại chúng và SCB thuộc đối tượng bắt buộc phải kiểm toán độc lập. Trách nhiệm này thuộc về các doanh nghiệp kiểm toán độc lập đã cung cấp dịch vụ kiểm toán, báo cáo của SCB” - ông Tuấn nói. Giải trình thêm nội dung này, Bộ trưởng Bộ Tài chính Hồ Đức Phớc cho hay khi kiểm toán về Ngân hàng Nhà nước, Kiểm toán Nhà nước dù không kiểm toán SCB nhưng đã kiến nghị và lưu ý về vấn đề SCB. Về kiểm toán độc lập, ông Phớc cho biết giai đoạn 2012 - 2016, SCB đã thuê công ty kiểm toán nước ngoài là Ernst & Young; giai đoạn 2017 - 2019 thuê Công ty kiểm toán Deloitte của nước ngoài; giai đoạn 2019 - 2022 SCB thuê Công ty kiểm toán KPMG thực hiện. Theo bộ trưởng, quá trình thực hiện kiểm toán này cũng có những vấn đề thiếu sót, sai phạm và những vấn đề mà cơ quan điều tra, cơ quan công tố đã điều tra và xử lý vụ án. ""Thời gian tới với vai trò chức năng, nhiệm vụ và phạm vi công tác được Chính phủ giao và luật định, chúng tôi tiếp tục nâng cao chất lượng kiểm toán độc lập, phục vụ cho các dịch vụ kiểm toán của các cơ quan đơn vị và doanh nghiệp"" - ông Phớc nói. Ba công ty nước ngoài kiểm toán độc lập SCB Bộ trưởng Phớc cũng nói thêm, kiểm toán có hai hệ thống, bao gồm Kiểm toán Nhà nước là cơ quan độc lập do Quốc hội thành lập và thực hiện theo pháp luật. Theo đó, chỗ nào có tài sản và tiền của Nhà nước là có hoạt động kiểm toán. Vì vậy chức năng, nhiệm vụ của Kiểm toán Nhà nước đã được tổng kiểm toán nêu rõ. Kiểm toán Nhà nước có quy trình chặt chẽ và chất lượng tốt, áp dụng công nghệ cao, công nghệ thông tin trong kiểm toán như viễn thám, siêu âm bê tông, áp dụng công nghệ để kiếm toán về hệ thống công nghệ thông tin trong cơ quan nhà nước. ""Với trình độ năng lực của anh em kiểm toán dự án đầu tư xây dựng cơ bản thì đây là một trong những cơ quan hàng đầu về kiểm toán và thanh tra về đầu tư"" - ông Phớc nói. Với kiểm toán độc lập, ông Phớc nói phải thực hiện theo Luật Kiểm toán độc lập, cung cấp dịch vụ kiểm toán cho doanh nghiệp. Các tổ chức cung cấp dịch vụ này là những người hành nghề kiểm toán độc lập, doanh nghiệp kiểm toán độc lập, doanh nghiệp nước ngoài có chi nhánh kiểm toán đặt lại Việt Nam, thực hiện kiểm toán báo cáo tài chính, kiểm toán đầu tư hoặc các công việc mà doanh nghiệp thuê. Theo ông Phớc, kiểm toán độc lập cũng sẽ phối hợp Kiểm toán Nhà nước thông qua hợp đồng và trưng dụng để thực hiện theo yêu cầu của Kiểm toán Nhà nước. Bộ trưởng Bộ Tài chính khẳng định đã thực hiện theo đúng quy định kiểm toán là quản lý chất lượng kiểm toán thông qua ban hành cơ chế chính sách, chiến lược, thanh kiểm tra và giám sát với các tổ chức kiểm toán. Năm 2023 - 2024 thanh kiểm tra 20 doanh nghiệp, đánh giá 11 doanh nghiệp đạt yêu cầu, 7 doanh nghiệp không đạt yêu cầu và 1 doanh nghiệp yếu. Kiểm tra 62 hồ sơ kiểm toán, có 16 hồ sơ đạt yêu cầu, 26 hồ sơ không đạt yêu cầu, 20 hồ sơ yếu kém. Từ đó đình chỉ 7 kiểm toán viên, nhắc nhở 21 kiểm toán viên và phê bình các công ty kiểm toán.",05/06/2024 11:33 GMT+7,https://tuoitre.vn/dai-bieu-truy-trach-nhiem-cua-kiem-toan-trong-vu-scb-hai-tu-lenh-nganh-noi-gi-20240605112018288.htm,"Sáng 5-6, trong phiên chất vấn và trả lời chất vấn của Tổng Kiểm toán Nhà nước Ngô Văn Tuấn, câu hỏi về trách nhiệm của cơ quan Kiểm toán Nhà nước đối với vụ việc SCB được nêu ra."
"Các hãng bay tăng thời gian khai thác máy bay, được khuyến cáo về an toàn bay","Tin từ Cục Hàng không Việt Nam, cơ quan này vừa ra chỉ thị tăng cường biện pháp bảo đảm an toàn hàng không. Do ảnh hưởng của lệnh triệu hồi động cơ PW1100 khiến cho đội tàu bay A321NEO của các hãng hàng không Việt Nam phải tạm dừng khai thác với số lượng lớn (22/45 tàu bay) gây ra tình trạng thiếu tàu bay. Theo Cục Hàng không Việt Nam, để duy trì hoạt động khai thác, các hãng hàng không đã tối ưu hóa nhằm tăng thời gian sử dụng tàu bay để đáp ứng nhu cầu vận chuyển của ngành hàng không Việt Nam. Do vậy, để đảm bảo sử dụng tàu bay hiệu quả, an toàn, Cục Hàng không Việt Nam yêu cầu hãng bay tổ chức bảo dưỡng tàu bay, chuẩn bị đầy đủ vật tư, phụ tùng, thiết bị, dụng cụ phục vụ bảo dưỡng nhằm kịp thời phát hiện và khắc phục triệt để hỏng hóc, đảm bảo tàu bay được đưa vào khai thác ở trạng thái tốt nhất. Ngoài ra, cần đảm bảo thực hiện đầy đủ công tác huấn luyện định kỳ đối với nhân viên hàng không, bổ sung các nội dung đã được nhận diện thông qua hệ thống điều tra an toàn vào nội dung huấn luyện. Đồng thời quán triệt đội ngũ phi công triệt để tuân thủ các chính sách quy định, quy trình khai thác tiêu chuẩn đặc biệt trong điều kiện thời tiết bất lợi, nghiêm túc tuân thủ các quy định tại các chỉ thị an toàn của Cục Hàng không Việt Nam... Trong bối cảnh lực lượng vận tải hàng không giảm, các hãng hàng không Việt Nam đã thực hiện các giải pháp để tăng tải như thay đổi giờ hạ cất cánh, bổ sung nhiều chuyến bay đêm sau 22 giờ. Trước đó, Vietnam Airlines tăng thời gian khai thác đội tàu bay từ 10 giờ/ngày lên 11 giờ/ngày và tiếp tục tăng lên 12 giờ/ngày trong giai đoạn cao điểm; Vietjet tăng từ 12,8 giờ/ngày lên trên 13,2 giờ/ngày và sẽ tiếp tục tăng lên 14 giờ/ngày sau khi thực hiện việc thay đổi slot tại các cảng hàng không, sân bay. Còn hãng hàng không Viettravel Airlines và Bamboo Airways cũng đã thay đổi thời gian khai thác từ 11-12/giờ/ngày lên 12,5 giờ/ngày. Các hãng đang chạy đua tìm kiếm tàu bay trong bối cảnh nguồn lực đội bay suy giảm mạnh từ đầu năm do vấn đề liên quan đến động cơ Pratt & Whitney, cũng như khó khăn của một số doanh nghiệp. Tuy nhiên, thị trường thuê máy bay đang khan hiếmtàu, giá neo cao. Giá thuê máy bay loại thuê ướt (gồm cả phi công, tiếp viên) với giá 3.000 USD một giờ, thì hiện nay tăng đến 4.500 USD một giờ nhưng cũng không thể tìm được tàu.",05/06/2024 10:56 GMT+7,https://tuoitre.vn/cac-hang-bay-tang-thoi-gian-khai-thac-may-bay-duoc-khuyen-cao-ve-an-toan-bay-20240605103550293.htm,"Trong bối cảnh thiếu hụt máy bay, các hãng hàng không tăng thời gian sử dụng máy bay sẵn có để đáp ứng nhu cầu vận chuyển. Cục Hàng không Việt Nam yêu cầu các hãng hàng không nâng cao biện pháp bảo đảm an toàn."
Hà Tĩnh huy động nguồn lực hỗ trợ thi công dự án đường dây 500kV mạch 3,"Thực hiện ý kiến chỉ đạo của Thủ tướng Chính phủ về việc huy động các nguồn lực của địa phương đảm bảo hậu cần và tăng cường hỗ trợ thi công công trình đường dây 500kV mạch 3, Tỉnh Đoàn Hà Tĩnh đã triển khai đợt thi đua cao điểm 30 ngày đêm tình nguyện tham gia đẩy nhanh tiến độ, hoàn thành sớm dự án đường dây 500kV mạch 3 đoạn qua Hà Tĩnh. Gần 700 đoàn viên tham gia 46 tổ xung kích Theo đó, Tỉnh Đoàn Hà Tĩnh thành lập 46 tổ xung kích với sự tham gia của 690 đoàn viên về các địa phương đang thi công đường dây 500kV mạch 3 để tham gia loạt hoạt động tình nguyện chi viện, hỗ trợ cho các đơn vị thi công. Các phần việc đội xung kích thực hiện gồm tham gia hỗ trợ tháo gỡ, di dời tài sản, công trình kiến trúc, phát quang cây cối bàn giao mặt bằng tạo hành lang tuyến. Phối hợp chính quyền địa phương và các lực lượng liên quan đảm bảo an ninh trật tự, an toàn giao thông với những đoạn kéo dây qua các tuyến đường quốc lộ, tuyến đường chính. Tham gia hỗ trợ công tác hậu cần, hỗ trợ công nhân thi công, phối hợp với nhà thầu cung cấp đầu mối, thông tin trong việc mua sắm, thuê máy móc, thiết bị, vật dụng (nếu cần). Đồng thời, tổ chức thăm hỏi, động viên khen thưởng kịp thời các lực lượng đang trực tiếp thi công công trình và các hình thức hỗ trợ khác phù hợp. Anh Nguyễn Hoài Nam - phó bí thư Tỉnh Đoàn Hà Tĩnh, cho biết kế hoạch 30 ngày cao điểm được thực hiện từ ngày 1-6-2024 đến ngày 30-6-2024. Những ngày đầu triển khai đợt cao điểm, Tỉnh Đoàn Hà Tĩnh đã phối hợp với Công ty Điện lực Hà Tĩnh tổ chức khảo sát thực địa hiện trường thi công đường dây 500kV mạch 3 để có cơ sở triển khai các tổ xung kích thực hiện nhiệm vụ một cách hiệu quả nhất. ""Đoàn công tác đã đến động viên các đơn vị thi công, trao đổi, nắm bắt tâm tư, các khó khăn, vướng mắc. Khảo sát, ghi nhận các nội dung, phần việc đoàn viên thanh niên địa phương có thể tham gia hỗ trợ nhà thầu thi công với mục tiêu góp phần sớm hoàn thành dự án đường dây 500KV mạch 3 trước ngày 30-6 theo kế hoạch"" - anh Nam chia sẻ. Hoàn thành giải phóng mặt bằng dự án đường dây 500kV mạch 3 Sáng 5-6, trao đổi với Tuổi Trẻ Online, ông Dương Thanh Hòa - phó giám đốc Sở Công Thương Hà Tĩnh, cho biết dự án đường dây 500kV mạch 3 đoạn Quảng Trạch - Quỳnh Lưu qua Hà Tĩnh dài 141,52km với 285 vị trí móng cột thuộc địa bàn của 9 huyện, thị xã, được khởi công từ tháng 1-2024. Ngày 7-2, tỉnh Hà Tĩnh đã hoàn thành bàn giao 285/285 vị trí móng cột (đạt 100%). Ngày 31-5, địa phương này cũng hoàn thành bàn giao toàn tuyến 284/284 khoảng cột (tương đương với 113/113 khoảng néo). Thời điểm hiện tại, các đơn vị thi công hoàn thành đúc móng 285 vị trí; dựng xong 96/285 vị trí cột, đang dựng 65 vị trí cột; kéo xong 2/113 khoảng néo, đồng thời đang tổ chức kéo dây 2 khoảnh néo. Theo ông Hòa, thời gian qua Hà Tĩnh đã rất quyết liệt, tập trung cao trong công tác lãnh đạo, chỉ đạo giải phóng mặt bằng đường dây 500kV mạch 3 theo chỉ đạo của Thủ tướng Chính phủ. Địa phương đã làm tốt công tác tuyên truyền, tạo được sự đồng thuận cao của nhân dân, góp phần đẩy nhanh tiến độ trong công tác giải phóng mặt bằng, sớm bàn giao cho các đơn vị thi công. Tuy vậy, dự án đường dây 500kV mạch 3 với khối lượng công việc khá lớn, nhiều vị trí móng cột nằm trên đất rừng, việc yêu cầu phải giải phóng mặt bằng nhanh, đồng bộ để kịp thời bàn giao cho đơn vị thi công nên thời gian qua địa phương cũng gặp không ít khó khăn. ""Hiện nay Hà Tĩnh đang chỉ đạo các địa phương có dự án đi qua thực hiện huy động nguồn lực sẵn có, hỗ trợ tối đa, tạo mọi điều kiện để đơn vị thi công tổ chức tốt nhất công tác hậu cần, nơi ăn, chỗ ở, sinh hoạt, đi lại đảm bảo thuận tiện, vệ sinh, an toàn, sức khỏe người lao động, đảm bảo công tác an ninh trật tự"" - ông Hòa nói.",05/06/2024 10:22 GMT+7,https://tuoitre.vn/ha-tinh-huy-dong-nguon-luc-ho-tro-thi-cong-du-an-duong-day-500kv-mach-3-20240605095337801.htm,"Nhằm góp phần đẩy nhanh tiến độ dự án đường dây 500kV mạch 3, Hà Tĩnh yêu cầu các địa phương huy động nguồn lực, tạo điều kiện thuận lợi nhất về hậu cần, ăn ở, sinh hoạt để các đơn vị thi công sớm hoàn thành dự án."
"Giá vàng giảm thêm, nhu cầu mua vẫn cao","Hơn 10h sáng 4-6, Ngân hàng (NH) Nhà nước công bố giá bán vàng cho 4 NH và Công ty SJC là 77,98 triệu đồng/lượng. Giá vàng được 4 NH và Công ty SJC bán ra ở mức 78,98 triệu đồng/lượng, giảm thêm 1 triệu đồng/lượng so với ngày trước đó. Sáng cùng ngày, Công ty SJC treo bảng tạm ngưng giao dịch lúc 10h25 và mở cửa trở lại lúc 13h30. Nhưng từ trước 13h, hàng dài người đã xếp hàng trước giờ mở cửa. Một khách hàng cho hay đã điền thông tin và đặt cọc trước vào buổi sáng nên kiên nhẫn đội nắng, xếp hàng chờ để lấy vàng vào buổi chiều. Sau khi trải qua vòng xếp hàng, vào bên trong sảnh khách hàng sẽ lấy số thứ tự và chờ đến lượt giao dịch. Một khách hàng mua được 2 lượng vàng sau hơn một tiếng chờ đợi. Tuy nhiên, do có quá nhiều khách hàng đến mua vàng, Công ty SJC giới hạn mỗi khách mua được 1 lượng vàng. Chiều cùng ngày, các NH cũng chỉ bán vàng cho những khách hàng đã đăng ký vào buổi sáng hoặc hôm 3-6. Tại Vietcombank chi nhánh TP.HCM (số 5 Công trường Mê Linh, quận 1) lúc 13h30 có rất đông khách hàng xếp hàng tại sảnh để chờ gọi tên. Đây là những khách hàng đã đăng ký mua vàng và thanh toán tiền từ buổi sáng và được hẹn chiều nay đến nhận vàng. Sau khi được gọi tên, khách hàng lên tầng trên ký giấy nhận vàng. Những khách hàng mới đến buổi chiều 4-6 được hẹn lại vào sáng 5-6. Chi nhánh Agribank cũng chủ yếu giao vàng cho những khách hàng đã đăng ký từ trước. Chiều cùng ngày, giá vàng thế giới giảm sâu, còn 2.330 USD/ounce, tương đương 71,5 triệu đồng/lượng theo tỉ giá quy đổi. So với sáng 4-6, giá vàng thế giới đã giảm 21 USD/ounce (khoảng 654.000 đồng/lượng). Các chuyên gia dự báo nếu giá vàng thế giới tiếp tục duy trì đà giảm, giá vàng miếng SJC sẽ tiếp tục giảm trong những ngày tới. Trao đổi với báo chí chiều 4-6, ông Đào Xuân Tuấn, vụ trưởng Vụ Quản lý ngoại hối, NH Nhà nước, cho biết phương án can thiệp thông qua bán vàng cho 4 NH thương mại nhà nước và Công ty SJC bước đầu đã nhận được sự quan tâm, đánh giá tích cực của dư luận. ""Việc thu hẹp chênh lệch giữa giá vàng miếng SJC và giá vàng quốc tế dẫn tới giá bán vàng có thể sẽ còn giảm trong thời gian tới. Vì vậy, người dân cũng cần thận trọng khi mua vàng trong bối cảnh giá vàng thế giới đầy biến động như hiện nay"", ông Tuấn nhấn mạnh. Để cập nhật giá vàng mới nhất, mời bạn truy cập TẠI ĐÂY.",05/06/2024 08:17 GMT+7,https://tuoitre.vn/gia-vang-giam-them-nhu-cau-mua-van-cao-20240604224103494.htm,"Nhiều chuyên gia cho rằng Ngân hàng Nhà nước nên tăng lượng vàng cung ứng mỗi ngày để khách hàng khi có nhu cầu lập tức được đáp ứng ngay, thay vì phải đăng ký và chờ đợi. Một khi số lượng vàng được bán không giới hạn, yếu tố tâm lý sẽ được giải tỏa."
"Philippines thông báo giảm thuế nhập khẩu gạo, Việt Nam hưởng lợi lớn","Theo báo Nikkei Asia, quốc gia nhập khẩu gạo hàng đầu thế giới Philippines đang tiến hành cắt giảm thuế nhập khẩu đối với gạo từ 35% xuống 15% cho đến năm 2028, nhằm giảm bớt khủng hoảng lạm phát trong nước. Lợi cho nhà xuất khẩu gạo Theo đó, các nhà phân tích cho rằng động thái này có thể mang lại lợi ích cho các nhà xuất khẩu gạo nước ngoài như Việt Nam, và khiến nông dân Philippines gặp khó khăn trong việc cạnh tranh. Quyết định này được công bố hôm 4-6, sau cuộc họp của một hội đồng liên cơ quan do Tổng thống Philippines Ferdinand Marcos Jr đứng đầu. Người đứng đầu Cơ quan Kinh tế và Phát triển quốc gia Philippines Arsenio Balisacan cho biết động thái này sẽ giúp hạ giá gạo, khiến giá của mặt hàng này ""trở nên phải chăng hơn"". Gạo chiếm 9% chỉ số giá tiêu dùng của Philippines, nhưng mặt hàng thiết yếu này chiếm hơn một nửa tỉ lệ lạm phát chung trong ba tháng qua. Giá cả tại Philippines đã tăng tháng thứ ba liên tiếp trong tháng 4, tăng 3,8% so với cùng kỳ năm ngoái. ""Việc giảm thuế gạo dự kiến sẽ làm giảm giá gạo cho người tiêu dùng, đồng thời hỗ trợ sản xuất trong nước nhờ thuế quan và tăng hỗ trợ ngân sách để cải thiện năng suất nông nghiệp, đặc biệt là khi giá gạo toàn cầu vẫn ở mức cao"", ông Balisacan nói trong một thông cáo. Ông Balisacan cho biết chính quyền Tổng thống Marcos đang nỗ lực giữ giá thấp cho người nghèo Philippines, bằng cách cắt giảm thuế đối với gạo nhập khẩu xuống mức thấp nhất là 29 peso (0,49 USD)/kg trong năm nay. Tác động tiêu cực đến nông dân Trong khi đó, ông Miguel Chanco, nhà kinh tế trưởng cho khu vực châu Á tại Công ty tư vấn kinh tế Pantheon Macro Economics (trụ sở tại Anh), nhận định động thái cắt giảm thuế sẽ khiến gạo nhập khẩu rẻ hơn gạo trong nước của Philippines, đồng nghĩa với việc ""chắc chắn sẽ có tác động tiêu cực đến thu nhập của nông dân"". ""Mặt khác, trên cơ sở vĩ mô, điều này sẽ giúp ích đáng kể - một khi được thực hiện - trong việc kéo lạm phát xuống, và hỗ trợ sức mua của tất cả người dân Philippines"", ông Chanco nói. Ông Chanco cũng cho rằng động thái này sẽ mang lại ""lợi ích lớn"" cho các nhà xuất khẩu gạo ở châu Á, như Việt Nam và Thái Lan, và Ấn Độ sẽ tiếp tục lỡ cơ hội do nước này đang hạn chế xuất khẩu gạo. Ông Robert Dan Roces, nhà kinh tế trưởng tại Ngân hàng Security Bank ở Manila (Philippines), gọi mức thuế thấp đối với gạo nhập khẩu là ""con dao hai lưỡi"", vì người tiêu dùng sẽ được hưởng lợi, trong khi nông dân phải đối mặt với sự cạnh tranh gay gắt từ hàng nhập khẩu rẻ hơn. ""Điều này có thể thúc đẩy một số nông dân đa dạng hóa cây trồng, có tiềm năng xáo trộn các hoạt động canh tác đã có từ lâu. Các chương trình hỗ trợ của chính phủ, chẳng hạn như trợ cấp và cải thiện hiệu quả trang trại, là rất quan trọng để giảm bớt thiệt hại cho nông dân"", ông Roces nói. Tuy nhiên, ông Roces cũng cảnh báo rằng động thái như vậy có thể khiến các nhà xuất khẩu gạo phải suy nghĩ lại về tình thế của họ tại Philippines. ""Các nhà xuất khẩu gạo như Việt Nam có thể thấy doanh số bán sang Philippines thấp hơn, nhưng điều này cũng có thể thúc đẩy họ khám phá các thị trường mới hoặc… các nhà xuất khẩu như Việt Nam có thể cung cấp các loại gạo có giá trị cao hơn cho các nhà nhập khẩu Philippines"", ông Roces nhận định thêm.",05/06/2024 08:15 GMT+7,https://tuoitre.vn/philippines-thong-bao-giam-thue-nhap-khau-gao-viet-nam-huong-loi-lon-20240605075159484.htm,"Philippines thông báo sẽ giảm thuế nhập khẩu gạo. Các chuyên gia lo ngại động thái này sẽ gây hại cho nông dân Philippines, nhưng có lợi cho các nhà xuất khẩu gạo như Việt Nam."
