Title,Content,Date,Url,Summary
"Cảnh sát Đức lo ngại ""đội quân Tartan"" ở Euro 2024","Đặc biệt các CĐV Scotland với biệt danh ""đội quân Tartan"" luôn nổi tiếng là những bợm nhậu. Họ uống rất nhiều và luôn là khách hàng thường xuyên của các quán rượu ở các giải đấu bóng đá. Theo thông tin của tờ The Sun (Anh), khoảng 200.000 CĐV Scotland sẽ đến Đức để hòa mình trong không khí cuồng nhiệt tại Euro 2024. Điều này làm dấy lên những lo ngại về tình hình an ninh tại giải, nhất là khi Scotland sẽ gặp Hungary ngày 23-6 ở loạt trận cuối cùng của bảng A. Đây là trận đấu được xếp vào nhóm có rủi ro cao. Vì CĐV Scotland nổi tiếng yêu thích tiệc tùng. Trong khi đó, CĐV Hungary được biết đến là ""lữ đoàn Carpathian"" khét tiếng. Vì vậy, sẽ có đến 2.500 cảnh sát chịu trách nhiệm phụ trách an ninh trong và ngoài sân ở trận đấu này.  Ngoài ra cảnh sát Scotland cũng sẽ cử người theo dõi để có thể đảm bảo an toàn cho CĐV nhà. Dù vậy, Cảnh sát trưởng TP Stuttgart, ông Markus Eisenbraun, nói rằng ông không quá lo lắng về vấn đề an ninh. Nỗi lo lớn nhất của ông tại Euro 2024 là ""đội quân Tartan"" sẽ uống cạn các quán rượu. Ông Markus Eisenbraun nói với báo chí: ""Những người hâm mộ bóng đá sẽ đến thăm nước Đức với nhiều hình ảnh khác nhau. Chẳng hạn, các CĐV Scotland được cho là những ""con sâu rượu"". Các quán bar và nhà hàng là những nơi sẽ phải chuẩn bị cho việc tiếp đón họ"". Trước trận đấu này, Bộ Ngoại giao Scotland cũng cảnh báo các CĐV nhà hãy cẩn thận với bia Đức vì nó mạnh hơn so với các loại bia ở Anh và Scotland. Người phát ngôn của Bộ Ngoại giao Scotland nói rằng: ""Bia Đức có thể mạnh hơn ở Anh. Vì vậy, mọi người hãy uống có trách nhiệm, biết giới hạn của mình và tôn trọng luật pháp địa phương. Do đó CĐV có thể sẽ không được phép vào sân vận động nếu uống quá nhiều"". Tại Euro 2024, tuyển Scotland nằm ở bảng A cùng với chủ nhà Đức, Thụy Sĩ và Hungary. Đây là lần thứ 4, tuyển Scotland góp mặt ở đấu trường Euro. Và mục tiêu của tuyển Scotland là lần đầu tiên giành quyền vào vòng knock-out.",02/06/2024 11:44 GMT+7,https://tuoitre.vn/canh-sat-duc-lo-ngai-doi-quan-tartan-o-euro-2024-2024060209103541.htm,"Hơn hai tuần nữa Scotland sẽ bắt đầu hành trình ở Euro 2024 với trận ra quân gặp chủ nhà Đức vào ngày 14-6. Dù Scotland chưa bao giờ được đánh giá là đội bóng mạnh ở các giải đấu cấp châu lục, nhưng CĐV của họ lại rất nổi tiếng về sự cuồng nhiệt."
Bộ trưởng Nguyễn Văn Hùng: Lương thấp khó thu hút nhân tài trong lĩnh vực thể thao,"Theo chương trình kỳ họp thứ 7, Bộ trưởng Bộ Văn hóa, Thể thao và Du lịch Nguyễn Văn Hùng là 1 trong 4 tư lệnh ngành sẽ đăng đàn trả lời chất vấn Quốc hội. Bóng đá Việt Nam có sự tiến bộ ở cả đấu trường khu vực lẫn châu lục Phục vụ cho phiên chất vấn, Bộ trưởng Nguyễn Văn Hùng đã có báo cáo gửi đại biểu Quốc hội về các nội dung liên quan. Về vận động viên thể thao, ông cho biết hiện nay có khoảng 2.500 vận động viên quốc gia (trong đó vận động viên trẻ 1.100; đội tuyển là 1.400). Còn các tỉnh, thành, Bộ Quốc phòng, Bộ Công an có khoảng 22.000 vận động viên. Theo ông, nhìn chung công tác tuyển chọn, đào tạo vận động viên thể thao trong thời gian qua đã từng bước đáp ứng yêu cầu đặt ra; góp phần nâng cao thành tích của thể thao Việt Nam, thể hiện qua số lượng, cơ cấu huy chương đã đạt được tại các kỳ đại hội thể thao. Việt Nam đã giành được các huy chương vàng tại Olympic và Paralympic, luôn nằm trong tốp 3 nước dẫn đầu các kỳ SEA Games, 2 lần liên tiếp dẫn đầu bảng tổng sắp tại SEA Games 31, 32. Nhiều môn thể thao được đầu tư và đã giành được nhiều thành tích đáng ghi nhận. Bóng đá Việt Nam có sự tiến bộ ở cả đấu trường khu vực lẫn châu lục. Bên cạnh đó, theo ông Hùng, công tác tuyển chọn, đào tạo vận động viên trong thời gian qua còn gặp một số tồn tại, hạn chế. Điển hình là đầu tư cho công tác đào tạo tài năng thể thao, tuy có tăng hằng năm song còn thấp so với nhu cầu; Chưa đảm bảo nguồn lực đầu tư đúng mức theo tinh thần nghị quyết 08 của trung ương dẫn đến sự hẫng hụt lực lượng vận động viên kế cận trong các đội tuyển quốc gia; Hệ thống các giải thi đấu thể thao trẻ trên phạm vi cả nước còn hạn chế cả về số lượng và chất lượng; Chưa thu hút và phát huy được tiềm năng to lớn của các nguồn lực xã hội tham gia công tác phát hiện năng khiếu, tuyển chọn đào tạo và bồi dưỡng tài năng thể thao trẻ. Thời gian tới bộ trưởng cho biết sẽ trình Thủ tướng xem xét, ban hành chiến lược phát triển thể dục thể thao Việt Nam đến năm 2030, tầm nhìn đến năm 2045. Theo đó xác định tập trung đầu tư cho các môn, nội dung trọng điểm tham dự các kỳ ASIAD, Olympic và các kỳ SEA Games. Tập trung phân nhóm, đầu tư trọng điểm cho các môn, nội dung thi đấu và lực lượng vận động viên có khả năng giành huy chương ASIAD, Olympic... Bộ hướng tới thu hút nguồn lực xã hội hóa và đẩy nhanh quá trình phát triển thể thao chuyên nghiệp nhằm huy động tối đa các nguồn lực xã hội trong đào tạo vận động viên. ""Coi trọng giáo dục đạo đức, ý chí, lòng tự hào dân tộc cho vận động viên. Tôn vinh và đãi ngộ xứng đáng các vận động viên xuất sắc và phát huy vai trò nêu gương của họ với lớp vận động viên kế cận..."", ông Hùng nêu rõ. Tiền lương, chế độ dinh dưỡng với vận động viên còn thấp Liên quan chế độ chính sách với vận động viên, Bộ trưởng Hùng cho hay các chính sách được ban hành thời quan qua đã phát huy hiệu quả, đi vào thực tiễn, góp phần quan trọng trong việc huy động, tuyển chọn tài năng và đãi ngộ đối với tài năng thể thao... Tuy nhiên so với nhiều nước, các chính sách đãi ngộ đối với vận động viên thể thao nước ta còn hạn chế. Điển hình chế độ tiền lương với vận động viên các đội tuyển trẻ, đội tuyển quốc gia theo nghị định 152/2018 còn thấp (vận động viên đội tuyển quốc gia được hưởng 270.000 đồng/người/ngày x 26 ngày công = 7.020.000 đồng/tháng). Bộ trưởng đánh giá tiền lương với vận động viên thể thao thấp dẫn tới ""khó khăn trong thực hiện chính sách đãi ngộ, thu hút nhân tài trong lĩnh vực thể thao"". Chế độ dinh dưỡng với vận động viên thể thao còn thấp, khó đáp ứng đối với một số môn thể thao có cường độ tập luyện ở mức độ cao. Ngoài ra một số địa phương đã áp dụng chế độ đặc thù đối với vận động viên tài năng như hỗ trợ tiền lương với vận động viên đạt thành tích cao tại các kỳ đại hội thể thao quốc tế hoặc trong chu kỳ tập luyện để chuẩn bị tham dự đại hội thể thao quốc tế. Tuy nhiên đa số các địa phương chưa thể ban hành cơ chế đặc thù do nguồn lực đầu tư cho thể thao còn hạn chế. Thời gian tới, theo ông, sẽ tiếp tục tham mưu, hoàn thiện cơ chế, chính sách về thể dục, thể thao, trong đó bao gồm các cơ chế đặc thù đối với đối tượng là các vận động viên thể thao...",02/06/2024 11:31 GMT+7,https://tuoitre.vn/bo-truong-nguyen-van-hung-luong-thap-kho-kho-thu-hut-nhan-tai-trong-linh-vuc-the-thao-20240602104841347.htm,"Bộ trưởng Nguyễn Văn Hùng đánh giá tiền lương vận động viên thể thao thấp dẫn tới khó khăn trong thực hiện chính sách đãi ngộ, thu hút nhân tài trong lĩnh vực thể thao."
Euro trong tay người Ý,"Có 5 đội bóng sử dụng HLV trưởng mang quốc tịch Ý ở Euro 2024. Đó là Luciano Spalletti (tuyển Ý), Marco Rossi (Hungary), Francesco Calzona (Slovakia), Domenico Tedesco (Bỉ) và Vincenzo Montella (Thổ Nhĩ Kỳ). Vượt qua cả Tây Ban Nha Tây Ban Nha là quốc tịch phổ biến thứ hai với băng ghế HLV trưởng ở Euro 2024 với 3 người. Điều đó khá phù hợp với sự lớn mạnh của bóng đá Tây Ban Nha, khi các cầu thủ của họ được sử dụng khắp châu Âu. Nhưng kể cả như vậy, các HLV Tây Ban Nha vẫn bị những đồng nghiệp Ý áp đảo. Ai là HLV xuất sắc nhất thế giới lúc này? Nếu tính tổng hòa trên nhiều phương diện, câu trả lời có thể là Pep Guardiola. Chiến lược gia đang dẫn dắt Man City không chỉ là một HLV đơn thuần. Pep là một nhà quản lý đại tài với phương thức, chiến lược và triết lý bóng đá đặc thù. Pep đi đến đâu cũng gặt hái được thành công và xây dựng được mô hình bóng đá vững mạnh lâu dài. Ai là HLV trẻ xuất sắc nhất thế giới? Nhiều người sẽ lập tức trả lời: Xabi Alonso. Cựu danh thủ người Tây Ban Nha tạo ra kỳ tích bất bại phi thường cùng Leverkusen ở mùa giải năm nay, và được vô số các CLB lớn săn đón. Đáng nể hơn, ông từ chối hết những CLB đó để tiếp tục gắn bó với Leverkusen. Từ Guardiola, Alonso cho đến Unai Emery, Mikel Arteta, các HLV người Tây Ban Nha thể hiện rõ nét tính hệ thống của bóng đá Tây Ban Nha. Họ luôn mát tay với việc sử dụng cầu thủ trẻ, rồi xây dựng đội bóng theo hướng lâu dài. Suốt 2 thập niên qua, Tây Ban Nha vẫn là nền bóng đá số 1 thế giới, tính trên nhiều phương diện. Nhưng người đang dẫn dắt CLB hùng mạnh nhất Tây Ban Nha lại là một người Ý: HLV Carlo Ancelotti. Không chỉ vậy, cả 3 giải đấu châu lục của UEFA năm nay đều ghi nhận sự hiện diện của các HLV người Ý trong trận chung kết. Trước Ancelotti, HLV Gian Piero Gasperini đã giúp Atalanta đăng quang Europa League. Còn Vincenzo Italiano đưa Fiorentina vào chung kết Conference League năm thứ hai liên tiếp.  Thích nghi ở mọi nơi Có một điều ít ai để ý: những đội bóng vô địch World Cup luôn được dẫn dắt bởi chiến lược gia bản địa. Tại Euro, chân lý này cũng chỉ có duy nhất ngoại lệ: đó là Hy Lạp của HLV Otto Rehhagel (người Đức) vào năm 2004. Các CLB luôn là một tập thể ""hợp chủng quốc"", và họ không ngần ngại sử dụng các HLV nước ngoài. Nhưng tuyển quốc gia thì khác. Các đội bóng lớn có xu hướng sử dụng HLV bản địa, thậm chí là cựu danh thủ để tạo ra sự gắn kết. Thường chỉ những nền bóng đá còn yếu ở châu Phi, châu Á mới cần đến HLV ngoại để tiến bộ. Nhưng người Ý vẫn tạo ra sự ngoại lệ cho bóng đá. Hungary hay Slovakia có thể chỉ là những nền bóng đá trung bình, cần đến những HLV tên tuổi để tạo sức bật ở các giải đấu lớn. Nhưng Bỉ và Thổ Nhĩ Kỳ lại khác. Đầu năm 2023, LĐBĐ Bỉ gây ngỡ ngàng khi bổ nhiệm Tedesco - một HLV Ý chẳng có mấy tên tuổi. Nhưng qua hơn 1 năm làm việc, Tedesco đã cho thấy giá trị của mình, khi cùng tuyển Bỉ bất bại sau 12 trận. Sự thích nghi và tài ứng biến là điểm mạnh của các HLV người Ý. Họ rảo bước khắp châu Âu và để lại dấu ấn ở mọi nơi mình đi qua. Trước khi dẫn dắt tuyển Thổ Nhĩ Kỳ, Montella từng được xem là một HLV trẻ hàng đầu châu Âu. Năm 2021, Montella bất ngờ sang quốc gia vùng Trung Đông để dẫn dắt CLB Adana Demirspor. Rồi tiếp quản ghế HLV trưởng tuyển Thổ Nhĩ Kỳ vào năm 2023 và giúp họ giành vé dự Euro 2024. Rơi vào bảng đấu tử thần với Tây Ban Nha, Croatia và Albania, sẽ rất khó để Ý có thể tiến xa tại Euro 2024. Nhưng HLV Luciano Spalletti không đơn độc, khi vẫn có nhiều đồng hương của ông sẵn sàng viết tiếp thương hiệu ""xứ sở của chiến thuật"" tại Euro 2024.",02/06/2024 11:27 GMT+7,https://tuoitre.vn/euro-trong-tay-nguoi-y-2024060209080356.htm,"Người Ý đến Euro 2024 với vị thế đương kim vô địch. Và không chỉ vậy, họ còn áp đảo trên những băng ghế huấn luyện."
Filip Nguyễn: 'Tôi luôn đối mặt với mỗi sai lầm',"Có tên trong đợt tập trung đội tuyển Việt Nam lần đầu tiên dưới thời tân HLV trưởng Kim Sang Sik, Filip Nguyễn đang đánh mất phong độ ở V-League 2023-2024. Vì vậy anh cũng đối mặt khả năng mất suất bắt chính ở đội tuyển vào tay Đặng Văn Lâm. 1 sai lầm là 1 bài học * Sau gần một năm trở về Việt Nam thi đấu, anh cảm thấy thế nào? - Tôi hài lòng với CLB Công An Hà Nội. Tuy nhiên một số sân ở V-League chưa có cơ sở vật chất tốt. Thậm chí có sân không có phòng tắm cho cầu thủ. Trọng tài ở V-League cũng khác ở châu Âu. Họ ngại rút thẻ đỏ trực tiếp và không bảo vệ cầu thủ trước các pha vào bóng nguy hiểm. Đó là một trong những lý do mà khi ra sân chơi quốc tế, cầu thủ Việt Nam dễ lãnh thẻ đỏ. * Gần đây CLB Công An Hà Nội để thủng lưới nhiều, anh cũng chơi không ổn? - Đúng là gần đây tôi hay cáu gắt sau những bàn thua. Nhưng đây không phải vì việc không giữ sạch lưới. Tôi cần chỉ huy hàng thủ tốt hơn. Chúng tôi đã mắc nhiều lỗi di chuyển phòng ngự. Tôi luôn ra sân với 100% khả năng và đó là lý do tôi phản ứng giận dữ khi thua. Ở châu Âu, điều này là bình thường với thủ môn. Khi không hài lòng về bước di chuyển trong đội hình thì bạn cần phải nói cho đồng đội hiểu. Sau trận đấu, chúng tôi vẫn là bạn, là đồng đội, bởi lẽ nếu không có sự hỗ trợ của nhau, chúng tôi không thể tiến bộ. Tôi luôn đối mặt với sai lầm, với mọi thứ sau sai sót để đổi lấy bài học. Đó là cách phát triển bản thân. Cuộc sống của thủ môn là như vậy. Mọi người sẽ nhớ sai lầm của bạn nhiều hơn. Đây không phải lần đầu tôi mắc lỗi. Và điều cốt lõi là tôi không nghĩ về nó quá nhiều. Ai mà chẳng mắc sai lầm nhưng nếu là tiền đạo thì tỉ số vẫn là 0-0. Còn với thủ môn, tỉ số sẽ khác. * Đâu là sai lầm mà anh nhớ nhất ở V-League? - Đó có thể là bàn thắng của Văn Toàn (CLB Nam Định - PV). Cậu ấy sút nhẹ hơn tôi nghĩ và tôi đã chuẩn bị sẵn cho bước tiếp theo mình phải làm gì. Tôi phải trả giá khi không tập trung hoàn toàn cho khoảnh khắc đó. Ở trận gặp CLB TP.HCM, tôi thậm chí còn không biết vì sao mình ngồi ghế dự bị. Không ai giải thích cho tôi về điều đó. Tôi ngạc nhiên khi đón nhận thông tin ở buổi họp trước trận. Tôi chỉ hy vọng có ai nói cho tôi biết vì sao. Nếu ở châu Âu, HLV sẽ đến và nói chuyện để tôi hiểu lý do phải nghỉ thi đấu. Dĩ nhiên, thủ môn nào cũng trải qua việc dự bị khi chơi không tốt. Tôi không sợ ngồi dự bị * Dự bị có phải là nỗi ám ảnh lớn nhất của anh? - Tôi không sợ nếu phải ngồi dự bị. Bóng đá là thế và bạn phải chấp nhận điều đó. Đôi khi bạn chơi tốt, đôi khi mắc sai lầm, đó là chuyện bình thường. Nó cũng giống như việc đội bóng của bạn thay HLV, có người thích cầu thủ này, có người dùng cầu thủ kia. Nếu không được chọn, tôi vẫn tôn trọng HLV. Thủ môn không phải là cái máy, chúng tôi không thể mãi chơi tốt. Đó là lý do vì sao chúng ta cần nhiều cầu thủ giỏi. * Anh đánh giá thế nào về sự cạnh tranh với Đặng Văn Lâm ở đội tuyển Việt Nam? - Nhiều người so sánh tôi với Đặng Văn Lâm. Nhưng chúng tôi là bạn chứ không phải đối thủ. Đối thủ của tôi là tiền đạo đối phương. Văn Lâm có lợi thế hơn là nói rành tiếng Việt và có nhiều năm thi đấu ở Việt Nam. Chúng tôi vẫn cạnh tranh sòng phẳng vì mục tiêu chung của đội tuyển cũng như chiến thắng hai trận đấu sắp tới.  * Sau khi HLV Philippe Troussier rời đi, anh có suy nghĩ gì sau thời gian làm việc với ông ấy? - Tôi tôn trọng HLV Troussier vì ông ấy là một HLV chuyên nghiệp. Nếu ông ấy không thích điều gì, ông ấy sẽ nói thẳng. Đó cũng là một cách làm việc nhưng cũng có thể để lại vấn đề trong văn hóa ứng xử. Ông ấy muốn cầu thủ đối diện với sai sót để phát triển. Tuy nhiên, khó khăn nhất vẫn là khác biệt văn hóa và tôi nhìn nhận đó là một kinh nghiệm. * Anh có kỳ vọng gì dưới thời HLV Kim Sang Sik? - Tôi không muốn đặt kỳ vọng vào thời điểm này. Chúng tôi chỉ tò mò xem điều gì sẽ đến. Tôi chỉ mới làm việc cùng HLV Troussier ở đội tuyển Việt Nam. Đây sẽ là trải nghiệm mới với tôi và tôi rất mong được làm việc với HLV Kim Sang Sik để xem triết lý bóng đá của ông ấy như thế nào. Tôi rất tự hào khi được ông ấy gọi lên tuyển Việt Nam.",02/06/2024 10:52 GMT+7,https://tuoitre.vn/filip-nguyen-toi-luon-doi-mat-voi-moi-sai-lam-20240602091822522.htm,Đó là chia sẻ với Tuổi Trẻ của thủ môn Filip Nguyễn (CLB Công An Hà Nội) về phong độ cũng như góc nhìn của mình về V-League cùng trải nghiệm ở đội tuyển Việt Nam trước thềm vòng loại World Cup 2026.
"Djokovic chiến đấu xuyên đêm, đánh bại đối thủ vào lúc 3 giờ sáng","Trước đối thủ Lorenzo Musetti từng để thua 4 trận trong 5 lần đối đầu với Djokovic, nhiều chuyên gia đã dự báo một chiến thắng dễ dàng cho tay vợt Serbia. Nhưng thực tế Musetti đã khiến cho tay vợt từng 24 lần vô địch Grand Slam đã phải mướt mồ hôi và có lúc tưởng chừng anh đã tạo nên ""cơn địa chấn"" cho Roland Garros 2024. Ở ván đầu tiên, Djokovic phải rất vất vả mới giành chiến thắng 7-5. Sau đó ở ván thứ hai, Musetti đã buộc Djokovic phải bước vào loạt tie-break và thắng luôn 8-6 để gỡ hòa 1-1. Thừa thắng xông lên, Musetti đã giành chiến thắng ở ván thứ ba với tỉ số cách biệt 6-2. Lúc này tay vợt 37 tuổi người Serbia dường như sắp phải rời giải đấu dưới tay Musetti, hạt giống số 30 đang chơi đầy cảm hứng.  Nhưng một Djokovic trẻ hóa đã tìm thấy động lực mới ở ván thứ tư và giành chiến thắng 6-3. Ván thứ năm quyết định, Djokovic đã ""hủy diệt"" đối thủ với chiến thắng 6-0 để kết thúc trận đấu kéo dài 4 giờ 29 phút. Khi hai tay vợt trao cho nhau cái ôm thân tình sau trận đấu thì đồng hồ trên sân đã là 3 giờ 7 phút sáng. Chiến thắng này giúp Djokovic lọt vào vòng 4 gặp hạt giống số 23 Francisco Cerundolo của Argentina. Djokovic đang hướng đến danh hiệu Grand Slam thứ 25 trong sự nghiệp và chức vô địch Roland Garros thứ tư của anh.",02/06/2024 09:55 GMT+7,https://tuoitre.vn/djokovic-chien-dau-xuyen-dem-danh-bai-doi-thu-vao-luc-3-gio-sang-2024060209112739.htm,"Tay vợt số 1 thế giới Novak Djokovic đã trải qua trận đấu hoành tráng kéo dài 5 ván trước Lorenzo Musetti của Ý tại Roland Garros, trận đấu kết thúc lúc 3 giờ 7 phút giờ địa phương ở Paris ngày 2-6."
