Title,Content,Date,Url,Summary
Việt Nam đi tiếp ở vòng loại World Cup 2026 trong trường hợp nào?,"Ở trận đấu sớm nhất lượt trận thứ 5 bảng F, Iraq đã đánh bại chủ nhà Indonesia 2-0. Với chiến thắng này, Iraq đã giành ngôi nhất bảng F với 15 điểm tuyệt đối sau 5 trận. Tuyển Indonesia có trong tay 7 điểm tạm xếp thứ 2. Đứng thứ ba là Việt Nam với 6 điểm, còn Philippines xếp cuối cùng khi chỉ mới giành được 1 điểm.  Về lý thuyết, tuyển Việt Nam vẫn còn cơ hội đi tiếp vào vòng loại thứ 3 World Cup 2026 nếu kết quả lượt đấu cuối cùng có lợi. Cụ thể, tuyển Việt Nam đi tiếp nếu: thắng Iraq trên sân khách, còn Indonesia không thể có trọn vẹn 3 điểm trước Philippines. Khi đó, tuyển Việt Nam sẽ có trong tay 9 điểm, còn điểm số tối đa mà Indonesia giành được sau vòng loại thứ 2 là 8. Một trường hợp nữa cũng có thể giúp Việt Nam giành vé đi tiếp là thầy trò HLV Kim Sang Sik hòa Iraq còn Indonesia thua Philippines. Khi đó Việt Nam và Indonesia sẽ có cùng 7 điểm nhưng tuyển Việt Nam xếp trên nhờ có hiệu số bàn thắng tốt hơn. Những khả năng trên không phải là không thể xảy ra. Philippines đã từng cầm chân Indonesia ở lượt đi. Và với những gì họ thể hiện tại Mỹ Đình tối 6-6, Philippines có thể gây bất ngờ cho Indonesia. Chưa hết, tuyển Iraq đã giành vé vào vòng loại thứ ba với ngôi nhất bảng nên họ không có lý do gì để bung sức với Việt Nam ở lượt cuối. Phép màu hoàn toàn có thể xảy ra với đội tuyển Việt Nam và tân HLV Kim Sang Sik.",06/06/2024 22:00 GMT+7,https://tuoitre.vn/viet-nam-di-tiep-o-vong-loai-world-cup-2026-trong-truong-hop-nao-20240606214434862.htm,"Đánh bại Philippines 3-2 ở lượt trận thứ 5 bảng F vòng loại thứ 2 World Cup 2026, tuyển Việt Nam sống lại cơ hội đi tiếp."
HLV Tom Saintfiet: Tuyển Philippines xứng đáng có trận hòa,"Tối 6-6, đội tuyển Philippines thất bại 2-3 trước Việt Nam trên sân Mỹ Đình, khuôn khổ bảng F vòng loại World Cup 2026 khu vực châu Á. Phát biểu sau trận, HLV Tom Saintfiet nói: ""Chúc mừng đội tuyển Việt Nam. Tôi đánh giá cao bầu không khí cuồng nhiệt từ khán giả. Đội tuyển Philippines đã có nhiều pha tấn công nguy hiểm. Tôi tiếc nuối vì kết quả hòa sẽ hợp lý hơn. Dù sao tôi cũng hài lòng với các cầu thủ. Đội cần rút kinh nghiệm sau trận này"". Nói thêm về lượt trận cuối gặp Indonesia, ông Tom Saintfiet cho biết đội tuyển Philippines sẽ quyết tâm giành chiến thắng, đồng thời cầu chúc cho đội tuyển Việt Nam cũng có kết quả tốt trước Iraq để có thể đi tiếp vào vòng loại 3. Khi được hỏi về ASEAN Cup 2024 sẽ diễn ra vào cuối năm nay, vị HLV trưởng tuyển Philippines cho biết ông đã có kế hoạch chuẩn bị dài hơi và hứa hẹn sẽ thi đấu tốt hơn trận đấu hôm nay.",06/06/2024 21:51 GMT+7,https://tuoitre.vn/hlv-tom-saintfiet-tuyen-philippines-xung-dang-co-tran-hoa-20240606214250139.htm,"Sau trận thua 2-3 trước đội tuyển Việt Nam, HLV Tom Saintfiet tiếc nuối cho rằng Philippines xứng đáng có trận hòa."
"Hòa Trung Quốc, Thái Lan vẫn còn hy vọng đi tiếp","Trước lượt trận này, tuyển Thái Lan gặp bất lợi khi thua về điểm số. Do đó, họ buộc phải giành chiến thắng để nuôi hy vọng đi tiếp. Và đoàn quân của HLV Matasada Ishii đã chơi với chiến thuật hợp lý, tạo ra nhiều cơ hội hơn hẳn đội chủ nhà. May mắn cũng nhiều lần đứng về phía Thái Lan. Thế nhưng lý do khiến họ không thể giành chiến thắng là việc dứt điểm không đủ tốt. Trong hiệp 1, đáng lẽ ""voi chiến"" đã có thể ghi từ 2 - 3 bàn thắng. Tuy nhiên, chỉ một lần họ thành công. Phần lớn thời gian tuyển Thái Lan chơi phòng ngự và tạo ra được những đợt phản công hiệu quả. Một trong số những pha bóng đó giúp họ có bàn mở tỉ số ở phút 20. Supachai thoát xuống bên cánh trái rồi tạt vào cho Supachok bay người đánh đầu thoải mái mở tỉ số 1-0. Ngoài tình huống này, tuyển Thái Lan còn tạo ra thêm không ít cơ hội nhưng các chân sút của họ lại bỏ lỡ đáng tiếc. Trong đó có cú sút xa trúng xà ngang của Sarach Yooyen ở phút 35. Hoặc sau đó là Suphanat ở tình huống đối mặt thủ môn Wang Dalei nhưng lại đưa bóng trúng cột dọc phút 45+5. Bên kia chiến tuyến, đội chủ nhà Trung Quốc cũng lúng túng trước những thời cơ. Cầu thủ nhập tịch Fernandinho là người gây thất vọng lớn khi có tình huống dứt điểm bị cản phá trước vạch vôi. Trong hiệp 2, chân sút này thậm chí còn sút phạt đền vọt xà một cách khó hiểu. Trước đó, hậu vệ Kritsada của Thái Lan đã lóng ngóng để bóng chạm tay. Đang chơi hay, bước ngoặt xảy ra với Thái Lan ở phút 79. Thủ thành Khammai đang chơi hay với hàng loạt pha cứu thua lại dính chấn thương. Chỉ ít giây sau, từ một tình huống cố định, Behram Abduweli mang về bàn gỡ 1-1 cho tuyển Trung Quốc. Tỉ số này được giữ đến hết giờ. Kết quả này giúp cho Trung Quốc vẫn đứng nhì bảng với 8 điểm. Thái Lan xếp ngay sau với 5 điểm. Cũng tại bảng C lượt trận này, Hàn Quốc thắng dễ Singapore 7-0. Với 13 điểm, họ chắc chắn có ngôi đầu bảng và vé đi tiếp vào vòng loại 3 World Cup 2026 khu vực châu Á. Trong khi đó, Thái Lan buộc phải thắng Singapore ở lượt trận cuối và hy vọng Trung Quốc thua Hàn Quốc. Khi đó, hai đội sẽ bằng điểm và sẽ tính đến hiệu số phụ.",06/06/2024 21:36 GMT+7,https://tuoitre.vn/hoa-trung-quoc-thai-lan-van-con-hy-vong-di-tiep-20240606211859819.htm,"Tối 6-6, tại lượt trận thứ 5 bảng C vòng loại World Cup 2026 khu vực châu Á, Thái Lan dù chơi hay vẫn chỉ có được trận hòa 1-1 trước chủ nhà Trung Quốc."
"Bị thổi 2 quả phạt đền và 1 thẻ đỏ, Indonesia gục ngã trước Iraq","Với mục tiêu giành chiến thắng để đảm bảo vị trí thứ hai ở bảng F, Indonesia đã nhập cuộc rất quyết tâm và họ đã chơi lấn lướt trước Iraq trong 45 phút đầu tiên.  Họ tạo ra nhiều pha tấn công và dứt điểm về phía khung thành của thủ môn Jalal Hassan (Iraq). Nhưng các chân sút của Indonesia như: Rafael Struick, Marselino Ferdinan, Ragnar Oratmangoen đều không thể xuyên thủng được mành lưới của Iraq.  Đầu hiệp hai, HLV tuyển Iraq Jesus Casas đã thực hiện 2 sự điều chỉnh khi đưa Ali Jasim và Youssef Amyn vào sân. Điều này đã khiến lối chơi của Iraq trở nên khởi sắc hơn. Đến phút 53, hậu vệ Justin Hubner (Indonesia) đã để bóng chạm tay trong vòng cấm và trọng tài ngay lập tức cho Iraq được hưởng phạt đền. Từ chấm 11m, tiền đạo Aymen Hussein dễ dàng đánh bại thủ môn Ernando Ari để ghi bàn giúp Iraq vượt lên dẫn trước 1-0. Chỉ 5 phút sau, Indonesia lại chịu tổn thất lớn khi hậu vệ Jordi Armat nhận thẻ đỏ trực tiếp vì phạm lỗi với Youssef Amyn.  Chỉ còn 10 người nên Indonesia đã bị lép vế hoàn toàn trước Iraq. Phút 72, Indonesia lại bị thổi phạt đền sau khi thủ môn Ernando Ari đốn ngã cầu thủ Iraq trong vòng cấm. Nhưng lần này Hussein đã sút bóng lên trời. Sau đó Iraq có thêm vài cơ hội nhưng đều bị bỏ lỡ.  Phải đến phút 88 họ mới có bàn thắng nâng tỉ số lên 2-0 do công của Ali Jasim. Đây cũng là kết quả chung cuộc của trận đấu và Iraq đã chắc chắc giành vé đi tiếp vào vòng loại thứ 3 World Cup 2026 với vị trí đầu bảng F. Còn Indonesia vẫn xếp thứ hai với 7 điểm. ",06/06/2024 18:38 GMT+7,https://tuoitre.vn/bi-thoi-2-qua-phat-den-va-1-the-do-indonesia-guc-nga-truoc-iraq-20240606182206216.htm,"Bị thổi 2 quả phạt đền, trung vệ Jordi Amat nhận thẻ đỏ, tuyển Indonesia đã thất bại 0-2 trước Iraq trên sân nhà Gelora Bung Karno ở vòng loại thứ hai World Cup 2026 chiều 6-6."
"Người hâm mộ đổ về Mỹ Đình, tiếp sức tuyển Việt Nam","Chiều 6-6, khu vực sân vận động quốc gia Mỹ Đình sôi động hơn bình thường do đội tuyển Việt Nam có trận đón tiếp đội tuyển Philippines ở loạt trận thứ 5 vòng loại World Cup 2026. Nhiều khán giả tranh thủ có mặt quanh sân từ khoảng 16h và bắt đầu vào bên trong khuôn viên để được soát vé. Họ muốn xem trận đấu đầu tiên của HLV Kim Sang Sik ở Việt Nam. Vẫn như mọi khi, các hội cổ động viên ủng hộ đội tuyển Việt Nam lần lượt khuấy đảo bầu không khí bên ngoài sân Mỹ Đình. Có hội lái xe, phất cờ, đánh trống làm sôi động bầu không khí trước trận. Thời tiết Hà Nội đang ủng hộ cho khán giả và cầu thủ hai đội để có một trận đấu hay. Nhiệt độ được ghi nhận ở mức 27 độ C, không khí mát mẻ, dễ chịu. Vài ngày qua, Hà Nội có mưa rải rác và sấm chớp xuất hiện rất nhiều, tuy nhiên đến trước giờ thi đấu là 19h, thời tiết đang chiều lòng người hâm mộ bóng đá Việt Nam. Do trận đấu diễn ra vào ngày giữa tuần nên lượng khán giả đổ vào sân không quá đông. Đội tuyển Việt Nam đang cần nhiều sự động viên của khán giả nhà. Đây là lợi thế không nhỏ trong việc giúp HLV Kim Sang Sik có màn ra mắt thuận lợi cùng đội tuyển Việt Nam. Dù cơ hội đi tiếp vào vòng loại thứ 3 World Cup 2026 của Việt Nam còn rất nhỏ nhưng chưa hoàn toàn khép lại. Do đó, nếu thủ môn Đặng Văn Lâm và đồng đội có chiến thắng trước Philippines, họ sẽ nuôi tiếp hy vọng mong manh. Ở trận đấu diễn ra trước đó, đội tuyển Indonesia của HLV Shin Tae Yong đã thất bại 0-2 trước Iraq trên sân nhà. Vì vậy, tuyển Việt Nam buộc phải thắng Philippines nếu không muốn chấm dứt hành trình World Cup 2026 tại đây.",06/06/2024 18:37 GMT+7,https://tuoitre.vn/nguoi-ham-mo-do-ve-my-dinh-tiep-suc-tuyen-viet-nam-20240606182019449.htm,"Hàng nghìn cổ động viên đã có mặt ở sân Mỹ Đình để ủng hộ màn ra mắt của tân HLV trưởng đội tuyển Việt Nam Kim Sang Sik trong trận đấu gặp Philippines ở vòng loại World Cup 2026, diễn ra lúc 19h ngày 6-6."
"Đội hình ra sân trận Việt Nam - Philippines: Quang Hải đá chính, Nguyễn Filip dự bị","HLV Kim Sang Sik tạo ra khá nhiều sự bất ngờ trong đội hình sân ra sân của tuyển Việt Nam. Đầu tiên, vị chiến lược gia người Hàn Quốc sử dụng thủ môn Đặng Văn Lâm bắt chính (thay cho Nguyễn Filip). Nguyễn Filip dường như đã mất suất đá chính sau khi không giữ được phong độ cao tại V-League. Ở vị trí hậu vệ trái, HLV Kim Sang Sik bỏ qua nhiều lựa chọn tốt để điền tên Khuất Văn Khang - người vốn xuất thân là tiền vệ trung tâm. Thực tế Văn Khang đã được chơi ở vị trí này tại Giải U23 châu Á, tuy nhiên Văn Khang chưa phát huy hết sở trường. Khu vực giữa sân, tuyển Việt Nam sẽ chơi với bộ ba tiền vệ Đức Chiến - Hoàng Đức và Hùng Dũng. Sự xuất hiện của Đức Chiến có thể xem là bất ngờ bởi đội tuyển Việt Nam còn không ít những ""lựa chọn quen thuộc"" khác. Tuy nhiên, việc Đức Chiến đá chính là xứng đáng với màn trình diễn ấn tượng của anh tại Thể Công - Viettel thời gian qua. Trên hàng công, Tiến Linh sẽ đá trung phong cắm. Hỗ trợ anh là Văn Toàn (trái) và Quang Hải (phải). Đây là sự lựa chọn khá quen thuộc của tuyển Việt Nam thời HLV Park Hang Seo. Những ngôi sao này đang là giải pháp tốt nhất trên hàng công của tuyển Việt Nam lúc này. Bên cạnh đó, tuyển Việt Nam còn quân bài chiến lược mang tên Tuấn Hải, có thể là phương án dự phòng cho Tiến Linh.",06/06/2024 17:50 GMT+7,https://tuoitre.vn/doi-hinh-ra-san-tran-viet-nam-philippines-quang-hai-da-chinh-nguyen-filip-du-bi-20240606174010072.htm,"HLV Kim Sang Sik công bố đội hình ra sân của tuyển Việt Nam trong cuộc đối đầu với Philippines lúc 19h tối nay 6-6 trên sân Mỹ Đình. Quang Hải đá chính, thủ môn Nguyễn Filip dự bị."
Đội tuyển Việt Nam không đăng ký 4 cầu thủ ở trận gặp Philippines,"Bốn cầu thủ đội tuyển Việt Nam không được đăng ký, gồm: thủ môn Quan Văn Chuẩn, trung vệ Bùi Hoàng Việt Anh, tiền vệ Nguyễn Thái Sơn và Trần Ngọc Sơn. Trong số này, trung vệ Bùi Hoàng Việt Anh không thể đăng ký thi đấu vì đã nhận đủ 2 thẻ vàng tại vòng loại World Cup 2026 khu vực châu Á. Ở những phát biểu mới đây, Đỗ Hùng Dũng, Quang Hải và Văn Toàn đều cho biết mọi cầu thủ đều bình đẳng cạnh tranh, HLV Kim Sang Sik lựa chọn cầu thủ đá chính dựa theo phong độ, thích nghi nhanh nhất với lối chơi mới. Bên cạnh đó, trong trận ra mắt của mình, ông Kim cũng ưu tiên những cầu thủ có nhiều kinh nghiệm thi đấu quốc tế trong màu áo đội tuyển Việt Nam. Bốn cầu thủ không được đăng ký ở trận gặp Philippines sẽ tiếp tục tập luyện cùng đội hướng tới trận đấu sân khách với Iraq vào ngày 11-6. Sau trận gặp Philippines, đội tuyển Việt Nam sẽ có một ngày nghỉ ngơi trước khi di chuyển đi Iraq. Đội lên đường rạng sáng 8-6 với hai chuyến bay từ Hà Nội quá cảnh tại Doha và đến Basrah, Iraq lúc 10h (giờ địa phương).",06/06/2024 15:35 GMT+7,https://tuoitre.vn/doi-tuyen-viet-nam-khong-dang-ky-4-cau-thu-o-tran-gap-philippines-20240606152452067.htm,HLV Kim Sang Sik đã chốt danh sách 23 cầu thủ đội tuyển Việt Nam chính thức tham dự trận đấu với Philippines vào 19h tối nay 6-6.
Tuyển Việt Nam áp đảo Philippines ở nhiều chỉ số thống kê,"Trên bảng xếp hạng FIFA, tuyển Việt Nam đứng hạng 115 thế giới, bỏ xa Philippines hạng 141 thế giới. Thứ hạng của hai nền bóng đá đã phần nào phản ánh sự chênh lệch về trình độ. Trong quá khứ, tuyển Việt Nam và Philippines chạm trán nhau 13 lần. Trong đó, tuyển Việt Nam đang sở hữu thành tích áp đảo với 10 chiến thắng, 1 hòa và 2 thua. Trong 5 trận gần nhất hai đội gặp nhau, Philippines toàn thua Việt Nam. Chiến thắng gần nhất của tuyển Philippines trước Việt Nam diễn ra tại AFF Cup 2012. Trong danh sách 28 cầu thủ Philippines được HLV Tom Saintfiet triệu tập có tới 10 cầu thủ đang thi đấu tại các CLB châu Âu và châu Mỹ. HLV người Bỉ giữ lại 5 cựu binh kỳ cựu và bổ sung 8 tân binh. Dù vậy, giá trị đội hình của tuyển Philippines vẫn chưa thể sánh bằng tuyển Việt Nam. Cụ thể, theo định giá của trang transfermarkt, tổng giá trị đội hình tuyển Việt Nam là 6,65 triệu euro. Cầu thủ đắt giá nhất của tuyển Việt Nam là thủ môn Việt kiều Nguyễn Filip (600.000 euro). Trong khi đó, tổng giá trị đội hình của tuyển Philippines là 3,83 triệu euro. Thủ thành từng chơi bóng tại Giải ngoại hạng Anh Neil Etheridge là người có giá trị cao nhất đội hình tuyển Philippines (300.000 euro). Nhà cái cũng đánh giá cao sự vượt trội của tuyển Việt Nam khi ra kèo tuyển Việt Nam chấp Philippines 1 trái 1/4. Nhà cái nhận định trận đấu sẽ có nhiều bàn thắng khi ra tỉ lệ tài xỉu trận đấu lên đến 2 trái 3/4. Tất cả những thống kê đó sẽ giúp tuyển Việt Nam tự tin trước Philippines trong trận đấu tối nay. Dù vậy, trong bóng đá luôn chứa đựng những bất ngờ, nhất là khi nhân sự tuyển Philippines có rất nhiều biến động từ những cầu thủ nhập tịch, đang thi đấu ở nước ngoài. Điều các CĐV quan tâm nhất là tuyển Việt Nam sẽ chơi thế nào dưới thời tân HLV Kim Sang Sik, khi cơ hội vào vòng loại thứ 3 World Cup 2026 dường như đã khép lại.",06/06/2024 15:21 GMT+7,https://tuoitre.vn/tuyen-viet-nam-ap-dao-philippines-o-nhieu-chi-so-thong-ke-20240606121128907.htm,Tuyển Việt Nam có nhiều thống kê áp đảo Philippines trước trận đấu ở lượt thứ 5 bảng F vòng loại World Cup 2026 diễn ra lúc 19h hôm nay 6-6 trên sân Mỹ Đình.
Người Quy Nhơn đội nắng xem các VĐV teqball tranh tài,"Hôm nay, 40 trận đấu teqball ở nội dung đôi nam nữ diễn ra từ sáng tới chiều tối. Từ sáng sớm, nhiều người dân và du khách đã có mặt ở khu vực bãi biển TP Quy Nhơn để theo dõi những trận tranh tài hấp dẫn. Đa số người dân đều cho rằng môn thể thao này quá mới nhưng cũng khá thú vị. ""Tôi thấy môn này không đòi hỏi nhiều về mặt thể lực mà chủ yếu là kỹ thuật cá nhân phải tốt mới khống chế bóng và dứt điểm được. Tôi rất ấn tượng với các cầu thủ Thái Lan. Cả nam và nữ của họ đều rất giỏi""- anh Nguyễn Xuân Thành (ở TP Quy Nhơn) nói. Càng về trưa, nắng nóng càng gay gắt nhưng khán giả vẫn theo dõi các trận đấu và cổ vũ hết mình cho các VĐV.  Từ người lớn cho đến trẻ em, ai cũng hào hứng khi được chứng kiến những pha dứt điểm theo kiểu xe đạp chổng ngược. ""Kỹ thuật này rất đẹp mắt. Trước giờ tôi chỉ thấy các VĐV cầu mây biểu diễn những pha dứt điểm như vậy. Hôm nay, trên sân bóng teqball tôi lại thấy những pha dứt điểm đó"", anh Thành chia sẻ. Trong khi đó, chị Nguyễn Kim Hằng (du khách đến từ TP.HCM) cho hay chị đi du lịch Quy Nhơn và ghé lại để xem các trận đấu. ""Không khí ở đây rất vui. Các trận đấu được tổ chức ngay tại bãi biển, khung cảnh rất thơ mộng. Hơn nữa, người xem lại không cần phải tốn tiền mua vé. Tôi rất thích giải đấu này"", chị Hằng nói. ",06/06/2024 14:33 GMT+7,https://tuoitre.vn/nguoi-quy-nhon-doi-nang-xem-cac-vdv-teqball-tranh-tai-20240606131829268.htm,"Sáng 6-6, Giải vô địch teqball thế giới 2024 chính thức khởi tranh tại TP Quy Nhơn (Bình Định) trước sự háo hức của đông đảo người dân thành phố biển này."
Bắt nghi phạm trộm 2 điện thoại của 2 vận động viên bơi lội người nước ngoài,"Ngày 6-6, Công an Đà Nẵng cho biết Phòng cảnh sát hình sự đang tạm giữ hình sự đối với Lê Đình Dũng (41 tuổi, trú phường Hòa Xuân, quận Cẩm Lệ, Đà Nẵng) để điều tra về hành vi trộm cắp tài sản. Đây là nghi phạm đã trộm điện thoại của vận động viên tham dự Đại hội thể thao học sinh Đông Nam Á. Theo cơ quan công an, chiều ngày 4-6, có hai vận động viên bơi lội người nước ngoài đến tham gia thi đấu trong khuôn khổ Đại hội thể thao học sinh Đông Nam Á tổ chức tại Câu lạc bộ bơi Đà Nẵng (đường 2/9, phường Hòa Cường Bắc, quận Hải Châu, Đà Nẵng). Hai vận động viên này để hai túi xách, bên trong chứa hai điện thoại di động cùng một số tài sản tại khu vực chuẩn bị. Khoảng 16h cùng ngày, nghi phạm Dũng có mặt tại câu lạc bộ bơi thì phát hiện tài sản trên không có người trông coi nên đã lấy trộm rồi tẩu thoát. Ngay khi tiếp nhận thông tin, Phòng cảnh sát hình sự Công an Đà Nẵng phối hợp với Công an quận Cẩm Lệ (Đà Nẵng) nhanh chóng vào cuộc, tiến hành truy xét. Áp dụng các biện pháp nghiệp vụ, đến chiều ngày 5-6, cảnh sát hình sự đã xác định và triệu tập Dũng về làm việc. Người này khai nhận hành vi trộm cắp tài sản. Phòng cảnh sát hình sự thực hiện lệnh bắt người bị giữ trong trường hợp khẩn cấp đối với Lê Đình Dũng để phục vụ công tác điều tra.",06/06/2024 13:41 GMT+7,https://tuoitre.vn/bat-nghi-pham-trom-2-dien-thoai-cua-2-van-dong-vien-boi-loi-nguoi-nuoc-ngoai-20240606121231073.htm,Nghi phạm trộm hai điện thoại của hai vận động viên nước ngoài đang tham gia thi đấu tại Đại hội thể thao học sinh Đông Nam Á (tổ chức tại Đà Nẵng) vừa bị cảnh sát hình sự bắt giữ.
Tuổi Trẻ Online ra mắt chuyên trang Euro 2024,"Chuyên trang Euro 2024 của báo Tuổi Trẻ có địa chỉ tại: https://tuoitre.vn/euro-2024.htm. Chuyên trang được thiết kế dựa trên màu sắc chủ đạo của Euro 2024 là màu xanh.  Chuyên trang Euro 2024 của Tuổi Trẻ Online gồm có bốn mục chính: Tin tức, Nhận định, Bình luận và Lịch thi đấu. Tin tức là nơi cập nhật toàn bộ thông tin, diễn biến, các câu chuyện, nhân vật, sự kiện liên quan đến Euro 2024. Trong khi đó, chuyên mục Nhận định tập trung những bài viết nhận định trước, trong và sau trận đấu. Tại đây, bạn đọc sẽ có cái nhìn tổng quan về thực lực, khả năng chiến thắng của các đội bóng, tỉ lệ cá cược, dự đoán của các chuyên gia, nhà cái. Ở chuyên mục Bình luận, Tuổi Trẻ sẽ đưa ra những đánh giá, bình luận sắc sảo, nhiều chiều, khách quan về một nhân vật, sự kiện, câu chuyện tại Euro 2024. Đội ngũ chuyên gia trong nước và quốc tế, những cây bút thể thao hàng đầu sẽ mang đến cho bạn đọc những cái nhìn thú vị về giải bóng đá hấp dẫn nhất châu Âu. Tại Euro 2024, một trong những điều các CĐV quan tâm nhất là lịch thi đấu. Tuổi Trẻ Online đã tạo chuyên mục Lịch thi đấu riêng, đầy đủ 51 trận gửi đến bạn đọc. Chưa hết, chuyên trang Euro 2024 cũng sẽ cập nhật lịch thi đấu hằng ngày, với các kênh trực tiếp để bạn đọc tiện theo dõi. Cuối cùng là chuyên mục Vui cùng Euro, nơi Tuổi Trẻ Online gửi đến bạn đọc những thông tin vui về Euro 2024 và các chương trình đồng hành hấp dẫn cùng giải đấu. Ngoài ra, chuyên trang Euro 2024 cũng cung cấp cho bạn đọc những tính năng quan trọng như live kết quả các trận đấu, bảng xếp hạng, nhánh thi đấu để bạn đọc tiện theo dõi.",06/06/2024 13:34 GMT+7,https://tuoitre.vn/tuoi-tre-online-ra-mat-chuyen-trang-euro-2024-20240606110923293.htm,"Nhân dịp Euro 2024 diễn ra tại Đức từ ngày 15-6 đến 16-7, Tuổi Trẻ Online giới thiệu đến bạn đọc chuyên trang Euro 2024."
