Title,Content,Date,Url,Summary
Challengers gây sốt phòng vé với chuyện tình tay ba,"Theo số liệu của công ty nghiên cứu thị trường điện ảnh Exhibitor Relations, trong 3 ngày đầu trình làng, Challengers thu về 15 triệu USD tại các phòng vé trên khắp Bắc Mỹ với những phản hồi tích cực từ giới phê bình lẫn khán giả đại chúng. Nhà phân tích David A. Gross đánh giá đây là sự khởi đầu mạnh mẽ đối với một bộ phim thể thao lãng mạn. Challengers và ngôi sao đang lên Zendaya Challengers có ngân sách 55 triệu USD, quy tụ dàn sao trẻ như được nhiều khán giả yêu thích như Zendaya, Josh O'Connor, Mike Faist... Challengers thuộc thể loại tâm lý - tình cảm với chủ đề xoay quanh giới thế thao. Zendaya hóa thân Tashi Duncan - một trong những vận động viên nữ tiềm năng bậc nhất làng quần vợt thế giới. Cô sau đó vướng vào cuộc tình tay ba với 2 tay vợt nam khác là Patrick Zweig (Josh O'Connor) và Art Donaldson (Mike Faist). Câu chuyện phim xoay quanh mối quan hệ phức tạp giữa họ từ thời thiếu niên cho đến khi trưởng thành. Challengers nhận được ""mưa lời khen"" từ giới phê bình và khán giả đại chúng. Phim nhận mức chấm 87% trên trang Rotten Tomatoes, và được đánh giá là một trong những phim thể thao đáng xem thời gian này. Giới phân tích cũng đánh giá Challengers là tác phẩm tiếp theo cho thấy sự tỏa sáng của ngôi sao đang lên Zendaya. Kong, Kung Fu Panda và Dune vẫn thu tốt Vị trí thứ hai trên bảng xếp hạng thuộc về ""tân binh"" Unsung Hero với doanh thu 7,8 triệu USD. Ba phim ra rạp và có doanh thu tốt trước đó lần lượt lùi về vị trí 3 - 5, gồm Godzilla x Kong: The New Empire với 7,2 triệu USD; Civil War với 7 triệu USD và Abigail với 5,3 triệu USD. Những cái tên còn lại trong danh sách Top 10 phim ăn khách nhất tuần qua: 6. The Ministry of Ungentlemanly Warfare - 3,9 triệu USD 7. Kung Fu Panda 4 - 3,6 triệu USD 8. Ghostbusters: Frozen Empire - 3,3 triệu USD 9. Dune: Part Two - 1,9 triệu USD 10. Boy Kills World 1,7 triệu USD.",29/04/2024 14:40 GMT+7,https://tuoitre.vn/challengers-gay-sot-phong-ve-voi-chuyen-tinh-tay-ba-20240429143714113.htm,"Cuối tuần qua, bộ phim thể thao, lãng mạn Challengers (tựa Việt: Những kẻ thách đấu) của đạo diễn Luca Guadagnino đã có màn ra mắt ấn tượng khi vươn lên đứng đầu bảng xếp hạng phim ăn khách nhất Bắc Mỹ."
"Lật mặt 7 áp đảo trước lễ, thu hơn trăm tỉ sau 3 ngày ra rạp","Lật mặt 7: Một điều ước đạt doanh thu ""chào sân"" dẫn đầu như dự đoán, trong khi đó Cái giá của hạnh phúc bất ngờ ""mất đà"", bị tụt lại sâu trong bảng xếp hạng doanh thu cuối tuần vừa rồi. Cụ thể, theo số liệu của Box Office Vietnam, Lật mặt 7: Một điều ước  thu về hơn 105 tỉ đồng tính đến trưa 29-4, phim cũng sở hữu suất chiếu áp đảo - hơn 11.000 suất - gấp nhiều lần bộ phim đang xếp vị trí thứ 2 và 3. Lật mặt 7 lặp lại thành tích của Mai Bộ phim mới nhất trong series trị giá trăm tỉ của Lý Hải khai thác chủ đề tình cảm gia đình thay vì hài, hành động như phần phim trước, phim cũng phân loại K, phù hợp cho hầu hết đối tượng khán giả. Đây cũng là yếu tố khiến phim bứt phá so với những người tiền nhiệm. Tin vui cũng đến với Lý Hải cùng ê kíp khi phim đạt cột mốc trăm tỉ sau 3 ngày - thành tích tương tự phim Mai của đạo diễn Trấn Thành dịp Tết năm nay. Tuy nhiên, Cái giá của hạnh phúc - bộ phim được cho là sẽ trở thành ""đối thủ"" chính của Lật mặt 7 dịp lễ này - lại bất ngờ bị bỏ xa. Phim chỉ thu về 1,8 tỉ đồng trong dịp cuối tuần vừa qua, khiến cho tổng doanh thu phim chững lại ở mốc 23,1 tỉ đồng. Hiện Cái giá của hạnh phúc chỉ thu về ""lai rai"" vài trăm triệu đồng mỗi ngày và có khoảng hơn 400 suất chiếu, trong khi chỉ tính trong sáng nay, phim của Lý Hải thu hơn 11,7 tỉ đồng với hơn 4.000 suất chiếu, gấp 10 lần Cái giá của hạnh phúc. Hiện đang giữ vị trí thứ 2 trên cuộc đua doanh thu là bộ phim hành động Hàn Quốc Vây hãm: Kẻ trừng phạt, đánh dấu sự trở lại của Ma Dong Seok - ""đả nam"" nổi tiếng của màn ảnh xứ Kim Chi. Phim kể về hành trình một ""siêu cảnh sát"" đối đầu với những tội phạm tinh vi trong giới công nghệ.  Vây hãm: Kẻ trừng phạt hiện đang có mức tổng doanh thu là 9,9 tỉ đồng, trong đó phần lớn là thu về từ dịp cuối tuần vừa rồi. Nếu so với Lật mặt 7, doanh thu cuối tuần của ""bom tấn"" Hàn Quốc chỉ bằng 1/10 bộ phim của đạo diễn Lý Hải. Một bộ phim Hàn khác là Tà khúc triệu vong cũng chỉ thu về hơn 800 triệu đồng sau nhiều ngày ra mắt, thua những phim ra mắt gần một tháng như Godzilla x Kong. Về cuộc đua của hai phim hoạt hình Mèo mập mang 10 mạng và Gấu béo tung chưởng, bộ phim về chú mèo trải qua hành trình đầu thai của mình đang áp đảo đối thủ đến từ Úc. Cụ thể, Mèo mập mang 10 mạng thu về 4,4 tỉ đồng sau gần 4 ngày, trong khi Gấu béo tung chưởng chỉ có tổng doanh thu khiêm tốn 364 triệu đồng. Nhìn chung, dịp lễ 30-4 và 1-5 là cuộc đua không ""cân sức"" giữa Lật mặt 7 và những bộ phim còn lại. Tuy nhiên, khán giả ra rạp vẫn có rất nhiều lựa chọn từ kinh dị đến thuần hành động hay hoạt hình để phù hợp hơn với thị hiếu của mình.",29/04/2024 13:05 GMT+7,https://tuoitre.vn/lat-mat-7-ap-dao-truoc-le-thu-hon-tram-ti-sau-3-ngay-ra-rap-20240429091505773.htm,"Những bộ phim chiếu rạp dịp 30-4 và 1-5 hầu hết sẽ chiếu từ 26-4 và có một mốc doanh thu ban đầu, trong đó Lật mặt 7 dẫn đầu như dự kiến, Cái giá của hạnh phúc gần như bị loại khỏi đường đua."
Chiều nay ở Đà Lạt được nghe hòa nhạc kèn clarinet với đàn tranh,"Trong 2 khung giờ: 16h - 18h và 19h - 21h ngày 29-4, người dân và du khách tại Đà Lạt được thưởng thức miễn phí chương trình hòa nhạc của 2 nghệ sĩ Anna Koch và nghệ sĩ đàn tranh Thu Quyến.  Chương trình diễn ra tại Phố Bên Đồi Creative Studio (bên trong Trung tâm Thanh thiếu niên tỉnh Lâm Đồng, số 10 Lý Tự Trọng, Đà Lạt). Đây là chương trình Connecting the Dots do Đại sứ quán Áo phối hợp với UBND TP Đà Lạt, Phố Bên Đồi Creative Studio thực hiện.  Tại chương trình, 2 nghệ sĩ Áo và Việt Nam sẽ kết hợp với nhau thông qua sự kết nối của âm nhạc và 2 nhạc cụ: kèn clarinet và đàn tranh.  Cả 2 nghệ sĩ sẽ cùng biểu diễn một số bản nhạc đương đại phương Tây và Việt Nam thân quen. Theo ban tổ chức, đây là một sự kết hợp độc đáo và phù hợp. Anna Koch là nghệ sĩ chơi kèn clarinet, là một nhạc sĩ chuyên nghiệp, chuyên sáng tác âm nhạc đương đại và trình diễn ngẫu hứng.  Cô đã dành thời gian theo học tại Đại học Âm nhạc và Diễn xuất Vienna, tốt nghiệp danh dự vào năm 2017.  Cô được trao học bổng 'Start Stipendium Musik' năm 2020 từ Bộ Văn hóa và Nghệ thuật Liên bang Áo.  Anna Koch đã biểu diễn dưới dạng nghệ sĩ solo và nghệ sĩ hòa nhạc tại các hội chợ âm nhạc như Wien modern, Bang on a Can (Mỹ), Klangspuren Schwaz, Impuls Konzerte Graz, Styriarte và Expo Shanghai (2010). Còn nghệ sĩ đàn tranh Thu Quyến tốt nghiệp loại xuất sắc chuyên ngành đàn tranh Trường Quốc gia âm nhạc Huế (nay là Học viện Âm nhạc Huế).  Hiện tại cô đang mở các lớp đào tạo đàn tranh tại gia với mong muốn truyền lửa đam mê và tình yêu âm nhạc nhạc cụ dân tộc cho thế hệ trẻ để vốn quý này được tiếp nối.",29/04/2024 12:33 GMT+7,https://tuoitre.vn/chieu-nay-o-da-lat-duoc-nghe-hoa-nhac-ken-clarinet-voi-dan-tranh-20240429120440657.htm,Người dân và du khách tại Đà Lạt sẽ được thưởng thức miễn phí chương trình hòa nhạc do nghệ sĩ kèn clarinet Anna Koch (người Áo) và nghệ sĩ đàn tranh Thu Quyến thực hiện.
Dalat Best Dance Crew 2024 sẽ làm Đà Lạt 'nóng như chảo lửa',"Chung kết chương trình lễ hội vũ đạo ngoài trời “Dalat Best Dance Crew 2024 - Hoa Sen Home International Cup” sẽ diễn ra tại quảng trường Lâm Viên (ven hồ Xuân Hương, Đà Lạt) vào 2 ngày 29 và 30-4. Lễ hội với 2 bảng thi đấu chính thức gồm bảng phong trào mở rộng và bảng quốc tế, quy tụ các nhóm nhảy hàng đầu Việt Nam và các nước châu Á như: Indonesia, Thái Lan, Nhật Bản... Ban tổ chức cho biết việc mở rộng đối tượng dự thi bảng phong trào nhằm tạo cơ hội cho các bạn trẻ yêu nhảy được thử sức và hòa mình vào lễ hội vũ đạo ngoài trời lớn nhất Việt Nam. Sau đêm tổng duyệt, thông tin cho hay năm nay các bạn trẻ chuẩn bị nhiều tiết mục lạ và có sự đầu tư về chuyên môn. Các tiết mục vũ đạo sôi động thể hiện tinh thần nhiệt huyết, khẳng định chất riêng của mỗi nhóm, mỗi cá nhân và lan tỏa năng lượng tích cực, đam mê nhảy đến với cộng đồng. Các biên đạo trẻ đã bám sát chủ đề “Be You, Be Unique - Khẳng định chất tôi” mà ban tổ chức đề ra. Với chủ đề này, chương trình mong muốn tìm kiếm màu sắc cá nhân - điều riêng biệt định hình cá tính, sự khác biệt của thế hệ trẻ hiện nay thông qua các màn trình diễn vũ đạo. Đêm chung kết còn quy tụ các nghệ sĩ nổi tiếng, như: ca sĩ Anh Tú, Trương Thảo Nhi, Trung Hiếu, Anh Thi, nhóm nhạc đến từ Thái Lan... Toàn bộ chương trình mở cửa miễn phí để du khách và người dân địa phương tham dự. Chị Trần Diệp Mỹ Dung - phó bí thư Tỉnh Đoàn Lâm Đồng - cho biết: “‘Dalat Best Dance Crew 2024' là một sân chơi hoàn toàn mới, được đầu tư chỉn chu. Cuộc thi tác động và cổ vũ mạnh mẽ đến phong trào nhảy múa trong cả nước cũng như trong địa bàn tỉnh Lâm Đồng. Các nhóm nhảy có cơ hội được cọ xát và hướng đến giá trị sống tích cực. Đây cũng là yếu tố khiến chúng tôi tập hợp các em đến với sân chơi này”.",29/04/2024 11:15 GMT+7,https://tuoitre.vn/dalat-best-dance-crew-2024-se-lam-da-lat-nong-nhu-chao-lua-20240429105622373.htm,"Chung kết Dalat Best Dance Crew 2024 diễn ra trong 2 đêm 29 và 30-4 tại Đà Lạt, dự kiến sẽ có 10.000 người tham gia."
"Người đẹp Ukraine đoạt danh hiệu Miss Eco International 2024, Việt Nam trượt top 21","Tối 28-4 (theo giờ Ai Cập), đêm chung kết cuộc thi Miss Eco International 2024 diễn ra tại đất nước Ai Cập. Đại diện Việt Nam tham gia cuộc thi này là Hoàng Kim Chi. Cô sinh năm 1997, quê Quảng Trị. Kim Chi từng đoạt danh hiệu Miss Fire Vietnam 2023 tại cuộc thi Hoa hậu Trái đất Việt Nam 2023. Tại đêm chung kết, các thí sinh trải qua các phần thi: hô tên, trang phục dân tộc, trang phục dạ hội, thuyết trình về môi trường, ứng xử. Sau các phần thi, ban giám khảo chọn ra top 5 chung cuộc Miss Eco International 2024 gồm các người đẹp đến từ Indonesia, Ukraine, Brazil, Canada và Philippines. Đại diện của Việt Nam trượt top 21. Ở phần thi trang phục dân tộc, người đẹp Philippines giành chiến thắng phần thi này. Đại diện Việt Nam gặp sự cố ở cuối phần trình diễn, chuỗi ngọc trai bị đứt, rơi khắp nơi trên sàn diễn. Kết quả chung cuộc, người đẹp Ukraine giành vương miện Miss Eco International 2024. Danh hiệu á hậu 1, 2, 3, 4 lần lượt trao cho người đẹp đến từ Philippines, Canada, Brazil và Indonesia.",29/04/2024 06:54 GMT+7,https://tuoitre.vn/nguoi-dep-ukraine-doat-danh-hieu-miss-eco-international-2024-viet-nam-truot-top-21-20240429062140976.htm,Đêm chung kết cuộc thi Miss Eco International 2024 (Hoa hậu Môi trường thế giới) khép lại với ngôi vị cao nhất thuộc về người đẹp Ukraine.
"365 Radio, kênh phát thanh uy tín của Anh, bàn về các nghệ sĩ indie Việt Nam","Jukebox Judgement™ là chương trình radio của 365 Radio - một kênh uy tín của Vương quốc Anh về âm nhạc. Mỗi một số, Jukebox Judgement™ sẽ giới thiệu các sản phẩm âm nhạc tới từ các nghệ sĩ mới và tiềm năng của các thị trường âm nhạc trên toàn thế giới. Jukebox Judgement™ số ra ngày 26-4, do biên tập viên Dawn Parry dẫn dắt, tập trung vào những nghệ sĩ indie của Việt Nam. Toàn các nhà sản xuất uy tín Chương trình nằm trong sự hợp tác giữa Jukebox Judgement™ và AXEAN Festival nhằm mở ra một cánh cửa cho các nghệ sĩ trẻ trong khu vực châu Á có cơ hội giới thiệu những bài hát của họ đến với thị trường thế giới. Qua đó tăng độ nhận diện công chúng và tăng tỉ lệ radio play trên các nền tảng quốc tế. Trong số mới nhất về nhạc Việt, biên tập viên Dawn Parry sẽ cùng các nhà sản xuất nghe những ca khúc của Limebócx, Truant Fu, ChipPunks, Lý Bực, Vũ Thanh Vân, Thịnh Suy, Tuimi, MINH, 7UPPERCUTS, iTeu, Mèow Lạc. Mở đầu chương trình, các nhà sản xuất nghe Vắng của Lý Bực - ban nhạc gen Z theo đuổi rock metal. Khi nghe Lý Bực, nhà sản xuất âm nhạc Steve Lillywhite nói, ông ""cảm nhận được năng lượng cũng như đam mê của các nghệ sĩ indie Việt Nam"". Chương trình phát nhiều bài hát của các nghệ sĩ, ban nhạc trẻ ở Việt Nam như: Chết trong em (Thịnh Suy), Heartbreaker (MINH), Camera (ChipPunks)… Tiếng Việt có cách truyền tải đặc biệt Từng nghe nhiều nhạc Nhật, Trung Quốc và Hàn Quốc, nhà sản xuất Barry Upton cho rằng có những nghệ sĩ, ban nhạc tạo nên một làn sóng, có sức ảnh hưởng lớn đến người nghe của cả một khu vực, ví dụ như làn sóng K-pop. ""Ở Việt Nam, các nghệ sĩ trẻ vẫn có thể làm được điều đó khi họ giữ được cá tính của riêng mình"", ông nói. Ông chia sẻ thêm, tiếng Việt có cách truyền tải hoàn toàn khác biệt, không thể nhầm lẫn với các ngôn ngữ khác. Bài hát Camera của nhóm ChipPunks khiến các nhà sản xuất âm nhạc hào hứng và bất ngờ hơn cả. Ông Craig Leon thích thú khi cho rằng cấu trúc bài hát rất thú vị, có sự hài hước. ""Tôi nghe giới thiệu thì bài hát có nội dung nói về những bà hàng xóm có tính ""tọc mạch"" chuyện nhà người khác. Ca khúc mang màu sắc pop rõ rệt"", ông nói. Các nhà sản xuất âm nhạc cho rằng nhóm ChipPunks không làm người nghe thất vọng khi thể hiện đúng cá tính của nhóm mình qua giai điệu, câu từ trong lời ca, thậm chí ngay cả cái tên nhóm cũng khá thú vị (ChipPunks mang nghĩa là ""trò đùa""). Tuy nhiên, họ cũng nhận định rằng Camera là một ca khúc phản ánh đậm đặc văn hóa Việt Nam. Để lan tỏa bài hát ra với thế giới và tạo làn sóng như những ca khúc K-pop, không phải là điều dễ dàng. Bởi nếu chuyển ngữ sang một ngôn ngữ khác, bài hát không giữ được trọn vẹn ý nghĩa châm biếm như trong tiếng Việt.",28/04/2024 19:14 GMT+7,https://tuoitre.vn/365-radio-kenh-phat-thanh-uy-tin-cua-anh-ban-ve-cac-nghe-si-indie-viet-nam-20240428162802762.htm,"Trong Jukebox Judgement™, các nhà sản xuất âm nhạc nổi tiếng cho rằng nhạc Việt có thể tạo được làn sóng nếu các nghệ sĩ giữ được cá tính của họ."
"Tin tức giải trí 28-4: Nam Em xin lỗi, mong một con đường sống","Nam Em xin lỗi, mong antifan tha cho một con đường sống Trưa 28-4, Nam Em bất ngờ đăng tải tâm thư xin lỗi trên trang cá nhân, mong muốn được kết thúc mọi ồn ào. Cô mong antifan cho mình và những người thân một con đường sống, dừng lại những ""cuộc chiến"" trên mạng. Cô viết: ""Trong suốt thời gian vừa qua chúng ta đã rất căng thẳng và có khi kiệt sức vì những năng lượng độc hại. Là một người nổi tiếng tôi xin chịu trách nhiệm toàn bộ những gì tôi đã nói và đã làm. Tôi cũng hy vọng câu chuyện này kết thúc tại đây. Và cũng xin gửi lời xin lỗi đến các bạn. Tôi hy vọng sau ngày hôm nay các bạn tha cho tôi một con đường sống. Cho tôi và anh Cường được sống một cuộc sống bình yên. Không bạo lực, không chiến tranh ngôn từ.  Và cũng xin các bạn tha cho những người đang yêu thương tôi để cho họ một cuộc đời bình yên, một cuộc sống hoà bình - độc lập. Một lần nữa tôi chân thành xin lỗi và biết ơn"". Trước đó Nam Em bị Sở Thông tin và Truyền thông TP.HCM triệu tập lên làm việc lần 2. Hoa khôi Đồng bằng sông Cửu Long nhận mức phạt tăng nặng là 10 triệu đồng và bị đề xuất chặn hai tài khoản mạng xã hội mà cô sở hữu. Vua tiếng Việt tìm ra người chiến thắng trẻ tuổi nhất Đỗ Viết Hưng (17 tuổi) là thí sinh trẻ tuổi nhất chiến thắng game show Vua tiếng Việt. Cậu nam sinh ẵm giải thưởng lớn nhất lên đến 320 triệu đồng sau 4 trận đối đầu khi chinh phục ngôi cao nhất của chương trình với các ô chữ liên quan đến chủ đề máy móc. Khi tham gia Vua tiếng Việt, chiến thuật của Hưng là đoán từ xuôi theo hàng ngang, vận dụng những gợi ý để tưởng tượng ra từ mình định nói và điền vào. Đỗ Viết Hưng là học sinh lớp 11 Trường THPT Lê Quý Đôn (Hà Nội). Cậu được đánh giá là thông minh và có độ nhạy bén ngôn ngữ. Hưng tiết lộ bản thân yêu thích lịch sử, chơi bóng bàn, bóng đá.  Dương Mịch nhận cát xê cao  Bộ phim Cáp Nhĩ Tân 1944 do Dương Mịch, Tần Hạo đóng chính đang là chủ đề bàn tán trên nhiều diễn đàn phim ảnh, mạng xã hội. Ngoài vấn đề diễn xuất, khán giả cũng tò mò về mức cát xê của dàn diễn viên. Theo truyền thông Trung Quốc, Dương Mịch nhận được 8 triệu nhân dân tệ (khoảng 28 tỉ đồng) cho 40 tập phim. Đây là con số khá lớn nhưng không chênh lệch nhiều nếu so với mặt bằng chung các diễn viên hạng A như Dương Tử, Triệu Lệ Dĩnh... Trong khi đó nam chính Tần Hạo chỉ ""bỏ túi"" 6 triệu nhân dân tệ (khoảng 21 tỉ đồng) mặc dù diễn xuất của anh được đánh giá có phần nhỉnh hơn Dương Mịch.  Trong Cáp Nhĩ Tân 1944, Dương Mịch vào vai Quan Tuyết - nữ trưởng phòng đặc vụ tàn nhẫn, lạnh lùng. Để hoàn thành vai diễn, Dương Mịch đã mời giáo viên dạy diễn xuất để trau dồi, luyện tập thêm trước khi bước vào set quay. Tuy nhiên, nhiều khán giả cho rằng cô vẫn có lối diễn gồng cứng, thiếu tự nhiên ở một vài phân cảnh cảm xúc. Tài tử Alec Baldwin mệt mỏi khi đưa con đi dạo Alec Baldwin, nam diễn viên phim Nhiệm vụ bất khả thi được nhìn thấy khi ông đẩy xe đưa hai trong số 7 người con nhỏ đi chơi tại một con phố ở Manhattan, New York. Trong chuyến đi chơi, tài tử Hollywood dừng lại, tựa người vào lan can.  Ông gục đầu xuống, dáng vẻ mệt mỏi. Một bảo mẫu trông hai con cho Alec trong lúc ông nghỉ ngơi một lát. Alec Baldwin có 7 người con với huấn luyện viên yoga Hilaria Thomas gồm: Carmen 11 tuổi, Rafael 9 tuổi, Leonardo 8 tuổi, Romeo 6 tuổi, Eduardo 4 tuổi, María Lucía 3 tuổi và Ilaria một tuổi rưỡi. Trong đó, bé Maria chào đời nhờ người mang thai hộ.  Theo Dailymail, Alec Baldwin đang đối mặt với nhiều khó khăn khi ông sắp phải hầu tòa vì liên quan đến cái chết của người quay phim Halyna Hutchins ở trường quay Rust năm 2021.  Điều này được cho là ảnh hưởng tới sức khỏe và tinh thần của nam diễn viên. Rapper Trung Quốc bị tai nạn gãy xương ở 'Đạp gió 2024' Trong lúc diễn tập cho vòng công diễn 3 tại Đạp gió 2024, rapper Vinida Weng đã bị ngã từ bục cao 2m trên sân khấu, dẫn đến gãy xương cụt đốt sống. Cô lập tức được đưa đến bệnh viện. Tuy nhiên, để không ảnh hưởng đến các thành viên khác, cô từ chối nghỉ ngơi và quyết định tham gia biểu diễn.  Một số người hâm mộ cho biết khi đến tòa nhà ghi hình show để tiễn Vinida ra về, họ thấy cô ôm lưng và được nhiều nhân viên giúp đỡ.  Các nghệ sĩ khác cũng cẩn thận trong việc hỗ trợ Vinida. ""Vinida vẫn bị thương và chưa bình phục"", một nguồn tin tiết lộ. Trên Weibo, Vinida chia sẻ: ""Niềm tin chinh phục được tất cả, cố lên. Đừng lo lắng cho tôi, cảm ơn mọi người nhé"".  Dưới phần bình luận, cộng đồng mạng mong nghệ sĩ mau khỏe để tiếp tục chinh phục thử thách tiếp theo. Đạp gió 2024 quy tụ 36 chị đẹp đến từ nhiều quốc gia, gồm nhiều gương mặt nổi tiếng như: Mai Davika (Thái Lan), Nicole Jung (Mỹ), Joyce Jonathan (Pháp), Mari Kraimbrery (Nga), Sasha Alex Sloan...  Suni Hạ Linh là ca sĩ Việt Nam góp mặt.",28/04/2024 16:24 GMT+7,https://tuoitre.vn/tin-tuc-giai-tri-28-4-nam-em-xin-loi-mong-mot-con-duong-song-20240428152406122.htm,"Một số tin tức đáng chú ý: Nam Em xin lỗi, mong một con đường sống; Vua tiếng Việt tìm ra người chiến thắng trẻ tuổi nhất; Dương Mịch nhận cát xê cao dù diễn xuất gây tranh cãi trong 'Cáp nhĩ tân 1944'..."
