Title,Content,Date,Url,Summary
Những thành phố mơ màng và Sạp show 4 bỏ Thắng Ngọt khỏi chương trình,"Chương trình Những thành phố mơ màng Summer Hà Nội dự kiến diễn ra vào tháng 7 tới tại Hà Nội, bù cho sự kiện ngày 20-4 phải tạm hoãn giữa chừng vì mưa lớn. Còn Sạp show 4 có kế hoạch diễn vào 11-5 tại TP.HCM. Trước đó, cả hai sự kiện đều xác nhận có sự tham gia của Vũ Đinh Trọng Thắng (ban nhạc Ngọt) - hay còn gọi là Thắng Ngọt - trong chương trình. Trong thông báo tối 30-4, ban tổ chức Những thành phố mơ màng cảm ơn sự quan tâm và ý kiến chia sẻ của khán giả về sự tham gia của nghệ sĩ Thắng trong sự kiện diễn ra vào tháng 7 tại Hà Nội. ""Sau khi lắng nghe phản hồi của cư dân và thảo luận kỹ lưỡng, ban tổ chức đi đến quyết định rằng việc không có nghệ sĩ Thắng trong line-up (danh sách nghệ sĩ) của sự kiện lần này là phương án tốt nhất trong thời điểm hiện tại"", thông báo nêu. Với quyết định này, ban tổ chức mong khán giả ""thông cảm và thấu hiểu"". Ban tổ chức thông tin tiếp, ""dù không có sự hiện diện của nghệ sĩ Thắng, Những thành phố mơ màng vẫn sẽ mang đến cho các bạn một sự kiện đầy sắc màu ấn tượng với dàn nghệ sĩ đa dạng và phong phú"". Cụ thể trước mắt, danh sách nghệ sĩ gồm có Obito, Low G, Grey D, Chillies, The Cassette và nhiều nghệ sĩ khác. Còn với Sạp show 4, ban tổ chức thông báo ""sau khi trao đổi và làm việc trực tiếp với đại diện của Thắng, vì lý do cá nhân từ phía nghệ sĩ, ban tổ chức và Thắng quyết định dừng hợp tác và biểu diễn trong đêm nhạc ngày 11-5"". Đồng thời, ban tổ chức sẽ hoàn lại 60% giá vé cho khán giả quyết định không tiếp tục đồng hành cùng show diễn.",30/04/2024 22:42 GMT+7,https://tuoitre.vn/nhung-thanh-pho-mo-mang-va-sap-show-4-bo-thang-ngot-khoi-chuong-trinh-20240430213936626.htm,"Với những ồn ào liên quan đến đời tư của Thắng Ngọt, tối 30-4, ban tổ chức hai sự kiện Những thành phố mơ màng và Sạp show 4 ra thông báo rút nghệ sĩ này khỏi chương trình."
"Dù tin giả về Đà Lạt lan truyền, quảng trường Lâm Viên vẫn kín người dự sự kiện","Từ 18h ngày 30-4, quảng trường Lâm Viên Đà Lạt - nơi diễn ra chung kết bảng quốc tế lễ hội vũ đạo ngoài trời ""Dalat Best Dance Crew 2024 - Hoa Sen Home International Cup"" đã sôi động. Khán giả trật tự xếp hàng vào bên trong khu vực diễn ra cuộc thi. Đường Trần Quốc Toản, dọc hồ Xuân Hương khá đông người dân và du khách qua lại trong dịp nghỉ lễ. Điều này hoàn toàn khác với những thông tin đang lan truyền trên mạng xã hội rằng ""Đà Lạt xảy ra biến lớn"". 20h, lễ hội vũ đạo ngoài trời bắt đầu, khán giả khu vực gần sân khấu chật kín. Khán đài đối diện sân khấu đông kín người, những tiếng hò reo cùng âm nhạc làm nóng không khí ở hồ Xuân Hương. ""Dalat Best Dance Crew 2024 - Hoa Sen Home International Cup"" là hoạt động chính ở quảng trường Lâm Viên trong đêm 30-4. Cuộc thi bắt đầu diễn ra tại Đà Lạt năm 2022, đón nhận được sự quan tâm của khán giả trong nước và quốc tế. Liên quan đến các sự kiện chính trị - xã hội diễn ra tại quảng trường Lâm Viên trong hai ngày lễ 30-4 và 1-5, UBND TP Đà Lạt có văn bản hỏa tốc đề nghị các doanh nghiệp tại quảng trường Lâm Viên tạm ngưng các hoạt động kinh doanh, dịch vụ từ 13h ngày 30-4-2024, các điểm kinh doanh âm nhạc ngoài trời cũng tạm ngưng các hoạt động biểu diễn nghệ thuật trong dịp lễ. Theo UBND TP Đà Lạt, đây là hoạt động cần thiết để thực hiện tốt công tác an ninh trật tự trong quá trình tổ chức các sự kiện chính trị - xã hội tại khu vực quảng trường Lâm Viên trong dịp kỷ niệm 49 năm Ngày Giải phóng miền Nam, thống nhất đất nước (30-4-1975 - 30-4-2024) và Ngày Quốc tế lao động 1-5. Cũng trong chiều 30-4, trang thông tin điện tử Công an tỉnh Lâm Đồng đã chính thức phản bác thông tin ""Đà Lạt xảy ra biến lớn"" đang lan truyền trên không gian mạng gây hoang mang dư luận tại địa phương. Cụ thể, theo Phòng an ninh mạng và phòng, chống tội phạm sử dụng công nghệ cao (Công an tỉnh Lâm Đồng), qua công tác đảm bảo an ninh mạng, đơn vị phát hiện hiện nay trên không gian mạng lan truyền thông tin cho rằng ""Đà Lạt xảy ra biến lớn"", ""Đà Lạt xảy ra vấn đề, cấm người dân ra đường"", ""Đà Lạt xảy ra bạo động, bắn súng..."", gây hoang mang dư luận, ảnh hưởng trực tiếp đến tình hình an ninh trật tự tại địa phương. Công an tỉnh Lâm Đồng khẳng định các thông tin nêu trên là sai sự thật, vi phạm pháp luật.",30/04/2024 21:23 GMT+7,https://tuoitre.vn/du-tin-gia-ve-da-lat-lan-truyen-quang-truong-lam-vien-van-kin-nguoi-du-su-kien-20240430204759568.htm,"Tin giả ""Đà Lạt xảy ra biến lớn"" không làm ảnh hưởng nhiều đến không khí sôi động tại quảng trường Lâm Viên, nơi diễn ra chung kết Dalat Best Dance Crew 2024."
Lý Hải nói gì khi Lật mặt 7 bị chê không hợp lý?,"Trả lời phỏng vấn Tuổi Trẻ Online, đạo diễn Lý Hải thẳng thắn chia sẻ về một số vấn đề xoay quanh bộ phim và giới điện ảnh. Đó là suy nghĩ của anh về tình trạng mà nhiều người cho là một số bộ phim bị ""chèn ép suất chiếu""; chủ đề con cái chăm sóc cha mẹ về già và lý do phim Lật mặt 7 không có nhân vật phản diện. Đặc biệt, Lý Hải cũng phản hồi về luồng ý kiến cho rằng Lật mặt 7: Một điều ước có tình tiết không hợp lý. Tranh cãi nội dung phim * Vừa qua, có một số bình luận thắc mắc liệu có hợp lý lắm khi người mẹ bị thương lại đi khắp một số tỉnh thành để con cái luân phiên chăm sóc như vậy. Quan điểm của anh ra sao? - Trước đó, nếu mọi người xem kỹ thì tôi đã gài cắm rất nhiều. Sau khi bà Hai té, bà chỉ ở một mình, bà sống ở vùng sâu vùng xa. Tại sao tôi không chọn nhà của bà là ở nông thôn, giữa xóm làng? Vì nếu vậy khi té sẽ có chòm xóm qua giúp đỡ bà rất nhiều. Tôi chọn nhà bà Hai sống ở ven rừng vì khi bà bị tai nạn thì sẽ không có ai giúp đỡ, ngoài duy nhất một bà hàng xóm. Một người già không bị tai nạn vốn đã gặp khó khăn trong sinh hoạt ở vùng sâu vùng xa, từ việc chợ búa - bà sống với con gái, nhưng nay con gái phải nuôi con ở bệnh viện. Huống chi giờ gãy một chân, bà không thể sống một mình được. Tôi đã cho anh em trong đoàn phim kiểm tra thử, một bạn trẻ mới hơn 20 tuổi bó nẹp đến trên đầu gối mà cũng không thể đứng lên ngồi xuống, đi vệ sinh, nấu ăn giặt đồ... một mình được. * Khi làm kịch bản, anh có nghe góp ý để phản biện kịch bản sao cho chặt chẽ nhất? - Thường thường, khi tôi viết kịch bản đầu tiên sẽ kể cho bà xã nghe. Khi xong xuôi, tôi sẽ gửi email cho ê kíp đọc. Đa phần tôi chọn những người hiểu nghề vì duyệt khâu quan trọng mà không hiểu nghề thì bộ phim sẽ trở thành lẩu thập cẩm, vì ai cũng có cái tôi hết. Người thích hành động sẽ gài các mảng hành động vào. Người thích drama, ma mị hay thể loại nào đó khác sẽ góp ý vào, gây hoang mang. Là một biên kịch, một đạo diễn đầu tiên bạn phải vững và có lập trường, vì đó là câu chuyện bạn muốn kể. Những người con trong phim đâu có bất hiếu * Một điểm nổi bật khác của phim là không có người xấu. Tại sao anh chọn cách kể này? Trong Lật mặt 7: Một điều ước, tôi không làm điều gì to tát mà kể theo một góc nhìn: mọi người trong xã hội không phải ai cũng xấu. Góc nhìn này rất tích cực và không hề tiêu cực. Tôi nghĩ: tại sao trong xã hội giờ toàn tin tiêu cực, trong khi có rất nhiều câu chuyện tích cực. Tôi quyết định sẽ kể một câu chuyện như vậy để mọi người thấy xã hội tươi đẹp chứ không hề u ám. * Khi người ta nói về chuyện con cái không chăm sóc được bố mẹ già, rất dễ sa vào trách móc, đổ lỗi. Anh không chọn cách đó, vì sao? - Tôi xác định ngay từ đầu là không có người xấu trong phim.  Nếu chúng ta ngồi lại tìm cách giải quyết với nhau thì mọi điều sẽ êm đẹp. Những người con đâu có bất hiếu, vì hoàn cảnh mà họ không thể trực tiếp nuôi mẹ.  Như tôi chẳng hạn, tôi rất thương mẹ mình nhưng nói bỏ hết công việc chạy về chăm mẹ là cả một vấn đề.  Rất may là gia đình tôi đông anh em, các anh chị thay phiên chăm mẹ rất chu đáo. Phim bị chèn ép hay quy luật kinh doanh? * Gần đây, có một số phim Việt có lịch chiếu ít ỏi, doanh thu bị ảnh hưởng rất nhiều. Một số nhà làm phim cho rằng phim họ bị ""chèn ép"". Là một nhà làm phim lâu năm, từ khi Lật mặt chưa phải là một thương hiệu mạnh, anh nghĩ sao về vấn đề này? - Loạt phim Lật mặt ra từ cách đây 9 năm, năm nào cũng đụng độ những bom tấn lớn của nước ngoài, có năm là Avengers. Phần 1, phần 2, phần 3 của Lật mặt đều gặp chuyện này: phim tôi đang chiếu, suất đang tốt, phim nước ngoài ra là phim tôi rớt suất thảm hại luôn. Nhưng mình phải bền bỉ leo. Tôi còn nhớ phim Lật mặt 3: Ba chàng khuyết vừa ra đã được khán giả đón nhận, bùng nổ trong 2, 3 ngày đầu. Nhưng khi một phim Hollywood ra thì Lật mặt 3 bị rớt còn vài trăm suất một ngày. Lúc đó tôi không hiểu tại sao lại thế. Lúc rớt suất chiếu, rớt doanh thu thì mình buồn chứ. Tôi đã từng trải qua những lúc mất ăn mất ngủ đó rồi. Sau này, tôi mới hiểu rõ hơn là trong kinh doanh, các cụm rạp một năm phát hành rất nhiều phim, nhưng không phải phim nào cũng bán vé được. Nếu tôi đặt mình là người đầu tư vào cụm rạp đó, thì phim nào bán vé được mình phải sắp suất chiếu để lấy phần doanh thu ăn chia với nhà đầu tư của phim (50/50 mà). Phim ra rạp chỉ ăn nhiều trong tuần lễ đầu nên họ phải tranh thủ kiếm lợi nhuận.",30/04/2024 18:50 GMT+7,https://tuoitre.vn/ly-hai-noi-gi-khi-lat-mat-7-bi-che-khong-hop-ly-20240430162255059.htm,"Trước ý kiến cho rằng phim Lật mặt 7 có tình tiết không hợp lý và khiên cưỡng, đạo diễn Lý Hải cho biết anh gài cắm chặt chẽ và tin ở kịch bản của mình."
"Tin tức giải trí 30-4: Thái Hòa gửi lời tri ân ngày 30-4, Hanbin rạng ngời bên cờ Tổ quốc","'Bảy Theo' Thái Hòa gửi lời tri ân những chiến sĩ hy sinh cho Tổ quốc Fanpage phim Địa đạo: Mặt trời trong bóng tối của đạo diễn Bùi Thạc Chuyên vừa đăng clip diễn viên Thái Hòa, nam chính của phim, gửi lời cảm ơn đến những chiến sĩ đã hy sinh vì hòa bình đất nước nhân dịp lễ 30-4 và 1-5.  Trong clip, Thái Hòa nói: ""Hôm nay là ngày 30-4, ngày kỷ niệm đất nước hòa bình, thống nhất.  Bảy Theo cùng anh em du kích Bình An Đông xin gửi lời cảm ơn và tri ân các chiến sĩ, những người đã hy sinh cho Tổ quốc, cho ngày đất nước thống nhất"". Địa đạo là dự án phim điện ảnh lấy bối cảnh địa đạo Củ Chi trong những tháng năm miền Nam rực lửa trước ngày giải phóng.  Phim có những câu chuyện đan xen giữa tình đồng đội, tình yêu và khát khao sống của những người lính và trên hết là nghĩa vụ bảo vệ cho hòa bình của Tổ quốc.  Đây là dự án điện ảnh tâm huyết được ấp ủ trong 10 năm của Bùi Thạc Chuyên và ê kíp. Trong phim, Thái Hòa vào vai nam chính Bảy Theo chỉ huy đội du kích tại căn cứ Bình An Đông, trở thành mục tiêu tìm và diệt của địch. Hanbin Ngô Ngọc Hưng (TEMPEST) khoe ảnh rạng ngời bên cờ Tổ quốc  Ngày 30-4, ca sĩ Hanbin Ngô Ngọc Hưng, nhóm TEMPEST đăng tải hình ảnh anh chụp cùng với lá cờ đỏ sao vàng ở một cánh đồng hoa cúc họa mi.  Nam ca sĩ diện trang phục giản dị, miệng nở nụ cười rạng rỡ.  Hình ảnh của Ngọc Hưng ngay lập tức gây sốt cộng đồng mạng. Nhiều diễn đàn về K-pop cũng chia sẻ lại hình ảnh này của anh.  Nhiều người thích thú bình luận: ""30-4 năm nay chụp với lá cờ đỏ sao vàng và hoa cúc họa mi.  Chàng trai này lúc nào cũng tinh tế như vậy! Yêu nước như vậy! Đáng trân quý lắm - Hanbin Ngô Ngọc Hưng"";  ""Bức ảnh đẹp và tinh tế như con người Hanbin vậy. Hình ảnh rạng rỡ đầy hạnh phúc bên lá cờ Tổ quốc tung bay, nụ cười em đẹp như ngày Giải phóng""... Nữ bác sĩ 70 tuổi sải bước trên sàn diễn của nhà mốt xa xỉ Những người yêu thời trang bất ngờ khi thấy một nữ người mẫu lớn tuổi xuất hiện trên sàn diễn của thương hiệu Miu Miu, sánh bước cùng những tên tuổi hàng đầu trong làng thời trang như Gigi Hadid hay Amelia Gray. Nhân vật gây chú ý là bà Qin Huilan (70 tuổi, Trung Quốc) - khách hàng thân thiết của thương hiệu Miu Miu và Prada.  Trước đó, bà được biết đến nhờ những bức hình thời trang do con trai đăng tải trên mạng xã hội. Theo những hình ảnh được chia sẻ, bà Huilan thường xuyên xuống phố trong diện mạo sành điệu, từ đó thu hút nhiều sự chú ý của những người yêu thời trang. Hiện tại, công việc chính của bà là bác sĩ. Chia sẻ với Cosmopolitan, bà nói bà nhận được lời mời tham dự show diễn Miu Miu thuộc Tuần lễ thời trang Paris (Pháp) qua chính tài khoản mạng xã hội.  Ban đầu, bà có chút lưỡng lự vì lo ngại không sắp xếp được công việc cũng như rào cản ngôn ngữ.  Tuy nhiên, bà đã quyết định tham dự vì muốn chứng minh tuổi tác không phải vấn đề lớn. Ở tuổi 70, bà Huilan vẫn luôn nổi bật với những trang phục mang tông màu rực rỡ, giày cao gót và phụ kiện bắt mắt. Bà được xem là minh chứng sống, phá vỡ những quan điểm lạc hậu về phụ nữ cao tuổi ở Trung Quốc.  Lisa (BlackPink) hẹn hò bạn trai ở Pháp Trong loạt ảnh vừa được một tài khoản đăng tải trên X, Lisa (BlackPink) sánh đôi bạn trai Frédéric Arnault tại bảo tàng Rodin, Pháp. Cả hai vừa đi vừa ăn kem và trò chuyện. Khuôn viên bảo tàng có nhiều người nhưng cặp đôi tương tác thoải mái và cười nói vui vẻ.  Hình ảnh sánh đôi của Lisa và bạn trai tin đồn ngay lập tức thu hút sự chú ý của người hâm mộ. Trên các diễn đàn, có ý kiến cho rằng Lisa sau khi chấm dứt hợp đồng cá nhân với YG chỉ tập trung yêu đương, không tung sản phẩm solo.  Tuy nhiên, số khác cho rằng đây là chuyện riêng của nghệ sĩ, vì thế hãy tôn trọng sự lựa chọn của cô. Bạn trai tin đồn của Lisa là Frédéric Arnault, con trai của tỉ phú Bernard Arnault và bà Hélène Mercier.  Cả hai chưa lên tiếng chính thức, song việc họ thường xuyên xuất hiện cùng nhau là cơ sở để người hâm mộ khẳng định mối quan hệ tình cảm của cặp đôi. Lý Hiện gây sốt với bộ ba phim tình cảm Lý Hiện đang gây chú ý khi tham gia bộ phim Sắc xuân gửi người tình, đóng cùng Châu Vũ Đồng. Trong phim, Lý Hiện vào vai Trần Mạch Đông, là một thanh niên có tính tình ngang bướng. Nhưng sau biến cố cuộc đời, anh chọn trở thành nhân viên trang điểm cho thi hài người chết. Châu Vũ Đồng vào vai Trang Khiết. Cô từng bị tai nạn giao thông khiến một chân không còn nguyên vẹn. Hai người dần cảm mến và xây đắp nên một tình yêu ấm áp. Đặc biệt hơn, chính bà nội của Trần Mạch Đông là người chủ động mai mối cháu trai cho Trang Khiết. Chi tiết này khiến khán giả nhớ lại hai bộ phim tình cảm đình đám trước đó của Lý Hiện. Đó là phim Cá mực hầm mật và Đi đến nơi có gió. Trong các phim này, Lý Hiện cũng được ông nội, bà nội cật lực ""đẩy thuyền"" với nữ chính. Khán giả bày tỏ sự yêu mến cho những bậc phụ huynh trong phim khi luôn là chỗ dựa vững vàng cho nam chính Lý Hiện để giúp anh có được tình yêu trong đời. Phim Sắc xuân gửi người tình của Lý Hiện ghi nhận 20.000 lượt xem sau 40 phút đầu ra mắt trên Tecent, một nền tảng phim nổi tiếng ở Trung Quốc. Trước đó, bộ phim ghi nhận con số 2 triệu lượt người đặt xem trước. ",30/04/2024 16:48 GMT+7,https://tuoitre.vn/tin-tuc-giai-tri-30-4-thai-hoa-gui-loi-tri-an-ngay-30-4-hanbin-rang-ngoi-ben-co-to-quoc-20240430161248624.htm,Một số tin tức đáng chú ý: 'Bảy Theo' Thái Hòa trong phim Địa đạo gửi lời tri ân những chiến sĩ hy sinh cho Tổ quốc; Hanbin Ngô Ngọc Hưng (TEMPEST) khoe ảnh rạng ngời bên lá cờ Tổ quốc...
Nữ hoàng mặt nạ Oh Yoon Ah và tình yêu lớn với con trai tự kỷ,"Tình mẹ con của Oh Yoon Ah và con Song Min tạo ra những thông điệp tích cực, mang lại  hy vọng và niềm an ủi cho nhiều người. Như ý kiến của một khán giả viết: “Tôi tôn trọng Oh Yoon Ah. Làm mẹ đơn thân không hề dễ dàng. Cô yêu con trai mình đến nhường nào. Min thật tuyệt vời. Cô là hình mẫu cho phụ nữ trên khắp thế giới và truyền cảm hứng cho nhiều người”. Oh Yoon Ah được an ủi từ con trai Oh Yoon Ah sinh năm 1980, kết hôn và sau đó ly hôn vào năm 2015. Cô nuôi con trai Song Min bị chứng tự kỷ. Oh Yoon Ah yêu con và không ngại kể những cảm xúc của một người mẹ có con đặc biệt trên các show truyền hình. Oh Yoon Ah từng kể gia đình cô đã chuyển từ căn hộ sang trọng nhìn ra sông Hàn đến một ngôi nhà riêng bởi sự dè bỉu của người dân sống trong căn hộ khi nhìn thấy con trai cô. “Một cặp đôi nhìn chằm chằm vào con trai trong thang máy. Khi Min cất tiếng 'woo-woo', họ có vẻ không thoải mái”, cô kể. Mẹ của Oh Yoon Ah xin lỗi và giải thích: ""Đó là vì đứa trẻ bị bệnh"", nhưng họ lại nói: ""Tại sao bà lại nuôi một đứa trẻ bị bệnh ở đây?"". Thú nhận trong một show truyền hình rằng có những lúc không thể chịu nổi và khó khăn nhưng Oh Yoon Ah bảo: tình yêu thương là hình thức giao tiếp hiệu quả nhất của cô với con trai. Cô cũng nói về những thay đổi tích cực trong cuộc sống của con kể từ khi Min xuất hiện trong các chương trình giải trí. Thậm chí trên kênh YouTube của Oh Yoon Ah, các video chia sẻ cuộc sống của cô và con trai thu hút lượt xem cao nhất.  Còn trên phim trường, mọi người thường nhận ra con trai Min trước khi nhận ra cô. Năm 2020 Oh Yoon Ah và con trai làm người mẫu cho trang bìa tạp chí The Big Issue với mục đích nâng cao nhận thức về bệnh tự kỷ. Cô hy vọng mọi người sẽ nhìn trẻ tự kỷ một cách thân thiện hơn. Cuộc báo thù trong Nữ hoàng mặt nạ Trong phim Nữ hoàng mặt nạ, Oh Yoon Ah vào vai Go Yoo Na - thành viên của nhóm bạn thân gồm bốn người: Do Jae Yi (Kim Sun Ah), Go Yoo Na (Oh Yoon Ah), Joo Yoo Jung (Shin Eun Jung) và Yoon Hae Mi (Yoo Sun). 10 năm trước, cô bị đổ tội giết người phải trốn sang Mỹ và có cuộc sống mới bên chồng và con gái. Một ngày nọ, con gái đột nhiên mất tích khiến Go Yoo Na phải quay trở về Hàn Quốc để tìm con và đối mặt với những người bạn từng phản bội mình. Nữ hoàng mặt nạ vừa lên sóng tập đầu tiên lúc 17h45 ngày 29-4 trên HTV7 và phát sóng từ thứ hai đến thứ sáu hằng tuần.",30/04/2024 16:34 GMT+7,https://tuoitre.vn/nu-hoang-mat-na-oh-yoon-ah-va-tinh-yeu-lon-voi-con-trai-tu-ky-2024043000005154.htm,"Trong phim mới 'Nữ hoàng mặt nạ', Oh Yoon Ah vào vai Go Yoo Na - người mẹ từ Mỹ trở về Hàn Quốc tìm con gái bị mất tích. Ngoài đời, Oh Yoon Ah cũng là người mẹ ấm áp tình yêu lớn với cậu con trai tự kỷ nay 18 tuổi."
300 chiến sĩ bộ tư lệnh TP.HCM tham gia MV Đất nước trọn niềm vui,"Đất nước trọn niềm vui do nhạc sĩ Hoàng Hà sáng tác năm 1975, trong bối cảnh đất nước mong chờ ngày vui thống nhất. MV nằm trong chương trình Thành phố tình ca, giới thiệu ca khúc hay về TP.HCM. Đất nước trọn niềm vui trong ngày 30-4 lịch sử Lời và giai điệu ca khúc Đất nước trọn niềm vui hào hùng, tràn ngập niềm hân hoan dân tộc mừng vui chiến thắng. Trung Kiên là ca sĩ hát đầu tiên ca khúc này. Trong MV mới, ca sĩ Phạm Thế Vĩ trình bày ca khúc. Với chất giọng nam cao, ông đã truyền tải tinh thần bài hát khá trọn vẹn. MV được đầu tư với sự tham gia của 300 chiến sĩ bộ tư lệnh TP.HCM, gần 50 đoàn viên, thiếu nhi. Hình ảnh xuyên suốt của MV là lá cờ đỏ sao vàng, đan xen là clip phim tư liệu và hình ảnh mới của TP.HCM: như di tích lịch sử dinh Độc Lập, công viên Landmark, sân bay trực thăng tòa nhà Bitexco, phố đi bộ Nguyễn Huệ. Các chiến sĩ và các bạn trẻ trong chiếc áo cờ đỏ sao vàng xếp hình thành ngôi sao vàng, dải hình chữ S đất nước. Thành phố tình ca với những ca khúc về TP.HCM Đất nước trọn niềm vui là ca khúc nằm trong chương trình Thành phố tình ca do ban ca nhạc Đài truyền hình TP.HCM tổ chức. Chương trình mới giới thiệu các ca khúc nổi tiếng về TP.HCM, đồng thời đưa người xem đến những hình ảnh và câu chuyện thú vị về thành phố. Lên sóng từ tháng 1-2024, Thành phố tình ca gồm có 30 số. Chương trình gala tổng kết diễn ra đúng ngày 30-4-2025, kỷ niệm 50 năm ngày giải phóng miền Nam, thống nhất đất nước. Theo ban tổ chức, chương trình góp vào “thư viện văn hóa nghệ thuật” của thành phố những tư liệu về tác giả, tác phẩm và các sự kiện văn hóa đặc sắc. Với mỗi tập phát sóng, khách mời là ca sĩ, nhạc sĩ đưa ra những ý kiến, nhận xét về những điểm độc đáo của thành phố mang tên Bác, đồng thời giới thiệu những tác phẩm văn hóa - nghệ thuật về TP.HCM từ kiến trúc, nhiếp ảnh đến hội họa, văn thơ.",30/04/2024 16:30 GMT+7,https://tuoitre.vn/300-chien-si-bo-tu-lenh-tp-hcm-tham-gia-mv-dat-nuoc-tron-niem-vui-20240430161238234.htm,"Ca khúc “Đất nước trọn niềm vui” có sự tham gia của 300 chiến sĩ bộ tư lệnh TP.HCM cùng gần 50 đoàn viên, thiếu nhi."
