Title,Content,Date,Url,Summary
"Du khách chen lấn, chờ tàu đi Phú Quốc","Ngày 28-4, ghi nhận của Tuổi Trẻ tại bến tàu Hà Tiên đi Phú Quốc, tỉnh Kiên Giang, nhiều du khách phải đợi xếp hàng dài để được lên tàu cao tốc đi Phú Quốc. Chưa 9h sáng, thời tiết đã bắt đầu nắng gay gắt. Trên bờ, lượng xe ô tô của du khách đậu tại các bến đậu xe cũng đông nghẹt.  ""Đợt nghỉ lễ 30-4 và 1-5 này kéo dài 5 ngày, nên gia đình tôi có bốn người ra Phú Quốc để vui chơi, tắm biển. Ban đầu cũng tính đi xa, nhưng nghe bà con nói biển mùa này đẹp lắm nên chúng tôi quyết định đi Phú Quốc, vừa gần vừa đẹp"", anh Quý, ngụ tỉnh Đồng Tháp, nói. Nhiều người ra Phú Quốc chỉ muốn xem show diễn triệu đô như: ""Nụ hôn của biển cả"" ở thị trấn Hoàng Hôn (phường An Thới), hoặc show diễn ""Sắc màu Venice"", ""Tinh hoa Việt Nam"" ở khu Grand World Phú Quốc... Ông Vũ Văn Khương - tổng giám đốc Công ty cổ phần Tàu cao tốc Phú Quốc - cho hay tàu Express đã điều chỉnh giá vé niêm yết tuyến Rạch Giá - Phú Quốc, Hà Tiên - Phú Quốc giảm mạnh để kích cầu du lịch Phú Quốc.  Cụ thể, nếu như trước đây giá tàu tuyến Rạch Giá - Phú Quốc dao động từ 255.000 - 540.000 đồng/vé thì hiện nay chỉ còn từ 235.000 - 500.000 đồng/vé tùy theo khách là trẻ em, người lớn, người già hay khuyết tật, giảm từ 1,9% đến 16,7%.  Tuyến Hà Tiên - Phú Quốc giá cũ từ 187.000 - 350.000 đồng/vé thì hiện nay chỉ còn từ 160.000 - 330.000 đồng/vé, giảm từ 5,7% đến 26%. ""Nếu như bình thường, tàu Express chạy 4 chuyến/ngày thì đợt lễ này đã tăng thêm 2 chuyến, nâng lên tổng số 6 chuyến/ngày.  Chúng tôi cũng giảm giá để kích cầu du lịch phục vụ du khách đến với Phú Quốc nhiều hơn. Giá vé này giữ đến cuối năm 2024 mới tính tiếp"", đại diện tàu Express nói. Một đại lý tàu cao tốc cho biết tàu Superdong trong đợt lễ này có 4 chuyến/ngày, với giá tàu từ 240.000 - 324.000 đồng/vé/người tùy khách là trẻ em, người già, người lớn. Theo báo cáo của UBND tỉnh Kiên Giang, trong quý 1, tỉnh có trên 2,75 triệu lượt khách du lịch, tăng 22,12% so với cùng kỳ; doanh thu từ du lịch 7.274 tỉ đồng, đạt 36,4%, tăng 35,6% so với cùng kỳ… Tổng thu ngân sách đạt trên 5.000 tỉ đồng, tăng 24,44% so với cùng kỳ. Hình ảnh du khách đi tàu ra Phú Quốc nghỉ lễ 30-4 và 1-5:",28/04/2024 17:10 GMT+7,https://tuoitre.vn/du-khach-chen-lan-cho-tau-di-phu-quoc-20240428161309582.htm,"Ngày 28-4, lượng khách đi Phú Quốc tăng nhanh tại các bến tàu và phải chen lấn chờ rất lâu."
Nhà báo kỳ cựu Richard Quest của Đài CNN: Việt Nam giờ đây thật hấp dẫn,"Đó là những chia sẻ từ Richard Quest, người dẫn chương trình du lịch Quest’s World of Wonder của Đài truyền hình CNN, với Tuổi Trẻ sau khi cùng đoàn phim của CNN đến Việt Nam từ 23-4 để thực hiện những cảnh quay giới thiệu TP.HCM đến khán giả thế giới. Đi tìm những trải nghiệm độc nhất ""Nắng nóng khủng khiếp. Tôi sắp chết đến nơi rồi! Tôi đã từng đến Việt Nam một lần vào 20 năm trước, thời tiết lúc đó không nóng như bây giờ"" - Richard Quest nói khi trao đổi với Tuổi Trẻ tại cuộc hẹn vào cuối tuần. Nói về chương trình du lịch Quest’s World of Wonder, Quest cho biết mỗi tháng sẽ chọn một thành phố để giới thiệu với tiêu chí mang lại cho khán giả nhiều khám phá và trải nghiệm thú vị, độc nhất và hữu ích. Trước khi đến TP.HCM, Quest đã đến nhiều địa điểm nổi tiếng khác như Bangkok, Paris, London và sắp tới là Osaka (Nhật Bản), Melbourne (Úc)... ""Tôi không đến Việt Nam suốt 20 năm qua, và vì vậy tôi quyết định sẽ chọn nơi này làm điểm đến tiếp theo của chương trình. Việt Nam giờ đây thật hấp dẫn, với sự nồng hậu, chào đón du khách từ khắp nơi trên thế giới đổ về, ngày càng đặt trọng tâm vào phát triển du lịch"", ông nói. Để mang lại những góc nhìn và chia sẻ thực tế nhất, bản thân Quest phải trải nghiệm thực tế sinh hoạt ở mỗi điểm đến. Tại Việt Nam, những trải nghiệm đều rất đặc trưng và có phần mới mẻ mà nhiều chương trình khác chưa nhắc đến. Đó là học cách băng qua đường, thưởng thức bánh xèo, trải nghiệm múa rối nước... ""Chúng tôi cũng trò chuyện với nhiều nhân vật, phỏng vấn từ các câu chuyện văn hóa như múa rối nước, À Ố Show, đến góc nhìn phát triển kinh tế, du lịch"", ông tiết lộ. Richard Quest: Du lịch Việt Nam sẽ tăng trưởng mạnh mẽ Richard Quest cho biết rất ngạc nhiên về sự phát triển và hiện đại của Việt Nam, đặc biệt là rất ấn tượng vì sự thân thiện của người Việt, chất lượng thức ăn và dịch vụ đều rất tuyệt vời. Tất cả những yếu tố này sẽ thúc đẩy sự phát triển không ngừng và vượt bậc của du lịch. ""Việt Nam đã sẵn sàng cho sự tăng trưởng đáng kinh ngạc về du lịch, đặc biệt là trong 10 năm tới. Sẽ có rất nhiều người đến tham quan, kéo theo đó là câu chuyện về quản lý du lịch, phát triển bền vững, làm thế nào để không thiệt hại về môi trường. Đó sẽ là thách thức, nhưng cũng là cơ hội"", ông chia sẻ. Đặc biệt, theo ông Quest, với ""sự hỗn loạn một cách có tổ chức"" cùng sự ồn ào, náo nhiệt liên tục khiến TP.HCM có sự khác biệt với những thành phố mà chương trình của CNN từng thực hiện. ""Khi nhìn ra từ cửa sổ khách sạn, tôi thấy những dòng xe máy nối đuôi nhau. Mọi người di chuyển, hoạt động. Mọi thứ ở TP.HCM trông rất mượt mà. Nếu đặt một bản nhạc vào cuộc sống nơi đây, bạn sẽ tưởng tượng như thể những giai điệu sẽ vang lên sau mỗi chuyển động, biến thành phố thành một vở ballet đặc sắc"", Quest ví von. ""Tôi nhìn thấy ở Việt Nam một thế hệ trẻ đang không ngừng tiến về phía trước, nỗ lực phát triển, vươn lên. Chầm chậm mà chắc chắn, Việt Nam đang dần hội nhập vào nền kinh tế lớn hơn, rộng hơn. Và điều hấp dẫn là Việt Nam có 100 triệu dân. Các bạn không phải là một quốc gia nhỏ"", ông nói.",02/05/2024 11:19 GMT+7,https://tuoitre.vn/nha-bao-ky-cuu-richard-quest-cua-dai-cnn-viet-nam-gio-day-that-hap-dan-2024050122371815.htm,"""Tôi nhìn thấy ở Việt Nam một thế hệ trẻ đang không ngừng tiến về phía trước, nỗ lực phát triển, vươn lên"", nhà báo kỳ cựu của Đài CNN nhận xét."
Ổn định giá phòng nghỉ giúp du lịch Huế bội thu dịp lễ,"Ngày 2-5, ông Nguyễn Văn Phúc, giám đốc Sở Du lịch Thừa Thiên Huế, cho biết ngành du lịch tỉnh nhà vừa có một kỳ nghỉ lễ ""bội thu"". Từng dự báo ngành du lịch Huế sẽ gặp khó trước lễ Theo thống kê của ngành du lịch Huế, dịp lễ vừa qua tỉnh này ước đón khoảng 110.000 khách du lịch đến tỉnh để nghỉ lễ 30-4, 1-5. Tổng lượng khách đã đặt phòng lưu trú ước đạt 58.000 lượt (trong đó có khoảng 43.000 khách nội địa và 15.000 khách quốc tế), tổng doanh thu ước đạt 170 tỉ đồng. Công suất phòng bình quân của các cơ sở lưu trú du lịch đạt 85%. Hầu hết các khách sạn, kể cả nhóm khách sạn 4-5 sao và homestay đã kín phòng trong những ngày cao điểm từ 27-4 đến 30-4. Các điểm du lịch nghỉ dưỡng hoặc dịch vụ trải nghiệm gắn với thiên nhiên (đồi núi, suối, thác, biển và đầm phá) và ẩm thực đều kín khách dịp này. Riêng lượng khách vào tham quan các di tích do Trung tâm Bảo tồn di tích cố đô Huế quản lý trong 4 ngày đầu của kỳ nghỉ lễ đạt hơn 58.300 lượt khách (trong số đó có gần 15.000 lượt khách quốc tế mua vé vào tham quan di tích). Tổng doanh thu của di tích dịp này đạt gần 9 tỉ đồng. So với cùng kỳ dịp lễ năm 2023, lượng khách đến Huế tăng 15,8%, doanh thu du lịch tăng 9,7%. Khoảng 1 tuần trước kỳ nghỉ lễ năm nay, ngành du lịch Huế chỉ đưa ra con số khá khiêm tốn dự kiến đón khoảng 65.000 lượt khách đến vui chơi, nghỉ ngơi và tổng doanh thu từ ngành này khoảng 101 tỉ đồng. Nguyên do là vé máy bay nội địa trước lễ khá cao, cộng thêm thời tiết được dự báo nắng nóng kỷ lục, nên ngành du lịch dự báo người dân đến tham quan các điểm di tích sẽ bị ảnh hưởng. Ổn định giá phòng nghỉ giúp ngành du lịch ""bội thu"" Chị Kim Hằng, giám đốc khu du lịch YesHue Eco (huyện Nam Đông, Thừa Thiên Huế), cho biết trong 5 ngày nghỉ lễ, khu du lịch của chị đón hàng ngàn lượt khách đến tắm suối, nghỉ ngơi tránh nóng. ""Lượt khách đến với khu du lịch chúng tôi đông hơn ngày thường gấp nhiều lần. Tuy nhiên không vì thế chúng tôi tăng giá phòng và dịch vụ ở đây. Khu du lịch cũng huy động thêm nhân lực túc trực để phục vụ du khách trong kỳ nghỉ lễ"", chị Hằng nói. Theo ông Nguyễn Văn Phúc, có nhiều nguyên nhân khiến ngành du lịch Huế bội thu dịp lễ này. Đầu tiên là Huế trong thời gian gần đây đã đưa vào rất nhiều sản phẩm du lịch mới như điện Kiến Trung bên trong hoàng cung; phát triển, quảng bá sản phẩm du lịch suối, thác tự nhiên trên địa bàn. Một phần nữa, theo ông Phúc, là khách đến Huế dịp này chủ yếu đi theo đoàn gia đình và thường thuê hoặc tự lái xe đi. Hệ thống đường sá dẫn đến Huế những năm trở lại đây cũng được đầu tư, hoàn thiện với hệ thống cao tốc La Sơn - Túy Loan, Cam Lộ - La Sơn thông suốt… Điều này cũng lý giải được phần nào việc giá vé máy bay dù tăng cao nhưng lượng khách đến Huế vẫn tốt. Điều quan trọng nhất, theo ông Phúc, đó là việc ngành du lịch Huế thường xuyên vận động, kiểm tra các cơ sở lưu trú, nhà nghỉ, khách sạn, homestay… để các đơn vị này ổn định giá phòng, không ""chặt chém"", cũng không hạ giá quá thấp để cạnh tranh. ""Các phòng nghỉ có sự cạnh tranh mà theo tôi là cạnh tranh giá lành mạnh khi không nâng, hạ giá quá nhiều, mà bù lại là tăng chất lượng dịch vụ. Trong kỳ nghỉ lễ, chúng tôi cũng thường xuyên kiểm tra, tiếp nhận phản hồi từ du khách về nạn ""chặt chém"", nhưng đến lúc này chưa ghi nhận phản ánh nào tiêu cực về dịch vụ du lịch ở Huế dịp lễ"", ông Phúc nói.",02/05/2024 10:02 GMT+7,https://tuoitre.vn/on-dinh-gia-phong-nghi-giup-du-lich-hue-boi-thu-dip-le-20240502090406805.htm,"Được dự báo về một kỳ nghỉ lễ đầy khó khăn do vé máy bay cao và nắng nóng, Huế đã có những giải pháp căn cơ giúp ngành du lịch đạt những con số bội thu."
"Khách quốc tế đến Phú Quốc tăng gấp 2,2 lần, khách nội địa giảm","Ngày 2-5, ông Bùi Quốc Thái - giám đốc Sở Du lịch tỉnh Kiên Giang - thông tin về tình hình du lịch trong 5 ngày nghỉ lễ 30-4 và quốc tế lao động 1-5. Theo đó, trong 5 ngày nghỉ lễ, Kiên Giang đón 272.547 lượt khách, tăng 2,9% so với cùng kỳ.  Trong đó, khách du lịch quốc tế 23.911 lượt, tăng gấp 2,4 lần so với cùng kỳ; khách du lịch nội địa 248.636 lượt, giảm 3,6% so với cùng kỳ; khách tham quan các khu, điểm du lịch đạt 178.278 lượt, giảm 6,6% so với cùng kỳ…  Tổng thu từ du lịch đạt gần 600 tỉ đồng, tăng hơn 1,8 lần so với cùng kỳ (do lượng khách quốc tế tăng cao nên tổng thu cao). Riêng TP Phú Quốc ước đón 125.860 lượt khách, tăng 11,7% so với cùng kỳ. Trong đó, khách quốc tế 22.424 lượt, tăng gấp 2,2 lần so với cùng kỳ; khách lưu trú 46.828 lượt, tăng 23,7% so với cùng kỳ. Các doanh nghiệp du lịch tạo cảnh quan xanh, sạch, đẹp, đảm bảo vệ sinh an toàn thực phẩm; tuân thủ các quy định về đăng ký giá, niêm yết giá cả dịch vụ; tăng cường công tác xúc tiến quảng bá để thu hút khách…",02/05/2024 09:11 GMT+7,https://tuoitre.vn/khach-quoc-te-den-phu-quoc-tang-gap-2-2-lan-khach-noi-dia-giam-2024050122124791.htm,"Trong 5 ngày nghỉ lễ, lượng khách du lịch đến Kiên Giang gần 280.000 lượt, trong đó khách quốc tế tăng 2,4%, còn khách nội địa giảm 3,6% so với cùng kỳ. Riêng TP Phú Quốc lượng khách quốc tế là 22.424 lượt, tăng gấp 2,2 lần so với cùng kỳ."
"Du khách chết đuối, hai điểm du lịch tự phát trên suối Nước Lạnh bị buộc tháo dỡ","Tối 1-5, lãnh đạo UBND xã Trường Xuân (huyện Quảng Ninh, tỉnh Quảng Bình) xác nhận chính quyền địa phương đã có quyết định đình chỉ hoạt động với hai điểm du lịch tự phát trên suối Nước Lạnh sau khi có du khách chết đuối. Hai hộ dân là chủ của hai điểm du lịch này cũng phải tự tháo dỡ những hạng mục lán trại, dây đu đã tự xây dựng đón khách trên suối. Chủ của hai điểm du lịch này là bà Hồ Thị Đoan và bà Hồ Thị Đăng (cùng ở xã Ngân Thủy, huyện Lệ Thủy, tỉnh Quảng Bình). Cả hai đã tự ý xây dựng các lán trại, nhà kiên cố trên đất rừng sản xuất để đón khách vào tắm suối Nước Lạnh. Cũng theo chính quyền địa phương, sáng cùng ngày lực lượng chức năng của huyện Quảng Ninh gồm phòng văn hóa, kiểm lâm, ban quản lý rừng và UBND xã Trường Xuân đã đến trực tiếp tại hai điểm du lịch tự phát này để xác minh.  Kết quả xác minh cho thấy mỗi ngày tại đây thu hút hơn 1.000 lượt khách đến tắm. Mức vé vào cổng của khách phải nộp là 20.000 đồng. ""UBND xã sắp tới sẽ làm biển báo nơi nguy hiểm, cấm tắm"", lãnh đạo xã thông tin. UBND huyện Quảng Ninh cũng thông tin: vì vị trí của hai điểm du lịch tự phát này nằm ở giáp ranh giữa Quảng Ninh và Lệ Thủy, nên trong thời gian đến hai huyện sẽ làm việc, bàn bạc để giải quyết theo quy định của pháp luật. Như Tuổi Trẻ Online đã thông tin, chiều 30-4, ông L.V.Đ. (52 tuổi, ở xã An Ninh, huyện Quảng Ninh) đến điểm du lịch suối Nước Lạnh - View Triệu Đô để tắm. Đến chiều cùng ngày, trong lúc đang tắm, ông Đ. không may chết đuối. Thi thể ông Đ. sau đó được cơ quan chức năng tìm thấy. Hiện ông Đ. đã được gia đình đưa về nhà lo hậu sự.",01/05/2024 22:09 GMT+7,https://tuoitre.vn/du-khach-chet-duoi-hai-diem-du-lich-tu-phat-tren-suoi-nuoc-lanh-bi-buoc-thao-do-20240501215018819.htm,"Sau khi du khách chết đuối trên suối Nước Lạnh, chính quyền địa phương đã buộc tháo dỡ hai điểm du lịch tự phát ở đây."
"Mặc tin giả 'bạo động', du lịch Đà Lạt vẫn thắng lớn","Chiều ngày 1-5, khi hầu hết du khách đã rời Đà Lạt sau kỳ nghỉ lễ 30-4 và 1-5 kéo dài 5 ngày, UBND TP Đà Lạt công bố thống kê về du lịch.  Theo đó, vùng du lịch Đà Lạt (Đà Lạt và các huyện lân cận như Đức Trọng, Đơn Dương, Lạc Dương) có khoảng 170.000 lượt khách đến tham quan, nghỉ dưỡng, tăng 41,7% so với cùng kỳ năm 2023. Đại diện UBND TP Đà Lạt bày tỏ sự bất ngờ khi lượng khách đến Đà Lạt vượt dự kiến (100.000 lượt khách) đến 70%.  Đà Lạt vướng nhận định sai lệch về thời tiết, vướng tin giả ""bạo động, biến lớn"". Do đó, khi chốt số liệu, UBND TP Đà Lạt bất ngờ vì mức độ tăng trưởng của du lịch.  Cũng theo đơn vị này, năm 2022 và 2023, lượng du khách đến Đà Lạt trong dịp nghỉ lễ 30-4 và 1-5 rất thấp, thậm chí chỉ tương đương với những ngày cuối tuần. Ông Lê Anh Kiệt, trưởng Phòng Văn hóa Thông tin (UBND TP Đà Lạt), cho biết: ""Rất nhiều yếu tố bất lợi cho Đà Lạt trong cao điểm du lịch vừa qua nhưng khí hậu Đà Lạt mát mẻ đã khiến du lịch Đà Lạt được du khách lựa chọn"". Ông Kiệt lý giải việc lượng khách tăng lên nhưng nội đô Đà Lạt không xuất hiện sự quá tải: ""5 ngày du khách đến luân phiên, xen kẽ nên tổng lượng du khách cùng một thời điểm không quá cao như dịp Tết. Ngoài ra, du lịch Đà Lạt hiện đang phát triển theo liên kết vùng.  Tức Đà Lạt là trung tâm đón khách, ăn uống, nghỉ ngơi, nhưng khu điểm du lịch mới, phù hợp với giới trẻ, còn khách đoàn hầu hết ở ngoại ô và các huyện lân cận. Do đó, luồng di chuyển của du khách thay đổi so với giai đoạn trước. Sở Văn hóa, Thể thao và Du lịch tỉnh Lâm Đồng nhìn nhận các sự kiện giải trí lớn đã giúp du khách có chỗ chơi, chỗ xả stress sau khi đến Đà Lạt tránh nóng.  Trong thời gian từ 27-4 đến 1-5, tại nội ô Đà Lạt có nhiều sự kiện cộng đồng, miễn phí được đầu tư bài bản: lễ hội âm nhạc ngoài trời Đà Lạt Music Festival 2024 - Sweet Love; chung kết chương trình lễ hội vũ đạo ngoài trời Dalat Best Dance Crew 2024 - Hoa Sen Home International Cup; hòa nhạc của hai nghệ sĩ Anna Koch và nghệ sĩ đàn tranh Thu Quyến tại Phố Bên Đồi Creative Studio (số 10 Lý Tự Trọng, Đà Lạt).",01/05/2024 18:06 GMT+7,https://tuoitre.vn/mac-tin-gia-bao-dong-du-lich-da-lat-van-thang-lon-20240501172019018.htm,"170.000 lượt khách đến Đà Lạt nghỉ mát, tham quan bất chấp tin giả bủa vây trong dịp lễ 30-4 và 1-5 là thống kê mới nhất của UBND TP Đà Lạt."
"Du lịch Bà Rịa - Vũng Tàu thắng lớn, công suất phòng lưu trú đạt 80 - 95%","Chiều 1-5, ông Trịnh Hàng, giám đốc Sở Du lịch Bà Rịa - Vũng Tàu, cho biết sau kỳ nghỉ lễ 30-4, 1-5 kéo dài 5 ngày, từ 27-4 đến 1-5, có khoảng 630.000 lượt du khách đến tỉnh này nghỉ dưỡng, tắm biển, vui chơi. Con số này tăng khoảng 25% so với cùng kỳ năm ngoài. Đáng chú ý, khách lưu trú đạt gần 190.000 lượt - tăng khoảng 50% so với cùng kỳ năm 2023. Ngoài ra có gần 29.000 khách quốc tế đến tỉnh này, tăng hơn 92% so với cùng kỳ năm 2023. Theo lý giải của ngành du lịch Bà Rịa - Vũng Tàu, lượng khách đến tỉnh này trong kỳ nghỉ lễ 30-4, 1-5 năm nay đông so với năm ngoái, khách lưu trú cũng tăng hơn là do thời tiết nắng nóng và kỳ nghỉ kéo dài. Ngoài ra các địa phương đã chuẩn bị cơ sở hạ tầng cũng như quán xuyến đảm bảo an toàn, an ninh cho du khách. Còn doanh nghiệp, cơ sở du lịch lớn cũng tổ chức các chương trình ca nhạc ấn tượng với sự tham gia của nhiều ngôi sao ca nhạc đang 'hot', có lượng fan đông đảo. Nhờ đó công suất buồng resort, khách sạn, phòng nghỉ của tỉnh này khoảng 80 - 95%. Tổng doanh thu du lịch Bà Rịa - Vũng Tàu trong 5 ngày qua ước đạt gần 670 tỉ đồng, tăng khoảng 12,49% so với cùng kỳ năm 2023.",01/05/2024 17:18 GMT+7,https://tuoitre.vn/du-lich-ba-ria-vung-tau-thang-lon-cong-suat-phong-luu-tru-dat-80-95-20240501165953043.htm,"Sở Du lịch Bà Rịa - Vũng Tàu cho biết doanh thu du lịch của tỉnh này trong 5 ngày nghỉ lễ 30-4, 1-5 ước đạt gần 670 tỉ đồng."
"112 chuyến bay đến Đà Nẵng thì có 51 chuyến quốc tế, khách nước ngoài tăng mạnh","Ngày 1-5, Sở Du lịch thành phố Đà Nẵng cho biết trong 5 ngày nghỉ lễ (từ ngày 27-4 đến 1-5) sân bay Đà Nẵng đón khoảng 563 chuyến. Bình quân có 112 chuyến bay đến Đà Nẵng mỗi ngày, trong đó có 61 chuyến bay nội địa và 51 chuyến bay quốc tế. Bất chấp thời tiết nắng nóng, tổng lượng khách tham quan, lưu trú tại Đà Nẵng trong dịp nghỉ lễ (5 ngày) đạt hơn 336.000 lượt, tăng 11,6% so với cùng kỳ năm 2023. Việc khách tăng trong dịp lễ chủ yếu là do các đường bay quốc tế phục hồi mạnh, khách quốc tế dịp này đạt khoảng 72.000 lượt, tăng hơn 2 lần so với cùng kỳ năm 2023. Trong khi đó khách nội địa đạt khoảng 264.000 lượt. Qua khảo sát, công suất buồng phòng khối cơ sở lưu trú du lịch 4-5 sao và tương đương đạt 70%. Trong khi đó, các cơ sở lưu trú du lịch từ 3 sao trở xuống công suất bình quân đạt 45%, đa số là khách lẻ. Như dự báo trước lễ, việc khách tăng trưởng chủ yếu do dòng khách nước ngoài đến Đà Nẵng tăng mạnh. Trả lời Tuổi Trẻ Online, một thành viên Hội Lữ hành thành phố Đà Nẵng cho biết điều này đã được dự báo bởi giá vé máy bay trong nước đang neo cao, ảnh hưởng đến chuyến đi của khách. Vị này cho biết giá vé máy bay trong nước cao chiếm từ 1/2 đến 2/3 chi phí chuyến đi ngắn ngày, ảnh hưởng lớn đến trải nghiệm của du khách. ""Giá vé máy bay quá cao ảnh hưởng đến việc khai thác dòng khách ở hai đầu đất nước. Trong dịp này, công ty chúng tôi khai thác dòng khách ở hai đầu đất nước bằng tàu lửa và bán một số tour cho khách đoàn miền Trung đi bằng đường bộ"" - người này nói.",01/05/2024 17:15 GMT+7,https://tuoitre.vn/112-chuyen-bay-den-da-nang-thi-co-51-chuyen-quoc-te-khach-nuoc-ngoai-tang-manh-2024050116461674.htm,"Dịp lễ trung bình mỗi ngày Đà Nẵng đón 112 chuyến bay, trong đó có 61 chuyến bay nội địa và 51 chuyến bay quốc tế. Khách đến Đà Nẵng dịp lễ tăng nhẹ so với cùng kỳ."
