Title,Content,Date,Url,Summary
"Công tử Bạc Liêu, Địa đạo gây phấn khích khi công bố poster dịp lễ 30-4","Hôm 28 và 29-4, hai bộ phim điện ảnh Công tử Bạc Liêu và Địa đạo lần lượt công bố các hình ảnh đầu tiên. Hai bộ phim nhận được một số phản hồi tích cực và mong đợi từ khán giả. Địa đạo công bố hình ảnh du kích của Thái Hòa Với Địa đạo, poster đầu tiên giới thiệu nhân vật chính - du kích Bảy Theo (diễn viên Thái Hòa thủ vai), anh đang cầm súng và ngồi quỳ trong lòng địa đạo Củ Chi.  Bộ phim ấn định lịch chiếu ngày 30-4-2025, được giới thiệu thực hiện nhằm kỷ niệm 50 hòa bình thống nhất đất nước, với dòng tựa: ""Mặt trời trong bóng tối"". ""Câu chuyện về những người lính kiên cường trong năm tháng khói lửa được kể lại chân thực với poster đầu tiên qua góc nhìn điện ảnh của đạo diễn Bùi Thạc Chuyên"", nhà sản xuất Địa đạo giới thiệu về dự án. Theo Bùi Thạc Chuyên, phim điện ảnh Địa đạo được anh ấp ủ kịch bản suốt 10 năm, trải qua nhiều khó khăn khi tìm kiếm kinh phí đến khi được đưa vào sản xuất vào tháng 3 vừa qua. Các diễn viên của phim như Thái Hòa, Quang Tuấn, Hồ Thu Anh, Anh Tú Wilson... đều giảm cân và phơi nắng để có vẻ ngoài gầy gò, đen nhẻm phù hợp với tạo hình du kích, chiến đấu trong lòng đất. Địa đạo là dự án tâm huyết của cả ê kíp, từ đạo diễn, nhà đầu tư, nhà sản xuất, dàn diễn viên. Tất cả đều mong làm nên một bộ phim vừa hay, vừa ý nghĩa cho dịp kỷ niệm 50 năm ngày giải phóng miền Nam thống nhất đất nước. Công tử Bạc Liêu gây tò mò Sau thời gian dài casting và đi vào sản xuất, hình ảnh đầu tiên của phim Công tử Bạc Liêu được hé lộ nhưng vẫn giữ kín danh tính diễn viên đóng vai chính - cậu Ba Huy (nguyên mẫu là Trần Trinh Huy ngoài đời). Nhìn phần dưới gương mặt nhân vật được hé lộ, có khán giả đoán diễn viên thủ vai là Song Luân. Trước đó, một số diễn viên nam khác như Dustin, Khương Lê, Võ Điền Gia Huy, Tôn Kinh Lâm, Bạch Công Khanh, Công Dương, Lãnh Thanh... được đánh giá có vẻ ngoài phù hợp và mời tham gia casting. Đạo diễn Lý Minh Thắng của Công tử Bạc Liêu từng bày tỏ về dự án:  ""Tôi vốn là người rất yêu thích những giá trị văn hóa, con người Việt Nam và luôn khao khát đưa chúng lên màn ảnh rộng.  ""Công tử Bạc Liêu"" là một nhân vật đặc biệt, đã để lại những di sản, dấu ấn mang tính biểu tượng cho tỉnh Bạc Liêu.  Khi giám đốc sản xuất Thủy Nguyễn ngỏ lời mời, chỉ cần nghe cụm từ ""công tử Bạc Liêu"", tôi rất phấn khích và nhận lời ngay mà không cần suy nghĩ gì cả"". Giám đốc sản xuất Thủy Nguyễn mong muốn thông qua bộ phim tạo nên bức tranh đẹp về phong cảnh, con người miền Tây và trân trọng những giá trị của quá khứ. ",29/04/2024 15:06 GMT+7,https://tuoitre.vn/cong-tu-bac-lieu-dia-dao-gay-phan-khich-khi-cong-bo-poster-dip-le-30-4-20240429144915349.htm,Công tử Bạc Liêu hé lộ hình ảnh công tử Ba Huy ăn chơi nổi tiếng Nam Kỳ. Còn Địa đạo tung ảnh trong lòng địa đạo Củ Chi với nhân vật Bảy Theo do Thái Hòa đóng.
Challengers gây sốt phòng vé với chuyện tình tay ba,"Theo số liệu của công ty nghiên cứu thị trường điện ảnh Exhibitor Relations, trong 3 ngày đầu trình làng, Challengers thu về 15 triệu USD tại các phòng vé trên khắp Bắc Mỹ với những phản hồi tích cực từ giới phê bình lẫn khán giả đại chúng. Nhà phân tích David A. Gross đánh giá đây là sự khởi đầu mạnh mẽ đối với một bộ phim thể thao lãng mạn. Challengers và ngôi sao đang lên Zendaya Challengers có ngân sách 55 triệu USD, quy tụ dàn sao trẻ như được nhiều khán giả yêu thích như Zendaya, Josh O'Connor, Mike Faist... Challengers thuộc thể loại tâm lý - tình cảm với chủ đề xoay quanh giới thế thao. Zendaya hóa thân Tashi Duncan - một trong những vận động viên nữ tiềm năng bậc nhất làng quần vợt thế giới. Cô sau đó vướng vào cuộc tình tay ba với 2 tay vợt nam khác là Patrick Zweig (Josh O'Connor) và Art Donaldson (Mike Faist). Câu chuyện phim xoay quanh mối quan hệ phức tạp giữa họ từ thời thiếu niên cho đến khi trưởng thành. Challengers nhận được ""mưa lời khen"" từ giới phê bình và khán giả đại chúng. Phim nhận mức chấm 87% trên trang Rotten Tomatoes, và được đánh giá là một trong những phim thể thao đáng xem thời gian này. Giới phân tích cũng đánh giá Challengers là tác phẩm tiếp theo cho thấy sự tỏa sáng của ngôi sao đang lên Zendaya. Kong, Kung Fu Panda và Dune vẫn thu tốt Vị trí thứ hai trên bảng xếp hạng thuộc về ""tân binh"" Unsung Hero với doanh thu 7,8 triệu USD. Ba phim ra rạp và có doanh thu tốt trước đó lần lượt lùi về vị trí 3 - 5, gồm Godzilla x Kong: The New Empire với 7,2 triệu USD; Civil War với 7 triệu USD và Abigail với 5,3 triệu USD. Những cái tên còn lại trong danh sách Top 10 phim ăn khách nhất tuần qua: 6. The Ministry of Ungentlemanly Warfare - 3,9 triệu USD 7. Kung Fu Panda 4 - 3,6 triệu USD 8. Ghostbusters: Frozen Empire - 3,3 triệu USD 9. Dune: Part Two - 1,9 triệu USD 10. Boy Kills World 1,7 triệu USD.",29/04/2024 14:40 GMT+7,https://tuoitre.vn/challengers-gay-sot-phong-ve-voi-chuyen-tinh-tay-ba-20240429143714113.htm,"Cuối tuần qua, bộ phim thể thao, lãng mạn Challengers (tựa Việt: Những kẻ thách đấu) của đạo diễn Luca Guadagnino đã có màn ra mắt ấn tượng khi vươn lên đứng đầu bảng xếp hạng phim ăn khách nhất Bắc Mỹ."
"Lật mặt 7 áp đảo trước lễ, thu hơn trăm tỉ sau 3 ngày ra rạp","Lật mặt 7: Một điều ước đạt doanh thu ""chào sân"" dẫn đầu như dự đoán, trong khi đó Cái giá của hạnh phúc bất ngờ ""mất đà"", bị tụt lại sâu trong bảng xếp hạng doanh thu cuối tuần vừa rồi. Cụ thể, theo số liệu của Box Office Vietnam, Lật mặt 7: Một điều ước  thu về hơn 105 tỉ đồng tính đến trưa 29-4, phim cũng sở hữu suất chiếu áp đảo - hơn 11.000 suất - gấp nhiều lần bộ phim đang xếp vị trí thứ 2 và 3. Lật mặt 7 lặp lại thành tích của Mai Bộ phim mới nhất trong series trị giá trăm tỉ của Lý Hải khai thác chủ đề tình cảm gia đình thay vì hài, hành động như phần phim trước, phim cũng phân loại K, phù hợp cho hầu hết đối tượng khán giả. Đây cũng là yếu tố khiến phim bứt phá so với những người tiền nhiệm. Tin vui cũng đến với Lý Hải cùng ê kíp khi phim đạt cột mốc trăm tỉ sau 3 ngày - thành tích tương tự phim Mai của đạo diễn Trấn Thành dịp Tết năm nay. Tuy nhiên, Cái giá của hạnh phúc - bộ phim được cho là sẽ trở thành ""đối thủ"" chính của Lật mặt 7 dịp lễ này - lại bất ngờ bị bỏ xa. Phim chỉ thu về 1,8 tỉ đồng trong dịp cuối tuần vừa qua, khiến cho tổng doanh thu phim chững lại ở mốc 23,1 tỉ đồng. Hiện Cái giá của hạnh phúc chỉ thu về ""lai rai"" vài trăm triệu đồng mỗi ngày và có khoảng hơn 400 suất chiếu, trong khi chỉ tính trong sáng nay, phim của Lý Hải thu hơn 11,7 tỉ đồng với hơn 4.000 suất chiếu, gấp 10 lần Cái giá của hạnh phúc. Hiện đang giữ vị trí thứ 2 trên cuộc đua doanh thu là bộ phim hành động Hàn Quốc Vây hãm: Kẻ trừng phạt, đánh dấu sự trở lại của Ma Dong Seok - ""đả nam"" nổi tiếng của màn ảnh xứ Kim Chi. Phim kể về hành trình một ""siêu cảnh sát"" đối đầu với những tội phạm tinh vi trong giới công nghệ.  Vây hãm: Kẻ trừng phạt hiện đang có mức tổng doanh thu là 9,9 tỉ đồng, trong đó phần lớn là thu về từ dịp cuối tuần vừa rồi. Nếu so với Lật mặt 7, doanh thu cuối tuần của ""bom tấn"" Hàn Quốc chỉ bằng 1/10 bộ phim của đạo diễn Lý Hải. Một bộ phim Hàn khác là Tà khúc triệu vong cũng chỉ thu về hơn 800 triệu đồng sau nhiều ngày ra mắt, thua những phim ra mắt gần một tháng như Godzilla x Kong. Về cuộc đua của hai phim hoạt hình Mèo mập mang 10 mạng và Gấu béo tung chưởng, bộ phim về chú mèo trải qua hành trình đầu thai của mình đang áp đảo đối thủ đến từ Úc. Cụ thể, Mèo mập mang 10 mạng thu về 4,4 tỉ đồng sau gần 4 ngày, trong khi Gấu béo tung chưởng chỉ có tổng doanh thu khiêm tốn 364 triệu đồng. Nhìn chung, dịp lễ 30-4 và 1-5 là cuộc đua không ""cân sức"" giữa Lật mặt 7 và những bộ phim còn lại. Tuy nhiên, khán giả ra rạp vẫn có rất nhiều lựa chọn từ kinh dị đến thuần hành động hay hoạt hình để phù hợp hơn với thị hiếu của mình.",29/04/2024 13:05 GMT+7,https://tuoitre.vn/lat-mat-7-ap-dao-truoc-le-thu-hon-tram-ti-sau-3-ngay-ra-rap-20240429091505773.htm,"Những bộ phim chiếu rạp dịp 30-4 và 1-5 hầu hết sẽ chiếu từ 26-4 và có một mốc doanh thu ban đầu, trong đó Lật mặt 7 dẫn đầu như dự kiến, Cái giá của hạnh phúc gần như bị loại khỏi đường đua."
Chiều nay ở Đà Lạt được nghe hòa nhạc kèn clarinet với đàn tranh,"Trong 2 khung giờ: 16h - 18h và 19h - 21h ngày 29-4, người dân và du khách tại Đà Lạt được thưởng thức miễn phí chương trình hòa nhạc của 2 nghệ sĩ Anna Koch và nghệ sĩ đàn tranh Thu Quyến.  Chương trình diễn ra tại Phố Bên Đồi Creative Studio (bên trong Trung tâm Thanh thiếu niên tỉnh Lâm Đồng, số 10 Lý Tự Trọng, Đà Lạt). Đây là chương trình Connecting the Dots do Đại sứ quán Áo phối hợp với UBND TP Đà Lạt, Phố Bên Đồi Creative Studio thực hiện.  Tại chương trình, 2 nghệ sĩ Áo và Việt Nam sẽ kết hợp với nhau thông qua sự kết nối của âm nhạc và 2 nhạc cụ: kèn clarinet và đàn tranh.  Cả 2 nghệ sĩ sẽ cùng biểu diễn một số bản nhạc đương đại phương Tây và Việt Nam thân quen. Theo ban tổ chức, đây là một sự kết hợp độc đáo và phù hợp. Anna Koch là nghệ sĩ chơi kèn clarinet, là một nhạc sĩ chuyên nghiệp, chuyên sáng tác âm nhạc đương đại và trình diễn ngẫu hứng.  Cô đã dành thời gian theo học tại Đại học Âm nhạc và Diễn xuất Vienna, tốt nghiệp danh dự vào năm 2017.  Cô được trao học bổng 'Start Stipendium Musik' năm 2020 từ Bộ Văn hóa và Nghệ thuật Liên bang Áo.  Anna Koch đã biểu diễn dưới dạng nghệ sĩ solo và nghệ sĩ hòa nhạc tại các hội chợ âm nhạc như Wien modern, Bang on a Can (Mỹ), Klangspuren Schwaz, Impuls Konzerte Graz, Styriarte và Expo Shanghai (2010). Còn nghệ sĩ đàn tranh Thu Quyến tốt nghiệp loại xuất sắc chuyên ngành đàn tranh Trường Quốc gia âm nhạc Huế (nay là Học viện Âm nhạc Huế).  Hiện tại cô đang mở các lớp đào tạo đàn tranh tại gia với mong muốn truyền lửa đam mê và tình yêu âm nhạc nhạc cụ dân tộc cho thế hệ trẻ để vốn quý này được tiếp nối.",29/04/2024 12:33 GMT+7,https://tuoitre.vn/chieu-nay-o-da-lat-duoc-nghe-hoa-nhac-ken-clarinet-voi-dan-tranh-20240429120440657.htm,Người dân và du khách tại Đà Lạt sẽ được thưởng thức miễn phí chương trình hòa nhạc do nghệ sĩ kèn clarinet Anna Koch (người Áo) và nghệ sĩ đàn tranh Thu Quyến thực hiện.
Dalat Best Dance Crew 2024 sẽ làm Đà Lạt 'nóng như chảo lửa',"Chung kết chương trình lễ hội vũ đạo ngoài trời “Dalat Best Dance Crew 2024 - Hoa Sen Home International Cup” sẽ diễn ra tại quảng trường Lâm Viên (ven hồ Xuân Hương, Đà Lạt) vào 2 ngày 29 và 30-4. Lễ hội với 2 bảng thi đấu chính thức gồm bảng phong trào mở rộng và bảng quốc tế, quy tụ các nhóm nhảy hàng đầu Việt Nam và các nước châu Á như: Indonesia, Thái Lan, Nhật Bản... Ban tổ chức cho biết việc mở rộng đối tượng dự thi bảng phong trào nhằm tạo cơ hội cho các bạn trẻ yêu nhảy được thử sức và hòa mình vào lễ hội vũ đạo ngoài trời lớn nhất Việt Nam. Sau đêm tổng duyệt, thông tin cho hay năm nay các bạn trẻ chuẩn bị nhiều tiết mục lạ và có sự đầu tư về chuyên môn. Các tiết mục vũ đạo sôi động thể hiện tinh thần nhiệt huyết, khẳng định chất riêng của mỗi nhóm, mỗi cá nhân và lan tỏa năng lượng tích cực, đam mê nhảy đến với cộng đồng. Các biên đạo trẻ đã bám sát chủ đề “Be You, Be Unique - Khẳng định chất tôi” mà ban tổ chức đề ra. Với chủ đề này, chương trình mong muốn tìm kiếm màu sắc cá nhân - điều riêng biệt định hình cá tính, sự khác biệt của thế hệ trẻ hiện nay thông qua các màn trình diễn vũ đạo. Đêm chung kết còn quy tụ các nghệ sĩ nổi tiếng, như: ca sĩ Anh Tú, Trương Thảo Nhi, Trung Hiếu, Anh Thi, nhóm nhạc đến từ Thái Lan... Toàn bộ chương trình mở cửa miễn phí để du khách và người dân địa phương tham dự. Chị Trần Diệp Mỹ Dung - phó bí thư Tỉnh Đoàn Lâm Đồng - cho biết: “‘Dalat Best Dance Crew 2024' là một sân chơi hoàn toàn mới, được đầu tư chỉn chu. Cuộc thi tác động và cổ vũ mạnh mẽ đến phong trào nhảy múa trong cả nước cũng như trong địa bàn tỉnh Lâm Đồng. Các nhóm nhảy có cơ hội được cọ xát và hướng đến giá trị sống tích cực. Đây cũng là yếu tố khiến chúng tôi tập hợp các em đến với sân chơi này”.",29/04/2024 11:15 GMT+7,https://tuoitre.vn/dalat-best-dance-crew-2024-se-lam-da-lat-nong-nhu-chao-lua-20240429105622373.htm,"Chung kết Dalat Best Dance Crew 2024 diễn ra trong 2 đêm 29 và 30-4 tại Đà Lạt, dự kiến sẽ có 10.000 người tham gia."
"Người đẹp Ukraine đoạt danh hiệu Miss Eco International 2024, Việt Nam trượt top 21","Tối 28-4 (theo giờ Ai Cập), đêm chung kết cuộc thi Miss Eco International 2024 diễn ra tại đất nước Ai Cập. Đại diện Việt Nam tham gia cuộc thi này là Hoàng Kim Chi. Cô sinh năm 1997, quê Quảng Trị. Kim Chi từng đoạt danh hiệu Miss Fire Vietnam 2023 tại cuộc thi Hoa hậu Trái đất Việt Nam 2023. Tại đêm chung kết, các thí sinh trải qua các phần thi: hô tên, trang phục dân tộc, trang phục dạ hội, thuyết trình về môi trường, ứng xử. Sau các phần thi, ban giám khảo chọn ra top 5 chung cuộc Miss Eco International 2024 gồm các người đẹp đến từ Indonesia, Ukraine, Brazil, Canada và Philippines. Đại diện của Việt Nam trượt top 21. Ở phần thi trang phục dân tộc, người đẹp Philippines giành chiến thắng phần thi này. Đại diện Việt Nam gặp sự cố ở cuối phần trình diễn, chuỗi ngọc trai bị đứt, rơi khắp nơi trên sàn diễn. Kết quả chung cuộc, người đẹp Ukraine giành vương miện Miss Eco International 2024. Danh hiệu á hậu 1, 2, 3, 4 lần lượt trao cho người đẹp đến từ Philippines, Canada, Brazil và Indonesia.",29/04/2024 06:54 GMT+7,https://tuoitre.vn/nguoi-dep-ukraine-doat-danh-hieu-miss-eco-international-2024-viet-nam-truot-top-21-20240429062140976.htm,Đêm chung kết cuộc thi Miss Eco International 2024 (Hoa hậu Môi trường thế giới) khép lại với ngôi vị cao nhất thuộc về người đẹp Ukraine.
"365 Radio, kênh phát thanh uy tín của Anh, bàn về các nghệ sĩ indie Việt Nam","Jukebox Judgement™ là chương trình radio của 365 Radio - một kênh uy tín của Vương quốc Anh về âm nhạc. Mỗi một số, Jukebox Judgement™ sẽ giới thiệu các sản phẩm âm nhạc tới từ các nghệ sĩ mới và tiềm năng của các thị trường âm nhạc trên toàn thế giới. Jukebox Judgement™ số ra ngày 26-4, do biên tập viên Dawn Parry dẫn dắt, tập trung vào những nghệ sĩ indie của Việt Nam. Toàn các nhà sản xuất uy tín Chương trình nằm trong sự hợp tác giữa Jukebox Judgement™ và AXEAN Festival nhằm mở ra một cánh cửa cho các nghệ sĩ trẻ trong khu vực châu Á có cơ hội giới thiệu những bài hát của họ đến với thị trường thế giới. Qua đó tăng độ nhận diện công chúng và tăng tỉ lệ radio play trên các nền tảng quốc tế. Trong số mới nhất về nhạc Việt, biên tập viên Dawn Parry sẽ cùng các nhà sản xuất nghe những ca khúc của Limebócx, Truant Fu, ChipPunks, Lý Bực, Vũ Thanh Vân, Thịnh Suy, Tuimi, MINH, 7UPPERCUTS, iTeu, Mèow Lạc. Mở đầu chương trình, các nhà sản xuất nghe Vắng của Lý Bực - ban nhạc gen Z theo đuổi rock metal. Khi nghe Lý Bực, nhà sản xuất âm nhạc Steve Lillywhite nói, ông ""cảm nhận được năng lượng cũng như đam mê của các nghệ sĩ indie Việt Nam"". Chương trình phát nhiều bài hát của các nghệ sĩ, ban nhạc trẻ ở Việt Nam như: Chết trong em (Thịnh Suy), Heartbreaker (MINH), Camera (ChipPunks)… Tiếng Việt có cách truyền tải đặc biệt Từng nghe nhiều nhạc Nhật, Trung Quốc và Hàn Quốc, nhà sản xuất Barry Upton cho rằng có những nghệ sĩ, ban nhạc tạo nên một làn sóng, có sức ảnh hưởng lớn đến người nghe của cả một khu vực, ví dụ như làn sóng K-pop. ""Ở Việt Nam, các nghệ sĩ trẻ vẫn có thể làm được điều đó khi họ giữ được cá tính của riêng mình"", ông nói. Ông chia sẻ thêm, tiếng Việt có cách truyền tải hoàn toàn khác biệt, không thể nhầm lẫn với các ngôn ngữ khác. Bài hát Camera của nhóm ChipPunks khiến các nhà sản xuất âm nhạc hào hứng và bất ngờ hơn cả. Ông Craig Leon thích thú khi cho rằng cấu trúc bài hát rất thú vị, có sự hài hước. ""Tôi nghe giới thiệu thì bài hát có nội dung nói về những bà hàng xóm có tính ""tọc mạch"" chuyện nhà người khác. Ca khúc mang màu sắc pop rõ rệt"", ông nói. Các nhà sản xuất âm nhạc cho rằng nhóm ChipPunks không làm người nghe thất vọng khi thể hiện đúng cá tính của nhóm mình qua giai điệu, câu từ trong lời ca, thậm chí ngay cả cái tên nhóm cũng khá thú vị (ChipPunks mang nghĩa là ""trò đùa""). Tuy nhiên, họ cũng nhận định rằng Camera là một ca khúc phản ánh đậm đặc văn hóa Việt Nam. Để lan tỏa bài hát ra với thế giới và tạo làn sóng như những ca khúc K-pop, không phải là điều dễ dàng. Bởi nếu chuyển ngữ sang một ngôn ngữ khác, bài hát không giữ được trọn vẹn ý nghĩa châm biếm như trong tiếng Việt.",28/04/2024 19:14 GMT+7,https://tuoitre.vn/365-radio-kenh-phat-thanh-uy-tin-cua-anh-ban-ve-cac-nghe-si-indie-viet-nam-20240428162802762.htm,"Trong Jukebox Judgement™, các nhà sản xuất âm nhạc nổi tiếng cho rằng nhạc Việt có thể tạo được làn sóng nếu các nghệ sĩ giữ được cá tính của họ."
