Title,Content,Date,Url,Summary
Thầy giáo lên núi tìm nguồn nước sinh hoạt cho học sinh,"Một ngày đầu mùa hè, thấy nguồn nước chảy về bể chứa ở khu ký túc xá bị tắc, không đủ nước sinh hoạt cho học sinh và giáo viên sử dụng. Thầy giáo Lộc Văn Trung - phó hiệu trưởng Trường phổ thông dân tộc bán trú - THCS Trung Lý, huyện vùng cao, biên giới Mường Lát (Thanh Hóa) - cùng nhân viên nhà trường đem theo dao, một số vật dụng trèo lên khu vực núi Pù Luốc, cách trường hơn 400m để tìm và khơi thông dòng nước chảy từ phía đầu nguồn. Nguồn nước sinh hoạt của nhà trường được lấy từ suối Luốc ở bản Táo, nằm trên khu vực núi Pù Luốc. Nước sinh hoạt được dẫn bằng ống nhựa, có chiều dài hơn 400m từ đầu nguồn về bể tại khu ký túc xá do nhà trường tự đầu tư. Theo thầy Lộc Văn Trung, vào mùa khô hoặc những ngày nắng nóng, tại khu ký túc xá có 424 học sinh ở trường và khu nhà công vụ có hơn 10 giáo viên ở lại thường xuyên thiếu nước sinh hoạt. Nguồn nước tự chảy từ suối Luốc về chỉ đủ phục vụ nấu ăn bán trú cho học sinh và để học sinh đánh răng, rửa mặt hằng ngày. Còn việc tắm, giặt quần áo hằng ngày, học sinh đành phải ra suối Sao Lư, cách trường hơn 400m. Dù biết nguồn nước sinh hoạt từ suối Luốc chảy về bể cho học sinh, giáo viên dùng hằng ngày và học sinh phải đi tắm suối không được hợp vệ sinh, nhưng đành phải sử dụng vì hiện nhà trường chưa tìm được nguồn nước thay thế. Trao đổi với Tuổi Trẻ Online, thầy Lộc Văn Trung cho biết: ""Để chủ động được nguồn nước sinh hoạt hợp vệ sinh cho học sinh và giáo viên sử dụng chỉ có giải pháp đầu tư khoan giếng, lấy nguồn nước ngầm. Tuy nhiên, chi phí mỗi giếng khoan tại địa phương lên tới hơn 100 triệu đồng, trong khi nhà trường không có kinh phí để đầu tư khoan giếng. Do vậy, nhà trường rất mong Nhà nước, các nhà hảo tâm hỗ trợ kinh phí để khoan giếng phục vụ học sinh và giáo viên của trường"".",03/05/2024 10:48 GMT+7,https://tuoitre.vn/thay-giao-len-nui-tim-nguon-nuoc-sinh-hoat-cho-hoc-sinh-20240503103336884.htm,"Vào mùa khô hoặc ngày nắng nóng, nguồn nước sinh hoạt phục vụ hàng trăm học sinh, giáo viên Trường phổ thông dân tộc bán trú - THCS Trung Lý, huyện Mường Lát thiếu trầm trọng. Thầy giáo lại lên núi tìm và khơi nguồn nước dẫn về ký túc xá."
Vụ phản đối sáp nhập trường: Tất cả học sinh đã đến lớp,"Sáng 3-5, ông Bùi Xuân Ân - hiệu trưởng Trường tiểu học Ngọc Sơn, xã Ngọc Sơn, huyện Thanh Chương, Nghệ An - cho biết đến sáng nay, 5 học sinh cuối cùng trong nhóm 152 em bị cha mẹ không cho tới trường đã đi học lại. Đây là những em chưa đi học buổi nào kể từ ngày 10-4, thời điểm phụ huynh ngăn con đến trường để phản đối việc sáp nhập điểm trường lẻ Thanh Nam về trường chính Trường tiểu học Ngọc Sơn. ""Sau kỳ nghỉ lễ 30-4 và 1-5, hầu hết học sinh từng nghỉ học đã đến trường, chỉ còn một số em vắng do ốm. Nhà trường đang tập trung bổ trợ kiến thức cho các em"", ông Ân nói. Những ngày qua, các đoàn thể từ huyện Thanh Chương tới xã Ngọc Sơn cử cán bộ tới từng gia đình học sinh để tuyên truyền, vận động phụ huynh về chủ trương sáp nhập trường. Theo Phòng Giáo dục và Đào tạo huyện Thanh Chương, chủ trương sáp nhập điểm trường Thanh Nam về trường chính Trường tiểu học Ngọc Sơn đã được triển khai đúng quy trình, thực hiện theo lộ trình, nâng cấp cơ sở vật chất nhằm nâng cao chất lượng dạy học. Trường tiểu học Ngọc Sơn hiện đang là một trong số ít trường tiểu học trên địa bàn huyện Thanh Chương chưa đạt chuẩn quốc gia. Thời gian tới, địa phương sẽ tiếp tục đầu tư trang thiết bị dạy học, cơ sở vật chất, kêu gọi xã hội hóa giáo dục để nâng chuẩn Trường tiểu học Ngọc Sơn. Được biết, thời gian qua huyện Thanh Chương và xã Ngọc Sơn đã xây dựng, mua sắm tổng trị giá hơn 8,8 tỉ đồng, đáp ứng các điều kiện để chuyển học sinh từ điểm lẻ Thanh Nam về điểm chính học tập. Sau khi sáp nhập, một phần diện tích điểm trường Thanh Nam sẽ dành để mở rộng trụ sở UBND xã Ngọc Sơn. Ngày 10-4, xã Ngọc Sơn, huyện Thanh Chương tổ chức sáp nhập điểm lẻ Thanh Nam (152 học sinh khối lớp 1-5) về trường chính Trường tiểu học xã Ngọc Sơn. Cho rằng việc chuyển điểm trường lẻ về nơi xa, không có thời gian đưa đón con và truyền thống nhiều năm ở điểm lẻ, nhiều phụ huynh cho con nghỉ học để phản đối chủ trương sáp nhập trường. Sau đó, một số phụ huynh đưa con đến trước trụ sở UBND tỉnh Nghệ An yêu cầu được đối thoại, giữ lại điểm lẻ Thanh Nam. Lãnh đạo UBND huyện Thanh Chương khẳng định việc huyện sáp nhập điểm trường lẻ Thanh Nam về điểm chính Trường tiểu học Ngọc Sơn là chủ trương đúng đắn và phù hợp với kế hoạch phát triển sự nghiệp giáo dục của tỉnh, tạo điều kiện cho các em học sinh được học tập tốt hơn.",03/05/2024 10:07 GMT+7,https://tuoitre.vn/vu-phan-doi-sap-nhap-truong-tat-ca-hoc-sinh-da-den-lop-20240503093557827.htm,"Các thầy cô giáo đang bổ trợ kiến thức cho các học sinh đến lớp muộn sau sự việc phụ huynh phản đối sáp nhập trường ở huyện Thanh Chương, Nghệ An."
Giáo viên trường quốc tế phát sách có nội dung nhạy cảm cho học sinh lớp 11,"Phụ huynh trên 40 tuổi đọc còn ""đỏ mặt tía tai"" Hôm qua, ngay ngày đầu tiên sau kỳ nghỉ lễ, một phụ huynh tự nhận có con đang học lớp 11 tại Trường Quốc tế TP.HCM (ISHCMC) chia sẻ trên một group mạng xã hội có hơn 26.000 thành viên sự bức xúc về một cuốn sách được giáo viên trường này phát cho học sinh, trong đó đầy cảnh giường chiếu, ""đầu độc về mặt tinh thần"" con chị. Cụ thể, theo chia sẻ này, trước ngày lễ, cô giáo của lớp con chị đã phát sách ""Một thoáng ta rực rỡ nhân gian"" (sách tiếng Việt) của tác giả Ocean Vuong cho con chị để về nhà đọc. Từng rất hân hoan vì nghĩ rằng ""cả hai mẹ con sẽ được cùng nhau thảo luận một tác phẩm văn học hay"" nhưng vị phụ huynh này đã ""thật sự rất bàng hoàng khi tận mắt đọc được những trang văn đầy cảnh giường chiếu"".  Phụ huynh này đã chụp nhiều trang sách mà giáo viên phát cho con chị. Ngôn ngữ tả thực trần trụi cảnh giường chiếu trong một số trang sách khiến nhiều phụ huynh thấy ""choáng váng"", ""quá kinh khủng"", ""đầu độc"" tinh thần học sinh. Trang sách có những đoạn như: ""Quần cộc con đang kéo xuống mắt cá, Trevor vào tư thế ở sau lưng con, lông cậu cọ vào người con. Cậu nhổ nước miếng mấy lần lên bàn tay, bôi lên giữa hai chân con cho tới khi tất cả đã đặc và trơn và không thể phủ nhận""... Hay ở đoạn khác, sách mô tả: ""Và cảm giác trơ ì của da cậu, dính nhớp trên da con, khiến việc này dường như không còn chỉ là đ., mà là bấu víu""... Ngôn từ trong cuốn sách được phát cho học sinh lớp 11 khiến nhiều phụ huynh thấy bất ngờ. ""Bản thân tôi là một phụ nữ ngoài 40, nhưng khi đọc những câu văn này, tôi còn đỏ mặt tía tai, huống hồ gì bé con nhà tôi chỉ là một học sinh lớp 11 vẫn còn non nớt.  Tôi ngồi đọc sách cùng con mà giận run cả người vì không hiểu nhà trường hoạch định chương trình thế nào mà lại có thể lựa chọn một tác phẩm với những ngôn từ như vậy để dạy cho học sinh"", một phụ huynh bức xúc bày tỏ trên mạng xã hội. Nhà trường thu hồi sách Khuya 2-5, trả lời Tuổi Trẻ Online, đại diện Trường Quốc tế TP.HCM cho biết trường đã tiếp nhận thông tin một số học sinh lớp 11 được nhận một quyển sách dịch tiếng Việt với nội dung có thể không phù hợp với học sinh.  Tác giả sách thuộc danh sách đọc tham khảo, gồm nhiều ngôn ngữ, kể cả tiếng Việt, được Chương trình Tú tài quốc tế (IB) giới thiệu và các tác phẩm của ông hiện được phổ biến rộng rãi tại Việt Nam. Theo đó, sau khi nhận được phản ảnh quan ngại của phụ huynh về tác phẩm này, Trường Quốc tế TP.HCM đã thu hồi các ấn bản trên và hiện đang đánh giá, xem xét quy trình mà tác phẩm được giới thiệu cho học sinh.",03/05/2024 08:55 GMT+7,https://tuoitre.vn/giao-vien-truong-quoc-te-phat-sach-co-noi-dung-nhay-cam-cho-hoc-sinh-lop-11-20240503072141739.htm,Phụ huynh bức xúc 'tố' giáo viên Trường Quốc tế TP.HCM phát cho học sinh lớp 11 một cuốn sách (bằng tiếng Việt) với những ngôn ngữ trần trụi về cảnh giường chiếu.
Đăng ký nguyện vọng lớp 10: Tránh sai lầm đáng tiếc,"Thí sinh cần lưu ý gì? ""Bài học không quên"" ""Tổng điểm kiểm tra cuối học kỳ 2 lớp 9 của con tôi là 25 điểm cho toán, văn, ngoại ngữ. Cô chủ nhiệm nói thường điểm thi vào lớp 10 sẽ không được cao như điểm kiểm tra cuối học kỳ, nên phải trừ hao. Cô khuyên con tôi nên đăng ký nguyện vọng 1 vào Trường THPT Bùi Thị Xuân hoặc THPT Lê Quý Đôn. Tuy nhiên, con tôi thích Trường THPT Nguyễn Thị Minh Khai hơn và muốn nguyện vọng 1 vào trường này. Cô chủ nhiệm khuyên không nên vì quá phiêu lưu. Nhưng con gái tôi khăng khăng sẽ nỗ lực hết sức để đậu được nguyện vọng 1. Mẹ và cô hãy cho con cơ hội để thử sức mình. Kết quả, con tôi thi được 23,5 điểm, trong khi điểm chuẩn vào Trường THPT Nguyễn Thị Minh Khai là 24,25 điểm. Dò danh sách điểm chuẩn nguyện vọng 1, con gái bật khóc. Tôi ngồi kế bên, động viên con: Không sao, vẫn còn cơ hội vào Trường THPT Bùi Thị Xuân. Nhưng hỡi ôi, dò sang điểm chuẩn nguyện vọng 2 thì Trường Bùi Thị Xuân lấy 24,5 điểm. Cuối cùng, con tôi đậu nguyện vọng 3 vào một trường tốp giữa ở quận 3 dù điểm thi khá cao"". Đó là câu chuyện ở mùa tuyển sinh lớp 10 năm 2023 với con gái chị N.B.N., ở quận 3. Chị N. kể: ""Gia đình tôi có một bài học không thể quên. Đó là đừng để cho con đăng ký nguyện vọng 1 vượt quá năng lực học tập của bản thân. Ngay từ đầu, nếu cháu không hy vọng vào sự nỗ lực, may mắn mà đăng ký nguyện vọng 1 vào Trường Bùi Thị Xuân thì đã đậu rồi. Bởi điểm chuẩn nguyện vọng 1 vào Bùi Thị Xuân chỉ có 23,5 điểm"". Tương tự, cô M., giáo viên chủ nhiệm lớp 9 ở quận Tân Bình, cũng cho biết: ""Nhiều học sinh chọn đăng ký vào trường THPT mình thích mà không để ý đến khả năng học tập. Có em học lực khá nhưng đăng ký vào trường THPT tốp đầu. Khi tôi tư vấn, giải thích em vẫn một mực nói sẽ tăng tốc học tập để đạt được ước mơ. Thậm chí, có trường hợp tôi khuyên học sinh không được bèn gọi điện cho phụ huynh. Không ngờ phụ huynh trả lời là trường tốp đầu, chất lượng tốt hơn thì cháu đăng ký là đúng rồi. Có phụ huynh còn cho rằng giáo viên tư vấn chọn nguyện vọng an toàn vì bệnh thành tích. Cuối cùng những học sinh như vậy rớt cả nguyện vọng 1 và 2. Có em còn rớt cả 3 nguyện vọng vì đăng ký vào những trường có điểm chuẩn gần nhau"". Cô M. đúc kết: khi chọn nguyện vọng vào lớp 10 cần ""liệu cơm gắp mắm"" chứ đến cuối học kỳ 2 thì có tăng tốc, nỗ lực cũng rất khó thay đổi tình hình. Lưu ý chương trình mới Ông Lê Hoài Nam, phó giám đốc Sở GD-ĐT TP.HCM, chia sẻ: ""Trước đây, khi đăng ký nguyện vọng tuyển sinh lớp 10, thí sinh chỉ cần căn cứ vào năng lực học tập, điểm chuẩn vào lớp 10 của trường THPT ở năm trước, khoảng cách từ nhà mình đến trường THPT. Năm nay, tôi khuyên học sinh và phụ huynh cần lưu ý đến việc triển khai giảng dạy chương trình lớp 10 ở trường THPT mình chọn lựa"". Theo đó, chương trình giáo dục phổ thông 2018 đã được triển khai tại các trường THPT từ năm học 2022-2023. Trong đó, học sinh sẽ học 8 môn học/hoạt động giáo dục bắt buộc là toán, ngữ văn, ngoại ngữ 1, lịch sử, giáo dục thể chất, giáo dục quốc phòng an ninh, nội dung giáo dục địa phương, hoạt động trải nghiệm - hướng nghiệp. Ngoài ra, học sinh lớp 10 sẽ được chọn 5 trong số 10 môn học lựa chọn. Các môn lựa chọn được thiết kế theo 3 nhóm tương ứng với 3 định hướng nghề nghiệp là khoa học xã hội (địa lý, kinh tế và pháp luật); khoa học tự nhiên (các môn vật lý, hóa học, sinh học); công nghệ - nghệ thuật (công nghệ, tin học, âm nhạc, mỹ thuật). Thế nhưng, do thiếu giáo viên, thiếu phòng học nên nhiều trường THPT ở TP.HCM không thể tổ chức cho học sinh chọn lựa từng môn học theo sở thích và năng lực. Thay vào đó, các trường tổ chức môn học lựa chọn theo tổ hợp môn. Tuy nhiên, nhiều phụ huynh và học sinh lớp 9 ít quan tâm đến vấn đề này. Ghi nhận từ mùa thi tuyển sinh lớp 10 năm 2022, 2023 cho thấy khi đã đậu vào lớp 10 công lập rồi, nhiều học sinh mới ngỡ ngàng nhận ra là trường THPT không tổ chức dạy môn học mà mình yêu thích. Như trường hợp N.V.B.K. của mùa thi năm 2023. Khi đã đậu vào lớp 10 ở một trường THPT trên địa bàn TP Thủ Đức, K. mới nhận ra trường này không tổ chức dạy môn mỹ thuật. Trong khi đó, K. mong muốn được học môn này vì ước mơ sau này sẽ học ngành thiết kế thời trang.",03/05/2024 05:58 GMT+7,https://tuoitre.vn/dang-ky-nguyen-vong-lop-10-tranh-sai-lam-dang-tiec-20240502224003061.htm,"15h chiều nay (3-5), Sở GD-ĐT TP.HCM sẽ mở cổng cho học sinh lớp 9 đăng ký nguyện vọng thi tuyển sinh lớp 10 năm 2024."
"Thành lập hàng chục đoàn thanh tra, kiểm tra kỳ thi tốt nghiệp THPT","Kỳ thi tốt nghiệp THPT năm 2024 diễn ra trong hai ngày 27 và 28-6, dự kiến có hơn 1 triệu thí sinh đăng ký dự thi. Các đoàn kiểm tra cấp bộ và cấp sở Các đoàn thanh tra, kiểm tra thực hiện thanh tra, kiểm tra nhiều khâu chuẩn bị, tổ chức kỳ thi tốt nghiệp THPT năm 2024. Bộ Giáo dục và Đào tạo thành lập 10 đoàn kiểm tra công tác chuẩn bị thi sẽ kiểm tra trực tiếp tại 20 sở giáo dục và đào tạo (không tính các đoàn của ban chỉ đạo cấp quốc gia và lãnh đạo bộ) tại ba miền Bắc, Trung, Nam; thành phần gồm Thanh tra Bộ Giáo dục và Đào tạo và các vụ, cục thuộc bộ. Đoàn thanh tra, kiểm tra của bộ thực hiện thanh tra, kiểm tra việc ban hành văn bản, công tác chỉ đạo, tổ chức kỳ thi của ban chỉ đạo thi cấp tỉnh, sở giáo dục và đào tạo, hội đồng thi, điểm thi và công tác tổ chức thanh tra, kiểm tra thi của các sở giáo dục. Trong đó đặc biệt quan tâm đến công tác chuẩn bị cơ sở vật chất tại các điểm thi và việc chuẩn bị in sao đề thi. Đoàn thanh tra, kiểm tra của sở giáo dục và đào tạo thực hiện thanh tra, kiểm tra công tác tổ chức thi của hội đồng thi, các ban của hội đồng thi và điểm thi. Bộ Giáo dục và Đào tạo cũng thành lập 63 đoàn kiểm tra công tác chỉ đạo, tổ chức coi thi tốt nghiệp THPT năm 2024 tại 63 tỉnh, thành phố. Số cán bộ tối thiểu tham gia đoàn kiểm tra trực tiếp tại một điểm thi theo nguyên tắc dưới 20 phòng thi có 2 người; từ 20 đến 40 phòng thi có 3 người; từ 41 phòng thi trở lên có 4 người. Thanh tra, kiểm tra công tác chuẩn bị thi, coi thi, chấm thi Bộ yêu cầu đối với công tác chuẩn bị thi, tập trung thanh tra, kiểm tra về tiêu chuẩn, điều kiện đối với những người tham gia tổ chức kỳ thi. Công tác chuẩn bị cơ sở vật chất, phương tiện thông tin, liên lạc tại địa điểm in sao đề thi, hội đồng thi và điểm thi; phương án vận chuyển đề thi, bài thi; phương án bố trí các phòng tại điểm thi. Việc thực hiện quy định về đăng ký dự thi, đối tượng dự thi, xếp phòng thi. Đối với công tác coi thi, chú ý thanh tra, kiểm tra việc thành lập, điều kiện, tiêu chuẩn, thành phần của ban coi thi, ban thư ký và các ban có liên quan. Phương án xử lý tình huống bất thường; bảo đảm an ninh, an toàn tại điểm thi. Việc bố trí, sử dụng thiết bị, cơ sở vật chất tại điểm thi. Việc bảo quản đề thi, bài thi tại điểm thi; vận chuyển và bàn giao bài thi. Đối với công tác chấm thi, tập trung thanh tra, kiểm tra các khu vực chấm thi, làm phách, bảo quản bài thi. Thẩm quyền thành lập, điều kiện, tiêu chuẩn, thành phần của ban làm phách bài thi tự luận, ban chấm thi tự luận và các ban có liên quan. Việc thực hiện quy trình làm phách bài thi tự luận. Việc thực hiện quy trình giao nhận bài thi, quy trình chấm thi, thống nhất điểm, chấm kiểm tra. Việc ghép phách, nhập điểm bài thi tự luận. Về công tác xét công nhận tốt nghiệp THPT, nội dung thanh tra, kiểm tra gồm đối tượng miễn thi, đặc cách tốt nghiệp. Đối tượng bảo lưu điểm thi. Việc cộng điểm ưu tiên, điểm khuyến khích. Quy trình tổng hợp và duyệt công nhận tốt nghiệp.",02/05/2024 22:24 GMT+7,https://tuoitre.vn/thanh-lap-hang-chuc-doan-thanh-tra-kiem-tra-ky-thi-tot-nghiep-thpt-2024050221394582.htm,Bộ Giáo dục và Đào tạo vừa phê duyệt kế hoạch kiểm tra công tác chuẩn bị kỳ thi tốt nghiệp THPT năm 2024.
Nhà văn Mỹ từng đoạt giải Pulitzer giao lưu với sinh viên TP.HCM,"Tại đây, ông kể lại con đường văn chương của mình với nhiều tình tiết lý thú, một trong những chuyện hấp dẫn nhất là cơ duyên giúp ông thắng giải Pulitzer (1993). Buổi giới thiệu sách chỉ có 6 người  Ông chia sẻ ở thời điểm đó, các nhà xuất bản trong nước có thể đề cử một vài quyển sách họ đã xuất bản trong năm gửi về ủy ban xét giải thưởng Pulitzer. Ủy ban này sẽ chọn ra ba giám khảo chấm vòng loại, có thể là những nhà phê bình, học giả hoặc nhà văn nổi tiếng. Ba người này sẽ phải xem khoảng 5.000 cuốn sách được đề cử. Mỗi người sẽ chọn ra một cuốn để vào vòng chung kết. Tại vòng chung kết, 18 người trong ủy ban xét giải sẽ chọn ra tác phẩm chiến thắng chung cuộc từ ba cuốn trên. Năm 1992, Robert Olen Butler viết một trong những tập truyện ngắn đầu tay mang tên Hương thơm từ núi lạ (A good scent from strange mountain). Sau khi tác phẩm ra đời, ông tham gia những buổi giới thiệu ở các hiệu sách để dễ bán sách hơn. Trong một đêm giới thiệu sách như vậy ở thành phố Seattle, chỉ có sáu người đứng nghe Robert Olen Butler đọc và giới thiệu về quyển sách mới. ""Tôi đã nghĩ rằng, nếu họ ở đây để nghe tôi nói, tôi sẽ đọc trái tim mình cho họ nghe"", ông nhớ lại. Điều bất ngờ là trong sáu người lắng nghe buổi tối đó có tiểu thuyết gia người Mỹ Charles Johnson. Một năm sau, Charles Johnson trở thành một trong ba giám khảo lựa chọn sách sơ loại cho giải Pulitzer. Trong 5.000 quyển sách vòng loại, Charles Johnson chọn quyển Hương thơm từ núi lạ của Robert Olen Butler. Một trong những lý do là vì những ấn tượng từ buổi giới thiệu sách. Cuối cùng, quyển Hương thơm từ núi lạ giành giải thưởng Pulitzer ở hạng mục tác phẩm hư cấu năm 1993. ""Đó là một trong những bài học của tôi. Hãy làm những gì tốt nhất có thể, một cách chân thành và tận tâm nhất có thể"", Robert Olen Butler nói. Tình yêu Việt Nam của nhà văn Mỹ Năm 1969, nhà văn Robert Olen Butler tham gia quân đội Mỹ và được đưa đến miền Nam Việt Nam. Trước khi sang Việt Nam, ông học tiếng Việt tại Washington D.C. Ông cho biết nhờ biết đôi chút tiếng Việt nên trong ba năm ở Việt Nam, ông có thể tìm hiểu nhiều về văn hóa và con người Việt Nam. Trong thời gian tại Biên Hòa, ông kể mình được gặp gỡ nhiều nông dân, ngư dân và công chức địa phương, đều là những người đối xử với ông như một người bạn. Năm 1971 khi chuyển về Sài Gòn, ông thích lang thang mỗi đêm quanh những con hẻm khu trung tâm để quan sát cuộc sống của người dân và trò chuyện với họ. Ông chia sẻ khoảng thời gian ở Việt Nam giúp ông khai mở được mọi giác quan khi sáng tác. Không chỉ đơn thuần nhìn bằng mắt mà cảm nhận những thứ xung quanh bằng tất cả giác quan cơ thể khi truyền tải vào tác phẩm. ""Đất nước của các bạn đã trở thành một phần lâu dài trong tôi và sự hiện diện này tiếp tục lớn lên, hình thành, tiếp thêm năng lượng và hướng dẫn quá trình sáng tạo của riêng tôi. Và cuối cùng nó cũng định hình cách mà tôi đã dạy quá trình đó ở các đại học Mỹ và trong các hội nghị trên khắp thế giới trong 40 năm qua"", Robert Olen Butler nói. Từ Việt Nam trở về Mỹ sau năm 1971, Robert Olen Butler bắt đầu viết những quyển sách đầu tiên. Tác phẩm đầu tiên của ông phải gửi đến 22 nhà xuất bản khác nhau trong hơn 2 năm mới có đơn vị chịu xuất bản. Theo Robert Olen Butler, những thách thức luôn có mặt trong khoảng thời gian đầu khi bạn bắt đầu một đam mê. Nhưng quan trọng là vững lòng theo đuổi đam mê ấy và sẵn sàng khi một ngày cơ hội đến với mình.",02/05/2024 21:33 GMT+7,https://tuoitre.vn/nha-van-my-tung-doat-giai-pulitzer-giao-luu-voi-sinh-vien-tp-hcm-20240502205742937.htm,"Chiều 2-5, nhà văn Mỹ Robert Olen Butler có dịp trò chuyện với sinh viên TP.HCM trong chương trình diễn ra tại Trường đại học Hoa Sen."
