Title,Content,Date,Url,Summary
Tin tức giải trí 26-4: Album Taylor Swift đạt 1 tỉ lượt nghe chỉ sau 1 tuần,"Taylor Swift lập kỷ lục với album mới Theo Variety, The Tortured Poets Department của Taylor Swift trở thành album được nghe nhiều nhất trong một tuần trên Spotify. Đại diện của nền tảng phát nhạc trực tuyến cho hay album mới nhất của cô nàng đã vượt mốc 1 tỉ lượt nghe, kể từ khi ra mắt hôm 19-4. Với vị thế siêu sao của mình, Taylor Swift đã tự phá kỷ lục của chính bản thân lập nên tháng 10-2022 với album Midnights. Ngoài ra, đĩa đơn Fortnight thuộc album The Tortured Poets Department cũng trở thành bài hát được nghe nhiều nhất trong ngày của nền tảng Spotify. Các chuyên gia từ Luminate và Billboard nhận định The Tortured Poets Department trở thành album phiên bản vinyl bán chạy nhất trong một tuần. Chỉ tính trong 3 ngày đầu phát hành, album đã bán được 700.000 bản LP. Theo dự đoán của Variety, album kể trên sẽ dễ dàng vượt mốc 2 triệu album bán ra trong thời gian tới. Tom Holland và Zendaya tính tới hôn nhân Theo tờ People, một trong những tờ báo có nguồn tin thân cận với các nhân vật Hollywood, Tom Holland (nổi tiếng với vai diễn Người Nhện) và bạn gái Zendaya (ngôi sao sáng đang lên của Hollywood, từng đóng Dune, Euphoria,...) đang tính đến chuyện sớm ngày ""về một nhà"". Tuy nhiên, nguồn tin của tạp chí này cũng chia sẻ thêm rằng hai người sẽ không công bố tin cho đến phút chót, vì không muốn thu hút sự chú ý của công chúng. Một phần cũng là do Tom Holland và bạn gái đều bận rộn với các dự án lớn. Nên duyên cũng từ bộ phim Spider-Man: Homecoming (2017), hai diễn viên tài năng của Hollywood có sự nghiệp thăng tiến cùng nhau khi liên tục nhận những vai trò quan trọng trong các dòng phim lớn. Zendaya sẽ đóng vai trò chính trong Dune 3, còn Tom Holland vẫn còn dự án Spider Man 4 đang ở phía chân trời. Nhiều đồn đoán xoay quanh việc cặp đôi này chia tay trong nhiều năm qua, nhưng mỗi lần có dịp chia sẻ về đời sống tình cảm của mình, cả hai đều cởi mở cho rằng mình vẫn rất hạnh phúc. Khán giả cũng chờ đợi tin vui từ cặp diễn viên trẻ. Hà Nhi top 1 trending YouTube với Tội cho em Sáng 26-4, video ca khúc Tội cho em của Hà Nhi chính thức đạt vị trí top 1 trending mục Âm nhạc của YouTube. Video cho live stage Tội cho em cũng cán mốc hơn 3 triệu lượt xem trên YouTube. Đây là ca khúc thứ 2 trong sự nghiệp của Hà Nhi đạt được vị trí cao nhất trên top trending, sau Vì em chưa bao giờ khóc ra mắt vào năm ngoái. Được biết, sân khấu live Tội cho em vừa đạt top 1 trending của Hà Nhi được ghi hình trong đêm nhạc tại phòng trà Bến Thành, diễn ra vào tối 7-4 của Hà Nhi. Đại diện của Hà Nhi chia sẻ ban đầu cũng chỉ dự định đăng tải lên kênh YouTube như các màn trình diễn live thông thường, chỉ giới thiệu đơn giản, không tiến hành quảng bá rầm rộ như khi ra mắt MV chính thức, tuy nhiên kết quả lại khiến nữ ca sĩ cùng ê kíp không khỏi bất ngờ. Nữ hoàng nước mắt đầu tư hàng nghìn tỉ đồng Một trong những bộ phim ăn khách nhất xứ kim chi thời gian vừa qua - Nữ hoàng nước mắt đã sắp kết thúc.  Truyền thông Hàn Quốc cũng đã bắt đầu công bố những con số ""khủng"" của series này cả về đầu tư lẫn doanh thu. Nữ hoàng nước mắt (Queen of Tears) được đầu tư kinh phí là 56 tỉ won (khoảng 1.031 tỉ đồng) cho 16 tập phim, tương đương với 3,5 tỉ won mỗi tập (khoảng 64 tỉ đồng). Tuy không thể sánh với các bộ phim TV series được đầu tư hàng trăm triệu USD của Netflix, đây vẫn là một con số rất lớn đối với một nhà đài địa phương như tvN. Ban đầu, kinh phí ước tính khoảng 40 tỉ won (khoảng 737 tỉ đồng), nhưng trong quá trình sản xuất, kinh phí của phim đã phát sinh thêm 16 tỉ won (gần 300 tỉ đồng). Nhà đài tvN đã có thương vụ bán bản quyền phát sóng của Nữ hoàng nước mắt cho ""ông lớn"" Netflix và thu về 65 tỉ won (1.200 tỉ đồng). Do vậy, lợi nhuận của phim hiện là 10 tỉ won (khoảng 184 tỉ đồng). Đây là con số chưa tính lợi nhuận từ quảng cáo giờ vàng hoặc các khoản thu khác trên sóng truyền hình tvN. Hyoyeon (SNSD), Bomi (Apink) bị tạm giữ tại Bali Mới đây, thông tin các nghệ sĩ lớn như Hyoyeon (SNSD), Bomi (Apink) cùng một số nghệ sĩ khác đang bị tạm giữ tại Bali (Indonesia) khiến cư dân mạng giật mình. Cụ thể, các nữ idol đang ghi hình cùng đội ngũ sản xuất chương trình mới của KBS Joy có tên My Way Package Season 2: Pick Me Trip in Bali đã bị chính quyền Bali bắt quả tang, khi đang thực hiện hành vi gọi là 'quay phim trộm' mà không xuất trình được giấy phép. Cộng đồng mạng nghi ngờ KBS chưa thông qua chính quyền Bali về kế hoạch quay phim, vì vậy đội ngũ sản xuất đã không thể xuất trình giấy phép. Trước đó, ê kíp chương trình đã đến Bali vào ngày 21-4 để ghi hình và dự kiến trở về vào ngày 25-4. Tuy nhiên do sự cố này, đến nay toàn bộ đội ngũ sản xuất và dàn cast vẫn chưa thể trở về Hàn Quốc. Theo chia sẻ của nhân viên trong đoàn phim cùng tờ báo SPOTV News, có vẻ như đội ngũ sản xuất không chia sẻ về tình hình này cho các thành viên khác, dẫn đến việc dàn nghệ sĩ cũng không biết lý do vì sao họ đột nhiên bị tạm giữ. Cả đoàn đang nỗ lực để có thể nhanh chóng trở về Hàn Quốc.",26/04/2024 16:03 GMT+7,https://tuoitre.vn/tin-tuc-giai-tri-26-4-album-taylor-swift-dat-1-ti-luot-nghe-chi-sau-1-tuan-20240426154725049.htm,"Một số tin tức nổi bật: Taylor Swift lập kỷ lục với album mới; Nam diễn viên Tom Holland và Zendaya tính tới hôn nhân; Gây sốt toàn cầu, bộ phim ""Nữ hoàng nước mắt"" cũng đầu tư khủng hàng nghìn tỉ đồng;..."
"Nhạc sĩ Vũ Xuân Hùng, người chuyển ngữ Anh thì không, Dòng sông tuổi nhỏ... qua đời","Trước đó, ngày 27-4, bà Đinh Thị Xuân Hòa - vợ nhạc sĩ - từng chia sẻ trên trang Facebook cá nhân: ""Người đi bên cạnh cuộc đời tôi - nhạc sĩ Vũ Xuân Hùng đang lâm trọng bịnh (bệnh).  Xin các anh chị em bạn hữu cầu nguyện giúp cho Vũ Xuân Hùng của con vượt qua kiếp nạn này"". Cuối cùng, người chuyển ngữ những bản tình ca đã không vượt qua được, ông đã về với Chúa chiều 1-5. Nhạc sĩ Vũ Xuân Hùng ra đi thanh thản Chia sẻ với Tuổi Trẻ Online, bà Xuân Hòa kể, nhạc sĩ Vũ Xuân Hùng bị nhiều chứng bệnh như suy thận, suy tim, suy hô hấp. Từ khi ông nhập viện tới khi mất là 10 ngày. ""Những ngày cuối đời, anh rơi vào tình trạng mê man không biết gì. Mọi thứ quá chóng vánh, tôi không tin là anh đã rời xa tôi mãi mãi"", bà chia sẻ. Theo bà, ông Vũ Xuân Hùng ra đi trong thanh thản, những điều muốn làm cũng đã làm được. Bà Xuân Hòa nói lúc còn sống, nhạc sĩ từng nói ""sống với em, anh mới biết còn có thiên đường ở trần gian"". Bà cũng yêu ông nhiều như ông yêu bà. Vì thế, khi ông Hùng mất, bà Hòa ""rơi vào tình trạng mất phương hướng, không biết mình đang làm gì, nói chuyện với ai, nói gì"". Góp phần Việt hóa nhạc trẻ Trước năm 1975, nhạc sĩ Vũ Xuân Hùng từng giảng dạy ngoại ngữ và triết học. Ông biết nhiều ngoại ngữ, ngoài tiếng Anh còn có tiếng Pháp, Đức, Ý nên thuận lợi trong việc chuyển ngữ nhạc ngoại sang lời Việt. Trong sự nghiệp của mình, nhạc sĩ Vũ Xuân Hùng đã chuyển ngữ hơn 100 ca khúc ngoại, được xem là ""vua chuyển ngữ nhạc ngoại"". Trong đó có nhiều bài rất nổi tiếng, được giới trẻ Sài Gòn hâm mộ một thời như Búp bê không tình yêu, Chuyện phim buồn, Dòng sông tuổi nhỏ, Em đẹp như mơ, Hôm nay không sữa, Anh thì không, Em đẹp nhất đêm nay, Biệt khúc, Nụ hôn dưới mưa... Các ca khúc chuyển ngữ của ông gắn với nhiều giọng ca vàng như Nguyễn Chánh Tín - Bích Trâm, Lê Uyên - Phương, Thanh Lan, Duy Quang, Julie Quang, Ngọc Lan, Ý Lan,… Nhạc sĩ Vũ Xuân Hùng được xem là một trong những người đóng góp cho phong trào Việt hóa nhạc trẻ giai đoạn đầu ở Sài Gòn - TP.HCM. Ba tập Tình ca nhạc trẻ I, II, III do Vũ Xuân Hùng đồng chuyển ngữ đã tạo ra một làn sóng nhạc trẻ ca khúc nước ngoài lời Việt đầu thập niên 70 của thế kỷ trước. Sau đó, ông định cư ở Mỹ. Tới năm 1997, ông cùng vợ là bà Đinh Thị Xuân Hòa về nước, thành lập phòng trà Tiếng Xưa. Ngoài biên tập nhiều chương trình, ông còn dựng nhiều vở nhạc kịch dựa theo các bài hát nổi tiếng như: Hòn vọng phu, Trầu cau, Cung đàn xưa, Tiếng đàn tôi, Tiếng sáo thiên thai, Mối tình Trương Chi, Lan và Điệp…",02/05/2024 12:53 GMT+7,https://tuoitre.vn/nhac-si-vu-xuan-hung-nguoi-chuyen-ngu-anh-thi-khong-dong-song-tuoi-nho-qua-doi-20240502122837334.htm,"Nhạc sĩ Vũ Xuân Hùng, người chuyển ngữ loạt ca khúc nổi tiếng như Dòng sông tuổi nhỏ, Anh thì không, Búp bê không tình yêu… qua đời lúc 18h ngày 1-5, hưởng thọ 79 tuổi."
"Lật mặt 7 chạm mốc 200 tỉ, liệu có phá kỷ lục của Trấn Thành?","Theo số liệu của Box Office Vietnam đến sáng 2-5, Lật mặt 7: Một điều ước vẫn giữ ngôi đầu bảng phòng vé với doanh thu 200 tỉ đồng.  Đáng chú ý, chỉ trong hai ngày 30-4 và 1-5, Lật mặt 7 đã bứt phá doanh thu và thu về gần 100 tỉ đồng.  Lật mặt 7 và phần còn lại  Từ khi bắt đầu đợt nghỉ lễ, bộ phim của Lý Hải thu về trung bình từ 20 đến 30 tỉ một ngày, các nhà rạp cũng ""ưu ái"" bộ phim thuộc hàng bom tấn điện ảnh Việt này khi cho phim từ 4.300 đến hơn 4.700 suất chiếu mỗi ngày.  Phần mới trong loạt phim Lật mặt của Lý Hải chính thức ra rạp từ 26-4, nhưng trước đó đã có những suất chiếu sớm ngày 24 và 25-4. Con số doanh thu trên tính cả các suất chiếu sớm. Xếp ở vị trí thứ hai sau Lật mặt 7 là phim hành động Hàn Quốc có tên Vây hãm: Kẻ trừng phạt, với sự góp mặt của siêu sao hành động xứ Hàn - Ma Dong Seok, phim cũng phát hành chung đợt với Lật mặt 7.  Tuy khuấy đảo thị trường Hàn Quốc, thu về hơn 30 triệu USD nhưng doanh thu tại Việt Nam sau lễ của Vây hãm: Kẻ trừng phạt chỉ dừng lại ở mốc gần 20 tỉ đồng, với trung bình dưới 2.000 suất chiếu một ngày.   Trong hôm nay 2-5, phim thậm chí còn chưa đến 1.000 suất chiếu. Một phim Hàn khác là Tà khúc triệu vong thì tụt sâu trong bảng xếp hạng, chỉ thu về tổng cộng 1,5 tỉ đồng sau gần một tuần ra mắt.  Tuy cũng khai thác thể loại kinh dị siêu nhiên từng gây sốt tại Hàn Quốc với Exhuma: Quật mộ trùng ma, nhưng bộ phim Tà khúc triệu vong không thể kế thừa được sự thành công của bom tấn này.  Đường đua phim hoạt hình mùa lễ cũng không quá hấp dẫn khi Mèo mập mang 10 mạng áp đảo những đối thủ còn lại, thu về hơn 11 tỉ đồng, trong khi Gấu béo tung chưởng ngậm ngùi kết thúc đường đua khi chưa thu nổi 1 tỉ đồng.  Ngoài ra, còn có những bộ phim đã ""xuất phát"" trước lễ nhưng doanh thu cũng không mấy khả quan như B4S - Trước giờ yêu, Cái giá của hạnh phúc, Đóa hoa mong manh hay Tu viện máu.  Hầu hết những phim kể trên đều có doanh thu ""lẹt đẹt"", phim Cái giá của hạnh phúc tuy thu về hơn 25 tỉ đồng nhưng vẫn còn rất xa mức ""hoàn vốn"".  Nhìn chung, thị trường điện ảnh Việt dịp lễ đã không có bất ngờ xảy ra, Lật mặt 7 đạt được thành công như dự đoán. Thậm chí, tổng doanh thu tất cả các phim ra mắt trong dịp lễ cũng chưa bằng được bộ phim của Lý Hải.  Hiện tại, chúng ta chỉ có thể chờ xem liệu Lật mặt 7 có làm nên kỳ tích, phá vỡ kỷ lục 400 tỉ của Mai dịp Tết vừa rồi. ",02/05/2024 11:32 GMT+7,https://tuoitre.vn/lat-mat-7-cham-moc-200-ti-lieu-co-pha-ky-luc-cua-tran-thanh-20240502111913796.htm,"Sau 5 ngày nghỉ lễ 30-4 và 1-5, kết quả của cuộc cạnh tranh doanh thu phòng vé đã ngã ngũ, Lật mặt 7: Một điều ước áp đảo phần còn lại, bứt phá doanh thu lên cột mốc mới."
"'Thần tiên tỷ tỷ' 37 tuổi Lưu Diệc Phi độc thân, giàu có và làm mẹ của 20 con mèo","Ở tuổi 37, Lưu Diệc Phi vẫn giữ được ngoại hình trẻ trung, xinh đẹp, cô tận hưởng cuộc sống độc thân, giàu có cùng với đàn mèo của mình. ""Thần tiên tỷ tỷ"" vừa đăng tải một loạt ảnh thư giãn, vui đùa cùng thú cưng trong khu vườn nhà. Tuy chỉ là những khoảnh khắc đời thường giản dị nhưng loạt ảnh của Lưu Diệc Phi thu về lượng tương tác cao và lọt thẳng vào top tìm kiếm trên các mạng xã hội xứ Trung. Lưu Diệc Phi cuồng mèo Ngoài ngưỡng mộ cuộc sống như mơ, một số khác lại trầm trồ vì ""gia tài"" mèo của nữ diễn viên. Được biết, Lưu Diệc Phi nuôi gần 20 con mèo trong nhà, trong đó phần lớn là mèo hoang được cô ""giải cứu"". Căn biệt thự của Lưu Diệc Phi tọa lạc tại quận Thuận Nghĩa (Bắc Kinh), diện tích của khu nhà lên tới 16.700m2. Ngoài không gian chính, nữ diễn viên còn dành một khoảng sân sau làm không gian riêng cho những thú cưng của mình. Số lượng mèo của Lưu Diệc Phi không cố định, có thời điểm cô nuôi gần 50 chú mèo bị bỏ rơi, sau đó đưa chúng đi chữa bệnh, tiêm phòng, chăm sóc chu đáo ở sân sau cho đến khi tìm được chủ mới. Lưu Diệc Phi nói cô cảm thấy rất thoải mái, hạnh phúc khi ở bên bầy mèo vì chúng rất quấn chủ lại dễ chăm sóc, hơn nữa mèo có một phần tính cách giống cô. Vậy nên mỗi khi phải đi công tác xa nhà, nữ diễn viên đều cảm thấy rất nhớ bầy thú cưng. ""Đôi khi chúng rất giống tôi, chúng quyết định làm việc gì đó theo trực giác, rất tùy hứng và không quy củ gì cả"" - Lưu Diệc Phi nói. Theo Sohu, Lưu Diệc Phi là một người biết tận hưởng cuộc sống, cô thường xuyên dành thời gian đi du lịch, thư giãn sau mỗi dự án phim ảnh, lịch trình sự kiện. Nữ diễn viên biết cân bằng công việc và cuộc sống, đôi lúc còn 'ở ẩn' trong căn biệt thự triệu đô của mình. Từng chăm sóc hơn 50 con mèo hoang ""Thần tiên tỷ tỷ"" còn là một người cuồng mèo, nhân hậu, cô và mẹ đã tham gia cứu hộ và nhận nuôi mèo hoang từ năm 2011. Tính đến nay, đã có hơn 50 con mèo được cứu sống và chăm sóc bởi Lưu Diệc Phi, họ thường nhận nuôi những chú mèo hoang để chữa bệnh và sau đó tìm những gia đình quan tâm để nhận nuôi chúng. Ngoài việc tự tay cứu hộ mèo, cô cũng thường xuyên tham gia và đóng góp tiền cho các tổ chức bảo vệ động vật và kêu gọi cộng đồng không ngược đãi và bỏ rơi động vật. Hiện tại, căn hộ của Lưu Diệc Phi đang có gần 20 chú mèo, cô thường xuyên đăng tải, cập nhật hình ảnh của thú cưng lên mạng xã hội. Nữ diễn viên còn được gọi vui là blogger thú cưng vì mạng xã hội của cô tràn ngập ảnh chụp cùng với mèo. Trong số đó, chú mèo quen thuộc Miêu Tiểu Mị đã ở bên Lưu Diệc Phi hơn 10 năm, cô coi nó như một thành viên của gia đình. Còn chú mèo khác tên Anna cũng đã sống tại nhà của nữ diễn viên được 7 năm. Sau hơn 20 năm bước chân vào giới giải trí, Lưu Diệc Phi vẫn giữ được sức hút của riêng mình. Cuộc sống độc thân, thoải mái của Lưu Diệc Phi hiện tại đã trở thành hình mẫu cuộc sống lý tưởng của nhiều bạn trẻ Trung Quốc.",02/05/2024 09:30 GMT+7,https://tuoitre.vn/than-tien-ty-ty-37-tuoi-luu-diec-phi-doc-than-giau-co-va-lam-me-cua-20-con-meo-20240502073048267.htm,Cuộc sống vui vẻ thoải mái của Lưu Diệc Phi cùng dàn 'boss' đã trở thành một hình mẫu cuộc sống lý tưởng của giới trẻ Trung Quốc.
"Diễn viên chuyên vai phụ, từng đóng hàng trăm bà mẹ trên phim ảnh 20 năm qua, là ai?","Lật mặt 7: Một điều ước có dàn diễn viên đồ sộ hơn 50 người, trong đó nhân vật tâm điểm là bà Hai của Thanh Hiền, nữ nghệ sĩ có gương mặt phúc hậu và đài từ dịu dàng. Nghệ sĩ Thanh Hiền cho Tuổi Trẻ Online biết năm nay bà 72 tuổi nhưng vẫn rất mê đi diễn. Hiện sống cùng chồng ở quận 12 (TP.HCM), bà được gia đình ủng hộ theo đuổi diễn xuất như một niềm vui của tuổi già. ""Bà Hai"" vui sống bên con cháu và nghề diễn Nhận vai bà Hai - bà mẹ của 5 người con nhưng có lúc đơn chiếc, con cái bận mưu sinh không thể chăm sóc - nghệ sĩ Thanh Hiền dành nhiều thời gian để hóa thân. Bởi ngoài đời bà có hoàn cảnh khác biệt với nhân vật. Ở tuổi này, bà vẫn đi phim hoài, chủ yếu đóng phim truyền hình. ""Cứ buổi sáng, dậy đánh răng xong là tôi xách giỏ ra khỏi nhà có khi 4h, có khi 5h, tối hù mới về"" - bà kể về cuộc sống của mình. Có những đợt, bà ngủ 3 đêm liền trên xe khách. Đó là khi bà đi xe đêm từ TP.HCM đi Đà Lạt quay phim, sau đó lên xe về TP.HCM đi Phan Thiết, rồi về TP.HCM đi Vĩnh Long. Có những vai ngắn trong phim truyền hình, người ta gom quay trong một ngày để tiết kiệm kinh phí. Riêng đóng Lật mặt 7 là bà phải theo đoàn đi Lạc Dương khoảng một tháng, chưa kể đi các địa phương khác như Hà Nội, Ninh Thuận, Bảo Lộc, rồi lại về TP.HCM. Trời cho bà sức khỏe tốt dù đi phim nhiều, không có thời gian bồi bổ. Chồng và các con của nghệ sĩ cũng ủng hộ bà đi phim. Diện bộ áo dài truyền thống và khăn choàng điệu đà khi trả lời phỏng vấn, ""bà Hai"" khoe con dâu may cho để bà đi quảng bá Lật mặt 7. Nếu trong phim, mối quan hệ giữa bà Hai và con dâu cả có lúc căng thẳng, thì ngoài đời nghệ sĩ Thanh Hiền lại rất yêu thương con dâu. ""Với con dâu, tôi quan niệm mình thương nó thì nó thương mình. Tôi nấu cái ngon cũng đưa lên cho cháu nội, cho con dâu con trai. Cái gì con Trinh thích thì tôi mua cho. Nó cũng thấy má thích ăn gì là mua gửi qua cho má.  Má đi họp báo, nó may cho mấy cái áo dài nhung đẹp lắm. Chỉ cần vậy là mình biết con quý mình, đâu cần nó đưa mình cục tiền bự"" - bà kể. Nhờ đóng phim, nghệ sĩ Thanh Hiền có tiền chi tiêu khá thoải mái, bên cạnh việc con cái phụng dưỡng. Bà dành cát sê để may phục trang đóng phim và đi chùa, làm từ thiện, thấy ai khó khăn thì biếu. Trong gia đình bà, chuyện con cái nuôi cha mẹ già không phải vấn đề căng thẳng. Các con bà cùng nhau chăm lo cho cha mẹ và đoàn kết với nhau. ""Khán giả Lật mặt 7 ôm tôi khóc nức nở""  Nghệ sĩ Thanh Hiền từng đóng hàng trăm vai bà mẹ trong các phim điện ảnh lớn nhỏ, phim truyền hình, phim ngắn, cả phim bài tập của sinh viên, nổi bật có: Tiếng sét trong mưa, Mắt biếc, Hai Phượng, Lật mặt 7... Sau hơn 20 năm trong nghề, diễn viên Thanh Hiền được trải nghiệm đi cinetour với lịch trình dày đặc. Lịch cinetour của ê kíp Lý Hải được coi là dày nhất trong giới điện ảnh Việt, nên diễn viên cũng được gặp gỡ rất nhiều khán giả. Diễn viên Thanh Hiền cảm động vì nhiều khán giả yêu thương nhân vật của bà. Có em bé 9-10 tuổi đã mất mẹ, xem phim nhớ mẹ nên khóc. Có bà cụ hơn 80 tuổi ôm chặt lấy bà, khóc nức nở sau khi xem.",02/05/2024 05:56 GMT+7,https://tuoitre.vn/dien-vien-chuyen-vai-phu-tung-dong-hang-tram-ba-me-tren-phim-anh-20-nam-qua-la-ai-20240501173846105.htm,"Trên 70 tuổi, diễn viên Thanh Hiền của Lật mặt 7 có 20 năm theo nghề diễn với hàng trăm vai bà mẹ. Bà được gia đình ủng hộ, thức khuya dậy sớm 'đi phim'."
