Title,Content,Date,Url,Summary
Hơn 6.500 thí sinh phải thi lại đánh giá tư duy Đại học Bách khoa Hà Nội do lỗi hệ thống,"Ngày 28-4, sau khi dự thi đánh giá tư duy đợt 4 của Đại học Bách khoa Hà Nội, nhiều thí sinh lên các diễn đàn mạng xã hội cho biết kíp thi buổi sáng bị lỗi trắng màn hình từ 5-10 phút mới hiển thị đề thi, có thí sinh không bị lỗi. Đến buổi chiều, một số thí sinh thi tại các điểm thi Thái Nguyên, Hà Nội dự thi kíp chiều phản ánh hệ thống bài thi bị lỗi không thể hoàn thành bài thi, không được công nhận kết quả bài thi. Xác nhận lỗi toàn bộ kíp chiều Sáng nay 29-4, Đại học Bách khoa Hà Nội đã chính thức thông tin về sự cố thi đánh giá tư duy đợt 4, kíp chiều 28-4. PGS.TS Vũ Duy Hải - trưởng ban tuyển sinh - hướng nghiệp, Đại học Bách khoa Hà Nội - phó chủ tịch thường trực Hội đồng thi đánh giá tư duy năm 2024, cho biết trong hai ngày 27 và 28-4, Đại học Bách khoa Hà Nội tiếp tục tổ chức bài thi đánh giá tư duy với quy mô lớn cho gần 14.000 thí sinh đăng ký dự thi tại 29 điểm thi ở 11 tỉnh/thành phố. Đợt thi gồm 2 kíp thi sáng và chiều, trong đó kíp sáng đã có 7.130 thí sinh đến làm bài thi trên tổng số 7.231 thí sinh đăng ký dự thi. Kíp chiều đã có 6.566 thí sinh đến làm thủ tục thi trên tổng số 6.720 thí sinh đăng ký dự thi. Theo ông Hải, kíp thi buổi sáng đã diễn ra thành công, toàn bộ kết quả thi của thi sinh đã được ghi nhận trên hệ thống. ""Mặc dù có một số thí sinh bị lỗi mở đề phần thi tư duy toán học chậm mất một vài phút, song vẫn nằm trong khung phạm vi thời gian cho phép của phần thi nên sẽ không ảnh hưởng tới kết quả thi của thí sinh"", ông Hải thông tin. Trong kíp thi buổi chiều, ông Hải cho biết bộ phận kỹ thuật đã phát hiện hệ thống nền tảng thi có dấu hiệu thiếu ổn định từ thời điểm 13h50 (40 phút trước khi diễn ra bài thi).  Ban chỉ đạo thi đã quyết định lùi thời gian bắt đầu thi 60 phút để kiểm tra lại hệ thống và đã cho mở lại thời gian vào thi lúc 15h30. ""Phần thi tư duy toán học đã diễn ra thành công. Sau đó chuyển sang phần thi tư duy đọc hiểu thì hệ thống lại có dấu hiệu mất ổn định trở lại.  Các dịch vụ đồng bộ dữ liệu bị gián đoạn, bài làm của thí sinh không được cập nhật về server dẫn đến thí sinh không thể tiếp tục hoàn thành bài thi. Ban chỉ đạo thi đã quyết định cho dừng kíp thi vào lúc 17h cùng ngày. Bộ phận kỹ thuật đã xác định nguyên nhân lỗi là do tài nguyên server của hệ thống nền tảng thi bị quá tải do một số chức năng mới được đưa vào sử dụng để tổng hợp dữ liệu trợ giúp giám thị sàng lọc và phát hiện nguy cơ gian lận thi cử.  Chức năng này đã xảy ra lỗi và chiếm dụng các tài nguyên của hệ thống, từ đó tạo hiệu ứng dây chuyền làm treo hệ thống thi"", ông Hải thông tin. Ông Hải cho biết nhà trường đánh giá với lỗi hệ thống này, đây là sự cố lớn đầu tiên mà hội đồng thi đã phải quyết định cho dừng kíp thi theo quy chế thi. Trong các đợt thi tiếp theo, nhà trường cùng các đối tác công nghệ cam kết sẽ thực hiện khâu kiểm soát kỹ thuật chặt chẽ hơn nữa để đảm bảo không để xảy ra các sự cố tương tự. Hơn 6.500 thí sinh phải thi lại Từ 1h sáng 29-4, Hội đồng thi đánh giá tư duy của Đại học Bách khoa Hà Nội đã gửi email thông báo cho tất cả các thí sinh tham dự kíp thi chiều ngày 28-4 vì sự cố trên và đưa ra các giải pháp để thí sinh có thể lựa chọn nhằm đảm bảo quyền lợi. Theo đó, Hội đồng thi đánh giá tư duy Đại học Bách khoa Hà Nội quyết định: - Tổ chức thi bù cho các thí sinh đã không thể hoàn thành bài thi trong kíp thi chiều ngày 28-4 vào ngày 19-5. - Các thí sinh đã không thể hoàn thành bài thi trong kíp thi chiều ngày 28-4 sẽ được ưu tiên đăng ký dự thi miễn phí trong đợt 5 hoặc đợt 6 diễn ra vào các ngày 8 và 9-6, ngày 15 và 16-6. - Các thí sinh không bố trí được thời gian tham dự thi bù vào ngày 19-5, hội đồng thi sẽ hoàn trả lệ phí dự thi mà các em đã đóng cho kíp thi chiều 28-4.",29/04/2024 09:18 GMT+7,https://tuoitre.vn/hon-6-500-thi-sinh-phai-thi-lai-danh-gia-tu-duy-dai-hoc-bach-khoa-ha-noi-do-loi-he-thong-20240429090301089.htm,"Sau khi tham dự kỳ thi đánh giá tư duy của Đại học Bách khoa Hà Nội chiều 28-4, nhiều thí sinh phản ảnh hệ thống bị lỗi khiến thí sinh không thể hoàn thành bài thi, kết quả không được công nhận."
Trung Quốc mở chiến dịch chống bắt nạt học đường trên toàn quốc,"Theo kết quả cuộc họp giữa đại diện Bộ Giáo dục, Bộ Công an và cơ quan quản lý cứu hỏa và cứu hộ Trung Quốc, nước này sẽ triển khai chiến dịch điều tra toàn diện nạn bắt nạt học đường tại tất cả các trường tiểu học và trung học cơ sở trên cả nước. Các quan chức tham dự cuộc họp cho rằng cần nâng cao nhận thức của giáo viên, học sinh và phụ huynh về luật chống bạo lực học đường, song song với nỗ lực cải thiện các biện pháp kỷ luật và cơ chế giải trình. Ngoài ra, cơ quan chức năng sẽ tập trung hơn vào việc tăng cường sức khỏe tâm thần của học sinh với một hệ thống được nâng cấp để theo dõi sức khỏe tâm lý của các em, cũng như hợp tác mạnh mẽ hơn giữa trường học và bệnh viện. Nỗ lực dẹp bỏ vấn nạn bắt nạt học đường được thúc đẩy trong bối cảnh Trung Quốc ghi nhận ngày càng nhiều vụ việc trẻ vị thành niên phạm pháp và số vụ tự tử gia tăng ở các trường tiểu học và trung học. Tháng trước, ba học sinh cấp hai ở tỉnh Hà Bắc gần Bắc Kinh được cho là đã sát hại một bạn cùng lớp 13 tuổi mà nhóm này đã bắt nạt từ lâu. Cả ba nghi phạm đều dưới 14 tuổi. Vụ việc đã gây chấn động cả nước và gây ra cuộc tranh luận sôi nổi trên mạng xã hội Trung Quốc về luật quản lý tội phạm vị thành niên phạm tội nghiêm trọng.",28/04/2024 22:04 GMT+7,https://tuoitre.vn/trung-quoc-mo-chien-dich-chong-bat-nat-hoc-duong-tren-toan-quoc-20240428214238249.htm,Nhà chức trách Trung Quốc ngày 28-4 cho biết nước này sẽ phát động chiến dịch chống bắt nạt học đường trên quy mô toàn quốc.
Bác tin sai sự thật liên quan Trường ĐH Y dược Thái Bình,"Ngày 28-4, Trường ĐH Y dược Thái Bình đã ra thông báo phản bác những thông tin trên mạng xã hội và truyền miệng những ngày qua về việc quan hệ tình cảm giữa một lưu học sinh và cán bộ nhà trường. Nhà trường khẳng định những thông tin này là hoàn toàn sai sự thật. Trường cho biết sau khi tiếp nhận thông tin về lưu học sinh có quan hệ tình cảm với cán bộ nhà trường, lãnh đạo trường đã chỉ đạo phòng hợp tác quốc tế, đại diện ban chấp hành Đoàn thanh niên trường tổ chức cuộc họp vào ngày 23-4 với trưởng đoàn lưu học sinh và lưu học sinh. Tại cuộc họp, lưu học sinh xác nhận: ""Trong thời gian học tại Trường ĐH Y dược Thái Bình không có mối quan hệ tình cảm hay hành động nào tổn hại về mặt thể chất và tinh thần giữa bản thân và cán bộ nhà trường"". Ngày 25-4, ban chấp hành Đảng bộ nhà trường đã họp, xem xét nội dung thông tin, đồng thời khẳng định các tin đồn là hoàn toàn sai sự thật, không có căn cứ, làm ảnh hưởng đến uy tín của nhà trường và cán bộ, sinh viên. Thông báo nhà trường được gửi đến các đơn vị và toàn thể viên chức, người lao động trong trường, đồng thời nêu rõ: ""Nếu tập thể, cá nhân có phát ngôn hoặc phát tán thông tin sai sự thật về sự việc nêu trên sẽ phải hoàn toàn chịu trách nhiệm trước pháp luật và nhà trường"". Trước đó, những ngày qua dư luận trên địa bàn tỉnh Thái Bình xôn xao cho rằng tại Trường ĐH Y dược Thái Bình xảy ra việc lưu học sinh đang theo học tại trường có quan hệ tình cảm vượt quá mức giới hạn với cán bộ, giáo viên trong trường. Câu chuyện còn được ""thêu dệt"" với nhiều tình tiết không có thật, làm ảnh hưởng xấu đến nhà trường cũng như lưu học sinh.",28/04/2024 21:36 GMT+7,https://tuoitre.vn/bac-tin-sai-su-that-lien-quan-truong-dh-y-duoc-thai-binh-20240428212328574.htm,Trường ĐH Y dược Thái Bình bác tin đồn một lưu học sinh có quan hệ tình cảm vượt quá giới hạn với cán bộ nhà trường.
"Đề xuất bổ sung giáo viên mầm non vào nghề nặng nhọc, độc hại, nguy hiểm","Theo cử tri tỉnh Bình Định, quy định tuổi nghỉ hưu của nữ giáo viên mầm non (60 tuổi) không phù hợp với thực tế, vì sức khỏe, độ nhanh nhẹn, các thao tác chuyên môn... khó đáp ứng được với yêu cầu công việc. Cử tri đề nghị Chính phủ chỉ đạo các bộ, ngành liên quan xem xét, đánh giá các yếu tố đặc thù về điều kiện lao động của giáo viên mầm non và bổ sung vào ""danh mục nghề, công việc nặng nhọc, độc hại, nguy hiểm..."". Việc này để đối tượng này được hưởng chế độ nghỉ hưu ở tuổi thấp hơn so với lao động trong điều kiện bình thường theo quy định của Bộ luật Lao động. Cử tri tỉnh Yên Bái đề nghị xem xét bổ sung giáo viên mầm non vào nhóm có thể nghỉ hưu sớm hơn so với quy định để đảm bảo phù hợp với tính chất đặc thù công việc. Vì sao giáo viên mầm non chưa vào nghề nặng nhọc, độc hại...? Trả lời ý kiến của cử tri tỉnh Bình Định, Bộ Lao động - Thương binh và Xã hội nêu rõ tại thông tư 29/2021 đã quy định cụ thể về việc bổ sung danh mục nghề, công việc nặng nhọc, độc hại, nguy hiểm và nghề, công việc đặc biệt nặng nhọc, độc hại, nguy hiểm. Cụ thể, bộ quản lý ngành, lĩnh vực rà soát nghề, công việc nặng nhọc, độc hại, nguy hiểm và nghề, công việc đặc biệt nặng nhọc, độc hại, nguy hiểm thuộc ngành, lĩnh vực quản lý. Cùng với đó, xem xét ý kiến của người sử dụng lao động để đề xuất sửa đổi, bổ sung danh mục nghề phù hợp với sự phát triển kinh tế - xã hội, khoa học công nghệ và quản lý trong từng thời kỳ, gửi Bộ Lao động - Thương binh và Xã hội. Thông tư 11/2020 quy định hằng năm, các bộ quản lý ngành, lĩnh vực, người sử dụng lao động chủ động rà soát, đánh giá danh mục nghề theo phương pháp đã được Bộ Lao động - Thương binh và Xã hội quy định để đề xuất sửa đổi, bổ sung danh mục nghề phù hợp với sự phát triển kinh tế - xã hội, khoa học công nghệ và quản lý trong từng thời kỳ. Trên cơ sở đề xuất của các bộ quản lý ngành, lĩnh vực, người sử dụng lao động, bộ nêu rõ sẽ phối hợp với các bộ, ngành, cơ quan xem xét, đánh giá điều kiện lao động của các nghề, công việc giáo viên mầm non để có cơ sở xem xét, sửa đổi, bổ sung danh mục nghề, công việc nặng nhọc, độc hại, nguy hiểm và nghề, công việc đặc biệt nặng nhọc, độc hại, nguy hiểm theo quy định. Cũng theo Bộ Lao động - Thương binh và Xã hội, ngày 15-12-2022, Bộ Giáo dục và Đào tạo có công văn đề nghị bổ sung vào danh mục nghề với hai nhóm giáo viên mầm non, nhân viên thiết bị, thí nghiệm nhưng không gửi kèm hồ sơ theo các quy định trên nên không có cơ sở xem xét, bổ sung vào danh mục. Những nghề nào có thể nghỉ hưu sớm? Liên quan tuổi nghỉ hưu, Bộ Lao động - Thương binh và Xã hội nêu rõ đã được thảo luận, thống nhất thông qua tại nghị quyết 28/2018 của Hội nghị lần thứ 7 Ban Chấp hành Trung ương Đảng khóa XII. Thể chế hóa chủ trương tăng tuổi nghỉ hưu tại nghị quyết 28, Quốc hội đã thống nhất ban hành Bộ luật Lao động năm 2019. Trong quá trình nghiên cứu, xây dựng Bộ luật Lao động năm 2019, vấn đề tuổi nghỉ hưu đã được trao đổi, thảo luận, đánh giá một cách kỹ lưỡng, tổng thể các mặt liên quan. Vì vậy, Bộ luật Lao động quy định việc điều chỉnh tăng tuổi nghỉ hưu hay điều kiện về tuổi hưởng lương hưu của người lao động không thực hiện tăng ngay lên 62 tuổi với nam, 60 tuổi với nữ mà được điều chỉnh theo lộ trình mỗi năm chỉ tăng thêm 3 tháng với lao động nam và 4 tháng với lao động nữ. Bên cạnh đó, việc tăng tuổi nghỉ hưu đã xem xét tính đến các yếu tố về tính chất, loại hình lao động, sức khỏe của người lao động. Những người lao động làm nghề, công việc đặc biệt nặng nhọc, độc hại, nguy hiểm; làm nghề, công việc nặng nhọc, độc hại, nguy hiểm; làm việc ở vùng có điều kiện kinh tế - xã hội đặc biệt khó khăn hoặc những người lao động sức khỏe yếu (bị suy giảm khả năng lao động). Những trường hợp này có thể nghỉ hưu ở tuổi thấp hơn so với người làm việc trong điều kiện lao động bình thường (nghỉ hưu sớm hơn tối đa 5 tuổi hoặc 10 tuổi, tùy từng trường hợp). Thời gian tới, trên cơ sở đề xuất của các bộ, ngành, địa phương, Bộ tiếp tục phối hợp nghiên cứu, rà soát để sửa đổi, bổ sung danh mục nghề nhằm đảm bảo thực hiện tốt các chế độ, chính sách cho người lao động, trong đó có việc làm cơ sở xét điều kiện về tuổi hưởng lương hưu của người lao động.",28/04/2024 17:40 GMT+7,https://tuoitre.vn/de-xuat-bo-sung-giao-vien-mam-non-vao-nghe-nang-nhoc-doc-hai-nguy-hiem-20240428172024077.htm,"Bộ Lao động - Thương binh và Xã hội đã có trả lời về đề xuất bổ sung giáo viên mầm non vào nghề nặng nhọc, độc hại, nguy hiểm và có thể nghỉ hưu sớm hơn."
Đề văn có thật sự quá dài hay do học sinh quen lướt TikTok?,"Như Tuổi Trẻ Online thông tin, sáng 25-4, học sinh Trường THPT Marie Curie, quận 3, TP.HCM phản ánh đề văn kiểm tra cuối học kỳ II của khối 10 quá dài và quá khó.  ""Chúng em đọc đề thôi đã mất 30 phút. Trong đó văn bản phần đọc - hiểu dài 2 trang giấy A4, trích từ tác phẩm Mùa hoa cải bên sông của tác giả Nguyễn Quang Thiều.  Để trả lời được những câu hỏi của phần đọc - hiểu, phải đọc đi đọc lại văn bản nhiều lần, rất mất thời gian và không còn thời gian cho phần viết văn"", một số học sinh than thở. Nhìn đề văn mà ngợp Nhiều bạn đọc cũng có cảm xúc như vậy khi đọc đề văn trên. Độc giả Lan Vo viết: ""Quá ngợp khi nhìn đề, thương các con đã trải qua một buổi thi toát mồ hôi thiệt sự"". ""Nhìn đề văn mà tôi thấy khớp"", bạn đọc Trần Văn Tám chia sẻ. ""Tôi thử đọc xem sao, mà chưa kịp hiểu đã buồn ngủ quá rồi. Đúng là một đề văn buộc các em 16 tuổi phải đấu tranh tư tưởng đọc hết hoặc trả lời đại đi ngủ"", độc giả Jan bày tỏ. Bạn đọc Hoa ""cũng thấy quá dài, có đọc lướt thì cũng phải hiểu mới trả lời đúng để có điểm chứ!"". Bạn đọc Trần Quang Dinh lo lắng: ""Đề quá dài, sao học sinh có đủ thời gian để đọc và cảm thụ mà làm bài cho kịp giờ?"". ""Thời gian qua có rất nhiều đề thi văn độc, lạ và cả đánh đố học sinh với những nội dung trừu tượng, cao xa, đặc biệt đu trend mạng xã hội. Không biết các dạng đề này có đạt mục đích đánh giá học sinh hay là để các trường, các tổ văn... khoe trình độ và quảng bá cho trường nổi tiếng? Cần phải xem lại hiện tượng này"", bạn đọc Khai Phong có ý kiến thêm. Quen lướt TikTok nên đề dài văn là than thở? Tuy nhiên, khá đông bạn đọc có ý kiến ngược lại về đề văn này. ""Cho rằng văn bản dài, bị ngợp là do học sinh chỉ quen làm văn bản ngắn. Còn thực tế mức độ dài của văn bản trong đề này không quá sức đọc của học sinh và khung thời gian làm bài. Văn bản này đọc chậm cũng chỉ mất tối đa 15 phút chứ không đến nỗi 30 phút. Học sinh lớp 10 rồi mà đọc quá chậm thì cần xem lại kỹ năng đọc của mình"", độc giả Phạm Tuyết nói. Bạn đọc Minh Duy nhận xét: ""Đề văn tuy dài nhưng câu hỏi rõ ràng, không khó, học sinh đọc lướt vẫn có thể trả lời cho từng ý, đâu cần phải đọc kỹ"". ""Ngữ liệu tuy có dài nhưng với yêu cầu của thể loại, nếu lược bớt có thể gây khó hiểu cho người đọc"", bạn đọc Thảo nói thêm. Trong khi đó, tài khoản hung****@gmail.com có ý kiến: ""Đề nhiêu đây mà đọc hết 30 phút thì cần xem lại khả năng đọc của học sinh. Thi IELTS đề dài gấp mấy lần không biết có bạn nào lên tiếng không? Hay mai mốt ra đề thi ngắn thôi, kiểu status trên Facebook, TikTok cho gen Z dễ đọc và cảm nhận?"". Cùng góc nhìn, bạn đọc Hy bình luận: ""Học sinh giờ chỉ xem TikTok và tiếp cận thông tin ngắn mà không đọc sách thì thấy đề dài rồi than thở. Chứ đọc hai trang A4 quá đơn giản mà. Câu hỏi của đề cũng không có gì đánh đố"". Theo tài khoản Thầy giáo dạy văn: ""Đề thi này không khó, vì học sinh đã được rèn kỹ năng và được ôn tập dạng đề như này. Đề có tính phân hóa cao; phù hợp với khung đánh giá năng lực chung; phù hợp là một đề thi chính thức của một kỳ thi cấp trường. Có điều ngữ liệu đọc - hiểu hơi dài. Đối với học sinh yếu kỹ năng thì sẽ rất mất thời gian đọc. Vì thế, nên chọn ngữ liệu đọc - hiểu ngắn hơn để học sinh đỡ hoang mang và cũng đỡ rối cho những học sinh chưa vững kỹ năng đọc - hiểu"".",28/04/2024 16:15 GMT+7,https://tuoitre.vn/de-van-co-that-su-qua-dai-hay-do-hoc-sinh-quen-luot-tiktok-20240427223158071.htm,Chuyện đề văn kiểm tra cuối học kỳ tại một trường THPT tiếp tục gây tranh luận: đề văn thật sự quá dài hay do học sinh thiếu kỹ năng đọc bởi thói quen lướt TikTok?
Mạo danh người thân đăng tìm sinh viên mất tích lên mạng xã hội,"Đăng bài lên mạng xã hội nhờ sinh viên chia sẻ để tìm người thân Sáng nay 28-4, trang Sinh viên KTX ĐHQG TP.HCM trên Facebook đăng bài với nội dung viết khẩn thiết: ""Nguyễn Thành Đ. giờ em đang ở đâu, anh mong em liên lạc lại với anh. Nhờ mấy anh em sinh viên chia sẻ bài giùm anh để cho em Đ. thấy được bài viết này"". Kèm them bài viết ngắn này là ảnh một nam sinh viên khoa lưu trữ học - quản trị văn phòng Trường đại học Khoa học xã hội và Nhân văn (Đại học Quốc gia TP.HCM). Do đây là nhóm công khai của cộng đồng sinh viên ký túc xá Đại học Quốc gia TP.HCM với hơn 56.300 thành viên và rất nhiều người theo dõi nên ngay sau khi bài biết trên được đăng, rất nhiều người quan tâm. Trong khi đầu tháng 4-2024, một nam sinh viên nội trú ký túc xá Đại học Quốc gia TP.HCM mất tích đến nay chưa có manh mối, nên thông tin có thêm sinh viên ""mất tích"" khiến nhiều người lo lắng. Sinh viên thường qua nhà người thân ở, không phải mất tích Trao đổi với Tuổi Trẻ Online, ông Trần Nam - trưởng phòng công tác sinh viên Trường đại học Khoa học xã hội và Nhân văn (Đại học Quốc gia TP.HCM) - cho biết: ""Với thông tin tìm người trên mạng xã hội, qua tìm hiểu của chúng tôi người trong ảnh đúng là Nguyễn Thành Đ., sinh viên khoa lưu trữ học - quản trị văn phòng, nhưng bạn này đang tạm thời ngưng học, bảo lưu kết quả học tập. Không có chuyện sinh viên này mất tích"". Ông Tăng Hữu Thủy - giám đốc Trung tâm quản lý ký túc xá Đại học Quốc gia TP.HCM, cũng cho hay trung tâm này đã xác minh ngay khi nhận được thông tin trên. ""Sau hơn một giờ tìm kiếm, chúng tôi xác định sinh viên Đ. nội trú tại ký túc xá Đại học Quốc gia TP.HCM và đã liên lạc được với em ấy. Đ. hiện không ở ký túc xá mà đang ở nhà bà con tại TP.HCM. Sinh viên cũng khẳng định người đăng thông tin trên mạng xã hội sáng nay không phải là người thân của em ấy. Đồng thời Đ. cho biết ngày 2-5, em ấy sẽ trở về lại ký túc xá"", ông Thủy cho biết thêm. Trưa cùng ngày, phóng viên Tuổi Trẻ Online đã liên lạc được với Nguyễn Thành Đ., khi sinh viên này đang ở TP.HCM cùng người thân. Đ. tỏ ra rất bức xúc với việc ai đó đã mạo danh người thân của mình đăng tin ""tìm người"" lên mạng xã hội như vậy. Đ. còn cho biết thêm gần đây nam sinh viên này nhận được nhiều cuộc gọi số điện thoại lạ quấy rối và nay lại có thêm người mạo danh người thân đăng bài đăng kiểu này lên mạng xã hội nhưng không rõ danh tính là ai đăng. ""Em ở ký túc xá Đại học Quốc gia TP.HCM, gần đây em thường qua nhà người thân để ở cùng do mẹ vừa lên TP.HCM và đang định chuyển lên sống cùng em. Hiện tại em đang bảo lưu kết quả học tập ở Trường đại học Khoa học xã hội và Nhân văn cũng gần 1 năm rồi. Em không có vấn đề gì hết, người đăng bài đó không phải người thân của em"", Đ. khẳng định.",28/04/2024 14:30 GMT+7,https://tuoitre.vn/mao-danh-nguoi-than-dang-tim-sinh-vien-mat-tich-len-mang-xa-hoi-20240428130651227.htm,Nhiều phụ huynh và sinh viên ở ký túc xá Đại học Quốc gia TP.HCM lo lắng với thông tin lan truyền trên mạng xã hội việc người thân tìm một sinh viên Trường đại học Khoa học xã hội và Nhân văn TP.HCM mất tích.
