Title,Content,Date,Url,Summary
Chương trình Bản hùng ca vang mãi ở phố đi bộ Nguyễn Huệ mừng ngày thống nhất non sông,"Tối 29-4, chương trình nghệ thuật với chủ đề Bản hùng ca vang mãi diễn ra tại phố đi bộ Nguyễn Huệ, TP.HCM. Chương trình do Ban Tổ chức kỷ niệm các ngày lễ lớn TP.HCM tổ chức, Trung tâm Ca nhạc nhẹ TP.HCM thực hiện nhân kỷ niệm 49 năm Ngày Giải phóng miền Nam, thống nhất đất nước (30-4-1975 - 30-4-2024) và 138 năm Ngày Quốc tế lao động (1-5-1886 - 1-5-2024). Tham dự chương trình có ông Phan Văn Mãi - chủ tịch UBND TP.HCM, bà Trần Kim Yến - chủ tịch Ủy ban Mặt trận Tổ quốc Việt Nam TP.HCM, ông Huỳnh Thanh Nhân - phó chủ tịch HĐND TP.HCM, ông Trần Thế Thuận - giám đốc Sở Văn hóa và Thể thao TP.HCM, bà Trần Thị Diệu Thúy - chủ tịch Liên đoàn Lao động TP.HCM… cùng hàng ngàn người dân. Khoác áo mới những ca khúc quen thuộc Chương trình nghệ thuật Bản hùng ca vang mãi do đạo diễn Dương Thảo dàn dựng, nghệ sĩ Thanh Thúy chỉ đạo nghệ thuật. Bản hùng ca vang mãi được xây dựng thành ba chương: Thống nhất non sông, Xây dựng ngày mới và Việt Nam - Khát vọng hùng cường. Ở chương ""Thống nhất non sông"", những ca khúc được dàn dựng có giai điệu hào hùng, tái hiện tinh thần chiến đấu chống giặc ngoại xâm của quân và dân ta. Đó là những ca khúc: Hò kéo pháo, Hành quân xa, Chiến thắng Điện Biên, Tổ quốc ơi ta đã nghe, Con đường huyền thoại, Tiến về Sài Gòn, Thịnh vượng Việt Nam sáng ngời, Tình ca, Đất nước trọn niềm vui, Bài ca thống nhất… qua phần thể hiện của ca sĩ Quốc Đại, Hiền Thục, Võ Hạ Trâm, Cao Công Nghĩa, Phạm Thế Vĩ, Duyên Huyền, Võ Thành Tâm, Đăng Quân, Minh Sang, nhóm ca MTV Sài Gòn, nhóm 135, nhóm Mắt Ngọc… Các ca khúc quen thuộc được phối mới, tạo nên nhiều cung bậc cảm xúc cho khán giả. Điểm nhấn của chương đầu tiên là hoạt cảnh Ra đi nung nấu ngày trở về qua phần thể hiện của các nghệ sĩ Mỹ Uyên, Hữu Quốc, Hạnh Thúy, Phi Nga, Trường Khanh và Đào Vân Anh. Ngợi ca thành phố mang tên Bác Đến chương hai ""Xây dựng ngày mới"", khán giả được thưởng thức những sáng tác mới ngợi ca những giá trị truyền thống tốt đẹp, nét văn hóa đặc trưng của nhân dân TP.HCM, đó là nhân ái, nghĩa tình. Cùng đó là quá trình xây dựng và phát triển thành phố, không ngừng đổi mới đi lên, phát triển và hội nhập. Ca sĩ Hồ Trung Dũng, Trung Quang, nhóm 135, nhóm Mắt Ngọc lần lượt thể hiện những ca khúc sôi động, ngợi ca thành phố mang tên Bác: Thành phố của tôi, Âm thanh ngày mới, Sức sống mới trên thành phố Bác… Khán giả không khỏi bồi hồi, tự hào về thành phố mình đang sống khi những câu từ chạm đến cảm xúc trong mỗi người. Ở chương ba mang tên ""Việt Nam - Khát vọng hùng cường"", khán giả được thưởng thức ba ca khúc: Giai điệu tự hào (nhóm MTV thể hiện), Một vòng Việt Nam (Đan Trường hát) và ca khúc Khát vọng hùng cường (nhóm Lạc Việt, Trúc Lai, Quyên Quỳnh, Thùy Trinh, nhóm ca MTV Sài Gòn hòa giọng). Thông qua đây, ban tổ chức mong muốn lan tỏa thông điệp thế hệ trẻ Việt Nam không bao giờ quên những giá trị lịch sử hào hùng của dân tộc, cùng chung tay xây dựng thành phố ngày càng văn minh, hiện đại, nghĩa tình. Chương trình nghệ thuật Bản hùng ca vang mãi khép lại nhưng để lại nhiều cảm xúc về những giai điệu tự hào, nhất là khán giả trẻ.",29/04/2024 22:05 GMT+7,https://tuoitre.vn/chuong-trinh-ban-hung-ca-vang-mai-o-pho-di-bo-nguyen-hue-mung-ngay-thong-nhat-non-song-20240429203955012.htm,"Hơn 30 văn nghệ sĩ như Đan Trường, Hiền Thục, Quốc Đại, Võ Hạ Trâm, Hồ Trung Dũng... góp giọng trong chương trình nghệ thuật 'Bản hùng ca vang mãi', được tổ chức tại phố đi bộ Nguyễn Huệ dịp lễ 30-4, 1-5."
Đạo diễn Trần Anh Hùng là chủ tịch ban giám khảo Liên hoan phim quốc tế Thượng Hải,"Theo đánh giá của Ủy ban tổ chức Liên hoan phim quốc tế Thượng Hải 2024, đạo diễn Trần Anh Hùng nổi tiếng về khả năng dung hòa những nét đặc trưng của văn hóa phương Đông và phương Tây một cách tinh tế, sâu sắc và lãng mạn trong các tác phẩm của anh. Nhà làm phim Trần Anh Hùng gây tiếng vang từ sau khi bộ phim Mùi đu đủ xanh của anh giành giải Camera vàng tại Liên hoan phim quốc tế Cannes 1993. Hai năm sau đó, vị đạo diễn trẻ tài năng tiếp tục thành công vang dội với Xích lô - giành giải Sư tử vàng tại Liên hoan phim Venice năm 1995. Năm 2010, bộ phim Rừng Na Uy của Trần Anh Hùng cũng dự tranh nhiều giải thưởng và công chiếu khắp các châu lục, nhận được những lời tán dương nồng nhiệt từ giới phê bình và công chúng yêu thích môn nghệ thuật thứ bảy. Gần đây nhất, Trần Anh Hùng đã đoạt giải Đạo diễn xuất sắc nhất tại Liên hoan phim Cannes 2023 với bộ phim Muôn vị nhân gian.",29/04/2024 21:28 GMT+7,https://tuoitre.vn/dao-dien-tran-anh-hung-la-chu-tich-ban-giam-khao-lien-hoan-phim-quoc-te-thuong-hai-20240429205806359.htm,Ủy ban tổ chức Liên hoan phim quốc tế Thượng Hải 2024 ngày 29-4 thông báo đạo diễn Trần Anh Hùng sẽ là chủ tịch ban giám khảo của liên hoan phim uy tín hàng đầu châu Á này trong năm nay.
Phim về địa đạo Củ Chi tung trailer mừng ngày thống nhất đất nước,"Nhân dịp ngày giải phóng hoàn toàn miền Nam, thống nhất đất nước 30-4, ê kíp bộ phim Địa đạo: Mặt trời trong bóng tối tung teaser với cảnh chiến trường hoành tráng, có xe tăng, vũ khí và cảnh bom rơi, cháy nổ như thật. Địa đạo là dự án phim điện ảnh lấy bối cảnh địa đạo Củ Chi trong những tháng năm miền Nam rực lửa trước ngày giải phóng. Đây là dự án tâm huyết của đạo diễn Bùi Thạc Chuyên và ê kíp, đã ấp ủ ngót nghét 10 năm mới có cơ hội thực hiện. Địa đạo chân thực trên màn bạc Teaser mở ra với cảnh du kích miền Nam phục kích một toán quân địch giữa cánh rừng xác xơ, cháy rụi vì bom napalm. Bên trên mặt đất là những trận bắn phá ác liệt của xe tăng, máy bay địch thì bên dưới là những con đường địa đạo ngoằn ngoèo, liên tục rung lắc vì những xung kích trên bề mặt. Địa đạo Củ Chi được nhiều nhà nghiên cứu lịch sử quân sự trên thế giới đánh giá là những công trình quân sự khoa học và kỳ vĩ, đã giúp một lực lượng mỏng cả về số lượng lẫn khí tài có thể đứng vững trước đối thủ mạnh.  Khó có thể tưởng tượng được, những người lính, những dân quân kiên cường đã dùng những dụng cụ thô sơ để xây dựng một hệ thống phòng thủ dày đặc và phức tạp như vậy ở ngay dưới lòng đất. Ta cũng được nghe văng vẳng câu tuyên bố của quân đội Mỹ lúc bấy giờ: ""Củ Chi còn thì Sài Gòn mất"". Chỉ vì một câu nói này, hàng nghìn tấn bom, hóa chất các loại đã được rải xuống Củ Chi để hòng diệt cỏ tận gốc Quân Giải phóng miền Nam Việt Nam. Tại một căn phòng trong địa đạo, người xem sẽ lần đầu tiên gặp gỡ đội trưởng Bảy (do diễn viên Thái Hòa thủ vai) - chỉ huy tiểu đội du kích, nhân vật chính của phim. Hiện vai trò cũng như cốt truyện của Địa đạo: Mặt trời trong bóng tối vẫn chưa được hé lộ quá nhiều, đạo diễn Bùi Thạc Chuyên chia sẻ phim sẽ lấy mốc thời gian trận càn Cedar falls lịch sử của Mỹ (hay còn gọi là chiến dịch ""bóc vỏ trái đất""). Đây cũng là giai đoạn Mỹ và quân đội Việt Nam Cộng hòa đánh phá ác liệt nhất vào địa đạo Củ Chi, với bom đạn bắn phá ác liệt ngày đêm và những chiến thuật diệt du kích như chiến dịch ""lính chuột cống"" (Tunnel rat). Địa đạo dự kiến khởi chiếu ngày 30-4-2025 - nhân kỷ niệm 50 năm hòa bình thống nhất đất nước. Một số hình ảnh mới tiết lộ của Địa đạo:  ",29/04/2024 20:41 GMT+7,https://tuoitre.vn/phim-ve-dia-dao-cu-chi-tung-trailer-mung-ngay-thong-nhat-dat-nuoc-20240429201526363.htm,Câu chuyện về những người lính du kích kiên cường trong những năm tháng khói lửa được kể trong bộ phim mới nhất lấy tên Địa đạo: Mặt trời trong bóng tối.
"Tin tức giải trí 29-4: Nữ hoàng nước mắt kết thúc, lập kỷ lục rating","Nữ hoàng nước mắt kết thúc, lập kỷ lục rating Tối 29-4, bộ phim Nữ hoàng nước mắt đã đi đến hồi kết, tập cuối có thời lượng dài nhất trong 16 tập phim với 110 phút. Theo Nielsen Korea (công ty nghiên cứu tỉ suất người xem của Hàn Quốc) ghi nhận, tỉ suất người xem tập cuối trên toàn quốc của phim là 24,9%. Với thành tích này, Nữ hoàng nước mắt đã trở thành bộ phim có rating cao nhất trong lịch sử của đài tvN, vượt qua thành tích đầu bảng trong suốt 4 năm của siêu phẩm truyền hình Hạ cánh nơi anh. Kết thúc của Nữ hoàng nước mắt được nhận xét là trọn vẹn với tất cả các nhân vật, tình yêu của hai nhân vật chính là Baek Hyun Woo và Hong Hae In đi đến cái kết đẹp sau loạt những mâu thuẫn, khó khăn. Trong suốt thời gian phát sóng, Nữ hoàng nước mắt gây sốt trên toàn cầu, nằm trong top 10 phim hot trên Netflix và lọt vào top 3 phim truyền hình cáp có rating cao nhất Hàn Quốc. Sơn Tùng M-TP khác lạ với hình ảnh mới Tối 28-4, Sơn Tùng M-TP đăng tải hình ảnh mới lên trang cá nhân, anh xuất hiện với diện mạo khác lạ khi để râu, đeo kính râm. Bức hình được Sơn Tùng chụp ở sân bóng rổ, nam ca sĩ ăn mặc thoải mái, đội mũ và đeo kính râm. Đặc biệt, nhiều người bất ngờ khi thấy anh với hình ảnh chững chạc, để râu. Ngay sau khi đăng tải, bài viết nhanh chóng nhận được sự chú ý của người hâm mộ, nhiều người nhận xét Sơn Tùng chững chạc, ra dáng ""anh chú tuổi 30"": ""Giờ nhìn ảnh này tôi phải gọi anh là chú"", ""Lần đầu thấy sếp để râu, nhưng vẫn đẹp trai"", ""Chuẩn dáng vẻ của người 30 tuổi"".... Sau khi ra mắt MV Chúng ta của tương lai hồi tháng 3-2024, Sơn Tùng dành thời gian tận hưởng cuộc sống thường ngày, anh thường xuyên cập nhật hình ảnh trên các trang mạng xã hội. Jung Il Woo tung Vlog du lịch Việt Nam, mê phở đến mức tự nấu đãi bạn Ngày 28-4, ""hoàng tử cổ trang"" Jung Il Woo bắt đầu tung tập đầu tiên dài hơn 21 phút trong chuỗi Vlog du lịch Việt Nam lên kênh YouTube cá nhân. Đây là điều mà Jung Il Woo đã hứa ngay khi kết thúc chuyến ""phượt"" Việt Nam; nhưng không ai ngờ lại sớm thế. Thậm chí, trước khi tung Vlog chính thức, hơn một ngày trước đó, anh còn ra cả teaser ""nhá hàng"". Trước đây, Jung Il Woo từng đi du lịch nhiều nơi nhưng đây là lần đầu tiên, diễn viên ra Vlog sớm như vậy. Anh cũng là người tự tay biên tập Vlog. Trước đó, hành trình chuyến du lịch Việt Nam được nghệ sĩ cập nhật liên tục, khiến fan Việt nức lòng và fan quốc tế ghen tị. Các fan nói, chưa bao giờ thấy Jung Il Woo đăng tải ảnh đi chơi nhiều như thế. Trong tập Vlog đầu tiên về Hà Nội, diễn viên 9x liên tục khen đồ ăn Việt Nam. Tài tử chia sẻ, anh mê phở đến mức tự nấu phở ở nhà để chiêu đãi bạn bè trong tiệc tất niên. Anh cũng khen các món chả giò, bún chả, các món cuốn… vừa miệng. ""Các món ăn ở đây xuất sắc hơn những gì mà tôi từng mong đợi"", Jung Il Woo nói. Sau tập đầu tiên, Jung Il Woo sẽ ra tiếp Vlog được quay tại Sa Pa. Choi Ye Bin đóng Penthouse khoe ảnh TP.HCM Nữ diễn viên Choi Ye Bin nổi tiếng với vai Ha Eun Byul trong loạt phim Penthouse (Cuộc chiến thượng lưu) vừa khoe ảnh sau chuyến du lịch tại TP.HCM lên trang cá nhân. Theo những hình ảnh Ye Bin chia sẻ, cô đến tham quan nhiều địa điểm nổi tiếng của thành phố như Bảo tàng mỹ thuật, phố đi bộ Nguyễn Huệ... nữ diễn viên còn dạo phố và nghỉ mát tại quán cà phê, công viên. Nhiều fans Việt cũng bình luận dưới bài viết của Choi Ye Bin và chào mừng cô đến Việt Nam. Sau thành công vang dội sau khi đóng vai phản diện trong Penthouse, Ye Bin tái xuất với hình tượng mới thiện cảm hơn cùng dự án mới It's Beautiful Now. Hiện tại, nữ diễn viên đang dành thời gian nghỉ ngơi trước khi tiếp tục dự án phim mới. Justin Bieber đăng ảnh khóc lóc, fans lo lắng Chiều 28-4 (theo giờ Mỹ), Justin Bieber bất ngờ đăng ảnh selfie lên trang cá nhân, trong bức ảnh nam ca sĩ đang khóc. Tuy nhiên sau ít phút, nam ca sĩ đã vội xóa ảnh đi và không đưa ra bất kỳ lời giải thích nào cho bức ảnh bất thường trên khiến cho nhiều người hâm mộ lo lắng. Nhiều ý kiến, suy đoán được đưa ra, bên cạnh nghi ngờ nam ca sĩ đang gặp bất ổn về tâm lý, một số khác còn nhắc đến tin đồn chia tay giữa anh và vợ là người mẫu Hailey Bieber. Trong những năm gần đây, Justin Bieber liên tục phải đối diện với bệnh tật, sức khỏe và tinh thần xuống dốc khiến anh luôn trong tình trạng mệt mỏi, thẫn thờ. Khi mới kết hôn với Hailey, nam ca sĩ thường xuyên bị phóng viên bắt gặp đang bật khóc khi đang lái xe hay đi dạo ở công viên. Trong thời gian đó, anh được vợ ở bên cạnh động viên, an ủi. BlackPink là người nổi tiếng quyền lực nhất năm Forbes Korea vừa công bố danh sách Power Celebrity 40 - xếp hạng 40 người nổi tiếng quyền lực nhất Hàn Quốc năm 2024. Danh sách dựa trên 4 tiêu chí: thu nhập hằng năm, ảnh hưởng trên các phương tiện truyền thông, mạng xã hội và truyền hình do Forbers Korea tổng hợp. Theo Forbes Korea, danh sách người nổi tiếng quyền lực nhất Hàn Quốc đã có sự thay đổi đáng kể những năm gần đây, ngày càng trở nên đa dạng và thú vị. Năm nay, BlackPink là cái tên đứng đầu danh sách này, vị trí này từng thuộc về BTS vào năm ngoái. Xếp sau BlackPink là cầu thủ Son Heung Min, NewJeans, cầu thủ Kim Minjae, ca sĩ Lim Young Woong... Ngoài những gương mặt mới, bảng xếp hạng vẫn có sự góp mặt của những gương mặt quen thuộc như Yoo Jae Seok, Lee Seung Gi, IU, YoonA... Được biết, họ là những người nổi tiếng đã luôn có mặt trong danh sách hơn 10 năm qua, dù thứ hạng từng năm có sự khác biệt.",29/04/2024 16:21 GMT+7,https://tuoitre.vn/tin-tuc-giai-tri-29-4-nu-hoang-nuoc-mat-ket-thuc-lap-ky-luc-rating-202404291609366.htm,"Một số tin tức đáng chú ý: Sơn Tùng M-TP khác lạ với hình ảnh mới; Jung Il Woo tung Vlog du lịch Việt Nam; Justin Bieber đăng ảnh khóc lóc, fans lo lắng..."
"Công tử Bạc Liêu, Địa đạo gây phấn khích khi công bố poster dịp lễ 30-4","Hôm 28 và 29-4, hai bộ phim điện ảnh Công tử Bạc Liêu và Địa đạo lần lượt công bố các hình ảnh đầu tiên. Hai bộ phim nhận được một số phản hồi tích cực và mong đợi từ khán giả. Địa đạo công bố hình ảnh du kích của Thái Hòa Với Địa đạo, poster đầu tiên giới thiệu nhân vật chính - du kích Bảy Theo (diễn viên Thái Hòa thủ vai), anh đang cầm súng và ngồi quỳ trong lòng địa đạo Củ Chi.  Bộ phim ấn định lịch chiếu ngày 30-4-2025, được giới thiệu thực hiện nhằm kỷ niệm 50 hòa bình thống nhất đất nước, với dòng tựa: ""Mặt trời trong bóng tối"". ""Câu chuyện về những người lính kiên cường trong năm tháng khói lửa được kể lại chân thực với poster đầu tiên qua góc nhìn điện ảnh của đạo diễn Bùi Thạc Chuyên"", nhà sản xuất Địa đạo giới thiệu về dự án. Theo Bùi Thạc Chuyên, phim điện ảnh Địa đạo được anh ấp ủ kịch bản suốt 10 năm, trải qua nhiều khó khăn khi tìm kiếm kinh phí đến khi được đưa vào sản xuất vào tháng 3 vừa qua. Các diễn viên của phim như Thái Hòa, Quang Tuấn, Hồ Thu Anh, Anh Tú Wilson... đều giảm cân và phơi nắng để có vẻ ngoài gầy gò, đen nhẻm phù hợp với tạo hình du kích, chiến đấu trong lòng đất. Địa đạo là dự án tâm huyết của cả ê kíp, từ đạo diễn, nhà đầu tư, nhà sản xuất, dàn diễn viên. Tất cả đều mong làm nên một bộ phim vừa hay, vừa ý nghĩa cho dịp kỷ niệm 50 năm ngày giải phóng miền Nam thống nhất đất nước. Công tử Bạc Liêu gây tò mò Sau thời gian dài casting và đi vào sản xuất, hình ảnh đầu tiên của phim Công tử Bạc Liêu được hé lộ nhưng vẫn giữ kín danh tính diễn viên đóng vai chính - cậu Ba Huy (nguyên mẫu là Trần Trinh Huy ngoài đời). Nhìn phần dưới gương mặt nhân vật được hé lộ, có khán giả đoán diễn viên thủ vai là Song Luân. Trước đó, một số diễn viên nam khác như Dustin, Khương Lê, Võ Điền Gia Huy, Tôn Kinh Lâm, Bạch Công Khanh, Công Dương, Lãnh Thanh... được đánh giá có vẻ ngoài phù hợp và mời tham gia casting. Đạo diễn Lý Minh Thắng của Công tử Bạc Liêu từng bày tỏ về dự án:  ""Tôi vốn là người rất yêu thích những giá trị văn hóa, con người Việt Nam và luôn khao khát đưa chúng lên màn ảnh rộng.  ""Công tử Bạc Liêu"" là một nhân vật đặc biệt, đã để lại những di sản, dấu ấn mang tính biểu tượng cho tỉnh Bạc Liêu.  Khi giám đốc sản xuất Thủy Nguyễn ngỏ lời mời, chỉ cần nghe cụm từ ""công tử Bạc Liêu"", tôi rất phấn khích và nhận lời ngay mà không cần suy nghĩ gì cả"". Giám đốc sản xuất Thủy Nguyễn mong muốn thông qua bộ phim tạo nên bức tranh đẹp về phong cảnh, con người miền Tây và trân trọng những giá trị của quá khứ. ",29/04/2024 15:06 GMT+7,https://tuoitre.vn/cong-tu-bac-lieu-dia-dao-gay-phan-khich-khi-cong-bo-poster-dip-le-30-4-20240429144915349.htm,Công tử Bạc Liêu hé lộ hình ảnh công tử Ba Huy ăn chơi nổi tiếng Nam Kỳ. Còn Địa đạo tung ảnh trong lòng địa đạo Củ Chi với nhân vật Bảy Theo do Thái Hòa đóng.
"Rời Liên hoan phim quốc tế TP.HCM, ông Kore-eda vào ban giám khảo Cannes","Ban giám khảo Liên hoan phim Cannes năm nay do nữ đạo diễn Greta Gerwig làm chủ tịch. Theo Hollywood Reporter, hôm 29-4, ban tổ chức công bố thêm các thành viên khác. Kore-eda, nhiều diễn viên hạng A làm giám khảo Cannes Đó là bốn diễn viên hạng A gồm: Lily Gladstone, diễn viên chính của The Killers of the Flower Moon được đề cử giải Oscar; các ngôi sao người Pháp Eva Green và Omar Sy; nam diễn viên người Ý Pierfrancisco Favino. Cùng với họ là bộ ba đạo diễn quốc tế có nhiều thành tựu: đạo diễn Nhật Bản Kore-eda Hirokazu (đoạt Cành cọ vàng 2018 với Shoplifters), Nadine Labaki (phim Capernaum) - nhà làm phim người Lebanon, Juan Antonio Bayona (Society of the Snow) của Tây Ban Nha. Thành viên còn lại là nhà biên kịch kiêm nhiếp ảnh gia người Thổ Nhĩ Kỳ Ebru Ceylan, đồng biên kịch đoạt giải Cành cọ vàng 2014 với phim Winter Sleep. Ban giám khảo sẽ chọn ra các phim và nhân vật chiến thắng, trong đó có giải giành cho phim hay nhất là Cành cọ vàng. Trong số các phim tranh giải Cành cọ vàng năm nay có Megalopolis được mong đợi từ lâu của đạo diễn kỷ cựu Francis Ford Coppola;  phần tiếp theo của Poor Things của đạo diễn Yorgos Lanthimos Kindness; Bird của đạo diễn người Scotland Andrea Arnold;  The Shrouds của David Cronenberg; và bộ phim The Apprentice về cựu Tổng thống Mỹ Donald Trump của Ali Abbasi. Liên hoan phim Cannes 2024 khai mạc vào ngày 14-5 với The Second Act, một bộ phim hài siêu thực của đạo diễn người Pháp Quentin Dupieux (Smoking Causes Ho) với sự tham gia của Léa Seydoux và Vincent Lindon. Một số phim khác sẽ chiếu không tranh giải là Furiosa: A Mad Max Saga của George Miller, bộ phim tận thế có sự tham gia của diễn viên Anya Taylor-Joy; và phim sử thi phương Tây Horizons: An American Saga - Chapter 1 của Kevin Costner. Năm ngoái, bộ phim đoạt giải Cành cọ vàng là Anatomy of a Fall của Justine Triet về sau thành công ở Oscar, giành giải Oscar Kịch bản gốc hay nhất và được đề cử Nữ diễn viên chính xuất sắc nhất cho ngôi sao đột phá Sandra Hüller. Liên hoan phim Cannes lần thứ 77 diễn ra từ ngày 14 đến 25-5.",29/04/2024 15:40 GMT+7,https://tuoitre.vn/roi-lien-hoan-phim-quoc-te-tp-hcm-ong-kore-eda-vao-ban-giam-khao-cannes-20240429151856217.htm,"Liên hoan phim Cannes lần thứ 77 vừa công bố ban giám khảo gồm: Lily Gladstone (diễn viên được đề cử Oscar), bậc thầy điện ảnh Nhật Bản Hirokazu Kore-eda, Eva Green, Omar Sy..."
