Title,Content,Date,Url,Summary
"Bạo hành trẻ trong giờ ăn: Giáo viên bị áp lực vì phụ huynh muốn con ăn giỏi, tăng cân?","Người viết bài này cảm thấy như nghẹt thở khi xem clip chủ nhóm lớp mẫu giáo Tí Bo (phường Linh Đông, TP Thủ Đức, TP.HCM) đánh trẻ, ngồi đè lên bụng và cố nhét trái cây vào miệng trẻ. Trời ơi, đáng lẽ bữa ăn phải là những phút giây hạnh phúc và vui vẻ nhất của trẻ mà sao người lớn lại biến nó thành ra khổ sở, đau đớn như thế này! Quặn lòng Hồi cuối tháng 3-2024, clip ghi lại cảnh giáo viên Trường mầm non 4, quận 3 (TP.HCM) tát lên tục vào mặt bé khiến bé ngã dúi dụi trong giờ ăn trưa đã khiến dư luận phẫn nộ. Chưa hết, trong một clip khác, cũng cô giáo này đút cho học sinh ăn. Cô đút rất nhanh khiến trẻ bị ói. Ngay lập tức, cô đã đè đầu bé vào tô thức ăn rồi đút tiếp, bắt bé ăn tiếp. Thật là một sự tra tấn đến cùng cực. Viết đến đây, tôi đã lên Google tìm từ khóa ""bạo hành trẻ mầm non trong giờ ăn"" và nhận được 8.670.000 kết quả. Sự việc đã và đang xảy ra ở nhiều tỉnh thành trên cả nước. Đó là những vụ việc được camera ghi lại và phát tán ra ngoài. Còn bao nhiêu vụ bạo hành nữa chưa bị phát hiện và vẫn đang tồn tại trong các trường, nhóm, lớp mầm non. Còn bao nhiêu trẻ vẫn đang phải chịu đựng những bữa ăn chan đầy nước mắt? Còn nhớ năm 2018 chúng tôi đã từng phản ánh tình trạng này. Lúc ấy, nhiều nhà nghiên cứu đã cho rằng đa số những người bạo hành trẻ là những người ít học, thiếu hiểu biết, không có kỹ năng chăm sóc - giáo dục trẻ. Đó là bảo mẫu Quảng Thị Kim Hoa (Đồng Nai) hành hạ các cháu nhỏ trong bữa ăn một cách tàn nhẫn. Bà Hoa đã đút cơm cho các cháu với thước và cái lược nhựa, sẵn sàng ra tay khi trẻ không ăn. Đó là các bảo mẫu tại nhóm trẻ Phương Anh (TP Thủ Đức, TP.HCM). Mỗi lần cho học sinh ăn hoặc uống sữa, người trông trẻ ở đây đã lấy khăn bịt mũi, bóp cổ, túm đầu các cháu. Đó là các bảo mẫu ở nhóm trẻ thuộc phường 17, quận Gò Vấp (TP.HCM) tìm mọi cách để tống thức ăn vào miệng trẻ. Thế nhưng, sau nhiều năm, tình trạng bạo hành trẻ trong bữa ăn có vẻ như không thuyên giảm mà còn khủng khiếp hơn, tăng nặng hơn. Bởi những người bạo hành trẻ là những người có hiểu biết (theo quy định của Bộ Giáo dục và Đào tạo, chủ nhóm lớp mầm non phải có bằng tốt nghiệp THPT trở lên, có chứng chỉ bồi dưỡng nghiệp vụ quản lý, chăm sóc, nuôi dưỡng giáo dục trẻ em hoặc chứng chỉ bồi dưỡng cán bộ quản lý giáo dục. Còn giáo viên mầm non phải có bằng tốt nghiệp cao đẳng sư phạm mầm non trở lên). Trước đây, nhiều người cho rằng việc bạo hành trẻ chỉ xảy ra trong các nhóm, lớp mầm non tư thục. Thì nay giáo viên ở trường mầm non công lập cũng bạo hành trẻ. Mức độ bạo hành khủng khiếp khi mà trẻ vừa ói xong bắt ăn tiếp. Mà sự việc lại xảy ra tại một trường mầm non nằm ngay trung tâm TP được xem là hiện đại, văn minh nhất nhì cả nước. Mọi thứ dồn hết lên giáo viên Nói về một trong những nguyên nhân dẫn đến các vụ bạo hành trẻ trong bữa ăn, cô Thanh, giáo viên có thâm niên dạy lớp mẫu giáo 3 tuổi ở quận Phú Nhuận (TP.HCM), cho rằng có trách nhiệm của chính các phụ huynh. ""Tâm lý của các bậc làm cha làm mẹ ai cũng muốn con mình phát triển tốt. Nhưng một số người cho con đi học mầm non chỉ quan tâm duy nhất đến cân nặng của trẻ. Có phụ huynh mua sẵn cái cân ở nhà và tháng nào cũng cho con cân. Sau đó thì họ vào gặp tôi, than thở: ""Sao tháng này bé tăng cân ít quá"", ""Sao tháng này bé tăng có 3 lạng""... Tiếp theo là nhờ cô đút cho bé ăn, nhờ cô ép cháu ăn thêm... Tôi có giải thích rằng tuy bé tăng cân không nhiều nhưng chiều cao phát triển rất tốt. Bé nhanh nhẹn, hoạt bát, năng động... thì phụ huynh không hài lòng cho rằng cô không quan tâm đến con mình"", cô Thanh nói. Không những thế, hiệu trưởng một trường mầm non tư thục ở quận Tân Phú còn tâm sự: ""Nhiều phụ huynh khi gởi con học mầm non thường có tư tưởng là ở nhà không rèn được, cho con đi học để cô rèn. Tức là cái gì khó là nhờ giáo viên mầm non. Con ở nhà không ăn rau, họ nhờ cô tập cho cháu ăn rau. Con ở nhà thường xuyên ngậm khi ăn, họ nhờ cô rèn để cháu đừng ngậm nữa. Con ở nhà biếng ăn, khi đi học ra điều kiện cháu phải tăng cân đều... Tất cả những điều này gây áp lực rất lớn đến giáo viên mầm non, khiến các cô có cảm giác nếu học sinh không tăng cân là chưa hoàn thành nhiệm vụ với phụ huynh"". Đổi mới hình thức tổ chức bữa ăn cho trẻ Theo bà Lương Thị Hồng Điệp - trưởng Phòng giáo dục mầm non, Sở Giáo dục và Đào tạo TP.HCM, hầu hết các hành vi thiếu chuẩn mực với trẻ xảy ra trong giờ ăn xuất phát từ áp lực của người trông trẻ. Áp lực bé phải ăn hết suất, phải tăng cân đều... đè nặng lên giáo viên, nhân viên nuôi dưỡng trong các trường, nhóm, lớp mầm non. Áp lực này xuất phát từ chính quan niệm của cha mẹ trẻ, người chăm sóc trẻ: trẻ con phải mũm mĩm, phải tăng cân đều mỗi tháng... thì mới tốt. ""Dĩ nhiên, trẻ em cần được ăn uống đầy đủ để phát triển toàn diện về thể chất và tinh thần. Nuôi con khỏe mạnh và cho con nền tảng vững chắc để phát triển toàn diện là mong mỏi không chỉ các bậc cha mẹ, người thân của trẻ. Thế nhưng cần phải phát triển toàn diện trẻ như thế nào, là đúng, cần có sự phối hợp giữa gia đình và các cơ sở giáo dục mầm non. Giáo viên cần thực hiện tốt việc nuôi dưỡng, chăm sóc giáo dục trẻ"", bà Điệp nói. Bà Điệp cũng cho biết trong những năm qua Sở Giáo dục và Đào tạo TP.HCM đã triển khai và chỉ đạo các đơn vị đổi mới hình thức tổ chức bữa ăn cho trẻ. Mục tiêu của việc đổi mới là thay đổi nhận thức của cán bộ quản lý và giáo viên trong việc tổ chức cho trẻ ăn uống nhằm mang lại bữa ăn thân thiện, lành mạnh, an toàn, hợp vệ sinh, giảm cường độ lao động, đồng thời nâng cao kỹ năng tự phục vụ ở trẻ; giáo dục văn hóa ăn uống đáp ứng yêu cầu đổi mới của giáo dục mầm non. Theo đó, việc đổi mới hình thức tổ chức bữa ăn cho trẻ bao gồm các nội dung sau: thay đổi cách chế biến thức ăn phù hợp yêu cầu dinh dưỡng và nhu cầu ăn uống của cá nhân trẻ; thực đơn phong phú, thay đổi phù hợp theo mùa; tổ chức ""bữa ăn gia đình"", ăn theo nhóm, ăn tiệc buffer... Nhờ đó, trẻ có nhiều kỹ năng và hứng thú trong giờ ăn. Điểm mới là trẻ được tham gia trực tiếp trong quá trình tổ chức bữa ăn tự phục vụ: trẻ tự sắp xếp bàn ăn, trưng bày các món ăn, giới thiệu món ăn... ""Nếu các cơ sở giáo dục mầm non tổ chức giờ ăn theo hình thức đổi mới đúng tinh thần chỉ đạo của sở thì sẽ giảm áp lực cho giáo viên và sẽ không còn xảy ra hành vi vi phạm đối với trẻ trong giờ ăn. Sau nhiều năm triển khai, hiện trên địa bàn TP.HCM có nhiều trường đã và đang thực hiện rất tốt. Thời gian tới, sở sẽ tiếp tục tập huấn chuyên sâu về vấn đề này đồng thời sẽ có biện pháp thúc đẩy các đơn vị thực hiện đổi mới hình thức tổ chức bữa ăn cho trẻ để thực sự trẻ mỗi ngày đến trường là một ngày vui"", bà Điệp khẳng định. ",27/04/2024 06:26 GMT+7,https://tuoitre.vn/bao-hanh-tre-trong-gio-an-giao-vien-bi-ap-luc-vi-phu-huynh-muon-con-an-gioi-tang-can-20240426225345849.htm,"Từ trước tới nay, đa số vụ bạo hành trẻ đều xảy ra trong giờ ăn của trường, nhóm, lớp mầm non. Tại sao như vậy?"
Công bố đề thi tham khảo kỳ thi đánh giá của Bộ Công an năm 2024,"Ngày 26-4, Cục Đào tạo, Bộ Công an đã công bố đề thi tham khảo kỳ thi đánh giá của Bộ Công an năm 2024. Theo Cục Đào tạo, đề thi tham khảo có cấu trúc giống đề thi đánh giá chính thức, gồm hai phần trắc nghiệm và tự luận, làm trong 180 phút, tương tự năm ngoái. Đề tham khảo của hai mã bài thi CA1 và CA2 được công bố nhằm giúp thí sinh có căn cứ ôn tập, nếu đặt nguyện vọng vào các trường công an năm nay. Năm 2024, kỳ thi đánh giá của Bộ Công an sẽ diễn ra vào hai ngày 6 và 7-7. Thí sinh tham dự kỳ thi đánh giá của Bộ Công an sẽ chọn một trong hai mã bài thi là CA1 (trắc nghiệm và tự luận toán) hoặc CA2 (trắc nghiệm và tự luận ngữ văn). Về phương thức tuyển sinh, các trường công an tuyển theo ba phương thức: Phương thức 1: Tuyển thẳng theo quy chế tuyển sinh hiện hành của Bộ Giáo dục và Đào tạo và quy định của Bộ Công an. Phương thức 2: Xét tuyển thẳng kết hợp chứng chỉ ngoại ngữ quốc tế với kết quả học tập THPT. Phương thức 3: Kết hợp kết quả thi tốt nghiệp THPT năm 2024 với kết quả bài thi đánh giá của Bộ Công an. Công thức tính điểm xét tuyển vẫn áp dụng cách tính tổng điểm của ba môn thuộc tổ hợp xét tuyển (chiếm tỉ lệ 40%) và điểm bài thi đánh giá của Bộ Công an được quy về thang điểm 30 (chiếm tỉ lệ 60%). Năm 2024, các trường khối ngành Công an nhân dân tuyển 2.150 chỉ tiêu đào tạo đại học chính quy, tăng 150 chỉ tiêu so với năm 2023. Trong đó, Học viện Cảnh sát nhân dân dẫn đầu số lượng tuyển sinh với 530 chỉ tiêu ngành nghiệp vụ cảnh sát, Học viện An ninh nhân dân tuyển sinh 510 chỉ tiêu, Trường đại học Cảnh sát nhân dân tuyển sinh 420 chỉ tiêu... Học viện Quốc tế tuyển sinh số lượng thấp nhất với 50 chỉ tiêu ngành ngôn ngữ Anh và ngôn ngữ Trung Quốc. Năm ngoái, điểm chuẩn các trường công an dao động từ 14,01 đến 24,94 điểm. Xem đề thi tham khảo tại đây: Đề thi tham khảo mã CA1. Đề thi tham khảo mã CA2.",26/04/2024 20:01 GMT+7,https://tuoitre.vn/cong-bo-de-thi-tham-khao-ky-thi-danh-gia-cua-bo-cong-an-nam-2024-20240426192825634.htm,"Theo Cục Đào tạo, Bộ Công an, đề thi tham khảo có cấu trúc giống đề thi đánh giá chính thức, gồm hai phần trắc nghiệm và tự luận. Thí sinh làm bài trong 180 phút, tương tự năm ngoái."
"Ông Nguyễn Tiến Thanh làm chủ tịch HĐTV, tổng giám đốc Nhà xuất bản Giáo Dục","Bộ trưởng Bộ Giáo dục và Đào tạo Nguyễn Kim Sơn vừa ký quyết định số 1279/QĐ-BGDĐT về việc bổ nhiệm chủ tịch hội đồng thành viên đồng thời là tổng giám đốc Công ty trách nhiệm hữu hạn một thành viên Nhà xuất bản Giáo Dục Việt Nam. Quyết định nêu rõ tiếp nhận ông Nguyễn Tiến Thanh, tổng biên tập tạp chí Đời sống và Pháp luật thuộc Hội Luật gia Việt Nam, về công tác tại Công ty trách nhiệm hữu hạn một thành viên Nhà xuất bản Giáo Dục Việt Nam (gọi tắt Nhà xuất bản Giáo Dục Việt Nam) để bổ nhiệm giữ chức vụ chủ tịch hội đồng thành viên đồng thời là tổng giám đốc Nhà xuất bản Giáo Dục Việt Nam. Thời hạn ông Nguyễn Tiến Thanh giữ chức vụ 5 năm, kể từ ngày 15-5-2024.",26/04/2024 19:44 GMT+7,https://tuoitre.vn/ong-nguyen-tien-thanh-lam-chu-tich-hdtv-tong-giam-doc-nha-xuat-ban-giao-duc-20240426193931537.htm,Ông Nguyễn Tiến Thanh được bổ nhiệm giữ chức chủ tịch hội đồng thành viên đồng thời là tổng giám đốc Nhà xuất bản Giáo Dục Việt Nam.
18 'Trạng Nguyên nhỏ tuổi' được vinh danh tại Văn Miếu,"Ngày 26-4, báo Thiếu Niên Tiền Phong và Nhi Đồng phối hợp với các cơ quan, đơn vị tổ chức ngày hội chung kết toàn quốc Trạng Nguyên nhỏ tuổi lần thứ 22 - Viết chữ đẹp Nét chữ, nết người - Bảng vàng ghi danh lần thứ 4 năm học 2023 - 2024. Với 346 sĩ tử đến từ 18 tỉnh, thành và 161 trường học (128 trường tiểu học và 33 trường trung học cơ sở) trên cả nước, Ngày hội Trạng nguyên nhỏ tuổi, Bảng vàng ghi danh và Viết chữ đẹp Nét chữ - Nết người năm học 2023-2024 là Vòng chung kết có số lượng thí sinh đông nhất từ trước tới nay. Trong đó có 159 học sinh thi Trạng Nguyên nhỏ tuổi, 115 học sinh thi Viết chữ đẹp, 72 học sinh thi Bảng vàng ghi danh. Đây là những thí sinh xuất sắc đã vượt qua vòng thi sơ loại. Từ sáng sớm dù trời oi nóng nhưng các thí sinh đã tề tựu bước vào sân Thái Học, Văn Miếu - Quốc Tử Giám(Hà Nội) để tham gia lễ dâng hương và nghe phổ biến quy chế. Sau hồi trống khai thi, các thí sinh tiến hành thi. Thí sinh thi ""Trạng Nguyên nhỏ tuổi"" dự thi các môn: toán, tiếng Việt, tự nhiên - xã hội; thí sinh tham gia ngày hội ""Bảng vàng ghi danh"" thi môn toán, tổ hợp môn khoa học - xã hội; thí sinh dự thi Viết chữ đẹp ""Nét chữ - Nết người"" chép một bài thơ, văn theo đề của ban tổ chức. Phát biểu tại ngày hội, ông Trần Văn Đạt - vụ trưởng Vụ Giáo dục Chính trị và Công tác học sinh, sinh viên (Bộ Giáo dục và Đào tạo) - nhấn mạnh ngày hội Trạng nguyên nhỏ tuổi, Viết chữ đẹp ""nét chữ - nết người"" và Bảng vàng ghi danh là một sân chơi tri thức bổ ích và giàu ý nghĩa để các em mạnh dạn, khuyến khích tinh thần học tập và giáo dục truyền thống lịch sử yêu tổ quốc, yêu đồng bào. Ông Đạt mong muốn trong thời gian tới báo Thiếu Niên Tiền Phong Và Nhi Đồng tiếp tục phát huy và tổ chức tốt hơn nữa các chương trình này. Đồng thời có thể nghiên cứu, sáng kiến thêm những sân chơi mới, bổ ích nhằm khích lệ tinh thần học tập cho các em học sinh. Hội thi ""Trạng Nguyên nhỏ tuổi"" đã trao 12 giải trạng nguyên, 16 giải bảng nhãn, 24 giải thám hoa và 79 giải hoàng giáp. Cùng với đó, 4 giải nhất, 12 giải nhì, 16 giải ba và 83 giải khuyến khích đã được trao cho 102 học sinh tham gia hội thi Viết chữ đẹp. Hội thi Bảng vàng ghi danh đã trao 6 giải trạng nguyên, 12 giải bảng nhãn, 18 giải thám hoa và 38 giải hoàng giáp. 18 bạn nhỏ xuất sắc nhất đoạt giải trạng nguyên đã tái hiện lễ rước trạng nguyên theo nghi thức xưa tại sân Thái Học.",26/04/2024 17:19 GMT+7,https://tuoitre.vn/18-trang-nguyen-nho-tuoi-duoc-vinh-danh-tai-van-mieu-20240426163846179.htm,"18 bạn nhỏ xuất sắc nhất đoạt giải Trạng Nguyên đã tái hiện lễ rước Trạng Nguyên theo nghi thức xưa tại sân Thái Học, Văn Miếu - Quốc Tử Giám."
"Nắng nóng hơn 42 độ C, Bangladesh đóng cửa trường học","Bangladesh đang hứng chịu một trong những đợt nắng nóng tồi tệ nhất được ghi nhận, với nhiệt độ cao hơn mức trung bình từ 4-5 độ C.  Trong khi đó, rất ít trường học ở thủ đô Dhaka có điều hòa và việc cố gắng cho học sinh đến trường trong điều nắng nóng như vậy sẽ không hiệu quả.  Tuy nhiên, một số học sinh cho biết kể cả khi ở nhà cũng không thể làm bài tập do nhiệt độ quá cao và còn bị mất điện. Nhiệt độ trên cả nước Bangladesh đã lên tới hơn 42 độ C trong tuần này và dự kiến nắng nóng tiếp tục kéo dài đến cuối tuần. Chính quyền Bangladesh dự kiến sẽ mở cửa trở lại trường học từ ngày 28-4, trước khi nhiệt độ dự kiến sẽ giảm. Nghiên cứu khoa học cho thấy biến đổi khí hậu đang khiến các đợt nắng nóng kéo dài hơn, thường xuyên hơn và nghiêm trọng hơn.  Liên Hiệp Quốc (LHQ) trong tuần này cho biết châu Á là khu vực chịu ảnh hưởng nặng nề nhất từ các mối nguy hiểm về khí hậu và thời tiết trong năm 2023 với bão lũ là nguyên nhân chính gây thương vong và thiệt hại kinh tế.  Theo ghi nhận, hàng triệu người ở khu vực Nam Á và Đông Nam Á đã phải chịu nắng nóng bất thường trong tuần này. Bangladesh và 171 triệu dân của nước này hiện đang ở tuyến đầu của cuộc khủng hoảng khí hậu toàn cầu, thường xuyên bị các cơn bão và lũ lụt tàn phá với tần suất và mức độ nghiêm trọng ngày càng tăng.  Đợt thời tiết khắc nghiệt mới nhất đã gây ra đợt bùng phát bệnh tiêu chảy ở miền Nam đất nước, do nhiệt độ cao hơn và dẫn đến độ mặn của nguồn nước địa phương tăng lên.",26/04/2024 16:25 GMT+7,https://tuoitre.vn/nang-nong-hon-42-do-c-bangladesh-dong-cua-truong-hoc-20240426142224667.htm,Hàng triệu học sinh ở Bangladesh đã phải nghỉ học khi các trường học đóng cửa do nắng nóng quá mức.
Năm 2025 sẽ có kỳ thi riêng cho tuyển sinh quân đội,"Ngày 26-4, trao đổi tại buổi gặp gỡ báo chí giới thiệu công tác tuyển sinh quân đội năm 2024, Trung tướng Nguyễn Văn Oanh cho biết năm 2024, khối trường quân đội có 4 phương thức xét tuyển. Phương thức 1 là xét tuyển thẳng, ưu tiên xét tuyển, xét tuyển với học sinh giỏi bậc THPT (không quá 15% chỉ tiêu).  Phương thức 2 là xét tuyển dựa vào học bạ (không quá 10% chỉ tiêu, riêng Học viện Quân y, Học viện Kỹ thuật quân sự chưa sử dụng phương thức này).  Phương thức 3, xét tuyển từ kết quả thi đánh giá năng lực do các trường đại học trong nước tổ chức (không quá 20% chỉ tiêu). Phương thức 4 là xét tuyển dựa vào kết quả kỳ thi tốt nghiệp THPT. Tổ chức kỳ thi đánh giá của quân đội Trung tướng Nguyễn Văn Oanh cho biết từ năm 2025, Bộ Quốc phòng tổ chức kỳ thi đánh giá riêng để sử dụng kết quả tuyển sinh cho các trường quân đội.  Cục Nhà trường (Bộ Quốc phòng) sẽ phối hợp Đại học Quốc gia Hà Nội để tổ chức kỳ thi riêng này theo phương thức tương tự như kỳ thi đánh giá năng lực mà Đại học Quốc gia Hà Nội đang làm. Bài thi đánh giá năng lực để tuyển sinh vào các trường quân đội sẽ gồm nội dung toán, ngữ văn, khoa học xã hội, khoa học tự nhiên... Thí sinh làm bài thi trên máy. Trung tướng Nguyễn Văn Oanh cho biết dự kiến sẽ dành 30% chỉ tiêu năm 2025 để xét tuyển bằng kết quả của kỳ thi đánh giá năng lực riêng của khối quân đội. Tỉ lệ này có thể sẽ điều chỉnh căn cứ vào thực tiễn tuyển sinh.  Cùng với phương thức này, khối trường quân đội vẫn sử dụng các phương thức xét tuyển như đã thực hiện năm 2024. Nguồn tuyển sinh quân đội giảm do nhiều học sinh phổ thông mắc tật khúc xạ Trao đổi tại buổi gặp báo chí, Trung tướng Nguyễn Văn Oanh cho biết tỉ lệ thí sinh dự tuyển vào trường quân đội trong ba năm gần đây giảm. Có nhiều nguyên nhân, trong đó có một nguyên nhân rất đáng chú ý là số học sinh phổ thông mắc tật khúc xạ gia tăng trong các năm gần đây. Trong khi đó, hầu hết các trường quân đội có quy định không tuyển thí sinh mắc tật khúc xạ. Chỉ có 3 trong số 17 học viện, trường đại học của quân đội tuyển thí sinh có tật khúc xạ mức độ nhẹ. Quy định này khiến nhiều thí sinh có năng lực, sức khỏe, nhưng bị các tật khúc xạ vẫn không đủ điều kiện sơ tuyển để vào học các trường quân đội. Trung tướng Nguyễn Văn Oanh cho biết từ năm 2024, tuyển sinh quân đội sẽ đa dạng hơn phương thức xét tuyển. Bên cạnh đó, sẽ tăng cường công tác tuyên truyền, hướng nghiệp đến từng trường THPT trên cả nước để đảm bảo đủ nguồn tuyển, đảm bảo chất lượng tuyển sinh. Trung tướng Nguyễn Văn Oanh cũng nhấn mạnh về việc phối hợp với báo Tuổi Trẻ trong việc tham gia tổ chức các chương trình, ngày hội tư vấn tuyển sinh - hướng nghiệp thường niên như một phương thức hiệu quả thúc đẩy việc tuyên truyền trong công tác tuyển sinh của các trường quân đội.",26/04/2024 16:14 GMT+7,https://tuoitre.vn/nam-2025-se-co-ky-thi-rieng-cho-tuyen-sinh-quan-doi-20240426133230023.htm,"Trung tướng, TS Nguyễn Văn Oanh - cục trưởng Cục Nhà trường (Bộ Quốc phòng) - cho biết từ năm 2025 sẽ có kỳ thi đánh giá riêng để sử dụng kết quả tuyển sinh quân đội."
Lạc Hồng có thêm sáu chương trình đào tạo đạt chuẩn kiểm định chất lượng quốc tế,"Ngày 26-4, Trường đại học Lạc Hồng (Đồng Nai) đã tổ chức lễ trao chứng nhận kiểm định chất lượng giáo dục của Bộ Giáo dục và Đào tạo, Hội đồng Kiểm định kỹ thuật và Công nghệ Mỹ (ABET) và Mạng lưới các trường đại học Đông Nam Á (AUN). Theo đó, Trường đại học Lạc Hồng đón nhận chứng nhận đạt chuẩn kiểm định chất lượng cơ sở giáo dục chu kỳ 2 theo Bộ tiêu chuẩn kiểm định chất lượng đại học của bộ trưởng Bộ Giáo dục và Đào tạo. Bên cạnh đó, bốn ngành Nhật Bản học, tài chính ngân hàng, công nghệ kỹ thuật công trình xây dựng, công nghệ kỹ thuật điều khiển và tự động hóa đạt chuẩn đánh giá chất lượng chương trình đào tạo theo AUN-QA. Trước đó, Lạc Hồng cũng có sáu chương trình đào tạo khác đạt chứng nhận này. Ngoài ra, hai ngành công nghệ thông tin và công nghệ kỹ thuật điện - điện tử đạt chuẩn kiểm định chất lượng chương trình đào tạo theo ABET. Bà Đỗ Thị Lan Đài, chủ tịch hội đồng Trường đại học Lạc Hồng, cho biết việc đạt chứng chỉ kiểm định quốc tế không chỉ công nhận chất lượng giáo dục của trường mà còn tạo cơ hội cho người học mở rộng hiểu biết, hội nhập môi trường học tập quốc tế. Tại buổi lễ, bà Nguyễn Thu Thủy, vụ trưởng Vụ Giáo dục đại học - Bộ Giáo dục và Đào tạo, cũng đã gửi lời chúc mừng thành tích đáng tự hào của tập thể sư phạm Trường đại học Lạc Hồng. Bà Thủy mong muốn nhà trường tiếp tục phát huy và lan tỏa văn hóa chất lượng đến tất cả mọi hoạt động của trường, không ngừng cải tiến chất lượng đối với các chương trình đào tạo đã đạt chuẩn.",26/04/2024 15:49 GMT+7,https://tuoitre.vn/lac-hong-co-them-sau-chuong-trinh-dao-tao-dat-chuan-kiem-dinh-chat-luong-quoc-te-20240426154424557.htm,Trường đại học Lạc Hồng vừa có thêm sáu chương trình đào tạo đạt chuẩn kiểm định chất lượng AUN-QA và ABET.
