Title,Content,Date,Url,Summary
Biểu tình phản chiến ở Mỹ lan sang các trường đại học ở Úc và châu Âu,"Đài Al Jazeera ghi nhận ít nhất 900 sinh viên và giảng viên tham gia các cuộc biểu tình ủng hộ người Palestine và kêu gọi quân đội Israel chấm dứt chiến sự ở Dải Gaza đã bị bắt giữ ở Mỹ trong vòng 10 ngày qua, tính đến tối 29-4. Tuy nhiên làn sóng biểu tình dường như vẫn chưa hạ nhiệt. Mặt khác các cuộc biểu tình phản chiến dần trở nên bạo lực hơn khi các cơ quan thực thi pháp luật Mỹ cố gắng giải tán đám đông biểu tình trong khuôn viên một số trường đại học. Các cuộc biểu tình quy mô lớn lan rộng khắp 50 trường đại học ở Mỹ, trong đó có cả những đại học lớn và danh tiếng như Đại học Yale, Đại học Bách khoa Virginia, Đại học Texas ở thành phố Austin (thuộc bang Texas) và Đại học California ở thành phố Berkeley (thuộc tiểu bang California). Bất chấp mọi nỗ lực của giới chức địa phương và cảnh sát, biểu tình phản chiến đã lan sang các trường đại học ở nước ngoài. Điển hình như Đại học Melbourne, Đại học Sydney (Úc), Đại học McGill, Đại học Concordia (Canada), Viện nghiên cứu chính trị Paris, Đại học Sorbonne (Pháp), Đại học Sapienza (Ý), Đại học Leeds, Đại học College London và Đại học Warwick (Anh). Hiện một số sinh viên đã bị đình chỉ học, chịu hình phạt quản chế và một số khác bị buộc thôi học. Hãng tin Reuters đưa tin hôm 29-4, hai đại học thuộc nhóm Ivy League (nhóm gồm tám đại học danh tiếng nhất tại Mỹ) là Đại học Colombia và Cornell tuyên bố đình chỉ những sinh viên từ chối ngừng biểu tình phản chiến. Hiệu trưởng trường Columbia, bà Nemat Minouche Shafik, cho biết trong một tuyên bố rằng sau nhiều ngày đàm phán với các sinh viên và các nhà lãnh đạo học thuật, cả hai bên không đạt được kết quả như mong đợi và họ không thể thuyết phục người biểu tình dỡ lều trại. “Chúng tôi đã bắt đầu đình chỉ các sinh viên tham gia biểu tình như một phần trong nỗ lực tiếp theo nhằm đảm bảo tình hình an ninh trong khuôn viên trường đại học của chúng tôi”, phát ngôn viên của trường Columbia Ben Chang nói trong cuộc họp báo ngắn hôm 29-4. “Những khu lều trại đã tạo ra một môi trường không mấy thân thiện với nhiều sinh viên và giảng viên người gốc Do Thái của chúng tôi. Đồng thời, việc biểu tình cũng gây ồn ào, quấy nhiễu đến công tác giảng dạy, cản trở quá trình học tập và đặc biệt là ảnh hưởng đến việc chuẩn bị cho kỳ thi cuối học kỳ sắp tới”, người phát ngôn Ben nói thêm. Tương tự Đại học Colombia, một ngôi trường anh em khác trong nhóm Ivy League là Đại học Cornell cũng tuyên bố đã áp dụng hình phạt đình chỉ học đối với các sinh viên từ chối nhổ trại dừng biểu tình. “Các cá nhân đã nhận được yêu cầu ngừng biểu tình phản chiến và nhận được nhiều cơ hội để dừng hành động đó lại, bao gồm cả thời gian năm giờ đồng hồ thương thảo để suy nghĩ về quyết định ngừng biểu tình. Cuối cùng, họ vẫn quyết định ngồi yên tại chỗ. Sau đó họ đã được nhắc nhở nhiều lần và đến chiều tối, nhóm biểu tình được thông báo nếu không dỡ bỏ lều trại sẽ phải chịu các biện pháp kỷ luật của nhà trường”, ông Martha E.Pollack, hiệu trưởng trường Cornell nói với đài CNN.",30/04/2024 15:09 GMT+7,https://tuoitre.vn/bieu-tinh-phan-chien-o-my-lan-sang-cac-truong-dai-hoc-o-uc-va-chau-au-20240430145340084.htm,"Các cuộc biểu tình kêu gọi Israel chấm dứt chiến sự ở Dải Gaza lan rộng khắp các trường đại học không chỉ ở Mỹ mà còn ở Canada, Anh, Pháp, Ý và Úc. Hai đại học thuộc nhóm Ivy League bắt đầu đình chỉ sinh viên từ chối ngừng biểu tình."
Đề văn gây ngộp vì quá dài: Trách nhiệm của ai?,"Đề kiểm tra môn ngữ văn cuối học kỳ 2 của khối 10 Trường THPT Marie Curie (quận 3, TP.HCM) tiếp tục là chủ đề nóng trên các diễn đàn. Các tranh luận về độ dài và độ khó của đề thi dường như chưa hồi kết. 90 phút làm bài, đề dài ba trang A4 Theo ma trận đề thi, 6 câu hỏi trong phần “Đọc - hiểu (5 điểm)” đã đảm bảo được các mức độ kiểm tra từ nhận biết, thông hiểu đến vận dụng và vận dụng cao về đặc trưng thể loại truyện ngắn. Đề thi bám sát văn bản, phù hợp với khung đánh giá năng lực và yêu cầu tính phân hóa của đề. Ngoại trừ câu 6 (khái quát tư tưởng tác phẩm), các câu hỏi từ 1 đến 5 (hỏi về: ngôi kể, điểm nhìn, lời kể, tìm chi tiết thể hiện tính cách nhân vật, lỗi dùng từ Hán Việt), học sinh đều có thể trả lời tương đối tốt ngay cả khi không đọc hết toàn bộ văn bản ngữ liệu. Đối với câu 6, để làm tốt, học sinh chỉ cần nắm kỹ và thực hiện thao tác tìm các từ khóa, câu chủ đề. Cũng cần đặt trong bối cảnh chương trình học: ở học kỳ này, học sinh được học và thực hành đọc hiểu thể loại truyện ngắn. Và hình thức các câu hỏi ngắn trong phần đọc hiểu đã quen thuộc với học sinh từ bậc THCS. Ở phần “Viết (5 điểm)”, yêu cầu viết văn nghị luận cũng là dạng đề và nội dung kiến thức mà học sinh đã được học. Như vậy, nhận định đề văn khó (nếu không tính đến yếu tố thời gian) là có phần chưa thuyết phục. Vấn đề ở đây chỉ còn là: với 90 phút làm bài, liệu đề thi này có dài hay không? Độ dài của ngữ liệu ở phần “Đọc - hiểu” đã châm ngòi cho cuộc tranh luận không chỉ của học sinh, giáo viên mà còn của cả dư luận xã hội.  Chúng ta thử lý giải vì sao người ra đề lại chọn ngữ liệu này? Dù yêu cầu đề thi phải sử dụng ngữ liệu ngoài sách giáo khoa đã được thực hiện nhiều năm nay, nhưng chương trình giáo dục phổ thông 2018 của khối 10 mới chỉ áp dụng được 2 năm nên sự lúng túng trong khâu kiểm tra, đánh giá học sinh là khó tránh khỏi.  Dạng đề về thể loại truyện ngắn cũng là một tình huống gây trở ngại. Tâm lý người ra đề thường lo lắng nếu chỉ dùng ngữ liệu là trích đoạn, sẽ khiến học sinh khó hiểu hoặc không hiểu đầy đủ trọn vẹn văn bản. Nên người ra đề thậm chí còn cung cấp luôn cả thông tin tác giả của văn bản dùng làm ngữ liệu. Đọc lướt hay đọc hiểu? Và kết quả, chúng ta có một đề văn dài ba trang A4, khiến học sinh cảm thấy “ngộp” khi vừa nhận đề. Đây là tâm lý bình thường, vì lúc đó học sinh đang trong phòng thi, áp lực thi cử.  Thế nên, một số ý kiến cho rằng học sinh đã được học kỹ năng “đọc lướt” nên sẽ không gặp tâm lý hoang mang là chưa thuyết phục. Vì rõ ràng, đề yêu cầu kỹ năng “đọc hiểu”, chứ không phải “đọc lướt”. Quan điểm cho rằng độ dài văn bản của đề thi môn ngữ văn nói trên “chưa là gì” so với các văn bản xuất hiện trong các đề thi tiếng Anh, và từ đó kết luận học sinh đọc tiếng Việt đang ngày càng kém đi cũng là lối so sánh khập khiễng.  Vì một bên là học tiếng (ngôn ngữ), một bên là học ngữ văn (bao gồm cả cảm thụ văn học). Mức độ đọc hiểu, phân tích văn bản là khác nhau.  Đấy là chưa kể đề thi tiếng Anh phần lớn là dạng trắc nghiệm, học sinh chỉ cần suy luận logic để tìm ra đáp án đúng nhất trong 4 phương án mà đề đưa sẵn. Còn đề thi ngữ văn là dạng đề tự luận bao gồm cả bốn mức độ nhận biết, thông hiểu, vận dụng và vận dụng cao. Công bằng mà nói, ngữ liệu quá dài đã khiến học sinh phần nào gặp khó khăn trong quá trình làm bài. Đây là bài học kinh nghiệm chuyên môn cần được ghi nhận, để cùng thảo luận và có những giải pháp khả dĩ về sau. Việc lựa chọn ngữ liệu cho đề thi ngữ văn chưa bao giờ là dễ dàng, vì phải đảm bảo đồng thời nhiều yêu cầu khắt khe theo quy định của các cấp chuyên môn từ tổ, trường đến sở.  Vậy nên, các thao tác phản biện đề có được thực hiện không? Trách nhiệm của tổ trưởng, của ban giám hiệu, của chuyên viên mạng lưới bộ môn đến đâu?  Và quan trọng hơn hết là định hướng và hướng dẫn ra đề của cán bộ phụ trách chuyên môn của Sở Giáo dục và Đào tạo cụ thể ra sao?  Chúng ta không thể đẩy hết trách nhiệm lên vai người ra đề.    ",30/04/2024 15:06 GMT+7,https://tuoitre.vn/de-van-gay-ngop-vi-qua-dai-trach-nhiem-cua-ai-20240430113523972.htm,Đề văn dài ba trang A4 khiến học sinh cảm thấy ngộp là chuyện bình thường và độ dài của đề văn này chưa là gì so với các văn bản xuất hiện trong các đề thi tiếng Anh?
Tỉnh ở Canada cấm điện thoại di động trong trường học,"Chính quyền tỉnh bang Ontario, Canada vừa thông báo việc áp dụng triệt để lệnh cấm sử dụng điện thoại di động và thuốc lá điện tử tại các trường học công lập nhằm giảm bớt tình trạng mất tập trung và cải thiện sức khỏe cho học sinh. Vi phạm lệnh cấm điện thoại di động, học sinh có thể bị đình chỉ học Lệnh cấm mới được soạn thảo dựa trên những quy định cấm sử dụng điện thoại di động trong lớp học từ năm 2019 nhưng chưa được các Hội đồng trường học (tương đương với các sở giáo dục) thực hiện một cách nhất quán. Lệnh cấm mới này sẽ cho phép lãnh đạo nhà trường có quyền thông báo cho phụ huynh, tịch thu các thiết bị và thậm chí được đình chỉ học tập đối với những học sinh không nghiêm túc chấp hành. Theo Bộ trưởng Giáo dục Canada Ontario Stephen Lecce, đây sẽ là chính sách cứng rắn nhất từ trước tới nay tại Canada nhằm hạn chế việc sử dụng điện thoại di động và thuốc lá điện tử đối với học sinh trong thời gian ở trường. Điều này sẽ giúp học sinh tránh mất tập trung, đồng thời đảm bảo sức khỏe cho các em khi tới trường học. Các Hội đồng trường học của Ontario sẽ được yêu cầu lên kế hoạch triển khai chính sách mới và lệnh cấm dự kiến sẽ có hiệu lực bắt đầu từ năm học mới. Theo lệnh cấm này, học sinh từ lớp 6 trở xuống phải cất điện thoại di động, tắt nguồn hoặc đặt ở chế độ im lặng trong suốt thời gian học tập trừ phi được giáo viên cho phép. Học sinh từ lớp 7 đến lớp 12 sẽ chỉ được sử dụng điện thoại giữa giờ học hoặc trong giờ ăn trưa và bị cấm sử dụng trong thời gian giáo viên lên lớp. Những học sinh không tuân thủ sẽ bị đưa đến phòng hiệu trưởng và có thể bị đình chỉ học. Các Hội đồng trường học cũng sẽ được yêu cầu hạn chế quyền truy cập tất cả các nền tảng truyền thông xã hội qua mạng không dây của trường và trên các thiết bị của trường. Ontario sẽ là địa phương đầu tiên ở Canada hạn chế quyền truy cập các nền tảng truyền thông xã hội trên các mạng Internet của trường học. Các giáo viên sẽ được tập huấn để triển khai thực hiện các quy định mới bởi giờ đây họ sẽ được yêu cầu viết nhận xét về mức độ mất tập trung của học sinh trên lớp học trong báo cáo kết quả học tập cuối học kỳ của học sinh. Chi 30 triệu đô Canada lắp thiết bị phát hiện thuốc lá điện tử Việc cấm thuốc lá điện tử trong trường học cũng được thực hiện triệt để cùng với các sản phẩm khác như cần sa, nicotine các loại và thuốc lá. Nếu học sinh bị bắt gặp hút thuốc lá điện tử trong trường, học sinh đó sẽ phải giao nộp và nhà trường sẽ thông báo cho phụ huynh biết sự việc này. Chính quyền Ontario dự kiến sẽ cấp 30 triệu CAD trong ngân sách tỉnh bang năm 2024 để lắp đặt các thiết bị phát hiện thuốc lá điện tử và một số thiết bị an ninh khác tại các trường công lập trên toàn tỉnh bang. Trước đó để hỗ trợ việc thực hiện quy định mới, chính quyền Ontario cũng đã công bố gói tài trợ 17,5 triệu CAD để tăng cường hỗ trợ sức khỏe tinh thần và kết nối học sinh cũng như gia đình với các dịch vụ chăm sóc sức khỏe tâm thần. Tiến sĩ Kieran Moore, quan chức ngành y tế Ontario, nhận định việc loại bỏ các sản phẩm thuốc lá điện tử ở trường học sẽ giúp bảo vệ học sinh khỏi những mối nguy hiểm. Ontario đang chứng kiến ngày càng nhiều thanh thiếu niên từ lớp 7 đến lớp 12 sử dụng các sản phẩm thuốc lá điện tử có chứa nhiều chất độc hại.",30/04/2024 12:51 GMT+7,https://tuoitre.vn/tinh-o-canada-cam-dien-thoai-di-dong-trong-truong-hoc-20240430112805034.htm,"Lệnh cấm điện thoại di động, thuốc lá điện tử trong trường học được Ontario áp dụng từ năm học tới. Học sinh vi phạm có thể bị đình chỉ học."
"Đăng ký thi tốt nghiệp THPT 2024, thí sinh tự do lưu ý gì?","Tất cả học sinh lớp 12 năm học 2023 - 2024 phải đăng ký dự thi tốt nghiệp THPT theo hình thức trực tuyến trên hệ thống quản lý thi (địa chỉ http://thisinh.thitotnghiepthpt.edu.vn) bằng tài khoản đã được nhà trường cấp. Riêng thí sinh tự do sẽ đăng ký dự thi trực tiếp, không phải trực tuyến như học sinh đang học lớp 12; địa điểm đăng ký dự thi do Sở Giáo dục và Đào tạo quy định. Bộ Giáo dục và Đào tạo lưu ý thí sinh tự do có học bạ theo chương trình THPT nào phải đăng ký dự thi theo quy định dành cho chương trình đó. Trường hợp thí sinh bị mất bản chính học bạ THPT có nguyện vọng được dự thi năm 2024 phải có xác nhận bản sao học bạ được cấp hoặc bản sao kết quả học tập THPT, hoặc được Sở Giáo dục và Đào tạo xác nhận (trên cơ sở đối chiếu với hồ sơ lưu của trường phổ thông nơi học lớp 12 hoặc căn cứ vào hồ sơ dự thi của các kỳ thi trước). Tùy theo mục đích dự thi và việc lựa chọn tổ hợp môn xét tuyển đại học, cao đẳng, thí sinh tự do có thể chọn cả bài thi hoặc chỉ chọn một số môn thành phần cho phù hợp. Sau khi nộp phiếu đăng ký dự thi, thí sinh tự do sẽ được đơn vị đăng ký dự thi cấp tài khoản và mật khẩu để đăng nhập vào hệ thống quản lý thi tại địa chỉ http://thisinh.thitotnghiepthpt.edu.vn. Thông tin chi tiết, thí sinh có thể xem thêm tại đây.",30/04/2024 11:26 GMT+7,https://tuoitre.vn/dang-ky-thi-tot-nghiep-thpt-2024-thi-sinh-tu-do-luu-y-gi-20240430101358885.htm,"Theo quy định của Bộ Giáo dục và Đào tạo, từ ngày 2-5 đến 17h ngày 10-5, các thí sinh sẽ chính thức đăng ký dự thi tốt nghiệp THPT năm 2024."
Đại học Quốc gia TP.HCM ưu tiên xét tuyển 149 trường THPT năm 2024,"Năm 2024, các trường thành viên Đại học Quốc gia TP.HCM đồng thời sử dụng nhiều phương thức tuyển sinh, trong đó có ưu tiên theo quy định riêng của đại học này chiếm tối đa 20% tổng chỉ tiêu. Ưu tiên xét tuyển 83 trường THPT chuyên, năng khiếu và 66 trường THPT Sáng 30-4, trao đổi với Tuổi Trẻ Online, TS Dương Tôn Thái Dương - phó trưởng ban đào tạo Đại học Quốc gia TP.HCM - cho biết giám đốc Đại học Quốc gia TP.HCM đã chốt danh sách 149 trường THPT thuộc diện ưu tiên xét tuyển năm 2024. ""Danh sách 149 trường THPT có học sinh được ưu tiên xét tuyển vào Đại học Quốc gia TP.HCM năm nay được giữ ổn định như năm 2023. Danh sách này gồm 83 trường THPT chuyên, năng khiếu (8 trường trực thuộc đại học và 15 trường trực thuộc tỉnh/thành phố) và 66 trường THPT khác được lựa chọn theo các tiêu chí kết hợp tiêu chí của Đại học Quốc gia TP.HCM"", ông Dương cho biết thêm. Các tiêu chí lựa chọn cụ thể gồm: phân bổ số lượng trường theo hướng ưu tiên khu vực tuyển sinh hoặc tỉnh/thành có số lượng thí sinh đăng ký, trúng tuyển nhiều vào Đại học Quốc gia TP.HCM giai đoạn 2018-2020; Trường THPT có số lượng thí sinh trúng tuyển, nhập học nhiều vào Đại học Quốc gia TP.HCM; trường THPT có số lượng cựu học sinh đạt kết quả học tập cao khi học đại học tại Đại học Quốc gia TP.HCM. Danh sách 149 trường THPT thuộc diện ưu tiên xét tuyển theo quy định của Đại học Quốc gia TP.HCM tại đây. Đăng ưu tiên xét tuyển từ ngày 15-5, không giới hạn nguyện vọng Cũng theo ông Dương, đối với phương thức ưu tiên xét tuyển theo quy định của Đại học Quốc gia TP.HCM năm nay, thí sinh được đăng ký không bị giới hạn số nguyện vọng, không giới hạn số đơn vị nhưng có phân biệt thứ tự nguyện vọng. Các nguyện vọng phải được sắp xếp theo thứ tự ưu tiên từ cao xuống thấp (nguyện vọng 1 là nguyện vọng cao nhất). Thí sinh chỉ trúng tuyển vào nguyện vọng ưu tiên cao nhất có trong danh sách các nguyện vọng đã đăng ký. Sau khi các trường thành viên xét tuyển, Đại học Quốc gia TP.HCM thực hiện lọc ảo, xét tuyển và công bố kết quả trúng tuyển. Thí sinh đăng ký xét tuyển trực tuyến phương thức này tại trang thông tin điện tử của Đại học Quốc gia TP.HCM (https://tuyensinh.vnuhcm.edu.vn) và khai báo thông tin theo hướng dẫn của hệ thống dự kiến ngày 15-5 đến 15-6. Dự kiến thời gian xét tuyển và công bố kết quả ""Thí sinh đủ điều kiện trúng tuyển"" trước ngày 25-6. Đăng ký, điều chỉnh nguyện vọng trên hệ thống tuyển sinh chung của Bộ Giáo dục và Đào tạo từ ngày 18-7 đến 17h00 ngày 30-7 (theo hướng dẫn của Bộ Giáo dục và Đào tạo). Dành tối đa 20% tổng chỉ tiêu ưu tiên xét tuyển Năm nay Đại học Quốc gia TP.HCM dành tối đa 20% tổng chỉ tiêu cho phương thức ưu tiên xét tuyển theo quy định của đại học này. Hội đồng tuyển sinh các đơn vị xây dựng điều kiện đăng ký xét tuyển và tiêu chí xét tuyển chi tiết riêng từ 2% đến 25% (tùy trường). Trường đại học Bách khoa ưu tiên xét tuyển kết quả học tập 3 năm THPT trong danh sách 149 trường THPT và chứng chỉ tiếng Anh quốc tế, dự kiến 15% - 20% chỉ tiêu. Trường đại học Khoa học tự nhiên ưu tiên xét tuyển theo quy định của Đại học Quốc gia TP.HCM dựa trên điểm học bạ, dự kiến 10% - 20% chỉ tiêu. Trường đại học Khoa học xã hội và Nhân văn ưu tiên xét tuyển theo quy định của Đại học Quốc gia TP.HCM, xét điểm trung bình cộng 3 môn học tương ứng trong tổ hợp xét tuyển của 3 năm học THPT, cộng với điểm ưu tiên do trường quy định, 15 - 20% tổng chỉ tiêu. Điều kiện đăng ký: thí sinh đảm bảo 3 điều kiện: tốt nghiệp THPT năm 2024; hạnh kiểm tốt trong năm lớp 10, 11 và 12; có thành tích học tập chia theo các nhóm: đối với học sinh các trường THPT chuyên, năng khiếu phải đạt danh hiệu học sinh giỏi trong 2 năm và 1 năm xếp loại khá; học sinh thuộc các nhóm trường THPT khác và các nhóm đối tượng còn lại phải đạt danh hiệu học sinh giỏi trong 3 năm THPT. Trường đại học Kinh tế - Luật ưu tiên xét tuyển theo quy định của Đại học Quốc gia TP.HCM tối đa 20% tổng chỉ tiêu. Trường đại học Công nghệ thông tin dành đến 25% chỉ tiêu cho phương thức tuyển thẳng và ưu tiên xét tuyển. Trường đại học Quốc tế ưu tiên xét tuyển theo quy định của Đại học Quốc gia TP.HCM, thí sinh tốt nghiệp THPT năm 2024; đạt danh hiệu học sinh giỏi trong 3 năm THPT; hoặc là thành viên đội tuyển của trường hoặc tỉnh thành tham dự kỳ thi học sinh giỏi quốc gia, với 5% - 15% chỉ tiêu. Trường đại học An Giang ưu tiên xét tuyển theo quy định của Đại học Quốc gia TP.HCM tối đa 2% chỉ tiêu. Khoa Y ưu tiên xét tuyển theo quy định của Đại học Quốc gia TP.HCM, xét tổng điểm 3 môn toán, hóa, sinh trong 3 năm lớp 10, 11, 12 với 10%-15% chỉ tiêu. Phân hiệu Đại học Quốc gia TP.HCM tại tỉnh Bến Tre ưu tiên xét tuyển theo quy định của Đại học Quốc gia TP.HCM học lực giỏi, hạnh kiểm tốt 3 năm THPT với 3 - 4% chỉ tiêu.",30/04/2024 11:10 GMT+7,https://tuoitre.vn/dai-hoc-quoc-gia-tphcm-uu-tien-xet-tuyen-149-truong-thpt-nam-2024-20240430103041952.htm,Đại học Quốc gia TP.HCM vừa công bố danh sách 149 trường THPT thuộc diện ưu tiên xét tuyển theo quy định của đại học này năm 2024.
