Title,Content,Date,Url,Summary
'Kẻ sát nhân cô độc' Khôi Trần áp lực vào vai có tính nam độc hại,"""Tôi là người mở lời với đạo diễn Trần Đức Long và đoàn phim ẻ sát nhân cô độc phần 2 để được vào vai kẻ sát nhân. May mắn đạo diễn đã tin tưởng. Kha trong Kẻ sát nhân cô độc là vai phản diện đầu tiên, mà còn là vai bệnh tâm lý nữa nên tôi rất muốn hóa thân"", Khôi Trần chia sẻ với Tuổi Trẻ Online. Kẻ sát nhân bệnh tính nam độc hại * Trong hai tập đầu tiên, mỗi lần Kha đút cơm con trai ăn nhìn rất tình cảm. Khi vợ giận, anh ta còn mua hoa tặng vợ làm lành và nói những lời ngọt ngào. Ánh mắt của Kha luôn nhìn người thân của mình trìu mến. Người như vậy tại sao lại mắc bệnh tính nam độc hại? - Kha đáng thương lắm. Anh có gia đình nhỏ. Người vợ và cậu con trai bé bỏng 3 tuổi. Từ nhỏ anh chứng kiến sự bạo hành của cha đối với mẹ, của cha với bản thân. Ám ảnh tuổi thơ khiến Kha luôn muốn mình trở thành một người người chồng, người cha tốt. Kha luôn đấu tranh để quên đi nỗi ám ảnh của quá khứ. Không ảnh hưởng đến cuộc sống tốt đẹp ở hiện tại. Nhưng cuộc sống không như Kha mong muốn. Áp lực kinh tế, xung đột vợ chồng làm tâm lý của Kha ngày càng bất ổn. Để vào vai diễn, tôi đã nghiên cứu tính nam độc hại khá kỹ. Cụm từ này chỉ những tiêu chuẩn cực đoan về sự nam tính của người đàn ông. Nó bao gồm sự mạnh mẽ về thể chất, quyền lực trong xã hội và gia đình, và đặc biệt, không mang trong mình những tính nữ như thể hiện cảm xúc hay mưu cầu sự giúp đỡ từ người khác. ""Đàn ông phải mạnh mẽ, đàn ông phải ra đàn ông, phải quyết định hết tất cả mọi thứ"", Kha nghĩ như vậy. Vì vậy, anh ta sát hại và đập nát khuôn mặt những người mà anh ta nghĩ là không nam tính giống như phá đi sự yếu đuối trong con người mình. Nghệ sĩ với áp lực mang tên tồn tại * Căn bệnh của Kha trong phim Kẻ sát nhân cô độc phần 2 nghe khá lạ. Còn ngoài đời, sức khỏe tinh thần của người làm nghề diễn nói riêng và nghệ sĩ nói chung có gì khác biệt không? - Tôi nghĩ mỗi ngành nghề đều có những đặc thù riêng. Yêu cầu của mỗi ngành nghề cũng khác nhau. Theo nghệ thuật thì áp lực là phải chứng minh được sự tồn tại của bản thân. Sự nổi tiếng, sự công nhận của công chúng, của người trong nghề. * Có khi nào bản thân Khôi Trần trải qua những cảm giác bất ổn về tâm sinh lý? - Tôi là người không có quá nhiều tham vọng trong cuộc sống. Đối với tôi được làm công việc mình yêu thích là điều tuyệt vời. Thấy đủ là đủ. Chính điều đó tôi sống và làm việc với tâm thế thoải mái. Không đặt cho mình một mục tiêu cần đạt để vô tình tạo cho mình một áp lực vô hình. Tôi đặt chữ ""duyên"" lên đầu. Nhưng thú thật là cũng có lúc tôi buồn, mất ngủ cả đêm, dằn vặt câu hỏi vì sao mình luôn cố gắng nhưng kết quả không như mình mong đợi. Nhưng không bao giờ tôi để vấn đề này kéo dài quá một đêm. Vì tôi nghĩ, buồn cũng đây giải quyết được vấn đề. Còn đam mê thì còn tiếp tục phấn đấu. Chắc chắn sẽ thành công. Tôi nghĩ đơn giản như thế.",28/04/2024 16:21 GMT+7,https://tuoitre.vn/ke-sat-nhan-co-doc-khoi-tran-ap-luc-vao-vai-co-tinh-nam-doc-hai-20240428155851597.htm,Cuộc sống của Kha trong hai tập đầu phim 'Kẻ sát nhân cô độc' phần 2 khiến người xem tò mò về căn bệnh có tên tính nam độc hại. Khôi Trần bảo có lúc anh cũng thấy căng thẳng với vai diễn.
Taylor Swift và tham vọng vĩ đại mãi,"Đó là câu mở đầu một ca khúc thuộc album Tortured Poets Department, ca khúc So Long, London. Câu hát dường như cảm hứng từ tứ văn kinh điển trong The Great Gatsby của F. Scott Fitzgerald, khi Gatsby chỉ cho Nick thấy ánh đèn màu xanh ở phía bên kia bờ vịnh, biểu tượng cho một khao khát vĩnh viễn không thể chạm tới của Gatsby. Có khao khát nào Taylor Swift chưa đạt được? Khi Tortured Poets Department phát hành, Taylor Swift đang ở trên đỉnh thế giới. Cô xuất hiện ở mọi nơi trong đời sống văn hóa đại chúng: tour lưu diễn Eras ăn khách nhất lịch sử, cô giành giải Grammy cho Album của năm đến lần thứ 4 (điều chưa từng có ai làm được), trong khi vẫn tằng tằng ghi âm lại những album cũ của mình với thêm các ca khúc chưa được công bố. Và rồi cô phát hành một album với tận 31 ca khúc, dài 2 tiếng - bằng một bộ phim điện ảnh! Phải chăng ""ánh đèn màu xanh"" mà Taylor Swift đang vươn tới không chỉ là sự vĩ đại, vì điều đó thì cô đã đạt được rồi, mà là sự vĩ đại tuyệt đối, trường kỳ, bất biến? Lên đỉnh cao chưa đủ, cô muốn đỉnh cao đó được duy trì không ngừng nghỉ và mở rộng ra vô biên. Người ta vẫn thường nói về Swift như một nhà thơ trong âm nhạc và tham vọng trở thành một thi gia đích thực hiển hiện trong The Tortured Poets Department, album mà tựa đề dịch nôm na là ""phân khoa các nhà thơ mắc đọa"". Nhưng bao giờ cũng vậy, tham vọng một khi quá bành trướng thì có thể lại phản tác dụng. The Tortured Poets Department vẫn là một album với những sáng tác đạt đến trình độ bao người ao ước, nhưng đây là Taylor Swift và ta không thể tránh khỏi trở nên ""tiêu chuẩn kép"" khi mong mỏi nhiều hơn thế. Đành rằng Taylor Swift đã thực sự xuất sắc trong việc vào vai một cô giáo dạy văn lý tưởng cho người hâm mộ trẻ tuổi của mình, lồng ghép những gợi ý sách vở nghệ thuật hàn lâm dày đặc trong những tâm sự yêu đương, nào là thơ ca của Dylan Thomas, nào là William Shakespeare, nào là Khu vườn bí mật, nào là Peter Pan, nào là A Wrinkle in Time, nào là thần thoại Hy Lạp, thậm chí cả triết gia cổ đại Aristotle cũng có một vai cameo trong ""bài giảng"" của cô. Đành rằng Taylor Swift vẫn cứ, tự nhiên như hơi thở, viết ra những bài hát mang vóc dáng một truyện ngắn, như The Black Dog về một đôi tình nhân chia sẻ cho nhau định vị của mình và rồi nàng thấy chàng bước vào một quán bar, hay I Look in People's Window với một cô gái đi trên phố, nhìn vào những ô cửa sổ nhà bên tìm một gương mặt thân quen. Rượu nhạt uống lắm cũng say Tức là thơ của Swift vẫn hay, vẫn đầy ắp vốn từ vựng làm ta xuýt xoa và những bản phối tối giản kiểu indie, lấy guitar và piano làm trung tâm của Aaron Dessner và Jack Antonoff vẫn mở rộng và phát triển từ thời kỳ Folklore, những ""drama"" với người yêu cũ vẫn nóng bỏng tay nhưng việc thiếu đi những ca khúc thực sự nổi trội có khả năng găm vào tâm trí người nghe và làm trụ đỡ cho album khiến 2 tiếng nghe nhạc không tránh khỏi những đoạn có phần dài dòng lê thê. ""Rượu nhạt uống lắm cũng say. Người khôn nói lắm dẫu hay cũng nhàm"", hay như thành ngữ tiếng Anh ""too much of a good thing can be bad"" (cái gì quá cũng không tốt). Sự xuất hiện dày đặc của Taylor Swift khiến cho người ta còn đặt ra một cụm từ ""Taylor Swift fatigue"", cảm giác mệt mỏi khi đi đâu cũng thấy cô, lúc nào cũng thấy cô, chỗ nào cũng nghe nhạc cô văng vẳng, mạng xã hội góc nào cũng tràn ngập những câu chuyện về cô. Sự chăm chỉ lao động của Taylor (người hâm mộ còn gọi đùa cô là ""trâu Mỹ"") chỉ mới đây thôi đã giúp cô lên hết đỉnh cao này tới đỉnh cao khác nhưng đổi lại, nó lại lấy đi ở cô cảm giác thần bí cần có ở một nghệ sĩ - cái cảm giác rằng không phải lúc nào cô cũng có mặt ở đây để hát cho chúng ta nghe và trưng bày đời mình lên những ca khúc như trưng bày một triển lãm. Sau cùng, với nghệ thuật, đôi khi sự biến mất cũng quan trọng hệt như sự hiện diện vậy.",28/04/2024 11:18 GMT+7,https://tuoitre.vn/taylor-swift-va-tham-vong-vi-dai-mai-20240428100825084.htm,"Taylor Swift đã viết thế này: 'Trong tâm trí mình tôi thấy những ánh đèn thần tiên xuyên qua màn sương, nhưng tôi vẫn giữ tinh thần để gánh lấy sức nặng của vết rạn ấy'."
"Thắng Ngọt đăng trạng thái khó hiểu, nhắc cả ma túy khiến khán giả hoang mang","Facebook này được Thắng lập ra sau khi ban nhạc Ngọt tuyên bố tan rã. Từ khuya qua tới rạng sáng nay, liên tục trong mấy tiếng đồng hồ, Facebook này cập nhật liên tục các status (trạng thái): ""Nấm ơi anh yêu Nấm"", ""Nấm ơi, anh chưa từng không yêu Nấm"", ""Nên anh bảo Nấm này"", ""Miễn phí cả Giang lẫn Nhung cho Nấm"", ""Thì cút vẫn yêu""… Đỉnh điểm là status ""từ giờ bỏ maaAA túy"" (ma túy) khiến nhiều khán giả ""sốc ngang"" lẫn thất vọng. Thắng ""Ngọt"" có vấn đề? Trước đó Facebook Thang Vu cũng nhiều lần cập nhật những status khó hiểu liên quan những cái tên như Nhung, Giang và Nấm và xin tiền fan sản xuất nhạc, đề nghị miễn phí WiFi và điều hòa... Đáng chú ý, Facebook này còn nhắc đến cả ca sĩ trẻ Amee: ""Thề anh sáng tác miễn hết cả phí cho Amee một giờ đầu tiên luôn”, ""Muốn làm một bài với Amee thật, thề!”. Chưa hết, Thang Vu còn dẫn lại tên một ca khúc của Amee Trời giấu trời mang đi rồi viết: ""Thề anh cũng không hiểu sao ông trời lại giấu anh đi nhưng mà anh đây rồi!"". Facebook này cũng cho rằng bài Đen đá không đường của Amee là dành cho Thắng Ngọt: “Cho em đen đá không đường là chả hát tặng Thắng Ngọt thì là gì?”. Rất nhiều khán giả để lại bình luận dưới các bài đăng trên. Bên cạnh những ý kiến mỉa mai, chế nhạo, cũng có không ít fan lo lắng cho tình trạng của Thắng, cho rằng nghệ sĩ đang có vấn đề về tâm lý, cần được điều trị. Một khán giả bình luận: ""Thắng Ngọt rất có thể là đang bị bipolar (rối loạn lưỡng cực) nên rất hy vọng hiện tại có người ở bên cạnh bạn ý để ngăn hành động dại dột""… Dù khuya nhưng những bài đăng trên trang Facebook cá nhân này vẫn gây bão mạng. Nhiều diễn đàn, trang mạng dẫn lại, độ thảo luận rất lớn. Hiện ""Thắng (Ngọt)"" đang là từ khóa được tìm kiếm và phổ biến trên mạng. Thắng cần xem lại  Vũ Đinh Trọng Thắng sinh năm 1995, là người sáng tác lẫn hát chính, được xem là ""linh hồn"" của ban nhạc Ngọt. Trong các thành viên của ban nhạc, Thắng là người sở hữu lượng fan đông đảo nhất, kế đó là Nguyễn Hùng Nam Anh. Tuổi Trẻ Online đã liên hệ Thắng để xác nhận thông tin song không được. Nếu quả thực Thắng chính là người đăng tải những status trên thì nghệ sĩ cũng nên xem lại hành vi của mình. Nghệ sĩ cần có trách nhiệm hơn trong phát ngôn trên môi trường mạng, nhất là những nghệ sĩ nổi tiếng, có lượng fan trẻ hùng hậu. Nhiều người tag (gắn thẻ) bạn bè vào bài đăng của Facebook Thang Vu và nói ""vào đây mà xem thần tượng này"". Có không ít fan cảm thấy ""xấu hổ khi thần tượng một nghệ sĩ có lối sống lệch lạc như vậy"". Có người thì cho rằng Thắng Ngọt ""không xứng hát cho giới trẻ"". Không lâu sau khi ban nhạc Ngọt tan rã, Thắng lần đầu lên tiếng về việc hủy những show đã hứa vì lý do sức khỏe, “sẽ diễn bù cho mọi người sau khi bình phục”. Ngày 27-4, Thắng kết hợp với rapper Datmaniac ra MV Nó.  Ban tổ chức sự kiện Những thành phố mơ màng cũng thông báo, Thắng sẽ có mặt trong chương trình tháng 7 tới đây, diễn bù cho sự kiện Những thành phố mơ màng summer Hà Nội ngày 20-4 phải tạm hoãn vì lý do thời tiết.  ",28/04/2024 11:12 GMT+7,https://tuoitre.vn/thang-ngot-dang-trang-thai-kho-hieu-nhac-ca-ma-tuy-khien-khan-gia-hoang-mang-20240428065519864.htm,"Khuya 27-4 tới rạng sáng 28-4, Facebook Thang Vu - tài khoản cá nhân của Vũ Đinh Trọng Thắng (ban nhạc Ngọt) - liên tục đăng những trạng thái khó hiểu, trong đó có 'từ giờ bỏ maaAA túy' (ma túy) khiến khán giả hoang mang."
"Giải trí điện ảnh, sân khấu, truyền hình lễ 30-4 và 1-5: Bài ca thống nhất trên màn ảnh nhỏ","Từ đó những giai đoạn lịch sử hào hùng dân tộc được kể qua bài hát: Bài ca không quên, Bài ca thống nhất, Tiếng hát từ thành phố mang tên Người, Một vòng Việt Nam. Các ca sĩ Ngọc Mai, Đức Tuấn, Lê Anh Tuấn, nhóm Lạc Việt, Sen Việt tham gia biểu diễn. Lúc 21h ngày 30-4 trên HTV9 truyền hình trực tiếp bắn pháo hoa nghệ thuật, tiếp theo đó là chương trình biểu diễn nghệ thuật kỷ niệm 49 năm Ngày giải phóng miền Nam thống nhất đất nước và 138 năm Ngày Quốc tế lao động. Rạp phim có gì? Dịp lễ 30-4 và 1-5 khán giả yêu phim sẽ được ""chiêu đãi"" bữa tiệc điện ảnh thịnh soạn với đa dạng các thể loại như hài, tình cảm, kinh dị, hành động... Hai phim Việt đang chiếu dịp nghỉ lễ này là Lật mặt 7: Một điều ước và Cái giá của hạnh phúc. Ngoài hai phim Việt, khán giả ra rạp vẫn có nhiều lựa chọn khác để phù hợp hơn với ""gu"" phim của mình. Đó là Vây hãm: Kẻ trừng phạt sẽ là lựa chọn phù hợp cho khán giả yêu thích phim hành động, máu lửa với sự xuất hiện của ""đả nam"" nổi tiếng bậc nhất xứ Hàn - Ma Dong Seok, kể về hành trình một ""siêu cảnh sát"" đối đầu với tội phạm. Người yêu thích thể loại kinh dị có thể chọn xem Tà khúc triệu vong, phim lấy đề tài kinh dị, siêu nhiên tương tự bom tấn Exhuma: Quật mộ trùng ma tháng trước. Gia đình có khán giả nhỏ tuổi nên chọn phim hoạt hình vui nhộn như Gấu béo tung chưởng hay Mèo mập mang 10 mạng. Rộn ràng xiếc và sân khấu Gala Xiếc và ảo thuật ba miền trở lại với công chúng thủ đô từ 27-4 tới 1-5 tại 67-69 Trần Nhân Tông. Chương trình do NSND Tống Toàn Thắng viết kịch bản và dàn dựng, với nhiều màn biểu diễn phong phú như xiếc leo cột, xiếc trâu, xiếc lợn, múa rồng, múa sen, xiếc ""đám cưới đê"", ảo thuật, hề xiếc... Năm nay nghỉ lễ dài ngày, sàn diễn TP.HCM chuẩn bị nhiều chương trình phục vụ khán giả. Ngày xửa ngày xưa 35 với vở Cuộc phiêu lưu của thuyền trưởng Sinbad: Huyền thoại mắt thần năm nay hẹn sớm với khán giả nhí từ suất 16h ngày 30-4. Trong hai ngày 30-4 và 1-5, vở sẽ diễn bốn suất (lúc 16h và 20h). Nhà hát nghệ thuật Phương Nam cũng chọn dịp lễ để giới thiệu đến các bé chương trình xiếc mang tên rất mềm mại Ầu ơ (tác giả: Nguyễn Thanh Phương, đạo diễn: Phi Sơn, Bích Liên, Công Nguyễn). Trong dịp lễ, nhà hát biểu diễn chương trình tại rạp xiếc công viên Gia Định (đường Hoàng Minh Giám, quận Gò Vấp) với tám suất từ 27-4 đến 1-5 vào lúc 19h30. Riêng 28, 29 và 30-4 tăng cường thêm suất 17h. Vở kịch xiếc Cha Rồng mẹ Tiên tại sân khấu Dế Mèn của Công viên văn hóa Đầm Sen cũng diễn lúc 13h30 chủ nhật hằng tuần. Vở cải lương Người ven đô của sân khấu cải lương mới Đại Việt sẽ công diễn tối 27-4 tại Nhà hát cải lương Trần Hữu Trang. Nhà hát kịch Idecaf có 1 suất diễn lớn vào ngày 28-4 tại Nhà hát Thanh Niên với vở kịch lịch sử Đức thượng công Tả quân Lê Văn Duyệt - Người mang 9 án tử. Nhà hát Thanh Niên diễn các vở Đại hội yêu quái - 7 con yêu nhền nhện, Lạc lối ở Bangkok. Sân khấu kịch Thiên Đăng diễn vở Lộ hàng và Cô giáo Duyên. Sân khấu Thế Giới Trẻ diễn Ở đây ai tỉnh, Tâm ma, Tình kỹ nữ, Nghiệp quật, Hồn ma cô đào hát. Sân khấu kịch Hồng Vân diễn Bông cánh cò, Hậu cung ngoại truyện, Quả tim máu, Người vợ ma. Sân khấu Trương Hùng Minh có vở Truy lùng thái tử và Dâu ngọt. Sân khấu Hoàng Thái Thanh tiếp tục với Lạc ở đáy sông và Lồng sắt. Nhà hát kịch 5B diễn vở Bến lửa lòng, Tình lá diêu bông, Đại náo long cung và Thế giới đồ chơi - Câu chuyện cậu bé rồng.",28/04/2024 10:22 GMT+7,https://tuoitre.vn/giai-tri-dien-anh-san-khau-truyen-hinh-le-30-4-va-1-5-bai-ca-thong-nhat-tren-man-anh-nho-20240428094959401.htm,"VTV9 lúc 10h ngày 28-4 phát sóng phim ca nhạc Bài ca thống nhất. Hình ảnh người cựu chiến binh thời bình thanh thản nhớ lại những hình ảnh cách đây 49 năm khi từ chiến trường trở về xuyên suốt chương trình, kết nối các ca khúc."
"Bella Vũ hát Hello Vietnam với sáo, đàn tranh, tì bà và piano","Tối 27-4, Bella Vũ lấy được cảm tình của khán giả khi cô thể hiện tài năng chơi đàn piano, hát trong một buổi hòa nhạc được tổ chức tại TP.HCM. Góp mặt trong đêm nhạc Bella Vũ - Steinway Piano Recital có nghệ sĩ Nguyễn Long An - người hướng dẫn Bella Vũ chơi đàn piano từ nhỏ, anh trai Oscar Vũ… và Dàn nhạc học sinh quốc tế Sài Gòn (SISO). Làm mới ca khúc tiếng Pháp với nhạc cụ dân tộc Bella Vũ kết hợp cùng pianist Nguyễn Long An và Dàn nhạc học sinh quốc tế Sài Gòn qua tác phẩm Eine Kleine Nachtmusik. Đây là một trong những sáng tác nổi tiếng của nhà soạn nhạc Wolfgang Amadeus Mozart. Phần biểu diễn ăn ý của Bella Vũ và nghệ sĩ Nguyễn Long An nhận được sự cổ vũ nhiệt tình của khán giả. Sau đó, Bella Vũ tiếp tục chinh phục khán giả qua ca khúc dân ca của Ý mang tên Bella Ciao. Cô thể hiện qua tiếng đàn piano của pianist Nguyễn Long An. Bella Vũ Huyền Diệu đưa khán giả đến với không gian nhiều cảm xúc cho chơi solo piano bản Sonatine No.3 của nhạc sĩ Muzio Clementi. Phần kết hợp giữa Bella Vũ và anh trai Oscar Vũ qua ca khúc nhạc phim Cướp biển vùng Caribê - Pirates Of The Caribbean của nhạc sĩ Hans Zimmer khiến khán giả thích thú. Bella Vũ cho biết hai anh em chơi đàn piano từ nhỏ tuy nhiên không mấy hòa hợp nhau bởi sự năng động của anh trai. Việc kết hợp cùng nhau được xem là ""kỳ tích"". Đặc biệt, Bella Vũ làm mới ca khúc tiếng Pháp do nhạc sĩ Marc Lavoine sáng tác mang tên Hello Vietnam. Bella Vũ hát chính cùng tiếng đệm đàn piano của nghệ sĩ Nguyễn Long An cùng các thành viên của SISO chơi đàn tranh, đàn tì bà và sáo. Ca khúc quen thuộc này một lần nữa được khoác màu sắc mới mẻ cho người nghe. Ngoài ra, cô cũng thể hiện ca khúc Một vòng Việt Nam (sáng tác Đông Thiên Đức) với sự kết hợp của loại nhạc cụ dân tộc và đàn piano khiến khán giả cảm nhận được tài năng của cô. Hơn 10 năm gắn bó với piano Từ nhỏ, Bella Vũ được gia đình cho thử sức qua nhiều loại nhạc cụ khác nhau. Tuy nhiên cô bị sức hút bởi đàn piano và gắn bó hơn 10 năm qua và đoạt nhiều thành tích trong các cuộc thi piano. Người thầy dìu dắt và dạy Bella Vũ khi mới 7 tuổi là nghệ sĩ Nguyễn Long An. Với sự nỗ lực, Bella Vũ góp mặt trong đội hình chính thức của Dàn nhạc học sinh quốc tế Sài Gòn SISO. Những giải thưởng Bella Vũ đoạt được trong những năm qua như giải bạc piano solo tại Liên hoan nghệ thuật châu Á năm 2015; giải bạc piano duel, giải đồng hát và đệm đàn piano tại cuộc thi này năm 2016. Đến năm 2022, Bella Vũ đoạt giải vàng thanh nhạc và giải bạc đàn piano tại Liên hoan nghệ thuật châu Á lần thứ 9. Năm vừa rồi, cô đoạt huy chương vàng piano solo tại Lễ hội nghệ thuật quốc tế IAF 2023, là một trong 12 đại biểu diễn thuyết tại Hội nghị và giải thưởng lãnh đạo Thanh niên toàn cầu 2023. Đêm nhạc Bella Vũ - Steinway Piano Recital như là một món quà Bella Vũ dành tặng khán giả đã luôn yêu thương, dõi theo chặng đường nghệ thuật của cô.",28/04/2024 07:30 GMT+7,https://tuoitre.vn/bella-vu-hat-hello-vietnam-voi-sao-dan-tranh-ti-ba-va-piano-20240428061142445.htm,"Ca khúc Hello Vietnam, Một vòng Việt Nam được nhiều ca sĩ thể hiện thành công nhưng Bella Vũ làm mới hai ca khúc này khi kết hợp giữa nhạc cụ phương Tây và Việt Nam."
