Title,Content,Date,Url,Summary
Giải pháp nào nâng chất lượng đào tạo y khoa?,"Nhu cầu nhân lực cho ngành y tế cũng ngày càng cao khiến y khoa trở thành ngành ""hot"", nhiều trường ồ ạt đào tạo với điểm đầu vào thấp. Điều này khiến dư luận lo lắng về chất lượng đào tạo y khoa vốn liên quan trực tiếp đến sức khỏe con người. Tuổi Trẻ trích đăng ý kiến của chuyên gia, người dân về những vấn đề liên quan. TS.BS Trần Thanh Tùng (phó trưởng bộ môn dược lý, Trường đại học Y Hà Nội): Dễ dãi sẽ gây hậu quả lớn Qua kinh nghiệm đào tạo tại Trường đại học Y Hà Nội và một số trường đại học y dược khác trong hơn 20 năm qua, tôi nhận thấy sinh viên có nền tảng kiến thức vững vàng về các môn tự nhiên, bên cạnh đó có trình độ tiếng Anh, tiếng Pháp tốt mới có thể trở thành bác sĩ giỏi. Người xưa đã nói ""có bột mới gột nên hồ"". Nếu sinh viên đầu vào không tốt, thầy có giỏi đến mấy cũng không đào tạo để có đầu ra tốt được. Các sinh viên này không tiếp thu được kiến thức, quá trình học không tập trung, sợ tiếp xúc với người bệnh... Nếu chúng ta dễ dãi trong cấp phép đào tạo, dễ dãi trong tuyển sinh viên ngành y sẽ dẫn tới hậu quả lớn cho sau này. Chúng ta nên tập trung vào chất lượng đào tạo bác sĩ thay vì số lượng như hiện nay. Bác sĩ là nghề đặc biệt vì họ là những người chăm sóc sức khỏe cho toàn dân. Để có các bác sĩ ""vừa hồng vừa chuyên"" thì cần có quá trình tuyển chọn, đào tạo bài bản, chế độ đãi ngộ xứng đáng. Bên cạnh đó, các trường đào tạo y khoa tư nhân hiện nay hầu hết là các trường mới, đội ngũ giảng viên chưa đủ cho đào tạo bác sĩ, đôi khi phải mời thêm cho đủ ""bộ khung"" để được cấp phép đào tạo. Các trường này phải thuê các giảng viên trường ngoài đến thỉnh giảng. Trong khi đó, để thuê được các giảng viên có trình độ thì cần có kinh phí xứng đáng. Cách làm như vậy thường không ổn định và chất lượng không đảm bảo. Điều kiện phòng thí nghiệm và cơ sở thực hành cho sinh viên y khoa thiếu sẽ dẫn tới kết quả đầu ra không đạt được như mong đợi. Đối với sinh viên y khoa thì được thực hành trong môi trường tốt cùng với đội ngũ giảng viên giỏi sẽ đóng vai trò rất quan trọng trong hành nghề chữa bệnh cứu người sau khi tốt nghiệp. Bác sĩ Nguyễn Hữu Tùng (phó chủ tịch thường trực Hội hành nghề y tư nhân TP.HCM): Chú trọng cơ sở vật chất Hiện nay các trường mở ngành hoặc trường chuyên đào tạo khối ngành sức khỏe nhiều nhưng chưa thực sự quan tâm đến chất lượng. Nhiều trường lấy học phí để hoạt động, điều hành do vậy chủ yếu chạy theo số lượng nhưng không quan tâm nhiều đến chất lượng. Thậm chí một số trường không ký được hợp đồng thực hành cho sinh viên ở các bệnh viện. Lý do là bệnh viện không đủ nhân lực để hướng dẫn do sinh viên quá đông, gây phiền hà cho bệnh nhân, một số bệnh viện ký vì chủ trương, ngoại giao. Một thầy không thể dạy hết 40-50 em sinh viên thực hành, dẫn đến sinh viên ra trường không đủ năng lực khám chữa bệnh. Tôi đã từng phỏng vấn nhiều bác sĩ: ""Các em đã được khám bao nhiêu bệnh nhân khi thực tập?"". Nhiều bác sĩ cho hay ít được khám vì đông bác sĩ thực tập. Một sinh viên đọc sách 10 năm không thể ra làm bác sĩ được nếu không tiếp cận được bệnh nhân, ngành bác sĩ phải thực hành lâm sàng. Chất lượng đào tạo y khoa của Việt Nam so với các nước trên thế giới còn rất thấp. Chúng ta cần tập trung đầu tư cho đào tạo. Trong đó chú trọng đến cơ sở vật chất, cơ sở thực hành tiền lâm sàng, phải có cơ sở thực tập... Các trường nào muốn đào tạo ngành y phải đảm bảo cơ sở thực hành riêng. Tại một số nước trên thế giới, một số trường chỉ tuyển khoảng 100 sinh viên, thế nhưng họ đầu tư rất lớn cho từng sinh viên. PGS Đỗ Văn Dũng (nguyên phó hiệu trưởng Trường đại học Y dược TP.HCM): Phải đáp ứng nhiều điều kiện Đào tạo y khoa phải đáp ứng nhiều điều kiện như năng lực và phẩm chất của người theo học y khoa, kinh nghiệm lâm sàng, trình độ khoa học của giảng viên, cơ sở thực hành đa dạng về mặt bệnh và đủ số lượng bệnh nhân... Tuy nhiên, hiện nay một số trường y khoa mới mở có thể không đạt tiêu chuẩn. Do phải tăng lượng tuyển sinh để tăng doanh số của trường mới mở nên yêu cầu về năng lực của người học có thể bị hạ thấp. Nhiều trường mới mở thường không có đủ giảng viên có đủ kinh nghiệm và trình độ, do những giảng viên có kinh nghiệm thường gắn bó với các trường đại học được thành lập nhiều năm trước đó. Các trường đại học tư cũng thường không có mạng lưới giảng viên gắn kết với các bệnh viện công để giảng dạy tại các bệnh viện công, nên thường nhờ vào các bác sĩ dù có kinh nghiệm lâm sàng nhưng ít có kinh nghiệm giảng dạy. Ngoài ra các trường y mới thường thu học phí cao, khiến đa số sinh viên vào học là sinh viên từ các gia đình khá giả ở thành thị, cản trở hình thành môi trường giáo dục toàn diện. Tất các điều trên khiến chất lượng các bác sĩ tốt nghiệp từ các trường tư mới có thể có chất lượng chuyên môn kém hơn. Để có thể giải quyết vấn đề này, cần có sự quan tâm từ lãnh đạo của các trường y mới mở như: khắc phục một phần điểm yếu về năng lực học tập bằng cách bổ sung các tiêu chuẩn tuyển sinh để có sinh viên vào học có đạo đức làm việc tốt, có đam mê cống hiến và giúp đỡ người khác; chọn lựa giảng viên là người có kinh nghiệm, có bằng cấp phù hợp và có khả năng truyền đạt tốt; đầu tư vào các cơ sở thực hành cho sinh viên thực tập; cấp học bổng toàn khóa cho sinh viên nghèo nhưng có thành tích học tập xuất sắc, hỗ trợ tài chính và cung cấp tín dụng học tập toàn khóa cho sinh viên có kết quả học tập tốt. Tuy nhiên trách nhiệm chính là Nhà nước và các cơ quan quản lý phải có hệ thống kiểm định chất lượng cơ sở đào tạo với yêu cầu chặt chẽ hơn từ trước khi tuyển sinh khóa đầu tiên về giảng viên, chương trình đào tạo, cơ sở thực hành và sự ổn định tài chính. Sau khi mở trường phải kiểm định thường xuyên và đúng thực chất. Xây dựng kỳ thi cấp giấy phép hành nghề y khoa công bằng, đánh giá chính xác và trên tỉ lệ sinh viên có kết quả tốt trong kỳ thi này để tiếp tục hoặc dừng cho phép đào tạo. Ông Nguyễn Hoàng Long (cục trưởng Cục Khoa học công nghệ và đào tạo - Bộ Y tế): Đang đề xuất các giải pháp đảm bảo chất lượng Hiện nay, đào tạo trình độ đại học khối ngành sức khỏe do Bộ GD-ĐT quản lý. Trước khi xin mở ngành đào tạo thuộc lĩnh vực sức khỏe, các đơn vị sẽ phải xin ý kiến ngành đó có nhu cầu hay không? Thứ hai, các điều kiện thực hành để xây dựng đề án có đảm bảo hay không? Bộ Y tế sẽ trả lời hai việc này, còn lại do Bộ GD-ĐT quản lý từ cơ sở vật chất, giảng viên... Thực tế, hiện nay các cơ sở đào tạo công lập và ngoài công lập mở rất nhiều khoa, ngành đào tạo lĩnh vực y khoa. Khi mở ngành học, các trường lập đề án với các tiêu chí đảm bảo đầy đủ các yêu cầu, có giảng viên, có cơ sở đào tạo... Tuy nhiên, sau đó các trường triển khai thực sự ra sao thì không dễ dàng quản lý. Hiện cục cũng đang xây dựng đề xuất các giải pháp để đảm bảo chất lượng đào tạo. Trong đó có đánh giá chuẩn chương trình, chuẩn năng lực đầu ra đối với bác sĩ trực tiếp tham gia khám chữa bệnh. Cụ thể, theo quy định một số điều của Luật Khám bệnh chữa bệnh, sau khi tốt nghiệp đào tạo y khoa, sinh viên phải tham gia thực hành nghề nghiệp tại một cơ sở khám chữa bệnh đủ điều kiện. Thời gian thực hành tùy vào từng chức danh. Sau đó, phải tham dự kỳ kiểm tra đánh giá năng lực hành nghề do Hội đồng y khoa quốc gia tổ chức. Đối với bác sĩ sẽ thực hiện kỳ kiểm tra này từ năm 2027, các chức danh hành nghề khác sẽ thực hiện từ năm 2028. Khi đạt tại kỳ kiểm tra này, các bác sĩ sẽ được cấp giấy phép hành nghề và phạm vi hoạt động là khám chữa bệnh đa khoa. Hiện Bộ Y tế đang giao Viện chiến lược chính sách y tế triển khai khảo sát, đánh giá nhu cầu hành nghề của các bác sĩ chuyên khoa ở các tuyến bệnh viện, từ trung ương đến tuyến tỉnh. Khi đó, Bộ Y tế sẽ có những con số dự kiến trong đào tạo chuyên khoa trên cả nước.",28/04/2024 11:25 GMT+7,https://tuoitre.vn/giai-phap-nao-nang-chat-luong-dao-tao-y-khoa-20240428084615101.htm,"Theo Bộ Y tế, đến năm 2023 lĩnh vực đào tạo nhân lực y tế có 66 cơ sở đào tạo trình độ đại học với mỗi năm có hơn 10.000 bác sĩ."
"Lần đầu tham dự Olympic hóa học quốc tế Mendeleev, cả 10 học sinh Việt Nam đoạt giải","Ngày 27-4, Hội Hóa học Việt Nam cho biết tại cuộc thi Olympic hóa học quốc tế Mendeleev (IMChO) lần thứ 58 được tổ chức tại Thâm Quyến (Trung Quốc), Việt Nam lần đầu tiên cử thí sinh dự thi và đạt thành tích 10/10 thí sinh đoạt giải. Cụ thể, huy chương vàng thuộc về em Giang Đức Dũng (lớp 11 Trường THPT chuyên Khoa học tự nhiên, Đại học Quốc gia Hà Nội). 5 huy chương bạc thuộc về các em: Ngô Huy Đăng Khoa (lớp 12 Trường THPT chuyên Hà Nội - Amsterdam, Hà Nội), Trần Đăng Khôi (lớp 12 Trường THPT chuyên Hà Nội - Amsterdam), Vũ Việt Bắc (lớp 12 Trường THPT chuyên Hùng Vương, Phú Thọ), Nguyễn Ngô Đức (lớp 11 Trường THPT chuyên Phan Bội Châu, Nghệ An), Tạ Quang Chí (lớp 12 Trường THPT chuyên Vĩnh Phúc, Vĩnh Phúc). 4 huy chương đồng thuộc về các em Lê Đức Huy (Trường THPT chuyên Lê Quý Đôn, Đà Nẵng), Lê Xuân Anh Quân (Trường THPT chuyên Phan Bội Châu, Nghệ An), Lê Thành Đạt (Trường THPT chuyên Lam Sơn, Thanh Hóa) và Đặng Trần Nhật Minh (Trường THPT chuyên Khoa học tự nhiên, Đại học Quốc gia Hà Nội). Với thành tích trên, Việt Nam xếp hạng ba toàn đoàn, sau đoàn Trung Quốc và Nga. Cuộc thi Olympic hóa học quốc tế Mendeleev lần thứ 58 năm 2024 diễn ra từ ngày 20-4 đến hết ngày 27-4 với sự tham dự của 151 thí sinh đến từ 26 quốc gia và vùng lãnh thổ.",27/04/2024 16:55 GMT+7,https://tuoitre.vn/lan-dau-tham-du-olympic-hoa-hoc-quoc-te-mendeleev-ca-10-hoc-sinh-viet-nam-doat-giai-20240427162750061.htm,"Với thành tích 1 huy chương vàng, 5 huy chương bạc và 4 huy chương đồng tại cuộc thi Olympic hóa học quốc tế Mendeleev, Việt Nam xếp hạng ba toàn đoàn, sau đoàn Trung Quốc và Nga."
"Bến xe mọc sát trường học, chẳng lẽ bó tay?","Người dân quanh bến xe khách nhà xe Đại Ngân cho biết dù đã nhiều lần phản ảnh đến cơ quan chức năng nhưng bến cóc hoạt động ngay cạnh Trường tiểu học Huỳnh Kiến Hoa (quận 5, TP.HCM) vẫn chưa di dời mà còn hoạt động mạnh hơn vào dịp lễ Tết, khiến đoạn đường này thường xuyên bị tắc nghẽn. Những ngày gần đây, người đi đường và phụ huynh học sinh càng bức xúc vì xe khách đón trả khách ra vô liên tục ngay bên cổng trường. Có nhiều xe ra vô nhưng do đường phía trước khá hẹp nên xe cộ khác qua lại phải án binh bất động để xe khách đi vào hoặc ra khỏi bến. Giao thông qua khu vực càng trở nên phức tạp vào những giờ cao điểm đưa đón học sinh. Trước đó, ngày 12-10-2023, đại diện UBND quận 5 cho biết qua kiểm tra, nhà xe đặt cạnh Trường tiểu học Huỳnh Kiến Hoa có giấy chứng nhận địa điểm kinh doanh thuộc chi nhánh Công ty cổ phần - đầu tư vận tải Đại Ngân. Cũng theo đại diện UBND quận 5, việc đón trả khách thường xuyên tại địa điểm kinh doanh này chưa đúng quy định, chưa phù hợp (tuyến đường nhỏ, sát trường tiểu học). Do đó, UBND phường 6 đã cử lực lượng chốt chặn, đặt barie ở hai đầu đường Nguyễn Văn Đừng để cấm xe khách ra vào những giờ cao điểm, giờ đưa đón học sinh. UBND phường 6 cũng có văn bản gửi Phòng Quản lý đô thị quận 5 kiến nghị các sở, ngành liên quan xem xét cấm tất cả xe ô tô trên 16 chỗ đi vào đường Nguyễn Văn Đừng từ 6h-18h hằng ngày. Đồng thời, xử lý vi phạm hành chính đối với nhà xe Đại Ngân do vi phạm quy định phòng cháy chữa cháy. UBND phường 6 cũng gửi văn bản đến phòng đăng ký kinh doanh thuộc Sở Kế hoạch và Đầu tư TP.HCM đề xuất rút giấy phép kinh doanh của nhà xe Đại Ngân ở địa chỉ nêu trên. Tuy nhiên sau nửa năm, đến nay bến xe trên vẫn tiếp tục hoạt động. Rất nhiều phụ huynh lo lắng khi bến xe hoạt động tại khu vực có nhiều học sinh ra vào sẽ tiềm ẩn nhiều rủi ro. Trao đổi với Tuổi Trẻ Online sáng 27-4, đại diện UBND quận 5 cho biết dù đã nhiều lần kiến nghị xử lý rốt ráo để lập lại trật tự tại khu vực, nhưng thẩm quyền thuộc Sở Giao thông vận tải TP.HCM, đơn vị cấp giấy phép. ""Chúng tôi sẽ tiếp tục kiến nghị các cơ quan có thẩm quyền kiểm tra, xem lại việc cấp giấy phép cho nhà xe hoạt động cạnh trường học liệu có hợp lý hay không. Nếu không, phải xử lý ngay, không thể kéo dài thêm tình trạng này nữa"", vị này nói thêm. Hình ảnh hoạt động của nhà xe Đại Ngân:   ",27/04/2024 15:04 GMT+7,https://tuoitre.vn/ben-xe-moc-sat-truong-hoc-chang-le-bo-tay-20240426080327564.htm,"Dù bạn đọc nhiều lần phản ánh nhưng bến xe này vẫn tồn tại ngay cạnh trường tiểu học ở quận 5 (TP.HCM), gây mất an toàn cho học sinh."
Thí sinh đăng ký thi đánh giá năng lực của Trường đại học Sư phạm Hà Nội tăng hơn 2 lần,"Trường đại học Sư phạm Hà Nội vừa chính thức công bố các thông tin liên quan đến kỳ thi đánh giá năng lực do trường tổ chức vào ngày 11-5 tới. Ghi nhận tổng số thí sinh đăng ký tham dự kỳ thi năm nay là 11.537 thí sinh, trong đó ngữ văn là môn có thí sinh đăng ký dự thi nhiều nhất với 7.531 thí sinh, tiếp đến là môn toán có 6.617 thí sinh, tiếng Anh 5.131 thí sinh, lịch sử 2.830 thí sinh. Môn vật lý có 1.972 thí sinh đăng ký dự thi, hóa học 1.898 thí sinh, địa lý 931 thí sinh, sinh học 380 thí sinh. So với năm 2023, số lượng thí sinh tăng gần gấp 2,5 lần. Năm nay, Trường đại học Sư phạm Hà Nội tổ chức thi tại 3 điểm thi, gồm Hà Nội, Đà Nẵng và Quy Nhơn. Trong đó, Hà Nội có 281 phòng thi (11.125 thí sinh), Đà Nẵng có 5 phòng thi (243 thí sinh), Quy Nhơn có 5 phòng thi (169 thí sinh). Cấu trúc các bài thi đánh giá năng lực, về nội dung các bài thi tương ứng và phù hợp với nội dung các môn học, môn thi cấp THPT mà học sinh đã quen thuộc; thí sinh làm bài thi trực tiếp trên giấy. Đề thi có kết hợp trắc nghiệm và tự luận với tỉ lệ điểm phù hợp tùy theo bài thi, bao gồm các câu hỏi đánh giá mức độ thông hiểu kiến thức cốt lõi và năng lực lập luận, phân tích, đánh giá, giải quyết vấn đề và sáng tạo. Theo nhà trường, điểm mới của kỳ thi năm nay là ngân hàng câu hỏi được bổ sung, cập nhật, chú ý định hướng phương thức mới của Bộ Giáo dục và Đào tạo sau năm 2025. Cấu trúc các bài thi và thời gian làm bài cụ thể như sau: Kết quả bài thi được 9 trường đại học công nhận bao gồm: Trường đại học Sư phạm Hà Nội; Trường đại học Sư phạm Hà Nội 2; Trường đại học Sư phạm TP.HCM; Trường đại học Sư phạm - Đại học Huế; Trường đại học Sư phạm - Đại học Đà Nẵng; Trường đại học Sư phạm - Đại học Thái Nguyên; Trường đại học Vinh; Trường đại học Quy Nhơn; Trường đại học Y Dược Thái Bình. Thí sinh lựa chọn đăng ký một số bài thi và sử dụng kết quả thi để đăng ký dự tuyển vào các ngành đào tạo đại học theo yêu cầu của mỗi trường đại học. Thời gian, địa điểm, hình thức thi đánh giá năng lực diễn ra vào ngày 11-5 cụ thể như sau:",27/04/2024 10:59 GMT+7,https://tuoitre.vn/thi-sinh-dang-ky-thi-danh-gia-nang-luc-cua-truong-dh-su-pham-ha-noi-tang-hon-2-lan-20240427100743164.htm,"Năm 2024, tổng số thí sinh đăng ký dự thi đánh giá năng lực của Trường đại học Sư phạm Hà Nội là 11.537, tăng gấp gần 2,5 lần so với năm ngoái."
"TP.HCM: Tuyển sinh đầu cấp mầm non, lớp 1 theo nơi ở sao cho suôn sẻ?","Phần lớn phụ huynh học sinh, chuyên gia giáo dục, hiệu trưởng nhiều trường tiểu học và THCS tại TP.HCM đều đánh giá cao công tác phân bổ chỗ học của học sinh dựa vào tiêu chí nơi ở thực tế. Theo họ, tiêu chí này là hợp lý, tạo điều kiện cho gia đình học sinh, tạo công bằng trong giáo dục và cũng dễ dàng trong quản lý, điều chỉnh hướng đến đồng bộ chất lượng dạy học ở các trường. Trước khi thực hiện phân bổ chỗ học đầu cấp của học sinh trên toàn TP bằng tiêu chí nơi ở thực tế của học sinh, năm học 2023 - 2024 TP.HCM đã thực hiện thí điểm tại các quận 8, Tân Bình và TP Thủ Đức. Năm học 2024 - 2025, quận 8, Tân Bình và TP Thủ Đức đã thực hiện tuyển sinh đầu cấp theo hình thức trực tuyến và bằng bản đồ GIS. Bản đồ GIS sẽ quét nơi cư trú thực tế của học sinh và phân bổ trường học dựa trên cự ly từ nhà đến trường. Trong năm đầu tiên này, việc tuyển sinh đầu cấp tại các quận, TP này ban đầu cũng có những trục trặc, vướng mắc. Đó là những khó khăn như phụ huynh chưa làm theo nơi cư trú thực tế, phụ huynh chuyển con đi đến trường khác nhưng chưa rõ ràng... Và các quận, TP đã phải làm công tác xác định lại nơi cư trú thực tế của học sinh. Khó khăn thứ hai là với việc phân bổ chỗ học dựa trên tiêu chí chỗ ở thực tế sẽ cho phép học sinh đang cư trú tại địa bàn của quận đang là học sinh mầm non, lớp 5 ở ngoài quận được trở về để tuyển sinh ở trên địa bàn quận. Con số này ít, nhiều quận sẽ không dự báo chính xác được, đặc biệt là trong năm đầu tiên thực hiện. Với khó khăn này, quận 8 đã giải quyết bằng cách ba bậc học sẽ có ba trường tiên tiến hiện đại được tuyển trước khi các trường khác đồng loạt tuyển sinh một tuần.  Các trường này không tính toán tới địa bàn cư trú thực tế của học sinh mà tất cả học sinh trên địa bàn quận đều được tuyển hết, kể cả những học sinh nhà ở quận 8 mà học mầm non, tiểu học ở quận ngoài cũng được đăng ký xét tuyển vào đây. Sau khi công bố lấy đủ chỉ tiêu các trường này, các trường còn lại sẽ tuyển theo GIS. Khó khăn thứ ba chính là học sinh đã được tuyển sinh theo nơi ở thực tế nhưng lại không đúng nguyện vọng của gia đình. Quận 8 đã giải quyết khó khăn này bằng cách cho phụ huynh đăng ký xét tuyển vào những trường theo nguyện vọng ở đợt 2 và nếu trường còn chỉ tiêu thì vẫn mở để xét theo nguyện vọng của phụ huynh. Vì trên thực tế, có những trường gần nhà nhưng lại không tiện để cha mẹ đưa đón con. Nếu phụ huynh có nguyện vọng cho con học ở gần nơi công tác thì quận cũng xem xét giải quyết nếu còn chỗ. Theo ông Dương Văn Dân - trưởng phòng Giáo dục và Đào tạo quận 8, dù có những vướng mắc nhưng quận đã giải quyết được bài toán đó và năm nay tự tin để tiến hành việc tuyển sinh đầu cấp với tiêu chí chính là ""nơi ở của học sinh"". Các quận, huyện, TP tại TP.HCM năm nay bắt đầu thực hiện tuyển sinh theo tiêu chí nơi ở thực tế của học sinh cần áp dụng phù hợp vào địa phương mình. Từ đó lên kế hoạch về trường, lớp và đề xuất với Sở Giáo dục và Đào tạo TP.HCM trong việc thực hiện 100% theo nơi ở thực tế hay thực hiện từng phần dựa vào bài toán trường lớp hiện có. ",27/04/2024 08:48 GMT+7,https://tuoitre.vn/tp-hcm-tuyen-sinh-dau-cap-mam-non-lop-1-theo-noi-o-sao-cho-suon-se-20240426230204083.htm,"Ngành giáo dục TP.HCM đang đứng trước năm bản lề của việc tuyển sinh đầu cấp mầm non, lớp 1 với tiêu chí chính: nơi ở thực tế của học sinh, không phải theo nơi đăng ký thường trú hay chỗ học ở bậc học trước."
