Title,Content,Date,Url,Summary
"Vũng Tàu đông nghịt khách, phòng nghỉ, quán xá tăng giá","Ông Trịnh Hàng, giám đốc Sở Du lịch tỉnh Bà Rịa - Vũng Tàu, cho biết trong ngày 29-4, có khoảng 165.000 lượt khách đến tỉnh này nghỉ dưỡng, trong đó chủ yếu tắm biển để ""hạ nhiệt"" với hơn 110.000 khách, còn lại khoảng 52.000 ở lại lưu trú. Theo quan sát từ sáng 29-4, những con đường đổ về Vũng Tàu đông nghẹt xe cộ. Quốc lộ 51 có ùn ứ cục bộ. Do khách đến đông nên các quán xá, phòng nghỉ bình dân ở Vũng Tàu bắt đầu ""tăng nhiệt"". Trong khi các khách sạn lớn, resort sang đã được khách đặt trước có giá cả cụ thể thì giá các phòng nghỉ bình dân tùy thuộc vào chủ và lên giá theo nhu cầu.  Theo tìm hiểu có những phòng nghỉ tăng giá gấp 2 lần so với ngày thường. Công suất buồng ngày 29-4 đạt khoảng 85 - 95% toàn tỉnh. Những quán cà phê, ăn sáng cũng đông nghẹt du khách. Theo ước tính tổng doanh thu du lịch ngày 29-4 đạt hơn 182,5 tỉ đồng, riêng doanh thu lưu trú hơn 125,6 tỉ đồng.",29/04/2024 18:03 GMT+7,https://tuoitre.vn/vung-tau-dong-nghit-khach-phong-nghi-quan-xa-tang-gia-20240429173359667.htm,"Ngày 29-4, lượng du khách đổ về Bà Rịa - Vũng Tàu tăng so với các ngày trước. Du khách về biển để ‘hạ nhiệt’ vì thời tiết nóng nực thì phòng nghỉ bình dân, quán xá ‘tăng nhiệt’."
"Mỗi ngày cả ngàn khách ra Lý Sơn, chủ tịch huyện nói chỗ nghỉ thoải mái","Chiều 29-4, thống kê của Ban Quản lý cảng và cảng vụ đường thủy nội địa tỉnh Quảng Ngãi từ ngày 27 đến 29-4 có gần 7.000 du khách ra đảo Lý Sơn. Dù lượng khách đông nhưng tàu khách vẫn đáp ứng, còn chỗ lưu trú ở Lý Sơn vẫn đảm bảo. Tăng chục chuyến tàu đưa du khách ra Lý Sơn Theo ông Tạ Công Chức - phó giám đốc Ban Quản lý cảng và cảng vụ đường thủy nội địa tỉnh Quảng Ngãi, dịp lễ này lượng khách ra đảo Lý Sơn tăng gấp 4 lần ngày thường. Dù lượng khách tăng cao đột biến so với ngày thường nhưng tại cảng Sa Kỳ, ban quản lý đã sắp xếp, bố trí phương án đưa đón du khách dịp lễ từ sớm và hoàn toàn chủ động, không để khách chờ lâu vì không có tàu. Dịp lễ này, mỗi ngày có khoảng 15 - 18 chuyến di chuyển từ cảng Sa Kỳ ra đảo Lý Sơn. Bình quân 30 phút sẽ có một tàu khách xuất phát. Chính điều này đã giúp du khách thoải mái lựa chọn thời gian đi phù hợp với lịch trình. Ông Chức cho biết dựa trên số lượng khách đăng ký vé trước và dự đoán trong hai ngày lễ còn lại, lượng du khách ra đảo Lý Sơn sẽ giảm nhưng vẫn ở mức cao.  Phiền toái duy nhất cho du khách ra đảo Lý Sơn là thủ tục rời cảng được kiểm soát chặt. Vì vậy, du khách phải xếp hàng chờ làm thủ tục. Đây là điều dễ hiểu bởi những vấn đề an toàn khi di chuyển trên biển. Dịch vụ lưu trú tại đảo Lý Sơn đảm bảo Theo thống kê đảo Lý Sơn có hơn 130 nhà nghỉ, homestay và 7 khách sạn với hơn 1.000 phòng, có thể cùng lúc đáp ứng cho hơn 3.000 du khách. Số lượng du khách những ngày qua ra đảo Lý Sơn đông. Tuy nhiên đa phần du khách thăm thú nghỉ ngơi qua đêm, sáng hôm sau lại trở về thăm thú các điểm đến trong đất liền của tỉnh Quảng Ngãi. Vì vậy, Lý Sơn vẫn đảm bảo phòng cho du khách. Nhóm du khách 12 người từ TP Nha Trang sau hai ngày một đêm ra đảo Lý Sơn du lịch trở về cảng Sa Kỳ chiều 29-4, cho biết việc đi lại đến ăn uống, nghỉ ngơi... tại Lý Sơn đều ổn. Ra Lý Sơn, nhóm chọn ở homestay tại đảo Bé và tỏ ra rất hài lòng. Anh Thiện, một du khách, nói: ""Thời tiết nóng, đổi lại có gió và tắm biển, thăm nhiều danh lam thắng cảnh rất đẹp ở cả đảo Lớn và đảo Bé. Điều chúng tôi vui nhất là được trải nghiệm sống cùng người dân"". Bà Phạm Thị Hương - chủ tịch UBND huyện đảo Lý Sơn (tỉnh Quảng Ngãi) - cho hay kỳ nghỉ lễ 30-4 và 1-5 kéo dài 5 ngày, đến thời điểm này, tất cả khách sạn, nhà nghỉ, homestay đều đã được đăng ký, không còn phòng trống. Tuy vậy, du khách vẫn thoải mái ra đảo Lý Sơn thăm thú mà không lo thiếu phòng ngủ. Bởi đa phần du khách về sau một ngày nên số lượng phòng sẽ trống trở lại, dư sức đáp ứng nhu cầu của du khách mới. UBND huyện Lý Sơn đã tuyên truyền, yêu cầu các chủ nhà nghỉ, homestay, khách sạn… phải niêm yết giá công khai. Trường hợp thu lợi bất chính, nếu phát hiện địa phương sẽ xử lý nghiêm. ""Ngoài ra, UBND huyện cũng vận động người dân tham gia tạo điều kiện chỗ ở cho du khách theo phương thức ""du lịch cộng đồng"" nếu lượng du khách tăng cao hơn nữa và quá tải. Còn hiện tại Lý Sơn vẫn đáp ứng dịch vụ cho khách"", bà Hương nói.",29/04/2024 18:02 GMT+7,https://tuoitre.vn/moi-ngay-ca-ngan-khach-ra-ly-son-chu-tich-huyen-noi-cho-nghi-thoai-mai-20240429171041093.htm,"Nhiều người lo lắng việc du khách ra Lý Sơn quá đông sẽ quá tải chỗ lưu trú. Tuy nhiên, lãnh đạo huyện Lý Sơn khẳng định du khách cứ ra thăm đảo, chỗ lưu trú thỏa mái, đáp ứng nhu cầu."
Một khách sạn ở Hội An đỏ rực ấn tượng với 80 lá cờ Tổ quốc,"Khu lưu trú này nằm ở đường Đào Duy Từ, thành phố Hội An. Hình ảnh những khối nhà được trang hoàng đỏ rực cờ Tổ quốc nhiều ngày qua được cộng đồng mạng chia sẻ và gây hình ảnh ấn tượng. Trao đổi với Tuổi Trẻ Online, tổng quản lý khu lưu trú nói năm nay các nhân viên, quản lý của khu lưu trú muốn tạo ấn tượng cho du khách trong những ngày lưu trú dịp kỷ niệm lễ lớn. ""Khách sạn chúng tôi chủ yếu là khách quốc tế. Dịp lễ này có 80% phòng được khách đặt ở trong tổng số 54 phòng. Do có nhiều người ngoại quốc nên chúng tôi muốn khách hiểu về ý nghĩa của ngày 30-4, chia sẻ với niềm vui chung của người Việt Nam nên khu lưu trú quyết định mua cờ khổ lớn về treo ở ban công tất cả các phòng. Có 80 lá cờ được trang hoàng bao quanh khu lưu trú"" - tổng quản lý khu lưu trú chia sẻ. Theo vị tổng quản lý, sau khi cờ được treo đồng loạt lên các khối nhà lưu trú thì nhiều người đã tới chụp hình, đăng lên Facebook cá nhân. Nhiều khách cũng tò mò hỏi và được nhân viên giải thích đầy đủ về việc đồng loạt treo cờ này. Cả khách lẫn nhân viên khu lưu trú đều bày tỏ niềm vui. Hội An là thành phố du lịch mà khách lưu trú đa phần là khách quốc tế. Mỗi dịp 30-4 hay 2-9 một số khu lưu trú đều tổ chức lồng ghép các chương trình để khách tìm hiểu về lịch sử Việt Nam. Riêng việc đồng loạt treo cờ rực rỡ, trang hoàng ở khu lưu trú thì khá hiếm. ",29/04/2024 17:56 GMT+7,https://tuoitre.vn/mot-khach-san-o-hoi-an-do-ruc-an-tuong-voi-80-la-co-to-quoc-20240429164111426.htm,"Để giới thiệu cho du khách về ngày lễ trọng đại của Việt Nam, một khu lưu trú chuyên dòng khách quốc tế ở Hội An đã đồng loạt treo cờ ở tất cả các ban công trong dịp nghỉ lễ 30-4, 1-5."
Huyền thoại nhạc Jazz Chico Freeman ấn tượng khi dự khai hội Tháp Bà Ponagar Nha Trang,"Diễn ra từ 28-4 đến 1-5 (tức ngày 20 đến 23-3 âm lịch), lễ hội Tháp Bà Ponagar năm nay trùng với dịp nghỉ lễ 30-4 và 1-5 nên du khách đến tham gia đông hơn những năm trước. Trong số đó có huyền thoại nhạc Jazz Chico Freeman. Ông đang ở Nha Trang những ngày qua để tham gia Liên hoan nhạc Jazz quốc tế tại Nha Trang. Chico Freeman bày tỏ ấn tượng khi tham gia lễ hội truyền thống này tại Việt Nam. Ông chia sẻ: ""Tôi rất thích thú với màu sắc của lễ hội truyền thống tại Việt Nam, mọi người tụ tập rất đông với những trang phục rực rỡ khiến không gian ở đây cực kỳ nhộn nhịp, những giai điệu từ những nhạc cụ và nghệ sĩ biểu diễn tại đây cũng khiến tôi rất ấn tượng"". Lễ hội Tháp Bà Ponagar tôn vinh bà Thiên Y A Na - người Mẹ xứ sở Lễ hội Tháp Bà Ponagar diễn ra với các nghi thức truyền thống như: lễ thay y Mẫu, lễ cầu quốc thái dân an, lễ cúng thí thực, lễ cúng giờ tý, lễ khai diên, lễ tôn vương… Bên cạnh đó, còn có hoạt động dâng hương lễ Mẫu của các đoàn khách hành hương, người dân, du khách trong suốt thời gian diễn ra lễ hội. Ông Lê Văn Hoa - phó giám đốc Sở Văn hóa và Thể thao tỉnh Khánh Hòa - cho biết đây là dịp để tôn vinh bà Thiên Y A Na - người Mẹ xứ sở, qua đó nhằm góp phần nêu cao tinh thần trách nhiệm của các ban ngành và nhân dân trong việc bảo tồn và phát huy giá trị văn hóa truyền thống tiêu biểu ở Khánh Hòa đến người dân, du khách trong nước và quốc tế. ""Vì trùng với dịp nghỉ lễ, lễ hội năm nay có khoảng 100 đoàn khách đăng ký dự lễ. Ước tính đón khoảng 70.000 lượt khách hành hương, tham quan. Trong đó, có gần 4.000 đồng bào dân tộc Chăm tại địa phương và các tỉnh lân cận về với lễ hội"" - ông Hoa thông tin. Ngay ngày đầu lễ hội, rất đông người dân và du khách về tham dự với số lượng khoảng hơn 10.000 người. Ban tổ chức đã chuẩn bị đầy đủ cơ sở vật chất, hướng dẫn các đoàn hành hương và du khách đi lễ đảm bảo trật tự, an toàn. Tham gia lễ hội cùng gia đình, chị Miễu Nữ Di Quyên (du khách Ninh Thuận) bày tỏ niềm vui khi lần đầu tiên được đến với lễ hội Tháp Bà Ponagar. ""Đối với đồng bào người Chăm chúng tôi, lễ hội tại Tháp Bà rất ấn tượng vì quy mô lớn và được tổ chức bài bản, mong rằng không những người dân địa phương hay các tín đồ đến hành hương mà cả những du khách quốc tế, lễ hội này sẽ để lại những ấn tượng nhất định khi đến với TP Nha Trang"" - chị Quyên nói.",29/04/2024 15:34 GMT+7,https://tuoitre.vn/huyen-thoai-nhac-jazz-chico-freeman-an-tuong-khi-du-khai-hoi-thap-ba-ponagar-nha-trang-20240429132601297.htm,"Sáng 29-4, lễ hội Tháp Bà Ponagar (TP Nha Trang, Khánh Hòa) chính thức khai mạc, thu hút hàng ngàn người dân và du khách thập phương đến tham gia, trong đó có huyền thoại nhạc Jazz Chico Freeman."
99% khách tới Thánh địa Mỹ Sơn trong kỳ nghỉ lễ là khách quốc tế,"Trao đổi với Tuổi Trẻ Online ngày 29-4, ông Nguyễn Công Khiết, phó giám đốc phụ trách Ban quản lý Di sản văn hóa Mỹ Sơn, cho biết khách tham quan Mỹ Sơn hai ngày đầu kỳ nghỉ lễ có tăng nhưng số lượng không nhiều. 100% khách tới tham quan là khách quốc tế từ Ấn Độ, Úc, Đài Loan… Cụ thể ngày 27-4 có 1.793 khách tham quan, tương đương với gần 190 triệu đồng tiền vé. Ngày 28-4 có 1.440 khách, tiền vé thu được (gồm cả vé tham quan và vé dịch vụ) là trên 200 triệu đồng. Số khách nội địa tham quan Mỹ Sơn mỗi ngày chỉ loanh quanh chừng 100 lượt. Về số lượng khách tham quan hai ngày đầu tiên trong kỳ nghỉ dài ngày dịp 30-4, 1-5, ông Khiết cho biết có tăng nhưng không nhiều. Thậm chí con số này tương đương với một vài ngày trong tháng 4. ""Do tính chất đặc thù của di sản Mỹ Sơn nên khách đến đa phần là khách quốc tế. Dịp lễ 30-4, 1-5 này chủ yếu là kỳ nghỉ của khách nội địa. Cho nên lượng vé bán ra ở Mỹ Sơn không có nhiều thay đổi"", ông Khiết nói. Khu đền tháp Mỹ Sơn gần đây đã ghi nhận sự phục hồi du lịch mạnh mẽ. Nhiều hạng mục, chương trình phục vụ tham quan được đầu tư khiến điểm đến này ngày càng hấp dẫn. Đặc biệt mới đây kết quả khảo cổ học đã công bố việc tồn tại một con đường thiêng bí mật dẫn vào hướng ngược lại với lối tham quan lâu nay khiến Mỹ Sơn thêm thu hút du khách. Trong quý 1 vừa qua, khu đền tháp Mỹ Sơn đón gần 123.000 lượt khách, tăng 46,8% so với cùng kỳ năm ngoái. Trong đó, khách quốc tế ước đạt gần 110.000 lượt, khách Việt khoảng hơn 12.400 lượt.",29/04/2024 15:21 GMT+7,https://tuoitre.vn/99-khach-toi-thanh-dia-my-son-trong-ky-nghi-le-la-khach-quoc-te-20240429103849169.htm,"Những ngày cao điểm lễ, khách tới tham quan tại khu đền tháp Mỹ Sơn (huyện Duy Xuyên, tỉnh Quảng Nam) ghi nhận không tăng so với ngày thường, trong đó khách quốc tế chiếm tỉ lệ gần như tuyệt đối."
Điểm trường Tắk Pổ đẹp lung linh qua mắt nhóm bạn du lịch kết hợp thiện nguyện,"Theo anh Nguyễn Bình Nam (ngụ tại Đà Nẵng), anh cùng nhóm bạn ở Đà Nẵng, Quảng Nam đã chọn kỳ nghỉ lễ bằng cách lên núi cao cắm trại, nấu ăn cho trẻ em nghèo ở nóc Tắk Pổ thay vì ở lại thành phố . Tắk Pổ không xa lạ  Cả nhóm chọn nóc Tắk Pổ, xã Trà Tập, huyện Nam Trà My, tỉnh Quảng Nam để dựng lều trại nghỉ ngơi vui chơi qua đêm. Để chuyến đi ý nghĩa hơn, các thành viên đã tổ chức nấu các món ăn rồi mời gọi bà con cùng trẻ nhỏ trong nóc Tắk Pổ cùng thưởng thức. Trong những ngày cao điểm nắng nóng như thiêu đốt ở miền Trung, ở các vùng núi cao tỉnh Quảng Nam nhiệt độ dịu hơn. Nóc Tắk Pổ nằm trên lưng chừng đồi của sườn núi Ngọc Linh, bà con ở đây gồm 35 hộ, tất cả là đồng bào địa phương sống dựa vào rừng núi. Tắk Pổ là cái tên không xa lạ với nhiều người từ những năm 2019 trở đi. Đây là nóc làng gắn với hình ảnh ngôi trường Tắk Pổ đơn sơ mọc lên như ụ nấm bạc lơ lửng dưới những hàng cau già.  Ở đó, dù gian khó, cách trở nhưng có những cô giáo trẻ tuổi đôi mươi đã dành những năm tháng thanh xuân để dạy học. Điểm đến thiện nguyện  Sau khi câu chuyện về Tắk Pổ được báo Tuổi Trẻ Online đăng tải, các nhà hảo tâm khắp cả nước đã tìm về điểm trường đơn sơ này để thăm cô trò. Nóc làng đẹp như trong tranh hiện lên giữa chân mây đã đốn tim nhiều người. Năm 2022, ngôi trường Tắk Pổ bằng bê tông cốt thép, khang trang sạch sẽ với quy mô gần 1,4 tỉ đồng đã được những tấm lòng thiện nguyện góp công góp của dựng lên.  Ngôi trường như biểu tượng về sự cổ vũ tiếp sức của cộng đồng với nỗ lực dạy học trên vùng cao của những giáo viên tuổi đôi mươi. Tắk Pổ từ đó trở thành một điểm đến của những chuyến du lịch thiện nguyện, địa điểm check in cắm trại nổi tiếng.",29/04/2024 13:13 GMT+7,https://tuoitre.vn/diem-truong-tak-po-dep-lung-linh-qua-mat-nhom-ban-du-lich-ket-hop-thien-nguyen-20240429085838915.htm,"Dành kỳ nghỉ lễ dài ngày để lên nóc Tắk Pổ (huyện Nam Trà My, tỉnh Quảng Nam) du lịch kết hợp thiện nguyện, nhóm bạn trẻ tại Đà Nẵng đã ghi lại những hình ảnh đẹp lung linh của ngôi làng giữa lưng chừng núi."
Chiều nay ở Đà Lạt được nghe hòa nhạc kèn clarinet với đàn tranh,"Trong 2 khung giờ: 16h - 18h và 19h - 21h ngày 29-4, người dân và du khách tại Đà Lạt được thưởng thức miễn phí chương trình hòa nhạc của 2 nghệ sĩ Anna Koch và nghệ sĩ đàn tranh Thu Quyến.  Chương trình diễn ra tại Phố Bên Đồi Creative Studio (bên trong Trung tâm Thanh thiếu niên tỉnh Lâm Đồng, số 10 Lý Tự Trọng, Đà Lạt). Đây là chương trình Connecting the Dots do Đại sứ quán Áo phối hợp với UBND TP Đà Lạt, Phố Bên Đồi Creative Studio thực hiện.  Tại chương trình, 2 nghệ sĩ Áo và Việt Nam sẽ kết hợp với nhau thông qua sự kết nối của âm nhạc và 2 nhạc cụ: kèn clarinet và đàn tranh.  Cả 2 nghệ sĩ sẽ cùng biểu diễn một số bản nhạc đương đại phương Tây và Việt Nam thân quen. Theo ban tổ chức, đây là một sự kết hợp độc đáo và phù hợp. Anna Koch là nghệ sĩ chơi kèn clarinet, là một nhạc sĩ chuyên nghiệp, chuyên sáng tác âm nhạc đương đại và trình diễn ngẫu hứng.  Cô đã dành thời gian theo học tại Đại học Âm nhạc và Diễn xuất Vienna, tốt nghiệp danh dự vào năm 2017.  Cô được trao học bổng 'Start Stipendium Musik' năm 2020 từ Bộ Văn hóa và Nghệ thuật Liên bang Áo.  Anna Koch đã biểu diễn dưới dạng nghệ sĩ solo và nghệ sĩ hòa nhạc tại các hội chợ âm nhạc như Wien modern, Bang on a Can (Mỹ), Klangspuren Schwaz, Impuls Konzerte Graz, Styriarte và Expo Shanghai (2010). Còn nghệ sĩ đàn tranh Thu Quyến tốt nghiệp loại xuất sắc chuyên ngành đàn tranh Trường Quốc gia âm nhạc Huế (nay là Học viện Âm nhạc Huế).  Hiện tại cô đang mở các lớp đào tạo đàn tranh tại gia với mong muốn truyền lửa đam mê và tình yêu âm nhạc nhạc cụ dân tộc cho thế hệ trẻ để vốn quý này được tiếp nối.",29/04/2024 12:33 GMT+7,https://tuoitre.vn/chieu-nay-o-da-lat-duoc-nghe-hoa-nhac-ken-clarinet-voi-dan-tranh-20240429120440657.htm,Người dân và du khách tại Đà Lạt sẽ được thưởng thức miễn phí chương trình hòa nhạc do nghệ sĩ kèn clarinet Anna Koch (người Áo) và nghệ sĩ đàn tranh Thu Quyến thực hiện.
Nhiều điểm du lịch ở Cần Thơ mất khách do nắng nóng,"Ngày 29-4, theo ghi nhận của PV Tuổi Trẻ Online tại một số địa điểm du lịch của TP Cần Thơ, số lượng khách đến vui chơi và trải nghiệm các sản phẩm du lịch có giảm so với cùng kỳ năm ngoái. Theo đó, trong kỷ nghỉ lễ kéo dài này, thời tiết nắng nóng bức, nền nhiệt độ dao động từ 37-39 độ C có thể là một trong những nguyên nhân khiến nhiều du khách ngại ra đường, không muốn đi du lịch. Ông Lê Hải Phúc - giám đốc Làng du lịch sinh thái Ông Đề (huyện Phong Điền, TP Cần Thơ) - cho biết những ngày qua có khoảng 400-500 lượt khách/ngày đến đây vui chơi dù nơi này có không gian mát mẻ, nhiều cây xanh, có hồ bơi... ""Thời điểm này năm rồi chỗ chúng tôi đón từ 600-700 lượt khách/ngày. Có thể do nắng nóng kéo dài nên lượng khách đến khu du lịch không bằng những kỳ nghỉ lễ trước đó"", ông Phúc nói. Tương tự, tại những địa điểm du lịch khác như bến Ninh Kiều, chợ cổ Cần Thơ... lượng khách cũng không nhiều. Ông Nguyễn Hoàng Tuấn - giám đốc Thúy Nga Mekong Travel (quận Ninh Kiều, TP Cần Thơ) - cho biết những ngày qua đơn vị đón khoảng 5 đoàn khách/buổi sáng. Cùng thời điểm năm ngoái là 10 đoàn khách/buổi sáng. ""Kỳ nghỉ này có thể cái nắng gay gắt của thời tiết cũng làm ảnh hưởng ít nhiều đến việc vui chơi của du khách gần xa… Dù ít hay nhiều khách thì chúng tôi cũng phục vụ chu đáo để du khách có những trải nghiệm thú vị nhất về đất và con người xứ Tây Đô, nhất là đối với khách nước ngoài..."" - ông Tuấn nói.",29/04/2024 12:00 GMT+7,https://tuoitre.vn/nhieu-diem-du-lich-o-can-tho-mat-khach-do-nang-nong-20240429105734445.htm,Thời tiết nắng nóng oi bức tại TP Cần Thơ đã ảnh hưởng phần nào đến kế hoạch chơi lễ của nhiều người.
"Suối Tà Má ở Bình Định có gì mà khách Tây, khách ta đều mê?","Trong những ngày nắng nóng hiện nay, mỗi ngày con suối Tà Má đón hàng ngàn du khách đến vui chơi, tắm mát, ăn uống, giải trí cùng gia đình, bạn bè. Suối Tà Má là con suối rất nổi tiếng tại Bình Định. Bên cạnh dòng nước trong vắt, mát lạnh chảy suốt không ngừng, thì dọc đôi bờ suối dài khoảng 2km là dãy cây hoa vàng anh (còn gọi là hoa trang).  Có năm, hoa vàng anh nở rực cả một vùng không gian rộng lớn, khiến hàng trăm du khách mê mẩn vẻ đẹp tự nhiên và lãng mạn của nơi này. Ở thời điểm hiện tại, mặc dù hoa vàng anh không nở rộ, nhưng không vì thế mà sức hấp dẫn của con suối Tà Má bị suy giảm. Ngược lại, hàng ngàn du khách vẫn nườm nượp về đây trong những ngày nghỉ lễ 30-4 và 1-5 này. Để phục vụ khách, người dân đã dựng hàng trăm chòi lá, cột kèo bằng những cây tre mộc mạc dọc hai bên bờ suối. Đây cũng là nơi để du khách dừng chân nghỉ ngơi, nấu nướng, ăn uống. Từ người lớn cho đến trẻ em, ai nấy cũng tỏ ra háo hức trước khung cảnh thiên nhiên thanh bình, mát mẻ nơi đây. Những trò nghịch nước, tắm suối là lựa chọn hàng đầu của rất nhiều du khách. Chị Nguyễn Thanh Mai (ở Gia Lai) cho biết: ""Năm nào tôi cũng đến đây chơi. Suối Tà Má rất đẹp, nước trong và mát lạnh. Tôi và gia đình vô cùng thoải mái khi đến nơi này thư giãn. Các con của tôi rất thích tắm suối. Giữa mùa hè nóng bức oi ả mà tới suối Tà Má là thấy mát rượi"". Trong khi đó, lần đầu tiên đến suối Tà Má, anh Skipp (21 tuổi, đến từ Ireland) tỏ ra rất thích thú trước cảnh vật và con người nơi đây.  ""Tôi cực thích nơi này. Con suối này quá đẹp và yên bình. Mọi thứ đều xanh mát. Tôi thấy mọi người đến đây đều rất vui vẻ. Đặc biệt, người dân lúc nào cũng thân thiện, vui vẻ. Đồ ăn ở đây cũng rất ngon. Ở đây giống như một bức tranh rất đẹp. Các bạn thật may mắn"", anh Skipp cho hay.",29/04/2024 11:22 GMT+7,https://tuoitre.vn/suoi-ta-ma-o-binh-dinh-co-gi-ma-khach-tay-khach-ta-deu-me-20240429095710138.htm,"Dưới cái nóng gần 40 độ C, nhiều du khách trong và ngoài nước đổ về suối Tà Má ở huyện miền núi Vĩnh Thạnh (tỉnh Bình Định) để vui chơi, giải nhiệt."
