Title,Content,Date,Url,Summary
"Bella Vũ hát Hello Vietnam với sáo, đàn tranh, tì bà và piano","Tối 27-4, Bella Vũ lấy được cảm tình của khán giả khi cô thể hiện tài năng chơi đàn piano, hát trong một buổi hòa nhạc được tổ chức tại TP.HCM. Góp mặt trong đêm nhạc Bella Vũ - Steinway Piano Recital có nghệ sĩ Nguyễn Long An - người hướng dẫn Bella Vũ chơi đàn piano từ nhỏ, anh trai Oscar Vũ… và Dàn nhạc học sinh quốc tế Sài Gòn (SISO). Làm mới ca khúc tiếng Pháp với nhạc cụ dân tộc Bella Vũ kết hợp cùng pianist Nguyễn Long An và Dàn nhạc học sinh quốc tế Sài Gòn qua tác phẩm Eine Kleine Nachtmusik. Đây là một trong những sáng tác nổi tiếng của nhà soạn nhạc Wolfgang Amadeus Mozart. Phần biểu diễn ăn ý của Bella Vũ và nghệ sĩ Nguyễn Long An nhận được sự cổ vũ nhiệt tình của khán giả. Sau đó, Bella Vũ tiếp tục chinh phục khán giả qua ca khúc dân ca của Ý mang tên Bella Ciao. Cô thể hiện qua tiếng đàn piano của pianist Nguyễn Long An. Bella Vũ Huyền Diệu đưa khán giả đến với không gian nhiều cảm xúc cho chơi solo piano bản Sonatine No.3 của nhạc sĩ Muzio Clementi. Phần kết hợp giữa Bella Vũ và anh trai Oscar Vũ qua ca khúc nhạc phim Cướp biển vùng Caribê - Pirates Of The Caribbean của nhạc sĩ Hans Zimmer khiến khán giả thích thú. Bella Vũ cho biết hai anh em chơi đàn piano từ nhỏ tuy nhiên không mấy hòa hợp nhau bởi sự năng động của anh trai. Việc kết hợp cùng nhau được xem là ""kỳ tích"". Đặc biệt, Bella Vũ làm mới ca khúc tiếng Pháp do nhạc sĩ Marc Lavoine sáng tác mang tên Hello Vietnam. Bella Vũ hát chính cùng tiếng đệm đàn piano của nghệ sĩ Nguyễn Long An cùng các thành viên của SISO chơi đàn tranh, đàn tì bà và sáo. Ca khúc quen thuộc này một lần nữa được khoác màu sắc mới mẻ cho người nghe. Ngoài ra, cô cũng thể hiện ca khúc Một vòng Việt Nam (sáng tác Đông Thiên Đức) với sự kết hợp của loại nhạc cụ dân tộc và đàn piano khiến khán giả cảm nhận được tài năng của cô. Hơn 10 năm gắn bó với piano Từ nhỏ, Bella Vũ được gia đình cho thử sức qua nhiều loại nhạc cụ khác nhau. Tuy nhiên cô bị sức hút bởi đàn piano và gắn bó hơn 10 năm qua và đoạt nhiều thành tích trong các cuộc thi piano. Người thầy dìu dắt và dạy Bella Vũ khi mới 7 tuổi là nghệ sĩ Nguyễn Long An. Với sự nỗ lực, Bella Vũ góp mặt trong đội hình chính thức của Dàn nhạc học sinh quốc tế Sài Gòn SISO. Những giải thưởng Bella Vũ đoạt được trong những năm qua như giải bạc piano solo tại Liên hoan nghệ thuật châu Á năm 2015; giải bạc piano duel, giải đồng hát và đệm đàn piano tại cuộc thi này năm 2016. Đến năm 2022, Bella Vũ đoạt giải vàng thanh nhạc và giải bạc đàn piano tại Liên hoan nghệ thuật châu Á lần thứ 9. Năm vừa rồi, cô đoạt huy chương vàng piano solo tại Lễ hội nghệ thuật quốc tế IAF 2023, là một trong 12 đại biểu diễn thuyết tại Hội nghị và giải thưởng lãnh đạo Thanh niên toàn cầu 2023. Đêm nhạc Bella Vũ - Steinway Piano Recital như là một món quà Bella Vũ dành tặng khán giả đã luôn yêu thương, dõi theo chặng đường nghệ thuật của cô.",28/04/2024 07:30 GMT+7,https://tuoitre.vn/bella-vu-hat-hello-vietnam-voi-sao-dan-tranh-ti-ba-va-piano-20240428061142445.htm,"Ca khúc Hello Vietnam, Một vòng Việt Nam được nhiều ca sĩ thể hiện thành công nhưng Bella Vũ làm mới hai ca khúc này khi kết hợp giữa nhạc cụ phương Tây và Việt Nam."
"'Thiên vương' Kim Jae Joong vẫn đẹp không tuổi, thắc mắc sao fan Việt hết đòi... 'cưới em'","Tối 27-4 đã diễn ra sự kiện fan concert (đêm nhạc dành riêng cho người hâm mộ) của ca sĩ Kim Jae Joong có tên ""Kim Jae Joong special J-party in Vietnam - I'm Twenty"". Fan concert không chỉ là một đêm diễn ca nhạc thông thường, ngoài lắng nghe idol biểu diễn, người hâm mộ còn có cơ hội giao lưu, tâm sự cùng ""vị thần phương Đông"" trong khuôn khổ sự kiện này. Đêm diễn được tổ chức tại nhà thi đấu Quân khu 7, TP.HCM. Việt Nam là một trong những điểm dừng chân của ""thiên vương"" Kim Jae Joong trong chuỗi sự kiện trải dài qua nhiều quốc gia và vùng lãnh thổ. Chàng idol sắp U40 vẫn cháy hết mình Đây là một trong những sự kiện được mong đợi nhất của cộng đồng hâm mộ K-pop tại TP.HCM. I'm Twenty thu hút hơn 3.000 khán giả tham dự, xuyên suốt chương trình, ánh xanh lá, đỏ phủ rợp hội trường, đây là 2 màu chủ đạo lightstick của ca sĩ Kim Jae Joong. Giá vé sự kiện cũng không hề rẻ khi vé thuộc hàng thấp nhất đã có giá 1,5 triệu đồng, vé hàng VIP thì giá lên đến 5 triệu đồng. Dẫu đắt đỏ như vậy, hầu hết các hàng ghế đều được lấp đầy. Vừa xuất hiện, ""thiên vương"" Kim Jae Joong đã khiến khán đài nổ tung với tiếng hò hét.  Thậm chí có người còn khóc nấc lên khi nam ca sĩ nói câu ""cảm ơn"" bằng tiếng Việt. Chàng ca sĩ sắp U40 không quên hỏi thăm người hâm mộ rằng họ chờ đợi mình có lâu không, thời tiết TP.HCM nóng vậy các bạn xếp hàng có mệt không một cách đầy tình cảm. Mở màn đêm diễn, Kim Jae Joong đã ""cháy"" hết mình với bản hit Mirotic đầy thương nhớ, tuy không cần nói ra, cả hội trường đều hiểu dụng ý tri ân những thành viên DBSK (hay TVXQ) xưa kia. Trong một đoạn phim hậu trường được ê kíp của Kim Jae Joong thực hiện, anh cũng đã tâm sự rằng sự kiện DBSK tan rã đã khiến anh và người trong cuộc vô cùng tổn thương, anh vẫn còn đau đáu sự kiện đó hơn 1 thập kỷ qua. Kim Jae Joong: ""Hình như fan Việt già hết rồi thì phải?"" Chương trình còn có khoảng 30 phút để Kim Jae Joong giao lưu, giải đáp những câu hỏi của khán giả.  Tại đây, Kim Jae Joong phải đón nhận những câu hỏi dí dỏm từ người hâm mộ Việt như: ""Anh cho em mượn 10 triệu won được không?""; ""Anh đã nói ta cùng nhau già đi, sao chỉ có fan già đi?""... khiến cho chàng idol U40 cười khúc khích. Ngoài ra, có những câu hỏi thực sự nghiêm túc như xin được tư vấn công việc, lời khuyên cuộc sống, cách cư xử ở môi trường công sở, lan tỏa năng lượng chống lão hóa sau tuổi 30, làm thế nào để ba mẹ yên tâm khi 28 tuổi vẫn chưa muốn kết hôn,… Kim Jae Joong cũng giải đáp thắc mắc cho fan một cách chân thành, nhưng anh cũng không khỏi cảm thán rằng có lẽ fan Việt đã già thật rồi, vì trước đây khi đi lưu diễn, các câu hỏi anh nhận được đều là: ""Em muốn ôm anh có được không?"" hoặc ""Em muốn cưới anh được không?""... Quả thật, người hâm mộ của nam ca sĩ hầu như là thế hệ đầu 9X, những người hâm mộ K-pop gen 1, gen 2. Khi được idol hỏi trong khán đài đã có ai ngoài 30 thì hơn nửa số fan tại đây đã đưa tay lên hưởng ứng.",28/04/2024 07:12 GMT+7,https://tuoitre.vn/thien-vuong-kim-jae-joong-van-dep-khong-tuoi-thac-mac-sao-fan-viet-het-doi-cuoi-em-20240428055214564.htm,"Giao lưu với khán giả Việt Nam trong fan concert của mình, Kim Jae Joong không khỏi trăn trở rằng: 'Phải chăng người hâm mộ Việt Nam đã già?'."
Du khách thú vị thưởng thức Liên hoan Jazz quốc tế bên bờ biển Nha Trang,"Chương trình do Bộ Văn hóa, Thể thao và Du lịch phối hợp với UBND tỉnh Khánh Hòa tổ chức. Đây là chương trình jazz quốc tế lần đầu tiên được tổ chức tại Việt Nam và cũng là lần đầu tiên được tổ chức tại TP Nha Trang. Liên hoan Jazz quốc tế với sự tham gia của hơn 100 nghệ sĩ, ban nhạc Việt Nam và các nghệ sĩ, ban nhạc quốc tế đến từ Mỹ, Singapore và Hàn Quốc với đa dạng về thể loại từ classic, bossa nova tới jazz funk, world music... Các nghệ sĩ nổi tiếng tham gia chương trình như Chico Freeman, Thu Minh, Tùng Dương, nhạc sĩ Nguyễn Hải Phong... Phát biểu tại đêm khai mạc, ông Tạ Quang Đông - thứ trưởng Bộ Văn hóa, Thể thao và Du lịch - chia sẻ:  ""Liên hoan Jazz quốc tế lần thứ I - Nha Trang 2024 sẽ giới thiệu những nét đẹp, dòng chảy jazz tại Việt Nam đến cho nhân dân, du khách. Đồng thời giới thiệu Nha Trang - Khánh Hòa là điểm đến âm nhạc, văn hóa đậm đà bản sắc dân tộc, qua đó góp phần vào nền công nghiệp văn hóa của Việt Nam"". Chị Lê Thanh Xuân, du khách Bình Dương, thích thú nói: ""Tôi và gia đình đến Nha Trang du lịch dịp lễ 30-4, 1-5 đây là lần đầu tiên tôi được nghe nhạc jazz ngay tại quảng trường view biển, được nghe các bản nhạc jazz cổ điển nhưng phối lại rất mới mẻ. Chương trình này rất hay, phù hợp cho du khách thưởng thức hằng đêm trong dịp nghỉ lễ"". Theo đó, chương trình được xây dựng sẽ là chuỗi hoạt động biểu diễn âm nhạc quy mô quốc tế được tổ chức thường niên tại Nha Trang, thu hút khách du lịch trong nước và quốc tế, để Nha Trang trở thành điểm đến của du lịch và âm nhạc. Chương trình kéo dài 5 đêm từ ngày 27-4 đến hết ngày 1-5. Tại quảng trường 2 Tháng 4 (biểu diễn các đêm 27, 29-4 và 1-5) và tại sân bóng Thanh Niên (biểu diễn các đêm 28, 30-4).",28/04/2024 06:16 GMT+7,https://tuoitre.vn/du-khach-thu-vi-thuong-thuc-lien-hoan-jazz-quoc-te-ben-bo-bien-nha-trang-20240427223306804.htm,"Tối 27-4, hàng ngàn người dân, du khách đã đến quảng trường 2 Tháng 4, TP Nha Trang (Khánh Hòa) để thưởng thức các tiết mục hấp dẫn trong chương trình Liên hoan Jazz quốc tế lần thứ I - Nha Trang 2024 lần đầu tiên được tổ chức tại Việt Nam."
Tin tức giải trí 27-4: Lật mặt 7 thu hơn 50 tỉ đồng sau ba ngày công chiếu,"'Lật mặt 7' thu hơn 50 tỉ đồng  Theo số liệu của đơn vị thống kê Box Office Vietnam, tính đến chiều 27-4, Lật mặt 7: Một điều ước đứng đầu bảng xếp hạng phim chiếu rạp có doanh thu cao với hơn 51 tỉ đồng. Doanh thu trên đã bao gồm tiền thu được từ suất chiếu sớm. Phim điện ảnh mới của đạo diễn Lý Hải sớm vượt mốc 50 tỉ trong hai ngày cuối tuần sau khi nhà sản xuất đăng lịch trình gặp gỡ, giao lưu khán giả tại các cụm rạp lớn ở TP.HCM, Hà Nội. Đến thời điểm hiện tại, doanh thu trong ngày 27-4 của Lật mặt 7: Một điều ước hơn 13 tỉ đồng với hơn 4.000 suất chiếu, gấp bốn lần phim Vây hãm: Kẻ trừng phạt, tác phẩm có doanh thu đứng thứ 2 phòng vé Việt. Trước đó, phim cũng lập kỷ lục tác phẩm Việt có lượng vé bán trước trong 6 ngày đầu tiên cao nhất lịch sử với 105.000 vé. Khán giả than não phải hoạt động liên tục khi xem 'Vũ trụ VFC ngoại truyện' Tối 27-4, tập đầu tiên Vũ trụ VFC ngoại truyện đã lên YouTube VTVgo và các nền tảng số của VTV.  Lấy câu chuyện từ tập mới nhất của phim Người một nhà, diễn viên Duy Hưng sau khi gặp lại mẹ đã lang thang ra hồ thì gặp Doãn Quốc Đam, diễn viên mà anh đóng chung trong phim Quỳnh búp bê.  Từ đó họ đóng vai trò kết nối, cùng với Phương Oanh, Anh Đào, Đình Tú… diễn tiểu phẩm, lồng ghép loạt phim do VFC sản xuất có sự xuất hiện của các diễn viên này như: Quỳnh búp bê, Hương vị tình thân, Gặp em ngày nắng.  Diễn viên Phương Oanh bụng bầu sấp mặt cũng xuất hiện trong tập này. Vì lồng ghép thông tin các phim VFC sản xuất đan xen liên tục nên khán giả xem tập này than: “Xem cái này não phải hoạt động nhiều quá”, “Khó thế mà cũng nghĩ ra”. Thậm chí, có ý kiến cho rằng: “Phim Việt có mấy diễn viên mài đi mài lại nhẵn hết cả mặt!”. Hòa Minzy xúc động với 'Mái ấm gia đình Việt' Trong tập 81 Mái ấm gia đình Việt lên sóng tối qua, ca sĩ Hòa Minzy và diễn viên Kiều Minh Tuấn là khách mời tham gia. Họ vượt qua thử thách mà ban tổ chức đặt ra để mang tiền thưởng về hỗ trợ các em nhỏ có hoàn cảnh khó khăn. Câu chuyện của em Võ Lê Thanh Châu khiến Hòa Minzy, Kiều Minh Tuấn không khỏi xót xa. Cậu bé hiện sống cùng chị gái và bà nội trong căn nhà đã xuống cấp, sau khi mẹ mất, còn cha có gia đình mới.  Bà nội Thanh Châu đã 88 tuổi, bị bệnh nặng không thể tự lo cho bản thân. Do đó, bác ở cạnh nhà phải chăm sóc bà, đồng thời lo cơm nước cho các cháu. Hòa Minzy nhắn nhủ đến cô bé mồ côi: “Thật ra nếu mẹ con may mắn còn sống và sinh con ra chính là niềm hạnh phúc của mẹ trong cuộc sống. Mẹ đã vượt qua mọi khó khăn để sinh con ra dù mẹ không còn nhưng cô cũng tin mẹ đã hạnh phúc vì thấy hai chị em che chở, bao bọc lẫn nhau”. Sau chương trình, Kiều Minh Tuấn cũng dành tặng mỗi gia đình một phần quà đặc biệt. Còn Hòa Minzy quyết định bỏ tiền túi tặng cho các gia đình tham gia.  Thắng Ngọt tung MV 'Nó'  Đây là một cú “quay xe” khiến không ít khán giả bất ngờ. Sản phẩm do Thắng phối khí và sản xuất, đậm chất RnB, alternative. MV do Phương Vũ và Antiantiart đảm nhận. Về tổng thể, đây là một sản phẩm mang đậm dấu ấn cá nhân của cả ba. Vừa cho thấy cá tính của Thắng, màn kết hợp đúng chất và mượt mà của Datmaniac và độc lạ của Phương Vũ cùng Antiantiart. Trước đó, trên trang Facebook cá nhân, rapper Datmaniac chia sẻ anh nhận được demo của Thắng trong một ngày khá đặc biệt: “Thắng kêu viết về nó đi chỉ vậy thôi. Nói chung mình rất mãn nguyện”. Ca khúc viết về những vòng quay nhàm chán, lặp đi lặp lại và chật chội trong cuộc sống thường nhật và trôi trong bao điều vô nghĩa lý.  Song ca khúc cũng đang tạo ra một thảo luận trên mạng vì ở phần Datmaniac, có một số câu, từ ngữ có trong bài hát dễ dẫn đến suy diễn như: “Đi với nhau qua được hoang mạc/ Tương lai tới đâu khi thành ban nhạc/ Anh là tay trống, tôi thì mang đàn/ Hứa có nhau khi oán than hay là hoang tàn”…  Trước Nó, ca khúc Xin lỗi của Thắng cũng gây tranh luận trên mạng vì những quan điểm mà 9x này đưa vào âm nhạc của mình. Quang Sự lần đầu to tiếng trong 'Trạm cứu hộ trái tim' Trong Trạm cứu hộ trái tim, do mâu thuẫn với An Nhiên (Lương Thu Trang) nên Nghĩa (Quang Sự) bỏ về nhà. Sốt ruột, An Nhiên nhờ con trai gọi cho bà Xinh (NSND Mỹ Uyên) để nhắn bố nghe điện thoại của mình.  Sau khi nói lời ngon ngọt với con trai, Nghĩa đề nghị con chuyển máy cho An Nhiên rồi quát lên trong điện thoại: ""Tôi nói với cô sao: Đừng bao giờ lợi dụng thằng bé!"" rồi cúp máy. Trong khi đó, Hà (Hồng Diễm) về nhà và phát hiện xe của Nghĩa trước nhà. Nghĩa ngăn Hà lại rồi quát:  ""Cô đứng lại đấy! Tôi muốn nhìn rõ bộ mặt giả tạo của cô, mở miệng ra là chửi tôi. Tưởng cô đàng hoàng thế nào, hóa ra ngủ với thằng đàn ông khác trong ngày cưới lại còn trách móc cái gì. Công tác vùng cao à? Việc bất khả kháng à? Cô cũng khốn nạn như tôi thôi"". Chuyện gì khiến An Nhiên mâu thuẫn với Nghĩa? Diễn biến chi tiết sẽ có trong Trạm cứu hộ trái tim tập 22 lên sóng trên VTV3 vào tối 29-4.",27/04/2024 16:59 GMT+7,https://tuoitre.vn/tin-tuc-giai-tri-27-4-lat-mat-7-thu-hon-50-ti-dong-sau-ba-ngay-cong-chieu-20240420100353553.htm,Một số tin tức đáng chú ý: 'Lật mặt 7' thu hơn 50 tỉ đồng sau ba ngày công chiếu; Não phải hoạt động liên tục khi xem 'Vũ trụ VFC ngoại truyện'; Hòa Minzy xúc động trước hai chị em mồ côi ăn rau luộc khi đói trong 'Mái ấm gia đình Việt'...
"Chú chó Messi, ngôi sao của Oscar, sẽ có phim truyền hình riêng","Theo Entertainment Weekly, bộ phim có tựa đề Messi: The Cannes Festival Seen from a Dog's Point of View (Chú chó Messi: Liên hoan phim Cannes nhìn từ góc nhìn của một chú chó) sẽ lấy bối cảnh tại Liên hoan phim Cannes năm nay (sẽ diễn ra từ ngày 14-5 tới). Chương trình sẽ được đài D18 Paris sản xuất, các tập phim dài 8 phút được phát sóng hằng ngày trên nhiều đài truyền hình Pháp như Đài Truyền hình quốc gia Pháp; Culturebox và TV5 Monde từ ngày 13-5 cho đến khi kết thúc lễ hội. Trải nghiệm Cannes 2024 qua góc nhìn của chú chó Messi Mỗi tập sẽ theo chân chú chó Messi (hay còn được mệnh danh là George Clooney của loài cún) cùng tham dự liên hoan phim Cannes từ sáng sớm đến tối khuya. Khán giả sẽ được giao lưu với những diễn viên, nhà làm phim hàng đầu thế giới qua góc nhìn của Messi, đặc biệt là khi ai cũng muốn nựng chú chó giống border collie này. Sở dĩ chú chó Messi được nhiều sự quan tâm chú ý như vậy là nhờ vai diễn ""xuất thần"" trong phim Anatomy of a Fall. Vai chú chó Snoop của Messi đã đem lại giải Palm Dog - giải thưởng không chính thức được trao cho màn trình diễn xuất sắc nhất của một diễn viên ""4 chân"" trong khuôn khổ Liên hoan phim Cannes 2023. Ý tưởng cho chương trình này đến từ nhà sản xuất Tim Newman của đài D18. Messi sẽ lần đầu tiên ""cất tiếng"" nhờ giọng lồng tiếng của Raphaël Mezrahi. Đạo diễn người Pháp Loïc Pourageaux sẽ chỉ đạo sản xuất; Laura Martin là huấn luyện viên và chủ sở hữu của Messi sẽ theo sát chú chó.",27/04/2024 14:36 GMT+7,https://tuoitre.vn/chu-cho-messi-ngoi-sao-cua-oscar-se-co-phim-truyen-hinh-rieng-20240427142928351.htm,"Chú chó Messi, diễn viên bốn chân trong phim Anatomy of a Fall từng gây sốt tại Liên hoan phim Cannes 2023 và giải Oscar 2024 sẽ có chương trình truyền hình của riêng mình trong năm nay."
